"No.","Time","Source","Destination","Protocol","Length","Info"
"65","1.202421","192.168.2.103","224.0.0.251","MDNS","183","Standard query 0x0000 PTR _oculusal_sp._tcp.local, ""QM"" question"
"68","1.202436","192.168.2.103","224.0.0.251","MDNS","371","Standard query response 0x0000 PTR 12549::oldman._oculusal_sp_v2._tcp.local SRV 0 0 3469 oldman.local TXT A 192.168.2.103 AAAA fe80::18a0:cb74:d156:8d15"
"72","1.202893","192.168.2.103","224.0.0.251","MDNS","175","Standard query 0x0000 PTR _oculusal_sp._tcp.local, ""QM"" question"
"74","1.203353","192.168.2.103","224.0.0.251","MDNS","175","Standard query 0x0000 PTR _oculusal_sp._tcp.local, ""QM"" question"
"95","1.468747","192.168.2.103","224.0.0.251","MDNS","186","Standard query 0x0000 PTR _oculusal_sp_v2._tcp.local, ""QM"" question"
"104","1.469528","192.168.2.103","224.0.0.251","MDNS","366","Standard query response 0x0000 PTR 12549::oldman._oculusal_sp_v2._tcp.local SRV 0 0 3469 oldman.local TXT A 192.168.2.103 AAAA fe80::18a0:cb74:d156:8d15"
"107","1.469879","192.168.2.103","224.0.0.251","MDNS","366","Standard query response 0x0000 PTR 12549::oldman._oculusal_sp_v2._tcp.local SRV 0 0 3469 oldman.local TXT A 192.168.2.103 AAAA fe80::18a0:cb74:d156:8d15"
"378","5.260103","192.168.2.103","224.0.0.251","MDNS","183","Standard query 0x0000 PTR _oculusal_sp._tcp.local, ""QM"" question"
"381","5.260122","192.168.2.103","224.0.0.251","MDNS","371","Standard query response 0x0000 PTR 12549::oldman._oculusal_sp_v2._tcp.local SRV 0 0 3469 oldman.local TXT A 192.168.2.103 AAAA fe80::18a0:cb74:d156:8d15"
"405","5.484266","192.168.2.103","224.0.0.251","MDNS","186","Standard query 0x0000 PTR _oculusal_sp_v2._tcp.local, ""QM"" question"
"411","5.484774","192.168.2.103","224.0.0.251","MDNS","366","Standard query response 0x0000 PTR 12549::oldman._oculusal_sp_v2._tcp.local SRV 0 0 3469 oldman.local TXT A 192.168.2.103 AAAA fe80::18a0:cb74:d156:8d15"
"5322","11.459658","192.168.2.103","157.240.26.49","TLSv1.2","201","Application Data"
"5323","11.459664","192.168.2.103","157.240.26.49","TLSv1.2","178","Application Data"
"5324","11.459669","192.168.2.103","157.240.26.49","TCP","154","2030  >  443 [FIN, ACK] Seq=72 Ack=1 Win=251 Len=0"
"5325","11.459674","192.168.2.103","192.168.2.1","DNS","176","Standard query 0x1e33 A graph.oculus.com"
"5329","11.511458","192.168.2.103","192.168.2.1","DNS","176","Standard query 0xbb1d A graph.oculus.com"
"5330","11.511464","192.168.2.103","192.168.2.1","DNS","176","Standard query 0xdbc1 HTTPS graph.oculus.com"
"5333","11.548221","192.168.2.1","192.168.2.103","DNS","219","Standard query response 0x1e33 A graph.oculus.com CNAME oculus.c10r.facebook.com A 157.240.26.49"
"5337","11.549655","192.168.2.103","157.240.26.49","TCP","158","2166  >  443 [SYN] Seq=0 Win=64480 Len=0 MSS=1460 WS=256 SACK_PERM"
"5339","11.582160","157.240.26.49","192.168.2.103","TCP","158","443  >  2166 [SYN, ACK] Seq=0 Ack=1 Win=65535 Len=0 MSS=1392 SACK_PERM WS=256"
"5343","11.582750","192.168.2.103","157.240.26.49","TCP","146","2166  >  443 [ACK] Seq=1 Ack=1 Win=65536 Len=0"
"5345","11.582773","192.168.2.1","192.168.2.103","DNS","219","Standard query response 0xbb1d A graph.oculus.com CNAME oculus.c10r.facebook.com A 157.240.26.49"
"5349","11.583346","192.168.2.103","157.240.26.49","TLSv1.3","664","Client Hello (SNI=graph.oculus.com)"
"5352","11.584302","192.168.2.103","157.240.26.49","TCP","664","[TCP Retransmission] 2166  >  443 [PSH, ACK] Seq=1 Ack=1 Win=65536 Len=518"
"5356","11.588542","192.168.2.103","157.240.26.49","TCP","664","[TCP Retransmission] 2166  >  443 [PSH, ACK] Seq=1 Ack=1 Win=65536 Len=518"
"5358","11.599388","157.240.26.49","192.168.2.103","TCP","146","443  >  2166 [ACK] Seq=1 Ack=519 Win=66816 Len=0"
"5360","11.599862","157.240.26.49","192.168.2.103","TLSv1.3","358","Server Hello, Change Cipher Spec, Application Data"
"5364","11.600724","192.168.2.103","157.240.26.49","TLSv1.3","210","Change Cipher Spec, Application Data"
"5368","11.600988","192.168.2.103","157.240.26.49","TLSv1.3","240","Application Data"
"5369","11.600994","192.168.2.103","157.240.26.49","TLSv1.3","506","Application Data"
"5371","11.609856","157.240.26.49","192.168.2.103","TCP","146","443  >  2166 [ACK] Seq=213 Ack=669 Win=66816 Len=0"
"5373","11.610402","157.240.26.49","192.168.2.103","TLSv1.3","323","Application Data"
"5374","11.610411","157.240.26.49","192.168.2.103","TLSv1.3","228","Application Data"
"5376","11.610664","157.240.26.49","192.168.2.103","TLSv1.3","190","Application Data"
"5380","11.610931","192.168.2.103","157.240.26.49","TCP","146","2166  >  443 [ACK] Seq=1021 Ack=456 Win=65024 Len=0"
"5384","11.611312","192.168.2.103","157.240.26.49","TLSv1.3","177","Application Data"
"5388","11.611570","192.168.2.103","157.240.26.49","TCP","158","2167  >  443 [SYN] Seq=0 Win=64480 Len=0 MSS=1460 WS=256 SACK_PERM"
"5390","11.611917","192.168.2.1","192.168.2.103","DNS","287","Standard query response 0xdbc1 HTTPS graph.oculus.com CNAME oculus.c10r.facebook.com HTTPS HTTPS"
"5391","11.612279","192.168.2.1","192.168.2.103","DNS","287","Standard query response 0xdbc1 HTTPS graph.oculus.com CNAME oculus.c10r.facebook.com HTTPS HTTPS"
"5393","11.621303","157.240.26.49","192.168.2.103","TCP","158","443  >  2167 [SYN, ACK] Seq=0 Ack=1 Win=65535 Len=0 MSS=1392 SACK_PERM WS=256"
"5397","11.621849","192.168.2.103","157.240.26.49","TCP","146","2167  >  443 [ACK] Seq=1 Ack=1 Win=65536 Len=0"
"5401","11.622114","192.168.2.103","157.240.26.49","TCP","146","[TCP Dup ACK 5397#1] 2167  >  443 [ACK] Seq=1 Ack=1 Win=65536 Len=0"
"5405","11.622664","192.168.2.103","157.240.26.49","TLSv1.3","827","Client Hello (SNI=graph.oculus.com)"
"5407","11.636337","157.240.26.49","192.168.2.103","TCP","146","443  >  2167 [ACK] Seq=1 Ack=682 Win=67072 Len=0"
"5409","11.636710","157.240.26.49","192.168.2.103","TLSv1.3","903","Server Hello, Change Cipher Spec, Application Data"
"5415","11.638511","192.168.2.103","157.240.26.49","TLSv1.3","218","Change Cipher Spec, Application Data"
"5416","11.638522","192.168.2.103","157.240.26.49","TLSv1.3","246","Application Data"
"5417","11.638527","192.168.2.103","157.240.26.49","TLSv1.3","544","Application Data"
"5418","11.638532","192.168.2.103","157.240.26.49","TLSv1.3","526","Application Data"
"5421","11.647126","157.240.26.49","192.168.2.103","TCP","146","443  >  2167 [ACK] Seq=758 Ack=838 Win=67072 Len=0"
"5423","11.647873","157.240.26.49","192.168.2.103","TCP","154","443  >  2167 [ACK] Seq=758 Ack=1600 Win=69632 Len=0"
"5424","11.647885","157.240.26.49","192.168.2.103","TLSv1.3","323","Application Data"
"5428","11.648474","157.240.26.49","192.168.2.103","TLSv1.3","228","Application Data"
"5429","11.648485","157.240.26.49","192.168.2.103","TLSv1.3","198","Application Data"
"5433","11.648988","192.168.2.103","157.240.26.49","TCP","154","2167  >  443 [ACK] Seq=1600 Ack=1045 Win=64512 Len=0"
"5434","11.648994","192.168.2.103","157.240.26.49","TLSv1.3","185","Application Data"
"5438","11.656466","192.168.2.103","157.240.26.49","TCP","146","2166  >  443 [ACK] Seq=1052 Ack=500 Win=65024 Len=0"
"5443","11.658321","192.168.2.103","157.240.26.49","TCP","146","[TCP Dup ACK 5438#1] 2166  >  443 [ACK] Seq=1052 Ack=500 Win=65024 Len=0"
"5445","11.661805","157.240.26.49","192.168.2.103","TCP","146","443  >  2166 [ACK] Seq=500 Ack=1052 Win=67840 Len=0"
"5459","11.690407","192.168.2.103","157.240.26.49","TCP","217","[TCP Retransmission] 2030  >  443 [FIN, PSH, ACK] Seq=1 Ack=1 Win=251 Len=71"
"5461","11.697964","157.240.26.49","192.168.2.103","TCP","146","443  >  2167 [ACK] Seq=1045 Ack=1631 Win=69632 Len=0"
"5465","11.717956","157.240.26.49","192.168.2.103","TLSv1.3","655","Application Data"
"5467","11.718080","157.240.26.49","192.168.2.103","TLSv1.3","231","Application Data"
"5471","11.719084","192.168.2.103","157.240.26.49","TCP","146","2167  >  443 [ACK] Seq=1631 Ack=1639 Win=65536 Len=0"
"5473","11.726786","157.240.26.49","192.168.2.103","TLSv1.3","700","Application Data"
"5475","11.726815","157.240.26.49","192.168.2.103","TLSv1.3","250","Application Data"
"5479","11.727884","192.168.2.103","157.240.26.49","TCP","146","2166  >  443 [ACK] Seq=1052 Ack=1158 Win=64512 Len=0"
"5509","11.999396","192.168.2.103","157.240.26.49","TCP","217","[TCP Retransmission] 2030  >  443 [FIN, PSH, ACK] Seq=1 Ack=1 Win=251 Len=71"
"5521","12.605268","192.168.2.103","157.240.26.49","TCP","217","[TCP Retransmission] 2030  >  443 [FIN, PSH, ACK] Seq=1 Ack=1 Win=251 Len=71"
"5529","12.863346","192.168.2.103","34.107.172.168","TLSv1.2","1347","Application Data"
"5533","12.892398","34.107.172.168","192.168.2.103","TCP","146","443  >  2097 [ACK] Seq=1 Ack=1202 Win=1006 Len=0"
"5535","12.911247","34.107.172.168","192.168.2.103","TLSv1.2","330","Application Data"
"5539","12.969393","192.168.2.103","34.107.172.168","TCP","146","2097  >  443 [ACK] Seq=1202 Ack=185 Win=251 Len=0"
"5545","13.142687","192.168.2.103","192.168.2.1","DNS","173","Standard query 0x1a97 A static.nvidiagrid.net"
"5551","13.195042","192.168.2.103","224.0.0.251","MDNS","183","Standard query 0x0000 PTR _oculusal_sp._tcp.local, ""QM"" question"
"5555","13.195297","192.168.2.103","224.0.0.251","MDNS","183","Standard query 0x0000 PTR _oculusal_sp._tcp.local, ""QM"" question"
"5563","13.196007","192.168.2.103","224.0.0.251","MDNS","363","Standard query response 0x0000 PTR 12549::oldman._oculusal_sp_v2._tcp.local SRV 0 0 3469 oldman.local TXT A 192.168.2.103 AAAA fe80::18a0:cb74:d156:8d15"
"5566","13.196487","192.168.2.103","224.0.0.251","MDNS","363","Standard query response 0x0000 PTR 12549::oldman._oculusal_sp_v2._tcp.local SRV 0 0 3469 oldman.local TXT A 192.168.2.103 AAAA fe80::18a0:cb74:d156:8d15"
"5568","13.248479","192.168.2.1","192.168.2.103","DNS","286","Standard query response 0x1a97 A static.nvidiagrid.net CNAME static.nvidiagrid.net.edgekey.net CNAME e28142.dscg.akamaiedge.net A 23.192.220.16 A 23.192.220.4"
"5573","13.250197","192.168.2.103","23.192.220.16","TCP","158","2168  >  443 [SYN] Seq=0 Win=64240 Len=0 MSS=1460 WS=256 SACK_PERM"
"5577","13.251925","192.168.2.103","157.240.26.49","TCP","158","2169  >  443 [SYN] Seq=0 Win=64480 Len=0 MSS=1460 WS=256 SACK_PERM"
"5579","13.260178","23.192.220.16","192.168.2.103","TCP","158","443  >  2168 [SYN, ACK] Seq=0 Ack=1 Win=64240 Len=0 MSS=1384 SACK_PERM WS=128"
"5583","13.260679","192.168.2.103","23.192.220.16","TCP","146","2168  >  443 [ACK] Seq=1 Ack=1 Win=66304 Len=0"
"5587","13.261140","192.168.2.103","23.192.220.16","TLSv1.3","767","Client Hello (SNI=static.nvidiagrid.net)"
"5589","13.261159","157.240.26.49","192.168.2.103","TCP","158","443  >  2169 [SYN, ACK] Seq=0 Ack=1 Win=65535 Len=0 MSS=1392 SACK_PERM WS=256"
"5593","13.261706","192.168.2.103","157.240.26.49","TCP","146","2169  >  443 [ACK] Seq=1 Ack=1 Win=65536 Len=0"
"5597","13.262696","192.168.2.103","157.240.26.49","TLSv1.2","365","Client Hello (SNI=graph.oculus.com)"
"5599","13.272410","23.192.220.16","192.168.2.103","TCP","146","443  >  2168 [ACK] Seq=1 Ack=622 Win=64128 Len=0"
"5601","13.272898","23.192.220.16","192.168.2.103","TLSv1.3","410","Server Hello, Change Cipher Spec, Application Data, Application Data"
"5603","13.273255","157.240.26.49","192.168.2.103","TCP","146","443  >  2169 [ACK] Seq=1 Ack=220 Win=66816 Len=0"
"5607","13.274165","192.168.2.103","23.192.220.16","TLSv1.3","234","Change Cipher Spec, Application Data"
"5608","13.274170","192.168.2.103","23.192.220.16","TLSv1.3","240","Application Data"
"5612","13.274480","192.168.2.103","23.192.220.16","TLSv1.3","429","Application Data"
"5613","13.274489","192.168.2.103","23.192.220.16","TLSv1.3","218","Application Data"
"5615","13.276435","157.240.26.49","192.168.2.103","TLSv1.2","1386","Server Hello"
"5617","13.276945","157.240.26.49","192.168.2.103","TCP","1394","443  >  2169 [PSH, ACK] Seq=1241 Ack=220 Win=66816 Len=1240 [TCP PDU reassembled in 5618]"
"5618","13.276958","157.240.26.49","192.168.2.103","TLSv1.2","1241","Certificate, Server Key Exchange, Server Hello Done"
"5622","13.277351","192.168.2.103","157.240.26.49","TCP","146","2169  >  443 [ACK] Seq=220 Ack=3568 Win=65536 Len=0"
"5626","13.277994","192.168.2.103","157.240.26.49","TLSv1.2","272","Client Key Exchange, Change Cipher Spec, Encrypted Handshake Message"
"5633","13.288155","23.192.220.16","192.168.2.103","TCP","146","443  >  2168 [ACK] Seq=265 Ack=702 Win=64128 Len=0"
"5635","13.290382","23.192.220.16","192.168.2.103","TLSv1.3","441","Application Data"
"5636","13.290387","23.192.220.16","192.168.2.103","TCP","154","443  >  2168 [ACK] Seq=552 Ack=788 Win=64128 Len=0"
"5637","13.290391","23.192.220.16","192.168.2.103","TLSv1.3","215","Application Data"
"5638","13.290395","23.192.220.16","192.168.2.103","TLSv1.3","185","Application Data"
"5639","13.290399","23.192.220.16","192.168.2.103","TLSv1.3","414","Application Data"
"5640","13.290403","23.192.220.16","192.168.2.103","TCP","1394","443  >  2168 [ACK] Seq=904 Ack=1127 Win=64128 Len=1240 [TCP PDU reassembled in 5693]"
"5641","13.290410","23.192.220.16","192.168.2.103","TCP","1394","443  >  2168 [ACK] Seq=2144 Ack=1127 Win=64128 Len=1240 [TCP PDU reassembled in 5693]"
"5642","13.290414","23.192.220.16","192.168.2.103","TCP","1394","443  >  2168 [ACK] Seq=3384 Ack=1127 Win=64128 Len=1240 [TCP PDU reassembled in 5693]"
"5643","13.290417","23.192.220.16","192.168.2.103","TCP","1394","443  >  2168 [PSH, ACK] Seq=4624 Ack=1127 Win=64128 Len=1240 [TCP PDU reassembled in 5693]"
"5644","13.290420","23.192.220.16","192.168.2.103","TCP","1394","443  >  2168 [ACK] Seq=5864 Ack=1127 Win=64128 Len=1240 [TCP PDU reassembled in 5693]"
"5645","13.290423","23.192.220.16","192.168.2.103","TCP","1394","443  >  2168 [ACK] Seq=7104 Ack=1127 Win=64128 Len=1240 [TCP PDU reassembled in 5693]"
"5646","13.290427","23.192.220.16","192.168.2.103","TCP","1394","443  >  2168 [ACK] Seq=8344 Ack=1127 Win=64128 Len=1240 [TCP PDU reassembled in 5693]"
"5647","13.290431","23.192.220.16","192.168.2.103","TCP","1394","443  >  2168 [PSH, ACK] Seq=9584 Ack=1127 Win=64128 Len=1240 [TCP PDU reassembled in 5693]"
"5648","13.290434","23.192.220.16","192.168.2.103","TCP","1394","443  >  2168 [ACK] Seq=10824 Ack=1127 Win=64128 Len=1240 [TCP PDU reassembled in 5693]"
"5649","13.290438","23.192.220.16","192.168.2.103","TCP","1394","443  >  2168 [ACK] Seq=12064 Ack=1127 Win=64128 Len=1240 [TCP PDU reassembled in 5693]"
"5650","13.290441","23.192.220.16","192.168.2.103","TCP","1394","443  >  2168 [ACK] Seq=13304 Ack=1127 Win=64128 Len=1240 [TCP PDU reassembled in 5693]"
"5651","13.290445","23.192.220.16","192.168.2.103","TCP","1394","443  >  2168 [PSH, ACK] Seq=14544 Ack=1127 Win=64128 Len=1240 [TCP PDU reassembled in 5693]"
"5652","13.290448","157.240.26.49","192.168.2.103","TLSv1.2","205","Change Cipher Spec, Encrypted Handshake Message"
"5653","13.290452","157.240.26.49","192.168.2.103","TLSv1.2","235","Application Data"
"5657","13.291128","192.168.2.103","23.192.220.16","TCP","154","2168  >  443 [ACK] Seq=1127 Ack=15784 Win=66304 Len=0"
"5658","13.292288","192.168.2.103","157.240.26.49","TCP","154","2169  >  443 [ACK] Seq=346 Ack=3700 Win=65536 Len=0"
"5659","13.292294","192.168.2.103","157.240.26.49","TLSv1.2","207","Application Data"
"5660","13.292299","192.168.2.103","157.240.26.49","TLSv1.2","210","Application Data"
"5661","13.292305","192.168.2.103","157.240.26.49","TLSv1.2","196","Application Data"
"5662","13.292310","192.168.2.103","157.240.26.49","TLSv1.2","197","Application Data"
"5663","13.292315","192.168.2.103","157.240.26.49","TCP","1394","2169  >  443 [ACK] Seq=540 Ack=3700 Win=65536 Len=1240 [TCP PDU reassembled in 5686]"
"5664","13.292320","192.168.2.103","157.240.26.49","TCP","1394","2169  >  443 [ACK] Seq=1780 Ack=3700 Win=65536 Len=1240 [TCP PDU reassembled in 5686]"
"5665","13.292323","192.168.2.103","157.240.26.49","TCP","1394","2169  >  443 [ACK] Seq=3020 Ack=3700 Win=65536 Len=1240 [TCP PDU reassembled in 5686]"
"5668","13.292334","192.168.2.103","157.240.26.49","TCP","1221","[TCP Previous segment not captured] 2169  >  443 [PSH, ACK] Seq=6740 Ack=3700 Win=65536 Len=1067 [TCP PDU reassembled in 5686]"
"5669","13.292337","192.168.2.103","157.240.26.49","TLSv1.2","192","Application Data"
"5672","13.292546","192.168.2.103","23.192.220.16","TLSv1.3","177","Application Data"
"5676","13.292756","192.168.2.103","23.192.220.16","TCP","154","2168  >  443 [ACK] Seq=1127 Ack=15784 Win=66304 Len=0"
"5677","13.292761","192.168.2.103","157.240.26.49","TCP","154","2169  >  443 [ACK] Seq=346 Ack=3700 Win=65536 Len=0"
"5678","13.293899","192.168.2.103","157.240.26.49","TCP","207","[TCP Retransmission] 2169  >  443 [PSH, ACK] Seq=346 Ack=3700 Win=65536 Len=53"
"5679","13.293904","192.168.2.103","157.240.26.49","TCP","210","[TCP Retransmission] 2169  >  443 [PSH, ACK] Seq=399 Ack=3700 Win=65536 Len=56"
"5680","13.293909","192.168.2.103","157.240.26.49","TCP","196","[TCP Retransmission] 2169  >  443 [PSH, ACK] Seq=455 Ack=3700 Win=65536 Len=42"
"5681","13.293914","192.168.2.103","157.240.26.49","TCP","197","[TCP Retransmission] 2169  >  443 [PSH, ACK] Seq=497 Ack=3700 Win=65536 Len=43"
"5682","13.293919","192.168.2.103","157.240.26.49","TCP","1394","[TCP Retransmission] 2169  >  443 [ACK] Seq=540 Ack=3700 Win=65536 Len=1240"
"5683","13.293923","192.168.2.103","157.240.26.49","TCP","1394","[TCP Retransmission] 2169  >  443 [ACK] Seq=1780 Ack=3700 Win=65536 Len=1240 [TCP PDU reassembled in 5686]"
"5684","13.293927","192.168.2.103","157.240.26.49","TCP","1394","[TCP Retransmission] 2169  >  443 [ACK] Seq=3020 Ack=3700 Win=65536 Len=1240 [TCP PDU reassembled in 5686]"
"5685","13.293930","192.168.2.103","157.240.26.49","TCP","1394","[TCP Out-Of-Order] 2169  >  443 [ACK] Seq=4260 Ack=3700 Win=65536 Len=1240 [TCP PDU reassembled in 5686]"
"5686","13.293934","192.168.2.103","157.240.26.49","TCP","1394","[TCP Out-Of-Order] 2169  >  443 [ACK] Seq=5500 Ack=3700 Win=65536 Len=1240"
"5687","13.293937","192.168.2.103","157.240.26.49","TCP","1221","[TCP Retransmission] 2169  >  443 [PSH, ACK] Seq=6740 Ack=3700 Win=65536 Len=1067 [TCP PDU reassembled in 5686]"
"5688","13.293940","192.168.2.103","157.240.26.49","TCP","192","[TCP Retransmission] 2169  >  443 [PSH, ACK] Seq=7807 Ack=3700 Win=65536 Len=38"
"5690","13.302983","23.192.220.16","192.168.2.103","TCP","1386","443  >  2168 [ACK] Seq=15784 Ack=1127 Win=64128 Len=1240 [TCP PDU reassembled in 5693]"
"5691","13.303361","23.192.220.16","192.168.2.103","TCP","1386","[TCP Retransmission] 443  >  2168 [ACK] Seq=15784 Ack=1127 Win=64128 Len=1240 [TCP PDU reassembled in 5693]"
"5693","13.306354","23.192.220.16","192.168.2.103","TLSv1.3","1394","Application Data, Application Data"
"5702","13.307259","192.168.2.103","23.192.220.16","TCP","146","2168  >  443 [ACK] Seq=1158 Ack=18264 Win=66304 Len=0"
"5709","13.311838","23.192.220.16","192.168.2.103","TCP","1394","443  >  2168 [ACK] Seq=18264 Ack=1127 Win=64128 Len=1240"
"5710","13.311842","23.192.220.16","192.168.2.103","TCP","1394","443  >  2168 [PSH, ACK] Seq=19504 Ack=1127 Win=64128 Len=1240"
"5711","13.311847","23.192.220.16","192.168.2.103","TCP","1394","[TCP Previous segment not captured] 443  >  2168 [ACK] Seq=25704 Ack=1127 Win=64128 Len=1240"
"5712","13.311851","23.192.220.16","192.168.2.103","TCP","1394","443  >  2168 [ACK] Seq=26944 Ack=1127 Win=64128 Len=1240"
"5713","13.311855","23.192.220.16","192.168.2.103","TCP","1394","443  >  2168 [ACK] Seq=28184 Ack=1127 Win=64128 Len=1240"
"5714","13.311860","23.192.220.16","192.168.2.103","TCP","1394","443  >  2168 [PSH, ACK] Seq=29424 Ack=1127 Win=64128 Len=1240"
"5721","13.314342","23.192.220.16","192.168.2.103","TCP","1394","[TCP Retransmission] 443  >  2168 [ACK] Seq=18264 Ack=1127 Win=64128 Len=1240"
"5722","13.314345","23.192.220.16","192.168.2.103","TCP","1394","[TCP Retransmission] 443  >  2168 [PSH, ACK] Seq=19504 Ack=1127 Win=64128 Len=1240"
"5723","13.314359","23.192.220.16","192.168.2.103","TCP","1394","[TCP Retransmission] 443  >  2168 [ACK] Seq=25704 Ack=1127 Win=64128 Len=1240"
"5724","13.314363","23.192.220.16","192.168.2.103","TCP","1394","[TCP Retransmission] 443  >  2168 [ACK] Seq=26944 Ack=1127 Win=64128 Len=1240"
"5725","13.314367","23.192.220.16","192.168.2.103","TCP","1394","[TCP Retransmission] 443  >  2168 [ACK] Seq=28184 Ack=1127 Win=64128 Len=1240"
"5726","13.314370","23.192.220.16","192.168.2.103","TCP","1394","[TCP Retransmission] 443  >  2168 [PSH, ACK] Seq=29424 Ack=1127 Win=64128 Len=1240"
"5727","13.314373","23.192.220.16","192.168.2.103","TCP","1394","443  >  2168 [ACK] Seq=30664 Ack=1127 Win=64128 Len=1240"
"5728","13.314377","23.192.220.16","192.168.2.103","TCP","1394","443  >  2168 [ACK] Seq=31904 Ack=1127 Win=64128 Len=1240"
"5729","13.314380","23.192.220.16","192.168.2.103","TCP","1394","443  >  2168 [ACK] Seq=33144 Ack=1127 Win=64128 Len=1240, Application Data"
"5730","13.314383","23.192.220.16","192.168.2.103","TCP","1394","443  >  2168 [PSH, ACK] Seq=34384 Ack=1127 Win=64128 Len=1240 [TCP PDU reassembled in 5731]"
"5731","13.314386","23.192.220.16","192.168.2.103","TLSv1.3","1394","Application Data, Application Data"
"5732","13.314389","23.192.220.16","192.168.2.103","TCP","1394","443  >  2168 [ACK] Seq=36864 Ack=1158 Win=64128 Len=1240"
"5733","13.314392","23.192.220.16","192.168.2.103","TCP","1394","443  >  2168 [ACK] Seq=38104 Ack=1158 Win=64128 Len=1240"
"5737","13.314618","192.168.2.103","23.192.220.16","TCP","154","[TCP ACKed unseen segment] 2168  >  443 [ACK] Seq=1158 Ack=30664 Win=66304 Len=0"
"5738","13.314622","192.168.2.103","157.240.26.49","TCP","154","[TCP ACKed unseen segment] 2169  >  443 [ACK] Seq=7845 Ack=3780 Win=65280 Len=0"
"5740","13.317605","23.192.220.16","192.168.2.103","TCP","1394","[TCP Retransmission] 443  >  2168 [ACK] Seq=30664 Ack=1127 Win=64128 Len=1240"
"5741","13.317610","23.192.220.16","192.168.2.103","TCP","1394","[TCP Retransmission] 443  >  2168 [PSH, ACK] Seq=34384 Ack=1127 Win=64128 Len=1240 [TCP PDU reassembled in 5731]"
"5742","13.317614","23.192.220.16","192.168.2.103","TCP","1394","[TCP Retransmission] 443  >  2168 [ACK] Seq=35624 Ack=1158 Win=64128 Len=1240"
"5746","13.318353","23.192.220.16","192.168.2.103","TCP","1386","[TCP Retransmission] 443  >  2168 [ACK] Seq=38104 Ack=1158 Win=64128 Len=1240"
"5750","13.318561","192.168.2.103","23.192.220.16","TCP","146","2168  >  443 [ACK] Seq=1158 Ack=38104 Win=66304 Len=0"
"5752","13.320037","23.192.220.16","192.168.2.103","TCP","1394","[TCP Previous segment not captured] 443  >  2168 [PSH, ACK] Seq=46784 Ack=1158 Win=64128 Len=1240"
"5753","13.320041","23.192.220.16","192.168.2.103","TCP","1394","[TCP Previous segment not captured] 443  >  2168 [ACK] Seq=49264 Ack=1158 Win=64128 Len=1240"
"5754","13.320046","23.192.220.16","192.168.2.103","TCP","1394","443  >  2168 [ACK] Seq=50504 Ack=1158 Win=64128 Len=1240"
"5755","13.320050","23.192.220.16","192.168.2.103","TCP","1394","443  >  2168 [PSH, ACK] Seq=51744 Ack=1158 Win=64128 Len=1240, Application Data"
"5756","13.320055","23.192.220.16","192.168.2.103","TCP","1394","443  >  2168 [ACK] Seq=52984 Ack=1158 Win=64128 Len=1240 [TCP PDU reassembled in 5788]"
"5757","13.320058","23.192.220.16","192.168.2.103","TCP","1394","443  >  2168 [PSH, ACK] Seq=54224 Ack=1158 Win=64128 Len=1240 [TCP PDU reassembled in 5788]"
"5758","13.320063","23.192.220.16","192.168.2.103","TCP","1394","443  >  2168 [ACK] Seq=55464 Ack=1158 Win=64128 Len=1240 [TCP PDU reassembled in 5788]"
"5759","13.320066","23.192.220.16","192.168.2.103","TCP","1394","443  >  2168 [ACK] Seq=56704 Ack=1158 Win=64128 Len=1240 [TCP PDU reassembled in 5788]"
"5761","13.320630","23.192.220.16","192.168.2.103","TCP","1394","443  >  2168 [ACK] Seq=57944 Ack=1158 Win=64128 Len=1240 [TCP PDU reassembled in 5788]"
"5762","13.320641","23.192.220.16","192.168.2.103","TCP","1394","443  >  2168 [PSH, ACK] Seq=59184 Ack=1158 Win=64128 Len=1240 [TCP PDU reassembled in 5788]"
"5766","13.320847","192.168.2.103","23.192.220.16","TCP","154","[TCP ACKed unseen segment] 2168  >  443 [ACK] Seq=1158 Ack=46784 Win=66304 Len=0"
"5767","13.320850","192.168.2.103","23.192.220.16","TCP","154","[TCP ACKed unseen segment] 2168  >  443 [ACK] Seq=1158 Ack=57944 Win=66304 Len=0"
"5771","13.321264","192.168.2.103","23.192.220.16","TCP","146","2168  >  443 [ACK] Seq=1158 Ack=60424 Win=66304 Len=0"
"5773","13.322877","23.192.220.16","192.168.2.103","TCP","1386","443  >  2168 [ACK] Seq=60424 Ack=1158 Win=64128 Len=1240 [TCP PDU reassembled in 5788]"
"5780","13.329199","23.192.220.16","192.168.2.103","TCP","1394","443  >  2168 [ACK] Seq=61664 Ack=1158 Win=64128 Len=1240 [TCP PDU reassembled in 5788]"
"5781","13.329202","23.192.220.16","192.168.2.103","TCP","1394","443  >  2168 [ACK] Seq=62904 Ack=1158 Win=64128 Len=1240 [TCP PDU reassembled in 5788]"
"5782","13.329206","23.192.220.16","192.168.2.103","TCP","1394","443  >  2168 [PSH, ACK] Seq=64144 Ack=1158 Win=64128 Len=1240 [TCP PDU reassembled in 5788]"
"5785","13.330331","23.192.220.16","192.168.2.103","TCP","1394","[TCP Retransmission] 443  >  2168 [PSH, ACK] Seq=64144 Ack=1158 Win=64128 Len=1240 [TCP PDU reassembled in 5788]"
"5786","13.330334","23.192.220.16","192.168.2.103","TCP","1394","443  >  2168 [ACK] Seq=65384 Ack=1158 Win=64128 Len=1240 [TCP PDU reassembled in 5788]"
"5787","13.330337","23.192.220.16","192.168.2.103","TCP","1394","443  >  2168 [ACK] Seq=66624 Ack=1158 Win=64128 Len=1240 [TCP PDU reassembled in 5788]"
"5788","13.330340","23.192.220.16","192.168.2.103","TLSv1.3","1394","Application Data, Application Data"
"5789","13.330343","23.192.220.16","192.168.2.103","TCP","1394","443  >  2168 [PSH, ACK] Seq=69104 Ack=1158 Win=64128 Len=1240 [TCP PDU reassembled in 5790]"
"5790","13.330346","23.192.220.16","192.168.2.103","TLSv1.3","600","Application Data"
"5794","13.330635","192.168.2.103","23.192.220.16","TCP","146","2168  >  443 [ACK] Seq=1158 Ack=64144 Win=66304 Len=0"
"5797","13.331208","192.168.2.103","23.192.220.16","TCP","146","[TCP Dup ACK 5794#1] 2168  >  443 [ACK] Seq=1158 Ack=64144 Win=66304 Len=0"
"5800","13.332901","23.192.220.16","192.168.2.103","TCP","1394","[TCP Retransmission] 443  >  2168 [ACK] Seq=65384 Ack=1158 Win=64128 Len=1240 [TCP PDU reassembled in 5788]"
"5801","13.332905","23.192.220.16","192.168.2.103","TCP","1394","[TCP Retransmission] 443  >  2168 [ACK] Seq=66624 Ack=1158 Win=64128 Len=1240 [TCP PDU reassembled in 5788]"
"5802","13.332908","23.192.220.16","192.168.2.103","TCP","1394","[TCP Retransmission] 443  >  2168 [ACK] Seq=67864 Ack=1158 Win=64128 Len=1240"
"5803","13.332911","23.192.220.16","192.168.2.103","TCP","1394","[TCP Retransmission] 443  >  2168 [PSH, ACK] Seq=69104 Ack=1158 Win=64128 Len=1240 [TCP PDU reassembled in 5790]"
"5808","13.333212","192.168.2.103","23.192.220.16","TCP","146","2168  >  443 [ACK] Seq=1158 Ack=65384 Win=65024 Len=0"
"5813","13.334233","192.168.2.103","23.192.220.16","TCP","146","[TCP Dup ACK 5808#1] 2168  >  443 [ACK] Seq=1158 Ack=65384 Win=65024 Len=0"
"5817","13.334448","192.168.2.103","23.192.220.16","TCP","146","2168  >  443 [ACK] Seq=1158 Ack=70344 Win=66304 Len=0"
"5820","13.334953","192.168.2.103","23.192.220.16","TCP","146","[TCP Dup ACK 5817#1] 2168  >  443 [ACK] Seq=1158 Ack=70344 Win=66304 Len=0"
"5822","13.335218","23.192.220.16","192.168.2.103","TCP","592","[TCP Retransmission] 443  >  2168 [PSH, ACK] Seq=70344 Ack=1158 Win=64128 Len=446 [TCP PDU reassembled in 5790]"
"5824","13.343315","157.240.26.49","192.168.2.103","TCP","1386","[TCP Previous segment not captured] 443  >  2169 [ACK] Seq=3780 Ack=7845 Win=83456 Len=1240 [TCP PDU reassembled in 5828]"
"5827","13.344526","157.240.26.49","192.168.2.103","TCP","1394","443  >  2169 [PSH, ACK] Seq=5020 Ack=7845 Win=83456 Len=1240 [TCP PDU reassembled in 5828]"
"5828","13.344529","157.240.26.49","192.168.2.103","TLSv1.2","588","Application Data"
"5829","13.344532","157.240.26.49","192.168.2.103","TLSv1.2","338","Application Data"
"5833","13.345178","192.168.2.103","157.240.26.49","TCP","146","2169  >  443 [ACK] Seq=7845 Ack=6878 Win=65536 Len=0"
"5837","13.346487","192.168.2.103","157.240.26.49","TLSv1.2","196","Application Data"
"5838","13.346491","192.168.2.103","157.240.26.49","TCP","1394","2169  >  443 [ACK] Seq=7887 Ack=6878 Win=65536 Len=1240 [TCP PDU reassembled in 5843]"
"5839","13.346494","192.168.2.103","157.240.26.49","TCP","1394","2169  >  443 [ACK] Seq=9127 Ack=6878 Win=65536 Len=1240 [TCP PDU reassembled in 5843]"
"5840","13.346497","192.168.2.103","157.240.26.49","TCP","1394","2169  >  443 [ACK] Seq=10367 Ack=6878 Win=65536 Len=1240 [TCP PDU reassembled in 5843]"
"5841","13.346499","192.168.2.103","157.240.26.49","TCP","1394","2169  >  443 [ACK] Seq=11607 Ack=6878 Win=65536 Len=1240 [TCP PDU reassembled in 5843]"
"5842","13.346502","192.168.2.103","157.240.26.49","TCP","1394","2169  >  443 [ACK] Seq=12847 Ack=6878 Win=65536 Len=1240 [TCP PDU reassembled in 5843]"
"5843","13.346505","192.168.2.103","157.240.26.49","TLSv1.2","1196","Application Data"
"5847","13.347380","192.168.2.103","157.240.26.49","TCP","1394","[TCP Retransmission] 2169  >  443 [ACK] Seq=7887 Ack=6878 Win=65536 Len=1240"
"5848","13.347383","192.168.2.103","157.240.26.49","TCP","1394","[TCP Retransmission] 2169  >  443 [ACK] Seq=9127 Ack=6878 Win=65536 Len=1240 [TCP PDU reassembled in 5843]"
"5849","13.347390","192.168.2.103","157.240.26.49","TCP","1394","[TCP Retransmission] 2169  >  443 [ACK] Seq=12847 Ack=6878 Win=65536 Len=1240 [TCP PDU reassembled in 5843]"
"5853","13.348149","192.168.2.103","157.240.26.49","TCP","1394","[TCP Retransmission] 2169  >  443 [ACK] Seq=7887 Ack=6878 Win=65536 Len=1240"
"5854","13.348157","192.168.2.103","157.240.26.49","TCP","1394","[TCP Retransmission] 2169  >  443 [ACK] Seq=9127 Ack=6878 Win=65536 Len=1240 [TCP PDU reassembled in 5843]"
"5863","13.350346","192.168.2.103","157.240.26.49","TCP","1386","[TCP Retransmission] 2169  >  443 [ACK] Seq=9127 Ack=6878 Win=65536 Len=1240 [TCP PDU reassembled in 5843]"
"5865","13.355766","157.240.26.49","192.168.2.103","TCP","146","443  >  2169 [ACK] Seq=6878 Ack=9127 Win=86272 Len=0"
"5867","13.358717","157.240.26.49","192.168.2.103","TCP","146","443  >  2169 [ACK] Seq=6878 Ack=11607 Win=91904 Len=0"
"5869","13.359284","157.240.26.49","192.168.2.103","TCP","154","443  >  2169 [ACK] Seq=6878 Ack=15129 Win=99072 Len=0"
"5870","13.359288","157.240.26.49","192.168.2.103","TLSv1.2","196","Application Data"
"5874","13.377936","192.168.2.103","23.192.220.16","TCP","146","2168  >  443 [ACK] Seq=1158 Ack=70790 Win=65792 Len=0"
"5878","13.398482","157.240.26.49","192.168.2.103","TCP","1386","443  >  2169 [ACK] Seq=6920 Ack=15129 Win=99072 Len=1240 [TCP PDU reassembled in 5881]"
"5880","13.399167","157.240.26.49","192.168.2.103","TCP","1394","443  >  2169 [PSH, ACK] Seq=8160 Ack=15129 Win=99072 Len=1240 [TCP PDU reassembled in 5881]"
"5881","13.399175","157.240.26.49","192.168.2.103","TLSv1.2","333","Application Data"
"5882","13.399178","157.240.26.49","192.168.2.103","TLSv1.2","338","Application Data"
"5886","13.399543","192.168.2.103","157.240.26.49","TCP","146","2169  >  443 [ACK] Seq=15129 Ack=8160 Win=65536 Len=0"
"5890","13.399803","192.168.2.103","157.240.26.49","TCP","154","2169  >  443 [ACK] Seq=15129 Ack=9763 Win=65536 Len=0"
"5891","13.399807","192.168.2.103","157.240.26.49","TLSv1.2","196","Application Data"
"5895","13.401147","192.168.2.103","157.240.26.49","TCP","1394","2169  >  443 [ACK] Seq=15171 Ack=9763 Win=65536 Len=1240 [TCP PDU reassembled in 5909]"
"5896","13.401155","192.168.2.103","157.240.26.49","TCP","1394","2169  >  443 [ACK] Seq=16411 Ack=9763 Win=65536 Len=1240 [TCP PDU reassembled in 5909]"
"5897","13.401158","192.168.2.103","157.240.26.49","TCP","1394","2169  >  443 [ACK] Seq=17651 Ack=9763 Win=65536 Len=1240 [TCP PDU reassembled in 5909]"
"5898","13.401162","192.168.2.103","157.240.26.49","TCP","1394","2169  >  443 [ACK] Seq=18891 Ack=9763 Win=65536 Len=1240 [TCP PDU reassembled in 5909]"
"5899","13.401168","192.168.2.103","157.240.26.49","TCP","1394","2169  >  443 [ACK] Seq=20131 Ack=9763 Win=65536 Len=1240 [TCP PDU reassembled in 5909]"
"5908","13.402663","192.168.2.103","157.240.26.49","TCP","1394","[TCP Retransmission] 2169  >  443 [ACK] Seq=20131 Ack=9763 Win=65536 Len=1240 [TCP PDU reassembled in 5909]"
"5909","13.402670","192.168.2.103","157.240.26.49","TLSv1.2","1193","Application Data"
"5911","13.409502","157.240.26.49","192.168.2.103","TCP","146","443  >  2169 [ACK] Seq=9763 Ack=16411 Win=101888 Len=0"
"5913","13.409773","157.240.26.49","192.168.2.103","TCP","146","443  >  2169 [ACK] Seq=9763 Ack=18891 Win=107520 Len=0"
"5915","13.410585","157.240.26.49","192.168.2.103","TCP","146","443  >  2169 [ACK] Seq=9763 Ack=21371 Win=113152 Len=0"
"5917","13.411001","157.240.26.49","192.168.2.103","TLSv1.2","188","Application Data"
"5919","13.453409","157.240.26.49","192.168.2.103","TCP","1386","443  >  2169 [ACK] Seq=9805 Ack=22410 Win=115968 Len=1240 [TCP PDU reassembled in 5923]"
"5921","13.453829","157.240.26.49","192.168.2.103","TCP","1386","443  >  2169 [PSH, ACK] Seq=11045 Ack=22410 Win=115968 Len=1240 [TCP PDU reassembled in 5923]"
"5923","13.454155","157.240.26.49","192.168.2.103","TLSv1.2","574","Application Data"
"5924","13.454160","157.240.26.49","192.168.2.103","TLSv1.2","338","Application Data"
"5928","13.454756","192.168.2.103","157.240.26.49","TCP","146","2169  >  443 [ACK] Seq=22410 Ack=12889 Win=65536 Len=0"
"5934","13.455380","192.168.2.103","157.240.26.49","TLSv1.2","196","Application Data"
"5938","13.456356","192.168.2.103","157.240.26.49","TLSv1.2","1394","[TCP Previous segment not captured] , Ignored Unknown Record"
"5939","13.456362","192.168.2.103","157.240.26.49","TLSv1.2","1193","Ignored Unknown Record"
"5943","13.457475","192.168.2.103","157.240.26.49","TCP","1394","[TCP Out-Of-Order] 2169  >  443 [ACK] Seq=22452 Ack=12889 Win=65536 Len=1240"
"5944","13.457487","192.168.2.103","157.240.26.49","TCP","1394","[TCP Out-Of-Order] 2169  >  443 [ACK] Seq=23692 Ack=12889 Win=65536 Len=1240"
"5945","13.457491","192.168.2.103","157.240.26.49","TCP","1394","[TCP Out-Of-Order] 2169  >  443 [ACK] Seq=24932 Ack=12889 Win=65536 Len=1240"
"5946","13.457495","192.168.2.103","157.240.26.49","TCP","1394","[TCP Out-Of-Order] 2169  >  443 [ACK] Seq=26172 Ack=12889 Win=65536 Len=1240"
"5947","13.457498","192.168.2.103","224.0.0.251","MDNS","186","Standard query 0x0000 PTR _oculusal_sp_v2._tcp.local, ""QM"" question"
"5953","13.457726","192.168.2.103","224.0.0.251","MDNS","374","Standard query response 0x0000 PTR 12549::oldman._oculusal_sp_v2._tcp.local SRV 0 0 3469 oldman.local TXT A 192.168.2.103 AAAA fe80::18a0:cb74:d156:8d15"
"5955","13.466204","157.240.26.49","192.168.2.103","TCP","146","443  >  2169 [ACK] Seq=12889 Ack=23692 Win=118528 Len=0"
"5957","13.466593","157.240.26.49","192.168.2.103","TCP","146","443  >  2169 [ACK] Seq=12889 Ack=26172 Win=124160 Len=0"
"5959","13.467070","157.240.26.49","192.168.2.103","TCP","154","443  >  2169 [ACK] Seq=12889 Ack=28652 Win=129792 Len=0"
"5960","13.467074","157.240.26.49","192.168.2.103","TLSv1.2","196","Application Data"
"5966","13.505756","157.240.26.49","192.168.2.103","TCP","1386","443  >  2169 [ACK] Seq=12931 Ack=29691 Win=132608 Len=1240"
"5970","13.510121","192.168.2.103","157.240.26.49","TCP","154","[TCP ACKed unseen segment] 2169  >  443 [ACK] Seq=29691 Ack=15772 Win=65536 Len=0"
"5971","13.511204","192.168.2.103","157.240.26.49","TLSv1.2","196","Application Data"
"5972","13.511210","192.168.2.103","157.240.26.49","TCP","1394","2169  >  443 [ACK] Seq=29733 Ack=15772 Win=65536 Len=1240 [TCP PDU reassembled in 5977]"
"5973","13.511214","192.168.2.103","157.240.26.49","TCP","1394","2169  >  443 [ACK] Seq=30973 Ack=15772 Win=65536 Len=1240 [TCP PDU reassembled in 5977]"
"5974","13.511218","192.168.2.103","157.240.26.49","TCP","1394","2169  >  443 [ACK] Seq=32213 Ack=15772 Win=65536 Len=1240 [TCP PDU reassembled in 5977]"
"5975","13.511222","192.168.2.103","157.240.26.49","TCP","1394","2169  >  443 [ACK] Seq=33453 Ack=15772 Win=65536 Len=1240 [TCP PDU reassembled in 5977]"
"5976","13.511226","192.168.2.103","157.240.26.49","TCP","1394","2169  >  443 [ACK] Seq=34693 Ack=15772 Win=65536 Len=1240 [TCP PDU reassembled in 5977]"
"5977","13.511230","192.168.2.103","157.240.26.49","TLSv1.2","1193","Application Data"
"5979","13.517099","157.240.26.49","192.168.2.103","TCP","146","[TCP Previous segment not captured] 443  >  2169 [ACK] Seq=15772 Ack=30973 Win=135424 Len=0"
"5981","13.519150","157.240.26.49","192.168.2.103","TCP","146","443  >  2169 [ACK] Seq=15772 Ack=33453 Win=140800 Len=0"
"5983","13.519520","157.240.26.49","192.168.2.103","TCP","146","443  >  2169 [ACK] Seq=15772 Ack=35933 Win=146432 Len=0"
"5985","13.519852","157.240.26.49","192.168.2.103","TLSv1.2","188","Application Data"
"5988","13.556769","157.240.26.49","192.168.2.103","TLSv1.2","1386","[TCP Previous segment not captured] , Ignored Unknown Record"
"5989","13.557061","157.240.26.49","192.168.2.103","TCP","1386","[TCP Retransmission] 443  >  2169 [PSH, ACK] Seq=17054 Ack=36972 Win=149248 Len=1240"
"5993","13.557225","192.168.2.103","157.240.26.49","TCP","146","[TCP ACKed unseen segment] 2169  >  443 [ACK] Seq=36972 Ack=17054 Win=65536 Len=0"
"5995","13.557560","157.240.26.49","192.168.2.103","TLSv1.2","562","Ignored Unknown Record"
"5996","13.557567","157.240.26.49","192.168.2.103","TLSv1.2","338","Application Data"
"5997","13.557749","157.240.26.49","192.168.2.103","TCP","562","[TCP Retransmission] 443  >  2169 [ACK] Seq=18294 Ack=36972 Win=149248 Len=408"
"5998","13.557756","157.240.26.49","192.168.2.103","TCP","338","[TCP Retransmission] 443  >  2169 [PSH, ACK] Seq=18702 Ack=36972 Win=149248 Len=184"
"6004","13.559739","192.168.2.103","157.240.26.49","TCP","154","2169  >  443 [ACK] Seq=36972 Ack=18886 Win=65536 Len=0"
"6005","13.559746","192.168.2.103","157.240.26.49","TLSv1.2","196","Application Data"
"6006","13.559752","192.168.2.103","157.240.26.49","TCP","1394","2169  >  443 [ACK] Seq=37014 Ack=18886 Win=65536 Len=1240 [TCP PDU reassembled in 6011]"
"6007","13.559759","192.168.2.103","157.240.26.49","TCP","1394","2169  >  443 [ACK] Seq=38254 Ack=18886 Win=65536 Len=1240 [TCP PDU reassembled in 6011]"
"6008","13.559765","192.168.2.103","157.240.26.49","TCP","1394","2169  >  443 [ACK] Seq=39494 Ack=18886 Win=65536 Len=1240 [TCP PDU reassembled in 6011]"
"6009","13.559773","192.168.2.103","157.240.26.49","TCP","1394","2169  >  443 [ACK] Seq=40734 Ack=18886 Win=65536 Len=1240 [TCP PDU reassembled in 6011]"
"6010","13.559779","192.168.2.103","157.240.26.49","TCP","1394","2169  >  443 [ACK] Seq=41974 Ack=18886 Win=65536 Len=1240 [TCP PDU reassembled in 6011]"
"6011","13.559781","192.168.2.103","157.240.26.49","TLSv1.2","1193","Application Data"
"6013","13.567837","157.240.26.49","192.168.2.103","TCP","146","443  >  2169 [ACK] Seq=18886 Ack=38254 Win=152064 Len=0"
"6015","13.568445","157.240.26.49","192.168.2.103","TCP","154","443  >  2169 [ACK] Seq=18886 Ack=40734 Win=157696 Len=0"
"6016","13.568454","157.240.26.49","192.168.2.103","TCP","154","443  >  2169 [ACK] Seq=18886 Ack=44253 Win=164864 Len=0"
"6018","13.568789","157.240.26.49","192.168.2.103","TLSv1.2","188","Application Data"
"6021","13.606350","157.240.26.49","192.168.2.103","TCP","1386","443  >  2169 [ACK] Seq=18928 Ack=44253 Win=164864 Len=1240 [TCP PDU reassembled in 6025]"
"6023","13.606694","157.240.26.49","192.168.2.103","TCP","1386","443  >  2169 [PSH, ACK] Seq=20168 Ack=44253 Win=164864 Len=1240 [TCP PDU reassembled in 6025]"
"6025","13.607389","157.240.26.49","192.168.2.103","TLSv1.2","327","Application Data"
"6026","13.607395","157.240.26.49","192.168.2.103","TLSv1.2","338","Application Data"
"6033","13.608337","192.168.2.103","157.240.26.49","TCP","154","2169  >  443 [ACK] Seq=44253 Ack=21408 Win=65536 Len=0"
"6034","13.608340","192.168.2.103","157.240.26.49","TCP","154","2169  >  443 [ACK] Seq=44253 Ack=21765 Win=65280 Len=0"
"6040","13.809445","192.168.2.103","157.240.26.49","TCP","217","[TCP Retransmission] 2030  >  443 [FIN, PSH, ACK] Seq=1 Ack=1 Win=251 Len=71"
