"No.","Time","Source","Destination","Protocol","Length","Info"
"5459","11.690407","192.168.2.103","157.240.26.49","TCP","217","[TCP Retransmission] 2030  >  443 [FIN, PSH, ACK] Seq=1 Ack=1 Win=251 Len=71"
"5509","11.999396","192.168.2.103","157.240.26.49","TCP","217","[TCP Retransmission] 2030  >  443 [FIN, PSH, ACK] Seq=1 Ack=1 Win=251 Len=71"
"5521","12.605268","192.168.2.103","157.240.26.49","TCP","217","[TCP Retransmission] 2030  >  443 [FIN, PSH, ACK] Seq=1 Ack=1 Win=251 Len=71"
"5678","13.293899","192.168.2.103","157.240.26.49","TCP","207","[TCP Retransmission] 2169  >  443 [PSH, ACK] Seq=346 Ack=3700 Win=65536 Len=53"
"5679","13.293904","192.168.2.103","157.240.26.49","TCP","210","[TCP Retransmission] 2169  >  443 [PSH, ACK] Seq=399 Ack=3700 Win=65536 Len=56"
"5680","13.293909","192.168.2.103","157.240.26.49","TCP","196","[TCP Retransmission] 2169  >  443 [PSH, ACK] Seq=455 Ack=3700 Win=65536 Len=42"
"5681","13.293914","192.168.2.103","157.240.26.49","TCP","197","[TCP Retransmission] 2169  >  443 [PSH, ACK] Seq=497 Ack=3700 Win=65536 Len=43"
"5682","13.293919","192.168.2.103","157.240.26.49","TCP","1394","[TCP Retransmission] 2169  >  443 [ACK] Seq=540 Ack=3700 Win=65536 Len=1240"
"5683","13.293923","192.168.2.103","157.240.26.49","TCP","1394","[TCP Retransmission] 2169  >  443 [ACK] Seq=1780 Ack=3700 Win=65536 Len=1240 [TCP PDU reassembled in 5686]"
"5684","13.293927","192.168.2.103","157.240.26.49","TCP","1394","[TCP Retransmission] 2169  >  443 [ACK] Seq=3020 Ack=3700 Win=65536 Len=1240 [TCP PDU reassembled in 5686]"
"5687","13.293937","192.168.2.103","157.240.26.49","TCP","1221","[TCP Retransmission] 2169  >  443 [PSH, ACK] Seq=6740 Ack=3700 Win=65536 Len=1067 [TCP PDU reassembled in 5686]"
"5688","13.293940","192.168.2.103","157.240.26.49","TCP","192","[TCP Retransmission] 2169  >  443 [PSH, ACK] Seq=7807 Ack=3700 Win=65536 Len=38"
"5847","13.347380","192.168.2.103","157.240.26.49","TCP","1394","[TCP Retransmission] 2169  >  443 [ACK] Seq=7887 Ack=6878 Win=65536 Len=1240"
"5848","13.347383","192.168.2.103","157.240.26.49","TCP","1394","[TCP Retransmission] 2169  >  443 [ACK] Seq=9127 Ack=6878 Win=65536 Len=1240 [TCP PDU reassembled in 5843]"
"5849","13.347390","192.168.2.103","157.240.26.49","TCP","1394","[TCP Retransmission] 2169  >  443 [ACK] Seq=12847 Ack=6878 Win=65536 Len=1240 [TCP PDU reassembled in 5843]"
"5853","13.348149","192.168.2.103","157.240.26.49","TCP","1394","[TCP Retransmission] 2169  >  443 [ACK] Seq=7887 Ack=6878 Win=65536 Len=1240"
"5854","13.348157","192.168.2.103","157.240.26.49","TCP","1394","[TCP Retransmission] 2169  >  443 [ACK] Seq=9127 Ack=6878 Win=65536 Len=1240 [TCP PDU reassembled in 5843]"
"5863","13.350346","192.168.2.103","157.240.26.49","TCP","1386","[TCP Retransmission] 2169  >  443 [ACK] Seq=9127 Ack=6878 Win=65536 Len=1240 [TCP PDU reassembled in 5843]"
"5908","13.402663","192.168.2.103","157.240.26.49","TCP","1394","[TCP Retransmission] 2169  >  443 [ACK] Seq=20131 Ack=9763 Win=65536 Len=1240 [TCP PDU reassembled in 5909]"
"6040","13.809445","192.168.2.103","157.240.26.49","TCP","217","[TCP Retransmission] 2030  >  443 [FIN, PSH, ACK] Seq=1 Ack=1 Win=251 Len=71"
"6124","14.176445","192.168.2.103","157.240.26.49","TCP","218","[TCP Retransmission] 2174  >  443 [PSH, ACK] Seq=518 Ack=3628 Win=65536 Len=64"
"6125","14.176457","192.168.2.103","157.240.26.49","TCP","240","[TCP Retransmission] 2174  >  443 [PSH, ACK] Seq=582 Ack=3628 Win=65536 Len=86"
"6126","14.176462","192.168.2.103","157.240.26.49","TCP","653","[TCP Retransmission] 2174  >  443 [PSH, ACK] Seq=668 Ack=3628 Win=65536 Len=499"
"6130","14.176706","192.168.2.103","157.240.26.49","TCP","232","[TCP Retransmission] 2174  >  443 [PSH, ACK] Seq=582 Ack=3628 Win=65536 Len=86"
"6275","15.777175","157.240.26.49","192.168.2.103","TCP","1386","[TCP Retransmission] 443  >  2174 [ACK] Seq=6090 Ack=3976 Win=301 Len=1240"
"6426","15.815998","157.240.26.49","192.168.2.103","TCP","1394","[TCP Retransmission] 443  >  2174 [PSH, ACK] Seq=31184 Ack=3976 Win=301 Len=1240 [TCP PDU reassembled in 6450]"
"6427","15.816003","157.240.26.49","192.168.2.103","TCP","1394","[TCP Retransmission] 443  >  2174 [ACK] Seq=34904 Ack=3976 Win=301 Len=1240 [TCP PDU reassembled in 6450]"
"6457","15.823039","157.240.26.49","192.168.2.103","TCP","1394","[TCP Retransmission] 443  >  2174 [ACK] Seq=37384 Ack=3976 Win=301 Len=1240 [TCP PDU reassembled in 6450]"
"6458","15.823043","157.240.26.49","192.168.2.103","TCP","1394","[TCP Retransmission] 443  >  2174 [ACK] Seq=43584 Ack=3976 Win=301 Len=1240 [TCP PDU reassembled in 6454]"
"6596","15.871557","157.240.26.49","192.168.2.103","TCP","1394","[TCP Retransmission] 443  >  2174 [PSH, ACK] Seq=72104 Ack=3976 Win=301 Len=1240 [TCP PDU reassembled in 6597]"
"6641","15.893700","157.240.26.49","192.168.2.103","TCP","1386","[TCP Retransmission] 443  >  2174 [ACK] Seq=79544 Ack=3976 Win=301 Len=1240 [TCP PDU reassembled in 6803]"
"6672","15.916122","157.240.26.49","192.168.2.103","TCP","1386","[TCP Retransmission] 443  >  2174 [ACK] Seq=79544 Ack=3976 Win=301 Len=1240 [TCP PDU reassembled in 6803]"
"6771","16.094687","157.240.26.49","192.168.2.103","TCP","1390","[TCP Retransmission] 443  >  2174 [PSH, ACK] Seq=85744 Ack=3976 Win=301 Len=1240 [TCP PDU reassembled in 6803]"
"6807","16.223111","192.168.2.103","157.240.26.49","TCP","225","[TCP Retransmission] 2030  >  443 [FIN, PSH, ACK] Seq=1 Ack=1 Win=251 Len=71"
"6815","16.223532","192.168.2.103","157.240.26.49","TCP","225","[TCP Retransmission] 2030  >  443 [FIN, PSH, ACK] Seq=1 Ack=1 Win=251 Len=71"
"6864","16.364800","157.240.26.49","192.168.2.103","TCP","1390","[TCP Retransmission] 443  >  2174 [ACK] Seq=90704 Ack=3976 Win=301 Len=1240 [TCP PDU reassembled in 6839]"
"7009","16.808031","157.240.26.49","192.168.2.103","TCP","646","[TCP Retransmission] 443  >  2174 [PSH, ACK] Seq=100624 Ack=3976 Win=301 Len=496 [TCP PDU reassembled in 7000]"
"7134","17.109524","157.240.26.49","192.168.2.103","TCP","1390","[TCP Retransmission] 443  >  2174 [PSH, ACK] Seq=105335 Ack=3976 Win=301 Len=1240 [TCP PDU reassembled in 7100]"
"8704","21.021084","192.168.2.103","157.240.26.49","TCP","217","[TCP Retransmission] 2030  >  443 [FIN, PSH, ACK] Seq=1 Ack=1 Win=251 Len=71"
"8921","21.824292","192.168.2.103","34.107.172.168","TCP","1386","[TCP Retransmission] 2190  >  443 [ACK] Seq=678 Ack=220 Win=66048 Len=1240"
"8925","21.839495","192.168.2.103","34.107.172.168","TCP","1394","[TCP Retransmission] 2190  >  443 [ACK] Seq=678 Ack=220 Win=66048 Len=1240"
"8926","21.839506","192.168.2.103","34.107.172.168","TCP","326","[TCP Retransmission] 2190  >  443 [ACK] Seq=1918 Ack=220 Win=66048 Len=172 [TCP PDU reassembled in 8912]"
"37668","37.126438","192.168.2.103","157.240.26.49","TCP","218","[TCP Retransmission] 2200  >  443 [PSH, ACK] Seq=518 Ack=3628 Win=65536 Len=64"
"37669","37.126443","192.168.2.103","157.240.26.49","TCP","240","[TCP Retransmission] 2200  >  443 [PSH, ACK] Seq=582 Ack=3628 Win=65536 Len=86"
"37701","37.265953","192.168.2.103","157.240.26.49","TCP","217","[TCP Retransmission] 2120  >  443 [FIN, PSH, ACK] Seq=1 Ack=1 Win=254 Len=71"
"37712","37.574413","192.168.2.103","157.240.26.49","TCP","217","[TCP Retransmission] 2120  >  443 [FIN, PSH, ACK] Seq=1 Ack=1 Win=254 Len=71"
"37823","39.382251","192.168.2.103","157.240.26.49","TCP","217","[TCP Retransmission] 2120  >  443 [FIN, PSH, ACK] Seq=1 Ack=1 Win=254 Len=71"
"37945","40.788221","192.168.2.103","142.250.191.138","TCP","720","[TCP Retransmission] 2201  >  443 [PSH, ACK] Seq=429 Ack=4691 Win=65280 Len=574"
"38202","41.189109","142.250.191.138","192.168.2.103","TCP","1394","[TCP Retransmission] 443  >  2201 [ACK] Seq=110951 Ack=1003 Win=269056 Len=1240"
"38203","41.189113","142.250.191.138","192.168.2.103","TCP","1394","[TCP Retransmission] 443  >  2201 [ACK] Seq=112191 Ack=1003 Win=269056 Len=1240"
"38271","41.204907","142.250.191.138","192.168.2.103","TCP","1394","[TCP Retransmission] 443  >  2201 [ACK] Seq=151871 Ack=1003 Win=269056 Len=1240"
"38272","41.204912","142.250.191.138","192.168.2.103","TCP","1394","[TCP Retransmission] 443  >  2201 [ACK] Seq=153111 Ack=1003 Win=269056 Len=1240"
"38273","41.204916","142.250.191.138","192.168.2.103","TCP","1394","[TCP Retransmission] 443  >  2201 [ACK] Seq=154351 Ack=1003 Win=269056 Len=1240"
"38274","41.204920","142.250.191.138","192.168.2.103","TCP","1394","[TCP Retransmission] 443  >  2201 [ACK] Seq=155591 Ack=1003 Win=269056 Len=1240"
"38275","41.204924","142.250.191.138","192.168.2.103","TCP","1394","[TCP Retransmission] 443  >  2201 [PSH, ACK] Seq=156831 Ack=1003 Win=269056 Len=1240"
"38276","41.204928","142.250.191.138","192.168.2.103","TCP","1394","[TCP Retransmission] 443  >  2201 [ACK] Seq=158071 Ack=1003 Win=269056 Len=1240"
"38280","41.204944","142.250.191.138","192.168.2.103","TCP","1394","[TCP Retransmission] 443  >  2201 [ACK] Seq=163031 Ack=1003 Win=269056 Len=1240"
"38303","41.209936","142.250.191.138","192.168.2.103","TCP","1394","[TCP Retransmission] 443  >  2201 [ACK] Seq=172951 Ack=1003 Win=269056 Len=1240"
"38401","41.226481","142.250.191.138","192.168.2.103","TCP","1394","[TCP Retransmission] 443  >  2201 [ACK] Seq=229991 Ack=1003 Win=269056 Len=1240 [TCP PDU reassembled in 38424]"
"38423","41.230408","142.250.191.138","192.168.2.103","TCP","1394","[TCP Retransmission] 443  >  2201 [ACK] Seq=257271 Ack=1003 Win=269056 Len=1240"
"38451","41.235228","142.250.191.138","192.168.2.103","TCP","1394","[TCP Retransmission] 443  >  2201 [ACK] Seq=270911 Ack=1003 Win=269056 Len=1240"
"38452","41.235231","142.250.191.138","192.168.2.103","TCP","1394","[TCP Retransmission] 443  >  2201 [ACK] Seq=273391 Ack=1003 Win=269056 Len=1240"
"38453","41.235235","142.250.191.138","192.168.2.103","TCP","1394","[TCP Retransmission] 443  >  2201 [ACK] Seq=274631 Ack=1003 Win=269056 Len=1240"
"38454","41.235237","142.250.191.138","192.168.2.103","TCP","1394","[TCP Retransmission] 443  >  2201 [ACK] Seq=275871 Ack=1003 Win=269056 Len=1240"
"38455","41.235240","142.250.191.138","192.168.2.103","TCP","1394","[TCP Retransmission] 443  >  2201 [ACK] Seq=277111 Ack=1003 Win=269056 Len=1240"
"38456","41.235244","142.250.191.138","192.168.2.103","TCP","1394","[TCP Retransmission] 443  >  2201 [PSH, ACK] Seq=278351 Ack=1003 Win=269056 Len=1240"
"38548","41.257617","142.250.191.138","192.168.2.103","TCP","1394","[TCP Retransmission] 443  >  2201 [PSH, ACK] Seq=330431 Ack=1003 Win=269056 Len=1240"
"38789","41.304572","142.250.191.138","192.168.2.103","TCP","1394","[TCP Retransmission] 443  >  2201 [PSH, ACK] Seq=474271 Ack=1003 Win=269056 Len=1240"
"38790","41.304576","142.250.191.138","192.168.2.103","TCP","1394","[TCP Retransmission] 443  >  2201 [ACK] Seq=475511 Ack=1003 Win=269056 Len=1240"
"38793","41.304588","142.250.191.138","192.168.2.103","TCP","1394","[TCP Retransmission] 443  >  2201 [PSH, ACK] Seq=479231 Ack=1003 Win=269056 Len=1240"
"39317","41.416390","142.250.191.138","192.168.2.103","TCP","1394","[TCP Retransmission] 443  >  2201 [ACK] Seq=832631 Ack=1003 Win=269056 Len=1240"
"39318","41.416394","142.250.191.138","192.168.2.103","TCP","1394","[TCP Retransmission] 443  >  2201 [PSH, ACK] Seq=833871 Ack=1003 Win=269056 Len=1240"
"39319","41.416398","142.250.191.138","192.168.2.103","TCP","1394","[TCP Retransmission] 443  >  2201 [ACK] Seq=835111 Ack=1003 Win=269056 Len=1240"
"39320","41.416402","142.250.191.138","192.168.2.103","TCP","1394","[TCP Retransmission] 443  >  2201 [PSH, ACK] Seq=836351 Ack=1003 Win=269056 Len=1240"
"39449","41.440713","142.250.191.138","192.168.2.103","TCP","1394","[TCP Retransmission] 443  >  2201 [PSH, ACK] Seq=903311 Ack=1003 Win=269056 Len=1240"
"39450","41.440717","142.250.191.138","192.168.2.103","TCP","1394","[TCP Retransmission] 443  >  2201 [ACK] Seq=904551 Ack=1003 Win=269056 Len=1240"
"39451","41.440722","142.250.191.138","192.168.2.103","TCP","1394","[TCP Retransmission] 443  >  2201 [PSH, ACK] Seq=905791 Ack=1003 Win=269056 Len=1240"
"39489","41.451750","142.250.191.138","192.168.2.103","TCP","1394","[TCP Retransmission] 443  >  2201 [ACK] Seq=934311 Ack=1003 Win=269056 Len=1240"
"39513","41.456850","142.250.191.138","192.168.2.103","TCP","1394","[TCP Retransmission] 443  >  2201 [PSH, ACK] Seq=938031 Ack=1003 Win=269056 Len=1240"
"39515","41.456857","142.250.191.138","192.168.2.103","TCP","1394","[TCP Retransmission] 443  >  2201 [PSH, ACK] Seq=940511 Ack=1003 Win=269056 Len=1240"
"39655","41.482704","142.250.191.138","192.168.2.103","TCP","1394","[TCP Retransmission] 443  >  2201 [PSH, ACK] Seq=1014911 Ack=1003 Win=269056 Len=1240"
"39728","41.500238","142.250.191.138","192.168.2.103","TCP","1394","[TCP Retransmission] 443  >  2201 [PSH, ACK] Seq=1066991 Ack=1003 Win=269056 Len=1240"
"39729","41.500242","142.250.191.138","192.168.2.103","TCP","1394","[TCP Retransmission] 443  >  2201 [ACK] Seq=1068231 Ack=1003 Win=269056 Len=1240"
"39780","41.509708","142.250.191.138","192.168.2.103","TCP","1394","[TCP Retransmission] 443  >  2201 [PSH, ACK] Seq=1099231 Ack=1003 Win=269056 Len=1240"
"39860","41.524692","142.250.191.138","192.168.2.103","TCP","1394","[TCP Retransmission] 443  >  2201 [ACK] Seq=1142631 Ack=1003 Win=269056 Len=1240"
"39861","41.524697","142.250.191.138","192.168.2.103","TCP","1394","[TCP Retransmission] 443  >  2201 [PSH, ACK] Seq=1143871 Ack=1003 Win=269056 Len=1240"
"39862","41.524701","142.250.191.138","192.168.2.103","TCP","1394","[TCP Retransmission] 443  >  2201 [ACK] Seq=1145111 Ack=1003 Win=269056 Len=1240"
"39863","41.524705","142.250.191.138","192.168.2.103","TCP","1394","[TCP Retransmission] 443  >  2201 [PSH, ACK] Seq=1146351 Ack=1003 Win=269056 Len=1240"
"39864","41.524710","142.250.191.138","192.168.2.103","TCP","1394","[TCP Retransmission] 443  >  2201 [ACK] Seq=1147591 Ack=1003 Win=269056 Len=1240"
"40132","41.584675","142.250.191.138","192.168.2.103","TCP","1394","[TCP Retransmission] 443  >  2201 [ACK] Seq=1259191 Ack=1003 Win=269056 Len=1240"
"40263","41.610723","142.250.191.138","192.168.2.103","TCP","1394","[TCP Retransmission] 443  >  2201 [PSH, ACK] Seq=1337311 Ack=1003 Win=269056 Len=1240"
"40311","41.620275","142.250.191.138","192.168.2.103","TCP","1394","[TCP Retransmission] 443  >  2201 [PSH, ACK] Seq=1359631 Ack=1003 Win=269056 Len=1240 [TCP PDU reassembled in 40331]"
"40312","41.620279","142.250.191.138","192.168.2.103","TCP","1394","[TCP Retransmission] 443  >  2201 [ACK] Seq=1360871 Ack=1003 Win=269056 Len=1240 [TCP PDU reassembled in 40331]"
"40313","41.620283","142.250.191.138","192.168.2.103","TCP","1394","[TCP Retransmission] 443  >  2201 [PSH, ACK] Seq=1362111 Ack=1003 Win=269056 Len=1240 [TCP PDU reassembled in 40331]"
"40422","41.640776","142.250.191.138","192.168.2.103","TCP","1394","[TCP Retransmission] 443  >  2201 [PSH, ACK] Seq=1419151 Ack=1003 Win=269056 Len=1240"
"40582","41.783206","192.168.2.103","157.240.26.49","TCP","217","[TCP Retransmission] 2120  >  443 [FIN, PSH, ACK] Seq=1 Ack=1 Win=254 Len=71"
"43919","46.593721","192.168.2.103","157.240.26.49","TCP","217","[TCP Retransmission] 2120  >  443 [FIN, PSH, ACK] Seq=1 Ack=1 Win=254 Len=71"
"49854","51.565074","142.250.191.138","192.168.2.103","TCP","1394","[TCP Retransmission] 443  >  2201 [ACK] Seq=1947357 Ack=1577 Win=268544 Len=1240"
"49855","51.565078","142.250.191.138","192.168.2.103","TCP","1394","[TCP Retransmission] 443  >  2201 [ACK] Seq=1948597 Ack=1577 Win=268544 Len=1240"
"49858","51.565092","142.250.191.138","192.168.2.103","TCP","1394","[TCP Retransmission] 443  >  2201 [ACK] Seq=1952317 Ack=1577 Win=268544 Len=1240"
"50644","51.800168","142.250.191.138","192.168.2.103","TCP","1394","[TCP Retransmission] 443  >  2201 [ACK] Seq=2194117 Ack=1577 Win=268544 Len=1240 [TCP PDU reassembled in 50776]"
"50770","51.840967","142.250.191.138","192.168.2.103","TCP","1394","[TCP Retransmission] 443  >  2201 [ACK] Seq=2218917 Ack=1577 Win=268544 Len=1240 [TCP PDU reassembled in 50776]"
"50880","51.877762","142.250.191.138","192.168.2.103","TCP","1394","[TCP Retransmission] 443  >  2201 [PSH, ACK] Seq=2251157 Ack=1577 Win=268544 Len=1240 [TCP PDU reassembled in 51031]"
"50882","51.877771","142.250.191.138","192.168.2.103","TCP","1394","[TCP Retransmission] 443  >  2201 [ACK] Seq=2253637 Ack=1577 Win=268544 Len=1240 [TCP PDU reassembled in 51031]"
"51383","52.019012","142.250.191.138","192.168.2.103","TCP","1394","[TCP Retransmission] 443  >  2201 [ACK] Seq=2439637 Ack=1577 Win=268544 Len=1240"
"52485","52.353781","142.250.191.138","192.168.2.103","TCP","1394","[TCP Retransmission] 443  >  2201 [PSH, ACK] Seq=2826517 Ack=1577 Win=268544 Len=1240"
"60491","54.594378","192.168.2.103","142.250.191.138","TCP","1394","[TCP Retransmission] 2193  >  443 [ACK] Seq=10094 Ack=7840 Win=65024 Len=1240"
"60492","54.594381","192.168.2.103","142.250.191.138","TCP","846","[TCP Retransmission] 2193  >  443 [PSH, ACK] Seq=11334 Ack=7840 Win=65024 Len=692 [TCP PDU reassembled in 60488]"
"60496","54.594929","192.168.2.103","142.250.191.138","TCP","1386","[TCP Retransmission] 2193  >  443 [ACK] Seq=10094 Ack=7840 Win=65024 Len=1240"
"60508","54.597197","192.168.2.103","142.250.191.138","TCP","1386","[TCP Retransmission] 2193  >  443 [ACK] Seq=10094 Ack=7840 Win=65024 Len=1240"
"60512","54.598313","192.168.2.103","142.250.191.138","TCP","1386","[TCP Retransmission] 2193  >  443 [ACK] Seq=10094 Ack=7840 Win=65024 Len=1240"
"77141","61.379937","142.250.191.138","192.168.2.103","TCP","1394","[TCP Retransmission] 443  >  2201 [ACK] Seq=3129290 Ack=2151 Win=268032 Len=1240"
"77142","61.379941","142.250.191.138","192.168.2.103","TCP","1394","[TCP Retransmission] 443  >  2201 [PSH, ACK] Seq=3130530 Ack=2151 Win=268032 Len=1240"
"77233","61.395549","142.250.191.138","192.168.2.103","TCP","1394","[TCP Retransmission] 443  >  2201 [ACK] Seq=3188810 Ack=2151 Win=268032 Len=1240"
"77236","61.395561","142.250.191.138","192.168.2.103","TCP","1394","[TCP Retransmission] 443  >  2201 [ACK] Seq=3192530 Ack=2151 Win=268032 Len=1240"
"77238","61.395570","142.250.191.138","192.168.2.103","TCP","1394","[TCP Retransmission] 443  >  2201 [PSH, ACK] Seq=3195010 Ack=2151 Win=268032 Len=1240"
"77710","61.479039","142.250.191.138","192.168.2.103","TCP","1394","[TCP Retransmission] 443  >  2201 [ACK] Seq=3523498 Ack=2151 Win=268032 Len=1240"
"77712","61.479044","142.250.191.138","192.168.2.103","TCP","1394","[TCP Retransmission] 443  >  2201 [PSH, ACK] Seq=3525978 Ack=2151 Win=268032 Len=1240"
"77713","61.479047","142.250.191.138","192.168.2.103","TCP","1394","[TCP Retransmission] 443  >  2201 [ACK] Seq=3527218 Ack=2151 Win=268032 Len=1240"
"77714","61.479049","142.250.191.138","192.168.2.103","TCP","1394","[TCP Retransmission] 443  >  2201 [ACK] Seq=3528458 Ack=2151 Win=268032 Len=1240"
"77766","61.488241","142.250.191.138","192.168.2.103","TCP","1394","[TCP Retransmission] 443  >  2201 [PSH, ACK] Seq=3545818 Ack=2151 Win=268032 Len=1240"
"77768","61.488249","142.250.191.138","192.168.2.103","TCP","1394","[TCP Retransmission] 443  >  2201 [ACK] Seq=3548298 Ack=2151 Win=268032 Len=1240"
"77769","61.488252","142.250.191.138","192.168.2.103","TCP","1394","[TCP Retransmission] 443  >  2201 [ACK] Seq=3549538 Ack=2151 Win=268032 Len=1240"
"77771","61.488260","142.250.191.138","192.168.2.103","TCP","1394","[TCP Retransmission] 443  >  2201 [ACK] Seq=3552018 Ack=2151 Win=268032 Len=1240"
"77817","61.496521","142.250.191.138","192.168.2.103","TCP","1394","[TCP Retransmission] 443  >  2201 [ACK] Seq=3583018 Ack=2151 Win=268032 Len=1240"
"77839","61.501217","142.250.191.138","192.168.2.103","TCP","1394","[TCP Retransmission] 443  >  2201 [ACK] Seq=3607818 Ack=2151 Win=268032 Len=1240"
"77841","61.501225","142.250.191.138","192.168.2.103","TCP","1394","[TCP Retransmission] 443  >  2201 [PSH, ACK] Seq=3610298 Ack=2151 Win=268032 Len=1240"
"77842","61.501230","142.250.191.138","192.168.2.103","TCP","1394","[TCP Retransmission] 443  >  2201 [ACK] Seq=3611538 Ack=2151 Win=268032 Len=1240"
"77867","61.505391","142.250.191.138","192.168.2.103","TCP","1394","[TCP Retransmission] 443  >  2201 [ACK] Seq=3622698 Ack=2151 Win=268032 Len=1240 [TCP PDU reassembled in 77903]"
"78052","61.546506","142.250.191.138","192.168.2.103","TCP","1394","[TCP Retransmission] 443  >  2201 [ACK] Seq=3738018 Ack=2151 Win=268032 Len=1240"
"78053","61.546509","142.250.191.138","192.168.2.103","TCP","1394","[TCP Retransmission] 443  >  2201 [PSH, ACK] Seq=3739258 Ack=2151 Win=268032 Len=1240"
"78054","61.546511","142.250.191.138","192.168.2.103","TCP","1394","[TCP Retransmission] 443  >  2201 [ACK] Seq=3740498 Ack=2151 Win=268032 Len=1240"
"78093","61.553621","142.250.191.138","192.168.2.103","TCP","1394","[TCP Retransmission] 443  >  2201 [ACK] Seq=3766538 Ack=2151 Win=268032 Len=1240"
"78094","61.553624","142.250.191.138","192.168.2.103","TCP","1394","[TCP Retransmission] 443  >  2201 [ACK] Seq=3767778 Ack=2151 Win=268032 Len=1240"
"78295","61.592424","142.250.191.138","192.168.2.103","TCP","1394","[TCP Retransmission] 443  >  2201 [ACK] Seq=3884338 Ack=2151 Win=268032 Len=1240"
"78697","61.671789","142.250.191.138","192.168.2.103","TCP","1394","[TCP Retransmission] 443  >  2201 [ACK] Seq=4149698 Ack=2151 Win=268032 Len=1240"
"78698","61.671793","142.250.191.138","192.168.2.103","TCP","1394","[TCP Retransmission] 443  >  2201 [PSH, ACK] Seq=4150938 Ack=2151 Win=268032 Len=1240"
"78699","61.671798","142.250.191.138","192.168.2.103","TCP","1394","[TCP Retransmission] 443  >  2201 [ACK] Seq=4152178 Ack=2151 Win=268032 Len=1240"
"78700","61.671802","142.250.191.138","192.168.2.103","TCP","1394","[TCP Retransmission] 443  >  2201 [ACK] Seq=4153418 Ack=2151 Win=268032 Len=1240"
"78852","61.699435","142.250.191.138","192.168.2.103","TCP","1386","[TCP Retransmission] 443  >  2201 [PSH, ACK] Seq=4262538 Ack=2151 Win=268032 Len=1240"
"78854","61.701046","142.250.191.138","192.168.2.103","TCP","1394","[TCP Retransmission] 443  >  2201 [ACK] Seq=4263778 Ack=2151 Win=268032 Len=1240"
"78856","61.701054","142.250.191.138","192.168.2.103","TCP","1394","[TCP Retransmission] 443  >  2201 [PSH, ACK] Seq=4266258 Ack=2151 Win=268032 Len=1240"
"78858","61.701063","142.250.191.138","192.168.2.103","TCP","1394","[TCP Retransmission] 443  >  2201 [ACK] Seq=4268738 Ack=2151 Win=268032 Len=1240"
"78859","61.701066","142.250.191.138","192.168.2.103","TCP","1394","[TCP Retransmission] 443  >  2201 [PSH, ACK] Seq=4269978 Ack=2151 Win=268032 Len=1240"
"81960","67.472616","192.168.2.103","142.250.191.138","TCP","1394","[TCP Retransmission] 2193  >  443 [ACK] Seq=15891 Ack=9732 Win=65536 Len=1240"
"81961","67.472626","192.168.2.103","142.250.191.138","TCP","847","[TCP Retransmission] 2193  >  443 [PSH, ACK] Seq=17131 Ack=9732 Win=65536 Len=693 [TCP PDU reassembled in 81957]"
"82462","71.421356","142.250.191.138","192.168.2.103","TCP","1394","[TCP Retransmission] 443  >  2201 [PSH, ACK] Seq=4721600 Ack=2725 Win=267520 Len=1240"
"82618","71.443292","142.250.191.138","192.168.2.103","TCP","1394","[TCP Retransmission] 443  >  2201 [PSH, ACK] Seq=4847968 Ack=2725 Win=267520 Len=1240"
"82619","71.443296","142.250.191.138","192.168.2.103","TCP","1394","[TCP Retransmission] 443  >  2201 [ACK] Seq=4849208 Ack=2725 Win=267520 Len=1240"
"82621","71.443304","142.250.191.138","192.168.2.103","TCP","1394","[TCP Retransmission] 443  >  2201 [ACK] Seq=4851688 Ack=2725 Win=267520 Len=1240"
"82622","71.443309","142.250.191.138","192.168.2.103","TCP","1394","[TCP Retransmission] 443  >  2201 [PSH, ACK] Seq=4852928 Ack=2725 Win=267520 Len=1240"
"82707","71.461002","142.250.191.138","192.168.2.103","TCP","1394","[TCP Retransmission] 443  >  2201 [PSH, ACK] Seq=4900048 Ack=2725 Win=267520 Len=1240 [TCP PDU reassembled in 82731]"
"82743","71.466882","142.250.191.138","192.168.2.103","TCP","1394","[TCP Retransmission] 443  >  2201 [ACK] Seq=4917408 Ack=2725 Win=267520 Len=1240 [TCP PDU reassembled in 82731]"
"82746","71.466892","142.250.191.138","192.168.2.103","TCP","1394","[TCP Retransmission] 443  >  2201 [ACK] Seq=4921128 Ack=2725 Win=267520 Len=1240 [TCP PDU reassembled in 82731]"
"82747","71.466895","142.250.191.138","192.168.2.103","TCP","1394","[TCP Retransmission] 443  >  2201 [ACK] Seq=4922368 Ack=2725 Win=267520 Len=1240 [TCP PDU reassembled in 82731]"
"82751","71.466906","142.250.191.138","192.168.2.103","TCP","1394","[TCP Retransmission] 443  >  2201 [ACK] Seq=4927328 Ack=2725 Win=267520 Len=1240"
"82783","71.472437","142.250.191.138","192.168.2.103","TCP","1394","[TCP Retransmission] 443  >  2201 [PSH, ACK] Seq=4939728 Ack=2725 Win=267520 Len=1240"
"83117","71.530889","142.250.191.138","192.168.2.103","TCP","1386","[TCP Retransmission] 443  >  2201 [ACK] Seq=5154248 Ack=2725 Win=267520 Len=1240"
"83131","71.534756","142.250.191.138","192.168.2.103","TCP","1394","[TCP Retransmission] 443  >  2201 [PSH, ACK] Seq=5162928 Ack=2725 Win=267520 Len=1240"
"83160","71.539011","142.250.191.138","192.168.2.103","TCP","1394","[TCP Retransmission] 443  >  2201 [PSH, ACK] Seq=5182768 Ack=2725 Win=267520 Len=1240"
"83161","71.539014","142.250.191.138","192.168.2.103","TCP","1394","[TCP Retransmission] 443  >  2201 [ACK] Seq=5184008 Ack=2725 Win=267520 Len=1240"
"83403","71.587026","142.250.191.138","192.168.2.103","TCP","1394","[TCP Retransmission] 443  >  2201 [PSH, ACK] Seq=5327736 Ack=2725 Win=267520 Len=1240"
"83404","71.587029","142.250.191.138","192.168.2.103","TCP","1394","[TCP Retransmission] 443  >  2201 [ACK] Seq=5328976 Ack=2725 Win=267520 Len=1240"
"83405","71.587032","142.250.191.138","192.168.2.103","TCP","1394","[TCP Retransmission] 443  >  2201 [ACK] Seq=5330216 Ack=2725 Win=267520 Len=1240"
"83406","71.587034","142.250.191.138","192.168.2.103","TCP","1394","[TCP Retransmission] 443  >  2201 [PSH, ACK] Seq=5331456 Ack=2725 Win=267520 Len=1240"
"83407","71.587036","142.250.191.138","192.168.2.103","TCP","1394","[TCP Retransmission] 443  >  2201 [ACK] Seq=5332696 Ack=2725 Win=267520 Len=1240"
"83439","71.594485","142.250.191.138","192.168.2.103","TCP","1394","[TCP Retransmission] 443  >  2201 [ACK] Seq=5340024 Ack=2725 Win=267520 Len=1240"
"83441","71.594489","142.250.191.138","192.168.2.103","TCP","1394","[TCP Retransmission] 443  >  2201 [ACK] Seq=5342504 Ack=2725 Win=267520 Len=1240"
"83466","71.601924","142.250.191.138","192.168.2.103","TCP","1394","[TCP Retransmission] 443  >  2201 [ACK] Seq=5346224 Ack=2725 Win=267520 Len=1240"
"83616","71.633051","142.250.191.138","192.168.2.103","TCP","1394","[TCP Retransmission] 443  >  2201 [ACK] Seq=5440464 Ack=2725 Win=267520 Len=1240 [TCP PDU reassembled in 83636]"
"83618","71.633058","142.250.191.138","192.168.2.103","TCP","1394","[TCP Retransmission] 443  >  2201 [ACK] Seq=5442944 Ack=2725 Win=267520 Len=1240 [TCP PDU reassembled in 83636]"
"84130","71.734207","142.250.191.138","192.168.2.103","TCP","1394","[TCP Retransmission] 443  >  2201 [ACK] Seq=5803784 Ack=2725 Win=267520 Len=1240"
"84194","71.745139","142.250.191.138","192.168.2.103","TCP","1394","[TCP Retransmission] 443  >  2201 [PSH, ACK] Seq=5843464 Ack=2725 Win=267520 Len=1240"
"84195","71.745142","142.250.191.138","192.168.2.103","TCP","1394","[TCP Retransmission] 443  >  2201 [ACK] Seq=5844704 Ack=2725 Win=267520 Len=1240"
"84196","71.745144","142.250.191.138","192.168.2.103","TCP","1394","[TCP Retransmission] 443  >  2201 [ACK] Seq=5845944 Ack=2725 Win=267520 Len=1240"
"84198","71.745148","142.250.191.138","192.168.2.103","TCP","1394","[TCP Retransmission] 443  >  2201 [ACK] Seq=5848424 Ack=2725 Win=267520 Len=1240"
"84199","71.745150","142.250.191.138","192.168.2.103","TCP","1394","[TCP Retransmission] 443  >  2201 [ACK] Seq=5849664 Ack=2725 Win=267520 Len=1240"
"84214","71.748879","142.250.191.138","192.168.2.103","TCP","1394","[TCP Retransmission] 443  >  2201 [ACK] Seq=5853384 Ack=2725 Win=267520 Len=1240"
"84215","71.748883","142.250.191.138","192.168.2.103","TCP","1394","[TCP Retransmission] 443  >  2201 [PSH, ACK] Seq=5854624 Ack=2725 Win=267520 Len=1240"
"84426","71.794608","142.250.191.138","192.168.2.103","TCP","1394","[TCP Retransmission] 443  >  2201 [ACK] Seq=5976144 Ack=2725 Win=267520 Len=1240 [TCP PDU reassembled in 84459]"
"84428","71.794612","142.250.191.138","192.168.2.103","TCP","1394","[TCP Retransmission] 443  >  2201 [ACK] Seq=5978624 Ack=2725 Win=267520 Len=1240 [TCP PDU reassembled in 84459]"
"84429","71.794615","142.250.191.138","192.168.2.103","TCP","1394","[TCP Retransmission] 443  >  2201 [ACK] Seq=5979864 Ack=2725 Win=267520 Len=1240 [TCP PDU reassembled in 84459]"
"84430","71.794617","142.250.191.138","192.168.2.103","TCP","1394","[TCP Retransmission] 443  >  2201 [PSH, ACK] Seq=5981104 Ack=2725 Win=267520 Len=1240 [TCP PDU reassembled in 84459]"
"84447","71.798119","142.250.191.138","192.168.2.103","TCP","1394","[TCP Retransmission] 443  >  2201 [PSH, ACK] Seq=5988544 Ack=2725 Win=267520 Len=1240 [TCP PDU reassembled in 84459]"
"84553","71.818648","142.250.191.138","192.168.2.103","TCP","1394","[TCP Retransmission] 443  >  2201 [ACK] Seq=6054264 Ack=2725 Win=267520 Len=1240"
"84554","71.818651","142.250.191.138","192.168.2.103","TCP","1394","[TCP Retransmission] 443  >  2201 [PSH, ACK] Seq=6055504 Ack=2725 Win=267520 Len=1240"
"84555","71.818653","142.250.191.138","192.168.2.103","TCP","1394","[TCP Retransmission] 443  >  2201 [ACK] Seq=6056744 Ack=2725 Win=267520 Len=1240"
"88628","81.133999","142.250.191.138","192.168.2.103","TCP","1386","[TCP Retransmission] 443  >  2193 [ACK] Seq=35203 Ack=26130 Win=245760 Len=1240 [TCP PDU reassembled in 88625]"
"88813","81.165021","142.250.191.138","192.168.2.103","TCP","1394","[TCP Retransmission] 443  >  2193 [ACK] Seq=134403 Ack=26130 Win=245760 Len=1240"
"88995","81.203250","142.250.191.138","192.168.2.103","TCP","1394","[TCP Retransmission] 443  >  2193 [PSH, ACK] Seq=274523 Ack=26130 Win=245760 Len=1240 [TCP PDU reassembled in 89005]"
"89040","81.209324","142.250.191.138","192.168.2.103","TCP","1394","[TCP Retransmission] 443  >  2193 [PSH, ACK] Seq=304283 Ack=26130 Win=245760 Len=1240"
"89062","81.212629","142.250.191.138","192.168.2.103","TCP","1394","[TCP Retransmission] 443  >  2193 [PSH, ACK] Seq=315443 Ack=26130 Win=245760 Len=1240"
"89063","81.212633","142.250.191.138","192.168.2.103","TCP","1394","[TCP Retransmission] 443  >  2193 [ACK] Seq=316683 Ack=26130 Win=245760 Len=1240"
"89064","81.212637","142.250.191.138","192.168.2.103","TCP","1394","[TCP Retransmission] 443  >  2193 [ACK] Seq=317923 Ack=26130 Win=245760 Len=1240"
"89065","81.212640","142.250.191.138","192.168.2.103","TCP","1394","[TCP Retransmission] 443  >  2193 [ACK] Seq=319163 Ack=26130 Win=245760 Len=1240"
"89153","81.232098","142.250.191.138","192.168.2.103","TCP","1394","[TCP Retransmission] 443  >  2193 [ACK] Seq=366283 Ack=26130 Win=245760 Len=1240"
"89449","81.286250","142.250.191.138","192.168.2.103","TCP","1394","[TCP Retransmission] 443  >  2193 [PSH, ACK] Seq=542251 Ack=26130 Win=245760 Len=1240 [TCP PDU reassembled in 89527]"
"89482","81.293436","142.250.191.138","192.168.2.103","TCP","1394","[TCP Retransmission] 443  >  2193 [ACK] Seq=552171 Ack=26130 Win=245760 Len=1240 [TCP PDU reassembled in 89527]"
"89483","81.293440","142.250.191.138","192.168.2.103","TCP","1394","[TCP Retransmission] 443  >  2193 [PSH, ACK] Seq=553411 Ack=26130 Win=245760 Len=1240 [TCP PDU reassembled in 89527]"
"89484","81.293444","142.250.191.138","192.168.2.103","TCP","1394","[TCP Retransmission] 443  >  2193 [ACK] Seq=554651 Ack=26130 Win=245760 Len=1240 [TCP PDU reassembled in 89527]"
"89486","81.293452","142.250.191.138","192.168.2.103","TCP","1394","[TCP Retransmission] 443  >  2193 [PSH, ACK] Seq=557131 Ack=26130 Win=245760 Len=1240 [TCP PDU reassembled in 89527]"
"89488","81.293460","142.250.191.138","192.168.2.103","TCP","1394","[TCP Retransmission] 443  >  2193 [ACK] Seq=559611 Ack=26130 Win=245760 Len=1240 [TCP PDU reassembled in 89527]"
"89489","81.293464","142.250.191.138","192.168.2.103","TCP","1394","[TCP Retransmission] 443  >  2193 [PSH, ACK] Seq=560851 Ack=26130 Win=245760 Len=1240 [TCP PDU reassembled in 89527]"
"89818","81.360035","142.250.191.138","192.168.2.103","TCP","1394","[TCP Retransmission] 443  >  2193 [PSH, ACK] Seq=795211 Ack=26130 Win=245760 Len=1240"
"89819","81.360039","142.250.191.138","192.168.2.103","TCP","1394","[TCP Retransmission] 443  >  2193 [ACK] Seq=796451 Ack=26130 Win=245760 Len=1240"
"89860","81.366896","142.250.191.138","192.168.2.103","TCP","1394","[TCP Retransmission] 443  >  2193 [ACK] Seq=823731 Ack=26130 Win=245760 Len=1240"
"89887","81.370986","142.250.191.138","192.168.2.103","TCP","1394","[TCP Retransmission] 443  >  2193 [ACK] Seq=837371 Ack=26130 Win=245760 Len=1240"
"89889","81.370990","142.250.191.138","192.168.2.103","TCP","1394","[TCP Retransmission] 443  >  2193 [PSH, ACK] Seq=839851 Ack=26130 Win=245760 Len=1240"
"89890","81.370993","142.250.191.138","192.168.2.103","TCP","1394","[TCP Retransmission] 443  >  2193 [ACK] Seq=841091 Ack=26130 Win=245760 Len=1240"
"89891","81.370995","142.250.191.138","192.168.2.103","TCP","1394","[TCP Retransmission] 443  >  2193 [ACK] Seq=842331 Ack=26130 Win=245760 Len=1240"
"89892","81.370998","142.250.191.138","192.168.2.103","TCP","1394","[TCP Retransmission] 443  >  2193 [PSH, ACK] Seq=843571 Ack=26130 Win=245760 Len=1240"
"89915","81.375054","142.250.191.138","192.168.2.103","TCP","1394","[TCP Retransmission] 443  >  2193 [ACK] Seq=849771 Ack=26130 Win=245760 Len=1240"
"89917","81.375059","142.250.191.138","192.168.2.103","TCP","1394","[TCP Retransmission] 443  >  2193 [ACK] Seq=852251 Ack=26130 Win=245760 Len=1240"
"89918","81.375060","142.250.191.138","192.168.2.103","TCP","1394","[TCP Retransmission] 443  >  2193 [ACK] Seq=853491 Ack=26130 Win=245760 Len=1240"
"89994","81.394567","142.250.191.138","192.168.2.103","TCP","1394","[TCP Retransmission] 443  >  2193 [ACK] Seq=896891 Ack=26130 Win=245760 Len=1240"
"89995","81.394570","142.250.191.138","192.168.2.103","TCP","1394","[TCP Retransmission] 443  >  2193 [ACK] Seq=898131 Ack=26130 Win=245760 Len=1240"
"89996","81.394571","142.250.191.138","192.168.2.103","TCP","1394","[TCP Retransmission] 443  >  2193 [PSH, ACK] Seq=899371 Ack=26130 Win=245760 Len=1240"
"89997","81.394574","142.250.191.138","192.168.2.103","TCP","1394","[TCP Retransmission] 443  >  2193 [ACK] Seq=889451 Ack=26130 Win=245760 Len=1240"
"90062","81.406105","142.250.191.138","192.168.2.103","TCP","1394","[TCP Retransmission] 443  >  2193 [ACK] Seq=937811 Ack=26130 Win=245760 Len=1240"
"90433","81.474125","142.250.191.138","192.168.2.103","TCP","1394","[TCP Retransmission] 443  >  2193 [PSH, ACK] Seq=1174651 Ack=26130 Win=245760 Len=1240 [TCP PDU reassembled in 90445]"
"90436","81.474138","142.250.191.138","192.168.2.103","TCP","1394","[TCP Retransmission] 443  >  2193 [PSH, ACK] Seq=1178371 Ack=26130 Win=245760 Len=1240 [TCP PDU reassembled in 90445]"
"90646","81.518368","142.250.191.138","192.168.2.103","TCP","1394","[TCP Retransmission] 443  >  2193 [ACK] Seq=1309811 Ack=26130 Win=245760 Len=1240 [TCP PDU reassembled in 90681]"
"90647","81.518372","142.250.191.138","192.168.2.103","TCP","1394","[TCP Retransmission] 443  >  2193 [ACK] Seq=1311051 Ack=26130 Win=245760 Len=1240 [TCP PDU reassembled in 90681]"
"90649","81.518379","142.250.191.138","192.168.2.103","TCP","1394","[TCP Retransmission] 443  >  2193 [ACK] Seq=1313531 Ack=26130 Win=245760 Len=1240 [TCP PDU reassembled in 90681]"
"90794","81.548897","142.250.191.138","192.168.2.103","TCP","1394","[TCP Retransmission] 443  >  2193 [PSH, ACK] Seq=1394131 Ack=26130 Win=245760 Len=1240 [TCP PDU reassembled in 90816]"
"90795","81.548901","142.250.191.138","192.168.2.103","TCP","1394","[TCP Retransmission] 443  >  2193 [ACK] Seq=1395371 Ack=26130 Win=245760 Len=1240 [TCP PDU reassembled in 90816]"
"95036","91.634633","142.250.191.138","192.168.2.103","TCP","1394","[TCP Retransmission] 443  >  2201 [ACK] Seq=6209658 Ack=5232 Win=265472 Len=1240"
"95037","91.634637","142.250.191.138","192.168.2.103","TCP","1394","[TCP Retransmission] 443  >  2201 [PSH, ACK] Seq=6210898 Ack=5232 Win=265472 Len=1240"
"95094","91.643537","142.250.191.138","192.168.2.103","TCP","1394","[TCP Retransmission] 443  >  2201 [ACK] Seq=6246734 Ack=5232 Win=265472 Len=1240"
"95135","91.650817","142.250.191.138","192.168.2.103","TCP","1394","[TCP Retransmission] 443  >  2201 [ACK] Seq=6275139 Ack=5232 Win=265472 Len=1240"
"95136","91.650820","142.250.191.138","192.168.2.103","TCP","1394","[TCP Retransmission] 443  >  2201 [PSH, ACK] Seq=6276379 Ack=5232 Win=265472 Len=1240"
"95139","91.650832","142.250.191.138","192.168.2.103","TCP","1394","[TCP Retransmission] 443  >  2201 [ACK] Seq=6280099 Ack=5232 Win=265472 Len=1240"
"95185","91.661967","142.250.191.138","192.168.2.103","TCP","1394","[TCP Retransmission] 443  >  2201 [ACK] Seq=6304238 Ack=5232 Win=265472 Len=1240"
"95207","91.665674","142.250.191.138","192.168.2.103","TCP","1394","[TCP Retransmission] 443  >  2201 [ACK] Seq=6336478 Ack=5232 Win=265472 Len=1240 [TCP PDU reassembled in 95197]"
"95342","91.686438","142.250.191.138","192.168.2.103","TCP","1394","[TCP Retransmission] 443  >  2201 [PSH, ACK] Seq=6426998 Ack=5232 Win=265472 Len=1240 [TCP PDU reassembled in 95304]"
"95345","91.686447","142.250.191.138","192.168.2.103","TCP","1394","[TCP Retransmission] 443  >  2201 [ACK] Seq=6430718 Ack=5232 Win=265472 Len=1240 [TCP PDU reassembled in 95307]"
"95346","91.686450","142.250.191.138","192.168.2.103","TCP","1394","[TCP Retransmission] 443  >  2201 [PSH, ACK] Seq=6431958 Ack=5232 Win=265472 Len=1240 [TCP PDU reassembled in 95308]"
"95409","91.696403","142.250.191.138","192.168.2.103","TCP","1394","[TCP Retransmission] 443  >  2201 [ACK] Seq=6465438 Ack=5232 Win=265472 Len=1240"
"95435","91.703105","142.250.191.138","192.168.2.103","TCP","1394","[TCP Retransmission] 443  >  2201 [ACK] Seq=6475246 Ack=5232 Win=265472 Len=1240 [TCP PDU reassembled in 95448]"
"95436","91.703108","142.250.191.138","192.168.2.103","TCP","1394","[TCP Retransmission] 443  >  2201 [PSH, ACK] Seq=6476486 Ack=5232 Win=265472 Len=1240 [TCP PDU reassembled in 95448]"
"95589","91.738652","142.250.191.138","192.168.2.103","TCP","1394","[TCP Retransmission] 443  >  2201 [ACK] Seq=6578166 Ack=5232 Win=265472 Len=1240"
"95590","91.738655","142.250.191.138","192.168.2.103","TCP","1394","[TCP Retransmission] 443  >  2201 [ACK] Seq=6579406 Ack=5232 Win=265472 Len=1240"
"95591","91.738657","142.250.191.138","192.168.2.103","TCP","1394","[TCP Retransmission] 443  >  2201 [PSH, ACK] Seq=6580646 Ack=5232 Win=265472 Len=1240"
"95592","91.738660","142.250.191.138","192.168.2.103","TCP","1394","[TCP Retransmission] 443  >  2201 [ACK] Seq=6581886 Ack=5232 Win=265472 Len=1240"
"95658","91.754177","142.250.191.138","192.168.2.103","TCP","1394","[TCP Retransmission] 443  >  2201 [ACK] Seq=6606686 Ack=5232 Win=265472 Len=1240"
"95662","91.754196","142.250.191.138","192.168.2.103","TCP","1394","[TCP Retransmission] 443  >  2201 [ACK] Seq=6611646 Ack=5232 Win=265472 Len=1240"
"95663","91.754200","142.250.191.138","192.168.2.103","TCP","1394","[TCP Retransmission] 443  >  2201 [ACK] Seq=6612886 Ack=5232 Win=265472 Len=1240"
"95664","91.754204","142.250.191.138","192.168.2.103","TCP","1394","[TCP Retransmission] 443  >  2201 [ACK] Seq=6614126 Ack=5232 Win=265472 Len=1240"
"95665","91.754208","142.250.191.138","192.168.2.103","TCP","1394","[TCP Retransmission] 443  >  2201 [PSH, ACK] Seq=6615366 Ack=5232 Win=265472 Len=1240"
"95666","91.754212","142.250.191.138","192.168.2.103","TCP","1394","[TCP Retransmission] 443  >  2201 [ACK] Seq=6616606 Ack=5232 Win=265472 Len=1240"
"95694","91.758901","142.250.191.138","192.168.2.103","TCP","1386","[TCP Retransmission] 443  >  2201 [PSH, ACK] Seq=6620326 Ack=5232 Win=265472 Len=1240"
"95700","91.760713","142.250.191.138","192.168.2.103","TCP","1394","[TCP Retransmission] 443  >  2201 [ACK] Seq=6621566 Ack=5232 Win=265472 Len=1240"
"95701","91.760717","142.250.191.138","192.168.2.103","TCP","1394","[TCP Retransmission] 443  >  2201 [ACK] Seq=6622806 Ack=5232 Win=265472 Len=1240"
