"No.","Time","Source","Destination","Protocol","Length","Info"
"595","14.942052","23.192.220.4","192.168.2.103","TCP","185","[TCP Retransmission] 443  >  1191 [PSH, ACK] Seq=1 Ack=169 Win=501 Len=39"
"623","14.952531","23.192.220.4","192.168.2.103","TCP","1394","[TCP Retransmission] 443  >  1191 [ACK] Seq=12700 Ack=169 Win=501 Len=1240 [TCP PDU reassembled in 616]"
"624","14.952540","23.192.220.4","192.168.2.103","TCP","1394","[TCP Retransmission] 443  >  1191 [ACK] Seq=13940 Ack=169 Win=501 Len=1240 [TCP PDU reassembled in 616]"
"652","14.959780","23.192.220.4","192.168.2.103","TCP","1394","[TCP Retransmission] 443  >  1191 [ACK] Seq=39026 Ack=169 Win=501 Len=1240 [TCP PDU reassembled in 670]"
"658","14.962671","23.192.220.4","192.168.2.103","TCP","1394","[TCP Retransmission] 443  >  1191 [PSH, ACK] Seq=32826 Ack=169 Win=501 Len=1240"
"659","14.962680","23.192.220.4","192.168.2.103","TCP","1394","[TCP Retransmission] 443  >  1191 [ACK] Seq=34066 Ack=169 Win=501 Len=1240 [TCP PDU reassembled in 638]"
"660","14.962684","23.192.220.4","192.168.2.103","TCP","1394","[TCP Retransmission] 443  >  1191 [ACK] Seq=35306 Ack=169 Win=501 Len=1240 [TCP PDU reassembled in 639]"
"673","14.965044","23.192.220.4","192.168.2.103","TCP","1394","[TCP Retransmission] 443  >  1191 [ACK] Seq=52666 Ack=169 Win=501 Len=1240 [TCP PDU reassembled in 685]"
"693","14.966569","23.192.220.4","192.168.2.103","TCP","1394","[TCP Retransmission] 443  >  1191 [ACK] Seq=62586 Ack=169 Win=501 Len=1240 [TCP PDU reassembled in 685]"
"694","14.966578","23.192.220.4","192.168.2.103","TCP","1394","[TCP Retransmission] 443  >  1191 [ACK] Seq=63826 Ack=169 Win=501 Len=1240 [TCP PDU reassembled in 685]"
"695","14.966582","23.192.220.4","192.168.2.103","TCP","1394","[TCP Retransmission] 443  >  1191 [ACK] Seq=65066 Ack=169 Win=501 Len=1240 [TCP PDU reassembled in 685]"
"697","14.966590","23.192.220.4","192.168.2.103","TCP","1394","[TCP Retransmission] 443  >  1191 [PSH, ACK] Seq=67546 Ack=169 Win=501 Len=1240"
"698","14.966594","23.192.220.4","192.168.2.103","TCP","1394","[TCP Retransmission] 443  >  1191 [ACK] Seq=68786 Ack=169 Win=501 Len=1240 [TCP PDU reassembled in 687]"
"699","14.966598","23.192.220.4","192.168.2.103","TCP","314","[TCP Retransmission] 443  >  1191 [PSH, ACK] Seq=70026 Ack=169 Win=501 Len=160 [TCP PDU reassembled in 687]"
"715","14.969729","23.192.220.4","192.168.2.103","TCP","1394","[TCP Retransmission] 443  >  1191 [ACK] Seq=66306 Ack=169 Win=501 Len=1240 [TCP PDU reassembled in 685]"
"716","14.969735","23.192.220.4","192.168.2.103","TCP","1394","[TCP Retransmission] 443  >  1191 [PSH, ACK] Seq=67546 Ack=169 Win=501 Len=1240"
"717","14.969738","23.192.220.4","192.168.2.103","TCP","1394","[TCP Retransmission] 443  >  1191 [ACK] Seq=68786 Ack=169 Win=501 Len=1240 [TCP PDU reassembled in 687]"
"718","14.969742","23.192.220.4","192.168.2.103","TCP","314","[TCP Retransmission] 443  >  1191 [PSH, ACK] Seq=70026 Ack=169 Win=501 Len=160 [TCP PDU reassembled in 687]"
"764","15.127100","192.168.2.103","157.240.26.49","TCP","272","[TCP Retransmission] 1222  >  443 [PSH, ACK] Seq=220 Ack=3568 Win=256 Len=126"
"769","15.137101","157.240.26.49","192.168.2.103","TCP","227","[TCP Retransmission] 443  >  1222 [PSH, ACK] Seq=3619 Ack=346 Win=66816 Len=81"
"789","15.139227","192.168.2.103","157.240.26.49","TCP","184","[TCP Retransmission] 1222  >  443 [PSH, ACK] Seq=7807 Ack=3700 Win=256 Len=38"
"793","15.139848","192.168.2.103","157.240.26.49","TCP","1394","[TCP Retransmission] 1222  >  443 [ACK] Seq=5500 Ack=3619 Win=256 Len=1240 [TCP PDU reassembled in 782]"
"794","15.139856","192.168.2.103","157.240.26.49","TCP","1221","[TCP Retransmission] 1222  >  443 [PSH, ACK] Seq=6740 Ack=3619 Win=256 Len=1067 [TCP PDU reassembled in 782]"
"797","15.140665","192.168.2.103","157.240.26.49","TCP","1394","[TCP Retransmission] 1222  >  443 [ACK] Seq=5500 Ack=3619 Win=256 Len=1240 [TCP PDU reassembled in 782]"
"798","15.140669","192.168.2.103","157.240.26.49","TCP","1221","[TCP Retransmission] 1222  >  443 [PSH, ACK] Seq=6740 Ack=3619 Win=256 Len=1067 [TCP PDU reassembled in 782]"
"878","15.244300","192.168.2.103","157.240.26.49","TCP","1386","[TCP Retransmission] 1222  >  443 [ACK] Seq=15171 Ack=9770 Win=256 Len=1240"
"887","15.256139","157.240.26.49","192.168.2.103","TCP","188","[TCP Retransmission] 443  >  1222 [PSH, ACK] Seq=9770 Ack=22410 Win=116224 Len=42"
"912","15.296852","192.168.2.103","157.240.26.49","TCP","196","[TCP Retransmission] 1222  >  443 [PSH, ACK] Seq=22410 Ack=12887 Win=256 Len=42"
"913","15.298086","192.168.2.103","157.240.26.49","TCP","1394","[TCP Retransmission] 1222  >  443 [ACK] Seq=22452 Ack=12887 Win=256 Len=1240"
"914","15.298093","192.168.2.103","157.240.26.49","TCP","1394","[TCP Retransmission] 1222  >  443 [ACK] Seq=23692 Ack=12887 Win=256 Len=1240 [TCP PDU reassembled in 908]"
"915","15.298095","192.168.2.103","157.240.26.49","TCP","1394","[TCP Retransmission] 1222  >  443 [ACK] Seq=24932 Ack=12887 Win=256 Len=1240 [TCP PDU reassembled in 908]"
"916","15.298098","192.168.2.103","157.240.26.49","TCP","1394","[TCP Retransmission] 1222  >  443 [ACK] Seq=26172 Ack=12887 Win=256 Len=1240 [TCP PDU reassembled in 908]"
"917","15.298101","192.168.2.103","157.240.26.49","TCP","1394","[TCP Retransmission] 1222  >  443 [ACK] Seq=27412 Ack=12887 Win=256 Len=1240 [TCP PDU reassembled in 908]"
"918","15.298104","192.168.2.103","157.240.26.49","TCP","1193","[TCP Retransmission] 1222  >  443 [PSH, ACK] Seq=28652 Ack=12887 Win=256 Len=1039 [TCP PDU reassembled in 908]"
"1032","16.048577","192.168.2.103","157.240.26.49","TCP","1386","[TCP Retransmission] 1222  >  443 [ACK] Seq=45535 Ack=21769 Win=256 Len=1240 [TCP PDU reassembled in 1028]"
"1138","16.417045","157.240.26.49","192.168.2.103","TCP","189","[TCP Retransmission] 443  >  1225 [PSH, ACK] Seq=4657 Ack=2902 Win=71168 Len=35"
"1139","16.417055","157.240.26.49","192.168.2.103","TCP","189","[TCP Retransmission] 443  >  1225 [PSH, ACK] Seq=4692 Ack=2902 Win=71168 Len=35"
"1168","16.646776","192.168.2.103","157.240.26.49","TCP","556","[TCP Retransmission] 1225  >  443 [PSH, ACK] Seq=3238 Ack=4980 Win=65536 Len=402"
"1169","16.646787","192.168.2.103","157.240.26.49","TCP","490","[TCP Retransmission] 1225  >  443 [PSH, ACK] Seq=3640 Ack=4980 Win=65536 Len=336"
"1248","18.006504","157.240.26.49","192.168.2.103","TCP","1394","[TCP Retransmission] 443  >  1225 [PSH, ACK] Seq=18759 Ack=3976 Win=77056 Len=1240 [TCP PDU reassembled in 1251]"
"1304","18.016941","157.240.26.49","192.168.2.103","TCP","1394","[TCP Fast Retransmission] 443  >  1225 [ACK] Seq=42319 Ack=3976 Win=77056 Len=1240 [TCP PDU reassembled in 1291]"
"1305","18.016944","157.240.26.49","192.168.2.103","TCP","1394","[TCP Retransmission] 443  >  1225 [PSH, ACK] Seq=43559 Ack=3976 Win=77056 Len=1240 [TCP PDU reassembled in 1291]"
"1307","18.016951","157.240.26.49","192.168.2.103","TCP","1394","[TCP Retransmission] 443  >  1225 [PSH, ACK] Seq=46039 Ack=3976 Win=77056 Len=1240 [TCP PDU reassembled in 1324]"
"1313","18.017566","157.240.26.49","192.168.2.103","TCP","1386","[TCP Retransmission] 443  >  1225 [ACK] Seq=44799 Ack=3976 Win=77056 Len=1240 [TCP PDU reassembled in 1324]"
"1338","18.025836","157.240.26.49","192.168.2.103","TCP","1394","[TCP Retransmission] 443  >  1225 [ACK] Seq=54719 Ack=3976 Win=77056 Len=1240 [TCP PDU reassembled in 1329]"
"1354","18.028965","157.240.26.49","192.168.2.103","TCP","1386","[TCP Retransmission] 443  >  1225 [PSH, ACK] Seq=58439 Ack=3976 Win=77056 Len=1240 [TCP PDU reassembled in 1341]"
"1356","18.031425","157.240.26.49","192.168.2.103","TCP","1394","[TCP Retransmission] 443  >  1225 [ACK] Seq=59679 Ack=3976 Win=77056 Len=1240 [TCP PDU reassembled in 1342]"
"1357","18.031431","157.240.26.49","192.168.2.103","TCP","1394","[TCP Retransmission] 443  >  1225 [ACK] Seq=60919 Ack=3976 Win=77056 Len=1240 [TCP PDU reassembled in 1372]"
"1367","18.034728","157.240.26.49","192.168.2.103","TCP","1394","[TCP Retransmission] 443  >  1225 [ACK] Seq=62159 Ack=3976 Win=77056 Len=1240 [TCP PDU reassembled in 1372]"
"1368","18.034732","157.240.26.49","192.168.2.103","TCP","1394","[TCP Retransmission] 443  >  1225 [ACK] Seq=63399 Ack=3976 Win=77056 Len=1240 [TCP PDU reassembled in 1372]"
"1369","18.034737","157.240.26.49","192.168.2.103","TCP","1394","[TCP Retransmission] 443  >  1225 [PSH, ACK] Seq=64639 Ack=3976 Win=77056 Len=1240 [TCP PDU reassembled in 1372]"
"1370","18.034741","157.240.26.49","192.168.2.103","TCP","1394","[TCP Retransmission] 443  >  1225 [ACK] Seq=65879 Ack=3976 Win=77056 Len=1240 [TCP PDU reassembled in 1372]"
"1371","18.034746","157.240.26.49","192.168.2.103","TCP","1394","[TCP Retransmission] 443  >  1225 [ACK] Seq=67119 Ack=3976 Win=77056 Len=1240 [TCP PDU reassembled in 1372]"
"1373","18.034754","157.240.26.49","192.168.2.103","TCP","1394","[TCP Retransmission] 443  >  1225 [ACK] Seq=69599 Ack=3976 Win=77056 Len=1240 [TCP PDU reassembled in 1372]"
"1374","18.034759","157.240.26.49","192.168.2.103","TCP","1394","[TCP Retransmission] 443  >  1225 [ACK] Seq=70839 Ack=3976 Win=77056 Len=1240 [TCP PDU reassembled in 1372]"
"1375","18.034762","157.240.26.49","192.168.2.103","TCP","1394","[TCP Retransmission] 443  >  1225 [PSH, ACK] Seq=72079 Ack=3976 Win=77056 Len=1240 [TCP PDU reassembled in 1376]"
"1396","18.039222","157.240.26.49","192.168.2.103","TCP","1394","[TCP Retransmission] 443  >  1225 [ACK] Seq=63399 Ack=3976 Win=77056 Len=1240 [TCP PDU reassembled in 1372]"
"1397","18.039226","157.240.26.49","192.168.2.103","TCP","1394","[TCP Retransmission] 443  >  1225 [PSH, ACK] Seq=64639 Ack=3976 Win=77056 Len=1240 [TCP PDU reassembled in 1372]"
"1398","18.039229","157.240.26.49","192.168.2.103","TCP","1394","[TCP Retransmission] 443  >  1225 [ACK] Seq=65879 Ack=3976 Win=77056 Len=1240 [TCP PDU reassembled in 1372]"
"1399","18.039232","157.240.26.49","192.168.2.103","TCP","1394","[TCP Retransmission] 443  >  1225 [ACK] Seq=67119 Ack=3976 Win=77056 Len=1240 [TCP PDU reassembled in 1372]"
"1400","18.039235","157.240.26.49","192.168.2.103","TCP","1394","[TCP Retransmission] 443  >  1225 [ACK] Seq=68359 Ack=3976 Win=77056 Len=1240 [TCP PDU reassembled in 1372]"
"1401","18.039238","157.240.26.49","192.168.2.103","TCP","1394","[TCP Retransmission] 443  >  1225 [ACK] Seq=69599 Ack=3976 Win=77056 Len=1240 [TCP PDU reassembled in 1372]"
"1402","18.039241","157.240.26.49","192.168.2.103","TCP","1394","[TCP Retransmission] 443  >  1225 [ACK] Seq=70839 Ack=3976 Win=77056 Len=1240 [TCP PDU reassembled in 1372]"
"1408","18.041869","157.240.26.49","192.168.2.103","TCP","1394","[TCP Retransmission] 443  >  1225 [PSH, ACK] Seq=72079 Ack=3976 Win=77056 Len=1240 [TCP PDU reassembled in 1376]"
"1409","18.041872","157.240.26.49","192.168.2.103","TCP","1394","[TCP Retransmission] 443  >  1225 [ACK] Seq=73319 Ack=3976 Win=77056 Len=1240 [TCP PDU reassembled in 1376]"
"1412","18.043835","157.240.26.49","192.168.2.103","TCP","1394","[TCP Retransmission] 443  >  1225 [ACK] Seq=74559 Ack=3976 Win=77056 Len=1240 [TCP PDU reassembled in 1377]"
"1424","18.045206","157.240.26.49","192.168.2.103","TCP","1394","[TCP Retransmission] 443  >  1225 [ACK] Seq=65879 Ack=3976 Win=77056 Len=1240 [TCP PDU reassembled in 1372]"
"1426","18.045212","157.240.26.49","192.168.2.103","TCP","1394","[TCP Retransmission] 443  >  1225 [ACK] Seq=68359 Ack=3976 Win=77056 Len=1240 [TCP PDU reassembled in 1372]"
"1427","18.045216","157.240.26.49","192.168.2.103","TCP","1394","[TCP Retransmission] 443  >  1225 [ACK] Seq=69599 Ack=3976 Win=77056 Len=1240 [TCP PDU reassembled in 1372]"
"1428","18.045219","157.240.26.49","192.168.2.103","TCP","1394","[TCP Retransmission] 443  >  1225 [ACK] Seq=70839 Ack=3976 Win=77056 Len=1240 [TCP PDU reassembled in 1372]"
"1437","18.048263","157.240.26.49","192.168.2.103","TCP","1394","[TCP Retransmission] 443  >  1225 [ACK] Seq=99359 Ack=3976 Win=77056 Len=1240"
"1438","18.048268","157.240.26.49","192.168.2.103","TCP","599","[TCP Retransmission] 443  >  1225 [PSH, ACK] Seq=100599 Ack=3976 Win=77056 Len=445"
"1439","18.048272","157.240.26.49","192.168.2.103","TCP","1394","[TCP Retransmission] 443  >  1225 [ACK] Seq=65879 Ack=3976 Win=77056 Len=1240 [TCP PDU reassembled in 1372]"
"1440","18.048276","157.240.26.49","192.168.2.103","TCP","1394","[TCP Retransmission] 443  >  1225 [ACK] Seq=67119 Ack=3976 Win=77056 Len=1240 [TCP PDU reassembled in 1372]"
"1441","18.048280","157.240.26.49","192.168.2.103","TCP","1394","[TCP Retransmission] 443  >  1225 [ACK] Seq=68359 Ack=3976 Win=77056 Len=1240 [TCP PDU reassembled in 1372]"
"1442","18.048284","157.240.26.49","192.168.2.103","TCP","1394","[TCP Retransmission] 443  >  1225 [ACK] Seq=69599 Ack=3976 Win=77056 Len=1240 [TCP PDU reassembled in 1372]"
"1443","18.048288","157.240.26.49","192.168.2.103","TCP","1394","[TCP Retransmission] 443  >  1225 [ACK] Seq=70839 Ack=3976 Win=77056 Len=1240 [TCP PDU reassembled in 1372]"
"1445","18.048740","157.240.26.49","192.168.2.103","TCP","1386","[TCP Retransmission] 443  >  1225 [ACK] Seq=99359 Ack=3976 Win=77056 Len=1240"
"1459","18.316839","157.240.26.49","192.168.2.103","TCP","348","[TCP Retransmission] 443  >  1225 [ACK] Seq=101044 Ack=3976 Win=77056 Len=202"
"1492","18.325064","157.240.26.49","192.168.2.103","TCP","1394","[TCP Spurious Retransmission] 443  >  1225 [ACK] Seq=110109 Ack=3976 Win=77056 Len=1240 [TCP PDU reassembled in 1480]"
"1493","18.325074","157.240.26.49","192.168.2.103","TCP","1394","[TCP Spurious Retransmission] 443  >  1225 [ACK] Seq=111349 Ack=3976 Win=77056 Len=1240 [TCP PDU reassembled in 1480]"
"1495","18.325086","157.240.26.49","192.168.2.103","TCP","1394","[TCP Spurious Retransmission] 443  >  1225 [ACK] Seq=113829 Ack=3976 Win=77056 Len=1240 [TCP PDU reassembled in 1480]"
"1496","18.325099","157.240.26.49","192.168.2.103","TCP","1394","[TCP Spurious Retransmission] 443  >  1225 [ACK] Seq=115069 Ack=3976 Win=77056 Len=1240 [TCP PDU reassembled in 1480]"
"1528","18.336864","157.240.26.49","192.168.2.103","TCP","1394","[TCP Retransmission] 443  >  1225 [ACK] Seq=130408 Ack=3976 Win=77056 Len=1240 [TCP PDU reassembled in 1552]"
"1529","18.336874","157.240.26.49","192.168.2.103","TCP","1394","[TCP Retransmission] 443  >  1225 [PSH, ACK] Seq=131648 Ack=3976 Win=77056 Len=1240 [TCP PDU reassembled in 1552]"
"1550","18.342379","157.240.26.49","192.168.2.103","TCP","1394","[TCP Retransmission] 443  >  1225 [PSH, ACK] Seq=151488 Ack=3976 Win=77056 Len=1240 [TCP PDU reassembled in 1561]"
"1697","19.963201","192.168.2.103","34.107.172.168","TCP","289","[TCP Retransmission] 1228  >  443 [PSH, ACK] Seq=2090 Ack=220 Win=66048 Len=135"
"1723","19.987530","192.168.2.103","34.107.172.168","TCP","1386","[TCP Retransmission] 1228  >  443 [ACK] Seq=678 Ack=220 Win=66048 Len=1240"
"1735","20.006226","192.168.2.103","34.107.172.168","TCP","1394","[TCP Retransmission] 1228  >  443 [ACK] Seq=678 Ack=220 Win=66048 Len=1240"
"1736","20.006235","192.168.2.103","34.107.172.168","TCP","326","[TCP Retransmission] 1228  >  443 [ACK] Seq=1918 Ack=220 Win=66048 Len=172"
"1845","20.149574","192.168.2.103","34.36.199.114","TCP","828","[TCP Retransmission] 1233  >  443 [PSH, ACK] Seq=1 Ack=1 Win=66304 Len=674"
"1846","20.149577","192.168.2.103","34.36.199.114","TCP","828","[TCP Retransmission] 1234  >  443 [PSH, ACK] Seq=1 Ack=1 Win=66304 Len=674"
"1847","20.149581","192.168.2.103","34.36.199.114","TCP","828","[TCP Retransmission] 1237  >  443 [PSH, ACK] Seq=1 Ack=1 Win=66304 Len=674"
"1886","20.175426","192.168.2.103","34.36.199.114","TCP","517","[TCP Retransmission] 1231  >  443 [PSH, ACK] Seq=675 Ack=220 Win=66048 Len=371"
"1950","20.207270","192.168.2.103","34.36.199.114","TCP","441","[TCP Retransmission] 1230  >  443 [PSH, ACK] Seq=1046 Ack=1073 Win=65280 Len=287"
"1951","20.207273","192.168.2.103","34.36.199.114","TCP","443","[TCP Retransmission] 1236  >  443 [PSH, ACK] Seq=1046 Ack=965 Win=65280 Len=289"
"1952","20.207276","192.168.2.103","34.36.199.114","TCP","447","[TCP Retransmission] 1234  >  443 [PSH, ACK] Seq=1044 Ack=965 Win=65280 Len=293"
"2025","20.229551","192.168.2.103","34.36.199.114","TCP","452","[TCP Retransmission] 1231  >  443 [PSH, ACK] Seq=1331 Ack=1274 Win=65024 Len=306"
"2115","20.253973","192.168.2.103","34.36.199.114","TCP","478","[TCP Retransmission] 1231  >  443 [PSH, ACK] Seq=1637 Ack=1475 Win=66304 Len=332"
"2119","20.254755","34.36.199.114","192.168.2.103","TCP","355","[TCP Retransmission] 443  >  1230 [PSH, ACK] Seq=1274 Ack=1633 Win=268288 Len=201"
"2120","20.254757","34.36.199.114","192.168.2.103","TCP","355","[TCP Retransmission] 443  >  1235 [PSH, ACK] Seq=1166 Ack=1632 Win=268288 Len=201"
"2127","20.255266","34.36.199.114","192.168.2.103","TCP","355","[TCP Retransmission] 443  >  1230 [PSH, ACK] Seq=1274 Ack=1633 Win=268288 Len=201"
"2128","20.255268","34.36.199.114","192.168.2.103","TCP","355","[TCP Retransmission] 443  >  1235 [PSH, ACK] Seq=1166 Ack=1632 Win=268288 Len=201"
"2172","20.269314","192.168.2.103","34.36.199.114","TCP","482","[TCP Retransmission] 1233  >  443 [PSH, ACK] Seq=1910 Ack=1568 Win=66304 Len=336"
"2183","20.271152","192.168.2.103","34.36.199.114","TCP","483","[TCP Retransmission] 1239  >  443 [PSH, ACK] Seq=1913 Ack=1568 Win=66304 Len=337"
"2188","20.272101","192.168.2.103","34.36.199.114","TCP","483","[TCP Retransmission] 1239  >  443 [PSH, ACK] Seq=1913 Ack=1568 Win=66304 Len=337"
"2203","20.275049","192.168.2.103","34.36.199.114","TCP","490","[TCP Retransmission] 1236  >  443 [PSH, ACK] Seq=1919 Ack=1568 Win=66304 Len=344"
"2206","20.276360","192.168.2.103","34.36.199.114","TCP","490","[TCP Retransmission] 1236  >  443 [PSH, ACK] Seq=1919 Ack=1568 Win=66304 Len=344"
"2223","20.281047","192.168.2.103","34.36.199.114","TCP","490","[TCP Retransmission] 1235  >  443 [PSH, ACK] Seq=1966 Ack=1552 Win=66304 Len=344"
"2261","20.296147","34.36.199.114","192.168.2.103","TCP","331","[TCP Retransmission] 443  >  1234 [PSH, ACK] Seq=1568 Ack=2248 Win=267776 Len=185"
"2264","20.296899","34.36.199.114","192.168.2.103","TCP","331","[TCP Retransmission] 443  >  1234 [PSH, ACK] Seq=1568 Ack=2248 Win=267776 Len=185"
"2315","20.311194","192.168.2.103","34.36.199.114","TCP","481","[TCP Retransmission] 1231  >  443 [PSH, ACK] Seq=2306 Ack=1845 Win=65792 Len=335"
"2334","20.315671","192.168.2.103","34.36.199.114","TCP","492","[TCP Retransmission] 1238  >  443 [PSH, ACK] Seq=2280 Ack=1737 Win=66048 Len=346"
"2444","20.351341","34.36.199.114","192.168.2.103","TCP","146","[TCP Retransmission] 443  >  1237 [FIN, ACK] Seq=1922 Ack=2630 Win=267520 Len=0"
"2565","21.581005","192.168.2.103","157.240.26.35","TCP","487","[TCP Retransmission] 1240  >  443 [PSH, ACK] Seq=1 Ack=1 Win=65536 Len=341"
"2581","21.582739","192.168.2.103","157.240.26.35","TCP","487","[TCP Retransmission] 1242  >  443 [PSH, ACK] Seq=1 Ack=1 Win=65536 Len=341"
"2610","21.593826","192.168.2.103","157.240.26.35","TCP","495","[TCP Retransmission] 1243  >  443 [PSH, ACK] Seq=1 Ack=1 Win=65536 Len=341"
"2611","21.593830","192.168.2.103","157.240.26.35","TCP","495","[TCP Retransmission] 1241  >  443 [PSH, ACK] Seq=1 Ack=1 Win=65536 Len=341"
"2796","21.741201","157.240.26.35","192.168.2.103","TCP","1394","[TCP Retransmission] 443  >  1243 [PSH, ACK] Seq=21434 Ack=601 Win=67840 Len=1240"
"2824","21.745363","157.240.26.35","192.168.2.103","TCP","1230","[TCP Retransmission] 443  >  1241 [PSH, ACK] Seq=6947 Ack=596 Win=67840 Len=1076"
"3076","26.613589","192.168.2.103","142.250.191.170","TCP","1566","[TCP Retransmission] 1246  >  443 [ACK] Seq=429 Ack=4690 Win=66048 Len=1412"
"3077","26.613597","192.168.2.103","142.250.191.170","TCP","675","[TCP Retransmission] 1246  >  443 [PSH, ACK] Seq=1841 Ack=4690 Win=66048 Len=521 [TCP PDU reassembled in 3073]"
"3083","26.614602","192.168.2.103","142.250.191.170","TCP","1386","[TCP Retransmission] 1246  >  443 [ACK] Seq=429 Ack=4690 Win=66048 Len=1240"
"3091","26.623074","192.168.2.103","142.250.191.170","TCP","839","[TCP Retransmission] 1246  >  443 [PSH, ACK] Seq=1669 Ack=4690 Win=66048 Len=693 [TCP PDU reassembled in 3073]"
"3094","26.623538","192.168.2.103","142.250.191.170","TCP","839","[TCP Retransmission] 1246  >  443 [PSH, ACK] Seq=1669 Ack=4690 Win=66048 Len=693 [TCP PDU reassembled in 3073]"
"3098","26.628589","192.168.2.103","142.250.191.170","TCP","839","[TCP Retransmission] 1246  >  443 [PSH, ACK] Seq=1669 Ack=4690 Win=66048 Len=693 [TCP PDU reassembled in 3073]"
"3101","26.629841","192.168.2.103","142.250.191.170","TCP","839","[TCP Retransmission] 1246  >  443 [PSH, ACK] Seq=1669 Ack=4690 Win=66048 Len=693 [TCP PDU reassembled in 3073]"
"3104","26.631876","192.168.2.103","142.250.191.170","TCP","839","[TCP Retransmission] 1246  >  443 [PSH, ACK] Seq=1669 Ack=4690 Win=66048 Len=693 [TCP PDU reassembled in 3073]"
"3140","28.717257","192.168.2.103","142.250.191.170","TCP","1386","[TCP Retransmission] 1246  >  443 [ACK] Seq=2362 Ack=5323 Win=65280 Len=1240"
"3185","30.063877","192.168.2.103","34.107.172.168","TCP","1147","[TCP Retransmission] 1228  >  443 [PSH, ACK] Seq=2225 Ack=983 Win=65280 Len=1001"
"3451","41.459076","157.240.26.49","192.168.2.103","TCP","181","[TCP Retransmission] 443  >  1101 [PSH, ACK] Seq=1 Ack=1061 Win=462 Len=35"
"3465","41.717800","192.168.2.103","142.250.191.170","TCP","158","[TCP Retransmission] 1251  >  443 [SYN] Seq=0 Win=64480 Len=0 MSS=1460 WS=256 SACK_PERM"
"3468","41.720208","192.168.2.103","142.250.191.170","TCP","158","[TCP Retransmission] 1251  >  443 [SYN] Seq=0 Win=64480 Len=0 MSS=1460 WS=256 SACK_PERM"
"3481","41.730130","192.168.2.103","142.250.191.170","TCP","489","[TCP Retransmission] 1251  >  443 [PSH, ACK] Seq=1 Ack=1 Win=65536 Len=343"
"3564","42.407529","142.250.191.170","192.168.2.103","TCP","1394","[TCP Spurious Retransmission] 443  >  1251 [ACK] Seq=10891 Ack=1003 Win=269056 Len=1240"
"3565","42.407543","142.250.191.170","192.168.2.103","TCP","1394","[TCP Spurious Retransmission] 443  >  1251 [PSH, ACK] Seq=12131 Ack=1003 Win=269056 Len=1240"
"3566","42.407547","142.250.191.170","192.168.2.103","TCP","1394","[TCP Spurious Retransmission] 443  >  1251 [ACK] Seq=13371 Ack=1003 Win=269056 Len=1240"
"3567","42.407551","142.250.191.170","192.168.2.103","TCP","1394","[TCP Spurious Retransmission] 443  >  1251 [ACK] Seq=14611 Ack=1003 Win=269056 Len=1240"
"3569","42.407561","142.250.191.170","192.168.2.103","TCP","1394","[TCP Spurious Retransmission] 443  >  1251 [ACK] Seq=17091 Ack=1003 Win=269056 Len=1240"
"3570","42.407565","142.250.191.170","192.168.2.103","TCP","935","[TCP Spurious Retransmission] 443  >  1251 [PSH, ACK] Seq=18331 Ack=1003 Win=269056 Len=781"
"3571","42.407576","142.250.191.170","192.168.2.103","TCP","1394","[TCP Spurious Retransmission] 443  >  1251 [ACK] Seq=19112 Ack=1003 Win=269056 Len=1240"
"3572","42.407580","142.250.191.170","192.168.2.103","TCP","233","[TCP Spurious Retransmission] 443  >  1251 [PSH, ACK] Seq=20352 Ack=1003 Win=269056 Len=79"
"3741","42.441189","142.250.191.170","192.168.2.103","TCP","1394","[TCP Retransmission] 443  >  1251 [ACK] Seq=104751 Ack=1003 Win=269056 Len=1240 [TCP PDU reassembled in 3718]"
"3742","42.441194","142.250.191.170","192.168.2.103","TCP","1394","[TCP Retransmission] 443  >  1251 [PSH, ACK] Seq=105991 Ack=1003 Win=269056 Len=1240 [TCP PDU reassembled in 3719]"
"3743","42.441198","142.250.191.170","192.168.2.103","TCP","1394","[TCP Retransmission] 443  >  1251 [ACK] Seq=107231 Ack=1003 Win=269056 Len=1240 [TCP PDU reassembled in 3720]"
"3744","42.441202","142.250.191.170","192.168.2.103","TCP","1394","[TCP Retransmission] 443  >  1251 [ACK] Seq=108471 Ack=1003 Win=269056 Len=1240 [TCP PDU reassembled in 3721]"
"3745","42.441206","142.250.191.170","192.168.2.103","TCP","1394","[TCP Retransmission] 443  >  1251 [ACK] Seq=109711 Ack=1003 Win=269056 Len=1240 [TCP PDU reassembled in 3722]"
"3789","42.449640","142.250.191.170","192.168.2.103","TCP","1394","[TCP Retransmission] 443  >  1251 [ACK] Seq=154167 Ack=1003 Win=269056 Len=1240"
"3790","42.449643","142.250.191.170","192.168.2.103","TCP","1394","[TCP Retransmission] 443  >  1251 [ACK] Seq=136807 Ack=1003 Win=269056 Len=1240 [TCP PDU reassembled in 3768]"
"3791","42.449647","142.250.191.170","192.168.2.103","TCP","1394","[TCP Retransmission] 443  >  1251 [ACK] Seq=138047 Ack=1003 Win=269056 Len=1240 [TCP PDU reassembled in 3769]"
"3795","42.449659","142.250.191.170","192.168.2.103","TCP","1394","[TCP Retransmission] 443  >  1251 [ACK] Seq=143007 Ack=1003 Win=269056 Len=1240"
"3796","42.449662","142.250.191.170","192.168.2.103","TCP","1394","[TCP Retransmission] 443  >  1251 [ACK] Seq=144247 Ack=1003 Win=269056 Len=1240"
"4054","42.498380","142.250.191.170","192.168.2.103","TCP","1394","[TCP Retransmission] 443  >  1251 [ACK] Seq=319087 Ack=1003 Win=269056 Len=1240"
"4055","42.498384","142.250.191.170","192.168.2.103","TCP","1394","[TCP Retransmission] 443  >  1251 [ACK] Seq=329007 Ack=1003 Win=269056 Len=1240"
"4056","42.498388","142.250.191.170","192.168.2.103","TCP","1394","[TCP Retransmission] 443  >  1251 [ACK] Seq=330247 Ack=1003 Win=269056 Len=1240"
"4106","42.509601","142.250.191.170","192.168.2.103","TCP","1394","[TCP Retransmission] 443  >  1251 [ACK] Seq=338927 Ack=1003 Win=269056 Len=1240"
"4107","42.509603","142.250.191.170","192.168.2.103","TCP","1394","[TCP Retransmission] 443  >  1251 [ACK] Seq=340167 Ack=1003 Win=269056 Len=1240"
"4108","42.509606","142.250.191.170","192.168.2.103","TCP","1394","[TCP Retransmission] 443  >  1251 [ACK] Seq=341407 Ack=1003 Win=269056 Len=1240"
"4109","42.509608","142.250.191.170","192.168.2.103","TCP","1394","[TCP Retransmission] 443  >  1251 [ACK] Seq=342647 Ack=1003 Win=269056 Len=1240"
"4112","42.509615","142.250.191.170","192.168.2.103","TCP","1394","[TCP Retransmission] 443  >  1251 [ACK] Seq=346367 Ack=1003 Win=269056 Len=1240"
"4113","42.509617","142.250.191.170","192.168.2.103","TCP","1394","[TCP Retransmission] 443  >  1251 [PSH, ACK] Seq=347607 Ack=1003 Win=269056 Len=1240"
"4114","42.509620","142.250.191.170","192.168.2.103","TCP","1394","[TCP Retransmission] 443  >  1251 [ACK] Seq=348847 Ack=1003 Win=269056 Len=1240"
"4115","42.509622","142.250.191.170","192.168.2.103","TCP","1394","[TCP Retransmission] 443  >  1251 [ACK] Seq=350087 Ack=1003 Win=269056 Len=1240"
"4116","42.509625","142.250.191.170","192.168.2.103","TCP","1394","[TCP Retransmission] 443  >  1251 [ACK] Seq=351327 Ack=1003 Win=269056 Len=1240"
"4119","42.512122","142.250.191.170","192.168.2.103","TCP","1394","[TCP Retransmission] 443  >  1251 [ACK] Seq=353807 Ack=1003 Win=269056 Len=1240"
"4120","42.512126","142.250.191.170","192.168.2.103","TCP","1394","[TCP Retransmission] 443  >  1251 [ACK] Seq=355047 Ack=1003 Win=269056 Len=1240 [TCP PDU reassembled in 4082]"
"4193","42.523823","142.250.191.170","192.168.2.103","TCP","1394","[TCP Retransmission] 443  >  1251 [ACK] Seq=407127 Ack=1003 Win=269056 Len=1240 [TCP PDU reassembled in 4201]"
"4194","42.523827","142.250.191.170","192.168.2.103","TCP","1394","[TCP Retransmission] 443  >  1251 [PSH, ACK] Seq=408367 Ack=1003 Win=269056 Len=1240 [TCP PDU reassembled in 4201]"
"4195","42.523831","142.250.191.170","192.168.2.103","TCP","1394","[TCP Retransmission] 443  >  1251 [ACK] Seq=426967 Ack=1003 Win=269056 Len=1240 [TCP PDU reassembled in 4201]"
"4196","42.523835","142.250.191.170","192.168.2.103","TCP","1394","[TCP Retransmission] 443  >  1251 [ACK] Seq=428207 Ack=1003 Win=269056 Len=1240 [TCP PDU reassembled in 4201]"
"4197","42.523839","142.250.191.170","192.168.2.103","TCP","1394","[TCP Retransmission] 443  >  1251 [ACK] Seq=429447 Ack=1003 Win=269056 Len=1240 [TCP PDU reassembled in 4201]"
"4198","42.523894","142.250.191.170","192.168.2.103","TCP","1394","[TCP Retransmission] 443  >  1251 [ACK] Seq=430687 Ack=1003 Win=269056 Len=1240 [TCP PDU reassembled in 4201]"
"4199","42.523898","142.250.191.170","192.168.2.103","TCP","1394","[TCP Retransmission] 443  >  1251 [ACK] Seq=431927 Ack=1003 Win=269056 Len=1240 [TCP PDU reassembled in 4201]"
"4200","42.523901","142.250.191.170","192.168.2.103","TCP","1394","[TCP Retransmission] 443  >  1251 [PSH, ACK] Seq=433167 Ack=1003 Win=269056 Len=1240 [TCP PDU reassembled in 4201]"
"4218","42.529254","142.250.191.170","192.168.2.103","TCP","1394","[TCP Retransmission] 443  >  1251 [ACK] Seq=444327 Ack=1003 Win=269056 Len=1240"
"4219","42.529257","142.250.191.170","192.168.2.103","TCP","1394","[TCP Retransmission] 443  >  1251 [PSH, ACK] Seq=445567 Ack=1003 Win=269056 Len=1240"
"4220","42.529259","142.250.191.170","192.168.2.103","TCP","1394","[TCP Retransmission] 443  >  1251 [ACK] Seq=446807 Ack=1003 Win=269056 Len=1240"
"4221","42.529262","142.250.191.170","192.168.2.103","TCP","1394","[TCP Retransmission] 443  >  1251 [ACK] Seq=448047 Ack=1003 Win=269056 Len=1240"
"4222","42.529264","142.250.191.170","192.168.2.103","TCP","1394","[TCP Retransmission] 443  >  1251 [ACK] Seq=449287 Ack=1003 Win=269056 Len=1240"
"4223","42.529266","142.250.191.170","192.168.2.103","TCP","1394","[TCP Retransmission] 443  >  1251 [ACK] Seq=450527 Ack=1003 Win=269056 Len=1240"
"4224","42.529269","142.250.191.170","192.168.2.103","TCP","1394","[TCP Retransmission] 443  >  1251 [ACK] Seq=451767 Ack=1003 Win=269056 Len=1240"
"4272","42.541214","142.250.191.170","192.168.2.103","TCP","1394","[TCP Retransmission] 443  >  1251 [ACK] Seq=482767 Ack=1003 Win=269056 Len=1240"
"4274","42.541218","142.250.191.170","192.168.2.103","TCP","1394","[TCP Retransmission] 443  >  1251 [ACK] Seq=485247 Ack=1003 Win=269056 Len=1240"
"4275","42.541221","142.250.191.170","192.168.2.103","TCP","1394","[TCP Retransmission] 443  >  1251 [ACK] Seq=486487 Ack=1003 Win=269056 Len=1240"
"4276","42.541223","142.250.191.170","192.168.2.103","TCP","1394","[TCP Retransmission] 443  >  1251 [ACK] Seq=487727 Ack=1003 Win=269056 Len=1240"
"4277","42.541226","142.250.191.170","192.168.2.103","TCP","1394","[TCP Retransmission] 443  >  1251 [ACK] Seq=488967 Ack=1003 Win=269056 Len=1240"
"4278","42.541228","142.250.191.170","192.168.2.103","TCP","1394","[TCP Retransmission] 443  >  1251 [ACK] Seq=490207 Ack=1003 Win=269056 Len=1240"
"4279","42.541230","142.250.191.170","192.168.2.103","TCP","1394","[TCP Retransmission] 443  >  1251 [PSH, ACK] Seq=491447 Ack=1003 Win=269056 Len=1240"
"4280","42.541232","142.250.191.170","192.168.2.103","TCP","1394","[TCP Retransmission] 443  >  1251 [ACK] Seq=492687 Ack=1003 Win=269056 Len=1240"
"4281","42.541234","142.250.191.170","192.168.2.103","TCP","1394","[TCP Retransmission] 443  >  1251 [PSH, ACK] Seq=493927 Ack=1003 Win=269056 Len=1240"
"4282","42.541236","142.250.191.170","192.168.2.103","TCP","1394","[TCP Retransmission] 443  >  1251 [ACK] Seq=495167 Ack=1003 Win=269056 Len=1240"
"4283","42.541238","142.250.191.170","192.168.2.103","TCP","1394","[TCP Retransmission] 443  >  1251 [PSH, ACK] Seq=496407 Ack=1003 Win=269056 Len=1240"
"4284","42.541240","142.250.191.170","192.168.2.103","TCP","1394","[TCP Retransmission] 443  >  1251 [ACK] Seq=497647 Ack=1003 Win=269056 Len=1240"
"4285","42.541248","142.250.191.170","192.168.2.103","TCP","1394","[TCP Retransmission] 443  >  1251 [PSH, ACK] Seq=498887 Ack=1003 Win=269056 Len=1240"
"4325","42.550054","142.250.191.170","192.168.2.103","TCP","1394","[TCP Retransmission] 443  >  1251 [ACK] Seq=492687 Ack=1003 Win=269056 Len=1240"
"4326","42.550057","142.250.191.170","192.168.2.103","TCP","1394","[TCP Retransmission] 443  >  1251 [PSH, ACK] Seq=493927 Ack=1003 Win=269056 Len=1240"
"4327","42.550059","142.250.191.170","192.168.2.103","TCP","1394","[TCP Retransmission] 443  >  1251 [ACK] Seq=495167 Ack=1003 Win=269056 Len=1240"
"4328","42.550062","142.250.191.170","192.168.2.103","TCP","1394","[TCP Retransmission] 443  >  1251 [PSH, ACK] Seq=496407 Ack=1003 Win=269056 Len=1240"
"4329","42.550064","142.250.191.170","192.168.2.103","TCP","1394","[TCP Retransmission] 443  >  1251 [ACK] Seq=497647 Ack=1003 Win=269056 Len=1240"
"4330","42.550066","142.250.191.170","192.168.2.103","TCP","1394","[TCP Retransmission] 443  >  1251 [PSH, ACK] Seq=498887 Ack=1003 Win=269056 Len=1240"
"4331","42.550068","142.250.191.170","192.168.2.103","TCP","1394","[TCP Retransmission] 443  >  1251 [ACK] Seq=461687 Ack=1003 Win=269056 Len=1240"
"4332","42.550070","142.250.191.170","192.168.2.103","TCP","1394","[TCP Retransmission] 443  >  1251 [ACK] Seq=462927 Ack=1003 Win=269056 Len=1240"
"4333","42.550072","142.250.191.170","192.168.2.103","TCP","1394","[TCP Retransmission] 443  >  1251 [ACK] Seq=464167 Ack=1003 Win=269056 Len=1240"
"4334","42.550074","142.250.191.170","192.168.2.103","TCP","1394","[TCP Retransmission] 443  >  1251 [ACK] Seq=465407 Ack=1003 Win=269056 Len=1240"
"4335","42.550077","142.250.191.170","192.168.2.103","TCP","1394","[TCP Retransmission] 443  >  1251 [PSH, ACK] Seq=466647 Ack=1003 Win=269056 Len=1240"
"4337","42.550086","142.250.191.170","192.168.2.103","TCP","1394","[TCP Retransmission] 443  >  1251 [ACK] Seq=470367 Ack=1003 Win=269056 Len=1240"
"4349","42.555007","142.250.191.170","192.168.2.103","TCP","1394","[TCP Retransmission] 443  >  1251 [ACK] Seq=471607 Ack=1003 Win=269056 Len=1240"
"4350","42.555011","142.250.191.170","192.168.2.103","TCP","1394","[TCP Retransmission] 443  >  1251 [ACK] Seq=472847 Ack=1003 Win=269056 Len=1240"
"4351","42.555016","142.250.191.170","192.168.2.103","TCP","1394","[TCP Retransmission] 443  >  1251 [ACK] Seq=474087 Ack=1003 Win=269056 Len=1240"
"4352","42.555020","142.250.191.170","192.168.2.103","TCP","1394","[TCP Retransmission] 443  >  1251 [ACK] Seq=475327 Ack=1003 Win=269056 Len=1240"
"4353","42.555024","142.250.191.170","192.168.2.103","TCP","1394","[TCP Retransmission] 443  >  1251 [ACK] Seq=476567 Ack=1003 Win=269056 Len=1240"
"4354","42.555028","142.250.191.170","192.168.2.103","TCP","1394","[TCP Retransmission] 443  >  1251 [ACK] Seq=477807 Ack=1003 Win=269056 Len=1240"
"4370","42.557333","142.250.191.170","192.168.2.103","TCP","1394","[TCP Retransmission] 443  >  1251 [ACK] Seq=470367 Ack=1003 Win=269056 Len=1240"
"4417","42.566317","142.250.191.170","192.168.2.103","TCP","1394","[TCP Retransmission] 443  >  1251 [PSH, ACK] Seq=538567 Ack=1003 Win=269056 Len=1240"
"4418","42.566321","142.250.191.170","192.168.2.103","TCP","1394","[TCP Retransmission] 443  >  1251 [ACK] Seq=539807 Ack=1003 Win=269056 Len=1240"
"4437","42.569148","142.250.191.170","192.168.2.103","TCP","1394","[TCP Retransmission] 443  >  1251 [ACK] Seq=557167 Ack=1003 Win=269056 Len=1240"
"4496","42.578965","142.250.191.170","192.168.2.103","TCP","1394","[TCP Retransmission] 443  >  1251 [PSH, ACK] Seq=578247 Ack=1003 Win=269056 Len=1240"
"4568","42.591683","142.250.191.170","192.168.2.103","TCP","1394","[TCP Retransmission] 443  >  1251 [ACK] Seq=632807 Ack=1003 Win=269056 Len=1240"
"4642","42.614815","142.250.191.170","192.168.2.103","TCP","1394","[TCP Retransmission] 443  >  1251 [ACK] Seq=702247 Ack=1003 Win=269056 Len=1240"
"4691","42.624665","142.250.191.170","192.168.2.103","TCP","1394","[TCP Retransmission] 443  >  1251 [ACK] Seq=720847 Ack=1003 Win=269056 Len=1240"
"4710","42.627235","142.250.191.170","192.168.2.103","TCP","1386","[TCP Retransmission] 443  >  1251 [ACK] Seq=748127 Ack=1003 Win=269056 Len=1240"
"4713","42.631961","142.250.191.170","192.168.2.103","TCP","1394","[TCP Retransmission] 443  >  1251 [ACK] Seq=724567 Ack=1003 Win=269056 Len=1240"
"4734","42.636153","142.250.191.170","192.168.2.103","TCP","1394","[TCP Retransmission] 443  >  1251 [PSH, ACK] Seq=756807 Ack=1003 Win=269056 Len=1240"
"4735","42.636157","142.250.191.170","192.168.2.103","TCP","1394","[TCP Retransmission] 443  >  1251 [ACK] Seq=758047 Ack=1003 Win=269056 Len=1240"
"4736","42.636161","142.250.191.170","192.168.2.103","TCP","1394","[TCP Retransmission] 443  >  1251 [ACK] Seq=759287 Ack=1003 Win=269056 Len=1240"
"4739","42.636173","142.250.191.170","192.168.2.103","TCP","1394","[TCP Retransmission] 443  >  1251 [ACK] Seq=763007 Ack=1003 Win=269056 Len=1240"
"4746","42.638548","142.250.191.170","192.168.2.103","TCP","1394","[TCP Spurious Retransmission] 443  >  1251 [ACK] Seq=755567 Ack=1003 Win=269056 Len=1240"
"4747","42.638553","142.250.191.170","192.168.2.103","TCP","1394","[TCP Spurious Retransmission] 443  >  1251 [PSH, ACK] Seq=756807 Ack=1003 Win=269056 Len=1240"
"4748","42.638557","142.250.191.170","192.168.2.103","TCP","1394","[TCP Spurious Retransmission] 443  >  1251 [ACK] Seq=758047 Ack=1003 Win=269056 Len=1240"
"4749","42.638561","142.250.191.170","192.168.2.103","TCP","1394","[TCP Spurious Retransmission] 443  >  1251 [ACK] Seq=759287 Ack=1003 Win=269056 Len=1240"
"4750","42.638565","142.250.191.170","192.168.2.103","TCP","1394","[TCP Retransmission] 443  >  1251 [PSH, ACK] Seq=760527 Ack=1003 Win=269056 Len=1240"
"4751","42.638569","142.250.191.170","192.168.2.103","TCP","1394","[TCP Retransmission] 443  >  1251 [ACK] Seq=761767 Ack=1003 Win=269056 Len=1240"
"4752","42.638573","142.250.191.170","192.168.2.103","TCP","1394","[TCP Retransmission] 443  >  1251 [ACK] Seq=763007 Ack=1003 Win=269056 Len=1240"
"4794","42.646675","142.250.191.170","192.168.2.103","TCP","1394","[TCP Retransmission] 443  >  1251 [PSH, ACK] Seq=786567 Ack=1003 Win=269056 Len=1240"
"4795","42.646679","142.250.191.170","192.168.2.103","TCP","1394","[TCP Retransmission] 443  >  1251 [ACK] Seq=789047 Ack=1003 Win=269056 Len=1240"
"4814","42.655012","142.250.191.170","192.168.2.103","TCP","1394","[TCP Retransmission] 443  >  1251 [ACK] Seq=792767 Ack=1003 Win=269056 Len=1240"
"4815","42.655016","142.250.191.170","192.168.2.103","TCP","1394","[TCP Retransmission] 443  >  1251 [ACK] Seq=795247 Ack=1003 Win=269056 Len=1240"
"4833","42.658661","142.250.191.170","192.168.2.103","TCP","1394","[TCP Retransmission] 443  >  1251 [ACK] Seq=811367 Ack=1003 Win=269056 Len=1240"
"4834","42.658666","142.250.191.170","192.168.2.103","TCP","1394","[TCP Retransmission] 443  >  1251 [PSH, ACK] Seq=812607 Ack=1003 Win=269056 Len=1240"
"4835","42.658670","142.250.191.170","192.168.2.103","TCP","1394","[TCP Retransmission] 443  >  1251 [ACK] Seq=813847 Ack=1003 Win=269056 Len=1240"
"4836","42.658674","142.250.191.170","192.168.2.103","TCP","1394","[TCP Retransmission] 443  >  1251 [ACK] Seq=815087 Ack=1003 Win=269056 Len=1240"
"4837","42.658678","142.250.191.170","192.168.2.103","TCP","1394","[TCP Retransmission] 443  >  1251 [PSH, ACK] Seq=816327 Ack=1003 Win=269056 Len=1240"
"4838","42.658681","142.250.191.170","192.168.2.103","TCP","1394","[TCP Retransmission] 443  >  1251 [ACK] Seq=817567 Ack=1003 Win=269056 Len=1240"
"4839","42.658685","142.250.191.170","192.168.2.103","TCP","1394","[TCP Retransmission] 443  >  1251 [ACK] Seq=818807 Ack=1003 Win=269056 Len=1240"
"4896","42.670336","142.250.191.170","192.168.2.103","TCP","1394","[TCP Retransmission] 443  >  1251 [PSH, ACK] Seq=842367 Ack=1003 Win=269056 Len=1240"
"4915","42.673987","142.250.191.170","192.168.2.103","TCP","1394","[TCP Retransmission] 443  >  1251 [ACK] Seq=859727 Ack=1003 Win=269056 Len=1240"
"4916","42.673989","142.250.191.170","192.168.2.103","TCP","1394","[TCP Retransmission] 443  >  1251 [PSH, ACK] Seq=860967 Ack=1003 Win=269056 Len=1240"
"4917","42.673991","142.250.191.170","192.168.2.103","TCP","1394","[TCP Retransmission] 443  >  1251 [ACK] Seq=862207 Ack=1003 Win=269056 Len=1240"
"4918","42.673993","142.250.191.170","192.168.2.103","TCP","1394","[TCP Retransmission] 443  >  1251 [ACK] Seq=863447 Ack=1003 Win=269056 Len=1240"
"4919","42.673995","142.250.191.170","192.168.2.103","TCP","1394","[TCP Retransmission] 443  >  1251 [PSH, ACK] Seq=864687 Ack=1003 Win=269056 Len=1240"
"4920","42.673997","142.250.191.170","192.168.2.103","TCP","1394","[TCP Retransmission] 443  >  1251 [ACK] Seq=865927 Ack=1003 Win=269056 Len=1240"
"4921","42.674005","142.250.191.170","192.168.2.103","TCP","1394","[TCP Retransmission] 443  >  1251 [ACK] Seq=867167 Ack=1003 Win=269056 Len=1240"
"4923","42.676493","142.250.191.170","192.168.2.103","TCP","1394","[TCP Retransmission] 443  >  1251 [PSH, ACK] Seq=853527 Ack=1003 Win=269056 Len=1240"
