"No.","Time","Source","Destination","Protocol","Length","Info"
"255","6.945923","192.168.2.103","224.0.0.251","MDNS","175","Standard query 0x0000 PTR _oculusal_sp._tcp.local, ""QM"" question"
"266","6.947106","192.168.2.103","224.0.0.251","MDNS","371","Standard query response 0x0000 PTR 12549::oldman._oculusal_sp_v2._tcp.local SRV 0 0 3469 oldman.local TXT A 192.168.2.103 AAAA fe80::18a0:cb74:d156:8d15"
"280","7.263592","192.168.2.103","224.0.0.251","MDNS","186","Standard query 0x0000 PTR _oculusal_sp_v2._tcp.local, ""QM"" question"
"285","7.263827","192.168.2.103","224.0.0.251","MDNS","186","Standard query 0x0000 PTR _oculusal_sp_v2._tcp.local, ""QM"" question"
"290","7.264157","192.168.2.103","224.0.0.251","MDNS","366","Standard query response 0x0000 PTR 12549::oldman._oculusal_sp_v2._tcp.local SRV 0 0 3469 oldman.local TXT A 192.168.2.103 AAAA fe80::18a0:cb74:d156:8d15"
"309","7.949120","192.168.2.103","224.0.0.251","MDNS","183","Standard query 0x0000 PTR _oculusal_sp._tcp.local, ""QM"" question"
"318","7.949800","192.168.2.103","224.0.0.251","MDNS","363","Standard query response 0x0000 PTR 12549::oldman._oculusal_sp_v2._tcp.local SRV 0 0 3469 oldman.local TXT A 192.168.2.103 AAAA fe80::18a0:cb74:d156:8d15"
"331","8.268933","192.168.2.103","224.0.0.251","MDNS","186","Standard query 0x0000 PTR _oculusal_sp_v2._tcp.local, ""QM"" question"
"337","8.269233","192.168.2.103","224.0.0.251","MDNS","366","Standard query response 0x0000 PTR 12549::oldman._oculusal_sp_v2._tcp.local SRV 0 0 3469 oldman.local TXT A 192.168.2.103 AAAA fe80::18a0:cb74:d156:8d15"
"341","8.269743","192.168.2.103","224.0.0.251","MDNS","178","Standard query 0x0000 PTR _oculusal_sp_v2._tcp.local, ""QM"" question"
"405","9.959356","192.168.2.103","224.0.0.251","MDNS","183","Standard query 0x0000 PTR _oculusal_sp._tcp.local, ""QM"" question"
"411","9.964874","192.168.2.103","224.0.0.251","MDNS","371","Standard query response 0x0000 PTR 12549::oldman._oculusal_sp_v2._tcp.local SRV 0 0 3469 oldman.local TXT A 192.168.2.103 AAAA fe80::18a0:cb74:d156:8d15"
"424","10.280354","192.168.2.103","224.0.0.251","MDNS","186","Standard query 0x0000 PTR _oculusal_sp_v2._tcp.local, ""QM"" question"
"427","10.280379","192.168.2.103","224.0.0.251","MDNS","374","Standard query response 0x0000 PTR 12549::oldman._oculusal_sp_v2._tcp.local SRV 0 0 3469 oldman.local TXT A 192.168.2.103 AAAA fe80::18a0:cb74:d156:8d15"
"431","10.280641","192.168.2.103","224.0.0.251","MDNS","186","Standard query 0x0000 PTR _oculusal_sp_v2._tcp.local, ""QM"" question"
"432","10.280846","192.168.2.103","224.0.0.251","MDNS","374","Standard query response 0x0000 PTR 12549::oldman._oculusal_sp_v2._tcp.local SRV 0 0 3469 oldman.local TXT A 192.168.2.103 AAAA fe80::18a0:cb74:d156:8d15"
"447","11.103641","192.168.2.103","157.240.26.49","TCP","147","1190  >  443 [ACK] Seq=1 Ack=1 Win=253 Len=1 [TCP PDU reassembled in 508]"
"450","11.103914","192.168.2.103","157.240.26.49","TCP","147","[TCP Keep-Alive] 1190  >  443 [ACK] Seq=1 Ack=1 Win=253 Len=1"
"452","11.113068","157.240.26.49","192.168.2.103","TCP","158","443  >  1190 [ACK] Seq=1 Ack=2 Win=281 Len=0 SLE=1 SRE=2"
"478","12.492086","192.168.2.103","23.192.220.4","TCP","147","1191  >  443 [ACK] Seq=1 Ack=1 Win=517 Len=1"
"481","12.500473","23.192.220.4","192.168.2.103","TCP","158","443  >  1191 [ACK] Seq=1 Ack=2 Win=501 Len=0 SLE=1 SRE=2"
"497","13.241796","192.168.2.103","157.240.26.49","TLSv1.2","412","Application Data"
"500","13.254305","157.240.26.49","192.168.2.103","TCP","146","443  >  1189 [ACK] Seq=1 Ack=267 Win=269 Len=0"
"502","13.254515","157.240.26.49","192.168.2.103","TLSv1.2","181","Application Data"
"508","13.299449","192.168.2.103","157.240.26.49","TLSv1.2","229","Ignored Unknown Record"
"509","13.299456","192.168.2.103","157.240.26.49","TLSv1.2","193","Application Data"
"510","13.299462","192.168.2.103","157.240.26.49","TLSv1.2","526","Application Data"
"514","13.299707","192.168.2.103","157.240.26.49","TCP","146","1189  >  443 [ACK] Seq=267 Ack=36 Win=252 Len=0"
"516","13.307816","157.240.26.49","192.168.2.103","TCP","146","443  >  1190 [ACK] Seq=1 Ack=77 Win=281 Len=0"
"518","13.308291","157.240.26.49","192.168.2.103","TLSv1.2","189","Application Data"
"519","13.308303","157.240.26.49","192.168.2.103","TCP","154","443  >  1190 [ACK] Seq=36 Ack=488 Win=287 Len=0"
"521","13.308920","157.240.26.49","192.168.2.103","TLSv1.2","185","Application Data"
"525","13.309704","192.168.2.103","157.240.26.49","TCP","146","1190  >  443 [ACK] Seq=488 Ack=75 Win=252 Len=0"
"529","13.376208","157.240.26.49","192.168.2.103","TLSv1.2","337","Application Data"
"531","13.376628","157.240.26.49","192.168.2.103","TLSv1.2","231","Application Data"
"535","13.377303","192.168.2.103","157.240.26.49","TCP","146","1190  >  443 [ACK] Seq=488 Ack=351 Win=251 Len=0"
"539","13.378038","192.168.2.103","157.240.26.49","TLSv1.2","181","Application Data"
"542","13.429665","157.240.26.49","192.168.2.103","TCP","146","443  >  1190 [ACK] Seq=351 Ack=523 Win=287 Len=0"
"543","13.430007","157.240.26.49","192.168.2.103","TCP","146","[TCP Dup ACK 542#1] 443  >  1190 [ACK] Seq=351 Ack=523 Win=287 Len=0"
"549","13.639749","157.240.26.49","192.168.2.103","TLSv1.2","340","Application Data"
"551","13.640008","157.240.26.49","192.168.2.103","TLSv1.2","250","Application Data"
"555","13.640857","192.168.2.103","157.240.26.49","TCP","146","1189  >  443 [ACK] Seq=267 Ack=334 Win=256 Len=0"
"567","13.979962","192.168.2.103","224.0.0.251","MDNS","183","Standard query 0x0000 PTR _oculusal_sp._tcp.local, ""QM"" question"
"570","13.980135","192.168.2.103","224.0.0.251","MDNS","371","Standard query response 0x0000 PTR 12549::oldman._oculusal_sp_v2._tcp.local SRV 0 0 3469 oldman.local TXT A 192.168.2.103 AAAA fe80::18a0:cb74:d156:8d15"
"575","14.280174","192.168.2.103","224.0.0.251","MDNS","186","Standard query 0x0000 PTR _oculusal_sp_v2._tcp.local, ""QM"" question"
"578","14.280349","192.168.2.103","224.0.0.251","MDNS","374","Standard query response 0x0000 PTR 12549::oldman._oculusal_sp_v2._tcp.local SRV 0 0 3469 oldman.local TXT A 192.168.2.103 AAAA fe80::18a0:cb74:d156:8d15"
"589","14.940233","23.192.220.4","192.168.2.103","TCP","146","[TCP ACKed unseen segment] 443  >  1191 [ACK] Seq=1 Ack=66 Win=501 Len=0"
"591","14.940681","23.192.220.4","192.168.2.103","TCP","154","[TCP ACKed unseen segment] 443  >  1191 [ACK] Seq=1 Ack=105 Win=501 Len=0"
"592","14.940694","23.192.220.4","192.168.2.103","TCP","154","[TCP ACKed unseen segment] 443  >  1191 [ACK] Seq=1 Ack=169 Win=501 Len=0"
"594","14.941852","23.192.220.4","192.168.2.103","TLSv1.2","185","Application Data"
"595","14.942052","23.192.220.4","192.168.2.103","TCP","185","[TCP Retransmission] 443  >  1191 [PSH, ACK] Seq=1 Ack=169 Win=501 Len=39"
"597","14.944206","23.192.220.4","192.168.2.103","TLSv1.2","414","Application Data"
"598","14.944218","23.192.220.4","192.168.2.103","TCP","1394","443  >  1191 [ACK] Seq=300 Ack=169 Win=501 Len=1240 [TCP PDU reassembled in 616]"
"599","14.944222","23.192.220.4","192.168.2.103","TCP","1394","443  >  1191 [ACK] Seq=1540 Ack=169 Win=501 Len=1240 [TCP PDU reassembled in 616]"
"600","14.944227","23.192.220.4","192.168.2.103","TCP","1394","443  >  1191 [ACK] Seq=2780 Ack=169 Win=501 Len=1240 [TCP PDU reassembled in 616]"
"601","14.944232","23.192.220.4","192.168.2.103","TCP","1394","443  >  1191 [ACK] Seq=4020 Ack=169 Win=501 Len=1240 [TCP PDU reassembled in 616]"
"602","14.944241","23.192.220.4","192.168.2.103","TCP","1394","443  >  1191 [ACK] Seq=5260 Ack=169 Win=501 Len=1240 [TCP PDU reassembled in 616]"
"603","14.944245","23.192.220.4","192.168.2.103","TCP","1394","443  >  1191 [ACK] Seq=6500 Ack=169 Win=501 Len=1240 [TCP PDU reassembled in 616]"
"607","14.944855","192.168.2.103","23.192.220.4","TCP","146","[TCP Previous segment not captured] 1191  >  443 [ACK] Seq=169 Ack=7740 Win=519 Len=0"
"609","14.946829","23.192.220.4","192.168.2.103","TCP","1394","443  >  1191 [PSH, ACK] Seq=7740 Ack=169 Win=501 Len=1240 [TCP PDU reassembled in 616]"
"610","14.946839","23.192.220.4","192.168.2.103","TCP","1394","443  >  1191 [ACK] Seq=8980 Ack=169 Win=501 Len=1240 [TCP PDU reassembled in 616]"
"611","14.946844","23.192.220.4","192.168.2.103","TCP","1394","443  >  1191 [ACK] Seq=10220 Ack=169 Win=501 Len=1240 [TCP PDU reassembled in 616]"
"612","14.946848","23.192.220.4","192.168.2.103","TCP","1394","443  >  1191 [ACK] Seq=11460 Ack=169 Win=501 Len=1240 [TCP PDU reassembled in 616]"
"613","14.946852","23.192.220.4","192.168.2.103","TCP","1394","443  >  1191 [ACK] Seq=12700 Ack=169 Win=501 Len=1240 [TCP PDU reassembled in 616]"
"614","14.946856","23.192.220.4","192.168.2.103","TCP","1394","443  >  1191 [ACK] Seq=13940 Ack=169 Win=501 Len=1240 [TCP PDU reassembled in 616]"
"615","14.946864","23.192.220.4","192.168.2.103","TCP","1394","443  >  1191 [ACK] Seq=15180 Ack=169 Win=501 Len=1240 [TCP PDU reassembled in 616]"
"616","14.946868","23.192.220.4","192.168.2.103","TLSv1.2","440","Application Data"
"617","14.946871","23.192.220.4","192.168.2.103","TLSv1.2","1394","Application Data"
"621","14.947420","192.168.2.103","23.192.220.4","TCP","146","1191  >  443 [ACK] Seq=169 Ack=12700 Win=519 Len=0"
"623","14.952531","23.192.220.4","192.168.2.103","TCP","1394","[TCP Retransmission] 443  >  1191 [ACK] Seq=12700 Ack=169 Win=501 Len=1240 [TCP PDU reassembled in 616]"
"624","14.952540","23.192.220.4","192.168.2.103","TCP","1394","[TCP Retransmission] 443  >  1191 [ACK] Seq=13940 Ack=169 Win=501 Len=1240 [TCP PDU reassembled in 616]"
"625","14.952544","23.192.220.4","192.168.2.103","TCP","1394","443  >  1191 [ACK] Seq=17946 Ack=169 Win=501 Len=1240 [TCP PDU reassembled in 656]"
"626","14.952548","23.192.220.4","192.168.2.103","TCP","1394","443  >  1191 [ACK] Seq=19186 Ack=169 Win=501 Len=1240 [TCP PDU reassembled in 656]"
"627","14.952553","23.192.220.4","192.168.2.103","TCP","1394","443  >  1191 [ACK] Seq=20426 Ack=169 Win=501 Len=1240 [TCP PDU reassembled in 656]"
"628","14.952560","23.192.220.4","192.168.2.103","TCP","1394","443  >  1191 [ACK] Seq=21666 Ack=169 Win=501 Len=1240 [TCP PDU reassembled in 656]"
"629","14.952564","23.192.220.4","192.168.2.103","TCP","1394","443  >  1191 [ACK] Seq=22906 Ack=169 Win=501 Len=1240 [TCP PDU reassembled in 656]"
"630","14.952568","23.192.220.4","192.168.2.103","TCP","1394","443  >  1191 [PSH, ACK] Seq=24146 Ack=169 Win=501 Len=1240 [TCP PDU reassembled in 656]"
"631","14.952571","23.192.220.4","192.168.2.103","TCP","1394","443  >  1191 [ACK] Seq=25386 Ack=169 Win=501 Len=1240 [TCP PDU reassembled in 656]"
"632","14.952575","23.192.220.4","192.168.2.103","TCP","1394","443  >  1191 [ACK] Seq=26626 Ack=169 Win=501 Len=1240 [TCP PDU reassembled in 656]"
"633","14.952579","23.192.220.4","192.168.2.103","TCP","1394","443  >  1191 [ACK] Seq=27866 Ack=169 Win=501 Len=1240 [TCP PDU reassembled in 656]"
"634","14.952583","23.192.220.4","192.168.2.103","TCP","1394","443  >  1191 [ACK] Seq=29106 Ack=169 Win=501 Len=1240 [TCP PDU reassembled in 656]"
"635","14.952586","23.192.220.4","192.168.2.103","TCP","1394","443  >  1191 [ACK] Seq=30346 Ack=169 Win=501 Len=1240 [TCP PDU reassembled in 656]"
"637","14.952595","23.192.220.4","192.168.2.103","TCP","1394","[TCP Previous segment not captured] 443  >  1191 [PSH, ACK] Seq=32826 Ack=169 Win=501 Len=1240 [TCP PDU reassembled in 656], Application Data"
"638","14.952598","23.192.220.4","192.168.2.103","TLSv1.2","1394","Application Data"
"639","14.952602","23.192.220.4","192.168.2.103","TLSv1.2","1394","Application Data"
"643","14.957185","192.168.2.103","23.192.220.4","TCP","146","1191  >  443 [ACK] Seq=169 Ack=31586 Win=519 Len=0"
"645","14.957914","23.192.220.4","192.168.2.103","TCP","1394","[TCP Previous segment not captured] 443  >  1191 [ACK] Seq=39026 Ack=169 Win=501 Len=1240 [TCP PDU reassembled in 670]"
"652","14.959780","23.192.220.4","192.168.2.103","TCP","1394","[TCP Retransmission] 443  >  1191 [ACK] Seq=39026 Ack=169 Win=501 Len=1240 [TCP PDU reassembled in 670]"
"653","14.959794","23.192.220.4","192.168.2.103","TCP","1394","443  >  1191 [ACK] Seq=40266 Ack=169 Win=501 Len=1240 [TCP PDU reassembled in 670]"
"654","14.959798","23.192.220.4","192.168.2.103","TCP","1394","443  >  1191 [PSH, ACK] Seq=41506 Ack=169 Win=501 Len=1240 [TCP PDU reassembled in 670]"
"656","14.960209","23.192.220.4","192.168.2.103","TCP","1386","[TCP Out-Of-Order] 443  >  1191 [ACK] Seq=31586 Ack=169 Win=501 Len=1240"
"658","14.962671","23.192.220.4","192.168.2.103","TCP","1394","[TCP Retransmission] 443  >  1191 [PSH, ACK] Seq=32826 Ack=169 Win=501 Len=1240"
"659","14.962680","23.192.220.4","192.168.2.103","TCP","1394","[TCP Retransmission] 443  >  1191 [ACK] Seq=34066 Ack=169 Win=501 Len=1240 [TCP PDU reassembled in 638]"
"660","14.962684","23.192.220.4","192.168.2.103","TCP","1394","[TCP Retransmission] 443  >  1191 [ACK] Seq=35306 Ack=169 Win=501 Len=1240 [TCP PDU reassembled in 639]"
"661","14.962689","23.192.220.4","192.168.2.103","TCP","1394","[TCP Out-Of-Order] 443  >  1191 [ACK] Seq=36546 Ack=169 Win=501 Len=1240 [TCP PDU reassembled in 670]"
"662","14.962693","23.192.220.4","192.168.2.103","TCP","1394","[TCP Out-Of-Order] 443  >  1191 [ACK] Seq=37786 Ack=169 Win=501 Len=1240 [TCP PDU reassembled in 670]"
"663","14.962700","23.192.220.4","192.168.2.103","TCP","1394","443  >  1191 [ACK] Seq=42746 Ack=169 Win=501 Len=1240 [TCP PDU reassembled in 670]"
"664","14.962704","23.192.220.4","192.168.2.103","TCP","1394","443  >  1191 [ACK] Seq=43986 Ack=169 Win=501 Len=1240 [TCP PDU reassembled in 670]"
"665","14.962708","23.192.220.4","192.168.2.103","TCP","1394","443  >  1191 [ACK] Seq=45226 Ack=169 Win=501 Len=1240 [TCP PDU reassembled in 670]"
"666","14.962711","23.192.220.4","192.168.2.103","TCP","1394","443  >  1191 [ACK] Seq=46466 Ack=169 Win=501 Len=1240 [TCP PDU reassembled in 670]"
"667","14.962715","23.192.220.4","192.168.2.103","TCP","1394","443  >  1191 [ACK] Seq=47706 Ack=169 Win=501 Len=1240 [TCP PDU reassembled in 670]"
"668","14.962719","23.192.220.4","192.168.2.103","TCP","1394","443  >  1191 [ACK] Seq=48946 Ack=169 Win=501 Len=1240 [TCP PDU reassembled in 670]"
"669","14.962722","23.192.220.4","192.168.2.103","TCP","1394","443  >  1191 [PSH, ACK] Seq=50186 Ack=169 Win=501 Len=1240 [TCP PDU reassembled in 670]"
"670","14.962726","23.192.220.4","192.168.2.103","TLSv1.2","1394","Application Data, Application Data"
"671","14.962730","23.192.220.4","192.168.2.103","TCP","1394","443  >  1191 [ACK] Seq=52666 Ack=169 Win=501 Len=1240 [TCP PDU reassembled in 685]"
"673","14.965044","23.192.220.4","192.168.2.103","TCP","1394","[TCP Retransmission] 443  >  1191 [ACK] Seq=52666 Ack=169 Win=501 Len=1240 [TCP PDU reassembled in 685]"
"674","14.965054","23.192.220.4","192.168.2.103","TCP","1394","443  >  1191 [ACK] Seq=53906 Ack=169 Win=501 Len=1240 [TCP PDU reassembled in 685]"
"675","14.965058","23.192.220.4","192.168.2.103","TCP","1394","443  >  1191 [ACK] Seq=55146 Ack=169 Win=501 Len=1240 [TCP PDU reassembled in 685]"
"676","14.965062","23.192.220.4","192.168.2.103","TCP","1394","443  >  1191 [ACK] Seq=56386 Ack=169 Win=501 Len=1240 [TCP PDU reassembled in 685]"
"677","14.965065","23.192.220.4","192.168.2.103","TCP","1394","443  >  1191 [ACK] Seq=57626 Ack=169 Win=501 Len=1240 [TCP PDU reassembled in 685]"
"678","14.965070","23.192.220.4","192.168.2.103","TCP","1394","443  >  1191 [PSH, ACK] Seq=58866 Ack=169 Win=501 Len=1240 [TCP PDU reassembled in 685]"
"679","14.965074","23.192.220.4","192.168.2.103","TCP","1394","443  >  1191 [ACK] Seq=60106 Ack=169 Win=501 Len=1240 [TCP PDU reassembled in 685]"
"680","14.965081","23.192.220.4","192.168.2.103","TCP","1394","443  >  1191 [ACK] Seq=61346 Ack=169 Win=501 Len=1240 [TCP PDU reassembled in 685]"
"681","14.965085","23.192.220.4","192.168.2.103","TCP","1394","443  >  1191 [ACK] Seq=62586 Ack=169 Win=501 Len=1240 [TCP PDU reassembled in 685]"
"682","14.965088","23.192.220.4","192.168.2.103","TCP","1394","443  >  1191 [ACK] Seq=63826 Ack=169 Win=501 Len=1240 [TCP PDU reassembled in 685]"
"683","14.965092","23.192.220.4","192.168.2.103","TCP","1394","443  >  1191 [ACK] Seq=65066 Ack=169 Win=501 Len=1240 [TCP PDU reassembled in 685]"
"684","14.965095","23.192.220.4","192.168.2.103","TCP","1394","443  >  1191 [ACK] Seq=66306 Ack=169 Win=501 Len=1240 [TCP PDU reassembled in 685]"
"685","14.965098","23.192.220.4","192.168.2.103","TLSv1.2","1394","Application Data, Application Data"
"686","14.965102","23.192.220.4","192.168.2.103","TCP","1394","443  >  1191 [ACK] Seq=68786 Ack=169 Win=501 Len=1240 [TCP PDU reassembled in 687]"
"687","14.965106","23.192.220.4","192.168.2.103","TLSv1.2","314","Application Data"
"691","14.965286","192.168.2.103","23.192.220.4","TCP","146","1191  >  443 [ACK] Seq=169 Ack=52666 Win=519 Len=0"
"693","14.966569","23.192.220.4","192.168.2.103","TCP","1394","[TCP Retransmission] 443  >  1191 [ACK] Seq=62586 Ack=169 Win=501 Len=1240 [TCP PDU reassembled in 685]"
"694","14.966578","23.192.220.4","192.168.2.103","TCP","1394","[TCP Retransmission] 443  >  1191 [ACK] Seq=63826 Ack=169 Win=501 Len=1240 [TCP PDU reassembled in 685]"
"695","14.966582","23.192.220.4","192.168.2.103","TCP","1394","[TCP Retransmission] 443  >  1191 [ACK] Seq=65066 Ack=169 Win=501 Len=1240 [TCP PDU reassembled in 685]"
"697","14.966590","23.192.220.4","192.168.2.103","TCP","1394","[TCP Retransmission] 443  >  1191 [PSH, ACK] Seq=67546 Ack=169 Win=501 Len=1240"
"698","14.966594","23.192.220.4","192.168.2.103","TCP","1394","[TCP Retransmission] 443  >  1191 [ACK] Seq=68786 Ack=169 Win=501 Len=1240 [TCP PDU reassembled in 687]"
"699","14.966598","23.192.220.4","192.168.2.103","TCP","314","[TCP Retransmission] 443  >  1191 [PSH, ACK] Seq=70026 Ack=169 Win=501 Len=160 [TCP PDU reassembled in 687]"
"703","14.966938","192.168.2.103","23.192.220.4","TCP","146","1191  >  443 [ACK] Seq=169 Ack=62586 Win=519 Len=0"
"708","14.967942","192.168.2.103","23.192.220.4","TCP","146","1191  >  443 [ACK] Seq=169 Ack=66306 Win=519 Len=0"
"715","14.969729","23.192.220.4","192.168.2.103","TCP","1394","[TCP Retransmission] 443  >  1191 [ACK] Seq=66306 Ack=169 Win=501 Len=1240 [TCP PDU reassembled in 685]"
"716","14.969735","23.192.220.4","192.168.2.103","TCP","1394","[TCP Retransmission] 443  >  1191 [PSH, ACK] Seq=67546 Ack=169 Win=501 Len=1240"
"717","14.969738","23.192.220.4","192.168.2.103","TCP","1394","[TCP Retransmission] 443  >  1191 [ACK] Seq=68786 Ack=169 Win=501 Len=1240 [TCP PDU reassembled in 687]"
"718","14.969742","23.192.220.4","192.168.2.103","TCP","314","[TCP Retransmission] 443  >  1191 [PSH, ACK] Seq=70026 Ack=169 Win=501 Len=160 [TCP PDU reassembled in 687]"
"722","14.970426","192.168.2.103","23.192.220.4","TCP","146","1191  >  443 [ACK] Seq=169 Ack=70186 Win=519 Len=0"
"726","15.022327","192.168.2.103","192.168.2.1","DNS","168","Standard query 0xab24 A graph.oculus.com"
"730","15.096668","192.168.2.1","192.168.2.103","DNS","219","Standard query response 0xab24 A graph.oculus.com CNAME oculus.c10r.facebook.com A 157.240.26.49"
"731","15.096792","192.168.2.1","192.168.2.103","DNS","219","Standard query response 0xab24 A graph.oculus.com CNAME oculus.c10r.facebook.com A 157.240.26.49"
"733","15.109674","157.240.26.49","192.168.2.103","TCP","158","443  >  1222 [SYN, ACK] Seq=0 Ack=1 Win=65535 Len=0 MSS=1392 SACK_PERM WS=256"
"737","15.110550","192.168.2.103","157.240.26.49","TCP","146","1222  >  443 [ACK] Seq=1 Ack=1 Win=256 Len=0"
"741","15.111738","192.168.2.103","157.240.26.49","TLSv1.2","365","Client Hello (SNI=graph.oculus.com)"
"743","15.122262","157.240.26.49","192.168.2.103","TCP","146","443  >  1222 [ACK] Seq=1 Ack=220 Win=66816 Len=0"
"744","15.122618","157.240.26.49","192.168.2.103","TCP","146","[TCP Dup ACK 743#1] 443  >  1222 [ACK] Seq=1 Ack=220 Win=66816 Len=0"
"746","15.124516","157.240.26.49","192.168.2.103","TLSv1.2","1386","Server Hello"
"748","15.125161","157.240.26.49","192.168.2.103","TCP","1394","443  >  1222 [PSH, ACK] Seq=1241 Ack=220 Win=66816 Len=1240 [TCP PDU reassembled in 749]"
"749","15.125166","157.240.26.49","192.168.2.103","TLSv1.2","1241","Certificate, Server Key Exchange, Server Hello Done"
"753","15.125868","192.168.2.103","157.240.26.49","TCP","146","1222  >  443 [ACK] Seq=220 Ack=3568 Win=256 Len=0"
"757","15.126158","192.168.2.103","157.240.26.49","TCP","146","[TCP Dup ACK 753#1] 1222  >  443 [ACK] Seq=220 Ack=3568 Win=256 Len=0"
"761","15.126715","192.168.2.103","157.240.26.49","TLSv1.2","272","Client Key Exchange, Change Cipher Spec, Encrypted Handshake Message"
"764","15.127100","192.168.2.103","157.240.26.49","TCP","272","[TCP Retransmission] 1222  >  443 [PSH, ACK] Seq=220 Ack=3568 Win=256 Len=126"
"766","15.136209","157.240.26.49","192.168.2.103","TLSv1.2","197","Change Cipher Spec, Encrypted Handshake Message"
"768","15.136485","157.240.26.49","192.168.2.103","TLSv1.2","227","Application Data"
"769","15.137101","157.240.26.49","192.168.2.103","TCP","227","[TCP Retransmission] 443  >  1222 [PSH, ACK] Seq=3619 Ack=346 Win=66816 Len=81"
"773","15.138481","192.168.2.103","157.240.26.49","TLSv1.2","207","Application Data"
"774","15.138493","192.168.2.103","157.240.26.49","TLSv1.2","210","Application Data"
"775","15.138499","192.168.2.103","157.240.26.49","TLSv1.2","196","Application Data"
"776","15.138504","192.168.2.103","157.240.26.49","TLSv1.2","197","Application Data"
"777","15.138510","192.168.2.103","157.240.26.49","TCP","1394","1222  >  443 [ACK] Seq=540 Ack=3619 Win=256 Len=1240 [TCP PDU reassembled in 782]"
"778","15.138517","192.168.2.103","157.240.26.49","TCP","1394","1222  >  443 [ACK] Seq=1780 Ack=3619 Win=256 Len=1240 [TCP PDU reassembled in 782]"
"779","15.138522","192.168.2.103","157.240.26.49","TCP","1394","1222  >  443 [ACK] Seq=3020 Ack=3619 Win=256 Len=1240 [TCP PDU reassembled in 782]"
"780","15.138530","192.168.2.103","157.240.26.49","TCP","1394","1222  >  443 [ACK] Seq=4260 Ack=3619 Win=256 Len=1240 [TCP PDU reassembled in 782]"
"781","15.138534","192.168.2.103","157.240.26.49","TCP","1394","1222  >  443 [ACK] Seq=5500 Ack=3619 Win=256 Len=1240 [TCP PDU reassembled in 782]"
"782","15.138538","192.168.2.103","157.240.26.49","TLSv1.2","1221","Application Data"
"786","15.138777","192.168.2.103","157.240.26.49","TLSv1.2","184","Application Data"
"789","15.139227","192.168.2.103","157.240.26.49","TCP","184","[TCP Retransmission] 1222  >  443 [PSH, ACK] Seq=7807 Ack=3700 Win=256 Len=38"
"793","15.139848","192.168.2.103","157.240.26.49","TCP","1394","[TCP Retransmission] 1222  >  443 [ACK] Seq=5500 Ack=3619 Win=256 Len=1240 [TCP PDU reassembled in 782]"
"794","15.139856","192.168.2.103","157.240.26.49","TCP","1221","[TCP Retransmission] 1222  >  443 [PSH, ACK] Seq=6740 Ack=3619 Win=256 Len=1067 [TCP PDU reassembled in 782]"
"797","15.140665","192.168.2.103","157.240.26.49","TCP","1394","[TCP Retransmission] 1222  >  443 [ACK] Seq=5500 Ack=3619 Win=256 Len=1240 [TCP PDU reassembled in 782]"
"798","15.140669","192.168.2.103","157.240.26.49","TCP","1221","[TCP Retransmission] 1222  >  443 [PSH, ACK] Seq=6740 Ack=3619 Win=256 Len=1067 [TCP PDU reassembled in 782]"
"800","15.147456","157.240.26.49","192.168.2.103","TCP","146","443  >  1222 [ACK] Seq=3700 Ack=1780 Win=69632 Len=0"
"802","15.147896","157.240.26.49","192.168.2.103","TLSv1.2","192","Application Data"
"803","15.147901","157.240.26.49","192.168.2.103","TCP","154","443  >  1222 [ACK] Seq=3738 Ack=4260 Win=75008 Len=0"
"805","15.148841","157.240.26.49","192.168.2.103","TCP","146","443  >  1222 [ACK] Seq=3738 Ack=6740 Win=80640 Len=0"
"807","15.149070","157.240.26.49","192.168.2.103","TLSv1.2","188","Application Data"
"811","15.150008","192.168.2.103","157.240.26.49","TCP","146","1222  >  443 [ACK] Seq=7845 Ack=3780 Win=255 Len=0"
"813","15.189605","157.240.26.49","192.168.2.103","TCP","1386","443  >  1222 [ACK] Seq=3780 Ack=7845 Win=83456 Len=1240 [TCP PDU reassembled in 828]"
"815","15.190252","157.240.26.49","192.168.2.103","TCP","1394","443  >  1222 [PSH, ACK] Seq=5020 Ack=7845 Win=83456 Len=1240 [TCP PDU reassembled in 828]"
"822","15.190757","192.168.2.103","157.240.26.49","TCP","146","1222  >  443 [ACK] Seq=7845 Ack=6260 Win=256 Len=0"
"826","15.191228","192.168.2.103","157.240.26.49","TCP","146","[TCP Dup ACK 822#1] 1222  >  443 [ACK] Seq=7845 Ack=6260 Win=256 Len=0"
"828","15.191426","157.240.26.49","192.168.2.103","TLSv1.2","604","Application Data"
"829","15.191435","157.240.26.49","192.168.2.103","TLSv1.2","338","Application Data"
"833","15.191809","192.168.2.103","157.240.26.49","TCP","146","1222  >  443 [ACK] Seq=7845 Ack=6894 Win=254 Len=0"
"837","15.193306","192.168.2.103","157.240.26.49","TLSv1.2","196","Application Data"
"838","15.193319","192.168.2.103","157.240.26.49","TCP","1394","1222  >  443 [ACK] Seq=7887 Ack=6894 Win=254 Len=1240 [TCP PDU reassembled in 843]"
"839","15.193325","192.168.2.103","157.240.26.49","TCP","1394","1222  >  443 [ACK] Seq=9127 Ack=6894 Win=254 Len=1240 [TCP PDU reassembled in 843]"
"840","15.193333","192.168.2.103","157.240.26.49","TCP","1394","1222  >  443 [ACK] Seq=10367 Ack=6894 Win=254 Len=1240 [TCP PDU reassembled in 843]"
"841","15.193337","192.168.2.103","157.240.26.49","TCP","1394","1222  >  443 [ACK] Seq=11607 Ack=6894 Win=254 Len=1240 [TCP PDU reassembled in 843]"
"842","15.193341","192.168.2.103","157.240.26.49","TCP","1394","1222  >  443 [ACK] Seq=12847 Ack=6894 Win=254 Len=1240 [TCP PDU reassembled in 843]"
"843","15.193345","192.168.2.103","157.240.26.49","TLSv1.2","1196","Application Data"
"845","15.201350","157.240.26.49","192.168.2.103","TCP","146","443  >  1222 [ACK] Seq=6894 Ack=9127 Win=86272 Len=0"
"847","15.201748","157.240.26.49","192.168.2.103","TCP","146","443  >  1222 [ACK] Seq=6894 Ack=11607 Win=91904 Len=0"
"849","15.202221","157.240.26.49","192.168.2.103","TCP","154","443  >  1222 [ACK] Seq=6894 Ack=14087 Win=97280 Len=0"
"850","15.202233","157.240.26.49","192.168.2.103","TLSv1.2","196","Application Data"
"852","15.240942","157.240.26.49","192.168.2.103","TCP","1386","443  >  1222 [ACK] Seq=6936 Ack=15129 Win=100096 Len=1240 [TCP PDU reassembled in 855]"
"854","15.241632","157.240.26.49","192.168.2.103","TCP","1394","443  >  1222 [PSH, ACK] Seq=8176 Ack=15129 Win=100096 Len=1240 [TCP PDU reassembled in 855]"
"855","15.241639","157.240.26.49","192.168.2.103","TLSv1.2","324","Application Data"
"856","15.241642","157.240.26.49","192.168.2.103","TLSv1.2","338","Application Data"
"860","15.241971","192.168.2.103","157.240.26.49","TCP","146","1222  >  443 [ACK] Seq=15129 Ack=8176 Win=256 Len=0"
"864","15.242482","192.168.2.103","157.240.26.49","TCP","154","1222  >  443 [ACK] Seq=15129 Ack=9770 Win=256 Len=0"
"865","15.242486","192.168.2.103","157.240.26.49","TLSv1.2","196","Application Data"
"869","15.243817","192.168.2.103","157.240.26.49","TCP","1394","1222  >  443 [ACK] Seq=15171 Ack=9770 Win=256 Len=1240 [TCP PDU reassembled in 874]"
"870","15.243828","192.168.2.103","157.240.26.49","TCP","1394","1222  >  443 [ACK] Seq=16411 Ack=9770 Win=256 Len=1240 [TCP PDU reassembled in 874]"
"871","15.243832","192.168.2.103","157.240.26.49","TCP","1394","1222  >  443 [ACK] Seq=17651 Ack=9770 Win=256 Len=1240 [TCP PDU reassembled in 874]"
"872","15.243834","192.168.2.103","157.240.26.49","TCP","1394","1222  >  443 [ACK] Seq=18891 Ack=9770 Win=256 Len=1240 [TCP PDU reassembled in 874]"
"873","15.243838","192.168.2.103","157.240.26.49","TCP","1394","1222  >  443 [ACK] Seq=20131 Ack=9770 Win=256 Len=1240 [TCP PDU reassembled in 874]"
"874","15.243841","192.168.2.103","157.240.26.49","TLSv1.2","1193","Application Data"
"878","15.244300","192.168.2.103","157.240.26.49","TCP","1386","[TCP Retransmission] 1222  >  443 [ACK] Seq=15171 Ack=9770 Win=256 Len=1240"
"880","15.255086","157.240.26.49","192.168.2.103","TCP","146","443  >  1222 [ACK] Seq=9770 Ack=16411 Win=102912 Len=0"
"882","15.255446","157.240.26.49","192.168.2.103","TCP","146","443  >  1222 [ACK] Seq=9770 Ack=18891 Win=107776 Len=0"
"884","15.255933","157.240.26.49","192.168.2.103","TCP","154","443  >  1222 [ACK] Seq=9770 Ack=21371 Win=113408 Len=0"
"885","15.255943","157.240.26.49","192.168.2.103","TLSv1.2","196","Application Data"
"887","15.256139","157.240.26.49","192.168.2.103","TCP","188","[TCP Retransmission] 443  >  1222 [PSH, ACK] Seq=9770 Ack=22410 Win=116224 Len=42"
"889","15.293114","157.240.26.49","192.168.2.103","TCP","1386","443  >  1222 [ACK] Seq=9812 Ack=22410 Win=116224 Len=1240 [TCP PDU reassembled in 893]"
"891","15.293510","157.240.26.49","192.168.2.103","TCP","1386","443  >  1222 [PSH, ACK] Seq=11052 Ack=22410 Win=116224 Len=1240 [TCP PDU reassembled in 893]"
"893","15.293939","157.240.26.49","192.168.2.103","TLSv1.2","565","Application Data"
"894","15.293945","157.240.26.49","192.168.2.103","TLSv1.2","338","Application Data"
"898","15.294760","192.168.2.103","157.240.26.49","TCP","146","1222  >  443 [ACK] Seq=22410 Ack=12887 Win=256 Len=0"
"902","15.295006","192.168.2.103","157.240.26.49","TLSv1.2","196","Application Data"
"903","15.296223","192.168.2.103","157.240.26.49","TCP","1394","1222  >  443 [ACK] Seq=22452 Ack=12887 Win=256 Len=1240 [TCP PDU reassembled in 908]"
"904","15.296229","192.168.2.103","157.240.26.49","TCP","1394","1222  >  443 [ACK] Seq=23692 Ack=12887 Win=256 Len=1240 [TCP PDU reassembled in 908]"
"905","15.296232","192.168.2.103","157.240.26.49","TCP","1394","1222  >  443 [ACK] Seq=24932 Ack=12887 Win=256 Len=1240 [TCP PDU reassembled in 908]"
"906","15.296235","192.168.2.103","157.240.26.49","TCP","1394","1222  >  443 [ACK] Seq=26172 Ack=12887 Win=256 Len=1240 [TCP PDU reassembled in 908]"
"907","15.296238","192.168.2.103","157.240.26.49","TCP","1394","1222  >  443 [ACK] Seq=27412 Ack=12887 Win=256 Len=1240 [TCP PDU reassembled in 908]"
"908","15.296244","192.168.2.103","157.240.26.49","TLSv1.2","1193","Application Data"
"912","15.296852","192.168.2.103","157.240.26.49","TCP","196","[TCP Retransmission] 1222  >  443 [PSH, ACK] Seq=22410 Ack=12887 Win=256 Len=42"
"913","15.298086","192.168.2.103","157.240.26.49","TCP","1394","[TCP Retransmission] 1222  >  443 [ACK] Seq=22452 Ack=12887 Win=256 Len=1240"
"914","15.298093","192.168.2.103","157.240.26.49","TCP","1394","[TCP Retransmission] 1222  >  443 [ACK] Seq=23692 Ack=12887 Win=256 Len=1240 [TCP PDU reassembled in 908]"
"915","15.298095","192.168.2.103","157.240.26.49","TCP","1394","[TCP Retransmission] 1222  >  443 [ACK] Seq=24932 Ack=12887 Win=256 Len=1240 [TCP PDU reassembled in 908]"
"916","15.298098","192.168.2.103","157.240.26.49","TCP","1394","[TCP Retransmission] 1222  >  443 [ACK] Seq=26172 Ack=12887 Win=256 Len=1240 [TCP PDU reassembled in 908]"
"917","15.298101","192.168.2.103","157.240.26.49","TCP","1394","[TCP Retransmission] 1222  >  443 [ACK] Seq=27412 Ack=12887 Win=256 Len=1240 [TCP PDU reassembled in 908]"
"918","15.298104","192.168.2.103","157.240.26.49","TCP","1193","[TCP Retransmission] 1222  >  443 [PSH, ACK] Seq=28652 Ack=12887 Win=256 Len=1039 [TCP PDU reassembled in 908]"
"920","15.303638","157.240.26.49","192.168.2.103","TCP","146","443  >  1222 [ACK] Seq=12887 Ack=23692 Win=119040 Len=0"
"922","15.306082","157.240.26.49","192.168.2.103","TCP","146","443  >  1222 [ACK] Seq=12887 Ack=26172 Win=124672 Len=0"
"924","15.306523","157.240.26.49","192.168.2.103","TCP","146","443  >  1222 [ACK] Seq=12887 Ack=29691 Win=131840 Len=0"
"933","15.365182","157.240.26.49","192.168.2.103","TCP","1386","[TCP Previous segment not captured] 443  >  1222 [ACK] Seq=12929 Ack=29691 Win=131840 Len=1240 [TCP PDU reassembled in 936]"
"935","15.365585","157.240.26.49","192.168.2.103","TCP","1394","443  >  1222 [PSH, ACK] Seq=14169 Ack=29691 Win=131840 Len=1240 [TCP PDU reassembled in 936]"
"936","15.365594","157.240.26.49","192.168.2.103","TLSv1.2","327","Application Data"
"937","15.365597","157.240.26.49","192.168.2.103","TLSv1.2","338","Application Data"
"941","15.368107","192.168.2.103","157.240.26.49","TCP","154","[TCP ACKed unseen segment] 1222  >  443 [ACK] Seq=29691 Ack=12929 Win=256 Len=0"
"942","15.368112","192.168.2.103","157.240.26.49","TCP","154","1222  >  443 [ACK] Seq=29691 Ack=15766 Win=256 Len=0"
"943","15.368117","192.168.2.103","157.240.26.49","TLSv1.2","196","Application Data"
"944","15.369320","192.168.2.103","157.240.26.49","TCP","1394","1222  >  443 [ACK] Seq=29733 Ack=15766 Win=256 Len=1240 [TCP PDU reassembled in 949]"
"945","15.369331","192.168.2.103","157.240.26.49","TCP","1394","1222  >  443 [ACK] Seq=30973 Ack=15766 Win=256 Len=1240 [TCP PDU reassembled in 949]"
"946","15.369335","192.168.2.103","157.240.26.49","TCP","1394","1222  >  443 [ACK] Seq=32213 Ack=15766 Win=256 Len=1240 [TCP PDU reassembled in 949]"
"947","15.369339","192.168.2.103","157.240.26.49","TCP","1394","1222  >  443 [ACK] Seq=33453 Ack=15766 Win=256 Len=1240 [TCP PDU reassembled in 949]"
"948","15.369346","192.168.2.103","157.240.26.49","TCP","1394","1222  >  443 [ACK] Seq=34693 Ack=15766 Win=256 Len=1240 [TCP PDU reassembled in 949]"
"949","15.369350","192.168.2.103","157.240.26.49","TLSv1.2","1193","Application Data"
"951","15.377626","157.240.26.49","192.168.2.103","TCP","146","443  >  1222 [ACK] Seq=15766 Ack=30973 Win=134656 Len=0"
"953","15.377994","157.240.26.49","192.168.2.103","TCP","146","443  >  1222 [ACK] Seq=15766 Ack=34693 Win=142336 Len=0"
"955","15.378499","157.240.26.49","192.168.2.103","TCP","154","443  >  1222 [ACK] Seq=15766 Ack=36972 Win=147968 Len=0"
"956","15.378510","157.240.26.49","192.168.2.103","TLSv1.2","196","Application Data"
"964","15.419147","192.168.2.103","157.240.26.49","TCP","146","1222  >  443 [ACK] Seq=36972 Ack=15808 Win=256 Len=0"
"966","15.419674","157.240.26.49","192.168.2.103","TCP","1386","443  >  1222 [ACK] Seq=15808 Ack=36972 Win=147968 Len=1240 [TCP PDU reassembled in 970]"
"968","15.420062","157.240.26.49","192.168.2.103","TCP","1386","443  >  1222 [PSH, ACK] Seq=17048 Ack=36972 Win=147968 Len=1240 [TCP PDU reassembled in 970]"
"970","15.420704","157.240.26.49","192.168.2.103","TLSv1.2","560","Application Data"
"974","15.421062","192.168.2.103","157.240.26.49","TCP","146","1222  >  443 [ACK] Seq=36972 Ack=18288 Win=256 Len=0"
"976","15.421175","157.240.26.49","192.168.2.103","TLSv1.2","330","Application Data"
"980","15.421528","192.168.2.103","157.240.26.49","TLSv1.2","196","Application Data"
"981","15.422604","192.168.2.103","157.240.26.49","TCP","1394","1222  >  443 [ACK] Seq=37014 Ack=18702 Win=255 Len=1240 [TCP PDU reassembled in 986]"
"982","15.422616","192.168.2.103","157.240.26.49","TCP","1394","1222  >  443 [ACK] Seq=38254 Ack=18702 Win=255 Len=1240 [TCP PDU reassembled in 986]"
"983","15.422624","192.168.2.103","157.240.26.49","TCP","1394","1222  >  443 [ACK] Seq=39494 Ack=18702 Win=255 Len=1240 [TCP PDU reassembled in 986]"
"984","15.422627","192.168.2.103","157.240.26.49","TCP","1394","1222  >  443 [ACK] Seq=40734 Ack=18702 Win=255 Len=1240 [TCP PDU reassembled in 986]"
"985","15.422630","192.168.2.103","157.240.26.49","TCP","1394","1222  >  443 [ACK] Seq=41974 Ack=18702 Win=255 Len=1240 [TCP PDU reassembled in 986]"
"986","15.422633","192.168.2.103","157.240.26.49","TLSv1.2","1193","Application Data"
"988","15.430206","157.240.26.49","192.168.2.103","TCP","146","443  >  1222 [ACK] Seq=18886 Ack=38254 Win=150784 Len=0"
"990","15.430868","157.240.26.49","192.168.2.103","TCP","154","443  >  1222 [ACK] Seq=18886 Ack=40734 Win=156416 Len=0"
"991","15.430875","157.240.26.49","192.168.2.103","TCP","154","443  >  1222 [ACK] Seq=18886 Ack=43214 Win=162048 Len=0"
"993","15.431140","157.240.26.49","192.168.2.103","TLSv1.2","188","Application Data"
"997","15.432337","192.168.2.103","157.240.26.49","TCP","146","1222  >  443 [ACK] Seq=44253 Ack=18928 Win=254 Len=0"
"1000","15.471080","157.240.26.49","192.168.2.103","TLSv1.2","1394","[TCP Previous segment not captured] , Ignored Unknown Record"
"1001","15.471091","157.240.26.49","192.168.2.103","TLSv1.2","331","Ignored Unknown Record"
"1002","15.471094","157.240.26.49","192.168.2.103","TLSv1.2","338","Application Data"
"1006","15.471473","192.168.2.103","157.240.26.49","TCP","146","[TCP ACKed unseen segment] 1222  >  443 [ACK] Seq=44253 Ack=21769 Win=256 Len=0"
"1017","16.046079","192.168.2.103","157.240.26.49","TLSv1.2","196","Application Data"
"1018","16.046088","192.168.2.103","157.240.26.49","TCP","1394","1222  >  443 [ACK] Seq=44295 Ack=21769 Win=256 Len=1240 [TCP PDU reassembled in 1028]"
"1021","16.047201","192.168.2.103","157.240.26.49","TCP","1214","[TCP Previous segment not captured] 1222  >  443 [PSH, ACK] Seq=50495 Ack=21769 Win=256 Len=1060 [TCP PDU reassembled in 1028]"
"1025","16.048176","192.168.2.103","157.240.26.49","TCP","1394","[TCP Out-Of-Order] 1222  >  443 [ACK] Seq=45535 Ack=21769 Win=256 Len=1240 [TCP PDU reassembled in 1028]"
"1026","16.048190","192.168.2.103","157.240.26.49","TCP","1394","[TCP Out-Of-Order] 1222  >  443 [ACK] Seq=46775 Ack=21769 Win=256 Len=1240 [TCP PDU reassembled in 1028]"
"1027","16.048195","192.168.2.103","157.240.26.49","TCP","1394","[TCP Out-Of-Order] 1222  >  443 [ACK] Seq=48015 Ack=21769 Win=256 Len=1240 [TCP PDU reassembled in 1028]"
"1028","16.048200","192.168.2.103","157.240.26.49","TCP","1394","[TCP Out-Of-Order] 1222  >  443 [ACK] Seq=49255 Ack=21769 Win=256 Len=1240"
"1032","16.048577","192.168.2.103","157.240.26.49","TCP","1386","[TCP Retransmission] 1222  >  443 [ACK] Seq=45535 Ack=21769 Win=256 Len=1240 [TCP PDU reassembled in 1028]"
"1034","16.055979","157.240.26.49","192.168.2.103","TCP","146","443  >  1222 [ACK] Seq=21769 Ack=45535 Win=167424 Len=0"
"1036","16.056932","157.240.26.49","192.168.2.103","TCP","146","443  >  1222 [ACK] Seq=21769 Ack=49255 Win=174848 Len=0"
"1038","16.057256","157.240.26.49","192.168.2.103","TCP","146","443  >  1222 [ACK] Seq=21769 Ack=51555 Win=179456 Len=0"
"1040","16.057606","157.240.26.49","192.168.2.103","TLSv1.2","188","Application Data"
"1046","16.100238","192.168.2.103","157.240.26.49","TCP","146","1222  >  443 [ACK] Seq=51555 Ack=21811 Win=256 Len=0"
"1049","16.136716","157.240.26.49","192.168.2.103","TLSv1.2","540","Application Data"
"1051","16.136975","157.240.26.49","192.168.2.103","TLSv1.2","207","Application Data"
"1055","16.137545","192.168.2.103","157.240.26.49","TCP","146","1222  >  443 [ACK] Seq=51555 Ack=22266 Win=254 Len=0"
"1061","16.309310","192.168.2.103","157.240.26.49","TCP","158","1225  >  443 [SYN] Seq=0 Win=64480 Len=0 MSS=1460 WS=256 SACK_PERM"
"1063","16.319470","157.240.26.49","192.168.2.103","TCP","158","443  >  1225 [SYN, ACK] Seq=0 Ack=1 Win=65535 Len=0 MSS=1392 SACK_PERM WS=256"
"1067","16.319735","192.168.2.103","157.240.26.49","TCP","146","1225  >  443 [ACK] Seq=1 Ack=1 Win=65536 Len=0"
"1071","16.324061","192.168.2.103","157.240.26.49","TLSv1.3","663","Client Hello (SNI=graph.oculus.com)"
"1073","16.334919","157.240.26.49","192.168.2.103","TCP","146","443  >  1225 [ACK] Seq=1 Ack=518 Win=66816 Len=0"
"1075","16.338243","157.240.26.49","192.168.2.103","TLSv1.3","1386","Server Hello, Change Cipher Spec, Application Data"
"1077","16.339232","157.240.26.49","192.168.2.103","TCP","1394","443  >  1225 [PSH, ACK] Seq=1241 Ack=518 Win=66816 Len=1240 [TCP PDU reassembled in 1078]"
"1078","16.339241","157.240.26.49","192.168.2.103","TLSv1.3","1301","Application Data, Application Data"
"1082","16.339457","192.168.2.103","157.240.26.49","TCP","146","1225  >  443 [ACK] Seq=518 Ack=3628 Win=65536 Len=0"
"1086","16.339745","192.168.2.103","157.240.26.49","TLSv1.3","210","Change Cipher Spec, Application Data"
"1090","16.340127","192.168.2.103","157.240.26.49","TLSv1.3","240","Application Data"
"1091","16.340142","192.168.2.103","157.240.26.49","TLSv1.3","653","Application Data"
"1093","16.349158","157.240.26.49","192.168.2.103","TCP","146","443  >  1225 [ACK] Seq=3628 Ack=668 Win=66816 Len=0"
"1095","16.349678","157.240.26.49","192.168.2.103","TLSv1.3","323","Application Data"
"1096","16.349688","157.240.26.49","192.168.2.103","TLSv1.3","228","Application Data"
"1097","16.349696","157.240.26.49","192.168.2.103","TLSv1.3","198","Application Data"
