"No.","Time","Source","Destination","Protocol","Length","Info"
"623","14.952531","23.192.220.4","192.168.2.103","TCP","1394","[TCP Retransmission] 443  >  1191 [ACK] Seq=12700 Ack=169 Win=501 Len=1240 [TCP PDU reassembled in 616]"
"624","14.952540","23.192.220.4","192.168.2.103","TCP","1394","[TCP Retransmission] 443  >  1191 [ACK] Seq=13940 Ack=169 Win=501 Len=1240 [TCP PDU reassembled in 616]"
"673","14.965044","23.192.220.4","192.168.2.103","TCP","1394","[TCP Retransmission] 443  >  1191 [ACK] Seq=52666 Ack=169 Win=501 Len=1240 [TCP PDU reassembled in 685]"
"697","14.966590","23.192.220.4","192.168.2.103","TCP","1394","[TCP Retransmission] 443  >  1191 [PSH, ACK] Seq=67546 Ack=169 Win=501 Len=1240"
"698","14.966594","23.192.220.4","192.168.2.103","TCP","1394","[TCP Retransmission] 443  >  1191 [ACK] Seq=68786 Ack=169 Win=501 Len=1240 [TCP PDU reassembled in 687]"
"699","14.966598","23.192.220.4","192.168.2.103","TCP","314","[TCP Retransmission] 443  >  1191 [PSH, ACK] Seq=70026 Ack=169 Win=501 Len=160 [TCP PDU reassembled in 687]"
"789","15.139227","192.168.2.103","157.240.26.49","TCP","184","[TCP Retransmission] 1222  >  443 [PSH, ACK] Seq=7807 Ack=3700 Win=256 Len=38"
"793","15.139848","192.168.2.103","157.240.26.49","TCP","1394","[TCP Retransmission] 1222  >  443 [ACK] Seq=5500 Ack=3619 Win=256 Len=1240 [TCP PDU reassembled in 782]"
"794","15.139856","192.168.2.103","157.240.26.49","TCP","1221","[TCP Retransmission] 1222  >  443 [PSH, ACK] Seq=6740 Ack=3619 Win=256 Len=1067 [TCP PDU reassembled in 782]"
"797","15.140665","192.168.2.103","157.240.26.49","TCP","1394","[TCP Retransmission] 1222  >  443 [ACK] Seq=5500 Ack=3619 Win=256 Len=1240 [TCP PDU reassembled in 782]"
"798","15.140669","192.168.2.103","157.240.26.49","TCP","1221","[TCP Retransmission] 1222  >  443 [PSH, ACK] Seq=6740 Ack=3619 Win=256 Len=1067 [TCP PDU reassembled in 782]"
"878","15.244300","192.168.2.103","157.240.26.49","TCP","1386","[TCP Retransmission] 1222  >  443 [ACK] Seq=15171 Ack=9770 Win=256 Len=1240"
"887","15.256139","157.240.26.49","192.168.2.103","TCP","188","[TCP Retransmission] 443  >  1222 [PSH, ACK] Seq=9770 Ack=22410 Win=116224 Len=42"
"912","15.296852","192.168.2.103","157.240.26.49","TCP","196","[TCP Retransmission] 1222  >  443 [PSH, ACK] Seq=22410 Ack=12887 Win=256 Len=42"
"913","15.298086","192.168.2.103","157.240.26.49","TCP","1394","[TCP Retransmission] 1222  >  443 [ACK] Seq=22452 Ack=12887 Win=256 Len=1240"
"914","15.298093","192.168.2.103","157.240.26.49","TCP","1394","[TCP Retransmission] 1222  >  443 [ACK] Seq=23692 Ack=12887 Win=256 Len=1240 [TCP PDU reassembled in 908]"
"915","15.298095","192.168.2.103","157.240.26.49","TCP","1394","[TCP Retransmission] 1222  >  443 [ACK] Seq=24932 Ack=12887 Win=256 Len=1240 [TCP PDU reassembled in 908]"
"916","15.298098","192.168.2.103","157.240.26.49","TCP","1394","[TCP Retransmission] 1222  >  443 [ACK] Seq=26172 Ack=12887 Win=256 Len=1240 [TCP PDU reassembled in 908]"
"917","15.298101","192.168.2.103","157.240.26.49","TCP","1394","[TCP Retransmission] 1222  >  443 [ACK] Seq=27412 Ack=12887 Win=256 Len=1240 [TCP PDU reassembled in 908]"
"918","15.298104","192.168.2.103","157.240.26.49","TCP","1193","[TCP Retransmission] 1222  >  443 [PSH, ACK] Seq=28652 Ack=12887 Win=256 Len=1039 [TCP PDU reassembled in 908]"
"1032","16.048577","192.168.2.103","157.240.26.49","TCP","1386","[TCP Retransmission] 1222  >  443 [ACK] Seq=45535 Ack=21769 Win=256 Len=1240 [TCP PDU reassembled in 1028]"
"1168","16.646776","192.168.2.103","157.240.26.49","TCP","556","[TCP Retransmission] 1225  >  443 [PSH, ACK] Seq=3238 Ack=4980 Win=65536 Len=402"
"1169","16.646787","192.168.2.103","157.240.26.49","TCP","490","[TCP Retransmission] 1225  >  443 [PSH, ACK] Seq=3640 Ack=4980 Win=65536 Len=336"
"1338","18.025836","157.240.26.49","192.168.2.103","TCP","1394","[TCP Retransmission] 443  >  1225 [ACK] Seq=54719 Ack=3976 Win=77056 Len=1240 [TCP PDU reassembled in 1329]"
"1528","18.336864","157.240.26.49","192.168.2.103","TCP","1394","[TCP Retransmission] 443  >  1225 [ACK] Seq=130408 Ack=3976 Win=77056 Len=1240 [TCP PDU reassembled in 1552]"
"1529","18.336874","157.240.26.49","192.168.2.103","TCP","1394","[TCP Retransmission] 443  >  1225 [PSH, ACK] Seq=131648 Ack=3976 Win=77056 Len=1240 [TCP PDU reassembled in 1552]"
"1550","18.342379","157.240.26.49","192.168.2.103","TCP","1394","[TCP Retransmission] 443  >  1225 [PSH, ACK] Seq=151488 Ack=3976 Win=77056 Len=1240 [TCP PDU reassembled in 1561]"
"1697","19.963201","192.168.2.103","34.107.172.168","TCP","289","[TCP Retransmission] 1228  >  443 [PSH, ACK] Seq=2090 Ack=220 Win=66048 Len=135"
"1723","19.987530","192.168.2.103","34.107.172.168","TCP","1386","[TCP Retransmission] 1228  >  443 [ACK] Seq=678 Ack=220 Win=66048 Len=1240"
"1735","20.006226","192.168.2.103","34.107.172.168","TCP","1394","[TCP Retransmission] 1228  >  443 [ACK] Seq=678 Ack=220 Win=66048 Len=1240"
"1736","20.006235","192.168.2.103","34.107.172.168","TCP","326","[TCP Retransmission] 1228  >  443 [ACK] Seq=1918 Ack=220 Win=66048 Len=172"
"1845","20.149574","192.168.2.103","34.36.199.114","TCP","828","[TCP Retransmission] 1233  >  443 [PSH, ACK] Seq=1 Ack=1 Win=66304 Len=674"
"1846","20.149577","192.168.2.103","34.36.199.114","TCP","828","[TCP Retransmission] 1234  >  443 [PSH, ACK] Seq=1 Ack=1 Win=66304 Len=674"
"1847","20.149581","192.168.2.103","34.36.199.114","TCP","828","[TCP Retransmission] 1237  >  443 [PSH, ACK] Seq=1 Ack=1 Win=66304 Len=674"
"1886","20.175426","192.168.2.103","34.36.199.114","TCP","517","[TCP Retransmission] 1231  >  443 [PSH, ACK] Seq=675 Ack=220 Win=66048 Len=371"
"1950","20.207270","192.168.2.103","34.36.199.114","TCP","441","[TCP Retransmission] 1230  >  443 [PSH, ACK] Seq=1046 Ack=1073 Win=65280 Len=287"
"1951","20.207273","192.168.2.103","34.36.199.114","TCP","443","[TCP Retransmission] 1236  >  443 [PSH, ACK] Seq=1046 Ack=965 Win=65280 Len=289"
"1952","20.207276","192.168.2.103","34.36.199.114","TCP","447","[TCP Retransmission] 1234  >  443 [PSH, ACK] Seq=1044 Ack=965 Win=65280 Len=293"
"2315","20.311194","192.168.2.103","34.36.199.114","TCP","481","[TCP Retransmission] 1231  >  443 [PSH, ACK] Seq=2306 Ack=1845 Win=65792 Len=335"
"2610","21.593826","192.168.2.103","157.240.26.35","TCP","495","[TCP Retransmission] 1243  >  443 [PSH, ACK] Seq=1 Ack=1 Win=65536 Len=341"
"2611","21.593830","192.168.2.103","157.240.26.35","TCP","495","[TCP Retransmission] 1241  >  443 [PSH, ACK] Seq=1 Ack=1 Win=65536 Len=341"
"3076","26.613589","192.168.2.103","142.250.191.170","TCP","1566","[TCP Retransmission] 1246  >  443 [ACK] Seq=429 Ack=4690 Win=66048 Len=1412"
"3077","26.613597","192.168.2.103","142.250.191.170","TCP","675","[TCP Retransmission] 1246  >  443 [PSH, ACK] Seq=1841 Ack=4690 Win=66048 Len=521 [TCP PDU reassembled in 3073]"
"3083","26.614602","192.168.2.103","142.250.191.170","TCP","1386","[TCP Retransmission] 1246  >  443 [ACK] Seq=429 Ack=4690 Win=66048 Len=1240"
"3091","26.623074","192.168.2.103","142.250.191.170","TCP","839","[TCP Retransmission] 1246  >  443 [PSH, ACK] Seq=1669 Ack=4690 Win=66048 Len=693 [TCP PDU reassembled in 3073]"
"3140","28.717257","192.168.2.103","142.250.191.170","TCP","1386","[TCP Retransmission] 1246  >  443 [ACK] Seq=2362 Ack=5323 Win=65280 Len=1240"
"3185","30.063877","192.168.2.103","34.107.172.168","TCP","1147","[TCP Retransmission] 1228  >  443 [PSH, ACK] Seq=2225 Ack=983 Win=65280 Len=1001"
"3745","42.441206","142.250.191.170","192.168.2.103","TCP","1394","[TCP Retransmission] 443  >  1251 [ACK] Seq=109711 Ack=1003 Win=269056 Len=1240 [TCP PDU reassembled in 3722]"
"3789","42.449640","142.250.191.170","192.168.2.103","TCP","1394","[TCP Retransmission] 443  >  1251 [ACK] Seq=154167 Ack=1003 Win=269056 Len=1240"
"4417","42.566317","142.250.191.170","192.168.2.103","TCP","1394","[TCP Retransmission] 443  >  1251 [PSH, ACK] Seq=538567 Ack=1003 Win=269056 Len=1240"
"4437","42.569148","142.250.191.170","192.168.2.103","TCP","1394","[TCP Retransmission] 443  >  1251 [ACK] Seq=557167 Ack=1003 Win=269056 Len=1240"
"4642","42.614815","142.250.191.170","192.168.2.103","TCP","1394","[TCP Retransmission] 443  >  1251 [ACK] Seq=702247 Ack=1003 Win=269056 Len=1240"
"4710","42.627235","142.250.191.170","192.168.2.103","TCP","1386","[TCP Retransmission] 443  >  1251 [ACK] Seq=748127 Ack=1003 Win=269056 Len=1240"
"4795","42.646679","142.250.191.170","192.168.2.103","TCP","1394","[TCP Retransmission] 443  >  1251 [ACK] Seq=789047 Ack=1003 Win=269056 Len=1240"
"5012","42.696486","142.250.191.170","192.168.2.103","TCP","1394","[TCP Retransmission] 443  >  1251 [ACK] Seq=919247 Ack=1003 Win=269056 Len=1240"
"5013","42.696491","142.250.191.170","192.168.2.103","TCP","1394","[TCP Retransmission] 443  >  1251 [PSH, ACK] Seq=920487 Ack=1003 Win=269056 Len=1240"
"5060","42.708768","142.250.191.170","192.168.2.103","TCP","1394","[TCP Retransmission] 443  >  1251 [PSH, ACK] Seq=946527 Ack=1003 Win=269056 Len=1240"
"5208","42.740388","142.250.191.170","192.168.2.103","TCP","1394","[TCP Retransmission] 443  >  1251 [PSH, ACK] Seq=1050687 Ack=1003 Win=269056 Len=1240"
"5255","42.748266","142.250.191.170","192.168.2.103","TCP","1394","[TCP Retransmission] 443  >  1251 [PSH, ACK] Seq=1091607 Ack=1003 Win=269056 Len=1240"
"5519","42.797155","142.250.191.170","192.168.2.103","TCP","1394","[TCP Retransmission] 443  >  1251 [ACK] Seq=1267687 Ack=1003 Win=269056 Len=1240 [TCP PDU reassembled in 5577]"
"5521","42.797164","142.250.191.170","192.168.2.103","TCP","1394","[TCP Retransmission] 443  >  1251 [PSH, ACK] Seq=1270167 Ack=1003 Win=269056 Len=1240 [TCP PDU reassembled in 5577]"
"5522","42.797167","142.250.191.170","192.168.2.103","TCP","1394","[TCP Retransmission] 443  >  1251 [ACK] Seq=1271407 Ack=1003 Win=269056 Len=1240 [TCP PDU reassembled in 5577]"
"5619","42.818928","142.250.191.170","192.168.2.103","TCP","1394","[TCP Retransmission] 443  >  1251 [PSH, ACK] Seq=1344567 Ack=1003 Win=269056 Len=1240"
"5621","42.818936","142.250.191.170","192.168.2.103","TCP","1394","[TCP Retransmission] 443  >  1251 [PSH, ACK] Seq=1348287 Ack=1003 Win=269056 Len=1240"
"5639","42.822446","142.250.191.170","192.168.2.103","TCP","1394","[TCP Retransmission] 443  >  1251 [PSH, ACK] Seq=1359447 Ack=1003 Win=269056 Len=1240"
"5641","42.822448","142.250.191.170","192.168.2.103","TCP","1394","[TCP Retransmission] 443  >  1251 [ACK] Seq=1361927 Ack=1003 Win=269056 Len=1240"
"5642","42.822449","142.250.191.170","192.168.2.103","TCP","1394","[TCP Retransmission] 443  >  1251 [PSH, ACK] Seq=1363167 Ack=1003 Win=269056 Len=1240"
"5793","42.858252","142.250.191.170","192.168.2.103","TCP","1394","[TCP Retransmission] 443  >  1251 [ACK] Seq=1438807 Ack=1003 Win=269056 Len=1240"
"5794","42.858254","142.250.191.170","192.168.2.103","TCP","1394","[TCP Retransmission] 443  >  1251 [ACK] Seq=1440047 Ack=1003 Win=269056 Len=1240"
"5795","42.858256","142.250.191.170","192.168.2.103","TCP","1394","[TCP Retransmission] 443  >  1251 [PSH, ACK] Seq=1441287 Ack=1003 Win=269056 Len=1240"
"5940","44.114736","192.168.2.103","142.250.191.170","TCP","1386","[TCP Retransmission] 1246  >  443 [ACK] Seq=12027 Ack=8472 Win=66304 Len=1240"
"5943","44.115287","192.168.2.103","142.250.191.170","TCP","1386","[TCP Retransmission] 1246  >  443 [ACK] Seq=12027 Ack=8472 Win=66304 Len=1240"
"6308","52.046725","142.250.191.170","192.168.2.103","TCP","1394","[TCP Retransmission] 443  >  1251 [PSH, ACK] Seq=1549363 Ack=1577 Win=268544 Len=1240"
"6309","52.046728","142.250.191.170","192.168.2.103","TCP","1394","[TCP Retransmission] 443  >  1251 [PSH, ACK] Seq=1550603 Ack=1577 Win=268544 Len=1240"
"6322","52.048679","142.250.191.170","192.168.2.103","TCP","1394","[TCP Retransmission] 443  >  1251 [PSH, ACK] Seq=1556803 Ack=1577 Win=268544 Len=1240"
"6562","52.100796","142.250.191.170","192.168.2.103","TCP","1394","[TCP Retransmission] 443  >  1251 [PSH, ACK] Seq=1719707 Ack=1577 Win=268544 Len=1240"
"6563","52.100800","142.250.191.170","192.168.2.103","TCP","1394","[TCP Retransmission] 443  >  1251 [ACK] Seq=1720947 Ack=1577 Win=268544 Len=1240"
"7471","52.286673","142.250.191.170","192.168.2.103","TCP","1394","[TCP Retransmission] 443  >  1251 [PSH, ACK] Seq=2312315 Ack=1577 Win=268544 Len=1240"
"8188","52.439830","142.250.191.170","192.168.2.103","TCP","1394","[TCP Fast Retransmission] 443  >  1251 [ACK] Seq=2802115 Ack=1577 Win=268544 Len=1240 [TCP PDU reassembled in 8217]"
"8539","52.510483","142.250.191.170","192.168.2.103","TCP","1394","[TCP Retransmission] 443  >  1251 [PSH, ACK] Seq=3052595 Ack=1577 Win=268544 Len=1240"
"8570","52.517145","142.250.191.170","192.168.2.103","TCP","1394","[TCP Retransmission] 443  >  1251 [ACK] Seq=3083595 Ack=1577 Win=268544 Len=1240"
"8575","52.518104","142.250.191.170","192.168.2.103","TCP","1386","[TCP Retransmission] 443  >  1251 [ACK] Seq=3092275 Ack=1577 Win=268544 Len=1240"
"8719","55.213104","192.168.2.103","142.250.191.170","TCP","1386","[TCP Retransmission] 1246  >  443 [ACK] Seq=19759 Ack=10990 Win=66304 Len=1240"
"8748","56.352783","192.168.2.103","157.240.26.11","TCP","177","[TCP Retransmission] 1084  >  443 [PSH, ACK] Seq=32 Ack=32 Win=259 Len=31"
"9088","62.306169","142.250.191.170","192.168.2.103","TCP","1394","[TCP Retransmission] 443  >  1251 [PSH, ACK] Seq=3164077 Ack=2151 Win=268032 Len=1240"
"9179","62.321309","142.250.191.170","192.168.2.103","TCP","1394","[TCP Retransmission] 443  >  1251 [ACK] Seq=3225974 Ack=2151 Win=268032 Len=1240"
"9180","62.321313","142.250.191.170","192.168.2.103","TCP","1394","[TCP Retransmission] 443  >  1251 [ACK] Seq=3227214 Ack=2151 Win=268032 Len=1240"
"9182","62.321322","142.250.191.170","192.168.2.103","TCP","1394","[TCP Retransmission] 443  >  1251 [ACK] Seq=3229694 Ack=2151 Win=268032 Len=1240 [TCP PDU reassembled in 9170]"
"9183","62.321327","142.250.191.170","192.168.2.103","TCP","1394","[TCP Retransmission] 443  >  1251 [ACK] Seq=3230934 Ack=2151 Win=268032 Len=1240 [TCP PDU reassembled in 9171]"
"9483","62.373342","142.250.191.170","192.168.2.103","TCP","1386","[TCP Retransmission] 443  >  1251 [ACK] Seq=3468902 Ack=2151 Win=268032 Len=1240 [TCP PDU reassembled in 9587]"
"9678","62.414002","142.250.191.170","192.168.2.103","TCP","1394","[TCP Retransmission] 443  >  1251 [ACK] Seq=3601470 Ack=2151 Win=268032 Len=1240 [TCP PDU reassembled in 9750]"
"9680","62.414007","142.250.191.170","192.168.2.103","TCP","1394","[TCP Retransmission] 443  >  1251 [ACK] Seq=3603950 Ack=2151 Win=268032 Len=1240 [TCP PDU reassembled in 9750]"
"9759","62.427209","142.250.191.170","192.168.2.103","TCP","1394","[TCP Retransmission] 443  >  1251 [ACK] Seq=3659750 Ack=2151 Win=268032 Len=1240"
"9761","62.427218","142.250.191.170","192.168.2.103","TCP","1394","[TCP Retransmission] 443  >  1251 [ACK] Seq=3662230 Ack=2151 Win=268032 Len=1240"
"9840","62.440315","142.250.191.170","192.168.2.103","TCP","1394","[TCP Retransmission] 443  >  1251 [PSH, ACK] Seq=3714310 Ack=2151 Win=268032 Len=1240"
"9861","62.444739","142.250.191.170","192.168.2.103","TCP","1394","[TCP Retransmission] 443  >  1251 [ACK] Seq=3722990 Ack=2151 Win=268032 Len=1240"
"9862","62.444743","142.250.191.170","192.168.2.103","TCP","1394","[TCP Retransmission] 443  >  1251 [PSH, ACK] Seq=3724230 Ack=2151 Win=268032 Len=1240"
"9910","62.452772","142.250.191.170","192.168.2.103","TCP","1394","[TCP Retransmission] 443  >  1251 [ACK] Seq=3760190 Ack=2151 Win=268032 Len=1240"
"9947","62.459737","142.250.191.170","192.168.2.103","TCP","1394","[TCP Retransmission] 443  >  1251 [ACK] Seq=3777550 Ack=2151 Win=268032 Len=1240"
"10358","62.540165","142.250.191.170","192.168.2.103","TCP","1394","[TCP Retransmission] 443  >  1251 [ACK] Seq=4060270 Ack=2151 Win=268032 Len=1240"
"10770","62.618877","142.250.191.170","192.168.2.103","TCP","1394","[TCP Retransmission] 443  >  1251 [ACK] Seq=4376358 Ack=2151 Win=268032 Len=1240"
"10771","62.618881","142.250.191.170","192.168.2.103","TCP","1394","[TCP Retransmission] 443  >  1251 [ACK] Seq=4377598 Ack=2151 Win=268032 Len=1240"
"10975","62.650689","142.250.191.170","192.168.2.103","TCP","1394","[TCP Retransmission] 443  >  1251 [PSH, ACK] Seq=4512758 Ack=2151 Win=268032 Len=1240 [TCP PDU reassembled in 11033]"
"10979","62.650704","142.250.191.170","192.168.2.103","TCP","1394","[TCP Retransmission] 443  >  1251 [ACK] Seq=4517718 Ack=2151 Win=268032 Len=1240 [TCP PDU reassembled in 11033]"
"11096","62.676118","142.250.191.170","192.168.2.103","TCP","1394","[TCP Fast Retransmission] 443  >  1251 [ACK] Seq=4574758 Ack=2151 Win=268032 Len=1240 [TCP PDU reassembled in 11091]"
"11395","72.683651","192.168.2.103","142.250.191.170","TCP","1394","[TCP Retransmission] 1246  >  443 [ACK] Seq=29424 Ack=14140 Win=65536 Len=1240"
"11396","72.683663","192.168.2.103","142.250.191.170","TCP","847","[TCP Retransmission] 1246  >  443 [PSH, ACK] Seq=30664 Ack=14140 Win=65536 Len=693 [TCP PDU reassembled in 11391]"
"11971","73.212936","142.250.191.170","192.168.2.103","TCP","1394","[TCP Retransmission] 443  >  1251 [ACK] Seq=5002104 Ack=2725 Win=267520 Len=1240"
"11972","73.212940","142.250.191.170","192.168.2.103","TCP","1394","[TCP Retransmission] 443  >  1251 [ACK] Seq=5003344 Ack=2725 Win=267520 Len=1240"
"12326","73.290538","142.250.191.170","192.168.2.103","TCP","1394","[TCP Retransmission] 443  >  1251 [ACK] Seq=5281104 Ack=2725 Win=267520 Len=1240"
"12327","73.290541","142.250.191.170","192.168.2.103","TCP","1394","[TCP Retransmission] 443  >  1251 [PSH, ACK] Seq=5282344 Ack=2725 Win=267520 Len=1240"
"12328","73.290545","142.250.191.170","192.168.2.103","TCP","1394","[TCP Retransmission] 443  >  1251 [ACK] Seq=5283584 Ack=2725 Win=267520 Len=1240"
"12329","73.290550","142.250.191.170","192.168.2.103","TCP","1394","[TCP Retransmission] 443  >  1251 [ACK] Seq=5284824 Ack=2725 Win=267520 Len=1240"
"12373","73.298503","142.250.191.170","192.168.2.103","TCP","1394","[TCP Retransmission] 443  >  1251 [ACK] Seq=5309624 Ack=2725 Win=267520 Len=1240"
"12374","73.298505","142.250.191.170","192.168.2.103","TCP","1394","[TCP Retransmission] 443  >  1251 [ACK] Seq=5310864 Ack=2725 Win=267520 Len=1240"
"12644","73.347116","142.250.191.170","192.168.2.103","TCP","1394","[TCP Retransmission] 443  >  1251 [PSH, ACK] Seq=5479504 Ack=2725 Win=267520 Len=1240 [TCP PDU reassembled in 12647]"
"12646","73.347124","142.250.191.170","192.168.2.103","TCP","1394","[TCP Retransmission] 443  >  1251 [ACK] Seq=5481984 Ack=2725 Win=267520 Len=1240 [TCP PDU reassembled in 12647]"
"12845","73.388440","142.250.191.170","192.168.2.103","TCP","1394","[TCP Retransmission] 443  >  1251 [ACK] Seq=5593584 Ack=2725 Win=267520 Len=1240"
"12911","73.399760","142.250.191.170","192.168.2.103","TCP","1394","[TCP Retransmission] 443  >  1251 [PSH, ACK] Seq=5643184 Ack=2725 Win=267520 Len=1240 [TCP PDU reassembled in 12902]"
"12912","73.399764","142.250.191.170","192.168.2.103","TCP","1394","[TCP Retransmission] 443  >  1251 [ACK] Seq=5648144 Ack=2725 Win=267520 Len=1240"
"13163","73.450270","142.250.191.170","192.168.2.103","TCP","1394","[TCP Retransmission] 443  >  1251 [PSH, ACK] Seq=5846544 Ack=2725 Win=267520 Len=1240"
"13164","73.450273","142.250.191.170","192.168.2.103","TCP","1394","[TCP Retransmission] 443  >  1251 [ACK] Seq=5847784 Ack=2725 Win=267520 Len=1240"
"13212","73.468118","142.250.191.170","192.168.2.103","TCP","1394","[TCP Retransmission] 443  >  1251 [ACK] Seq=5862664 Ack=2725 Win=267520 Len=1240"
"13213","73.468123","142.250.191.170","192.168.2.103","TCP","1394","[TCP Retransmission] 443  >  1251 [ACK] Seq=5863904 Ack=2725 Win=267520 Len=1240"
"13253","73.475416","142.250.191.170","192.168.2.103","TCP","1394","[TCP Retransmission] 443  >  1251 [ACK] Seq=5899864 Ack=2725 Win=267520 Len=1240 [TCP PDU reassembled in 13271]"
"13255","73.475424","142.250.191.170","192.168.2.103","TCP","1394","[TCP Retransmission] 443  >  1251 [PSH, ACK] Seq=5902344 Ack=2725 Win=267520 Len=1240 [TCP PDU reassembled in 13271]"
"13530","73.532791","142.250.191.170","192.168.2.103","TCP","1394","[TCP Retransmission] 443  >  1251 [ACK] Seq=6079664 Ack=2725 Win=267520 Len=1240"
"13614","73.548267","142.250.191.170","192.168.2.103","TCP","1394","[TCP Retransmission] 443  >  1251 [ACK] Seq=6128024 Ack=2725 Win=267520 Len=1240"
"13767","75.376766","192.168.2.103","142.250.191.170","TCP","847","[TCP Retransmission] 1246  >  443 [PSH, ACK] Seq=32597 Ack=14773 Win=66304 Len=693 [TCP PDU reassembled in 13763]"
"13770","75.377701","192.168.2.103","142.250.191.170","TCP","1394","[TCP Retransmission] 1246  >  443 [ACK] Seq=31357 Ack=14773 Win=66304 Len=1240"
"13771","75.377716","192.168.2.103","142.250.191.170","TCP","847","[TCP Retransmission] 1246  >  443 [PSH, ACK] Seq=32597 Ack=14773 Win=66304 Len=693 [TCP PDU reassembled in 13763]"
"13889","81.004051","192.168.2.103","142.250.191.170","TCP","1386","[TCP Retransmission] 1246  >  443 [ACK] Seq=35223 Ack=16039 Win=66304 Len=1240"
"13894","81.005465","192.168.2.103","142.250.191.170","TCP","1386","[TCP Retransmission] 1246  >  443 [ACK] Seq=35223 Ack=16039 Win=66304 Len=1240"
"14263","82.149593","142.250.191.170","192.168.2.103","TCP","1394","[TCP Retransmission] 443  >  1251 [PSH, ACK] Seq=6416668 Ack=3299 Win=267008 Len=1240"
"14264","82.149596","142.250.191.170","192.168.2.103","TCP","1394","[TCP Retransmission] 443  >  1251 [ACK] Seq=6417908 Ack=3299 Win=267008 Len=1240"
"14517","82.209312","142.250.191.170","192.168.2.103","TCP","1394","[TCP Retransmission] 443  >  1251 [ACK] Seq=6549348 Ack=3299 Win=267008 Len=1240 [TCP PDU reassembled in 14539]"
"14562","82.218219","142.250.191.170","192.168.2.103","TCP","1394","[TCP Retransmission] 443  >  1251 [PSH, ACK] Seq=6580348 Ack=3299 Win=267008 Len=1240"
"14616","82.228611","142.250.191.170","192.168.2.103","TCP","1394","[TCP Retransmission] 443  >  1251 [PSH, ACK] Seq=6605148 Ack=3299 Win=267008 Len=1240"
"14805","82.271335","142.250.191.170","192.168.2.103","TCP","1394","[TCP Retransmission] 443  >  1251 [ACK] Seq=6721708 Ack=3299 Win=267008 Len=1240"
"14806","82.271339","142.250.191.170","192.168.2.103","TCP","1394","[TCP Retransmission] 443  >  1251 [ACK] Seq=6722948 Ack=3299 Win=267008 Len=1240"
"14849","82.279463","142.250.191.170","192.168.2.103","TCP","1394","[TCP Retransmission] 443  >  1251 [ACK] Seq=6745268 Ack=3299 Win=267008 Len=1240"
"14850","82.279468","142.250.191.170","192.168.2.103","TCP","1394","[TCP Retransmission] 443  >  1251 [ACK] Seq=6750228 Ack=3299 Win=267008 Len=1240"
"14948","82.300671","142.250.191.170","192.168.2.103","TCP","1394","[TCP Retransmission] 443  >  1251 [PSH, ACK] Seq=6798588 Ack=3299 Win=267008 Len=1240 [TCP PDU reassembled in 14989]"
"14995","82.308535","142.250.191.170","192.168.2.103","TCP","1394","[TCP Retransmission] 443  >  1251 [ACK] Seq=6830828 Ack=3299 Win=267008 Len=1240"
"15128","82.339243","142.250.191.170","192.168.2.103","TCP","1386","[TCP Retransmission] 443  >  1251 [PSH, ACK] Seq=6926308 Ack=3299 Win=267008 Len=1240"
"15142","82.342862","142.250.191.170","192.168.2.103","TCP","1394","[TCP Retransmission] 443  >  1251 [PSH, ACK] Seq=6933748 Ack=3299 Win=267008 Len=1240"
"15267","82.369316","142.250.191.170","192.168.2.103","TCP","1394","[TCP Retransmission] 443  >  1251 [ACK] Seq=7009388 Ack=3299 Win=267008 Len=1240"
"15268","82.369320","142.250.191.170","192.168.2.103","TCP","1394","[TCP Retransmission] 443  >  1251 [ACK] Seq=7010628 Ack=3299 Win=267008 Len=1240"
"15967","82.509439","142.250.191.170","192.168.2.103","TCP","1394","[TCP Retransmission] 443  >  1251 [ACK] Seq=7444628 Ack=3299 Win=267008 Len=1240"
"16130","82.546666","142.250.191.170","192.168.2.103","TCP","1394","[TCP Retransmission] 443  >  1251 [ACK] Seq=7528948 Ack=3299 Win=267008 Len=1240"
"16150","82.550370","142.250.191.170","192.168.2.103","TCP","1394","[TCP Retransmission] 443  >  1251 [ACK] Seq=7538868 Ack=3299 Win=267008 Len=1240"
"16219","82.561547","142.250.191.170","192.168.2.103","TCP","1394","[TCP Retransmission] 443  >  1251 [ACK] Seq=7581028 Ack=3299 Win=267008 Len=1240 [TCP PDU reassembled in 16238]"
"16414","82.874349","192.168.2.103","20.189.173.13","TCP","146","[TCP Retransmission] 1126  >  443 [FIN, ACK] Seq=1 Ack=1 Win=1021 Len=0"
"16465","83.472239","192.168.2.103","20.189.173.13","TCP","146","[TCP Retransmission] 1126  >  443 [FIN, ACK] Seq=1 Ack=1 Win=1021 Len=0"
"16479","84.674864","192.168.2.103","20.189.173.13","TCP","146","[TCP Retransmission] 1126  >  443 [FIN, ACK] Seq=1 Ack=1 Win=1021 Len=0"
"16597","86.334097","192.168.2.103","142.250.191.170","TCP","1394","[TCP Retransmission] 1246  >  443 [ACK] Seq=39089 Ack=17305 Win=66304 Len=1240"
"16598","86.334106","192.168.2.103","142.250.191.170","TCP","847","[TCP Retransmission] 1246  >  443 [PSH, ACK] Seq=40329 Ack=17305 Win=66304 Len=693 [TCP PDU reassembled in 16592]"
"16602","86.334589","192.168.2.103","142.250.191.170","TCP","1386","[TCP Retransmission] 1246  >  443 [ACK] Seq=39089 Ack=17305 Win=66304 Len=1240"
"16605","86.334974","192.168.2.103","142.250.191.170","TCP","1386","[TCP Retransmission] 1246  >  443 [ACK] Seq=39089 Ack=17305 Win=66304 Len=1240"
"16645","87.083718","192.168.2.103","20.189.173.13","TCP","146","[TCP Retransmission] 1126  >  443 [FIN, ACK] Seq=1 Ack=1 Win=1021 Len=0"
"16698","88.347676","192.168.2.103","142.250.191.170","TCP","1394","[TCP Retransmission] 1246  >  443 [ACK] Seq=41022 Ack=17931 Win=65536 Len=1240"
"16699","88.347686","192.168.2.103","142.250.191.170","TCP","847","[TCP Retransmission] 1246  >  443 [PSH, ACK] Seq=42262 Ack=17931 Win=65536 Len=693 [TCP PDU reassembled in 16692]"
"16809","91.494298","192.168.2.103","142.250.191.170","TCP","720","[TCP Retransmission] 1251  >  443 [PSH, ACK] Seq=3299 Ack=7682865 Win=262656 Len=574"
"16856","91.896308","192.168.2.103","20.189.173.13","TCP","146","[TCP Retransmission] 1126  >  443 [FIN, ACK] Seq=1 Ack=1 Win=1021 Len=0"
"16888","92.071677","142.250.191.170","192.168.2.103","TCP","1394","[TCP Retransmission] 443  >  1251 [PSH, ACK] Seq=7697745 Ack=3873 Win=266496 Len=1240 [TCP PDU reassembled in 16879]"
"16889","92.071682","142.250.191.170","192.168.2.103","TCP","1394","[TCP Retransmission] 443  >  1251 [ACK] Seq=7698985 Ack=3873 Win=266496 Len=1240 [TCP PDU reassembled in 16880]"
"16890","92.071686","142.250.191.170","192.168.2.103","TCP","1394","[TCP Retransmission] 443  >  1251 [ACK] Seq=7700225 Ack=3873 Win=266496 Len=1240 [TCP PDU reassembled in 16881]"
"16891","92.071690","142.250.191.170","192.168.2.103","TCP","1394","[TCP Retransmission] 443  >  1251 [PSH, ACK] Seq=7701465 Ack=3873 Win=266496 Len=1240 [TCP PDU reassembled in 16882]"
"16937","92.079833","142.250.191.170","192.168.2.103","TCP","1394","[TCP Retransmission] 443  >  1251 [ACK] Seq=7739905 Ack=3873 Win=266496 Len=1240"
"16938","92.079836","142.250.191.170","192.168.2.103","TCP","1394","[TCP Retransmission] 443  >  1251 [ACK] Seq=7741145 Ack=3873 Win=266496 Len=1240"
"17268","92.133423","192.168.2.103","157.240.26.49","TCP","952","[TCP Retransmission] 1101  >  443 [PSH, ACK] Seq=1301 Ack=328 Win=258 Len=798"
"17272","92.135262","142.250.191.170","192.168.2.103","TCP","1394","[TCP Retransmission] 443  >  1251 [ACK] Seq=7944505 Ack=3873 Win=266496 Len=1240"
"17273","92.135267","142.250.191.170","192.168.2.103","TCP","1394","[TCP Retransmission] 443  >  1251 [ACK] Seq=7945745 Ack=3873 Win=266496 Len=1240"
"17314","92.145250","142.250.191.170","192.168.2.103","TCP","1386","[TCP Retransmission] 443  >  1251 [ACK] Seq=7977985 Ack=3873 Win=266496 Len=1240"
"17317","92.147111","142.250.191.170","192.168.2.103","TCP","1394","[TCP Retransmission] 443  >  1251 [PSH, ACK] Seq=7980465 Ack=3873 Win=266496 Len=1240"
"17673","92.219486","142.250.191.170","192.168.2.103","TCP","1394","[TCP Retransmission] 443  >  1251 [ACK] Seq=8206145 Ack=3873 Win=266496 Len=1240"
"17952","92.272603","142.250.191.170","192.168.2.103","TCP","1394","[TCP Retransmission] 443  >  1251 [ACK] Seq=8415705 Ack=3873 Win=266496 Len=1240 [TCP PDU reassembled in 17953]"
"18054","92.291782","142.250.191.170","192.168.2.103","TCP","1394","[TCP Retransmission] 443  >  1251 [PSH, ACK] Seq=8456625 Ack=3873 Win=266496 Len=1240"
"18278","92.335935","157.240.26.49","192.168.2.103","TCP","154","[TCP Retransmission] 443  >  1225 [FIN, ACK] Seq=204605 Ack=4317 Win=79104 Len=0"
"18305","92.340089","142.250.191.170","192.168.2.103","TCP","1394","[TCP Retransmission] 443  >  1251 [ACK] Seq=8638905 Ack=3873 Win=266496 Len=1240 [TCP PDU reassembled in 18312]"
"18306","92.340094","142.250.191.170","192.168.2.103","TCP","1394","[TCP Retransmission] 443  >  1251 [PSH, ACK] Seq=8640145 Ack=3873 Win=266496 Len=1240 [TCP PDU reassembled in 18312]"
"18307","92.340097","142.250.191.170","192.168.2.103","TCP","1394","[TCP Retransmission] 443  >  1251 [ACK] Seq=8641385 Ack=3873 Win=266496 Len=1240 [TCP PDU reassembled in 18312]"
"18308","92.340101","142.250.191.170","192.168.2.103","TCP","1394","[TCP Retransmission] 443  >  1251 [ACK] Seq=8642625 Ack=3873 Win=266496 Len=1240 [TCP PDU reassembled in 18312]"
"18558","92.389398","142.250.191.170","192.168.2.103","TCP","1394","[TCP Retransmission] 443  >  1251 [PSH, ACK] Seq=8802585 Ack=3873 Win=266496 Len=1240"
"18559","92.389403","142.250.191.170","192.168.2.103","TCP","1394","[TCP Retransmission] 443  >  1251 [ACK] Seq=8803825 Ack=3873 Win=266496 Len=1240"
"18625","92.403196","142.250.191.170","192.168.2.103","TCP","1394","[TCP Retransmission] 443  >  1251 [ACK] Seq=8849705 Ack=3873 Win=266496 Len=1240"
"18811","92.439225","142.250.191.170","192.168.2.103","TCP","1394","[TCP Retransmission] 443  >  1251 [ACK] Seq=8968745 Ack=3873 Win=266496 Len=1240"
"18812","92.439229","142.250.191.170","192.168.2.103","TCP","1394","[TCP Retransmission] 443  >  1251 [ACK] Seq=8974945 Ack=3873 Win=266496 Len=1240"
"19144","92.509885","142.250.191.170","192.168.2.103","TCP","1394","[TCP Retransmission] 443  >  1251 [ACK] Seq=9201865 Ack=3873 Win=266496 Len=1240"
"19429","96.723828","192.168.2.103","20.198.2.181","TCP","1386","[TCP Retransmission] 1267  >  443 [ACK] Seq=908 Ack=6540 Win=66048 Len=1240"
"19440","96.790954","192.168.2.103","20.198.2.181","TCP","1394","[TCP Retransmission] 1267  >  443 [ACK] Seq=908 Ack=6643 Win=66048 Len=1240"
"19441","96.790975","192.168.2.103","20.198.2.181","TCP","354","[TCP Retransmission] 1267  >  443 [ACK] Seq=2148 Ack=6643 Win=66048 Len=200 [TCP PDU reassembled in 19419]"
"19561","99.039846","192.168.2.103","142.250.191.170","TCP","1394","[TCP Retransmission] 1246  >  443 [ACK] Seq=48754 Ack=20455 Win=65536 Len=1240"
"19562","99.040116","192.168.2.103","142.250.191.170","TCP","846","[TCP Retransmission] 1246  >  443 [PSH, ACK] Seq=49994 Ack=20455 Win=65536 Len=692 [TCP PDU reassembled in 19558]"
"19669","101.208108","192.168.2.103","142.250.191.170","TCP","1386","[TCP Retransmission] 1246  >  443 [ACK] Seq=50686 Ack=21080 Win=66304 Len=1240"
"19806","102.590845","142.250.191.170","192.168.2.103","TCP","1394","[TCP Retransmission] 443  >  1251 [PSH, ACK] Seq=9330185 Ack=4447 Win=265984 Len=1240"
"20010","102.624572","142.250.191.170","192.168.2.103","TCP","1394","[TCP Retransmission] 443  >  1251 [ACK] Seq=9462865 Ack=4447 Win=265984 Len=1240"
"20127","102.649058","142.250.191.170","192.168.2.103","TCP","1394","[TCP Retransmission] 443  >  1251 [ACK] Seq=9533545 Ack=4447 Win=265984 Len=1240 [TCP PDU reassembled in 20166]"
"20128","102.649063","142.250.191.170","192.168.2.103","TCP","1394","[TCP Retransmission] 443  >  1251 [ACK] Seq=9534785 Ack=4447 Win=265984 Len=1240 [TCP PDU reassembled in 20166]"
"20130","102.649079","142.250.191.170","192.168.2.103","TCP","1394","[TCP Retransmission] 443  >  1251 [ACK] Seq=9537265 Ack=4447 Win=265984 Len=1240 [TCP PDU reassembled in 20166]"
"20134","102.649090","142.250.191.170","192.168.2.103","TCP","1394","[TCP Retransmission] 443  >  1251 [ACK] Seq=9542225 Ack=4447 Win=265984 Len=1240 [TCP PDU reassembled in 20166]"
"20135","102.649092","142.250.191.170","192.168.2.103","TCP","1394","[TCP Retransmission] 443  >  1251 [ACK] Seq=9543465 Ack=4447 Win=265984 Len=1240 [TCP PDU reassembled in 20166]"
"20179","102.658116","142.250.191.170","192.168.2.103","TCP","1394","[TCP Retransmission] 443  >  1251 [ACK] Seq=9558345 Ack=4447 Win=265984 Len=1240"
"20180","102.658119","142.250.191.170","192.168.2.103","TCP","1394","[TCP Retransmission] 443  >  1251 [ACK] Seq=9559585 Ack=4447 Win=265984 Len=1240"
"20181","102.658122","142.250.191.170","192.168.2.103","TCP","1394","[TCP Retransmission] 443  >  1251 [PSH, ACK] Seq=9560825 Ack=4447 Win=265984 Len=1240"
"20182","102.658125","142.250.191.170","192.168.2.103","TCP","1394","[TCP Retransmission] 443  >  1251 [ACK] Seq=9562065 Ack=4447 Win=265984 Len=1240"
"20184","102.658130","142.250.191.170","192.168.2.103","TCP","1394","[TCP Retransmission] 443  >  1251 [ACK] Seq=9564545 Ack=4447 Win=265984 Len=1240"
"20185","102.658134","142.250.191.170","192.168.2.103","TCP","1394","[TCP Retransmission] 443  >  1251 [PSH, ACK] Seq=9565785 Ack=4447 Win=265984 Len=1240"
"20186","102.658137","142.250.191.170","192.168.2.103","TCP","1394","[TCP Retransmission] 443  >  1251 [ACK] Seq=9567025 Ack=4447 Win=265984 Len=1240"
"20339","102.682149","142.250.191.170","192.168.2.103","TCP","1394","[TCP Retransmission] 443  >  1251 [PSH, ACK] Seq=9689785 Ack=4447 Win=265984 Len=1240"
"20686","102.749941","142.250.191.170","192.168.2.103","TCP","1394","[TCP Retransmission] 443  >  1251 [ACK] Seq=9976225 Ack=4447 Win=265984 Len=1240"
"20688","102.749945","142.250.191.170","192.168.2.103","TCP","1394","[TCP Retransmission] 443  >  1251 [ACK] Seq=9978705 Ack=4447 Win=265984 Len=1240"
"20690","102.749950","142.250.191.170","192.168.2.103","TCP","1394","[TCP Retransmission] 443  >  1251 [PSH, ACK] Seq=9981185 Ack=4447 Win=265984 Len=1240"
"21023","102.809177","142.250.191.170","192.168.2.103","TCP","1394","[TCP Retransmission] 443  >  1251 [ACK] Seq=10191985 Ack=4447 Win=265984 Len=1240"
"21218","102.849933","142.250.191.170","192.168.2.103","TCP","1394","[TCP Retransmission] 443  >  1251 [ACK] Seq=10333345 Ack=4447 Win=265984 Len=1240 [TCP PDU reassembled in 21263]"
"21509","102.900382","142.250.191.170","192.168.2.103","TCP","1394","[TCP Retransmission] 443  >  1251 [ACK] Seq=10541665 Ack=4447 Win=265984 Len=1240 [TCP PDU reassembled in 21514]"
"22005","111.011706","192.168.2.103","142.250.191.170","TCP","1394","[TCP Retransmission] 1246  >  443 [ACK] Seq=56484 Ack=22979 Win=65536 Len=1240"
"22006","111.011917","192.168.2.103","142.250.191.170","TCP","847","[TCP Retransmission] 1246  >  443 [PSH, ACK] Seq=57724 Ack=22979 Win=65536 Len=693 [TCP PDU reassembled in 22002]"
"22145","112.403734","142.250.191.170","192.168.2.103","TCP","1386","[TCP Retransmission] 443  >  1251 [PSH, ACK] Seq=10821238 Ack=5021 Win=265472 Len=1240"
"22421","112.457746","142.250.191.170","192.168.2.103","TCP","1394","[TCP Retransmission] 443  >  1251 [PSH, ACK] Seq=11028100 Ack=5021 Win=265472 Len=1240"
"22451","112.463554","142.250.191.170","192.168.2.103","TCP","1394","[TCP Retransmission] 443  >  1251 [PSH, ACK] Seq=11038020 Ack=5021 Win=265472 Len=1240"
"22452","112.463559","142.250.191.170","192.168.2.103","TCP","1394","[TCP Retransmission] 443  >  1251 [ACK] Seq=11039260 Ack=5021 Win=265472 Len=1240"
"22453","112.463563","142.250.191.170","192.168.2.103","TCP","1394","[TCP Retransmission] 443  >  1251 [ACK] Seq=11040500 Ack=5021 Win=265472 Len=1240"
"22880","112.549595","142.250.191.170","192.168.2.103","TCP","1394","[TCP Retransmission] 443  >  1251 [ACK] Seq=11323220 Ack=5021 Win=265472 Len=1240"
"23152","112.605045","142.250.191.170","192.168.2.103","TCP","1394","[TCP Retransmission] 443  >  1251 [ACK] Seq=11514180 Ack=5021 Win=265472 Len=1240"
"23324","112.639811","142.250.191.170","192.168.2.103","TCP","1394","[TCP Retransmission] 443  >  1251 [ACK] Seq=11598500 Ack=5021 Win=265472 Len=1240"
"23326","112.639815","142.250.191.170","192.168.2.103","TCP","1394","[TCP Retransmission] 443  >  1251 [ACK] Seq=11600980 Ack=5021 Win=265472 Len=1240"
"23327","112.639817","142.250.191.170","192.168.2.103","TCP","1394","[TCP Retransmission] 443  >  1251 [ACK] Seq=11602220 Ack=5021 Win=265472 Len=1240"
"23442","112.669734","142.250.191.170","192.168.2.103","TCP","1394","[TCP Retransmission] 443  >  1251 [ACK] Seq=11690260 Ack=5021 Win=265472 Len=1240"
"23491","112.682212","142.250.191.170","192.168.2.103","TCP","1394","[TCP Retransmission] 443  >  1251 [ACK] Seq=11717540 Ack=5021 Win=265472 Len=1240 [TCP PDU reassembled in 23474]"
"23672","112.719370","142.250.191.170","192.168.2.103","TCP","1394","[TCP Retransmission] 443  >  1251 [ACK] Seq=11837820 Ack=5021 Win=265472 Len=1240"
"23763","112.739344","142.250.191.170","192.168.2.103","TCP","1394","[TCP Retransmission] 443  >  1251 [ACK] Seq=11904780 Ack=5021 Win=265472 Len=1240"
"23764","112.739348","142.250.191.170","192.168.2.103","TCP","1394","[TCP Retransmission] 443  >  1251 [PSH, ACK] Seq=11906020 Ack=5021 Win=265472 Len=1240"
"23817","112.751283","142.250.191.170","192.168.2.103","TCP","1394","[TCP Retransmission] 443  >  1251 [ACK] Seq=11948180 Ack=5021 Win=265472 Len=1240"
"23861","112.758690","142.250.191.170","192.168.2.103","TCP","1394","[TCP Retransmission] 443  >  1251 [ACK] Seq=11980420 Ack=5021 Win=265472 Len=1240"
"24108","112.808688","142.250.191.170","192.168.2.103","TCP","1394","[TCP Retransmission] 443  >  1251 [ACK] Seq=12151540 Ack=5021 Win=265472 Len=1240 [TCP PDU reassembled in 24139]"
"24109","112.808692","142.250.191.170","192.168.2.103","TCP","1394","[TCP Retransmission] 443  >  1251 [PSH, ACK] Seq=12152780 Ack=5021 Win=265472 Len=1240 [TCP PDU reassembled in 24139]"
"24171","112.821258","142.250.191.170","192.168.2.103","TCP","1394","[TCP Retransmission] 443  >  1251 [PSH, ACK] Seq=12197420 Ack=5021 Win=265472 Len=1240"
"24172","112.821262","142.250.191.170","192.168.2.103","TCP","1394","[TCP Retransmission] 443  >  1251 [ACK] Seq=12198660 Ack=5021 Win=265472 Len=1240"
"24312","112.846857","142.250.191.170","192.168.2.103","TCP","1394","[TCP Retransmission] 443  >  1251 [ACK] Seq=12304060 Ack=5021 Win=265472 Len=1240"
"24551","116.416132","192.168.2.103","157.240.26.11","TCP","177","[TCP Retransmission] 1084  >  443 [PSH, ACK] Seq=94 Ack=94 Win=259 Len=31"
"24727","121.173736","192.168.2.103","142.250.191.170","TCP","1394","[TCP Retransmission] 1246  >  443 [PSH, ACK] Seq=61043 Ack=24245 Win=65536 Len=1240 [TCP PDU reassembled in 24726]"
"24733","121.181137","192.168.2.103","142.250.191.170","TCP","1386","[TCP Retransmission] 1246  >  443 [ACK] Seq=60350 Ack=24245 Win=65536 Len=1240"
"24882","122.000694","142.250.191.170","192.168.2.103","TCP","1394","[TCP Retransmission] 443  >  1251 [ACK] Seq=12415430 Ack=5595 Win=264960 Len=1240"
"25150","122.032175","142.250.191.170","192.168.2.103","TCP","1386","[TCP Fast Retransmission] 443  >  1251 [ACK] Seq=12515870 Ack=5595 Win=264960 Len=1240"
"25314","122.059615","142.250.191.170","192.168.2.103","TCP","1394","[TCP Fast Retransmission] 443  >  1251 [ACK] Seq=12626230 Ack=5595 Win=264960 Len=1240 [TCP PDU reassembled in 25320]"
"25315","122.059619","142.250.191.170","192.168.2.103","TCP","1394","[TCP Fast Retransmission] 443  >  1251 [PSH, ACK] Seq=12627470 Ack=5595 Win=264960 Len=1240 [TCP PDU reassembled in 25320]"
"25393","122.078801","142.250.191.170","192.168.2.103","TCP","1394","[TCP Retransmission] 443  >  1251 [ACK] Seq=12663430 Ack=5595 Win=264960 Len=1240"
"25396","122.078813","142.250.191.170","192.168.2.103","TCP","1394","[TCP Retransmission] 443  >  1251 [ACK] Seq=12667150 Ack=5595 Win=264960 Len=1240"
"25401","122.078833","142.250.191.170","192.168.2.103","TCP","1394","[TCP Retransmission] 443  >  1251 [ACK] Seq=12673350 Ack=5595 Win=264960 Len=1240"
"25824","122.215928","142.250.191.170","192.168.2.103","TCP","1394","[TCP Fast Retransmission] 443  >  1251 [ACK] Seq=12744030 Ack=5595 Win=264960 Len=1240"
"25825","122.215933","142.250.191.170","192.168.2.103","TCP","1394","[TCP Fast Retransmission] 443  >  1251 [PSH, ACK] Seq=12745270 Ack=5595 Win=264960 Len=1240"
"25847","122.218293","142.250.191.170","192.168.2.103","TCP","1394","[TCP Fast Retransmission] 443  >  1251 [ACK] Seq=12746510 Ack=5595 Win=264960 Len=1240"
"25848","122.218301","142.250.191.170","192.168.2.103","TCP","1394","[TCP Fast Retransmission] 443  >  1251 [PSH, ACK] Seq=12747750 Ack=5595 Win=264960 Len=1240"
"25849","122.218306","142.250.191.170","192.168.2.103","TCP","1394","[TCP Fast Retransmission] 443  >  1251 [ACK] Seq=12748990 Ack=5595 Win=264960 Len=1240"
"25851","122.218312","142.250.191.170","192.168.2.103","TCP","1394","[TCP Fast Retransmission] 443  >  1251 [ACK] Seq=12751470 Ack=5595 Win=264960 Len=1240"
"26032","122.250333","142.250.191.170","192.168.2.103","TCP","1394","[TCP Retransmission] 443  >  1251 [PSH, ACK] Seq=12946150 Ack=5595 Win=264960 Len=1240 [TCP PDU reassembled in 26019]"
"26082","122.258616","142.250.191.170","192.168.2.103","TCP","1386","[TCP Retransmission] 443  >  1251 [PSH, ACK] Seq=12980870 Ack=5595 Win=264960 Len=1240"
"26205","122.288350","142.250.191.170","192.168.2.103","TCP","1394","[TCP Retransmission] 443  >  1251 [PSH, ACK] Seq=13035430 Ack=5595 Win=264960 Len=1240"
"26206","122.288356","142.250.191.170","192.168.2.103","TCP","1394","[TCP Retransmission] 443  >  1251 [ACK] Seq=13036670 Ack=5595 Win=264960 Len=1240"
"26213","122.288382","142.250.191.170","192.168.2.103","TCP","1394","[TCP Retransmission] 443  >  1251 [PSH, ACK] Seq=13045350 Ack=5595 Win=264960 Len=1240"
"26514","122.426702","142.250.191.170","192.168.2.103","TCP","1394","[TCP Retransmission] 443  >  1251 [PSH, ACK] Seq=13137110 Ack=5595 Win=264960 Len=1240"
"26515","122.426705","142.250.191.170","192.168.2.103","TCP","1394","[TCP Retransmission] 443  >  1251 [ACK] Seq=13138350 Ack=5595 Win=264960 Len=1240"
"26890","122.492645","142.250.191.170","192.168.2.103","TCP","1394","[TCP Retransmission] 443  >  1251 [PSH, ACK] Seq=13252430 Ack=5595 Win=264960 Len=1240"
"26891","122.492649","142.250.191.170","192.168.2.103","TCP","1394","[TCP Retransmission] 443  >  1251 [ACK] Seq=13253670 Ack=5595 Win=264960 Len=1240"
"26892","122.492653","142.250.191.170","192.168.2.103","TCP","1394","[TCP Retransmission] 443  >  1251 [PSH, ACK] Seq=13254910 Ack=5595 Win=264960 Len=1240"
"26893","122.492657","142.250.191.170","192.168.2.103","TCP","1394","[TCP Retransmission] 443  >  1251 [ACK] Seq=13256150 Ack=5595 Win=264960 Len=1240"
"26894","122.492661","142.250.191.170","192.168.2.103","TCP","1394","[TCP Retransmission] 443  >  1251 [PSH, ACK] Seq=13257390 Ack=5595 Win=264960 Len=1240"
"27279","122.617213","142.250.191.170","192.168.2.103","TCP","1394","[TCP Fast Retransmission] 443  >  1251 [ACK] Seq=13461990 Ack=5595 Win=264960 Len=1240 [TCP PDU reassembled in 27280]"
"27783","122.703103","142.250.191.170","192.168.2.103","TCP","1394","[TCP Retransmission] 443  >  1251 [PSH, ACK] Seq=13734790 Ack=5595 Win=264960 Len=1240"
"27816","122.713496","142.250.191.170","192.168.2.103","TCP","1394","[TCP Retransmission] 443  >  1251 [PSH, ACK] Seq=13749670 Ack=5595 Win=264960 Len=1240"
"27817","122.713499","142.250.191.170","192.168.2.103","TCP","1394","[TCP Retransmission] 443  >  1251 [ACK] Seq=13750910 Ack=5595 Win=264960 Len=1240"
"27818","122.713501","142.250.191.170","192.168.2.103","TCP","1394","[TCP Retransmission] 443  >  1251 [ACK] Seq=13752150 Ack=5595 Win=264960 Len=1240"
"28576","132.649223","142.250.191.170","192.168.2.103","TCP","1394","[TCP Retransmission] 443  >  1251 [ACK] Seq=14042458 Ack=6169 Win=264448 Len=1240"
"28768","132.688633","142.250.191.170","192.168.2.103","TCP","1394","[TCP Retransmission] 443  >  1251 [ACK] Seq=14168938 Ack=6169 Win=264448 Len=1240"
"28931","132.721672","142.250.191.170","192.168.2.103","TCP","1394","[TCP Retransmission] 443  >  1251 [PSH, ACK] Seq=14289218 Ack=6169 Win=264448 Len=1240"
"28985","132.729848","142.250.191.170","192.168.2.103","TCP","1394","[TCP Retransmission] 443  >  1251 [ACK] Seq=14326418 Ack=6169 Win=264448 Len=1240"
"28987","132.729853","142.250.191.170","192.168.2.103","TCP","1394","[TCP Retransmission] 443  >  1251 [PSH, ACK] Seq=14328898 Ack=6169 Win=264448 Len=1240"
"29059","132.747379","142.250.191.170","192.168.2.103","TCP","1394","[TCP Retransmission] 443  >  1251 [ACK] Seq=14369818 Ack=6169 Win=264448 Len=1240"
"29112","132.759473","142.250.191.170","192.168.2.103","TCP","1394","[TCP Retransmission] 443  >  1251 [ACK] Seq=14392138 Ack=6169 Win=264448 Len=1240"
"29113","132.759477","142.250.191.170","192.168.2.103","TCP","1394","[TCP Retransmission] 443  >  1251 [PSH, ACK] Seq=14393378 Ack=6169 Win=264448 Len=1240"
"29356","132.800237","142.250.191.170","192.168.2.103","TCP","1394","[TCP Retransmission] 443  >  1251 [ACK] Seq=14553338 Ack=6169 Win=264448 Len=1240"
"29643","132.860245","142.250.191.170","192.168.2.103","TCP","1394","[TCP Retransmission] 443  >  1251 [ACK] Seq=14738098 Ack=6169 Win=264448 Len=1240"
"29644","132.860251","142.250.191.170","192.168.2.103","TCP","1394","[TCP Retransmission] 443  >  1251 [ACK] Seq=14739338 Ack=6169 Win=264448 Len=1240"
"29694","132.870455","142.250.191.170","192.168.2.103","TCP","1394","[TCP Retransmission] 443  >  1251 [PSH, ACK] Seq=14770338 Ack=6169 Win=264448 Len=1240"
"29954","132.921684","142.250.191.170","192.168.2.103","TCP","1394","[TCP Retransmission] 443  >  1251 [PSH, ACK] Seq=14924098 Ack=6169 Win=264448 Len=1240 [TCP PDU reassembled in 29973]"
"29980","132.925445","192.168.2.103","142.250.191.170","TCP","1394","[TCP Retransmission] 1246  >  443 [PSH, ACK] Seq=70708 Ack=27395 Win=66304 Len=1240 [TCP PDU reassembled in 29864]"
"29995","132.927618","192.168.2.103","142.250.191.170","TCP","1394","[TCP Retransmission] 1246  >  443 [PSH, ACK] Seq=70708 Ack=27395 Win=66304 Len=1240 [TCP PDU reassembled in 29864]"
"30271","132.982471","142.250.191.170","192.168.2.103","TCP","1394","[TCP Retransmission] 443  >  1251 [ACK] Seq=15143578 Ack=6169 Win=264448 Len=1240"
"30308","132.988439","142.250.191.170","192.168.2.103","TCP","1394","[TCP Retransmission] 443  >  1251 [PSH, ACK] Seq=15169618 Ack=6169 Win=264448 Len=1240 [TCP PDU reassembled in 30340]"
"30418","133.008979","142.250.191.170","192.168.2.103","TCP","1394","[TCP Retransmission] 443  >  1251 [ACK] Seq=15250218 Ack=6169 Win=264448 Len=1240 [TCP PDU reassembled in 30448]"
"30531","133.034184","142.250.191.170","192.168.2.103","TCP","1394","[TCP Retransmission] 443  >  1251 [PSH, ACK] Seq=15333298 Ack=6169 Win=264448 Len=1240"
"30534","133.034190","142.250.191.170","192.168.2.103","TCP","1394","[TCP Retransmission] 443  >  1251 [ACK] Seq=15337018 Ack=6169 Win=264448 Len=1240"
"30700","133.068119","142.250.191.170","192.168.2.103","TCP","1394","[TCP Retransmission] 443  >  1251 [ACK] Seq=15448618 Ack=6169 Win=264448 Len=1240"
"30701","133.068122","142.250.191.170","192.168.2.103","TCP","1394","[TCP Retransmission] 443  >  1251 [PSH, ACK] Seq=15449858 Ack=6169 Win=264448 Len=1240"
"31201","142.353175","142.250.191.170","192.168.2.103","TCP","1394","[TCP Retransmission] 443  >  1246 [ACK] Seq=199245 Ack=76388 Win=205312 Len=1240"
"31337","142.381600","142.250.191.170","192.168.2.103","TCP","1394","[TCP Retransmission] 443  >  1246 [ACK] Seq=272989 Ack=76388 Win=205312 Len=1240 [TCP PDU reassembled in 31375]"
"31544","142.413474","142.250.191.170","192.168.2.103","TCP","1394","[TCP Retransmission] 443  >  1246 [PSH, ACK] Seq=382109 Ack=76388 Win=205312 Len=1240 [TCP PDU reassembled in 31610]"
"31545","142.413476","142.250.191.170","192.168.2.103","TCP","1394","[TCP Retransmission] 443  >  1246 [ACK] Seq=383349 Ack=76388 Win=205312 Len=1240 [TCP PDU reassembled in 31610]"
"31548","142.413483","142.250.191.170","192.168.2.103","TCP","1394","[TCP Retransmission] 443  >  1246 [PSH, ACK] Seq=387069 Ack=76388 Win=205312 Len=1240 [TCP PDU reassembled in 31610]"
"31586","142.419703","142.250.191.170","192.168.2.103","TCP","1394","[TCP Retransmission] 443  >  1246 [ACK] Seq=408149 Ack=76388 Win=205312 Len=1240 [TCP PDU reassembled in 31610]"
"31678","142.434880","142.250.191.170","192.168.2.103","TCP","1394","[TCP Retransmission] 443  >  1246 [ACK] Seq=467669 Ack=76388 Win=205312 Len=1240"
"32396","142.570544","142.250.191.170","192.168.2.103","TCP","1394","[TCP Retransmission] 443  >  1246 [ACK] Seq=993429 Ack=76388 Win=205312 Len=1240"
"32397","142.570548","142.250.191.170","192.168.2.103","TCP","1394","[TCP Retransmission] 443  >  1246 [PSH, ACK] Seq=994669 Ack=76388 Win=205312 Len=1240"
"32744","142.632565","142.250.191.170","192.168.2.103","TCP","1394","[TCP Retransmission] 443  >  1246 [PSH, ACK] Seq=1243909 Ack=76388 Win=205312 Len=1240"
"32745","142.632569","142.250.191.170","192.168.2.103","TCP","1394","[TCP Retransmission] 443  >  1246 [ACK] Seq=1245149 Ack=76388 Win=205312 Len=1240"
"32746","142.632573","142.250.191.170","192.168.2.103","TCP","1394","[TCP Retransmission] 443  >  1246 [ACK] Seq=1246389 Ack=76388 Win=205312 Len=1240"
"32749","142.632586","142.250.191.170","192.168.2.103","TCP","1394","[TCP Retransmission] 443  >  1246 [ACK] Seq=1250109 Ack=76388 Win=205312 Len=1240"
"32751","142.632593","142.250.191.170","192.168.2.103","TCP","1394","[TCP Retransmission] 443  >  1246 [ACK] Seq=1252589 Ack=76388 Win=205312 Len=1240 [TCP PDU reassembled in 32839]"
"33047","142.689503","142.250.191.170","192.168.2.103","TCP","1394","[TCP Retransmission] 443  >  1246 [PSH, ACK] Seq=1478269 Ack=76388 Win=205312 Len=1240 [TCP PDU reassembled in 33064]"
"33236","146.329159","192.168.2.103","142.250.191.170","TCP","1386","[TCP Retransmission] 1246  >  443 [ACK] Seq=76388 Ack=1525016 Win=133888 Len=1240"
"33239","146.329744","192.168.2.103","142.250.191.170","TCP","1386","[TCP Retransmission] 1246  >  443 [ACK] Seq=76388 Ack=1525016 Win=133888 Len=1240"
"33298","147.994280","192.168.2.103","142.250.191.170","TCP","1386","[TCP Retransmission] 1246  >  443 [ACK] Seq=78321 Ack=1525649 Win=133120 Len=1240"
"33491","157.346707","192.168.2.103","34.107.172.168","TCP","1347","[TCP Retransmission] 1282  >  443 [PSH, ACK] Seq=432 Ack=4937 Win=65280 Len=1201"
"33663","160.352002","192.168.2.103","34.107.172.168","TCP","1394","[TCP Retransmission] 1283  >  443 [ACK] Seq=678 Ack=220 Win=65280 Len=1240"
"33664","160.352012","192.168.2.103","34.107.172.168","TCP","1008","[TCP Retransmission] 1283  >  443 [PSH, ACK] Seq=1918 Ack=220 Win=65280 Len=854 [TCP PDU reassembled in 33660]"
"33744","163.315375","192.168.2.103","157.240.26.49","TCP","146","[TCP Retransmission] 1225  >  443 [FIN, ACK] Seq=4388 Ack=204606 Win=130816 Len=0"
"33757","163.367554","192.168.2.103","157.240.26.49","TCP","185","[TCP Retransmission] 1222  >  443 [PSH, ACK] Seq=51555 Ack=22344 Win=254 Len=31"
"33761","163.367820","192.168.2.103","157.240.26.49","TCP","185","[TCP Retransmission] 1222  >  443 [PSH, ACK] Seq=51555 Ack=22344 Win=254 Len=31"
"33766","163.368320","192.168.2.103","157.240.26.49","TCP","177","[TCP Retransmission] 1222  >  443 [PSH, ACK] Seq=51555 Ack=22344 Win=254 Len=31"
"35576","244.586007","157.240.26.49","192.168.2.103","TCP","246","[TCP Retransmission] 443  >  1101 [PSH, ACK] Seq=2766 Ack=5976 Win=558 Len=100"
"35590","244.590809","157.240.26.49","192.168.2.103","TCP","246","[TCP Retransmission] 443  >  1101 [PSH, ACK] Seq=2766 Ack=5976 Win=558 Len=100"
