"No.","Time","Source","Destination","Protocol","Length","Info"
"607","14.944855","192.168.2.103","23.192.220.4","TCP","146","[TCP Previous segment not captured] 1191  >  443 [ACK] Seq=169 Ack=7740 Win=519 Len=0"
"645","14.957914","23.192.220.4","192.168.2.103","TCP","1394","[TCP Previous segment not captured] 443  >  1191 [ACK] Seq=39026 Ack=169 Win=501 Len=1240 [TCP PDU reassembled in 670]"
"933","15.365182","157.240.26.49","192.168.2.103","TCP","1386","[TCP Previous segment not captured] 443  >  1222 [ACK] Seq=12929 Ack=29691 Win=131840 Len=1240 [TCP PDU reassembled in 936]"
"1021","16.047201","192.168.2.103","157.240.26.49","TCP","1214","[TCP Previous segment not captured] 1222  >  443 [PSH, ACK] Seq=50495 Ack=21769 Win=256 Len=1060 [TCP PDU reassembled in 1028]"
"1350","18.025885","157.240.26.49","192.168.2.103","TCP","1394","[TCP Previous segment not captured] 443  >  1225 [ACK] Seq=69599 Ack=3976 Win=77056 Len=1240 [TCP PDU reassembled in 1372]"
"2074","20.244679","34.36.199.114","192.168.2.103","TCP","154","[TCP Previous segment not captured] 443  >  1232 [ACK] Seq=1166 Ack=1612 Win=268288 Len=0"
"2447","20.351766","34.36.199.114","192.168.2.103","TCP","154","[TCP Previous segment not captured] 443  >  1232 [ACK] Seq=1922 Ack=2969 Win=267264 Len=0"
"3136","28.717113","142.250.191.170","192.168.2.103","TCP","158","[TCP Previous segment not captured] 443  >  1246 [ACK] Seq=5323 Ack=2362 Win=268032 Len=0 SLE=3602 SRE=4295"
"3798","42.449668","142.250.191.170","192.168.2.103","TCP","1394","[TCP Previous segment not captured] 443  >  1251 [PSH, ACK] Seq=156647 Ack=1003 Win=269056 Len=1240"
"3803","42.449688","142.250.191.170","192.168.2.103","TCP","1394","[TCP Previous segment not captured] 443  >  1251 [ACK] Seq=162847 Ack=1003 Win=269056 Len=1240"
"4149","42.517382","142.250.191.170","192.168.2.103","TCP","1394","[TCP Previous segment not captured] 443  >  1251 [ACK] Seq=409607 Ack=1003 Win=269056 Len=1240 [TCP PDU reassembled in 4201]"
"4162","42.517432","142.250.191.170","192.168.2.103","TCP","1394","[TCP Previous segment not captured] 443  >  1251 [ACK] Seq=425727 Ack=1003 Win=269056 Len=1240 [TCP PDU reassembled in 4201]"
"4656","42.616648","142.250.191.170","192.168.2.103","TCP","1394","[TCP Previous segment not captured] 443  >  1251 [PSH, ACK] Seq=719607 Ack=1003 Win=269056 Len=1240"
"4731","42.634275","142.250.191.170","192.168.2.103","TCP","1394","[TCP Previous segment not captured] 443  >  1251 [ACK] Seq=763007 Ack=1003 Win=269056 Len=1240 [TCP PDU reassembled in 4775]"
"4858","42.662318","142.250.191.170","192.168.2.103","TCP","1394","[TCP Previous segment not captured] 443  >  1251 [PSH, ACK] Seq=834927 Ack=1003 Win=269056 Len=1240 [TCP PDU reassembled in 4874]"
"4948","42.680211","142.250.191.170","192.168.2.103","TCP","1394","[TCP Previous segment not captured] 443  >  1251 [ACK] Seq=889487 Ack=1003 Win=269056 Len=1240"
"4968","42.686483","142.250.191.170","192.168.2.103","TCP","1394","[TCP Previous segment not captured] 443  >  1251 [ACK] Seq=899407 Ack=1003 Win=269056 Len=1240"
"5094","42.715630","142.250.191.170","192.168.2.103","TCP","1394","[TCP Previous segment not captured] 443  >  1251 [ACK] Seq=984967 Ack=1003 Win=269056 Len=1240"
"5507","42.795277","142.250.191.170","192.168.2.103","TCP","1394","[TCP Previous segment not captured] 443  >  1251 [ACK] Seq=1267687 Ack=1003 Win=269056 Len=1240 [TCP PDU reassembled in 5577]"
"6681","52.129403","142.250.191.170","192.168.2.103","TCP","1394","[TCP Previous segment not captured] 443  >  1251 [PSH, ACK] Seq=1807635 Ack=1577 Win=268544 Len=1240 [TCP PDU reassembled in 6699]"
"6854","52.163938","142.250.191.170","192.168.2.103","TCP","1394","[TCP Previous segment not captured] 443  >  1251 [ACK] Seq=1925435 Ack=1577 Win=268544 Len=1240 [TCP PDU reassembled in 6918]"
"6931","52.177311","142.250.191.170","192.168.2.103","TCP","1394","[TCP Previous segment not captured] 443  >  1251 [PSH, ACK] Seq=1971315 Ack=1577 Win=268544 Len=1240"
"7090","52.208144","142.250.191.170","192.168.2.103","TCP","1394","[TCP Previous segment not captured] 443  >  1251 [ACK] Seq=2087875 Ack=1577 Win=268544 Len=1240 [TCP PDU reassembled in 7115]"
"8179","52.437842","142.250.191.170","192.168.2.103","TCP","1394","[TCP Previous segment not captured] 443  >  1251 [PSH, ACK] Seq=2803355 Ack=1577 Win=268544 Len=1240 [TCP PDU reassembled in 8217]"
"8226","52.447708","142.250.191.170","192.168.2.103","TCP","1394","[TCP Previous segment not captured] 443  >  1251 [ACK] Seq=2843035 Ack=1577 Win=268544 Len=1240"
"9511","62.381155","142.250.191.170","192.168.2.103","TCP","1394","[TCP Previous segment not captured] 443  >  1251 [ACK] Seq=3481302 Ack=2151 Win=268032 Len=1240 [TCP PDU reassembled in 9587]"
"9556","62.387084","142.250.191.170","192.168.2.103","TCP","1394","[TCP Previous segment not captured] 443  >  1251 [ACK] Seq=3512302 Ack=2151 Win=268032 Len=1240 [TCP PDU reassembled in 9587]"
"9660","62.411816","142.250.191.170","192.168.2.103","TCP","1394","[TCP Previous segment not captured] 443  >  1251 [ACK] Seq=3601470 Ack=2151 Win=268032 Len=1240 [TCP PDU reassembled in 9750]"
"10195","62.510507","142.250.191.170","192.168.2.103","TCP","1394","[TCP Previous segment not captured] 443  >  1251 [ACK] Seq=3968510 Ack=2151 Win=268032 Len=1240 [TCP PDU reassembled in 10212]"
"10524","62.566987","142.250.191.170","192.168.2.103","TCP","1394","[TCP Previous segment not captured] 443  >  1251 [ACK] Seq=4194078 Ack=2151 Win=268032 Len=1240 [TCP PDU reassembled in 10621]"
"10599","62.583705","142.250.191.170","192.168.2.103","TCP","1394","[TCP Previous segment not captured] 443  >  1251 [ACK] Seq=4247398 Ack=2151 Win=268032 Len=1240 [TCP PDU reassembled in 10621]"
"10661","62.596296","142.250.191.170","192.168.2.103","TCP","1394","[TCP Previous segment not captured] 443  >  1251 [ACK] Seq=4290798 Ack=2151 Win=268032 Len=1240 [TCP PDU reassembled in 10677]"
"10664","62.596307","142.250.191.170","192.168.2.103","TCP","1394","[TCP Previous segment not captured] 443  >  1251 [ACK] Seq=4294518 Ack=2151 Win=268032 Len=1240 [TCP PDU reassembled in 10677]"
"10952","62.648281","142.250.191.170","192.168.2.103","TCP","1394","[TCP Previous segment not captured] 443  >  1251 [PSH, ACK] Seq=4509038 Ack=2151 Win=268032 Len=1240 [TCP PDU reassembled in 11033]"
"10959","62.648320","142.250.191.170","192.168.2.103","TCP","1394","[TCP Previous segment not captured] 443  >  1251 [ACK] Seq=4517718 Ack=2151 Win=268032 Len=1240 [TCP PDU reassembled in 11033]"
"11598","73.136807","142.250.191.170","192.168.2.103","TCP","1394","[TCP Previous segment not captured] 443  >  1251 [ACK] Seq=4736919 Ack=2725 Win=267520 Len=1240 [TCP PDU reassembled in 11649]"
"11781","73.179748","142.250.191.170","192.168.2.103","TCP","1394","[TCP Previous segment not captured] 443  >  1251 [PSH, ACK] Seq=4886784 Ack=2725 Win=267520 Len=1240"
"11838","73.188505","142.250.191.170","192.168.2.103","TCP","1394","[TCP Previous segment not captured] 443  >  1251 [ACK] Seq=4925224 Ack=2725 Win=267520 Len=1240 [TCP PDU reassembled in 11863]"
"11843","73.188527","142.250.191.170","192.168.2.103","TCP","1394","[TCP Previous segment not captured] 443  >  1251 [ACK] Seq=4931424 Ack=2725 Win=267520 Len=1240 [TCP PDU reassembled in 11863]"
"12050","73.229993","142.250.191.170","192.168.2.103","TCP","1394","[TCP Previous segment not captured] 443  >  1251 [ACK] Seq=5074024 Ack=2725 Win=267520 Len=1240"
"12055","73.230004","142.250.191.170","192.168.2.103","TCP","1394","[TCP Previous segment not captured] 443  >  1251 [ACK] Seq=5081464 Ack=2725 Win=267520 Len=1240"
"12099","73.238728","142.250.191.170","192.168.2.103","TCP","1394","[TCP Previous segment not captured] 443  >  1251 [ACK] Seq=5108744 Ack=2725 Win=267520 Len=1240"
"12104","73.238747","142.250.191.170","192.168.2.103","TCP","1394","[TCP Previous segment not captured] 443  >  1251 [PSH, ACK] Seq=5116184 Ack=2725 Win=267520 Len=1240"
"12112","73.241691","142.250.191.170","192.168.2.103","TCP","1394","[TCP Previous segment not captured] 443  >  1251 [ACK] Seq=5121144 Ack=2725 Win=267520 Len=1240"
"12205","73.263068","142.250.191.170","192.168.2.103","TCP","1394","[TCP Previous segment not captured] 443  >  1251 [ACK] Seq=5185624 Ack=2725 Win=267520 Len=1240"
"12215","73.265597","142.250.191.170","192.168.2.103","TCP","1394","[TCP Previous segment not captured] 443  >  1251 [ACK] Seq=5201744 Ack=2725 Win=267520 Len=1240"
"12233","73.269878","142.250.191.170","192.168.2.103","TCP","1394","[TCP Previous segment not captured] 443  >  1251 [ACK] Seq=5217864 Ack=2725 Win=267520 Len=1240"
"12292","73.282931","142.250.191.170","192.168.2.103","TCP","1394","[TCP Previous segment not captured] 443  >  1251 [ACK] Seq=5260024 Ack=2725 Win=267520 Len=1240"
"12431","73.306459","142.250.191.170","192.168.2.103","TCP","1394","[TCP Previous segment not captured] 443  >  1251 [ACK] Seq=5344344 Ack=2725 Win=267520 Len=1240 [TCP PDU reassembled in 12491]"
"12440","73.308310","142.250.191.170","192.168.2.103","TCP","1394","[TCP Previous segment not captured] 443  >  1251 [ACK] Seq=5355504 Ack=2725 Win=267520 Len=1240 [TCP PDU reassembled in 12491]"
"12463","73.312424","142.250.191.170","192.168.2.103","TCP","1394","[TCP Previous segment not captured] 443  >  1251 [PSH, ACK] Seq=5360464 Ack=2725 Win=267520 Len=1240 [TCP PDU reassembled in 12491]"
"12835","73.384722","142.250.191.170","192.168.2.103","TCP","1394","[TCP Previous segment not captured] 443  >  1251 [PSH, ACK] Seq=5598544 Ack=2725 Win=267520 Len=1240 [TCP PDU reassembled in 12859]"
"12942","73.407558","142.250.191.170","192.168.2.103","TCP","1394","[TCP Previous segment not captured] 443  >  1251 [PSH, ACK] Seq=5676664 Ack=2725 Win=267520 Len=1240"
"13656","73.559158","142.250.191.170","192.168.2.103","TCP","1394","[TCP Previous segment not captured] 443  >  1251 [PSH, ACK] Seq=6155304 Ack=2725 Win=267520 Len=1240 [TCP PDU reassembled in 13675]"
"14391","82.180007","142.250.191.170","192.168.2.103","TCP","1394","[TCP Previous segment not captured] 443  >  1251 [ACK] Seq=6463788 Ack=3299 Win=267008 Len=1240 [TCP PDU reassembled in 14412]"
"14451","82.192131","142.250.191.170","192.168.2.103","TCP","1394","[TCP Previous segment not captured] 443  >  1251 [ACK] Seq=6514628 Ack=3299 Win=267008 Len=1240 [TCP PDU reassembled in 14539]"
"15133","82.340949","142.250.191.170","192.168.2.103","TCP","1394","[TCP Previous segment not captured] 443  >  1251 [ACK] Seq=6936228 Ack=3299 Win=267008 Len=1240 [TCP PDU reassembled in 15183]"
"15154","82.344755","142.250.191.170","192.168.2.103","TCP","1394","[TCP Previous segment not captured] 443  >  1251 [ACK] Seq=6942428 Ack=3299 Win=267008 Len=1240 [TCP PDU reassembled in 15183]"
"15673","82.447475","142.250.191.170","192.168.2.103","TCP","1394","[TCP Previous segment not captured] 443  >  1251 [ACK] Seq=7282188 Ack=3299 Win=267008 Len=1240 [TCP PDU reassembled in 15726]"
"16206","82.559580","142.250.191.170","192.168.2.103","TCP","1394","[TCP Previous segment not captured] 443  >  1251 [ACK] Seq=7587228 Ack=3299 Win=267008 Len=1240 [TCP PDU reassembled in 16238]"
"16223","82.563113","142.250.191.170","192.168.2.103","TCP","1394","[TCP Previous segment not captured] 443  >  1251 [PSH, ACK] Seq=7597148 Ack=3299 Win=267008 Len=1240 [TCP PDU reassembled in 16238]"
"16344","82.589955","142.250.191.170","192.168.2.103","TCP","1394","[TCP Previous segment not captured] 443  >  1251 [PSH, ACK] Seq=7644268 Ack=3299 Win=267008 Len=1240"
"16353","82.593328","142.250.191.170","192.168.2.103","TCP","1394","[TCP Previous segment not captured] 443  >  1251 [ACK] Seq=7657908 Ack=3299 Win=267008 Len=1240"
"16816","91.655688","157.240.26.35","192.168.2.103","TCP","146","[TCP Previous segment not captured] 443  >  1242 [FIN, ACK] Seq=27491 Ack=601 Win=67840 Len=0"
"17001","92.087992","142.250.191.170","192.168.2.103","TCP","1394","[TCP Previous segment not captured] 443  >  1251 [PSH, ACK] Seq=7775865 Ack=3873 Win=266496 Len=1240 [TCP PDU reassembled in 17061]"
"17868","92.252153","142.250.191.170","192.168.2.103","TCP","1394","[TCP Previous segment not captured] 443  >  1251 [ACK] Seq=8361145 Ack=3873 Win=266496 Len=1240 [TCP PDU reassembled in 17918]"
"17893","92.258439","142.250.191.170","192.168.2.103","TCP","1394","[TCP Previous segment not captured] 443  >  1251 [ACK] Seq=8371065 Ack=3873 Win=266496 Len=1240 [TCP PDU reassembled in 17918]"
"17896","92.258452","142.250.191.170","192.168.2.103","TCP","1394","[TCP Previous segment not captured] 443  >  1251 [ACK] Seq=8374785 Ack=3873 Win=266496 Len=1240 [TCP PDU reassembled in 17918]"
"18718","92.418146","142.250.191.170","192.168.2.103","TCP","1394","[TCP Previous segment not captured] 443  >  1251 [PSH, ACK] Seq=8921625 Ack=3873 Win=266496 Len=1240 [TCP PDU reassembled in 18778]"
"19800","102.588826","142.250.191.170","192.168.2.103","TCP","1394","[TCP Previous segment not captured] 443  >  1251 [PSH, ACK] Seq=9330185 Ack=4447 Win=265984 Len=1240 [TCP PDU reassembled in 19873]"
"20110","102.646404","142.250.191.170","192.168.2.103","TCP","1394","[TCP Previous segment not captured] 443  >  1251 [ACK] Seq=9529825 Ack=4447 Win=265984 Len=1240 [TCP PDU reassembled in 20166]"
"20771","102.764189","142.250.191.170","192.168.2.103","TCP","1394","[TCP Previous segment not captured] 443  >  1251 [ACK] Seq=10041945 Ack=4447 Win=265984 Len=1240 [TCP PDU reassembled in 20788]"
"21496","102.898192","142.250.191.170","192.168.2.103","TCP","1394","[TCP Previous segment not captured] 443  >  1251 [ACK] Seq=10541665 Ack=4447 Win=265984 Len=1240 [TCP PDU reassembled in 21514]"
"21560","102.908277","142.250.191.170","192.168.2.103","TCP","1394","[TCP Previous segment not captured] 443  >  1251 [PSH, ACK] Seq=10591265 Ack=4447 Win=265984 Len=1240 [TCP PDU reassembled in 21585]"
"21698","102.937725","142.250.191.170","192.168.2.103","TCP","1394","[TCP Previous segment not captured] 443  >  1251 [PSH, ACK] Seq=10691705 Ack=4447 Win=265984 Len=1240"
"21730","102.946814","142.250.191.170","192.168.2.103","TCP","1394","[TCP Previous segment not captured] 443  >  1251 [ACK] Seq=10711545 Ack=4447 Win=265984 Len=1240"
"22463","112.465423","142.250.191.170","192.168.2.103","TCP","1394","[TCP Previous segment not captured] 443  >  1251 [ACK] Seq=11051660 Ack=5021 Win=265472 Len=1240 [TCP PDU reassembled in 22487]"
"22837","112.535786","142.250.191.170","192.168.2.103","TCP","1394","[TCP Previous segment not captured] 443  >  1251 [ACK] Seq=11314540 Ack=5021 Win=265472 Len=1240 [TCP PDU reassembled in 22851]"
"22923","112.557226","142.250.191.170","192.168.2.103","TCP","1394","[TCP Previous segment not captured] 443  >  1251 [ACK] Seq=11355460 Ack=5021 Win=265472 Len=1240"
"23233","112.620394","142.250.191.170","192.168.2.103","TCP","1394","[TCP Previous segment not captured] 443  >  1251 [ACK] Seq=11555100 Ack=5021 Win=265472 Len=1240"
"23341","112.650874","142.250.191.170","192.168.2.103","TCP","1394","[TCP Previous segment not captured] 443  >  1251 [PSH, ACK] Seq=11618340 Ack=5021 Win=265472 Len=1240"
"23557","112.695036","142.250.191.170","192.168.2.103","TCP","1394","[TCP Previous segment not captured] 443  >  1251 [ACK] Seq=11762180 Ack=5021 Win=265472 Len=1240"
"23607","112.708284","142.250.191.170","192.168.2.103","TCP","1394","[TCP Previous segment not captured] 443  >  1251 [ACK] Seq=11785740 Ack=5021 Win=265472 Len=1240"
"23611","112.708300","142.250.191.170","192.168.2.103","TCP","1394","[TCP Previous segment not captured] 443  >  1251 [ACK] Seq=11791940 Ack=5021 Win=265472 Len=1240"
"24100","112.806824","142.250.191.170","192.168.2.103","TCP","1394","[TCP Previous segment not captured] 443  >  1251 [ACK] Seq=12151540 Ack=5021 Win=265472 Len=1240 [TCP PDU reassembled in 24139]"
"24424","112.868464","142.250.191.170","192.168.2.103","TCP","1394","[TCP Previous segment not captured] 443  >  1251 [ACK] Seq=12367300 Ack=5021 Win=265472 Len=1240"
"24540","116.115576","142.250.191.170","192.168.2.103","TCP","158","[TCP Previous segment not captured] 443  >  1246 [ACK] Seq=23612 Ack=58417 Win=221184 Len=0 SLE=59657 SRE=60350"
"24729","121.180735","142.250.191.170","192.168.2.103","TCP","158","[TCP Previous segment not captured] 443  >  1246 [ACK] Seq=24245 Ack=60350 Win=219392 Len=0 SLE=61590 SRE=62283"
"24846","121.997177","142.250.191.170","192.168.2.103","TCP","1394","[TCP Previous segment not captured] 443  >  1251 [PSH, ACK] Seq=12399310 Ack=5595 Win=264960 Len=1240 [TCP PDU reassembled in 24908]"
"25311","122.057017","142.250.191.170","192.168.2.103","TCP","1394","[TCP Previous segment not captured] 443  >  1251 [ACK] Seq=12628710 Ack=5595 Win=264960 Len=1240 [TCP PDU reassembled in 25320]"
"25616","122.185913","142.250.191.170","192.168.2.103","TCP","1394","[TCP Previous segment not captured] 443  >  1251 [PSH, ACK] Seq=12755190 Ack=5595 Win=264960 Len=1240"
"25873","122.222619","142.250.191.170","192.168.2.103","TCP","1394","[TCP Previous segment not captured] 443  >  1251 [ACK] Seq=12850670 Ack=5595 Win=264960 Len=1240 [TCP PDU reassembled in 25890]"
"25964","122.237873","142.250.191.170","192.168.2.103","TCP","1394","[TCP Previous segment not captured] 443  >  1251 [PSH, ACK] Seq=12911430 Ack=5595 Win=264960 Len=1240 [TCP PDU reassembled in 26019]"
"27264","122.615522","142.250.191.170","192.168.2.103","TCP","1394","[TCP Previous segment not captured] 443  >  1251 [ACK] Seq=13464470 Ack=5595 Win=264960 Len=1240 [TCP PDU reassembled in 27280]"
"27303","122.620421","142.250.191.170","192.168.2.103","TCP","1394","[TCP Previous segment not captured] 443  >  1251 [ACK] Seq=13486790 Ack=5595 Win=264960 Len=1240"
"27363","122.627012","142.250.191.170","192.168.2.103","TCP","1394","[TCP Previous segment not captured] 443  >  1251 [ACK] Seq=13494230 Ack=5595 Win=264960 Len=1240"
"27689","122.685283","142.250.191.170","192.168.2.103","TCP","1394","[TCP Previous segment not captured] 443  >  1251 [ACK] Seq=13678990 Ack=5595 Win=264960 Len=1240 [TCP PDU reassembled in 27776]"
"27708","122.689189","142.250.191.170","192.168.2.103","TCP","1394","[TCP Previous segment not captured] 443  >  1251 [ACK] Seq=13683950 Ack=5595 Win=264960 Len=1240 [TCP PDU reassembled in 27776]"
"27738","122.695177","142.250.191.170","192.168.2.103","TCP","1394","[TCP Previous segment not captured] 443  >  1251 [ACK] Seq=13713710 Ack=5595 Win=264960 Len=1240 [TCP PDU reassembled in 27776]"
"27764","122.699376","142.250.191.170","192.168.2.103","TCP","1394","[TCP Previous segment not captured] 443  >  1251 [ACK] Seq=13728590 Ack=5595 Win=264960 Len=1240 [TCP PDU reassembled in 27776]"
"28921","132.719033","142.250.191.170","192.168.2.103","TCP","1394","[TCP Previous segment not captured] 443  >  1251 [PSH, ACK] Seq=14289218 Ack=6169 Win=264448 Len=1240 [TCP PDU reassembled in 28938]"
"30054","132.938274","142.250.191.170","192.168.2.103","TCP","1394","[TCP Previous segment not captured] 443  >  1251 [ACK] Seq=15003458 Ack=6169 Win=264448 Len=1240 [TCP PDU reassembled in 30101]"
"31323","142.378167","142.250.191.170","192.168.2.103","TCP","1394","[TCP Previous segment not captured] 443  >  1246 [ACK] Seq=272989 Ack=76388 Win=205312 Len=1240 [TCP PDU reassembled in 31375]"
"31327","142.378177","142.250.191.170","192.168.2.103","TCP","1394","[TCP Previous segment not captured] 443  >  1246 [ACK] Seq=277949 Ack=76388 Win=205312 Len=1240 [TCP PDU reassembled in 31375]"
"31390","142.387727","142.250.191.170","192.168.2.103","TCP","1394","[TCP Previous segment not captured] 443  >  1246 [ACK] Seq=318869 Ack=76388 Win=205312 Len=1240"
"31533","142.411529","142.250.191.170","192.168.2.103","TCP","1394","[TCP Previous segment not captured] 443  >  1246 [ACK] Seq=380869 Ack=76388 Win=205312 Len=1240 [TCP PDU reassembled in 31610]"
"31575","142.417281","142.250.191.170","192.168.2.103","TCP","1394","[TCP Previous segment not captured] 443  >  1246 [ACK] Seq=408149 Ack=76388 Win=205312 Len=1240 [TCP PDU reassembled in 31610]"
"31708","142.444981","142.250.191.170","192.168.2.103","TCP","1394","[TCP Previous segment not captured] 443  >  1246 [PSH, ACK] Seq=496189 Ack=76388 Win=205312 Len=1240"
"31832","142.467244","142.250.191.170","192.168.2.103","TCP","1394","[TCP Previous segment not captured] 443  >  1246 [PSH, ACK] Seq=574309 Ack=76388 Win=205312 Len=1240 [TCP PDU reassembled in 31857]"
"31882","142.477745","142.250.191.170","192.168.2.103","TCP","1394","[TCP Previous segment not captured] 443  >  1246 [ACK] Seq=602829 Ack=76388 Win=205312 Len=1240"
"31946","142.488330","142.250.191.170","192.168.2.103","TCP","1394","[TCP Previous segment not captured] 443  >  1246 [PSH, ACK] Seq=656149 Ack=76388 Win=205312 Len=1240"
"32058","142.506585","142.250.191.170","192.168.2.103","TCP","1394","[TCP Previous segment not captured] 443  >  1246 [ACK] Seq=750389 Ack=76388 Win=205312 Len=1240 [TCP PDU reassembled in 32092]"
"32173","142.527815","142.250.191.170","192.168.2.103","TCP","1394","[TCP Previous segment not captured] 443  >  1246 [ACK] Seq=822309 Ack=76388 Win=205312 Len=1240 [TCP PDU reassembled in 32185]"
"32664","142.617817","142.250.191.170","192.168.2.103","TCP","1394","[TCP Previous segment not captured] 443  >  1246 [ACK] Seq=1200509 Ack=76388 Win=205312 Len=1240 [TCP PDU reassembled in 32678]"
"33241","146.337317","142.250.191.170","192.168.2.103","TCP","158","[TCP Previous segment not captured] 443  >  1246 [ACK] Seq=1525016 Ack=76388 Win=205312 Len=0 SLE=77628 SRE=78321"
"34720","204.322527","20.198.2.181","192.168.2.103","TCP","146","[TCP Previous segment not captured] 443  >  1267 [FIN, ACK] Seq=7026 Ack=3244 Win=4193792 Len=0"
