"No.","Time","Source","Destination","Protocol","Length","Info"
"593","22.111909","192.168.2.103","157.240.26.49","TCP","146","[TCP Previous segment not captured] 1346  >  443 [FIN, ACK] Seq=72 Ack=1 Win=251 Len=0"
"850","23.877477","23.192.220.16","192.168.2.103","TCP","1394","[TCP Previous segment not captured] 443  >  1553 [ACK] Seq=4624 Ack=1127 Win=64128 Len=1240 [TCP PDU reassembled in 886]"
"1603","26.136319","157.240.26.49","192.168.2.103","TCP","1394","[TCP Previous segment not captured] 443  >  1557 [ACK] Seq=81790 Ack=3976 Win=77056 Len=1240 [TCP PDU reassembled in 1648]"
"1687","26.563565","157.240.26.49","192.168.2.103","TCP","1394","[TCP Previous segment not captured] 443  >  1557 [ACK] Seq=115061 Ack=3976 Win=77056 Len=1240"
"1691","26.564730","157.240.26.49","192.168.2.103","TCP","1394","[TCP Previous segment not captured] 443  >  1557 [ACK] Seq=120264 Ack=3976 Win=77056 Len=1240 [TCP PDU reassembled in 1692]"
"1713","26.569934","157.240.26.49","192.168.2.103","TCP","1394","[TCP Previous segment not captured] 443  >  1557 [PSH, ACK] Seq=127986 Ack=3976 Win=77056 Len=1240"
"1732","26.574955","157.240.26.49","192.168.2.103","TCP","1394","[TCP Previous segment not captured] 443  >  1557 [PSH, ACK] Seq=135426 Ack=3976 Win=77056 Len=1240"
"1747","26.576950","157.240.26.49","192.168.2.103","TCP","1394","[TCP Previous segment not captured] 443  >  1557 [ACK] Seq=147826 Ack=3976 Win=77056 Len=1240"
"2264","32.643688","34.36.199.114","192.168.2.103","TCP","146","[TCP Previous segment not captured] 443  >  1564 [ACK] Seq=220 Ack=1046 Win=268800 Len=0"
"2266","32.644088","34.36.199.114","192.168.2.103","TCP","146","[TCP Previous segment not captured] 443  >  1568 [ACK] Seq=220 Ack=1046 Win=268800 Len=0"
"2283","32.648175","34.36.199.114","192.168.2.103","TCP","154","[TCP Previous segment not captured] 443  >  1563 [ACK] Seq=220 Ack=1046 Win=268800 Len=0"
"2519","32.750189","34.36.199.114","192.168.2.103","TCP","154","[TCP Previous segment not captured] 443  >  1563 [ACK] Seq=1475 Ack=1977 Win=268032 Len=0"
"2611","32.782796","34.36.199.114","192.168.2.103","TCP","146","[TCP Previous segment not captured] 443  >  1572 [ACK] Seq=1552 Ack=2304 Win=267776 Len=0"
"2640","32.792192","34.36.199.114","192.168.2.103","TCP","146","[TCP Previous segment not captured] 443  >  1565 [ACK] Seq=1753 Ack=2580 Win=267520 Len=0"
"3953","53.626835","20.190.157.1","192.168.2.103","TCP","1394","[TCP Previous segment not captured] 443  >  1587 [ACK] Seq=17647 Ack=7423 Win=16386 Len=1240"
"4618","54.867281","142.251.32.10","192.168.2.103","TCP","1394","[TCP Previous segment not captured] 443  >  1589 [ACK] Seq=177645 Ack=1003 Win=269056 Len=1240"
"4642","54.876004","142.251.32.10","192.168.2.103","TCP","1394","[TCP Previous segment not captured] 443  >  1589 [ACK] Seq=183845 Ack=1003 Win=269056 Len=1240"
"4645","54.877661","142.251.32.10","192.168.2.103","TCP","1394","[TCP Previous segment not captured] 443  >  1589 [ACK] Seq=191285 Ack=1003 Win=269056 Len=1240"
"4648","54.877674","142.251.32.10","192.168.2.103","TCP","1394","[TCP Previous segment not captured] 443  >  1589 [ACK] Seq=195005 Ack=1003 Win=269056 Len=1240"
"4667","54.885287","142.251.32.10","192.168.2.103","TCP","1394","[TCP Previous segment not captured] 443  >  1589 [ACK] Seq=201205 Ack=1003 Win=269056 Len=1240"
"4672","54.885307","142.251.32.10","192.168.2.103","TCP","1394","[TCP Previous segment not captured] 443  >  1589 [ACK] Seq=207405 Ack=1003 Win=269056 Len=1240"
"4721","54.893349","142.251.32.10","192.168.2.103","TCP","1394","[TCP Previous segment not captured] 443  >  1589 [ACK] Seq=235925 Ack=1003 Win=269056 Len=1240"
"4732","54.895542","142.251.32.10","192.168.2.103","TCP","1394","[TCP Previous segment not captured] 443  >  1589 [ACK] Seq=240885 Ack=1003 Win=269056 Len=1240"
"4740","54.897574","142.251.32.10","192.168.2.103","TCP","1394","[TCP Previous segment not captured] 443  >  1589 [ACK] Seq=245845 Ack=1003 Win=269056 Len=1240"
"4746","54.897595","142.251.32.10","192.168.2.103","TCP","1394","[TCP Previous segment not captured] 443  >  1589 [ACK] Seq=253285 Ack=1003 Win=269056 Len=1240"
"4844","54.923404","142.251.32.10","192.168.2.103","TCP","1394","[TCP Previous segment not captured] 443  >  1589 [ACK] Seq=310325 Ack=1003 Win=269056 Len=1240"
"4889","54.933370","23.47.72.8","192.168.2.103","TCP","1394","[TCP Previous segment not captured] 443  >  1594 [ACK] Seq=2481 Ack=293 Win=64128 Len=1240"
"4891","54.933377","142.251.32.10","192.168.2.103","TCP","1394","[TCP Previous segment not captured] 443  >  1589 [ACK] Seq=332645 Ack=1003 Win=269056 Len=1240"
"4893","54.933385","142.251.32.10","192.168.2.103","TCP","1394","[TCP Previous segment not captured] 443  >  1589 [ACK] Seq=335125 Ack=1003 Win=269056 Len=1240"
"4897","54.936914","142.251.32.10","192.168.2.103","TCP","1394","[TCP Previous segment not captured] 443  >  1589 [ACK] Seq=341325 Ack=1003 Win=269056 Len=1240"
"4920","54.939044","142.251.32.10","192.168.2.103","TCP","1394","[TCP Previous segment not captured] 443  >  1589 [ACK] Seq=357445 Ack=1003 Win=269056 Len=1240"
"4995","54.956960","142.251.32.10","192.168.2.103","TCP","1394","[TCP Previous segment not captured] 443  >  1589 [ACK] Seq=405805 Ack=1003 Win=269056 Len=1240"
"5351","55.043275","142.251.32.10","192.168.2.103","TCP","1394","[TCP Previous segment not captured] 443  >  1589 [ACK] Seq=589325 Ack=1003 Win=269056 Len=1240 [TCP PDU reassembled in 5421]"
"5399","55.051346","142.251.32.10","192.168.2.103","TCP","1394","[TCP Previous segment not captured] 443  >  1589 [ACK] Seq=619085 Ack=1003 Win=269056 Len=1240 [TCP PDU reassembled in 5421]"
"5578","55.097811","142.251.32.10","192.168.2.103","TCP","1394","[TCP Previous segment not captured] 443  >  1589 [ACK] Seq=728205 Ack=1003 Win=269056 Len=1240 [TCP PDU reassembled in 5629]"
"5582","55.099372","142.251.32.10","192.168.2.103","TCP","1394","[TCP Previous segment not captured] 443  >  1589 [PSH, ACK] Seq=734405 Ack=1003 Win=269056 Len=1240 [TCP PDU reassembled in 5629]"
"5625","55.107530","142.251.32.10","192.168.2.103","TCP","1394","[TCP Previous segment not captured] 443  >  1589 [ACK] Seq=750525 Ack=1003 Win=269056 Len=1240 [TCP PDU reassembled in 5629]"
"5755","55.141530","142.251.32.10","192.168.2.103","TCP","1394","[TCP Previous segment not captured] 443  >  1589 [ACK] Seq=829885 Ack=1003 Win=269056 Len=1240"
"5783","55.147358","142.251.32.10","192.168.2.103","TCP","1394","[TCP Previous segment not captured] 443  >  1589 [PSH, ACK] Seq=836085 Ack=1003 Win=269056 Len=1240"
"5791","55.149589","142.251.32.10","192.168.2.103","TCP","1394","[TCP Previous segment not captured] 443  >  1589 [ACK] Seq=839805 Ack=1003 Win=269056 Len=1240"
"5844","55.161695","142.251.32.10","192.168.2.103","TCP","1394","[TCP Previous segment not captured] 443  >  1589 [ACK] Seq=877005 Ack=1003 Win=269056 Len=1240 [TCP PDU reassembled in 5878]"
"6317","55.275586","142.251.32.10","192.168.2.103","TCP","1394","[TCP Previous segment not captured] 443  >  1589 [ACK] Seq=1147325 Ack=1003 Win=269056 Len=1240 [TCP PDU reassembled in 6410]"
"6324","55.277593","142.251.32.10","192.168.2.103","TCP","1394","[TCP Previous segment not captured] 443  >  1589 [ACK] Seq=1152285 Ack=1003 Win=269056 Len=1240 [TCP PDU reassembled in 6410]"
"6344","55.281518","142.251.32.10","192.168.2.103","TCP","1394","[TCP Previous segment not captured] 443  >  1589 [ACK] Seq=1164685 Ack=1003 Win=269056 Len=1240 [TCP PDU reassembled in 6410]"
"6357","55.285560","142.251.32.10","192.168.2.103","TCP","1394","[TCP Previous segment not captured] 443  >  1589 [ACK] Seq=1179565 Ack=1003 Win=269056 Len=1240 [TCP PDU reassembled in 6410]"
"6360","55.285572","142.251.32.10","192.168.2.103","TCP","1394","[TCP Previous segment not captured] 443  >  1589 [PSH, ACK] Seq=1183285 Ack=1003 Win=269056 Len=1240 [TCP PDU reassembled in 6410]"
"6376","55.289203","142.251.32.10","192.168.2.103","TCP","1394","[TCP Previous segment not captured] 443  >  1589 [PSH, ACK] Seq=1190725 Ack=1003 Win=269056 Len=1240 [TCP PDU reassembled in 6410]"
"6432","55.301254","142.251.32.10","192.168.2.103","TCP","1394","[TCP Previous segment not captured] 443  >  1589 [ACK] Seq=1219245 Ack=1003 Win=269056 Len=1240"
"6446","55.305268","142.251.32.10","192.168.2.103","TCP","1394","[TCP Previous segment not captured] 443  >  1589 [ACK] Seq=1221725 Ack=1003 Win=269056 Len=1240"
"6460","55.306957","142.251.32.10","192.168.2.103","TCP","1394","[TCP Previous segment not captured] 443  >  1589 [PSH, ACK] Seq=1235365 Ack=1003 Win=269056 Len=1240"
"6599","55.349312","142.251.32.10","192.168.2.103","TCP","1394","[TCP Previous segment not captured] 443  >  1589 [PSH, ACK] Seq=1319685 Ack=1003 Win=269056 Len=1240 [TCP PDU reassembled in 6635]"
"6603","55.351314","142.251.32.10","192.168.2.103","TCP","1394","[TCP Previous segment not captured] 443  >  1589 [PSH, ACK] Seq=1322165 Ack=1003 Win=269056 Len=1240 [TCP PDU reassembled in 6635]"
"6627","55.355490","142.251.32.10","192.168.2.103","TCP","1394","[TCP Previous segment not captured] 443  >  1589 [PSH, ACK] Seq=1334565 Ack=1003 Win=269056 Len=1240 [TCP PDU reassembled in 6734]"
"6640","55.357271","142.251.32.10","192.168.2.103","TCP","1394","[TCP Previous segment not captured] 443  >  1589 [PSH, ACK] Seq=1346965 Ack=1003 Win=269056 Len=1240 [TCP PDU reassembled in 6734]"
"6643","55.359256","142.251.32.10","192.168.2.103","TCP","1394","[TCP Previous segment not captured] 443  >  1589 [PSH, ACK] Seq=1349445 Ack=1003 Win=269056 Len=1240 [TCP PDU reassembled in 6734]"
"6658","55.363055","142.251.32.10","192.168.2.103","TCP","1394","[TCP Previous segment not captured] 443  >  1589 [PSH, ACK] Seq=1356885 Ack=1003 Win=269056 Len=1240 [TCP PDU reassembled in 6734]"
"6676","55.369380","142.251.32.10","192.168.2.103","TCP","1394","[TCP Previous segment not captured] 443  >  1589 [PSH, ACK] Seq=1359365 Ack=1003 Win=269056 Len=1240 [TCP PDU reassembled in 6734]"
"6680","55.369396","142.251.32.10","192.168.2.103","TCP","1394","[TCP Previous segment not captured] 443  >  1589 [PSH, ACK] Seq=1364325 Ack=1003 Win=269056 Len=1240 [TCP PDU reassembled in 6734]"
"6717","55.379564","142.251.32.10","192.168.2.103","TCP","1394","[TCP Previous segment not captured] 443  >  1589 [ACK] Seq=1387885 Ack=1003 Win=269056 Len=1240 [TCP PDU reassembled in 6734]"
"6751","55.385608","142.251.32.10","192.168.2.103","TCP","1394","[TCP Previous segment not captured] 443  >  1589 [PSH, ACK] Seq=1401525 Ack=1003 Win=269056 Len=1240 [TCP PDU reassembled in 6795]"
"7260","58.330963","150.171.28.10","192.168.2.103","TCP","146","[TCP Previous segment not captured] 443  >  1600 [ACK] Seq=7932 Ack=806 Win=4194048 Len=0"
"7338","58.382999","23.47.72.8","192.168.2.103","TCP","146","[TCP Previous segment not captured] 443  >  1601 [ACK] Seq=4623 Ack=834 Win=64128 Len=0"
"7403","58.590071","157.240.26.49","192.168.2.103","TCP","146","[TCP Previous segment not captured] 443  >  1101 [ACK] Seq=325 Ack=1529 Win=850 Len=0"
"7863","64.215752","142.251.32.10","192.168.2.103","TCP","1394","[TCP Previous segment not captured] 443  >  1589 [PSH, ACK] Seq=1543885 Ack=1577 Win=268544 Len=1240 [TCP PDU reassembled in 7969]"
"7992","64.239173","142.251.32.10","192.168.2.103","TCP","1394","[TCP Previous segment not captured] 443  >  1589 [ACK] Seq=1607125 Ack=1577 Win=268544 Len=1240 [TCP PDU reassembled in 8012]"
"8034","64.246277","142.251.32.10","192.168.2.103","TCP","1394","[TCP Previous segment not captured] 443  >  1589 [PSH, ACK] Seq=1641845 Ack=1577 Win=268544 Len=1240"
"8049","64.249612","142.251.32.10","192.168.2.103","TCP","1386","[TCP Previous segment not captured] 443  >  1589 [PSH, ACK] Seq=1645565 Ack=1577 Win=268544 Len=1240"
"8125","64.272832","142.251.32.10","192.168.2.103","TCP","1394","[TCP Previous segment not captured] 443  >  1589 [ACK] Seq=1702605 Ack=1577 Win=268544 Len=1240"
"8678","64.401982","142.251.32.10","192.168.2.103","TCP","1394","[TCP Previous segment not captured] 443  >  1589 [PSH, ACK] Seq=2054765 Ack=1577 Win=268544 Len=1240 [TCP PDU reassembled in 8731]"
"8724","64.413688","142.251.32.10","192.168.2.103","TCP","1394","[TCP Previous segment not captured] 443  >  1589 [PSH, ACK] Seq=2074605 Ack=1577 Win=268544 Len=1240 [TCP PDU reassembled in 8731]"
"8971","64.478147","142.251.32.10","192.168.2.103","TCP","1394","[TCP Previous segment not captured] 443  >  1589 [ACK] Seq=2189925 Ack=1577 Win=268544 Len=1240"
"8979","64.481948","142.251.32.10","192.168.2.103","TCP","1394","[TCP Previous segment not captured] 443  >  1589 [PSH, ACK] Seq=2193645 Ack=1577 Win=268544 Len=1240"
"9149","64.517232","142.251.32.10","192.168.2.103","TCP","1394","[TCP Previous segment not captured] 443  >  1589 [ACK] Seq=2281685 Ack=1577 Win=268544 Len=1240"
"9163","64.525573","142.251.32.10","192.168.2.103","TCP","1394","[TCP Previous segment not captured] 443  >  1589 [ACK] Seq=2289125 Ack=1577 Win=268544 Len=1240"
"9324","64.572222","142.251.32.10","192.168.2.103","TCP","1394","[TCP Previous segment not captured] 443  >  1589 [ACK] Seq=2361045 Ack=1577 Win=268544 Len=1240 [TCP PDU reassembled in 9336]"
"9428","64.597723","142.251.32.10","192.168.2.103","TCP","1394","[TCP Previous segment not captured] 443  >  1589 [ACK] Seq=2413125 Ack=1577 Win=268544 Len=1240"
"9480","64.611952","142.251.32.10","192.168.2.103","TCP","1394","[TCP Previous segment not captured] 443  >  1589 [ACK] Seq=2435445 Ack=1577 Win=268544 Len=1240"
"9712","64.665281","142.251.32.10","192.168.2.103","TCP","1394","[TCP Previous segment not captured] 443  >  1589 [ACK] Seq=2556965 Ack=1577 Win=268544 Len=1240 [TCP PDU reassembled in 9794]"
"9743","64.671144","142.251.32.10","192.168.2.103","TCP","1394","[TCP Previous segment not captured] 443  >  1589 [PSH, ACK] Seq=2578045 Ack=1577 Win=268544 Len=1240 [TCP PDU reassembled in 9794]"
"9990","64.730295","142.251.32.10","192.168.2.103","TCP","1394","[TCP Previous segment not captured] 443  >  1589 [PSH, ACK] Seq=2719405 Ack=1577 Win=268544 Len=1240"
"10024","64.735928","142.251.32.10","192.168.2.103","TCP","1394","[TCP Previous segment not captured] 443  >  1589 [ACK] Seq=2740485 Ack=1577 Win=268544 Len=1240"
"10364","64.809288","142.251.32.10","192.168.2.103","TCP","1394","[TCP Previous segment not captured] 443  >  1589 [ACK] Seq=2953765 Ack=1577 Win=268544 Len=1240 [TCP PDU reassembled in 10433]"
"10376","64.811547","142.251.32.10","192.168.2.103","TCP","1394","[TCP Previous segment not captured] 443  >  1589 [ACK] Seq=2958725 Ack=1577 Win=268544 Len=1240 [TCP PDU reassembled in 10433]"
"10383","64.813597","142.251.32.10","192.168.2.103","TCP","1394","[TCP Previous segment not captured] 443  >  1589 [PSH, ACK] Seq=2962445 Ack=1577 Win=268544 Len=1240 [TCP PDU reassembled in 10433]"
"10453","64.826826","142.251.32.10","192.168.2.103","TCP","1394","[TCP Previous segment not captured] 443  >  1589 [PSH, ACK] Seq=3014525 Ack=1577 Win=268544 Len=1240"
"10570","64.858170","142.251.32.10","192.168.2.103","TCP","1386","[TCP Previous segment not captured] 443  >  1589 [ACK] Seq=3080245 Ack=1577 Win=268544 Len=1240"
"10572","64.859392","142.251.32.10","192.168.2.103","TCP","1394","[TCP Previous segment not captured] 443  >  1589 [PSH, ACK] Seq=3083965 Ack=1577 Win=268544 Len=1240"
"10763","72.156052","142.251.32.10","192.168.2.103","TCP","146","[TCP Previous segment not captured] 443  >  1584 [ACK] Seq=11618 Ack=22932 Win=250368 Len=0"
"11022","74.196707","142.251.32.10","192.168.2.103","TCP","1394","[TCP Previous segment not captured] 443  >  1589 [ACK] Seq=3219550 Ack=2151 Win=268032 Len=1240"
"11117","74.221923","142.251.32.10","192.168.2.103","TCP","1394","[TCP Previous segment not captured] 443  >  1589 [ACK] Seq=3301390 Ack=2151 Win=268032 Len=1240 [TCP PDU reassembled in 11182]"
"11154","74.233428","142.251.32.10","192.168.2.103","TCP","1394","[TCP Previous segment not captured] 443  >  1589 [ACK] Seq=3331150 Ack=2151 Win=268032 Len=1240 [TCP PDU reassembled in 11182]"
"11206","74.239805","142.251.32.10","192.168.2.103","TCP","1394","[TCP Previous segment not captured] 443  >  1589 [ACK] Seq=3364630 Ack=2151 Win=268032 Len=1240"
"11252","74.248185","142.251.32.10","192.168.2.103","TCP","1394","[TCP Previous segment not captured] 443  >  1589 [ACK] Seq=3399350 Ack=2151 Win=268032 Len=1240"
"11284","74.257324","142.251.32.10","192.168.2.103","TCP","1394","[TCP Previous segment not captured] 443  >  1589 [ACK] Seq=3434070 Ack=2151 Win=268032 Len=1240"
"11574","74.329651","142.251.32.10","192.168.2.103","TCP","1394","[TCP Previous segment not captured] 443  >  1589 [ACK] Seq=3638670 Ack=2151 Win=268032 Len=1240"
"11692","74.357221","142.251.32.10","192.168.2.103","TCP","1394","[TCP Previous segment not captured] 443  >  1589 [ACK] Seq=3708110 Ack=2151 Win=268032 Len=1240"
"11729","74.363350","142.251.32.10","192.168.2.103","TCP","1394","[TCP Previous segment not captured] 443  >  1589 [ACK] Seq=3727950 Ack=2151 Win=268032 Len=1240"
"11797","74.377939","142.251.32.10","192.168.2.103","TCP","1394","[TCP Previous segment not captured] 443  >  1589 [PSH, ACK] Seq=3755230 Ack=2151 Win=268032 Len=1240 [TCP PDU reassembled in 11835]"
"11868","74.391516","142.251.32.10","192.168.2.103","TCP","1394","[TCP Previous segment not captured] 443  >  1589 [PSH, ACK] Seq=3792430 Ack=2151 Win=268032 Len=1240 [TCP PDU reassembled in 11922]"
"12452","74.515969","142.251.32.10","192.168.2.103","TCP","1394","[TCP Previous segment not captured] 443  >  1589 [PSH, ACK] Seq=4171870 Ack=2151 Win=268032 Len=1240 [TCP PDU reassembled in 12543]"
"12487","74.521679","142.251.32.10","192.168.2.103","TCP","1394","[TCP Previous segment not captured] 443  >  1589 [PSH, ACK] Seq=4190470 Ack=2151 Win=268032 Len=1240 [TCP PDU reassembled in 12543]"
"12490","74.523309","142.251.32.10","192.168.2.103","TCP","1394","[TCP Previous segment not captured] 443  >  1589 [ACK] Seq=4195430 Ack=2151 Win=268032 Len=1240 [TCP PDU reassembled in 12543]"
"12495","74.523319","142.251.32.10","192.168.2.103","TCP","1394","[TCP Previous segment not captured] 443  >  1589 [PSH, ACK] Seq=4201630 Ack=2151 Win=268032 Len=1240 [TCP PDU reassembled in 12543]"
"12512","74.527664","142.251.32.10","192.168.2.103","TCP","1394","[TCP Previous segment not captured] 443  >  1589 [ACK] Seq=4204110 Ack=2151 Win=268032 Len=1240 [TCP PDU reassembled in 12543]"
"12629","74.550325","142.251.32.10","192.168.2.103","TCP","1394","[TCP Previous segment not captured] 443  >  1589 [ACK] Seq=4284710 Ack=2151 Win=268032 Len=1240 [TCP PDU reassembled in 12646]"
"12838","74.595382","142.251.32.10","192.168.2.103","TCP","1394","[TCP Previous segment not captured] 443  >  1589 [ACK] Seq=4416150 Ack=2151 Win=268032 Len=1240 [TCP PDU reassembled in 12879]"
"12842","74.595391","142.251.32.10","192.168.2.103","TCP","1394","[TCP Previous segment not captured] 443  >  1589 [PSH, ACK] Seq=4421110 Ack=2151 Win=268032 Len=1240 [TCP PDU reassembled in 12879]"
"12869","74.601939","142.251.32.10","192.168.2.103","TCP","1394","[TCP Previous segment not captured] 443  >  1589 [ACK] Seq=4427310 Ack=2151 Win=268032 Len=1240 [TCP PDU reassembled in 12879]"
"13490","84.052955","192.168.2.103","142.251.32.10","TCP","146","[TCP Previous segment not captured] 1589  >  443 [ACK] Seq=2725 Ack=4601809 Win=262656 Len=0"
"13758","84.095023","142.251.32.10","192.168.2.103","TCP","1394","[TCP Previous segment not captured] 443  >  1589 [PSH, ACK] Seq=4780369 Ack=2725 Win=267520 Len=1240"
"13777","84.099200","142.251.32.10","192.168.2.103","TCP","1394","[TCP Previous segment not captured] 443  >  1589 [ACK] Seq=4787809 Ack=2725 Win=267520 Len=1240"
"13922","84.127696","142.251.32.10","192.168.2.103","TCP","1394","[TCP Previous segment not captured] 443  >  1589 [ACK] Seq=4916769 Ack=2725 Win=267520 Len=1240 [TCP PDU reassembled in 13947]"
"13950","84.132403","142.251.32.10","192.168.2.103","TCP","1394","[TCP Previous segment not captured] 443  >  1589 [ACK] Seq=4942809 Ack=2725 Win=267520 Len=1240 [TCP PDU reassembled in 13999]"
"14078","84.156648","142.251.32.10","192.168.2.103","TCP","1394","[TCP Previous segment not captured] 443  >  1589 [ACK] Seq=5024649 Ack=2725 Win=267520 Len=1240"
"14095","84.159124","142.251.32.10","192.168.2.103","TCP","1394","[TCP Previous segment not captured] 443  >  1589 [ACK] Seq=5045729 Ack=2725 Win=267520 Len=1240 [TCP PDU reassembled in 14126]"
"14152","84.168757","142.251.32.10","192.168.2.103","TCP","1394","[TCP Previous segment not captured] 443  >  1589 [ACK] Seq=5085409 Ack=2725 Win=267520 Len=1240"
"14643","84.260336","142.251.32.10","192.168.2.103","TCP","1394","[TCP Previous segment not captured] 443  >  1589 [ACK] Seq=5433849 Ack=2725 Win=267520 Len=1240 [TCP PDU reassembled in 14692]"
"14854","84.298931","142.251.32.10","192.168.2.103","TCP","1394","[TCP Previous segment not captured] 443  >  1589 [ACK] Seq=5576449 Ack=2725 Win=267520 Len=1240 [TCP PDU reassembled in 14945]"
"15199","84.367941","142.251.32.10","192.168.2.103","TCP","1394","[TCP Previous segment not captured] 443  >  1589 [PSH, ACK] Seq=5778569 Ack=2725 Win=267520 Len=1240 [TCP PDU reassembled in 15244]"
"15204","84.369516","142.251.32.10","192.168.2.103","TCP","1394","[TCP Previous segment not captured] 443  >  1589 [ACK] Seq=5784769 Ack=2725 Win=267520 Len=1240 [TCP PDU reassembled in 15244]"
"15228","84.373026","142.251.32.10","192.168.2.103","TCP","1394","[TCP Previous segment not captured] 443  >  1589 [ACK] Seq=5798409 Ack=2725 Win=267520 Len=1240 [TCP PDU reassembled in 15244]"
"15276","84.381797","142.251.32.10","192.168.2.103","TCP","1394","[TCP Previous segment not captured] 443  >  1589 [ACK] Seq=5831889 Ack=2725 Win=267520 Len=1240 [TCP PDU reassembled in 15334]"
"15429","84.407423","142.251.32.10","192.168.2.103","TCP","1394","[TCP Previous segment not captured] 443  >  1589 [PSH, ACK] Seq=5936049 Ack=2725 Win=267520 Len=1240 [TCP PDU reassembled in 15457]"
"15499","84.426215","142.251.32.10","192.168.2.103","TCP","1394","[TCP Previous segment not captured] 443  >  1589 [ACK] Seq=5979449 Ack=2725 Win=267520 Len=1240"
"15504","84.426234","142.251.32.10","192.168.2.103","TCP","1394","[TCP Previous segment not captured] 443  >  1589 [ACK] Seq=5986889 Ack=2725 Win=267520 Len=1240"
"15519","84.429575","142.251.32.10","192.168.2.103","TCP","1394","[TCP Previous segment not captured] 443  >  1589 [PSH, ACK] Seq=6003009 Ack=2725 Win=267520 Len=1240"
"15825","85.206130","192.168.2.103","142.251.32.10","TCP","146","[TCP Previous segment not captured] 1584  >  443 [ACK] Seq=31357 Ack=14760 Win=66304 Len=0"
"16617","94.247995","142.251.32.10","192.168.2.103","TCP","1394","[TCP Previous segment not captured] 443  >  1589 [PSH, ACK] Seq=6426451 Ack=3299 Win=267008 Len=1240"
"16627","94.248029","142.251.32.10","192.168.2.103","TCP","1394","[TCP Previous segment not captured] 443  >  1589 [ACK] Seq=6438851 Ack=3299 Win=267008 Len=1240"
"16715","94.265142","142.251.32.10","192.168.2.103","TCP","1394","[TCP Previous segment not captured] 443  >  1589 [ACK] Seq=6514491 Ack=3299 Win=267008 Len=1240 [TCP PDU reassembled in 16743]"
"16744","94.269002","142.251.32.10","192.168.2.103","TCP","1394","[TCP Previous segment not captured] 443  >  1589 [ACK] Seq=6538051 Ack=3299 Win=267008 Len=1240"
"17295","94.366377","142.251.32.10","192.168.2.103","TCP","1394","[TCP Previous segment not captured] 443  >  1589 [ACK] Seq=6955931 Ack=3299 Win=267008 Len=1240"
"18095","94.499535","142.251.32.10","192.168.2.103","TCP","1394","[TCP Previous segment not captured] 443  >  1589 [ACK] Seq=7636691 Ack=3299 Win=267008 Len=1240"
"18104","94.502625","142.251.32.10","192.168.2.103","TCP","1394","[TCP Previous segment not captured] 443  >  1589 [ACK] Seq=7641651 Ack=3299 Win=267008 Len=1240"
"18136","94.506995","142.251.32.10","192.168.2.103","TCP","1394","[TCP Previous segment not captured] 443  >  1589 [ACK] Seq=7673891 Ack=3299 Win=267008 Len=1240"
"18848","104.435831","142.251.32.10","192.168.2.103","TCP","1394","[TCP Previous segment not captured] 443  >  1584 [ACK] Seq=243559 Ack=43525 Win=233984 Len=1240 [TCP PDU reassembled in 18866]"
"19063","104.475799","142.251.32.10","192.168.2.103","TCP","1394","[TCP Previous segment not captured] 443  >  1584 [ACK] Seq=432007 Ack=43525 Win=233984 Len=1240 [TCP PDU reassembled in 19091]"
"19121","104.492442","142.251.32.10","192.168.2.103","TCP","1394","[TCP Previous segment not captured] 443  >  1584 [ACK] Seq=460527 Ack=43525 Win=233984 Len=1240 [TCP PDU reassembled in 19203]"
"19242","104.518679","142.251.32.10","192.168.2.103","TCP","1394","[TCP Previous segment not captured] 443  >  1584 [ACK] Seq=548567 Ack=43525 Win=233984 Len=1240"
"19256","104.521152","142.251.32.10","192.168.2.103","TCP","1394","[TCP Previous segment not captured] 443  >  1584 [ACK] Seq=564687 Ack=43525 Win=233984 Len=1240"
"19388","104.549858","142.251.32.10","192.168.2.103","TCP","1394","[TCP Previous segment not captured] 443  >  1584 [ACK] Seq=655207 Ack=43525 Win=233984 Len=1240 [TCP PDU reassembled in 19486]"
"19431","104.556463","142.251.32.10","192.168.2.103","TCP","1394","[TCP Previous segment not captured] 443  >  1584 [ACK] Seq=681247 Ack=43525 Win=233984 Len=1240 [TCP PDU reassembled in 19486]"
"19455","104.562128","142.251.32.10","192.168.2.103","TCP","1394","[TCP Previous segment not captured] 443  >  1584 [ACK] Seq=691167 Ack=43525 Win=233984 Len=1240 [TCP PDU reassembled in 19486]"
"19800","104.629654","142.251.32.10","192.168.2.103","TCP","1394","[TCP Previous segment not captured] 443  >  1584 [PSH, ACK] Seq=910647 Ack=43525 Win=233984 Len=1240 [TCP PDU reassembled in 19828]"
"19908","104.649777","142.251.32.10","192.168.2.103","TCP","1394","[TCP Previous segment not captured] 443  >  1584 [PSH, ACK] Seq=973887 Ack=43525 Win=233984 Len=1240 [TCP PDU reassembled in 19919]"
"20130","104.700175","142.251.32.10","192.168.2.103","TCP","1394","[TCP Previous segment not captured] 443  >  1584 [PSH, ACK] Seq=1133847 Ack=43525 Win=233984 Len=1240 [TCP PDU reassembled in 20149]"
"20137","104.701878","142.251.32.10","192.168.2.103","TCP","1394","[TCP Previous segment not captured] 443  >  1584 [PSH, ACK] Seq=1141287 Ack=43525 Win=233984 Len=1240 [TCP PDU reassembled in 20149]"
"21796","115.188359","142.251.32.10","192.168.2.103","TCP","1394","[TCP Previous segment not captured] 443  >  1589 [ACK] Seq=7999790 Ack=5806 Win=264960 Len=1240 [TCP PDU reassembled in 21851]"
"21892","115.207787","142.251.32.10","192.168.2.103","TCP","1394","[TCP Previous segment not captured] 443  >  1589 [ACK] Seq=8048150 Ack=5806 Win=264960 Len=1240 [TCP PDU reassembled in 21912]"
"21992","115.229532","142.251.32.10","192.168.2.103","TCP","1394","[TCP Previous segment not captured] 443  >  1589 [ACK] Seq=8110150 Ack=5806 Win=264960 Len=1240 [TCP PDU reassembled in 22019]"
"22123","115.259517","142.251.32.10","192.168.2.103","TCP","1394","[TCP Previous segment not captured] 443  >  1589 [ACK] Seq=8180830 Ack=5806 Win=264960 Len=1240 [TCP PDU reassembled in 22170]"
"22130","115.261885","142.251.32.10","192.168.2.103","TCP","1394","[TCP Previous segment not captured] 443  >  1589 [ACK] Seq=8183310 Ack=5806 Win=264960 Len=1240 [TCP PDU reassembled in 22170]"
"22220","115.281878","142.251.32.10","192.168.2.103","TCP","1394","[TCP Previous segment not captured] 443  >  1589 [PSH, ACK] Seq=8224230 Ack=5806 Win=264960 Len=1240 [TCP PDU reassembled in 22325]"
"22258","115.287757","142.251.32.10","192.168.2.103","TCP","1394","[TCP Previous segment not captured] 443  >  1589 [ACK] Seq=8250270 Ack=5806 Win=264960 Len=1240 [TCP PDU reassembled in 22325]"
"22273","115.291549","142.251.32.10","192.168.2.103","TCP","1394","[TCP Previous segment not captured] 443  >  1589 [ACK] Seq=8253990 Ack=5806 Win=264960 Len=1240 [TCP PDU reassembled in 22325]"
"22293","115.295858","142.251.32.10","192.168.2.103","TCP","1394","[TCP Previous segment not captured] 443  >  1589 [ACK] Seq=8265150 Ack=5806 Win=264960 Len=1240 [TCP PDU reassembled in 22325]"
"22635","115.379227","142.251.32.10","192.168.2.103","TCP","1394","[TCP Previous segment not captured] 443  >  1589 [ACK] Seq=8436270 Ack=5806 Win=264960 Len=1240 [TCP PDU reassembled in 22649]"
"22666","115.389647","142.251.32.10","192.168.2.103","TCP","1394","[TCP Previous segment not captured] 443  >  1589 [PSH, ACK] Seq=8453630 Ack=5806 Win=264960 Len=1240 [TCP PDU reassembled in 22689]"
"22674","115.391469","142.251.32.10","192.168.2.103","TCP","1394","[TCP Previous segment not captured] 443  >  1589 [ACK] Seq=8456110 Ack=5806 Win=264960 Len=1240 [TCP PDU reassembled in 22689]"
"22893","115.439202","142.251.32.10","192.168.2.103","TCP","1394","[TCP Previous segment not captured] 443  >  1589 [ACK] Seq=8570190 Ack=5806 Win=264960 Len=1240 [TCP PDU reassembled in 22946]"
"22978","115.455892","142.251.32.10","192.168.2.103","TCP","1394","[TCP Previous segment not captured] 443  >  1589 [PSH, ACK] Seq=8611110 Ack=5806 Win=264960 Len=1240 [TCP PDU reassembled in 23001]"
"23290","115.527764","142.251.32.10","192.168.2.103","TCP","1394","[TCP Previous segment not captured] 443  >  1589 [PSH, ACK] Seq=8753710 Ack=5806 Win=264960 Len=1240 [TCP PDU reassembled in 23325]"
"23358","115.549691","142.251.32.10","192.168.2.103","TCP","1394","[TCP Previous segment not captured] 443  >  1589 [ACK] Seq=8787190 Ack=5806 Win=264960 Len=1240"
"23527","115.590386","142.251.32.10","192.168.2.103","TCP","1394","[TCP Previous segment not captured] 443  >  1589 [ACK] Seq=8873990 Ack=5806 Win=264960 Len=1240 [TCP PDU reassembled in 23638]"
"23577","115.601501","142.251.32.10","192.168.2.103","TCP","1394","[TCP Previous segment not captured] 443  >  1589 [PSH, ACK] Seq=8897550 Ack=5806 Win=264960 Len=1240 [TCP PDU reassembled in 23638]"
"23626","115.614549","142.251.32.10","192.168.2.103","TCP","1394","[TCP Previous segment not captured] 443  >  1589 [ACK] Seq=8917390 Ack=5806 Win=264960 Len=1240 [TCP PDU reassembled in 23638]"
"23704","115.631262","142.251.32.10","192.168.2.103","TCP","1394","[TCP Previous segment not captured] 443  >  1589 [ACK] Seq=8959550 Ack=5806 Win=264960 Len=1240 [TCP PDU reassembled in 23767]"
"24073","115.723841","142.251.32.10","192.168.2.103","TCP","1394","[TCP Previous segment not captured] 443  >  1589 [PSH, ACK] Seq=9160430 Ack=5806 Win=264960 Len=1240"
"24369","124.132734","142.251.32.10","192.168.2.103","TCP","1386","[TCP Previous segment not captured] 443  >  1589 [PSH, ACK] Seq=9180203 Ack=6380 Win=264448 Len=1240"
"24404","124.137982","142.251.32.10","192.168.2.103","TCP","1394","[TCP Previous segment not captured] 443  >  1589 [ACK] Seq=9205003 Ack=6380 Win=264448 Len=1240"
"24854","124.235666","142.251.32.10","192.168.2.103","TCP","1394","[TCP Previous segment not captured] 443  >  1589 [ACK] Seq=9513826 Ack=6380 Win=264448 Len=1240 [TCP PDU reassembled in 24882]"
"25087","124.297592","142.251.32.10","192.168.2.103","TCP","1394","[TCP Previous segment not captured] 443  >  1589 [ACK] Seq=9656426 Ack=6380 Win=264448 Len=1240 [TCP PDU reassembled in 25163]"
"25346","124.355582","142.251.32.10","192.168.2.103","TCP","1394","[TCP Previous segment not captured] 443  >  1589 [ACK] Seq=9800266 Ack=6380 Win=264448 Len=1240"
"25376","124.362551","142.251.32.10","192.168.2.103","TCP","1394","[TCP Previous segment not captured] 443  >  1589 [ACK] Seq=9831266 Ack=6380 Win=264448 Len=1240"
"25392","124.366187","142.251.32.10","192.168.2.103","TCP","1394","[TCP Previous segment not captured] 443  >  1589 [ACK] Seq=9841186 Ack=6380 Win=264448 Len=1240 [TCP PDU reassembled in 25413]"
"25866","124.463629","142.251.32.10","192.168.2.103","TCP","1394","[TCP Previous segment not captured] 443  >  1589 [ACK] Seq=10115226 Ack=6380 Win=264448 Len=1240 [TCP PDU reassembled in 25994]"
"25888","124.467909","142.251.32.10","192.168.2.103","TCP","1394","[TCP Previous segment not captured] 443  >  1589 [ACK] Seq=10122666 Ack=6380 Win=264448 Len=1240 [TCP PDU reassembled in 25994]"
"25900","124.469672","142.251.32.10","192.168.2.103","TCP","1394","[TCP Previous segment not captured] 443  >  1589 [ACK] Seq=10132586 Ack=6380 Win=264448 Len=1240 [TCP PDU reassembled in 25994]"
"25906","124.471747","142.251.32.10","192.168.2.103","TCP","1394","[TCP Previous segment not captured] 443  >  1589 [PSH, ACK] Seq=10136306 Ack=6380 Win=264448 Len=1240 [TCP PDU reassembled in 25994]"
"26403","124.604555","142.251.32.10","192.168.2.103","TCP","1394","[TCP Previous segment not captured] 443  >  1589 [ACK] Seq=10344626 Ack=6380 Win=264448 Len=1240 [TCP PDU reassembled in 26485]"
"26511","124.629340","142.251.32.10","192.168.2.103","TCP","1394","[TCP Previous segment not captured] 443  >  1589 [ACK] Seq=10396706 Ack=6380 Win=264448 Len=1240 [TCP PDU reassembled in 26604]"
"26515","124.630598","142.251.32.10","192.168.2.103","TCP","1394","[TCP Previous segment not captured] 443  >  1589 [ACK] Seq=10401666 Ack=6380 Win=264448 Len=1240 [TCP PDU reassembled in 26604]"
"26564","124.641809","142.251.32.10","192.168.2.103","TCP","1394","[TCP Previous segment not captured] 443  >  1589 [ACK] Seq=10419026 Ack=6380 Win=264448 Len=1240 [TCP PDU reassembled in 26604]"
"26596","124.649278","142.251.32.10","192.168.2.103","TCP","1394","[TCP Previous segment not captured] 443  >  1589 [PSH, ACK] Seq=10435146 Ack=6380 Win=264448 Len=1240 [TCP PDU reassembled in 26604]"
"26835","124.711355","142.251.32.10","192.168.2.103","TCP","1394","[TCP Previous segment not captured] 443  >  1589 [PSH, ACK] Seq=10551706 Ack=6380 Win=264448 Len=1240"
"27760","134.665282","142.251.32.10","192.168.2.103","TCP","1394","[TCP Previous segment not captured] 443  >  1589 [PSH, ACK] Seq=10854950 Ack=6954 Win=263936 Len=1240 [TCP PDU reassembled in 27792]"
"28198","134.759391","142.251.32.10","192.168.2.103","TCP","1394","[TCP Previous segment not captured] 443  >  1589 [ACK] Seq=11095510 Ack=6954 Win=263936 Len=1240 [TCP PDU reassembled in 28245]"
"28204","134.759413","142.251.32.10","192.168.2.103","TCP","1394","[TCP Previous segment not captured] 443  >  1589 [ACK] Seq=11102950 Ack=6954 Win=263936 Len=1240 [TCP PDU reassembled in 28245]"
"28393","134.798510","142.251.32.10","192.168.2.103","TCP","1394","[TCP Previous segment not captured] 443  >  1589 [PSH, ACK] Seq=11220750 Ack=6954 Win=263936 Len=1240"
"28477","134.813966","142.251.32.10","192.168.2.103","TCP","1394","[TCP Previous segment not captured] 443  >  1589 [ACK] Seq=11266630 Ack=6954 Win=263936 Len=1240 [TCP PDU reassembled in 28531]"
"28487","134.816006","142.251.32.10","192.168.2.103","TCP","1394","[TCP Previous segment not captured] 443  >  1589 [ACK] Seq=11271590 Ack=6954 Win=263936 Len=1240 [TCP PDU reassembled in 28531]"
"28503","134.819694","142.251.32.10","192.168.2.103","TCP","1394","[TCP Previous segment not captured] 443  >  1589 [PSH, ACK] Seq=11282750 Ack=6954 Win=263936 Len=1240 [TCP PDU reassembled in 28531]"
"28720","134.859661","142.251.32.10","192.168.2.103","TCP","1394","[TCP Previous segment not captured] 443  >  1589 [PSH, ACK] Seq=11426590 Ack=6954 Win=263936 Len=1240 [TCP PDU reassembled in 28762]"
"28723","134.861589","142.251.32.10","192.168.2.103","TCP","1394","[TCP Previous segment not captured] 443  >  1589 [PSH, ACK] Seq=11429070 Ack=6954 Win=263936 Len=1240 [TCP PDU reassembled in 28762]"
"28955","134.907888","142.251.32.10","192.168.2.103","TCP","1394","[TCP Previous segment not captured] 443  >  1589 [ACK] Seq=11566710 Ack=6954 Win=263936 Len=1240 [TCP PDU reassembled in 29047]"
"29275","134.967922","142.251.32.10","192.168.2.103","TCP","1394","[TCP Previous segment not captured] 443  >  1589 [PSH, ACK] Seq=11753950 Ack=6954 Win=263936 Len=1240 [TCP PDU reassembled in 29346]"
"29488","135.009143","142.251.32.10","192.168.2.103","TCP","1394","[TCP Previous segment not captured] 443  >  1589 [PSH, ACK] Seq=11875470 Ack=6954 Win=263936 Len=1240 [TCP PDU reassembled in 29530]"
"29651","135.041863","142.251.32.10","192.168.2.103","TCP","1394","[TCP Previous segment not captured] 443  >  1589 [PSH, ACK] Seq=11962270 Ack=6954 Win=263936 Len=1240 [TCP PDU reassembled in 29690]"
"29673","135.045321","142.251.32.10","192.168.2.103","TCP","1394","[TCP Previous segment not captured] 443  >  1589 [PSH, ACK] Seq=11979630 Ack=6954 Win=263936 Len=1240 [TCP PDU reassembled in 29690]"
"29934","135.091655","142.251.32.10","192.168.2.103","TCP","1394","[TCP Previous segment not captured] 443  >  1589 [PSH, ACK] Seq=12128430 Ack=6954 Win=263936 Len=1240 [TCP PDU reassembled in 29960]"
"30002","135.109538","142.251.32.10","192.168.2.103","TCP","1394","[TCP Previous segment not captured] 443  >  1589 [PSH, ACK] Seq=12173070 Ack=6954 Win=263936 Len=1240 [TCP PDU reassembled in 30022]"
"30005","135.109549","142.251.32.10","192.168.2.103","TCP","1394","[TCP Previous segment not captured] 443  >  1589 [ACK] Seq=12176790 Ack=6954 Win=263936 Len=1240 [TCP PDU reassembled in 30022]"
"30646","144.409122","142.251.32.10","192.168.2.103","TCP","1394","[TCP Previous segment not captured] 443  >  1589 [PSH, ACK] Seq=12362632 Ack=7528 Win=263424 Len=1240"
"31022","144.480398","142.251.32.10","192.168.2.103","TCP","1394","[TCP Previous segment not captured] 443  >  1589 [ACK] Seq=12604432 Ack=7528 Win=263424 Len=1240 [TCP PDU reassembled in 31089]"
"31026","144.482199","142.251.32.10","192.168.2.103","TCP","1394","[TCP Previous segment not captured] 443  >  1589 [ACK] Seq=12611872 Ack=7528 Win=263424 Len=1240 [TCP PDU reassembled in 31089]"
"31391","144.554076","142.251.32.10","192.168.2.103","TCP","1394","[TCP Previous segment not captured] 443  >  1589 [ACK] Seq=12862352 Ack=7528 Win=263424 Len=1240 [TCP PDU reassembled in 31401]"
"31431","144.561986","142.251.32.10","192.168.2.103","TCP","1394","[TCP Previous segment not captured] 443  >  1589 [PSH, ACK] Seq=12885912 Ack=7528 Win=263424 Len=1240 [TCP PDU reassembled in 31453]"
"31838","144.646052","142.251.32.10","192.168.2.103","TCP","1394","[TCP Previous segment not captured] 443  >  1589 [PSH, ACK] Seq=13138872 Ack=7528 Win=263424 Len=1240 [TCP PDU reassembled in 31857]"
"32031","144.681643","142.251.32.10","192.168.2.103","TCP","1394","[TCP Previous segment not captured] 443  >  1589 [PSH, ACK] Seq=13267832 Ack=7528 Win=263424 Len=1240 [TCP PDU reassembled in 32086]"
"32199","144.716046","142.251.32.10","192.168.2.103","TCP","1394","[TCP Previous segment not captured] 443  >  1589 [ACK] Seq=13375712 Ack=7528 Win=263424 Len=1240"
"32668","144.805959","142.251.32.10","192.168.2.103","TCP","1394","[TCP Previous segment not captured] 443  >  1589 [PSH, ACK] Seq=13678272 Ack=7528 Win=263424 Len=1240 [TCP PDU reassembled in 32737]"
"32709","144.813904","142.251.32.10","192.168.2.103","TCP","1394","[TCP Previous segment not captured] 443  >  1589 [ACK] Seq=13714232 Ack=7528 Win=263424 Len=1240 [TCP PDU reassembled in 32737]"
"32822","144.837946","142.251.32.10","192.168.2.103","TCP","1394","[TCP Previous segment not captured] 443  >  1589 [PSH, ACK] Seq=13777472 Ack=7528 Win=263424 Len=1240 [TCP PDU reassembled in 32834]"
"33757","154.439579","142.251.32.10","192.168.2.103","TCP","1394","[TCP Previous segment not captured] 443  >  1589 [ACK] Seq=14188890 Ack=8102 Win=262912 Len=1240"
"34015","154.494062","142.251.32.10","192.168.2.103","TCP","1394","[TCP Previous segment not captured] 443  >  1589 [ACK] Seq=14389770 Ack=8102 Win=262912 Len=1240"
"34052","154.497586","142.251.32.10","192.168.2.103","TCP","1394","[TCP Previous segment not captured] 443  >  1589 [ACK] Seq=14428210 Ack=8102 Win=262912 Len=1240"
"34183","154.519686","142.251.32.10","192.168.2.103","TCP","1394","[TCP Previous segment not captured] 443  >  1589 [ACK] Seq=14557170 Ack=8102 Win=262912 Len=1240 [TCP PDU reassembled in 34192]"
"34293","154.538129","142.251.32.10","192.168.2.103","TCP","1394","[TCP Previous segment not captured] 443  >  1589 [ACK] Seq=14640250 Ack=8102 Win=262912 Len=1240 [TCP PDU reassembled in 34304]"
"34298","154.538148","142.251.32.10","192.168.2.103","TCP","1394","[TCP Previous segment not captured] 443  >  1589 [ACK] Seq=14646450 Ack=8102 Win=262912 Len=1240 [TCP PDU reassembled in 34304]"
"34781","154.627709","142.251.32.10","192.168.2.103","TCP","1394","[TCP Previous segment not captured] 443  >  1589 [PSH, ACK] Seq=15013490 Ack=8102 Win=262912 Len=1240"
"34794","154.630195","142.251.32.10","192.168.2.103","TCP","1394","[TCP Previous segment not captured] 443  >  1589 [ACK] Seq=15029610 Ack=8102 Win=262912 Len=1240"
"34928","154.650594","142.251.32.10","192.168.2.103","TCP","1394","[TCP Previous segment not captured] 443  >  1589 [ACK] Seq=15141210 Ack=8102 Win=262912 Len=1240 [TCP PDU reassembled in 34962]"
"34992","154.666061","142.251.32.10","192.168.2.103","TCP","1394","[TCP Previous segment not captured] 443  >  1589 [ACK] Seq=15204450 Ack=8102 Win=262912 Len=1240 [TCP PDU reassembled in 35028]"
"35293","157.452825","192.168.2.103","142.251.32.10","TCP","146","[TCP Previous segment not captured] 1584  >  443 [ACK] Seq=74449 Ack=1624090 Win=267776 Len=0"
