"No.","Time","Source","Destination","Protocol","Length","Info"
"87","1.649714","192.168.2.103","224.0.0.251","MDNS","183","Standard query 0x0000 PTR _oculusal_sp._tcp.local, ""QM"" question"
"90","1.649829","192.168.2.103","224.0.0.251","MDNS","371","Standard query response 0x0000 PTR 12549::oldman._oculusal_sp_v2._tcp.local SRV 0 0 3469 oldman.local TXT A 192.168.2.103 AAAA fe80::18a0:cb74:d156:8d15"
"103","1.959411","192.168.2.103","224.0.0.251","MDNS","178","Standard query 0x0000 PTR _oculusal_sp_v2._tcp.local, ""QM"" question"
"115","1.960264","192.168.2.103","224.0.0.251","MDNS","366","Standard query response 0x0000 PTR 12549::oldman._oculusal_sp_v2._tcp.local SRV 0 0 3469 oldman.local TXT A 192.168.2.103 AAAA fe80::18a0:cb74:d156:8d15"
"199","5.659230","192.168.2.103","224.0.0.251","MDNS","183","Standard query 0x0000 PTR _oculusal_sp._tcp.local, ""QM"" question"
"206","5.665623","192.168.2.103","224.0.0.251","MDNS","371","Standard query response 0x0000 PTR 12549::oldman._oculusal_sp_v2._tcp.local SRV 0 0 3469 oldman.local TXT A 192.168.2.103 AAAA fe80::18a0:cb74:d156:8d15"
"211","5.973168","192.168.2.103","224.0.0.251","MDNS","186","Standard query 0x0000 PTR _oculusal_sp_v2._tcp.local, ""QM"" question"
"214","5.973199","192.168.2.103","224.0.0.251","MDNS","374","Standard query response 0x0000 PTR 12549::oldman._oculusal_sp_v2._tcp.local SRV 0 0 3469 oldman.local TXT A 192.168.2.103 AAAA fe80::18a0:cb74:d156:8d15"
"313","13.645397","192.168.2.103","224.0.0.251","MDNS","175","Standard query 0x0000 PTR _oculusal_sp._tcp.local, ""QM"" question"
"325","13.646221","192.168.2.103","224.0.0.251","MDNS","363","Standard query response 0x0000 PTR 12549::oldman._oculusal_sp_v2._tcp.local SRV 0 0 3469 oldman.local TXT A 192.168.2.103 AAAA fe80::18a0:cb74:d156:8d15"
"331","13.954460","192.168.2.103","224.0.0.251","MDNS","178","Standard query 0x0000 PTR _oculusal_sp_v2._tcp.local, ""QM"" question"
"345","13.960304","192.168.2.103","224.0.0.251","MDNS","366","Standard query response 0x0000 PTR 12549::oldman._oculusal_sp_v2._tcp.local SRV 0 0 3469 oldman.local TXT A 192.168.2.103 AAAA fe80::18a0:cb74:d156:8d15"
"357","14.655662","192.168.2.103","224.0.0.251","MDNS","183","Standard query 0x0000 PTR _oculusal_sp._tcp.local, ""QM"" question"
"366","14.656457","192.168.2.103","224.0.0.251","MDNS","363","Standard query response 0x0000 PTR 12549::oldman._oculusal_sp_v2._tcp.local SRV 0 0 3469 oldman.local TXT A 192.168.2.103 AAAA fe80::18a0:cb74:d156:8d15"
"375","14.968670","192.168.2.103","224.0.0.251","MDNS","186","Standard query 0x0000 PTR _oculusal_sp_v2._tcp.local, ""QM"" question"
"384","14.969183","192.168.2.103","224.0.0.251","MDNS","366","Standard query response 0x0000 PTR 12549::oldman._oculusal_sp_v2._tcp.local SRV 0 0 3469 oldman.local TXT A 192.168.2.103 AAAA fe80::18a0:cb74:d156:8d15"
"432","16.664984","192.168.2.103","224.0.0.251","MDNS","175","Standard query 0x0000 PTR _oculusal_sp._tcp.local, ""QM"" question"
"444","16.665768","192.168.2.103","224.0.0.251","MDNS","363","Standard query response 0x0000 PTR 12549::oldman._oculusal_sp_v2._tcp.local SRV 0 0 3469 oldman.local TXT A 192.168.2.103 AAAA fe80::18a0:cb74:d156:8d15"
"455","16.975270","192.168.2.103","224.0.0.251","MDNS","186","Standard query 0x0000 PTR _oculusal_sp_v2._tcp.local, ""QM"" question"
"464","16.976078","192.168.2.103","224.0.0.251","MDNS","366","Standard query response 0x0000 PTR 12549::oldman._oculusal_sp_v2._tcp.local SRV 0 0 3469 oldman.local TXT A 192.168.2.103 AAAA fe80::18a0:cb74:d156:8d15"
"499","18.635849","192.168.2.103","157.240.26.11","TLSv1.2","177","Application Data"
"504","18.669771","157.240.26.11","192.168.2.103","TLSv1.2","177","Application Data"
"510","18.698056","192.168.2.103","157.240.26.11","TLSv1.2","177","Application Data"
"515","18.712391","192.168.2.103","157.240.26.11","TCP","146","1084  >  443 [ACK] Seq=32 Ack=32 Win=256 Len=0"
"517","18.731628","157.240.26.11","192.168.2.103","TLSv1.2","177","Application Data"
"522","18.774689","192.168.2.103","157.240.26.11","TCP","146","1085  >  443 [ACK] Seq=32 Ack=32 Win=260 Len=0"
"544","20.673586","192.168.2.103","224.0.0.251","MDNS","183","Standard query 0x0000 PTR _oculusal_sp._tcp.local, ""QM"" question"
"550","20.679802","192.168.2.103","224.0.0.251","MDNS","371","Standard query response 0x0000 PTR 12549::oldman._oculusal_sp_v2._tcp.local SRV 0 0 3469 oldman.local TXT A 192.168.2.103 AAAA fe80::18a0:cb74:d156:8d15"
"564","21.000745","192.168.2.103","224.0.0.251","MDNS","186","Standard query 0x0000 PTR _oculusal_sp_v2._tcp.local, ""QM"" question"
"567","21.000762","192.168.2.103","224.0.0.251","MDNS","374","Standard query response 0x0000 PTR 12549::oldman._oculusal_sp_v2._tcp.local SRV 0 0 3469 oldman.local TXT A 192.168.2.103 AAAA fe80::18a0:cb74:d156:8d15"
"584","22.110653","192.168.2.103","157.240.26.49","TLSv1.2","201","Application Data"
"589","22.110969","192.168.2.103","157.240.26.49","TCP","193","[TCP Retransmission] 1346  >  443 [PSH, ACK] Seq=1 Ack=1 Win=251 Len=47"
"593","22.111909","192.168.2.103","157.240.26.49","TCP","146","[TCP Previous segment not captured] 1346  >  443 [FIN, ACK] Seq=72 Ack=1 Win=251 Len=0"
"597","22.112388","192.168.2.103","192.168.2.1","DNS","168","Standard query 0x7f56 A graph.oculus.com"
"602","22.170196","192.168.2.103","192.168.2.1","DNS","176","Standard query 0xe820 A graph.oculus.com"
"603","22.170201","192.168.2.103","192.168.2.1","DNS","176","Standard query 0x716f HTTPS graph.oculus.com"
"605","22.206765","192.168.2.1","192.168.2.103","DNS","219","Standard query response 0x7f56 A graph.oculus.com CNAME oculus.c10r.facebook.com A 157.240.26.49"
"609","22.208352","192.168.2.103","157.240.26.49","TCP","158","1551  >  443 [SYN] Seq=0 Win=64480 Len=0 MSS=1460 WS=256 SACK_PERM"
"611","22.240369","157.240.26.49","192.168.2.103","TCP","158","443  >  1551 [SYN, ACK] Seq=0 Ack=1 Win=65535 Len=0 MSS=1392 SACK_PERM WS=256"
"615","22.240876","192.168.2.103","157.240.26.49","TCP","146","1551  >  443 [ACK] Seq=1 Ack=1 Win=65536 Len=0"
"619","22.241347","192.168.2.103","157.240.26.49","TLSv1.3","664","Client Hello (SNI=graph.oculus.com)"
"621","22.241365","192.168.2.1","192.168.2.103","DNS","219","Standard query response 0xe820 A graph.oculus.com CNAME oculus.c10r.facebook.com A 157.240.26.49"
"624","22.254350","157.240.26.49","192.168.2.103","TCP","146","443  >  1551 [ACK] Seq=1 Ack=519 Win=66816 Len=0"
"626","22.254609","157.240.26.49","192.168.2.103","TLSv1.3","358","Server Hello, Change Cipher Spec, Application Data"
"630","22.255387","192.168.2.103","157.240.26.49","TLSv1.3","218","Change Cipher Spec, Application Data"
"631","22.255393","192.168.2.103","157.240.26.49","TLSv1.3","240","Application Data"
"635","22.255788","192.168.2.103","157.240.26.49","TLSv1.3","498","Application Data"
"638","22.256127","192.168.2.103","157.240.26.49","TCP","498","[TCP Retransmission] 1551  >  443 [PSH, ACK] Seq=669 Ack=213 Win=65280 Len=352"
"640","22.263631","157.240.26.49","192.168.2.103","TCP","146","443  >  1551 [ACK] Seq=213 Ack=669 Win=66816 Len=0"
"644","22.264007","192.168.2.103","157.240.26.49","TCP","158","1552  >  443 [SYN] Seq=0 Win=64480 Len=0 MSS=1460 WS=256 SACK_PERM"
"647","22.264340","192.168.2.103","157.240.26.49","TCP","158","[TCP Retransmission] 1552  >  443 [SYN] Seq=0 Win=64480 Len=0 MSS=1460 WS=256 SACK_PERM"
"649","22.264597","157.240.26.49","192.168.2.103","TLSv1.3","315","Application Data"
"651","22.264986","157.240.26.49","192.168.2.103","TLSv1.3","220","Application Data"
"653","22.265614","157.240.26.49","192.168.2.103","TLSv1.3","190","Application Data"
"657","22.265983","192.168.2.103","157.240.26.49","TCP","154","1551  >  443 [ACK] Seq=1021 Ack=456 Win=65024 Len=0"
"658","22.265987","192.168.2.103","157.240.26.49","TLSv1.3","185","Application Data"
"660","22.273805","157.240.26.49","192.168.2.103","TCP","158","443  >  1552 [SYN, ACK] Seq=0 Ack=1 Win=65535 Len=0 MSS=1392 SACK_PERM WS=256"
"664","22.274572","192.168.2.103","157.240.26.49","TCP","154","1552  >  443 [ACK] Seq=1 Ack=1 Win=65536 Len=0"
"665","22.274577","192.168.2.103","157.240.26.49","TLSv1.3","899","Client Hello (SNI=graph.oculus.com)"
"668","22.275111","192.168.2.103","157.240.26.49","TCP","154","1552  >  443 [ACK] Seq=1 Ack=1 Win=65536 Len=0"
"669","22.275116","192.168.2.103","157.240.26.49","TCP","899","[TCP Retransmission] 1552  >  443 [PSH, ACK] Seq=1 Ack=1 Win=65536 Len=745"
"672","22.275938","192.168.2.103","157.240.26.49","TCP","154","1552  >  443 [ACK] Seq=1 Ack=1 Win=65536 Len=0"
"673","22.275942","192.168.2.103","157.240.26.49","TCP","899","[TCP Retransmission] 1552  >  443 [PSH, ACK] Seq=1 Ack=1 Win=65536 Len=745"
"675","22.286388","157.240.26.49","192.168.2.103","TCP","146","443  >  1552 [ACK] Seq=1 Ack=746 Win=67072 Len=0"
"677","22.287891","157.240.26.49","192.168.2.103","TLSv1.3","903","Server Hello, Change Cipher Spec, Application Data"
"681","22.294392","192.168.2.103","157.240.26.49","TLSv1.3","218","Change Cipher Spec, Application Data"
"682","22.294396","192.168.2.103","157.240.26.49","TLSv1.3","246","Application Data"
"683","22.294401","192.168.2.103","157.240.26.49","TLSv1.3","544","Application Data"
"684","22.294404","192.168.2.103","157.240.26.49","TLSv1.3","526","Application Data"
"687","22.295042","192.168.2.103","157.240.26.49","TCP","218","[TCP Retransmission] 1552  >  443 [PSH, ACK] Seq=746 Ack=758 Win=64768 Len=64"
"688","22.295046","192.168.2.103","157.240.26.49","TCP","246","[TCP Retransmission] 1552  >  443 [PSH, ACK] Seq=810 Ack=758 Win=64768 Len=92"
"694","22.295936","192.168.2.103","157.240.26.49","TCP","218","[TCP Retransmission] 1552  >  443 [PSH, ACK] Seq=746 Ack=758 Win=64768 Len=64"
"695","22.295940","192.168.2.103","157.240.26.49","TCP","246","[TCP Retransmission] 1552  >  443 [PSH, ACK] Seq=810 Ack=758 Win=64768 Len=92"
"696","22.295945","192.168.2.103","157.240.26.49","TCP","544","[TCP Retransmission] 1552  >  443 [PSH, ACK] Seq=902 Ack=758 Win=64768 Len=390"
"697","22.295948","192.168.2.103","157.240.26.49","TCP","526","[TCP Retransmission] 1552  >  443 [PSH, ACK] Seq=1292 Ack=758 Win=64768 Len=372"
"701","22.296385","192.168.2.103","157.240.26.49","TCP","536","[TCP Retransmission] 1552  >  443 [PSH, ACK] Seq=902 Ack=758 Win=64768 Len=390"
"703","22.303631","157.240.26.49","192.168.2.103","TCP","146","443  >  1552 [ACK] Seq=758 Ack=902 Win=67072 Len=0"
"705","22.304107","157.240.26.49","192.168.2.103","TLSv1.3","315","Application Data"
"707","22.304516","157.240.26.49","192.168.2.103","TLSv1.3","228","Application Data"
"708","22.304521","157.240.26.49","192.168.2.103","TLSv1.3","185","Application Data"
"712","22.305055","192.168.2.103","157.240.26.49","TCP","154","1552  >  443 [ACK] Seq=1664 Ack=1032 Win=64512 Len=0"
"713","22.305060","192.168.2.103","157.240.26.49","TLSv1.3","185","Application Data"
"716","22.305461","192.168.2.103","157.240.26.49","TCP","154","1552  >  443 [ACK] Seq=1664 Ack=1032 Win=64512 Len=0"
"717","22.305465","192.168.2.103","157.240.26.49","TCP","185","[TCP Retransmission] 1552  >  443 [PSH, ACK] Seq=1664 Ack=1032 Win=64512 Len=31"
"719","22.305577","157.240.26.49","192.168.2.103","TCP","146","443  >  1552 [ACK] Seq=1032 Ack=1664 Win=70144 Len=0"
"721","22.305985","157.240.26.49","192.168.2.103","TLSv1.3","181","Application Data"
"725","22.308825","192.168.2.103","157.240.26.49","TCP","146","1551  >  443 [ACK] Seq=1052 Ack=500 Win=65024 Len=0"
"727","22.314650","157.240.26.49","192.168.2.103","TCP","146","443  >  1551 [ACK] Seq=500 Ack=1052 Win=67840 Len=0"
"730","22.355245","157.240.26.49","192.168.2.103","TCP","146","443  >  1552 [ACK] Seq=1067 Ack=1695 Win=70144 Len=0"
"733","22.355906","192.168.2.103","157.240.26.49","TCP","146","1552  >  443 [ACK] Seq=1695 Ack=1067 Win=64512 Len=0"
"734","22.356275","157.240.26.49","192.168.2.103","TCP","146","[TCP Dup ACK 730#1] 443  >  1552 [ACK] Seq=1067 Ack=1695 Win=70144 Len=0"
"738","22.356814","192.168.2.103","157.240.26.49","TCP","146","[TCP Dup ACK 733#1] 1552  >  443 [ACK] Seq=1695 Ack=1067 Win=64512 Len=0"
"742","22.369695","192.168.2.103","157.240.26.49","TCP","217","[TCP Retransmission] 1346  >  443 [FIN, PSH, ACK] Seq=1 Ack=1 Win=251 Len=71"
"744","22.372667","157.240.26.49","192.168.2.103","TLSv1.3","657","Application Data"
"746","22.372914","157.240.26.49","192.168.2.103","TLSv1.3","231","Application Data"
"750","22.373757","192.168.2.103","157.240.26.49","TCP","146","1552  >  443 [ACK] Seq=1695 Ack=1663 Win=65536 Len=0"
"755","22.606173","157.240.26.49","192.168.2.103","TLSv1.3","700","Application Data"
"757","22.606192","157.240.26.49","192.168.2.103","TLSv1.3","250","Application Data"
"762","22.607773","192.168.2.103","157.240.26.49","TCP","146","1551  >  443 [ACK] Seq=1052 Ack=1158 Win=64512 Len=0"
"765","22.608174","192.168.2.103","157.240.26.49","TCP","146","[TCP Dup ACK 762#1] 1551  >  443 [ACK] Seq=1052 Ack=1158 Win=64512 Len=0"
"769","22.679007","192.168.2.103","157.240.26.49","TCP","217","[TCP Retransmission] 1346  >  443 [FIN, PSH, ACK] Seq=1 Ack=1 Win=251 Len=71"
"779","23.287938","192.168.2.103","157.240.26.49","TCP","217","[TCP Retransmission] 1346  >  443 [FIN, PSH, ACK] Seq=1 Ack=1 Win=251 Len=71"
"790","23.764856","192.168.2.103","192.168.2.1","DNS","173","Standard query 0x3220 A static.nvidiagrid.net"
"792","23.828063","192.168.2.1","192.168.2.103","DNS","286","Standard query response 0x3220 A static.nvidiagrid.net CNAME static.nvidiagrid.net.edgekey.net CNAME e28142.dscg.akamaiedge.net A 23.192.220.16 A 23.192.220.4"
"798","23.829814","192.168.2.103","23.192.220.16","TCP","158","1553  >  443 [SYN] Seq=0 Win=64240 Len=0 MSS=1460 WS=256 SACK_PERM"
"800","23.839784","23.192.220.16","192.168.2.103","TCP","158","443  >  1553 [SYN, ACK] Seq=0 Ack=1 Win=64240 Len=0 MSS=1384 SACK_PERM WS=128"
"804","23.840331","192.168.2.103","23.192.220.16","TCP","146","1553  >  443 [ACK] Seq=1 Ack=1 Win=66304 Len=0"
"808","23.840764","192.168.2.103","23.192.220.16","TCP","146","[TCP Dup ACK 804#1] 1553  >  443 [ACK] Seq=1 Ack=1 Win=66304 Len=0"
"814","23.841396","192.168.2.103","23.192.220.16","TLSv1.3","767","Client Hello (SNI=static.nvidiagrid.net)"
"817","23.852614","23.192.220.16","192.168.2.103","TCP","146","443  >  1553 [ACK] Seq=1 Ack=622 Win=64128 Len=0"
"819","23.853055","23.192.220.16","192.168.2.103","TLSv1.3","410","Server Hello, Change Cipher Spec, Application Data, Application Data"
"824","23.864133","192.168.2.103","23.192.220.16","TLSv1.3","234","Change Cipher Spec, Application Data"
"825","23.864138","192.168.2.103","23.192.220.16","TLSv1.3","240","Application Data"
"826","23.864143","192.168.2.103","23.192.220.16","TLSv1.3","429","Application Data"
"827","23.864148","192.168.2.103","23.192.220.16","TLSv1.3","218","Application Data"
"830","23.873044","23.192.220.16","192.168.2.103","TCP","146","443  >  1553 [ACK] Seq=265 Ack=702 Win=64128 Len=0"
"832","23.873773","23.192.220.16","192.168.2.103","TLSv1.3","441","Application Data"
"833","23.873781","23.192.220.16","192.168.2.103","TCP","154","443  >  1553 [ACK] Seq=552 Ack=788 Win=64128 Len=0"
"834","23.873788","23.192.220.16","192.168.2.103","TCP","154","443  >  1553 [ACK] Seq=552 Ack=1063 Win=64128 Len=0"
"835","23.873793","23.192.220.16","192.168.2.103","TCP","154","443  >  1553 [ACK] Seq=552 Ack=1127 Win=64128 Len=0"
"837","23.874695","23.192.220.16","192.168.2.103","TLSv1.3","215","Application Data"
"838","23.874720","23.192.220.16","192.168.2.103","TLSv1.3","185","Application Data"
"839","23.874725","23.192.220.16","192.168.2.103","TLSv1.3","414","Application Data"
"843","23.875678","23.192.220.16","192.168.2.103","TCP","215","[TCP Retransmission] 443  >  1553 [PSH, ACK] Seq=552 Ack=1127 Win=64128 Len=61"
"844","23.875684","23.192.220.16","192.168.2.103","TCP","185","[TCP Retransmission] 443  >  1553 [PSH, ACK] Seq=613 Ack=1127 Win=64128 Len=31"
"845","23.875698","23.192.220.16","192.168.2.103","TCP","414","[TCP Retransmission] 443  >  1553 [PSH, ACK] Seq=644 Ack=1127 Win=64128 Len=260"
"847","23.877456","23.192.220.16","192.168.2.103","TCP","1394","443  >  1553 [ACK] Seq=904 Ack=1127 Win=64128 Len=1240 [TCP PDU reassembled in 886]"
"850","23.877477","23.192.220.16","192.168.2.103","TCP","1394","[TCP Previous segment not captured] 443  >  1553 [ACK] Seq=4624 Ack=1127 Win=64128 Len=1240 [TCP PDU reassembled in 886]"
"851","23.877481","23.192.220.16","192.168.2.103","TCP","1394","443  >  1553 [ACK] Seq=5864 Ack=1127 Win=64128 Len=1240 [TCP PDU reassembled in 886]"
"855","23.878943","23.192.220.16","192.168.2.103","TCP","1394","[TCP Retransmission] 443  >  1553 [ACK] Seq=904 Ack=1127 Win=64128 Len=1240"
"856","23.878953","23.192.220.16","192.168.2.103","TCP","1394","[TCP Out-Of-Order] 443  >  1553 [ACK] Seq=2144 Ack=1127 Win=64128 Len=1240 [TCP PDU reassembled in 886]"
"857","23.878960","23.192.220.16","192.168.2.103","TCP","1394","[TCP Out-Of-Order] 443  >  1553 [PSH, ACK] Seq=3384 Ack=1127 Win=64128 Len=1240 [TCP PDU reassembled in 886]"
"858","23.878964","23.192.220.16","192.168.2.103","TCP","1394","[TCP Retransmission] 443  >  1553 [ACK] Seq=4624 Ack=1127 Win=64128 Len=1240 [TCP PDU reassembled in 886]"
"859","23.878968","23.192.220.16","192.168.2.103","TCP","1394","[TCP Retransmission] 443  >  1553 [ACK] Seq=5864 Ack=1127 Win=64128 Len=1240 [TCP PDU reassembled in 886]"
"860","23.878971","23.192.220.16","192.168.2.103","TCP","1394","443  >  1553 [PSH, ACK] Seq=7104 Ack=1127 Win=64128 Len=1240 [TCP PDU reassembled in 886]"
"861","23.878975","23.192.220.16","192.168.2.103","TCP","1394","443  >  1553 [ACK] Seq=8344 Ack=1127 Win=64128 Len=1240 [TCP PDU reassembled in 886]"
"862","23.878978","23.192.220.16","192.168.2.103","TCP","1394","443  >  1553 [ACK] Seq=9584 Ack=1127 Win=64128 Len=1240 [TCP PDU reassembled in 886]"
"866","23.879202","192.168.2.103","23.192.220.16","TCP","154","1553  >  443 [ACK] Seq=1127 Ack=904 Win=65280 Len=0"
"867","23.879214","192.168.2.103","23.192.220.16","TLSv1.3","185","Application Data"
"868","23.879218","192.168.2.103","23.192.220.16","TCP","154","1553  >  443 [ACK] Seq=1158 Ack=2144 Win=66304 Len=0"
"870","23.879996","23.192.220.16","192.168.2.103","TCP","1394","443  >  1553 [PSH, ACK] Seq=10824 Ack=1127 Win=64128 Len=1240 [TCP PDU reassembled in 886]"
"871","23.880004","23.192.220.16","192.168.2.103","TCP","1394","443  >  1553 [ACK] Seq=12064 Ack=1127 Win=64128 Len=1240 [TCP PDU reassembled in 886]"
"872","23.880011","23.192.220.16","192.168.2.103","TCP","1394","443  >  1553 [ACK] Seq=13304 Ack=1127 Win=64128 Len=1240 [TCP PDU reassembled in 886]"
"873","23.880015","23.192.220.16","192.168.2.103","TCP","1394","443  >  1553 [PSH, ACK] Seq=14544 Ack=1127 Win=64128 Len=1240 [TCP PDU reassembled in 886]"
"877","23.880232","192.168.2.103","23.192.220.16","TCP","146","1553  >  443 [ACK] Seq=1158 Ack=10824 Win=66304 Len=0"
"881","23.880590","192.168.2.103","23.192.220.16","TCP","146","1553  >  443 [ACK] Seq=1158 Ack=15784 Win=66304 Len=0"
"884","23.887831","23.192.220.16","192.168.2.103","TCP","1386","443  >  1553 [ACK] Seq=15784 Ack=1127 Win=64128 Len=1240 [TCP PDU reassembled in 886]"
"886","23.893278","23.192.220.16","192.168.2.103","TLSv1.3","1394","Application Data, Application Data"
"887","23.893287","23.192.220.16","192.168.2.103","TCP","1394","443  >  1553 [PSH, ACK] Seq=18264 Ack=1127 Win=64128 Len=1240 [TCP PDU reassembled in 945]"
"888","23.893291","23.192.220.16","192.168.2.103","TCP","1394","443  >  1553 [ACK] Seq=19504 Ack=1127 Win=64128 Len=1240 [TCP PDU reassembled in 945]"
"889","23.893295","23.192.220.16","192.168.2.103","TCP","1394","443  >  1553 [ACK] Seq=20744 Ack=1127 Win=64128 Len=1240 [TCP PDU reassembled in 945]"
"893","23.893827","192.168.2.103","23.192.220.16","TCP","146","1553  >  443 [ACK] Seq=1158 Ack=19504 Win=66304 Len=0"
"895","23.896978","23.192.220.16","192.168.2.103","TCP","1394","[TCP Retransmission] 443  >  1553 [ACK] Seq=19504 Ack=1127 Win=64128 Len=1240 [TCP PDU reassembled in 945]"
"896","23.896991","23.192.220.16","192.168.2.103","TCP","1394","[TCP Retransmission] 443  >  1553 [ACK] Seq=20744 Ack=1127 Win=64128 Len=1240 [TCP PDU reassembled in 945]"
"905","23.898132","192.168.2.103","23.192.220.16","TCP","146","1553  >  443 [ACK] Seq=1158 Ack=21984 Win=66304 Len=0"
"907","23.899190","23.192.220.16","192.168.2.103","TLSv1.3","1394","[TCP Previous segment not captured] , Continuation Data"
"908","23.899199","23.192.220.16","192.168.2.103","TLSv1.3","1394","Continuation Data"
"909","23.899206","23.192.220.16","192.168.2.103","TLSv1.3","1394","Continuation Data"
"914","23.900524","23.192.220.16","192.168.2.103","TCP","1394","[TCP Retransmission] 443  >  1553 [ACK] Seq=43064 Ack=1158 Win=64128 Len=1240"
"915","23.900533","23.192.220.16","192.168.2.103","TCP","1394","[TCP Retransmission] 443  >  1553 [PSH, ACK] Seq=44304 Ack=1158 Win=64128 Len=1240"
"916","23.900537","23.192.220.16","192.168.2.103","TCP","1394","[TCP Retransmission] 443  >  1553 [ACK] Seq=45544 Ack=1158 Win=64128 Len=1240"
"917","23.900541","23.192.220.16","192.168.2.103","TLSv1.3","1394","Continuation Data"
"919","23.900932","23.192.220.16","192.168.2.103","TCP","1386","[TCP Out-Of-Order] 443  >  1553 [PSH, ACK] Seq=21984 Ack=1127 Win=64128 Len=1240 [TCP PDU reassembled in 945]"
"921","23.903453","23.192.220.16","192.168.2.103","TCP","1394","[TCP Out-Of-Order] 443  >  1553 [ACK] Seq=23224 Ack=1158 Win=64128 Len=1240 [TCP PDU reassembled in 945]"
"922","23.903465","23.192.220.16","192.168.2.103","TCP","1394","[TCP Out-Of-Order] 443  >  1553 [ACK] Seq=24464 Ack=1158 Win=64128 Len=1240 [TCP PDU reassembled in 945]"
"923","23.903469","23.192.220.16","192.168.2.103","TCP","1394","[TCP Out-Of-Order] 443  >  1553 [PSH, ACK] Seq=25704 Ack=1158 Win=64128 Len=1240 [TCP PDU reassembled in 945]"
"924","23.903473","23.192.220.16","192.168.2.103","TCP","1394","[TCP Out-Of-Order] 443  >  1553 [ACK] Seq=26944 Ack=1158 Win=64128 Len=1240 [TCP PDU reassembled in 945]"
"925","23.903476","23.192.220.16","192.168.2.103","TCP","1394","[TCP Out-Of-Order] 443  >  1553 [ACK] Seq=28184 Ack=1158 Win=64128 Len=1240 [TCP PDU reassembled in 945]"
"926","23.903480","23.192.220.16","192.168.2.103","TCP","1394","[TCP Out-Of-Order] 443  >  1553 [PSH, ACK] Seq=29424 Ack=1158 Win=64128 Len=1240 [TCP PDU reassembled in 945]"
"927","23.903483","23.192.220.16","192.168.2.103","TCP","1394","[TCP Out-Of-Order] 443  >  1553 [ACK] Seq=30664 Ack=1158 Win=64128 Len=1240 [TCP PDU reassembled in 945]"
"928","23.903487","23.192.220.16","192.168.2.103","TCP","1394","[TCP Out-Of-Order] 443  >  1553 [ACK] Seq=31904 Ack=1158 Win=64128 Len=1240 [TCP PDU reassembled in 945]"
"936","23.903866","192.168.2.103","23.192.220.16","TCP","146","1553  >  443 [ACK] Seq=1158 Ack=33144 Win=66304 Len=0"
"938","23.906445","23.192.220.16","192.168.2.103","TCP","1394","[TCP Spurious Retransmission] 443  >  1553 [ACK] Seq=23224 Ack=1158 Win=64128 Len=1240 [TCP PDU reassembled in 945]"
"939","23.906453","23.192.220.16","192.168.2.103","TCP","1394","[TCP Spurious Retransmission] 443  >  1553 [ACK] Seq=24464 Ack=1158 Win=64128 Len=1240 [TCP PDU reassembled in 945]"
"945","23.909156","23.192.220.16","192.168.2.103","TCP","1394","[TCP Out-Of-Order] 443  >  1553 [PSH, ACK] Seq=33144 Ack=1158 Win=64128 Len=1240"
"950","23.909379","192.168.2.103","157.240.26.49","TCP","158","1554  >  443 [SYN] Seq=0 Win=64480 Len=0 MSS=1460 WS=256 SACK_PERM"
"953","23.909726","192.168.2.103","157.240.26.49","TCP","158","[TCP Retransmission] 1554  >  443 [SYN] Seq=0 Win=64480 Len=0 MSS=1460 WS=256 SACK_PERM"
"955","23.911493","23.192.220.16","192.168.2.103","TLSv1.3","1394","[TCP Previous segment not captured] , Continuation Data"
"956","23.911501","23.192.220.16","192.168.2.103","TLSv1.3","1394","Continuation Data"
"957","23.911505","23.192.220.16","192.168.2.103","TLSv1.3","1394","Continuation Data"
"958","23.911509","23.192.220.16","192.168.2.103","TLSv1.3","1394","Continuation Data"
"959","23.911512","23.192.220.16","192.168.2.103","TLSv1.3","1394","Continuation Data"
"960","23.911519","23.192.220.16","192.168.2.103","TCP","1394","443  >  1553 [PSH, ACK] Seq=61664 Ack=1158 Win=64128 Len=1240"
"961","23.911523","23.192.220.16","192.168.2.103","TLSv1.3","1394","Continuation Data"
"962","23.911526","23.192.220.16","192.168.2.103","TLSv1.3","1394","Continuation Data"
"963","23.911530","23.192.220.16","192.168.2.103","TLSv1.3","1394","Continuation Data"
"965","23.913906","23.192.220.16","192.168.2.103","TCP","1394","[TCP Out-Of-Order] 443  >  1553 [ACK] Seq=34384 Ack=1158 Win=64128 Len=1240"
"966","23.913911","23.192.220.16","192.168.2.103","TCP","1394","[TCP Out-Of-Order] 443  >  1553 [ACK] Seq=35624 Ack=1158 Win=64128 Len=1240"
"967","23.913916","23.192.220.16","192.168.2.103","TCP","1394","[TCP Out-Of-Order] 443  >  1553 [PSH, ACK] Seq=36864 Ack=1158 Win=64128 Len=1240"
"968","23.913920","23.192.220.16","192.168.2.103","TCP","1394","[TCP Out-Of-Order] 443  >  1553 [ACK] Seq=38104 Ack=1158 Win=64128 Len=1240"
"974","23.915841","23.192.220.16","192.168.2.103","TCP","1394","[TCP Retransmission] 443  >  1553 [ACK] Seq=38104 Ack=1158 Win=64128 Len=1240"
"975","23.915846","23.192.220.16","192.168.2.103","TCP","1394","[TCP Out-Of-Order] 443  >  1553 [ACK] Seq=39344 Ack=1158 Win=64128 Len=1240"
"976","23.915851","23.192.220.16","192.168.2.103","TCP","1394","[TCP Out-Of-Order] 443  >  1553 [PSH, ACK] Seq=40584 Ack=1158 Win=64128 Len=1240"
"977","23.915855","23.192.220.16","192.168.2.103","TCP","1394","[TCP Out-Of-Order] 443  >  1553 [ACK] Seq=41824 Ack=1158 Win=64128 Len=1240"
"978","23.915861","23.192.220.16","192.168.2.103","TCP","1394","[TCP Out-Of-Order] 443  >  1553 [ACK] Seq=48024 Ack=1158 Win=64128 Len=1240"
"979","23.915866","23.192.220.16","192.168.2.103","TCP","1394","[TCP Out-Of-Order] 443  >  1553 [ACK] Seq=49264 Ack=1158 Win=64128 Len=1240"
"981","23.915872","23.192.220.16","192.168.2.103","TCP","1394","[TCP Out-Of-Order] 443  >  1553 [ACK] Seq=51744 Ack=1158 Win=64128 Len=1240"
"982","23.915875","23.192.220.16","192.168.2.103","TCP","1394","[TCP Out-Of-Order] 443  >  1553 [ACK] Seq=52984 Ack=1158 Win=64128 Len=1240"
"986","23.916093","192.168.2.103","23.192.220.16","TCP","146","1553  >  443 [ACK] Seq=1158 Ack=38104 Win=66304 Len=0"
"988","23.917109","23.192.220.16","192.168.2.103","TCP","1394","[TCP Out-Of-Order] 443  >  1553 [PSH, ACK] Seq=54224 Ack=1158 Win=64128 Len=1240"
"989","23.917114","23.192.220.16","192.168.2.103","TLSv1.3","1394","Continuation Data"
"990","23.917118","23.192.220.16","192.168.2.103","TLSv1.3","1394","Continuation Data"
"991","23.917123","23.192.220.16","192.168.2.103","TLSv1.3","1394","Continuation Data"
"992","23.917127","23.192.220.16","192.168.2.103","TLSv1.3","600","Continuation Data"
"995","23.917424","192.168.2.103","23.192.220.16","TCP","146","1553  >  443 [ACK] Seq=1158 Ack=48024 Win=66304 Len=0"
"997","23.918318","23.192.220.16","192.168.2.103","TCP","1394","[TCP Retransmission] 443  >  1553 [PSH, ACK] Seq=69104 Ack=1158 Win=64128 Len=1240"
"998","23.918321","23.192.220.16","192.168.2.103","TCP","600","[TCP Retransmission] 443  >  1553 [PSH, ACK] Seq=70344 Ack=1158 Win=64128 Len=446"
"999","23.918324","23.192.220.16","192.168.2.103","TCP","1394","[TCP Retransmission] 443  >  1553 [ACK] Seq=48024 Ack=1158 Win=64128 Len=1240"
"1000","23.918334","23.192.220.16","192.168.2.103","TCP","1394","[TCP Retransmission] 443  >  1553 [ACK] Seq=49264 Ack=1158 Win=64128 Len=1240"
"1004","23.918986","192.168.2.103","23.192.220.16","TCP","146","1553  >  443 [ACK] Seq=1158 Ack=70790 Win=132864 Len=0"
"1006","23.919095","157.240.26.49","192.168.2.103","TCP","158","443  >  1554 [SYN, ACK] Seq=0 Ack=1 Win=65535 Len=0 MSS=1392 SACK_PERM WS=256"
"1010","23.919662","192.168.2.103","157.240.26.49","TCP","146","1554  >  443 [ACK] Seq=1 Ack=1 Win=65536 Len=0"
"1014","23.920885","192.168.2.103","157.240.26.49","TLSv1.2","365","Client Hello (SNI=graph.oculus.com)"
"1016","23.931279","157.240.26.49","192.168.2.103","TCP","146","443  >  1554 [ACK] Seq=1 Ack=220 Win=66816 Len=0"
"1018","23.935389","157.240.26.49","192.168.2.103","TLSv1.2","1386","Server Hello"
"1021","23.936076","157.240.26.49","192.168.2.103","TCP","1241","[TCP Previous segment not captured] 443  >  1554 [PSH, ACK] Seq=2481 Ack=220 Win=66816 Len=1087 [TCP PDU reassembled in 1023], Server Key Exchange, Server Hello Done"
"1023","23.936513","157.240.26.49","192.168.2.103","TCP","1386","[TCP Out-Of-Order] 443  >  1554 [PSH, ACK] Seq=1241 Ack=220 Win=66816 Len=1240"
"1027","23.937459","192.168.2.103","157.240.26.49","TCP","146","1554  >  443 [ACK] Seq=220 Ack=3568 Win=65536 Len=0"
"1031","23.937907","192.168.2.103","157.240.26.49","TLSv1.2","272","Client Key Exchange, Change Cipher Spec, Encrypted Handshake Message"
"1035","23.948470","192.168.2.103","157.240.26.49","TCP","154","[TCP ACKed unseen segment] 1554  >  443 [ACK] Seq=346 Ack=3700 Win=65536 Len=0"
"1036","23.948474","192.168.2.103","157.240.26.49","TLSv1.2","207","Application Data"
"1037","23.948477","192.168.2.103","157.240.26.49","TLSv1.2","210","Application Data"
"1038","23.948480","192.168.2.103","157.240.26.49","TLSv1.2","196","Application Data"
"1039","23.948483","192.168.2.103","157.240.26.49","TLSv1.2","197","Application Data"
"1046","23.950291","192.168.2.103","157.240.26.49","TCP","154","1554  >  443 [ACK] Seq=346 Ack=3700 Win=65536 Len=0"
"1047","23.950294","192.168.2.103","157.240.26.49","TCP","207","[TCP Retransmission] 1554  >  443 [PSH, ACK] Seq=346 Ack=3700 Win=65536 Len=53"
"1048","23.950296","192.168.2.103","157.240.26.49","TCP","210","[TCP Retransmission] 1554  >  443 [PSH, ACK] Seq=399 Ack=3700 Win=65536 Len=56"
"1049","23.950299","192.168.2.103","157.240.26.49","TCP","197","[TCP Retransmission] 1554  >  443 [PSH, ACK] Seq=497 Ack=3700 Win=65536 Len=43"
"1053","23.951678","192.168.2.103","157.240.26.49","TCP","1394","1554  >  443 [ACK] Seq=540 Ack=3700 Win=65536 Len=1240 [TCP PDU reassembled in 1065]"
"1057","23.951689","192.168.2.103","157.240.26.49","TLSv1.2","192","[TCP Previous segment not captured] , Application Data"
"1061","23.952898","192.168.2.103","157.240.26.49","TCP","1394","[TCP Out-Of-Order] 1554  >  443 [ACK] Seq=1780 Ack=3700 Win=65536 Len=1240 [TCP PDU reassembled in 1065]"
"1062","23.952903","192.168.2.103","157.240.26.49","TCP","1394","[TCP Out-Of-Order] 1554  >  443 [ACK] Seq=3020 Ack=3700 Win=65536 Len=1240 [TCP PDU reassembled in 1065]"
"1063","23.952907","192.168.2.103","157.240.26.49","TCP","1394","[TCP Out-Of-Order] 1554  >  443 [ACK] Seq=4260 Ack=3700 Win=65536 Len=1240 [TCP PDU reassembled in 1065]"
"1064","23.952911","192.168.2.103","157.240.26.49","TCP","1394","[TCP Out-Of-Order] 1554  >  443 [ACK] Seq=5500 Ack=3700 Win=65536 Len=1240 [TCP PDU reassembled in 1065]"
"1065","23.952915","192.168.2.103","157.240.26.49","TCP","1221","[TCP Out-Of-Order] 1554  >  443 [PSH, ACK] Seq=6740 Ack=3700 Win=65536 Len=1067"
"1067","23.958400","157.240.26.49","192.168.2.103","TLSv1.2","184","[TCP Previous segment not captured] , Application Data"
"1069","23.960789","157.240.26.49","192.168.2.103","TCP","146","443  >  1554 [ACK] Seq=3738 Ack=3020 Win=71680 Len=0"
"1071","23.961250","157.240.26.49","192.168.2.103","TCP","146","443  >  1554 [ACK] Seq=3738 Ack=5500 Win=76544 Len=0"
"1073","23.961727","157.240.26.49","192.168.2.103","TCP","154","443  >  1554 [ACK] Seq=3738 Ack=7807 Win=81664 Len=0"
"1074","23.961730","157.240.26.49","192.168.2.103","TLSv1.2","196","Application Data"
"1078","23.962356","192.168.2.103","157.240.26.49","TCP","146","1554  >  443 [ACK] Seq=7845 Ack=3780 Win=65280 Len=0"
"1081","24.004338","157.240.26.49","192.168.2.103","TCP","1386","443  >  1554 [ACK] Seq=3780 Ack=7845 Win=81664 Len=1240 [TCP PDU reassembled in 1084]"
"1083","24.004909","157.240.26.49","192.168.2.103","TCP","1394","443  >  1554 [PSH, ACK] Seq=5020 Ack=7845 Win=81664 Len=1240 [TCP PDU reassembled in 1084]"
"1084","24.004915","157.240.26.49","192.168.2.103","TLSv1.2","601","Application Data"
"1085","24.004918","157.240.26.49","192.168.2.103","TLSv1.2","338","Application Data"
"1089","24.005369","192.168.2.103","157.240.26.49","TCP","146","1554  >  443 [ACK] Seq=7845 Ack=6891 Win=65536 Len=0"
"1093","24.006692","192.168.2.103","157.240.26.49","TLSv1.2","196","Application Data"
"1094","24.006712","192.168.2.103","157.240.26.49","TCP","1394","1554  >  443 [ACK] Seq=7887 Ack=6891 Win=65536 Len=1240 [TCP PDU reassembled in 1099]"
"1095","24.006719","192.168.2.103","157.240.26.49","TCP","1394","1554  >  443 [ACK] Seq=9127 Ack=6891 Win=65536 Len=1240 [TCP PDU reassembled in 1099]"
"1096","24.006724","192.168.2.103","157.240.26.49","TCP","1394","1554  >  443 [ACK] Seq=10367 Ack=6891 Win=65536 Len=1240 [TCP PDU reassembled in 1099]"
"1097","24.006732","192.168.2.103","157.240.26.49","TCP","1394","1554  >  443 [ACK] Seq=11607 Ack=6891 Win=65536 Len=1240 [TCP PDU reassembled in 1099]"
"1098","24.006734","192.168.2.103","157.240.26.49","TCP","1394","1554  >  443 [ACK] Seq=12847 Ack=6891 Win=65536 Len=1240 [TCP PDU reassembled in 1099]"
"1099","24.006739","192.168.2.103","157.240.26.49","TLSv1.2","1196","Application Data"
"1101","24.029015","157.240.26.49","192.168.2.103","TCP","146","443  >  1554 [ACK] Seq=6891 Ack=9127 Win=83968 Len=0"
"1103","24.029036","157.240.26.49","192.168.2.103","TCP","146","443  >  1554 [ACK] Seq=6891 Ack=11607 Win=89088 Len=0"
"1105","24.029277","157.240.26.49","192.168.2.103","TCP","154","443  >  1554 [ACK] Seq=6891 Ack=14087 Win=93952 Len=0"
"1106","24.029282","157.240.26.49","192.168.2.103","TLSv1.2","196","Application Data"
"1108","24.057858","157.240.26.49","192.168.2.103","TCP","1386","443  >  1554 [ACK] Seq=6933 Ack=15129 Win=96512 Len=1240 [TCP PDU reassembled in 1111]"
"1110","24.058354","157.240.26.49","192.168.2.103","TCP","1394","443  >  1554 [PSH, ACK] Seq=8173 Ack=15129 Win=96512 Len=1240 [TCP PDU reassembled in 1111]"
"1111","24.058361","157.240.26.49","192.168.2.103","TLSv1.2","330","Application Data"
"1112","24.058364","157.240.26.49","192.168.2.103","TLSv1.2","338","Application Data"
"1116","24.058622","192.168.2.103","157.240.26.49","TCP","146","1554  >  443 [ACK] Seq=15129 Ack=8173 Win=65536 Len=0"
"1120","24.058978","192.168.2.103","157.240.26.49","TCP","154","1554  >  443 [ACK] Seq=15129 Ack=9773 Win=65536 Len=0"
"1121","24.058982","192.168.2.103","157.240.26.49","TLSv1.2","196","Application Data"
"1125","24.060395","192.168.2.103","157.240.26.49","TCP","1394","1554  >  443 [ACK] Seq=15171 Ack=9773 Win=65536 Len=1240 [TCP PDU reassembled in 1130]"
"1126","24.060401","192.168.2.103","157.240.26.49","TCP","1394","1554  >  443 [ACK] Seq=16411 Ack=9773 Win=65536 Len=1240 [TCP PDU reassembled in 1130]"
"1127","24.060404","192.168.2.103","157.240.26.49","TCP","1394","1554  >  443 [ACK] Seq=17651 Ack=9773 Win=65536 Len=1240 [TCP PDU reassembled in 1130]"
"1128","24.060410","192.168.2.103","157.240.26.49","TCP","1394","1554  >  443 [ACK] Seq=18891 Ack=9773 Win=65536 Len=1240 [TCP PDU reassembled in 1130]"
"1129","24.060413","192.168.2.103","157.240.26.49","TCP","1394","1554  >  443 [ACK] Seq=20131 Ack=9773 Win=65536 Len=1240 [TCP PDU reassembled in 1130]"
"1130","24.060416","192.168.2.103","157.240.26.49","TLSv1.2","1193","Application Data"
"1134","24.061005","192.168.2.103","157.240.26.49","TCP","1386","[TCP Retransmission] 1554  >  443 [ACK] Seq=20131 Ack=9773 Win=65536 Len=1240 [TCP PDU reassembled in 1130]"
"1136","24.068683","157.240.26.49","192.168.2.103","TCP","146","443  >  1554 [ACK] Seq=9773 Ack=16411 Win=99072 Len=0"
"1138","24.068890","157.240.26.49","192.168.2.103","TCP","146","443  >  1554 [ACK] Seq=9773 Ack=18891 Win=103936 Len=0"
"1140","24.069590","157.240.26.49","192.168.2.103","TCP","146","443  >  1554 [ACK] Seq=9773 Ack=21371 Win=108800 Len=0"
"1142","24.069713","157.240.26.49","192.168.2.103","TLSv1.2","188","Application Data"
"1144","24.106264","157.240.26.49","192.168.2.103","TCP","1386","443  >  1554 [ACK] Seq=9815 Ack=22410 Win=111360 Len=1240 [TCP PDU reassembled in 1148]"
"1146","24.107053","157.240.26.49","192.168.2.103","TCP","1386","443  >  1554 [PSH, ACK] Seq=11055 Ack=22410 Win=111360 Len=1240 [TCP PDU reassembled in 1148]"
"1148","24.107846","157.240.26.49","192.168.2.103","TLSv1.2","563","Application Data"
"1149","24.107853","157.240.26.49","192.168.2.103","TLSv1.2","338","Application Data"
"1153","24.107881","192.168.2.103","157.240.26.49","TCP","146","1554  >  443 [ACK] Seq=22410 Ack=12295 Win=65536 Len=0"
"1159","24.110551","192.168.2.103","157.240.26.49","TCP","154","1554  >  443 [ACK] Seq=22410 Ack=12888 Win=65024 Len=0"
"1160","24.110555","192.168.2.103","157.240.26.49","TLSv1.2","196","Application Data"
"1161","24.111638","192.168.2.103","157.240.26.49","TCP","1394","1554  >  443 [ACK] Seq=22452 Ack=12888 Win=65024 Len=1240 [TCP PDU reassembled in 1166]"
"1162","24.111649","192.168.2.103","157.240.26.49","TCP","1394","1554  >  443 [ACK] Seq=23692 Ack=12888 Win=65024 Len=1240 [TCP PDU reassembled in 1166]"
"1163","24.111652","192.168.2.103","157.240.26.49","TCP","1394","1554  >  443 [ACK] Seq=24932 Ack=12888 Win=65024 Len=1240 [TCP PDU reassembled in 1166]"
"1164","24.111655","192.168.2.103","157.240.26.49","TCP","1394","1554  >  443 [ACK] Seq=26172 Ack=12888 Win=65024 Len=1240 [TCP PDU reassembled in 1166]"
"1165","24.111658","192.168.2.103","157.240.26.49","TCP","1394","1554  >  443 [ACK] Seq=27412 Ack=12888 Win=65024 Len=1240 [TCP PDU reassembled in 1166]"
"1166","24.111661","192.168.2.103","157.240.26.49","TLSv1.2","1193","Application Data"
"1169","24.120043","157.240.26.49","192.168.2.103","TCP","146","443  >  1554 [ACK] Seq=12888 Ack=23692 Win=113920 Len=0"
"1171","24.120397","157.240.26.49","192.168.2.103","TCP","146","443  >  1554 [ACK] Seq=12888 Ack=26172 Win=118784 Len=0"
"1173","24.120934","157.240.26.49","192.168.2.103","TCP","154","443  >  1554 [ACK] Seq=12888 Ack=28652 Win=123648 Len=0"
"1174","24.120942","157.240.26.49","192.168.2.103","TLSv1.2","196","Application Data"
"1177","24.156905","157.240.26.49","192.168.2.103","TCP","1386","443  >  1554 [ACK] Seq=12930 Ack=29691 Win=126208 Len=1240 [TCP PDU reassembled in 1181]"
"1179","24.157296","157.240.26.49","192.168.2.103","TCP","1386","443  >  1554 [PSH, ACK] Seq=14170 Ack=29691 Win=126208 Len=1240 [TCP PDU reassembled in 1181]"
"1181","24.157853","157.240.26.49","192.168.2.103","TLSv1.2","325","Application Data"
"1182","24.157865","157.240.26.49","192.168.2.103","TLSv1.2","338","Application Data"
"1186","24.160121","192.168.2.103","157.240.26.49","TCP","146","1554  >  443 [ACK] Seq=29691 Ack=15765 Win=65536 Len=0"
"1190","24.160358","192.168.2.103","157.240.26.49","TLSv1.2","196","Application Data"
"1191","24.161498","192.168.2.103","157.240.26.49","TCP","1394","1554  >  443 [ACK] Seq=29733 Ack=15765 Win=65536 Len=1240 [TCP PDU reassembled in 1196]"
"1192","24.161505","192.168.2.103","157.240.26.49","TCP","1394","1554  >  443 [ACK] Seq=30973 Ack=15765 Win=65536 Len=1240 [TCP PDU reassembled in 1196]"
"1193","24.161508","192.168.2.103","157.240.26.49","TCP","1394","1554  >  443 [ACK] Seq=32213 Ack=15765 Win=65536 Len=1240 [TCP PDU reassembled in 1196]"
"1194","24.161512","192.168.2.103","157.240.26.49","TCP","1394","1554  >  443 [ACK] Seq=33453 Ack=15765 Win=65536 Len=1240 [TCP PDU reassembled in 1196]"
"1195","24.161515","192.168.2.103","157.240.26.49","TCP","1394","1554  >  443 [ACK] Seq=34693 Ack=15765 Win=65536 Len=1240 [TCP PDU reassembled in 1196]"
"1196","24.161521","192.168.2.103","157.240.26.49","TLSv1.2","1193","Application Data"
"1198","24.169622","157.240.26.49","192.168.2.103","TCP","146","443  >  1554 [ACK] Seq=15765 Ack=30973 Win=128768 Len=0"
"1200","24.170216","157.240.26.49","192.168.2.103","TCP","154","443  >  1554 [ACK] Seq=15765 Ack=33453 Win=133632 Len=0"
"1201","24.170225","157.240.26.49","192.168.2.103","TCP","154","443  >  1554 [ACK] Seq=15765 Ack=35933 Win=138752 Len=0"
"1203","24.170545","157.240.26.49","192.168.2.103","TLSv1.2","188","Application Data"
"1204","24.170861","157.240.26.49","192.168.2.103","TCP","188","[TCP Retransmission] 443  >  1554 [PSH, ACK] Seq=15765 Ack=36972 Win=141056 Len=42"
