"No.","Time","Source","Destination","Protocol","Length","Info"
"589","22.110969","192.168.2.103","157.240.26.49","TCP","193","[TCP Retransmission] 1346  >  443 [PSH, ACK] Seq=1 Ack=1 Win=251 Len=47"
"638","22.256127","192.168.2.103","157.240.26.49","TCP","498","[TCP Retransmission] 1551  >  443 [PSH, ACK] Seq=669 Ack=213 Win=65280 Len=352"
"669","22.275116","192.168.2.103","157.240.26.49","TCP","899","[TCP Retransmission] 1552  >  443 [PSH, ACK] Seq=1 Ack=1 Win=65536 Len=745"
"673","22.275942","192.168.2.103","157.240.26.49","TCP","899","[TCP Retransmission] 1552  >  443 [PSH, ACK] Seq=1 Ack=1 Win=65536 Len=745"
"687","22.295042","192.168.2.103","157.240.26.49","TCP","218","[TCP Retransmission] 1552  >  443 [PSH, ACK] Seq=746 Ack=758 Win=64768 Len=64"
"688","22.295046","192.168.2.103","157.240.26.49","TCP","246","[TCP Retransmission] 1552  >  443 [PSH, ACK] Seq=810 Ack=758 Win=64768 Len=92"
"694","22.295936","192.168.2.103","157.240.26.49","TCP","218","[TCP Retransmission] 1552  >  443 [PSH, ACK] Seq=746 Ack=758 Win=64768 Len=64"
"695","22.295940","192.168.2.103","157.240.26.49","TCP","246","[TCP Retransmission] 1552  >  443 [PSH, ACK] Seq=810 Ack=758 Win=64768 Len=92"
"696","22.295945","192.168.2.103","157.240.26.49","TCP","544","[TCP Retransmission] 1552  >  443 [PSH, ACK] Seq=902 Ack=758 Win=64768 Len=390"
"697","22.295948","192.168.2.103","157.240.26.49","TCP","526","[TCP Retransmission] 1552  >  443 [PSH, ACK] Seq=1292 Ack=758 Win=64768 Len=372"
"701","22.296385","192.168.2.103","157.240.26.49","TCP","536","[TCP Retransmission] 1552  >  443 [PSH, ACK] Seq=902 Ack=758 Win=64768 Len=390"
"717","22.305465","192.168.2.103","157.240.26.49","TCP","185","[TCP Retransmission] 1552  >  443 [PSH, ACK] Seq=1664 Ack=1032 Win=64512 Len=31"
"742","22.369695","192.168.2.103","157.240.26.49","TCP","217","[TCP Retransmission] 1346  >  443 [FIN, PSH, ACK] Seq=1 Ack=1 Win=251 Len=71"
"769","22.679007","192.168.2.103","157.240.26.49","TCP","217","[TCP Retransmission] 1346  >  443 [FIN, PSH, ACK] Seq=1 Ack=1 Win=251 Len=71"
"779","23.287938","192.168.2.103","157.240.26.49","TCP","217","[TCP Retransmission] 1346  >  443 [FIN, PSH, ACK] Seq=1 Ack=1 Win=251 Len=71"
"896","23.896991","23.192.220.16","192.168.2.103","TCP","1394","[TCP Retransmission] 443  >  1553 [ACK] Seq=20744 Ack=1127 Win=64128 Len=1240 [TCP PDU reassembled in 945]"
"997","23.918318","23.192.220.16","192.168.2.103","TCP","1394","[TCP Retransmission] 443  >  1553 [PSH, ACK] Seq=69104 Ack=1158 Win=64128 Len=1240"
"1047","23.950294","192.168.2.103","157.240.26.49","TCP","207","[TCP Retransmission] 1554  >  443 [PSH, ACK] Seq=346 Ack=3700 Win=65536 Len=53"
"1048","23.950296","192.168.2.103","157.240.26.49","TCP","210","[TCP Retransmission] 1554  >  443 [PSH, ACK] Seq=399 Ack=3700 Win=65536 Len=56"
"1049","23.950299","192.168.2.103","157.240.26.49","TCP","197","[TCP Retransmission] 1554  >  443 [PSH, ACK] Seq=497 Ack=3700 Win=65536 Len=43"
"1134","24.061005","192.168.2.103","157.240.26.49","TCP","1386","[TCP Retransmission] 1554  >  443 [ACK] Seq=20131 Ack=9773 Win=65536 Len=1240 [TCP PDU reassembled in 1130]"
"1233","24.211297","192.168.2.103","157.240.26.49","TCP","1386","[TCP Retransmission] 1554  >  443 [ACK] Seq=37014 Ack=18886 Win=65536 Len=1240"
"1256","24.495638","192.168.2.103","157.240.26.49","TCP","217","[TCP Retransmission] 1346  >  443 [FIN, PSH, ACK] Seq=1 Ack=1 Win=251 Len=71"
"1273","24.508664","192.168.2.103","157.240.26.49","TCP","1386","[TCP Retransmission] 1554  >  443 [ACK] Seq=49255 Ack=21760 Win=65536 Len=1240 [TCP PDU reassembled in 1269]"
"1355","24.871941","192.168.2.103","157.240.26.49","TCP","864","[TCP Retransmission] 1557  >  443 [PSH, ACK] Seq=1198 Ack=3937 Win=65280 Len=718"
"1618","26.138267","157.240.26.49","192.168.2.103","TCP","1394","[TCP Retransmission] 443  >  1557 [PSH, ACK] Seq=89230 Ack=3976 Win=77056 Len=1240 [TCP PDU reassembled in 1648]"
"1619","26.138271","157.240.26.49","192.168.2.103","TCP","1394","[TCP Retransmission] 443  >  1557 [ACK] Seq=90470 Ack=3976 Win=77056 Len=1240 [TCP PDU reassembled in 1648]"
"1622","26.138284","157.240.26.49","192.168.2.103","TCP","1394","[TCP Retransmission] 443  >  1557 [ACK] Seq=94190 Ack=3976 Win=77056 Len=1240 [TCP PDU reassembled in 1648]"
"1623","26.138290","157.240.26.49","192.168.2.103","TCP","1394","[TCP Retransmission] 443  >  1557 [PSH, ACK] Seq=95430 Ack=3976 Win=77056 Len=1240 [TCP PDU reassembled in 1648]"
"1624","26.138294","157.240.26.49","192.168.2.103","TCP","1394","[TCP Retransmission] 443  >  1557 [ACK] Seq=96670 Ack=3976 Win=77056 Len=1240 [TCP PDU reassembled in 1648]"
"1625","26.138298","157.240.26.49","192.168.2.103","TCP","1394","[TCP Retransmission] 443  >  1557 [ACK] Seq=97910 Ack=3976 Win=77056 Len=1240 [TCP PDU reassembled in 1648]"
"1682","26.563539","157.240.26.49","192.168.2.103","TCP","1394","[TCP Retransmission] 443  >  1557 [ACK] Seq=106381 Ack=3976 Win=77056 Len=1240 [TCP PDU reassembled in 1677]"
"1810","26.593840","157.240.26.49","192.168.2.103","TCP","1386","[TCP Retransmission] 443  >  1557 [ACK] Seq=196186 Ack=3976 Win=77056 Len=1240 [TCP PDU reassembled in 1807]"
"1831","26.896466","192.168.2.103","157.240.26.49","TCP","217","[TCP Retransmission] 1346  >  443 [FIN, PSH, ACK] Seq=1 Ack=1 Win=251 Len=71"
"2030","31.710094","192.168.2.103","157.240.26.49","TCP","217","[TCP Retransmission] 1346  >  443 [FIN, PSH, ACK] Seq=1 Ack=1 Win=251 Len=71"
"2033","31.710108","192.168.2.103","157.240.26.49","TCP","217","[TCP Retransmission] 1346  >  443 [FIN, PSH, ACK] Seq=1 Ack=1 Win=251 Len=71"
"2036","31.710617","192.168.2.103","157.240.26.49","TCP","217","[TCP Retransmission] 1346  >  443 [FIN, PSH, ACK] Seq=1 Ack=1 Win=251 Len=71"
"2133","32.583131","192.168.2.103","34.36.199.114","TCP","166","[TCP Retransmission] 1568  >  443 [SYN] Seq=0 Win=64240 Len=0 MSS=1460 WS=256 SACK_PERM"
"2134","32.583135","192.168.2.103","34.36.199.114","TCP","166","[TCP Retransmission] 1569  >  443 [SYN] Seq=0 Win=64240 Len=0 MSS=1460 WS=256 SACK_PERM"
"2135","32.583139","192.168.2.103","34.36.199.114","TCP","166","[TCP Retransmission] 1570  >  443 [SYN] Seq=0 Win=64240 Len=0 MSS=1460 WS=256 SACK_PERM"
"2136","32.583143","192.168.2.103","34.36.199.114","TCP","166","[TCP Retransmission] 1571  >  443 [SYN] Seq=0 Win=64240 Len=0 MSS=1460 WS=256 SACK_PERM"
"2140","32.583882","192.168.2.103","34.36.199.114","TCP","166","[TCP Retransmission] 1568  >  443 [SYN] Seq=0 Win=64240 Len=0 MSS=1460 WS=256 SACK_PERM"
"2141","32.583886","192.168.2.103","34.36.199.114","TCP","166","[TCP Retransmission] 1569  >  443 [SYN] Seq=0 Win=64240 Len=0 MSS=1460 WS=256 SACK_PERM"
"2142","32.583891","192.168.2.103","34.36.199.114","TCP","166","[TCP Retransmission] 1570  >  443 [SYN] Seq=0 Win=64240 Len=0 MSS=1460 WS=256 SACK_PERM"
"2143","32.583895","192.168.2.103","34.36.199.114","TCP","166","[TCP Retransmission] 1571  >  443 [SYN] Seq=0 Win=64240 Len=0 MSS=1460 WS=256 SACK_PERM"
"2144","32.583899","192.168.2.103","34.36.199.114","TCP","166","[TCP Retransmission] 1572  >  443 [SYN] Seq=0 Win=64240 Len=0 MSS=1460 WS=256 SACK_PERM"
"2203","32.612155","192.168.2.103","34.36.199.114","TCP","828","[TCP Retransmission] 1569  >  443 [PSH, ACK] Seq=1 Ack=1 Win=66304 Len=674"
"2255","32.633982","192.168.2.103","34.36.199.114","TCP","511","[TCP Retransmission] 1569  >  443 [PSH, ACK] Seq=675 Ack=220 Win=66048 Len=365"
"2314","32.660007","34.36.199.114","192.168.2.103","TCP","899","[TCP Retransmission] 443  >  1569 [PSH, ACK] Seq=220 Ack=1040 Win=268800 Len=745"
"2387","32.704904","192.168.2.103","34.36.199.114","TCP","460","[TCP Retransmission] 1570  >  443 [PSH, ACK] Seq=1333 Ack=1166 Win=65024 Len=306"
"2388","32.704907","192.168.2.103","34.36.199.114","TCP","454","[TCP Retransmission] 1568  >  443 [PSH, ACK] Seq=1331 Ack=1166 Win=65024 Len=300"
"2988","34.279918","192.168.2.103","157.240.26.35","TCP","272","[TCP Retransmission] 1575  >  443 [PSH, ACK] Seq=342 Ack=3175 Win=66816 Len=126"
"3059","34.375262","157.240.26.35","192.168.2.103","TCP","1394","[TCP Retransmission] 443  >  1577 [ACK] Seq=11907 Ack=601 Win=67840 Len=1240 [TCP PDU reassembled in 3047]"
"3060","34.375265","157.240.26.35","192.168.2.103","TCP","1091","[TCP Retransmission] 443  >  1577 [PSH, ACK] Seq=13147 Ack=601 Win=67840 Len=937 [TCP PDU reassembled in 3048]"
"3061","34.375269","157.240.26.35","192.168.2.103","TCP","1394","[TCP Retransmission] 443  >  1576 [ACK] Seq=3226 Ack=601 Win=67840 Len=1240"
"3062","34.375273","157.240.26.35","192.168.2.103","TCP","1394","[TCP Retransmission] 443  >  1576 [ACK] Seq=4466 Ack=601 Win=67840 Len=1240 [TCP PDU reassembled in 3050]"
"3063","34.375276","157.240.26.35","192.168.2.103","TCP","1394","[TCP Retransmission] 443  >  1576 [ACK] Seq=5706 Ack=601 Win=67840 Len=1240 [TCP PDU reassembled in 3051]"
"3064","34.375280","157.240.26.35","192.168.2.103","TCP","1394","[TCP Retransmission] 443  >  1576 [PSH, ACK] Seq=6946 Ack=601 Win=67840 Len=1240 [TCP PDU reassembled in 3052]"
"3253","36.214013","20.189.173.16","192.168.2.103","TCP","1386","[TCP Retransmission] 443  >  1578 [ACK] Seq=5060 Ack=846 Win=4194048 Len=1240 [TCP PDU reassembled in 3249]"
"3357","37.430045","192.168.2.103","157.240.26.49","TCP","217","[TCP Retransmission] 1418  >  443 [FIN, PSH, ACK] Seq=1 Ack=1 Win=253 Len=71"
"3364","37.739022","192.168.2.103","157.240.26.49","TCP","217","[TCP Retransmission] 1418  >  443 [FIN, PSH, ACK] Seq=1 Ack=1 Win=253 Len=71"
"3380","38.351805","192.168.2.103","157.240.26.49","TCP","217","[TCP Retransmission] 1418  >  443 [FIN, PSH, ACK] Seq=1 Ack=1 Win=253 Len=71"
"3448","39.118168","192.168.2.103","142.251.32.10","TCP","1386","[TCP Retransmission] 1584  >  443 [ACK] Seq=429 Ack=4692 Win=66048 Len=1240"
"3456","39.126529","192.168.2.103","142.251.32.10","TCP","839","[TCP Retransmission] 1584  >  443 [PSH, ACK] Seq=1669 Ack=4692 Win=66048 Len=693 [TCP PDU reassembled in 3442]"
"3462","39.555709","192.168.2.103","157.240.26.49","TCP","217","[TCP Retransmission] 1418  >  443 [FIN, PSH, ACK] Seq=1 Ack=1 Win=253 Len=71"
"3510","41.960206","192.168.2.103","157.240.26.49","TCP","217","[TCP Retransmission] 1418  >  443 [FIN, PSH, ACK] Seq=1 Ack=1 Win=253 Len=71"
"3684","46.761806","192.168.2.103","157.240.26.49","TCP","217","[TCP Retransmission] 1418  >  443 [FIN, PSH, ACK] Seq=1 Ack=1 Win=253 Len=71"
"3870","53.479850","192.168.2.103","20.190.157.1","TCP","1386","[TCP Retransmission] 1587  >  443 [ACK] Seq=732 Ack=4007 Win=66048 Len=1240"
"3874","53.497909","192.168.2.103","20.190.157.1","TCP","1394","[TCP Retransmission] 1587  >  443 [ACK] Seq=732 Ack=4007 Win=66048 Len=1240"
"3875","53.498381","192.168.2.103","20.190.157.1","TCP","1394","[TCP Retransmission] 1587  >  443 [ACK] Seq=1972 Ack=4007 Win=66048 Len=1240 [TCP PDU reassembled in 3859]"
"3876","53.498390","192.168.2.103","20.190.157.1","TCP","1085","[TCP Retransmission] 1587  >  443 [ACK] Seq=3212 Ack=4007 Win=66048 Len=931 [TCP PDU reassembled in 3859]"
"3882","53.526747","192.168.2.103","20.190.157.1","TCP","1394","[TCP Retransmission] 1587  >  443 [ACK] Seq=4143 Ack=4007 Win=66048 Len=1240 [TCP PDU reassembled in 3859]"
"3886","53.527248","192.168.2.103","20.190.157.1","TCP","1394","[TCP Retransmission] 1587  >  443 [ACK] Seq=4143 Ack=4007 Win=66048 Len=1240 [TCP PDU reassembled in 3859]"
"3890","53.528351","192.168.2.103","20.190.157.1","TCP","1394","[TCP Retransmission] 1587  >  443 [ACK] Seq=4143 Ack=4007 Win=66048 Len=1240 [TCP PDU reassembled in 3859]"
"3891","53.528359","192.168.2.103","20.190.157.1","TCP","1263","[TCP Retransmission] 1587  >  443 [ACK] Seq=5383 Ack=4007 Win=66048 Len=1109 [TCP PDU reassembled in 3859]"
"3897","53.542839","192.168.2.103","20.190.157.1","TCP","1386","[TCP Retransmission] 1587  >  443 [ACK] Seq=3212 Ack=4007 Win=66048 Len=1240 [TCP PDU reassembled in 3859]"
"3903","53.543443","192.168.2.103","20.190.157.1","TCP","1386","[TCP Retransmission] 1587  >  443 [ACK] Seq=4452 Ack=4007 Win=66048 Len=1240 [TCP PDU reassembled in 3859]"
"3909","53.571094","192.168.2.103","20.190.157.1","TCP","954","[TCP Retransmission] 1587  >  443 [ACK] Seq=5692 Ack=4007 Win=66048 Len=800 [TCP PDU reassembled in 3859]"
"3910","53.571099","192.168.2.103","20.190.157.1","TCP","1394","[TCP Retransmission] 1587  >  443 [ACK] Seq=5692 Ack=4007 Win=66048 Len=1240 [TCP PDU reassembled in 3859]"
"4073","54.353506","192.168.2.103","23.96.180.189","TCP","1386","[TCP Retransmission] 1588  >  443 [ACK] Seq=1791 Ack=6391 Win=262144 Len=1240 [TCP PDU reassembled in 4052]"
"4108","54.379202","192.168.2.103","142.251.32.10","TCP","160","[TCP Retransmission] 1589  >  443 [PSH, ACK] Seq=386 Ack=4405 Win=65536 Len=6"
"4109","54.379206","192.168.2.103","142.251.32.10","TCP","191","[TCP Retransmission] 1589  >  443 [PSH, ACK] Seq=392 Ack=4405 Win=65536 Len=37"
"4854","54.927373","142.251.32.10","192.168.2.103","TCP","1394","[TCP Retransmission] 443  >  1589 [ACK] Seq=312805 Ack=1003 Win=269056 Len=1240"
"4987","54.955316","192.168.2.103","23.47.72.8","TCP","234","[TCP Retransmission] 1594  >  443 [PSH, ACK] Seq=373 Ack=4048 Win=262144 Len=80"
"4988","54.955319","192.168.2.103","23.47.72.8","TCP","519","[TCP Retransmission] 1594  >  443 [PSH, ACK] Seq=453 Ack=4048 Win=262144 Len=365"
"5027","54.964570","192.168.2.103","23.47.72.8","TCP","234","[TCP Retransmission] 1594  >  443 [PSH, ACK] Seq=373 Ack=4048 Win=262144 Len=80"
"5028","54.964780","192.168.2.103","23.47.72.8","TCP","519","[TCP Retransmission] 1594  >  443 [PSH, ACK] Seq=453 Ack=4048 Win=262144 Len=365"
"5302","55.029054","142.251.32.10","192.168.2.103","TCP","1394","[TCP Retransmission] 443  >  1589 [ACK] Seq=562045 Ack=1003 Win=269056 Len=1240"
"5481","55.071362","142.251.32.10","192.168.2.103","TCP","1394","[TCP Retransmission] 443  >  1589 [ACK] Seq=658765 Ack=1003 Win=269056 Len=1240"
"5495","55.075330","142.251.32.10","192.168.2.103","TCP","1394","[TCP Retransmission] 443  >  1589 [PSH, ACK] Seq=669925 Ack=1003 Win=269056 Len=1240"
"6314","55.275573","142.251.32.10","192.168.2.103","TCP","1394","[TCP Retransmission] 443  >  1589 [ACK] Seq=1142365 Ack=1003 Win=269056 Len=1240"
"6402","55.295142","142.251.32.10","192.168.2.103","TCP","1394","[TCP Retransmission] 443  >  1589 [ACK] Seq=1201885 Ack=1003 Win=269056 Len=1240"
"6472","55.312928","192.168.2.103","142.251.32.10","TCP","1386","[TCP Retransmission] 1584  >  443 [PSH, ACK] Seq=10787 Ack=7834 Win=65536 Len=1240 [TCP PDU reassembled in 6382]"
"6662","55.365324","142.251.32.10","192.168.2.103","TCP","1394","[TCP Retransmission] 443  >  1589 [PSH, ACK] Seq=1356885 Ack=1003 Win=269056 Len=1240 [TCP PDU reassembled in 6734]"
"6848","55.403694","142.251.32.10","192.168.2.103","TCP","1394","[TCP Retransmission] 443  >  1589 [PSH, ACK] Seq=1446165 Ack=1003 Win=269056 Len=1240"
"6890","55.410825","142.251.32.10","192.168.2.103","TCP","1394","[TCP Retransmission] 443  >  1589 [ACK] Seq=1474685 Ack=1003 Win=269056 Len=1240"
"7029","55.695586","192.168.2.103","20.189.173.10","TCP","1394","[TCP Retransmission] 1595  >  443 [ACK] Seq=458 Ack=4394 Win=66048 Len=1240"
"7030","55.695595","192.168.2.103","20.189.173.10","TCP","354","[TCP Retransmission] 1595  >  443 [ACK] Seq=1698 Ack=4394 Win=66048 Len=200 [TCP PDU reassembled in 6993]"
"7031","55.696073","192.168.2.103","20.189.173.10","TCP","1394","[TCP Retransmission] 1595  >  443 [ACK] Seq=2003 Ack=4394 Win=66048 Len=1240"
"7032","55.696088","192.168.2.103","20.189.173.10","TCP","1014","[TCP Retransmission] 1595  >  443 [ACK] Seq=3243 Ack=4394 Win=66048 Len=860 [TCP PDU reassembled in 6997]"
"7037","55.746014","192.168.2.103","20.189.173.10","TCP","934","[TCP Retransmission] 1595  >  443 [ACK] Seq=4103 Ack=4394 Win=66048 Len=780 [TCP PDU reassembled in 6997]"
"7038","55.746026","192.168.2.103","20.189.173.10","TCP","1394","[TCP Retransmission] 1595  >  443 [PSH, ACK] Seq=1698 Ack=4394 Win=66048 Len=1240"
"7041","55.746649","192.168.2.103","20.189.173.10","TCP","934","[TCP Retransmission] 1595  >  443 [ACK] Seq=4103 Ack=4394 Win=66048 Len=780 [TCP PDU reassembled in 6997]"
"7042","55.746659","192.168.2.103","20.189.173.10","TCP","1394","[TCP Retransmission] 1595  >  443 [PSH, ACK] Seq=1698 Ack=4394 Win=66048 Len=1240"
"7050","55.772104","192.168.2.103","20.189.173.10","TCP","1386","[TCP Retransmission] 1595  >  443 [ACK] Seq=2938 Ack=4394 Win=66048 Len=1240 [TCP PDU reassembled in 6997]"
"7598","59.372518","192.168.2.103","52.168.117.170","TCP","1386","[TCP Retransmission] 1603  >  443 [ACK] Seq=1297 Ack=4785 Win=66048 Len=1240"
"7618","59.410511","192.168.2.103","52.168.117.170","TCP","1394","[TCP Retransmission] 1603  >  443 [ACK] Seq=2537 Ack=4785 Win=66048 Len=1240 [TCP PDU reassembled in 7592]"
"7619","59.410518","192.168.2.103","52.168.117.170","TCP","1394","[TCP Retransmission] 1603  >  443 [ACK] Seq=5017 Ack=4785 Win=66048 Len=1240 [TCP PDU reassembled in 7592]"
"7620","59.410521","192.168.2.103","52.168.117.170","TCP","954","[TCP Retransmission] 1603  >  443 [ACK] Seq=6257 Ack=4785 Win=66048 Len=800 [TCP PDU reassembled in 7592]"
"7626","59.415990","192.168.2.103","52.168.117.170","TCP","1386","[TCP Retransmission] 1603  >  443 [ACK] Seq=5017 Ack=4785 Win=66048 Len=1240 [TCP PDU reassembled in 7592]"
"7631","59.416608","192.168.2.103","52.168.117.170","TCP","1386","[TCP Retransmission] 1603  >  443 [ACK] Seq=5017 Ack=4785 Win=66048 Len=1240 [TCP PDU reassembled in 7592]"
"7635","59.417211","192.168.2.103","52.168.117.170","TCP","1386","[TCP Retransmission] 1603  >  443 [ACK] Seq=6257 Ack=4785 Win=66048 Len=1240 [TCP PDU reassembled in 7592]"
"8272","64.307005","142.251.32.10","192.168.2.103","TCP","1394","[TCP Retransmission] 443  >  1589 [ACK] Seq=1811725 Ack=1577 Win=268544 Len=1240"
"8273","64.307007","142.251.32.10","192.168.2.103","TCP","1394","[TCP Retransmission] 443  >  1589 [PSH, ACK] Seq=1812965 Ack=1577 Win=268544 Len=1240"
"8534","64.369614","142.251.32.10","192.168.2.103","TCP","1394","[TCP Retransmission] 443  >  1589 [ACK] Seq=1969205 Ack=1577 Win=268544 Len=1240"
"8535","64.369618","142.251.32.10","192.168.2.103","TCP","1394","[TCP Retransmission] 443  >  1589 [PSH, ACK] Seq=1970445 Ack=1577 Win=268544 Len=1240"
"8636","64.392734","142.251.32.10","192.168.2.103","TCP","1394","[TCP Retransmission] 443  >  1589 [ACK] Seq=2021285 Ack=1577 Win=268544 Len=1240"
"8810","64.434302","142.251.32.10","192.168.2.103","TCP","1394","[TCP Retransmission] 443  >  1589 [PSH, ACK] Seq=2114285 Ack=1577 Win=268544 Len=1240"
"8850","64.446991","142.251.32.10","192.168.2.103","TCP","1394","[TCP Retransmission] 443  >  1589 [PSH, ACK] Seq=2139085 Ack=1577 Win=268544 Len=1240"
"8977","64.480118","142.251.32.10","192.168.2.103","TCP","1386","[TCP Retransmission] 443  >  1589 [PSH, ACK] Seq=2191165 Ack=1577 Win=268544 Len=1240"
"9593","64.635245","142.251.32.10","192.168.2.103","TCP","1394","[TCP Retransmission] 443  >  1589 [PSH, ACK] Seq=2496205 Ack=1577 Win=268544 Len=1240 [TCP PDU reassembled in 9608]"
"9828","64.695680","142.251.32.10","192.168.2.103","TCP","1394","[TCP Retransmission] 443  >  1589 [PSH, ACK] Seq=2615245 Ack=1577 Win=268544 Len=1240"
"10411","64.819388","142.251.32.10","192.168.2.103","TCP","1394","[TCP Retransmission] 443  >  1589 [PSH, ACK] Seq=2982285 Ack=1577 Win=268544 Len=1240 [TCP PDU reassembled in 10433]"
"10760","72.148315","192.168.2.103","142.251.32.10","TCP","1394","[TCP Retransmission] 1584  >  443 [ACK] Seq=21692 Ack=11618 Win=65536 Len=1240"
"10761","72.148324","192.168.2.103","142.251.32.10","TCP","847","[TCP Retransmission] 1584  >  443 [PSH, ACK] Seq=22932 Ack=11618 Win=65536 Len=693 [TCP PDU reassembled in 10757]"
"11818","74.382419","142.251.32.10","192.168.2.103","TCP","1386","[TCP Retransmission] 443  >  1589 [ACK] Seq=3761430 Ack=2151 Win=268032 Len=1240 [TCP PDU reassembled in 11835]"
"12258","74.468005","142.251.32.10","192.168.2.103","TCP","1394","[TCP Retransmission] 443  >  1589 [ACK] Seq=4021830 Ack=2151 Win=268032 Len=1240 [TCP PDU reassembled in 12270]"
"12484","74.521668","142.251.32.10","192.168.2.103","TCP","1394","[TCP Retransmission] 443  >  1589 [ACK] Seq=4184270 Ack=2151 Win=268032 Len=1240 [TCP PDU reassembled in 12543]"
"12499","74.525397","142.251.32.10","192.168.2.103","TCP","1394","[TCP Retransmission] 443  >  1589 [PSH, ACK] Seq=4201630 Ack=2151 Win=268032 Len=1240 [TCP PDU reassembled in 12543]"
"13771","84.099181","142.251.32.10","192.168.2.103","TCP","1394","[TCP Retransmission] 443  >  1589 [PSH, ACK] Seq=4780369 Ack=2725 Win=267520 Len=1240"
"13985","84.142390","142.251.32.10","192.168.2.103","TCP","1394","[TCP Retransmission] 443  >  1589 [ACK] Seq=4976289 Ack=2725 Win=267520 Len=1240"
"14504","84.236842","142.251.32.10","192.168.2.103","TCP","1394","[TCP Retransmission] 443  >  1589 [PSH, ACK] Seq=5335889 Ack=2725 Win=267520 Len=1240"
"14505","84.236846","142.251.32.10","192.168.2.103","TCP","1394","[TCP Retransmission] 443  >  1589 [ACK] Seq=5337129 Ack=2725 Win=267520 Len=1240"
"14716","84.272755","142.251.32.10","192.168.2.103","TCP","1394","[TCP Retransmission] 443  >  1589 [ACK] Seq=5487169 Ack=2725 Win=267520 Len=1240"
"14984","84.325676","142.251.32.10","192.168.2.103","TCP","1394","[TCP Retransmission] 443  >  1589 [ACK] Seq=5650849 Ack=2725 Win=267520 Len=1240"
"15926","87.287064","157.240.26.49","192.168.2.103","TCP","185","[TCP Retransmission] 443  >  1551 [PSH, ACK] Seq=1158 Ack=1052 Win=67840 Len=39"
"16143","90.800556","192.168.2.103","142.251.32.10","TCP","1394","[TCP Retransmission] 1584  >  443 [ACK] Seq=35223 Ack=16012 Win=66304 Len=1240"
"16144","90.800745","192.168.2.103","142.251.32.10","TCP","846","[TCP Retransmission] 1584  >  443 [PSH, ACK] Seq=36463 Ack=16012 Win=66304 Len=692 [TCP PDU reassembled in 16140]"
"16278","93.786351","192.168.2.103","142.251.32.10","TCP","720","[TCP Retransmission] 1589  >  443 [PSH, ACK] Seq=2725 Ack=6187171 Win=262144 Len=574"
"16288","94.061368","192.168.2.103","34.107.172.168","TCP","146","[TCP Retransmission] 1408  >  443 [FIN, ACK] Seq=1 Ack=1 Win=256 Len=0"
"17014","94.317236","142.251.32.10","192.168.2.103","TCP","1394","[TCP Retransmission] 443  >  1589 [PSH, ACK] Seq=6743891 Ack=3299 Win=267008 Len=1240"
"17210","94.350614","142.251.32.10","192.168.2.103","TCP","1394","[TCP Retransmission] 443  >  1589 [ACK] Seq=6908811 Ack=3299 Win=267008 Len=1240"
"17212","94.350623","142.251.32.10","192.168.2.103","TCP","1394","[TCP Retransmission] 443  >  1589 [ACK] Seq=6911291 Ack=3299 Win=267008 Len=1240"
"17802","94.452745","142.251.32.10","192.168.2.103","TCP","1394","[TCP Retransmission] 443  >  1589 [ACK] Seq=7391171 Ack=3299 Win=267008 Len=1240"
"17803","94.452749","142.251.32.10","192.168.2.103","TCP","1394","[TCP Retransmission] 443  >  1589 [ACK] Seq=7392411 Ack=3299 Win=267008 Len=1240"
"18033","94.490926","142.251.32.10","192.168.2.103","TCP","1394","[TCP Retransmission] 443  >  1589 [PSH, ACK] Seq=7590811 Ack=3299 Win=267008 Len=1240"
"18167","94.662264","192.168.2.103","34.107.172.168","TCP","146","[TCP Retransmission] 1408  >  443 [FIN, ACK] Seq=1 Ack=1 Win=256 Len=0"
"18231","95.863256","192.168.2.103","34.107.172.168","TCP","146","[TCP Retransmission] 1408  >  443 [FIN, ACK] Seq=1 Ack=1 Win=256 Len=0"
"18302","98.269697","192.168.2.103","34.107.172.168","TCP","146","[TCP Retransmission] 1408  >  443 [FIN, ACK] Seq=1 Ack=1 Win=256 Len=0"
"18402","103.073419","192.168.2.103","34.107.172.168","TCP","146","[TCP Retransmission] 1408  >  443 [FIN, ACK] Seq=1 Ack=1 Win=256 Len=0"
"18505","104.368097","142.251.32.10","192.168.2.103","TCP","1394","[TCP Retransmission] 443  >  1584 [PSH, ACK] Seq=18535 Ack=43525 Win=233984 Len=1240"
"18682","104.406582","142.251.32.10","192.168.2.103","TCP","1394","[TCP Retransmission] 443  >  1584 [PSH, ACK] Seq=114015 Ack=43525 Win=233984 Len=1240"
"18684","104.406590","142.251.32.10","192.168.2.103","TCP","1394","[TCP Retransmission] 443  >  1584 [ACK] Seq=116495 Ack=43525 Win=233984 Len=1240"
"18685","104.406594","142.251.32.10","192.168.2.103","TCP","1394","[TCP Retransmission] 443  >  1584 [PSH, ACK] Seq=117735 Ack=43525 Win=233984 Len=1240"
"18689","104.406611","142.251.32.10","192.168.2.103","TCP","1394","[TCP Retransmission] 443  >  1584 [ACK] Seq=122695 Ack=43525 Win=233984 Len=1240"
"19379","104.548033","142.251.32.10","192.168.2.103","TCP","1394","[TCP Retransmission] 443  >  1584 [ACK] Seq=644047 Ack=43525 Win=233984 Len=1240"
"19449","104.560457","142.251.32.10","192.168.2.103","TCP","1394","[TCP Retransmission] 443  >  1584 [ACK] Seq=682487 Ack=43525 Win=233984 Len=1240 [TCP PDU reassembled in 19486]"
"19760","104.623818","142.251.32.10","192.168.2.103","TCP","1394","[TCP Retransmission] 443  >  1584 [ACK] Seq=882127 Ack=43525 Win=233984 Len=1240 [TCP PDU reassembled in 19828]"
"19761","104.623821","142.251.32.10","192.168.2.103","TCP","1394","[TCP Retransmission] 443  >  1584 [PSH, ACK] Seq=883367 Ack=43525 Win=233984 Len=1240 [TCP PDU reassembled in 19828]"
"19762","104.623825","142.251.32.10","192.168.2.103","TCP","1394","[TCP Retransmission] 443  >  1584 [PSH, ACK] Seq=885847 Ack=43525 Win=233984 Len=1240 [TCP PDU reassembled in 19828]"
"20228","104.723592","142.251.32.10","192.168.2.103","TCP","1394","[TCP Retransmission] 443  >  1584 [ACK] Seq=1205767 Ack=43525 Win=233984 Len=1240"
"20231","104.723605","142.251.32.10","192.168.2.103","TCP","1394","[TCP Retransmission] 443  >  1584 [ACK] Seq=1209487 Ack=43525 Win=233984 Len=1240 [TCP PDU reassembled in 20234]"
"20233","104.723614","142.251.32.10","192.168.2.103","TCP","1394","[TCP Retransmission] 443  >  1584 [PSH, ACK] Seq=1211967 Ack=43525 Win=233984 Len=1240 [TCP PDU reassembled in 20234]"
"20273","104.730859","142.251.32.10","192.168.2.103","TCP","1394","[TCP Retransmission] 443  >  1584 [ACK] Seq=1231807 Ack=43525 Win=233984 Len=1240"
"20275","104.730864","142.251.32.10","192.168.2.103","TCP","1394","[TCP Retransmission] 443  >  1584 [PSH, ACK] Seq=1234287 Ack=43525 Win=233984 Len=1240"
"20416","104.758141","142.251.32.10","192.168.2.103","TCP","1394","[TCP Retransmission] 443  >  1584 [PSH, ACK] Seq=1338447 Ack=43525 Win=233984 Len=1240"
"20584","104.791863","142.251.32.10","192.168.2.103","TCP","1394","[TCP Retransmission] 443  >  1584 [ACK] Seq=1459967 Ack=43525 Win=233984 Len=1240"
"21073","110.394237","192.168.2.103","142.251.32.10","TCP","839","[TCP Retransmission] 1584  >  443 [PSH, ACK] Seq=46698 Ack=1614631 Win=267008 Len=693 [TCP PDU reassembled in 21068]"
"21881","115.205861","142.251.32.10","192.168.2.103","TCP","1394","[TCP Retransmission] 443  >  1589 [PSH, ACK] Seq=8040710 Ack=5806 Win=264960 Len=1240"
"22044","115.244626","142.251.32.10","192.168.2.103","TCP","1386","[TCP Retransmission] 443  >  1589 [ACK] Seq=8129990 Ack=5806 Win=264960 Len=1240"
"22075","115.251860","142.251.32.10","192.168.2.103","TCP","1394","[TCP Retransmission] 443  >  1589 [ACK] Seq=8143630 Ack=5806 Win=264960 Len=1240"
"22076","115.251865","142.251.32.10","192.168.2.103","TCP","1394","[TCP Retransmission] 443  >  1589 [PSH, ACK] Seq=8144870 Ack=5806 Win=264960 Len=1240"
"22077","115.251868","142.251.32.10","192.168.2.103","TCP","1394","[TCP Retransmission] 443  >  1589 [ACK] Seq=8146110 Ack=5806 Win=264960 Len=1240"
"22119","115.259508","142.251.32.10","192.168.2.103","TCP","1394","[TCP Retransmission] 443  >  1589 [ACK] Seq=8174630 Ack=5806 Win=264960 Len=1240 [TCP PDU reassembled in 22170]"
"22120","115.259510","142.251.32.10","192.168.2.103","TCP","1394","[TCP Retransmission] 443  >  1589 [PSH, ACK] Seq=8175870 Ack=5806 Win=264960 Len=1240 [TCP PDU reassembled in 22170]"
"22121","115.259513","142.251.32.10","192.168.2.103","TCP","1394","[TCP Retransmission] 443  >  1589 [ACK] Seq=8177110 Ack=5806 Win=264960 Len=1240 [TCP PDU reassembled in 22170]"
"22138","115.263604","142.251.32.10","192.168.2.103","TCP","1394","[TCP Retransmission] 443  >  1589 [ACK] Seq=8185790 Ack=5806 Win=264960 Len=1240 [TCP PDU reassembled in 22170]"
"22208","115.279546","142.251.32.10","192.168.2.103","TCP","1394","[TCP Retransmission] 443  >  1589 [ACK] Seq=8215550 Ack=5806 Win=264960 Len=1240 [TCP PDU reassembled in 22325]"
"22301","115.297915","142.251.32.10","192.168.2.103","TCP","1394","[TCP Retransmission] 443  >  1589 [PSH, ACK] Seq=8267630 Ack=5806 Win=264960 Len=1240 [TCP PDU reassembled in 22325]"
"22302","115.297919","142.251.32.10","192.168.2.103","TCP","1394","[TCP Retransmission] 443  >  1589 [ACK] Seq=8270110 Ack=5806 Win=264960 Len=1240"
"22349","115.309296","142.251.32.10","192.168.2.103","TCP","1394","[TCP Retransmission] 443  >  1589 [ACK] Seq=8287470 Ack=5806 Win=264960 Len=1240 [TCP PDU reassembled in 22389]"
"22350","115.309299","142.251.32.10","192.168.2.103","TCP","1394","[TCP Retransmission] 443  >  1589 [ACK] Seq=8288710 Ack=5806 Win=264960 Len=1240 [TCP PDU reassembled in 22389]"
"22580","115.365425","142.251.32.10","192.168.2.103","TCP","1394","[TCP Retransmission] 443  >  1589 [ACK] Seq=8407750 Ack=5806 Win=264960 Len=1240"
"22598","115.371395","142.251.32.10","192.168.2.103","TCP","1394","[TCP Retransmission] 443  >  1589 [ACK] Seq=8412710 Ack=5806 Win=264960 Len=1240"
"22599","115.371396","142.251.32.10","192.168.2.103","TCP","1394","[TCP Retransmission] 443  >  1589 [ACK] Seq=8413950 Ack=5806 Win=264960 Len=1240"
"23043","115.473969","142.251.32.10","192.168.2.103","TCP","1394","[TCP Retransmission] 443  >  1589 [ACK] Seq=8629710 Ack=5806 Win=264960 Len=1240 [TCP PDU reassembled in 23052]"
"23125","115.493270","142.251.32.10","192.168.2.103","TCP","1394","[TCP Retransmission] 443  >  1589 [PSH, ACK] Seq=8671870 Ack=5806 Win=264960 Len=1240"
"23216","115.511174","142.251.32.10","192.168.2.103","TCP","1394","[TCP Retransmission] 443  >  1589 [ACK] Seq=8721470 Ack=5806 Win=264960 Len=1240 [TCP PDU reassembled in 23325]"
"23217","115.511176","142.251.32.10","192.168.2.103","TCP","1394","[TCP Retransmission] 443  >  1589 [ACK] Seq=8722710 Ack=5806 Win=264960 Len=1240 [TCP PDU reassembled in 23325]"
"23255","115.521517","142.251.32.10","192.168.2.103","TCP","1394","[TCP Retransmission] 443  >  1589 [ACK] Seq=8736350 Ack=5806 Win=264960 Len=1240 [TCP PDU reassembled in 23325]"
"23256","115.521521","142.251.32.10","192.168.2.103","TCP","1394","[TCP Retransmission] 443  >  1589 [ACK] Seq=8737590 Ack=5806 Win=264960 Len=1240 [TCP PDU reassembled in 23325]"
"23257","115.521526","142.251.32.10","192.168.2.103","TCP","1394","[TCP Retransmission] 443  >  1589 [PSH, ACK] Seq=8738830 Ack=5806 Win=264960 Len=1240 [TCP PDU reassembled in 23325]"
"23399","115.559282","142.251.32.10","192.168.2.103","TCP","1394","[TCP Retransmission] 443  >  1589 [PSH, ACK] Seq=8803310 Ack=5806 Win=264960 Len=1240"
"23512","115.587466","142.251.32.10","192.168.2.103","TCP","1394","[TCP Retransmission] 443  >  1589 [PSH, ACK] Seq=8867790 Ack=5806 Win=264960 Len=1240 [TCP PDU reassembled in 23638]"
"23543","115.595452","142.251.32.10","192.168.2.103","TCP","1394","[TCP Retransmission] 443  >  1589 [ACK] Seq=8877710 Ack=5806 Win=264960 Len=1240 [TCP PDU reassembled in 23638]"
"23574","115.601490","142.251.32.10","192.168.2.103","TCP","1394","[TCP Retransmission] 443  >  1589 [ACK] Seq=8892590 Ack=5806 Win=264960 Len=1240 [TCP PDU reassembled in 23638]"
"23619","115.613287","142.251.32.10","192.168.2.103","TCP","1394","[TCP Retransmission] 443  >  1589 [ACK] Seq=8909950 Ack=5806 Win=264960 Len=1240 [TCP PDU reassembled in 23638]"
"23620","115.613291","142.251.32.10","192.168.2.103","TCP","1394","[TCP Retransmission] 443  >  1589 [ACK] Seq=8911190 Ack=5806 Win=264960 Len=1240 [TCP PDU reassembled in 23638]"
"23621","115.613295","142.251.32.10","192.168.2.103","TCP","1394","[TCP Retransmission] 443  >  1589 [PSH, ACK] Seq=8912430 Ack=5806 Win=264960 Len=1240 [TCP PDU reassembled in 23638]"
"23636","115.617544","142.251.32.10","192.168.2.103","TCP","1394","[TCP Retransmission] 443  >  1589 [PSH, ACK] Seq=8912430 Ack=5806 Win=264960 Len=1240 [TCP PDU reassembled in 23638]"
"23764","115.649216","142.251.32.10","192.168.2.103","TCP","1394","[TCP Retransmission] 443  >  1589 [ACK] Seq=8989310 Ack=5806 Win=264960 Len=1240 [TCP PDU reassembled in 23767]"
"23838","115.667248","142.251.32.10","192.168.2.103","TCP","1394","[TCP Retransmission] 443  >  1589 [ACK] Seq=9017830 Ack=5806 Win=264960 Len=1240"
"23839","115.667250","142.251.32.10","192.168.2.103","TCP","1394","[TCP Retransmission] 443  >  1589 [PSH, ACK] Seq=9020310 Ack=5806 Win=264960 Len=1240"
"24040","115.716055","142.251.32.10","192.168.2.103","TCP","1394","[TCP Retransmission] 443  >  1589 [ACK] Seq=9135630 Ack=5806 Win=264960 Len=1240"
"24060","115.721543","142.251.32.10","192.168.2.103","TCP","1394","[TCP Retransmission] 443  >  1589 [ACK] Seq=9150510 Ack=5806 Win=264960 Len=1240"
"24329","122.112695","192.168.2.103","142.251.32.10","TCP","1394","[TCP Retransmission] 1584  >  443 [ACK] Seq=51257 Ack=1616523 Win=267776 Len=1240"
"24330","122.112722","192.168.2.103","142.251.32.10","TCP","847","[TCP Retransmission] 1584  >  443 [PSH, ACK] Seq=52497 Ack=1616523 Win=267776 Len=693 [TCP PDU reassembled in 24326]"
"24699","124.206774","142.251.32.10","192.168.2.103","TCP","1394","[TCP Retransmission] 443  >  1589 [ACK] Seq=9402226 Ack=6380 Win=264448 Len=1240"
"24700","124.206778","142.251.32.10","192.168.2.103","TCP","1394","[TCP Retransmission] 443  >  1589 [ACK] Seq=9403466 Ack=6380 Win=264448 Len=1240 [TCP PDU reassembled in 24692]"
"24701","124.206781","142.251.32.10","192.168.2.103","TCP","1394","[TCP Retransmission] 443  >  1589 [ACK] Seq=9404706 Ack=6380 Win=264448 Len=1240"
"24749","124.215808","142.251.32.10","192.168.2.103","TCP","1394","[TCP Retransmission] 443  >  1589 [ACK] Seq=9438186 Ack=6380 Win=264448 Len=1240"
"24751","124.215815","142.251.32.10","192.168.2.103","TCP","1394","[TCP Retransmission] 443  >  1589 [PSH, ACK] Seq=9440666 Ack=6380 Win=264448 Len=1240"
"24909","124.249883","142.251.32.10","192.168.2.103","TCP","1394","[TCP Retransmission] 443  >  1589 [ACK] Seq=9541106 Ack=6380 Win=264448 Len=1240"
"24910","124.249887","142.251.32.10","192.168.2.103","TCP","1394","[TCP Retransmission] 443  >  1589 [ACK] Seq=9542346 Ack=6380 Win=264448 Len=1240"
"25003","124.273081","142.251.32.10","192.168.2.103","TCP","1386","[TCP Retransmission] 443  >  1589 [ACK] Seq=9600626 Ack=6380 Win=264448 Len=1240"
"25008","124.274334","142.251.32.10","192.168.2.103","TCP","1394","[TCP Retransmission] 443  >  1589 [ACK] Seq=9605586 Ack=6380 Win=264448 Len=1240"
"25099","124.299932","142.251.32.10","192.168.2.103","TCP","1394","[TCP Retransmission] 443  >  1589 [ACK] Seq=9653946 Ack=6380 Win=264448 Len=1240"
"25191","124.320238","142.251.32.10","192.168.2.103","TCP","1394","[TCP Retransmission] 443  >  1589 [PSH, ACK] Seq=9717186 Ack=6380 Win=264448 Len=1240"
"25192","124.320241","142.251.32.10","192.168.2.103","TCP","1394","[TCP Retransmission] 443  >  1589 [ACK] Seq=9718426 Ack=6380 Win=264448 Len=1240"
"25193","124.320244","142.251.32.10","192.168.2.103","TCP","1394","[TCP Retransmission] 443  >  1589 [ACK] Seq=9719666 Ack=6380 Win=264448 Len=1240"
"25216","124.324081","142.251.32.10","192.168.2.103","TCP","1394","[TCP Retransmission] 443  >  1589 [ACK] Seq=9725866 Ack=6380 Win=264448 Len=1240"
"25289","124.337681","142.251.32.10","192.168.2.103","TCP","1394","[TCP Retransmission] 443  >  1589 [PSH, ACK] Seq=9769266 Ack=6380 Win=264448 Len=1240"
"25338","124.353672","142.251.32.10","192.168.2.103","TCP","1394","[TCP Retransmission] 443  >  1589 [ACK] Seq=9792826 Ack=6380 Win=264448 Len=1240"
"25339","124.353675","142.251.32.10","192.168.2.103","TCP","1394","[TCP Retransmission] 443  >  1589 [PSH, ACK] Seq=9794066 Ack=6380 Win=264448 Len=1240"
"25526","124.393765","142.251.32.10","192.168.2.103","TCP","1394","[TCP Retransmission] 443  >  1589 [ACK] Seq=9919306 Ack=6380 Win=264448 Len=1240"
"25527","124.393769","142.251.32.10","192.168.2.103","TCP","1394","[TCP Retransmission] 443  >  1589 [ACK] Seq=9920546 Ack=6380 Win=264448 Len=1240"
"25619","124.411879","142.251.32.10","192.168.2.103","TCP","1394","[TCP Retransmission] 443  >  1589 [PSH, ACK] Seq=9970146 Ack=6380 Win=264448 Len=1240"
"26029","124.504745","142.251.32.10","192.168.2.103","TCP","1394","[TCP Retransmission] 443  >  1589 [PSH, ACK] Seq=10168546 Ack=6380 Win=264448 Len=1240"
"26030","124.504748","142.251.32.10","192.168.2.103","TCP","1394","[TCP Retransmission] 443  >  1589 [ACK] Seq=10169786 Ack=6380 Win=264448 Len=1240"
"26038","124.507427","142.251.32.10","192.168.2.103","TCP","1394","[TCP Retransmission] 443  >  1589 [PSH, ACK] Seq=10178466 Ack=6380 Win=264448 Len=1240"
"26039","124.507429","142.251.32.10","192.168.2.103","TCP","1394","[TCP Retransmission] 443  >  1589 [ACK] Seq=10179706 Ack=6380 Win=264448 Len=1240"
"26040","124.507432","142.251.32.10","192.168.2.103","TCP","1394","[TCP Retransmission] 443  >  1589 [PSH, ACK] Seq=10180946 Ack=6380 Win=264448 Len=1240"
"26090","124.521552","142.251.32.10","192.168.2.103","TCP","1394","[TCP Retransmission] 443  >  1589 [ACK] Seq=10184666 Ack=6380 Win=264448 Len=1240 [TCP PDU reassembled in 26106]"
"26091","124.521556","142.251.32.10","192.168.2.103","TCP","1394","[TCP Retransmission] 443  >  1589 [PSH, ACK] Seq=10185906 Ack=6380 Win=264448 Len=1240 [TCP PDU reassembled in 26106]"
"26154","124.539538","142.251.32.10","192.168.2.103","TCP","1394","[TCP Retransmission] 443  >  1589 [PSH, ACK] Seq=10218146 Ack=6380 Win=264448 Len=1240"
"26155","124.539541","142.251.32.10","192.168.2.103","TCP","1394","[TCP Retransmission] 443  >  1589 [PSH, ACK] Seq=10220626 Ack=6380 Win=264448 Len=1240"
"26259","124.570668","142.251.32.10","192.168.2.103","TCP","1394","[TCP Retransmission] 443  >  1589 [ACK] Seq=10271466 Ack=6380 Win=264448 Len=1240"
"26381","124.599921","142.251.32.10","192.168.2.103","TCP","1394","[TCP Retransmission] 443  >  1589 [PSH, ACK] Seq=10328506 Ack=6380 Win=264448 Len=1240 [TCP PDU reassembled in 26485]"
"26382","124.599925","142.251.32.10","192.168.2.103","TCP","1394","[TCP Retransmission] 443  >  1589 [ACK] Seq=10329746 Ack=6380 Win=264448 Len=1240 [TCP PDU reassembled in 26485]"
"26409","124.606125","142.251.32.10","192.168.2.103","TCP","1394","[TCP Retransmission] 443  >  1589 [PSH, ACK] Seq=10340906 Ack=6380 Win=264448 Len=1240 [TCP PDU reassembled in 26485]"
"26479","124.623246","142.251.32.10","192.168.2.103","TCP","1394","[TCP Retransmission] 443  >  1589 [PSH, ACK] Seq=10378106 Ack=6380 Win=264448 Len=1240 [TCP PDU reassembled in 26485]"
"26508","124.629327","142.251.32.10","192.168.2.103","TCP","1394","[TCP Retransmission] 443  >  1589 [ACK] Seq=10391746 Ack=6380 Win=264448 Len=1240"
"26509","124.629332","142.251.32.10","192.168.2.103","TCP","1394","[TCP Retransmission] 443  >  1589 [PSH, ACK] Seq=10392986 Ack=6380 Win=264448 Len=1240 [TCP PDU reassembled in 26604]"
"26525","124.633711","142.251.32.10","192.168.2.103","TCP","1394","[TCP Retransmission] 443  >  1589 [ACK] Seq=10401666 Ack=6380 Win=264448 Len=1240 [TCP PDU reassembled in 26604]"
"26782","124.695795","142.251.32.10","192.168.2.103","TCP","1394","[TCP Retransmission] 443  >  1589 [PSH, ACK] Seq=10519466 Ack=6380 Win=264448 Len=1240"
"26784","124.695804","142.251.32.10","192.168.2.103","TCP","1394","[TCP Retransmission] 443  >  1589 [PSH, ACK] Seq=10521946 Ack=6380 Win=264448 Len=1240"
"26847","124.715974","142.251.32.10","192.168.2.103","TCP","1394","[TCP Retransmission] 443  >  1589 [PSH, ACK] Seq=10561626 Ack=6380 Win=264448 Len=1240"
"26940","124.734175","142.251.32.10","192.168.2.103","TCP","1394","[TCP Retransmission] 443  >  1589 [ACK] Seq=10605026 Ack=6380 Win=264448 Len=1240 [TCP PDU reassembled in 26956]"
"26991","124.743468","142.251.32.10","192.168.2.103","TCP","1394","[TCP Retransmission] 443  >  1589 [PSH, ACK] Seq=10631066 Ack=6380 Win=264448 Len=1240 [TCP PDU reassembled in 27062]"
"26992","124.743471","142.251.32.10","192.168.2.103","TCP","1394","[TCP Retransmission] 443  >  1589 [PSH, ACK] Seq=10633546 Ack=6380 Win=264448 Len=1240 [TCP PDU reassembled in 27062]"
"28049","134.730172","142.251.32.10","192.168.2.103","TCP","1394","[TCP Retransmission] 443  >  1589 [ACK] Seq=11013670 Ack=6954 Win=263936 Len=1240"
"28162","134.751878","142.251.32.10","192.168.2.103","TCP","1394","[TCP Retransmission] 443  >  1589 [ACK] Seq=11069470 Ack=6954 Win=263936 Len=1240"
"28401","134.800317","142.251.32.10","192.168.2.103","TCP","1394","[TCP Retransmission] 443  >  1589 [PSH, ACK] Seq=11220750 Ack=6954 Win=263936 Len=1240"
"28474","134.813954","142.251.32.10","192.168.2.103","TCP","1394","[TCP Retransmission] 443  >  1589 [ACK] Seq=11261670 Ack=6954 Win=263936 Len=1240 [TCP PDU reassembled in 28531]"
"28475","134.813958","142.251.32.10","192.168.2.103","TCP","1394","[TCP Retransmission] 443  >  1589 [PSH, ACK] Seq=11262910 Ack=6954 Win=263936 Len=1240 [TCP PDU reassembled in 28531]"
"28552","134.831934","142.251.32.10","192.168.2.103","TCP","1394","[TCP Retransmission] 443  >  1589 [ACK] Seq=11316230 Ack=6954 Win=263936 Len=1240"
"28944","134.906269","142.251.32.10","192.168.2.103","TCP","1394","[TCP Retransmission] 443  >  1589 [ACK] Seq=11554310 Ack=6954 Win=263936 Len=1240 [TCP PDU reassembled in 29047]"
"29345","134.980062","142.251.32.10","192.168.2.103","TCP","1394","[TCP Retransmission] 443  >  1589 [ACK] Seq=11792390 Ack=6954 Win=263936 Len=1240 [TCP PDU reassembled in 29346]"
"29366","134.983886","142.251.32.10","192.168.2.103","TCP","1394","[TCP Retransmission] 443  >  1589 [PSH, ACK] Seq=11803550 Ack=6954 Win=263936 Len=1240"
"29878","135.083622","142.251.32.10","192.168.2.103","TCP","1394","[TCP Retransmission] 443  >  1589 [PSH, ACK] Seq=12098670 Ack=6954 Win=263936 Len=1240 [TCP PDU reassembled in 29960]"
"29939","135.093595","142.251.32.10","192.168.2.103","TCP","1394","[TCP Retransmission] 443  >  1589 [PSH, ACK] Seq=12128430 Ack=6954 Win=263936 Len=1240 [TCP PDU reassembled in 29960]"
"29940","135.093599","142.251.32.10","192.168.2.103","TCP","1394","[TCP Retransmission] 443  >  1589 [PSH, ACK] Seq=12130910 Ack=6954 Win=263936 Len=1240 [TCP PDU reassembled in 29960]"
"30010","135.111697","142.251.32.10","192.168.2.103","TCP","1394","[TCP Retransmission] 443  >  1589 [PSH, ACK] Seq=12178030 Ack=6954 Win=263936 Len=1240 [TCP PDU reassembled in 30022]"
"30452","141.792743","192.168.2.103","142.251.32.10","TCP","847","[TCP Retransmission] 1584  >  443 [PSH, ACK] Seq=66024 Ack=1620939 Win=267008 Len=693"
"30889","144.458293","142.251.32.10","192.168.2.103","TCP","1394","[TCP Retransmission] 443  >  1589 [ACK] Seq=12515152 Ack=7528 Win=263424 Len=1240"
"30890","144.458298","142.251.32.10","192.168.2.103","TCP","1394","[TCP Retransmission] 443  >  1589 [PSH, ACK] Seq=12516392 Ack=7528 Win=263424 Len=1240"
"30891","144.458302","142.251.32.10","192.168.2.103","TCP","1394","[TCP Retransmission] 443  >  1589 [ACK] Seq=12517632 Ack=7528 Win=263424 Len=1240"
"30892","144.458306","142.251.32.10","192.168.2.103","TCP","1394","[TCP Retransmission] 443  >  1589 [ACK] Seq=12518872 Ack=7528 Win=263424 Len=1240"
"30965","144.471881","142.251.32.10","192.168.2.103","TCP","1394","[TCP Retransmission] 443  >  1589 [ACK] Seq=12559792 Ack=7528 Win=263424 Len=1240"
"30966","144.471885","142.251.32.10","192.168.2.103","TCP","1394","[TCP Retransmission] 443  >  1589 [PSH, ACK] Seq=12561032 Ack=7528 Win=263424 Len=1240"
"31058","144.487644","142.251.32.10","192.168.2.103","TCP","1394","[TCP Retransmission] 443  >  1589 [ACK] Seq=12625512 Ack=7528 Win=263424 Len=1240 [TCP PDU reassembled in 31089]"
"31059","144.487647","142.251.32.10","192.168.2.103","TCP","1394","[TCP Retransmission] 443  >  1589 [ACK] Seq=12626752 Ack=7528 Win=263424 Len=1240 [TCP PDU reassembled in 31089]"
"31152","144.502353","142.251.32.10","192.168.2.103","TCP","1394","[TCP Retransmission] 443  >  1589 [ACK] Seq=12682552 Ack=7528 Win=263424 Len=1240"
"31262","144.525967","142.251.32.10","192.168.2.103","TCP","1394","[TCP Retransmission] 443  >  1589 [ACK] Seq=12763152 Ack=7528 Win=263424 Len=1240"
"31264","144.525975","142.251.32.10","192.168.2.103","TCP","1394","[TCP Retransmission] 443  >  1589 [ACK] Seq=12765632 Ack=7528 Win=263424 Len=1240"
"31316","144.537454","142.251.32.10","192.168.2.103","TCP","1394","[TCP Retransmission] 443  >  1589 [PSH, ACK] Seq=12796632 Ack=7528 Win=263424 Len=1240"
"31337","144.540995","142.251.32.10","192.168.2.103","TCP","1394","[TCP Retransmission] 443  >  1589 [PSH, ACK] Seq=12816472 Ack=7528 Win=263424 Len=1240"
"31338","144.541000","142.251.32.10","192.168.2.103","TCP","1394","[TCP Retransmission] 443  >  1589 [ACK] Seq=12817712 Ack=7528 Win=263424 Len=1240"
"31681","144.610240","142.251.32.10","192.168.2.103","TCP","1394","[TCP Retransmission] 443  >  1589 [ACK] Seq=13035952 Ack=7528 Win=263424 Len=1240"
"31683","144.610250","142.251.32.10","192.168.2.103","TCP","1394","[TCP Retransmission] 443  >  1589 [ACK] Seq=13038432 Ack=7528 Win=263424 Len=1240"
"31781","144.636052","142.251.32.10","192.168.2.103","TCP","1394","[TCP Retransmission] 443  >  1589 [PSH, ACK] Seq=13099192 Ack=7528 Win=263424 Len=1240"
"31825","144.643841","142.251.32.10","192.168.2.103","TCP","1394","[TCP Retransmission] 443  >  1589 [PSH, ACK] Seq=13128952 Ack=7528 Win=263424 Len=1240 [TCP PDU reassembled in 31857]"
"31826","144.643843","142.251.32.10","192.168.2.103","TCP","1394","[TCP Retransmission] 443  >  1589 [ACK] Seq=13130192 Ack=7528 Win=263424 Len=1240 [TCP PDU reassembled in 31857]"
"31827","144.643846","142.251.32.10","192.168.2.103","TCP","1394","[TCP Retransmission] 443  >  1589 [PSH, ACK] Seq=13131432 Ack=7528 Win=263424 Len=1240 [TCP PDU reassembled in 31857]"
"31828","144.643848","142.251.32.10","192.168.2.103","TCP","1394","[TCP Retransmission] 443  >  1589 [ACK] Seq=13132672 Ack=7528 Win=263424 Len=1240 [TCP PDU reassembled in 31857]"
"32346","144.747720","142.251.32.10","192.168.2.103","TCP","1394","[TCP Retransmission] 443  >  1589 [PSH, ACK] Seq=13468712 Ack=7528 Win=263424 Len=1240"
"32452","144.769817","142.251.32.10","192.168.2.103","TCP","1394","[TCP Retransmission] 443  >  1589 [ACK] Seq=13534432 Ack=7528 Win=263424 Len=1240"
"32524","144.781209","142.251.32.10","192.168.2.103","TCP","1394","[TCP Retransmission] 443  >  1589 [PSH, ACK] Seq=13570392 Ack=7528 Win=263424 Len=1240 [TCP PDU reassembled in 32523]"
"32527","144.782889","142.251.32.10","192.168.2.103","TCP","1394","[TCP Retransmission] 443  >  1589 [ACK] Seq=13574112 Ack=7528 Win=263424 Len=1240 [TCP PDU reassembled in 32523]"
"32783","144.832019","142.251.32.10","192.168.2.103","TCP","1394","[TCP Retransmission] 443  >  1589 [ACK] Seq=13751432 Ack=7528 Win=263424 Len=1240"
"32785","144.832027","142.251.32.10","192.168.2.103","TCP","1394","[TCP Retransmission] 443  >  1589 [ACK] Seq=13753912 Ack=7528 Win=263424 Len=1240"
"32900","144.852059","142.251.32.10","192.168.2.103","TCP","1394","[TCP Retransmission] 443  >  1589 [ACK] Seq=13818392 Ack=7528 Win=263424 Len=1240"
"33001","145.737018","192.168.2.103","142.251.32.10","TCP","839","[TCP Retransmission] 1584  >  443 [PSH, ACK] Seq=67957 Ack=1621572 Win=267776 Len=693 [TCP PDU reassembled in 32997]"
"33898","154.472292","142.251.32.10","192.168.2.103","TCP","1394","[TCP Retransmission] 443  >  1589 [ACK] Seq=14302970 Ack=8102 Win=262912 Len=1240"
"33990","154.490514","205.213.114.136","192.168.2.103","TCP","154","[TCP Retransmission] 443  >  1591 [FIN, ACK] Seq=1194 Ack=826 Win=64128 Len=0"
"35310","157.934676","192.168.2.103","142.251.32.10","TCP","1394","[TCP Retransmission] 1584  >  443 [ACK] Seq=74449 Ack=1624090 Win=267776 Len=1240"
"35314","157.936083","192.168.2.103","142.251.32.10","TCP","1394","[TCP Retransmission] 1584  >  443 [ACK] Seq=74449 Ack=1624090 Win=267776 Len=1240"
"35315","157.936094","192.168.2.103","142.251.32.10","TCP","847","[TCP Retransmission] 1584  >  443 [PSH, ACK] Seq=75689 Ack=1624090 Win=267776 Len=693 [TCP PDU reassembled in 35311]"
