"No.","Time","Source","Destination","Protocol","Length","Info"
"734","22.356275","157.240.26.49","192.168.2.103","TCP","146","[TCP Dup ACK 730#1] 443  >  1552 [ACK] Seq=1067 Ack=1695 Win=70144 Len=0"
"738","22.356814","192.168.2.103","157.240.26.49","TCP","146","[TCP Dup ACK 733#1] 1552  >  443 [ACK] Seq=1695 Ack=1067 Win=64512 Len=0"
"765","22.608174","192.168.2.103","157.240.26.49","TCP","146","[TCP Dup ACK 762#1] 1551  >  443 [ACK] Seq=1052 Ack=1158 Win=64512 Len=0"
"808","23.840764","192.168.2.103","23.192.220.16","TCP","146","[TCP Dup ACK 804#1] 1553  >  443 [ACK] Seq=1 Ack=1 Win=66304 Len=0"
"856","23.878953","23.192.220.16","192.168.2.103","TCP","1394","[TCP Out-Of-Order] 443  >  1553 [ACK] Seq=2144 Ack=1127 Win=64128 Len=1240 [TCP PDU reassembled in 886]"
"857","23.878960","23.192.220.16","192.168.2.103","TCP","1394","[TCP Out-Of-Order] 443  >  1553 [PSH, ACK] Seq=3384 Ack=1127 Win=64128 Len=1240 [TCP PDU reassembled in 886]"
"860","23.878971","23.192.220.16","192.168.2.103","TCP","1394","443  >  1553 [PSH, ACK] Seq=7104 Ack=1127 Win=64128 Len=1240 [TCP PDU reassembled in 886]"
"861","23.878975","23.192.220.16","192.168.2.103","TCP","1394","443  >  1553 [ACK] Seq=8344 Ack=1127 Win=64128 Len=1240 [TCP PDU reassembled in 886]"
"862","23.878978","23.192.220.16","192.168.2.103","TCP","1394","443  >  1553 [ACK] Seq=9584 Ack=1127 Win=64128 Len=1240 [TCP PDU reassembled in 886]"
"919","23.900932","23.192.220.16","192.168.2.103","TCP","1386","[TCP Out-Of-Order] 443  >  1553 [PSH, ACK] Seq=21984 Ack=1127 Win=64128 Len=1240 [TCP PDU reassembled in 945]"
"921","23.903453","23.192.220.16","192.168.2.103","TCP","1394","[TCP Out-Of-Order] 443  >  1553 [ACK] Seq=23224 Ack=1158 Win=64128 Len=1240 [TCP PDU reassembled in 945]"
"922","23.903465","23.192.220.16","192.168.2.103","TCP","1394","[TCP Out-Of-Order] 443  >  1553 [ACK] Seq=24464 Ack=1158 Win=64128 Len=1240 [TCP PDU reassembled in 945]"
"923","23.903469","23.192.220.16","192.168.2.103","TCP","1394","[TCP Out-Of-Order] 443  >  1553 [PSH, ACK] Seq=25704 Ack=1158 Win=64128 Len=1240 [TCP PDU reassembled in 945]"
"924","23.903473","23.192.220.16","192.168.2.103","TCP","1394","[TCP Out-Of-Order] 443  >  1553 [ACK] Seq=26944 Ack=1158 Win=64128 Len=1240 [TCP PDU reassembled in 945]"
"925","23.903476","23.192.220.16","192.168.2.103","TCP","1394","[TCP Out-Of-Order] 443  >  1553 [ACK] Seq=28184 Ack=1158 Win=64128 Len=1240 [TCP PDU reassembled in 945]"
"926","23.903480","23.192.220.16","192.168.2.103","TCP","1394","[TCP Out-Of-Order] 443  >  1553 [PSH, ACK] Seq=29424 Ack=1158 Win=64128 Len=1240 [TCP PDU reassembled in 945]"
"927","23.903483","23.192.220.16","192.168.2.103","TCP","1394","[TCP Out-Of-Order] 443  >  1553 [ACK] Seq=30664 Ack=1158 Win=64128 Len=1240 [TCP PDU reassembled in 945]"
"928","23.903487","23.192.220.16","192.168.2.103","TCP","1394","[TCP Out-Of-Order] 443  >  1553 [ACK] Seq=31904 Ack=1158 Win=64128 Len=1240 [TCP PDU reassembled in 945]"
"945","23.909156","23.192.220.16","192.168.2.103","TCP","1394","[TCP Out-Of-Order] 443  >  1553 [PSH, ACK] Seq=33144 Ack=1158 Win=64128 Len=1240"
"965","23.913906","23.192.220.16","192.168.2.103","TCP","1394","[TCP Out-Of-Order] 443  >  1553 [ACK] Seq=34384 Ack=1158 Win=64128 Len=1240"
"966","23.913911","23.192.220.16","192.168.2.103","TCP","1394","[TCP Out-Of-Order] 443  >  1553 [ACK] Seq=35624 Ack=1158 Win=64128 Len=1240"
"967","23.913916","23.192.220.16","192.168.2.103","TCP","1394","[TCP Out-Of-Order] 443  >  1553 [PSH, ACK] Seq=36864 Ack=1158 Win=64128 Len=1240"
"968","23.913920","23.192.220.16","192.168.2.103","TCP","1394","[TCP Out-Of-Order] 443  >  1553 [ACK] Seq=38104 Ack=1158 Win=64128 Len=1240"
"975","23.915846","23.192.220.16","192.168.2.103","TCP","1394","[TCP Out-Of-Order] 443  >  1553 [ACK] Seq=39344 Ack=1158 Win=64128 Len=1240"
"976","23.915851","23.192.220.16","192.168.2.103","TCP","1394","[TCP Out-Of-Order] 443  >  1553 [PSH, ACK] Seq=40584 Ack=1158 Win=64128 Len=1240"
"977","23.915855","23.192.220.16","192.168.2.103","TCP","1394","[TCP Out-Of-Order] 443  >  1553 [ACK] Seq=41824 Ack=1158 Win=64128 Len=1240"
"978","23.915861","23.192.220.16","192.168.2.103","TCP","1394","[TCP Out-Of-Order] 443  >  1553 [ACK] Seq=48024 Ack=1158 Win=64128 Len=1240"
"979","23.915866","23.192.220.16","192.168.2.103","TCP","1394","[TCP Out-Of-Order] 443  >  1553 [ACK] Seq=49264 Ack=1158 Win=64128 Len=1240"
"981","23.915872","23.192.220.16","192.168.2.103","TCP","1394","[TCP Out-Of-Order] 443  >  1553 [ACK] Seq=51744 Ack=1158 Win=64128 Len=1240"
"982","23.915875","23.192.220.16","192.168.2.103","TCP","1394","[TCP Out-Of-Order] 443  >  1553 [ACK] Seq=52984 Ack=1158 Win=64128 Len=1240"
"988","23.917109","23.192.220.16","192.168.2.103","TCP","1394","[TCP Out-Of-Order] 443  >  1553 [PSH, ACK] Seq=54224 Ack=1158 Win=64128 Len=1240"
"1146","24.107053","157.240.26.49","192.168.2.103","TCP","1386","443  >  1554 [PSH, ACK] Seq=11055 Ack=22410 Win=111360 Len=1240 [TCP PDU reassembled in 1148]"
"1465","26.088433","192.168.2.103","157.240.26.49","TCP","146","[TCP Dup ACK 1462#1] 1557  >  443 [ACK] Seq=3976 Ack=13590 Win=65536 Len=0"
"1468","26.089838","192.168.2.103","157.240.26.49","TCP","146","[TCP Dup ACK 1462#2] 1557  >  443 [ACK] Seq=3976 Ack=13590 Win=65536 Len=0"
"1498","26.097881","157.240.26.49","192.168.2.103","TCP","1386","443  >  1557 [PSH, ACK] Seq=27230 Ack=3976 Win=77056 Len=1240 [TCP PDU reassembled in 1519]"
"1528","26.108015","157.240.26.49","192.168.2.103","TCP","1394","[TCP Out-Of-Order] 443  >  1557 [PSH, ACK] Seq=42110 Ack=3976 Win=77056 Len=1240"
"1533","26.108236","192.168.2.103","157.240.26.49","TCP","146","[TCP Dup ACK 1527#1] 1557  >  443 [ACK] Seq=3976 Ack=42110 Win=65536 Len=0"
"1588","26.127875","192.168.2.103","157.240.26.49","TCP","146","[TCP Dup ACK 1584#1] 1557  >  443 [ACK] Seq=3976 Ack=61950 Win=65536 Len=0"
"1590","26.130368","157.240.26.49","192.168.2.103","TCP","1394","[TCP Out-Of-Order] 443  >  1557 [PSH, ACK] Seq=61950 Ack=3976 Win=77056 Len=1240"
"1603","26.136319","157.240.26.49","192.168.2.103","TCP","1394","[TCP Previous segment not captured] 443  >  1557 [ACK] Seq=81790 Ack=3976 Win=77056 Len=1240 [TCP PDU reassembled in 1648]"
"1604","26.136324","157.240.26.49","192.168.2.103","TCP","1394","443  >  1557 [ACK] Seq=83030 Ack=3976 Win=77056 Len=1240 [TCP PDU reassembled in 1648]"
"1605","26.136328","157.240.26.49","192.168.2.103","TCP","1394","443  >  1557 [PSH, ACK] Seq=84270 Ack=3976 Win=77056 Len=1240 [TCP PDU reassembled in 1648]"
"1606","26.136334","157.240.26.49","192.168.2.103","TCP","1394","443  >  1557 [ACK] Seq=85510 Ack=3976 Win=77056 Len=1240 [TCP PDU reassembled in 1648]"
"1607","26.136337","157.240.26.49","192.168.2.103","TCP","1394","443  >  1557 [ACK] Seq=86750 Ack=3976 Win=77056 Len=1240 [TCP PDU reassembled in 1648]"
"1608","26.136341","157.240.26.49","192.168.2.103","TCP","1394","443  >  1557 [ACK] Seq=87990 Ack=3976 Win=77056 Len=1240 [TCP PDU reassembled in 1648]"
"1609","26.136345","157.240.26.49","192.168.2.103","TCP","1394","443  >  1557 [PSH, ACK] Seq=89230 Ack=3976 Win=77056 Len=1240 [TCP PDU reassembled in 1648]"
"1610","26.136349","157.240.26.49","192.168.2.103","TCP","1394","443  >  1557 [ACK] Seq=90470 Ack=3976 Win=77056 Len=1240 [TCP PDU reassembled in 1648]"
"1611","26.136354","157.240.26.49","192.168.2.103","TCP","1394","443  >  1557 [ACK] Seq=91710 Ack=3976 Win=77056 Len=1240 [TCP PDU reassembled in 1648]"
"1612","26.136357","157.240.26.49","192.168.2.103","TCP","1394","443  >  1557 [ACK] Seq=92950 Ack=3976 Win=77056 Len=1240 [TCP PDU reassembled in 1648]"
"1613","26.136360","157.240.26.49","192.168.2.103","TCP","1394","443  >  1557 [ACK] Seq=94190 Ack=3976 Win=77056 Len=1240 [TCP PDU reassembled in 1648]"
"1614","26.136363","157.240.26.49","192.168.2.103","TCP","1394","443  >  1557 [PSH, ACK] Seq=95430 Ack=3976 Win=77056 Len=1240 [TCP PDU reassembled in 1648]"
"1615","26.136367","157.240.26.49","192.168.2.103","TCP","1394","443  >  1557 [ACK] Seq=96670 Ack=3976 Win=77056 Len=1240 [TCP PDU reassembled in 1648]"
"1616","26.136370","157.240.26.49","192.168.2.103","TCP","1394","443  >  1557 [ACK] Seq=97910 Ack=3976 Win=77056 Len=1240 [TCP PDU reassembled in 1648]"
"1626","26.138302","157.240.26.49","192.168.2.103","TCP","1394","[TCP Out-Of-Order] 443  >  1557 [PSH, ACK] Seq=66910 Ack=3976 Win=77056 Len=1240"
"1628","26.140119","157.240.26.49","192.168.2.103","TCP","1394","[TCP Out-Of-Order] 443  >  1557 [ACK] Seq=68150 Ack=3976 Win=77056 Len=1240"
"1629","26.140123","157.240.26.49","192.168.2.103","TCP","1394","[TCP Out-Of-Order] 443  >  1557 [ACK] Seq=70630 Ack=3976 Win=77056 Len=1240"
"1630","26.140127","157.240.26.49","192.168.2.103","TCP","1394","[TCP Out-Of-Order] 443  >  1557 [PSH, ACK] Seq=71870 Ack=3976 Win=77056 Len=1240"
"1631","26.140131","157.240.26.49","192.168.2.103","TCP","1394","[TCP Out-Of-Order] 443  >  1557 [ACK] Seq=73110 Ack=3976 Win=77056 Len=1240"
"1632","26.140137","157.240.26.49","192.168.2.103","TCP","1394","[TCP Out-Of-Order] 443  >  1557 [ACK] Seq=74350 Ack=3976 Win=77056 Len=1240"
"1633","26.140141","157.240.26.49","192.168.2.103","TCP","1394","[TCP Out-Of-Order] 443  >  1557 [ACK] Seq=75590 Ack=3976 Win=77056 Len=1240"
"1634","26.140145","157.240.26.49","192.168.2.103","TCP","1394","[TCP Out-Of-Order] 443  >  1557 [PSH, ACK] Seq=76830 Ack=3976 Win=77056 Len=1240"
"1635","26.140149","157.240.26.49","192.168.2.103","TCP","1394","[TCP Out-Of-Order] 443  >  1557 [ACK] Seq=78070 Ack=3976 Win=77056 Len=1240"
"1636","26.140154","157.240.26.49","192.168.2.103","TCP","1394","[TCP Out-Of-Order] 443  >  1557 [PSH, ACK] Seq=79310 Ack=3976 Win=77056 Len=1240"
"1645","26.141877","157.240.26.49","192.168.2.103","TCP","1394","[TCP Out-Of-Order] 443  >  1557 [ACK] Seq=80550 Ack=3976 Win=77056 Len=1240"
"1678","26.561579","157.240.26.49","192.168.2.103","TCP","1394","443  >  1557 [ACK] Seq=107621 Ack=3976 Win=77056 Len=1240"
"1679","26.561590","157.240.26.49","192.168.2.103","TCP","1394","443  >  1557 [ACK] Seq=108861 Ack=3976 Win=77056 Len=1240"
"1684","26.563552","157.240.26.49","192.168.2.103","TCP","1394","443  >  1557 [ACK] Seq=111341 Ack=3976 Win=77056 Len=1240"
"1705","26.565935","157.240.26.49","192.168.2.103","TCP","1394","[TCP Out-Of-Order] 443  >  1557 [ACK] Seq=118781 Ack=3976 Win=77056 Len=1240"
"1730","26.574947","157.240.26.49","192.168.2.103","TCP","1394","443  >  1557 [ACK] Seq=131706 Ack=3976 Win=77056 Len=1240"
"1731","26.574951","157.240.26.49","192.168.2.103","TCP","1394","443  >  1557 [PSH, ACK] Seq=132946 Ack=3976 Win=77056 Len=1240"
"1732","26.574955","157.240.26.49","192.168.2.103","TCP","1394","[TCP Previous segment not captured] 443  >  1557 [PSH, ACK] Seq=135426 Ack=3976 Win=77056 Len=1240"
"1787","26.590338","157.240.26.49","192.168.2.103","TCP","1394","443  >  1557 [ACK] Seq=173866 Ack=3976 Win=77056 Len=1240 [TCP PDU reassembled in 1797]"
"1788","26.590343","157.240.26.49","192.168.2.103","TCP","1394","443  >  1557 [ACK] Seq=175106 Ack=3976 Win=77056 Len=1240 [TCP PDU reassembled in 1797]"
"1789","26.590347","157.240.26.49","192.168.2.103","TCP","1394","443  >  1557 [ACK] Seq=176346 Ack=3976 Win=77056 Len=1240 [TCP PDU reassembled in 1797]"
"1790","26.590351","157.240.26.49","192.168.2.103","TCP","1394","443  >  1557 [PSH, ACK] Seq=177586 Ack=3976 Win=77056 Len=1240 [TCP PDU reassembled in 1797]"
"1791","26.590356","157.240.26.49","192.168.2.103","TCP","1394","443  >  1557 [ACK] Seq=178826 Ack=3976 Win=77056 Len=1240 [TCP PDU reassembled in 1797]"
"1792","26.590361","157.240.26.49","192.168.2.103","TCP","1394","443  >  1557 [ACK] Seq=180066 Ack=3976 Win=77056 Len=1240 [TCP PDU reassembled in 1797]"
"1817","26.594469","192.168.2.103","157.240.26.49","TCP","146","[TCP Dup ACK 1814#1] 1557  >  443 [ACK] Seq=3976 Ack=196186 Win=131328 Len=0"
"2268","32.644728","34.36.199.114","192.168.2.103","TCP","146","443  >  1570 [ACK] Seq=220 Ack=1040 Win=268800 Len=0"
"2492","32.740628","34.36.199.114","192.168.2.103","TCP","146","443  >  1570 [ACK] Seq=1367 Ack=1921 Win=268032 Len=0"
"2513","32.749579","34.36.199.114","192.168.2.103","TCP","154","443  >  1567 [ACK] Seq=1367 Ack=1943 Win=268032 Len=0"
"2514","32.749680","34.36.199.114","192.168.2.103","TCP","154","443  >  1564 [ACK] Seq=1475 Ack=1968 Win=268032 Len=0"
"2557","32.766308","34.36.199.114","192.168.2.103","TCP","146","443  >  1565 [ACK] Seq=1568 Ack=2247 Win=267776 Len=0"
"2611","32.782796","34.36.199.114","192.168.2.103","TCP","146","[TCP Previous segment not captured] 443  >  1572 [ACK] Seq=1552 Ack=2304 Win=267776 Len=0"
"2724","32.822867","34.36.199.114","192.168.2.103","TCP","146","443  >  1563 [ACK] Seq=2030 Ack=2986 Win=267264 Len=0"
"2726","32.823749","34.36.199.114","192.168.2.103","TCP","146","443  >  1567 [FIN, ACK] Seq=1922 Ack=2628 Win=267520 Len=0"
"2762","32.833411","192.168.2.103","34.36.199.114","TCP","146","1572  >  443 [FIN, ACK] Seq=2640 Ack=1922 Win=65792 Len=0"
"2826","32.852902","192.168.2.103","34.36.199.114","TCP","146","[TCP Dup ACK 2823#1] 1569  >  443 [ACK] Seq=2982 Ack=2108 Win=65792 Len=0"
"2967","34.250888","157.240.26.35","192.168.2.103","TCP","1386","443  >  1577 [PSH, ACK] Seq=1241 Ack=342 Win=66816 Len=1240 [TCP PDU reassembled in 2969]"
"2971","34.251950","157.240.26.35","192.168.2.103","TCP","1394","443  >  1576 [PSH, ACK] Seq=1241 Ack=342 Win=66816 Len=1240 [TCP PDU reassembled in 2972]"
"2974","34.251964","157.240.26.35","192.168.2.103","TCP","1394","443  >  1574 [PSH, ACK] Seq=1241 Ack=342 Win=66816 Len=1240 [TCP PDU reassembled in 2975]"
"3043","34.372447","157.240.26.35","192.168.2.103","TCP","1394","443  >  1575 [ACK] Seq=3226 Ack=596 Win=67840 Len=1240 [TCP PDU reassembled in 3044]"
"3049","34.372476","157.240.26.35","192.168.2.103","TCP","1394","443  >  1576 [ACK] Seq=3226 Ack=601 Win=67840 Len=1240 [TCP PDU reassembled in 3050]"
"3123","34.380728","157.240.26.35","192.168.2.103","TCP","1394","443  >  1577 [ACK] Seq=20284 Ack=601 Win=67840 Len=1240 [TCP PDU reassembled in 3129]"
"3372","37.922539","20.59.87.226","192.168.2.103","TCP","158","[TCP Dup ACK 3371#1] 443  >  1083 [ACK] Seq=1 Ack=2 Win=7837 Len=0 SLE=1 SRE=2"
"3501","41.505755","142.251.32.10","192.168.2.103","TCP","146","[TCP Dup ACK 3500#1] 443  >  1584 [ACK] Seq=5325 Ack=4295 Win=266240 Len=0"
"3730","49.106357","192.168.2.103","142.251.32.10","TCP","146","[TCP Dup ACK 3727#1] 1584  >  443 [ACK] Seq=6228 Ack=6576 Win=65536 Len=0"
"3916","53.588925","20.190.157.1","192.168.2.103","TCP","158","[TCP Dup ACK 3912#2] 443  >  1587 [ACK] Seq=4007 Ack=7423 Win=16386 Len=0 SLE=3212 SRE=4452"
"3921","53.614967","20.190.157.1","192.168.2.103","TCP","158","[TCP Dup ACK 3912#5] 443  >  1587 [ACK] Seq=4007 Ack=7423 Win=16386 Len=0 SLE=5692 SRE=6492"
"3960","53.628378","20.190.157.1","192.168.2.103","TCP","1394","[TCP Out-Of-Order] 443  >  1587 [ACK] Seq=16407 Ack=7423 Win=16386 Len=1240"
"3961","53.628389","20.190.157.1","192.168.2.103","TCP","1394","443  >  1587 [ACK] Seq=18887 Ack=7423 Win=16386 Len=1240"
"4007","54.253195","23.96.180.189","192.168.2.103","TCP","1386","443  >  1588 [ACK] Seq=1 Ack=306 Win=262400 Len=1240 [TCP PDU reassembled in 4017]"
"4118","54.388266","142.251.32.10","192.168.2.103","TCP","146","443  >  1589 [ACK] Seq=4405 Ack=429 Win=269568 Len=0"
"4135","54.391955","205.213.114.136","192.168.2.103","TCP","158","[TCP Out-Of-Order] 443  >  1590 [SYN, ACK] Seq=0 Ack=1 Win=64240 Len=0 MSS=1384 SACK_PERM WS=128"
"4153","54.407891","205.213.114.136","192.168.2.103","TCP","146","443  >  1591 [ACK] Seq=256 Ack=825 Win=64128 Len=0"
"4178","54.415044","205.213.114.136","192.168.2.103","TCP","441","[TCP Out-Of-Order] 443  >  1590 [PSH, ACK] Seq=2452 Ack=521 Win=64128 Len=287"
"4216","54.505062","13.107.5.88","192.168.2.103","TCP","158","443  >  1592 [SYN, ACK] Seq=0 Ack=1 Win=65535 Len=0 MSS=1440 WS=256 SACK_PERM"
"4279","54.691790","192.168.2.103","23.96.180.189","TCP","146","1588  >  443 [RST, ACK] Seq=3203 Ack=11472 Win=0 Len=0"
"4328","54.794339","192.168.2.103","142.251.32.10","TCP","146","[TCP Dup ACK 4324#1] 1589  >  443 [ACK] Seq=1003 Ack=19109 Win=65536 Len=0"
"4361","54.800926","192.168.2.103","142.251.32.10","TCP","146","[TCP Dup ACK 4358#1] 1589  >  443 [ACK] Seq=1003 Ack=30269 Win=65536 Len=0"
"4417","54.813980","142.251.32.10","192.168.2.103","TCP","1394","[TCP Out-Of-Order] 443  >  1589 [ACK] Seq=58789 Ack=1003 Win=269056 Len=1240"
"4418","54.813985","142.251.32.10","192.168.2.103","TCP","1394","[TCP Out-Of-Order] 443  >  1589 [ACK] Seq=60029 Ack=1003 Win=269056 Len=1240"
"4438","54.823169","142.251.32.10","192.168.2.103","TCP","1394","443  >  1589 [ACK] Seq=71189 Ack=1003 Win=269056 Len=1240"
"4499","54.833884","142.251.32.10","192.168.2.103","TCP","1394","[TCP Out-Of-Order] 443  >  1589 [PSH, ACK] Seq=99709 Ack=1003 Win=269056 Len=1240"
"4500","54.833889","142.251.32.10","192.168.2.103","TCP","1394","[TCP Out-Of-Order] 443  >  1589 [ACK] Seq=103429 Ack=1003 Win=269056 Len=1240"
"4501","54.833893","142.251.32.10","192.168.2.103","TCP","1394","[TCP Out-Of-Order] 443  >  1589 [PSH, ACK] Seq=104669 Ack=1003 Win=269056 Len=1240"
"4503","54.835660","142.251.32.10","192.168.2.103","TCP","1394","[TCP Out-Of-Order] 443  >  1589 [ACK] Seq=105909 Ack=1003 Win=269056 Len=1240"
"4504","54.835664","142.251.32.10","192.168.2.103","TCP","1394","[TCP Out-Of-Order] 443  >  1589 [ACK] Seq=107149 Ack=1003 Win=269056 Len=1240"
"4517","54.837620","142.251.32.10","192.168.2.103","TCP","1394","[TCP Out-Of-Order] 443  >  1589 [ACK] Seq=120789 Ack=1003 Win=269056 Len=1240"
"4554","54.851376","142.251.32.10","192.168.2.103","TCP","1394","[TCP Out-Of-Order] 443  >  1589 [ACK] Seq=129469 Ack=1003 Win=269056 Len=1240"
"4556","54.851381","142.251.32.10","192.168.2.103","TCP","1394","[TCP Out-Of-Order] 443  >  1589 [ACK] Seq=133189 Ack=1003 Win=269056 Len=1240"
"4567","54.855009","142.251.32.10","192.168.2.103","TCP","1394","[TCP Out-Of-Order] 443  >  1589 [PSH, ACK] Seq=130709 Ack=1003 Win=269056 Len=1240"
"4568","54.855012","142.251.32.10","192.168.2.103","TCP","1394","[TCP Out-Of-Order] 443  >  1589 [ACK] Seq=134429 Ack=1003 Win=269056 Len=1240"
"4569","54.855015","142.251.32.10","192.168.2.103","TCP","1394","[TCP Out-Of-Order] 443  >  1589 [ACK] Seq=135669 Ack=1003 Win=269056 Len=1240"
"4595","54.858239","142.251.32.10","192.168.2.103","TCP","1394","443  >  1589 [ACK] Seq=162949 Ack=1003 Win=269056 Len=1240"
"4629","54.869725","142.251.32.10","192.168.2.103","TCP","1394","[TCP Out-Of-Order] 443  >  1589 [ACK] Seq=175165 Ack=1003 Win=269056 Len=1240"
"4630","54.869729","142.251.32.10","192.168.2.103","TCP","1394","[TCP Out-Of-Order] 443  >  1589 [ACK] Seq=176405 Ack=1003 Win=269056 Len=1240"
"4632","54.869737","142.251.32.10","192.168.2.103","TCP","1394","443  >  1589 [PSH, ACK] Seq=178885 Ack=1003 Win=269056 Len=1240"
"4651","54.879331","142.251.32.10","192.168.2.103","TCP","1394","[TCP Out-Of-Order] 443  >  1589 [ACK] Seq=192525 Ack=1003 Win=269056 Len=1240"
"4652","54.879333","142.251.32.10","192.168.2.103","TCP","1394","[TCP Out-Of-Order] 443  >  1589 [ACK] Seq=193765 Ack=1003 Win=269056 Len=1240"
"4654","54.879339","142.251.32.10","192.168.2.103","TCP","1394","443  >  1589 [PSH, ACK] Seq=196245 Ack=1003 Win=269056 Len=1240"
"4655","54.879342","142.251.32.10","192.168.2.103","TCP","1394","443  >  1589 [ACK] Seq=197485 Ack=1003 Win=269056 Len=1240"
"4656","54.879352","142.251.32.10","192.168.2.103","TCP","1394","443  >  1589 [ACK] Seq=198725 Ack=1003 Win=269056 Len=1240"
"4658","54.883330","142.251.32.10","192.168.2.103","TCP","1394","[TCP Out-Of-Order] 443  >  1589 [ACK] Seq=182605 Ack=1003 Win=269056 Len=1240"
"4659","54.883333","142.251.32.10","192.168.2.103","TCP","1394","[TCP Out-Of-Order] 443  >  1589 [ACK] Seq=185085 Ack=1003 Win=269056 Len=1240"
"4660","54.883335","142.251.32.10","192.168.2.103","TCP","1394","[TCP Out-Of-Order] 443  >  1589 [ACK] Seq=186325 Ack=1003 Win=269056 Len=1240"
"4662","54.883339","23.47.72.8","192.168.2.103","TCP","166","443  >  1594 [SYN, ACK] Seq=0 Ack=1 Win=64240 Len=0 MSS=1384 SACK_PERM WS=128"
"4664","54.883345","142.251.32.10","192.168.2.103","TCP","1394","[TCP Out-Of-Order] 443  >  1589 [ACK] Seq=190045 Ack=1003 Win=269056 Len=1240"
"4680","54.887555","142.251.32.10","192.168.2.103","TCP","1394","[TCP Out-Of-Order] 443  >  1589 [PSH, ACK] Seq=204925 Ack=1003 Win=269056 Len=1240"
"4683","54.887563","142.251.32.10","192.168.2.103","TCP","1394","[TCP Out-Of-Order] 443  >  1589 [ACK] Seq=199965 Ack=1003 Win=269056 Len=1240"
"4729","54.895534","142.251.32.10","192.168.2.103","TCP","1394","[TCP Out-Of-Order] 443  >  1589 [ACK] Seq=234685 Ack=1003 Win=269056 Len=1240"
"4730","54.895537","142.251.32.10","192.168.2.103","TCP","1394","443  >  1589 [ACK] Seq=238405 Ack=1003 Win=269056 Len=1240"
"4748","54.900458","142.251.32.10","192.168.2.103","TCP","1394","[TCP Out-Of-Order] 443  >  1589 [PSH, ACK] Seq=239645 Ack=1003 Win=269056 Len=1240"
"4749","54.900462","142.251.32.10","192.168.2.103","TCP","1394","[TCP Out-Of-Order] 443  >  1589 [ACK] Seq=243365 Ack=1003 Win=269056 Len=1240"
"4750","54.900466","142.251.32.10","192.168.2.103","TCP","1394","[TCP Out-Of-Order] 443  >  1589 [ACK] Seq=244605 Ack=1003 Win=269056 Len=1240"
"4785","54.907910","142.251.32.10","192.168.2.103","TCP","1394","[TCP Out-Of-Order] 443  >  1589 [ACK] Seq=278085 Ack=1003 Win=269056 Len=1240"
"4790","54.907932","142.251.32.10","192.168.2.103","TCP","1394","[TCP Out-Of-Order] 443  >  1589 [ACK] Seq=269405 Ack=1003 Win=269056 Len=1240"
"4792","54.909601","142.251.32.10","192.168.2.103","TCP","1394","[TCP Out-Of-Order] 443  >  1589 [ACK] Seq=270645 Ack=1003 Win=269056 Len=1240"
"4793","54.909605","142.251.32.10","192.168.2.103","TCP","1394","[TCP Out-Of-Order] 443  >  1589 [ACK] Seq=271885 Ack=1003 Win=269056 Len=1240"
"4795","54.909613","142.251.32.10","192.168.2.103","TCP","1394","[TCP Out-Of-Order] 443  >  1589 [PSH, ACK] Seq=274365 Ack=1003 Win=269056 Len=1240"
"4807","54.911551","142.251.32.10","192.168.2.103","TCP","1394","[TCP Out-Of-Order] 443  >  1589 [ACK] Seq=275605 Ack=1003 Win=269056 Len=1240"
"4833","54.921731","142.251.32.10","192.168.2.103","TCP","1394","[TCP Out-Of-Order] 443  >  1589 [PSH, ACK] Seq=299165 Ack=1003 Win=269056 Len=1240"
"4834","54.921736","142.251.32.10","192.168.2.103","TCP","1394","[TCP Out-Of-Order] 443  >  1589 [ACK] Seq=300405 Ack=1003 Win=269056 Len=1240"
"4855","54.927377","142.251.32.10","192.168.2.103","TCP","1394","[TCP Out-Of-Order] 443  >  1589 [PSH, ACK] Seq=290485 Ack=1003 Win=269056 Len=1240"
"4856","54.927382","142.251.32.10","192.168.2.103","TCP","1394","[TCP Out-Of-Order] 443  >  1589 [ACK] Seq=294205 Ack=1003 Win=269056 Len=1240"
"4857","54.927387","142.251.32.10","192.168.2.103","TCP","1394","[TCP Out-Of-Order] 443  >  1589 [ACK] Seq=295445 Ack=1003 Win=269056 Len=1240"
"4932","54.944744","142.251.32.10","192.168.2.103","TCP","1394","443  >  1589 [ACK] Seq=358685 Ack=1003 Win=269056 Len=1240"
"4933","54.944748","142.251.32.10","192.168.2.103","TCP","1394","443  >  1589 [ACK] Seq=359925 Ack=1003 Win=269056 Len=1240"
"4934","54.944753","142.251.32.10","192.168.2.103","TCP","1394","443  >  1589 [ACK] Seq=361165 Ack=1003 Win=269056 Len=1240"
"4935","54.944757","142.251.32.10","192.168.2.103","TCP","1394","443  >  1589 [ACK] Seq=362405 Ack=1003 Win=269056 Len=1240"
"4936","54.944761","142.251.32.10","192.168.2.103","TCP","1394","443  >  1589 [ACK] Seq=363645 Ack=1003 Win=269056 Len=1240"
"4937","54.944766","142.251.32.10","192.168.2.103","TCP","1394","443  >  1589 [PSH, ACK] Seq=364885 Ack=1003 Win=269056 Len=1240"
"4938","54.944770","142.251.32.10","192.168.2.103","TCP","1394","443  >  1589 [ACK] Seq=366125 Ack=1003 Win=269056 Len=1240"
"4944","54.946629","142.251.32.10","192.168.2.103","TCP","1394","[TCP Out-Of-Order] 443  >  1589 [PSH, ACK] Seq=356205 Ack=1003 Win=269056 Len=1240"
"5008","54.962261","142.251.32.10","192.168.2.103","TCP","1394","443  >  1589 [PSH, ACK] Seq=414485 Ack=1003 Win=269056 Len=1240"
"5010","54.962269","142.251.32.10","192.168.2.103","TCP","1394","443  >  1589 [ACK] Seq=415725 Ack=1003 Win=269056 Len=1240"
"5011","54.962273","142.251.32.10","192.168.2.103","TCP","1394","443  >  1589 [PSH, ACK] Seq=416965 Ack=1003 Win=269056 Len=1240"
"5012","54.962277","142.251.32.10","192.168.2.103","TCP","1394","443  >  1589 [ACK] Seq=418205 Ack=1003 Win=269056 Len=1240"
"5013","54.962281","142.251.32.10","192.168.2.103","TCP","1394","443  >  1589 [PSH, ACK] Seq=419445 Ack=1003 Win=269056 Len=1240"
"5111","54.982182","142.251.32.10","192.168.2.103","TCP","1394","[TCP Out-Of-Order] 443  >  1589 [ACK] Seq=462845 Ack=1003 Win=269056 Len=1240"
"5112","54.982186","142.251.32.10","192.168.2.103","TCP","1394","[TCP Out-Of-Order] 443  >  1589 [PSH, ACK] Seq=464085 Ack=1003 Win=269056 Len=1240"
"5114","54.982194","142.251.32.10","192.168.2.103","TCP","1394","[TCP Out-Of-Order] 443  >  1589 [PSH, ACK] Seq=466565 Ack=1003 Win=269056 Len=1240"
"5115","54.982198","142.251.32.10","192.168.2.103","TCP","1394","443  >  1589 [PSH, ACK] Seq=469045 Ack=1003 Win=269056 Len=1240"
"5176","54.992105","142.251.32.10","192.168.2.103","TCP","1394","[TCP Out-Of-Order] 443  >  1589 [PSH, ACK] Seq=488885 Ack=1003 Win=269056 Len=1240"
"5177","54.992109","142.251.32.10","192.168.2.103","TCP","1394","[TCP Out-Of-Order] 443  >  1589 [ACK] Seq=490125 Ack=1003 Win=269056 Len=1240"
"5206","55.001462","142.251.32.10","192.168.2.103","TCP","1394","[TCP Out-Of-Order] 443  >  1589 [PSH, ACK] Seq=501285 Ack=1003 Win=269056 Len=1240"
"5208","55.001470","142.251.32.10","192.168.2.103","TCP","1394","[TCP Out-Of-Order] 443  >  1589 [ACK] Seq=505005 Ack=1003 Win=269056 Len=1240"
"5209","55.001474","142.251.32.10","192.168.2.103","TCP","1394","[TCP Out-Of-Order] 443  >  1589 [PSH, ACK] Seq=506245 Ack=1003 Win=269056 Len=1240"
"5251","55.013712","142.251.32.10","192.168.2.103","TCP","1394","[TCP Out-Of-Order] 443  >  1589 [PSH, ACK] Seq=528565 Ack=1003 Win=269056 Len=1240"
"5265","55.015765","142.251.32.10","192.168.2.103","TCP","1394","[TCP Out-Of-Order] 443  >  1589 [ACK] Seq=532285 Ack=1003 Win=269056 Len=1240"
"5277","55.023785","142.251.32.10","192.168.2.103","TCP","1394","[TCP Out-Of-Order] 443  >  1589 [ACK] Seq=529805 Ack=1003 Win=269056 Len=1240"
"5279","55.023790","142.251.32.10","192.168.2.103","TCP","1394","[TCP Out-Of-Order] 443  >  1589 [ACK] Seq=544685 Ack=1003 Win=269056 Len=1240"
"5298","55.027672","142.251.32.10","192.168.2.103","TCP","1394","443  >  1589 [PSH, ACK] Seq=565765 Ack=1003 Win=269056 Len=1240 [TCP PDU reassembled in 5421]"
"5299","55.027675","142.251.32.10","192.168.2.103","TCP","1394","443  >  1589 [ACK] Seq=567005 Ack=1003 Win=269056 Len=1240 [TCP PDU reassembled in 5421]"
"5304","55.029065","142.251.32.10","192.168.2.103","TCP","1394","[TCP Out-Of-Order] 443  >  1589 [PSH, ACK] Seq=543445 Ack=1003 Win=269056 Len=1240"
"5310","55.030625","142.251.32.10","192.168.2.103","TCP","1394","[TCP Out-Of-Order] 443  >  1589 [PSH, ACK] Seq=545925 Ack=1003 Win=269056 Len=1240"
"5311","55.030630","142.251.32.10","192.168.2.103","TCP","1394","[TCP Out-Of-Order] 443  >  1589 [PSH, ACK] Seq=555845 Ack=1003 Win=269056 Len=1240"
"5312","55.030634","142.251.32.10","192.168.2.103","TCP","1394","[TCP Out-Of-Order] 443  >  1589 [ACK] Seq=557085 Ack=1003 Win=269056 Len=1240"
"5313","55.030638","142.251.32.10","192.168.2.103","TCP","1394","[TCP Out-Of-Order] 443  >  1589 [PSH, ACK] Seq=558325 Ack=1003 Win=269056 Len=1240"
"5346","55.043265","142.251.32.10","192.168.2.103","TCP","1394","443  >  1589 [PSH, ACK] Seq=583125 Ack=1003 Win=269056 Len=1240 [TCP PDU reassembled in 5421]"
"5347","55.043267","142.251.32.10","192.168.2.103","TCP","1394","443  >  1589 [ACK] Seq=584365 Ack=1003 Win=269056 Len=1240 [TCP PDU reassembled in 5421]"
"5348","55.043269","142.251.32.10","192.168.2.103","TCP","1394","443  >  1589 [PSH, ACK] Seq=585605 Ack=1003 Win=269056 Len=1240 [TCP PDU reassembled in 5421]"
"5349","55.043271","142.251.32.10","192.168.2.103","TCP","1394","443  >  1589 [ACK] Seq=586845 Ack=1003 Win=269056 Len=1240 [TCP PDU reassembled in 5421]"
"5351","55.043275","142.251.32.10","192.168.2.103","TCP","1394","[TCP Previous segment not captured] 443  >  1589 [ACK] Seq=589325 Ack=1003 Win=269056 Len=1240 [TCP PDU reassembled in 5421]"
"5360","55.045531","142.251.32.10","192.168.2.103","TCP","1394","[TCP Out-Of-Order] 443  >  1589 [PSH, ACK] Seq=588085 Ack=1003 Win=269056 Len=1240 [TCP PDU reassembled in 5421]"
"5361","55.045535","142.251.32.10","192.168.2.103","TCP","1394","443  >  1589 [PSH, ACK] Seq=590565 Ack=1003 Win=269056 Len=1240 [TCP PDU reassembled in 5421]"
"5409","55.055863","142.251.32.10","192.168.2.103","TCP","1394","[TCP Out-Of-Order] 443  >  1589 [PSH, ACK] Seq=617845 Ack=1003 Win=269056 Len=1240 [TCP PDU reassembled in 5421]"
"5412","55.055876","142.251.32.10","192.168.2.103","TCP","1394","443  >  1589 [ACK] Seq=621565 Ack=1003 Win=269056 Len=1240 [TCP PDU reassembled in 5421]"
"5445","55.063373","142.251.32.10","192.168.2.103","TCP","1394","[TCP Out-Of-Order] 443  >  1589 [PSH, ACK] Seq=627765 Ack=1003 Win=269056 Len=1240"
"5446","55.063376","142.251.32.10","192.168.2.103","TCP","1394","[TCP Out-Of-Order] 443  >  1589 [ACK] Seq=629005 Ack=1003 Win=269056 Len=1240"
"5462","55.067302","142.251.32.10","192.168.2.103","TCP","1394","[TCP Out-Of-Order] 443  >  1589 [PSH, ACK] Seq=630245 Ack=1003 Win=269056 Len=1240"
"5463","55.067304","142.251.32.10","192.168.2.103","TCP","1394","[TCP Out-Of-Order] 443  >  1589 [PSH, ACK] Seq=640165 Ack=1003 Win=269056 Len=1240"
"5464","55.067306","142.251.32.10","192.168.2.103","TCP","1394","[TCP Out-Of-Order] 443  >  1589 [ACK] Seq=641405 Ack=1003 Win=269056 Len=1240"
"5485","55.071371","142.251.32.10","192.168.2.103","TCP","1394","[TCP Out-Of-Order] 443  >  1589 [PSH, ACK] Seq=652565 Ack=1003 Win=269056 Len=1240"
"5498","55.075336","142.251.32.10","192.168.2.103","TCP","1394","[TCP Out-Of-Order] 443  >  1589 [PSH, ACK] Seq=642645 Ack=1003 Win=269056 Len=1240"
"5499","55.075338","142.251.32.10","192.168.2.103","TCP","1394","[TCP Out-Of-Order] 443  >  1589 [PSH, ACK] Seq=655045 Ack=1003 Win=269056 Len=1240"
"5500","55.075341","142.251.32.10","192.168.2.103","TCP","1394","[TCP Out-Of-Order] 443  >  1589 [PSH, ACK] Seq=664965 Ack=1003 Win=269056 Len=1240"
"5538","55.086858","142.251.32.10","192.168.2.103","TCP","1394","[TCP Out-Of-Order] 443  >  1589 [PSH, ACK] Seq=692245 Ack=1003 Win=269056 Len=1240"
"5550","55.088401","192.168.2.103","142.251.32.10","TCP","146","1589  >  443 [ACK] Seq=1003 Ack=707125 Win=131328 Len=0"
"5575","55.095921","192.168.2.103","142.251.32.10","TCP","146","[TCP Dup ACK 5572#1] 1589  >  443 [ACK] Seq=1003 Ack=717045 Win=131328 Len=0"
"5590","55.099927","192.168.2.103","142.251.32.10","TCP","146","[TCP Dup ACK 5572#2] 1589  >  443 [ACK] Seq=1003 Ack=717045 Win=131328 Len=0"
"5597","55.101772","142.251.32.10","192.168.2.103","TCP","1394","443  >  1589 [ACK] Seq=740605 Ack=1003 Win=269056 Len=1240 [TCP PDU reassembled in 5629]"
"5598","55.101776","142.251.32.10","192.168.2.103","TCP","1394","443  >  1589 [PSH, ACK] Seq=741845 Ack=1003 Win=269056 Len=1240 [TCP PDU reassembled in 5629]"
"5599","55.101781","142.251.32.10","192.168.2.103","TCP","1394","[TCP Out-Of-Order] 443  >  1589 [ACK] Seq=725725 Ack=1003 Win=269056 Len=1240 [TCP PDU reassembled in 5629]"
"5600","55.101785","142.251.32.10","192.168.2.103","TCP","1394","[TCP Out-Of-Order] 443  >  1589 [PSH, ACK] Seq=726965 Ack=1003 Win=269056 Len=1240 [TCP PDU reassembled in 5629]"
"5601","55.101789","142.251.32.10","192.168.2.103","TCP","1394","[TCP Out-Of-Order] 443  >  1589 [PSH, ACK] Seq=729445 Ack=1003 Win=269056 Len=1240 [TCP PDU reassembled in 5629]"
"5602","55.101793","142.251.32.10","192.168.2.103","TCP","1394","[TCP Out-Of-Order] 443  >  1589 [ACK] Seq=730685 Ack=1003 Win=269056 Len=1240 [TCP PDU reassembled in 5629]"
"5604","55.103177","142.251.32.10","192.168.2.103","TCP","1394","[TCP Out-Of-Order] 443  >  1589 [PSH, ACK] Seq=731925 Ack=1003 Win=269056 Len=1240 [TCP PDU reassembled in 5629]"
"5605","55.103180","142.251.32.10","192.168.2.103","TCP","1394","[TCP Out-Of-Order] 443  >  1589 [ACK] Seq=733165 Ack=1003 Win=269056 Len=1240 [TCP PDU reassembled in 5629]"
"5621","55.106108","192.168.2.103","142.251.32.10","TCP","146","[TCP Dup ACK 5617#1] 1589  >  443 [ACK] Seq=1003 Ack=748045 Win=131328 Len=0"
"5623","55.107526","142.251.32.10","192.168.2.103","TCP","1394","443  >  1589 [ACK] Seq=748045 Ack=1003 Win=269056 Len=1240 [TCP PDU reassembled in 5629]"
"5625","55.107530","142.251.32.10","192.168.2.103","TCP","1394","[TCP Previous segment not captured] 443  >  1589 [ACK] Seq=750525 Ack=1003 Win=269056 Len=1240 [TCP PDU reassembled in 5629]"
"5680","55.117053","192.168.2.103","142.251.32.10","TCP","146","[TCP Dup ACK 5677#1] 1589  >  443 [ACK] Seq=1003 Ack=785245 Win=131328 Len=0"
"5682","55.119235","142.251.32.10","192.168.2.103","TCP","1394","[TCP Out-Of-Order] 443  >  1589 [ACK] Seq=785245 Ack=1003 Win=269056 Len=1240"
"5683","55.119237","142.251.32.10","192.168.2.103","TCP","1394","[TCP Out-Of-Order] 443  >  1589 [PSH, ACK] Seq=786485 Ack=1003 Win=269056 Len=1240"
"5684","55.119240","142.251.32.10","192.168.2.103","TCP","1394","[TCP Out-Of-Order] 443  >  1589 [ACK] Seq=787725 Ack=1003 Win=269056 Len=1240"
"5685","55.119242","142.251.32.10","192.168.2.103","TCP","1394","[TCP Out-Of-Order] 443  >  1589 [PSH, ACK] Seq=788965 Ack=1003 Win=269056 Len=1240"
"5686","55.119244","142.251.32.10","192.168.2.103","TCP","1394","[TCP Out-Of-Order] 443  >  1589 [ACK] Seq=790205 Ack=1003 Win=269056 Len=1240"
"5712","55.130508","142.251.32.10","192.168.2.103","TCP","1394","[TCP Out-Of-Order] 443  >  1589 [PSH, ACK] Seq=801365 Ack=1003 Win=269056 Len=1240"
"5713","55.130512","142.251.32.10","192.168.2.103","TCP","1394","[TCP Out-Of-Order] 443  >  1589 [ACK] Seq=802605 Ack=1003 Win=269056 Len=1240"
"5714","55.130516","142.251.32.10","192.168.2.103","TCP","1394","[TCP Out-Of-Order] 443  >  1589 [ACK] Seq=805085 Ack=1003 Win=269056 Len=1240"
"5727","55.134037","142.251.32.10","192.168.2.103","TCP","1394","443  >  1589 [ACK] Seq=819965 Ack=1003 Win=269056 Len=1240"
"5729","55.134045","142.251.32.10","192.168.2.103","TCP","1394","443  >  1589 [ACK] Seq=822445 Ack=1003 Win=269056 Len=1240"
"5745","55.139646","142.251.32.10","192.168.2.103","TCP","1394","443  >  1589 [PSH, ACK] Seq=823685 Ack=1003 Win=269056 Len=1240"
"5746","55.139654","142.251.32.10","192.168.2.103","TCP","1394","443  >  1589 [ACK] Seq=824925 Ack=1003 Win=269056 Len=1240"
"5768","55.143780","142.251.32.10","192.168.2.103","TCP","1394","[TCP Out-Of-Order] 443  >  1589 [PSH, ACK] Seq=826165 Ack=1003 Win=269056 Len=1240"
"5780","55.147350","142.251.32.10","192.168.2.103","TCP","1394","443  >  1589 [ACK] Seq=832365 Ack=1003 Win=269056 Len=1240"
"5781","55.147353","142.251.32.10","192.168.2.103","TCP","1394","443  >  1589 [PSH, ACK] Seq=833605 Ack=1003 Win=269056 Len=1240"
"5799","55.151446","142.251.32.10","192.168.2.103","TCP","1394","[TCP Out-Of-Order] 443  >  1589 [ACK] Seq=834845 Ack=1003 Win=269056 Len=1240"
"5800","55.151448","142.251.32.10","192.168.2.103","TCP","1394","[TCP Out-Of-Order] 443  >  1589 [PSH, ACK] Seq=838565 Ack=1003 Win=269056 Len=1240"
"5821","55.158096","142.251.32.10","192.168.2.103","TCP","1394","[TCP Out-Of-Order] 443  >  1589 [PSH, ACK] Seq=855925 Ack=1003 Win=269056 Len=1240"
"5822","55.158101","142.251.32.10","192.168.2.103","TCP","1394","[TCP Out-Of-Order] 443  >  1589 [ACK] Seq=857165 Ack=1003 Win=269056 Len=1240"
"5852","55.165944","142.251.32.10","192.168.2.103","TCP","1394","[TCP Out-Of-Order] 443  >  1589 [PSH, ACK] Seq=875765 Ack=1003 Win=269056 Len=1240 [TCP PDU reassembled in 5878]"
"5855","55.165957","142.251.32.10","192.168.2.103","TCP","1394","443  >  1589 [ACK] Seq=879485 Ack=1003 Win=269056 Len=1240 [TCP PDU reassembled in 5878]"
"5856","55.165961","142.251.32.10","192.168.2.103","TCP","1394","443  >  1589 [PSH, ACK] Seq=880725 Ack=1003 Win=269056 Len=1240 [TCP PDU reassembled in 5878]"
"5857","55.165965","142.251.32.10","192.168.2.103","TCP","1394","443  >  1589 [ACK] Seq=881965 Ack=1003 Win=269056 Len=1240 [TCP PDU reassembled in 5878]"
"5913","55.177339","142.251.32.10","192.168.2.103","TCP","1394","[TCP Out-Of-Order] 443  >  1589 [ACK] Seq=906765 Ack=1003 Win=269056 Len=1240"
"5914","55.177343","142.251.32.10","192.168.2.103","TCP","1394","[TCP Out-Of-Order] 443  >  1589 [ACK] Seq=909245 Ack=1003 Win=269056 Len=1240"
"5915","55.177347","142.251.32.10","192.168.2.103","TCP","1394","[TCP Out-Of-Order] 443  >  1589 [PSH, ACK] Seq=910485 Ack=1003 Win=269056 Len=1240"
"5916","55.177350","142.251.32.10","192.168.2.103","TCP","1394","[TCP Out-Of-Order] 443  >  1589 [ACK] Seq=911725 Ack=1003 Win=269056 Len=1240"
"5935","55.181316","142.251.32.10","192.168.2.103","TCP","1394","443  >  1589 [ACK] Seq=931565 Ack=1003 Win=269056 Len=1240"
"5957","55.185369","142.251.32.10","192.168.2.103","TCP","1394","[TCP Out-Of-Order] 443  >  1589 [ACK] Seq=936525 Ack=1003 Win=269056 Len=1240"
"5958","55.185373","142.251.32.10","192.168.2.103","TCP","1394","[TCP Out-Of-Order] 443  >  1589 [PSH, ACK] Seq=940245 Ack=1003 Win=269056 Len=1240"
"6001","55.193654","142.251.32.10","192.168.2.103","TCP","1394","[TCP Out-Of-Order] 443  >  1589 [ACK] Seq=976205 Ack=1003 Win=269056 Len=1240"
"6002","55.193659","142.251.32.10","192.168.2.103","TCP","1394","[TCP Out-Of-Order] 443  >  1589 [PSH, ACK] Seq=977445 Ack=1003 Win=269056 Len=1240"
"6007","55.195509","142.251.32.10","192.168.2.103","TCP","1394","[TCP Out-Of-Order] 443  >  1589 [PSH, ACK] Seq=970005 Ack=1003 Win=269056 Len=1240"
"6052","55.203466","142.251.32.10","192.168.2.103","TCP","1394","[TCP Out-Of-Order] 443  >  1589 [ACK] Seq=1001005 Ack=1003 Win=269056 Len=1240"
"6053","55.203469","142.251.32.10","192.168.2.103","TCP","1394","[TCP Out-Of-Order] 443  >  1589 [PSH, ACK] Seq=1002245 Ack=1003 Win=269056 Len=1240"
"6054","55.203476","142.251.32.10","192.168.2.103","TCP","1394","[TCP Out-Of-Order] 443  >  1589 [PSH, ACK] Seq=1004725 Ack=1003 Win=269056 Len=1240"
"6060","55.207720","142.251.32.10","192.168.2.103","TCP","1394","[TCP Out-Of-Order] 443  >  1589 [ACK] Seq=1005965 Ack=1003 Win=269056 Len=1240"
"6088","55.213327","142.251.32.10","192.168.2.103","TCP","1394","[TCP Out-Of-Order] 443  >  1589 [PSH, ACK] Seq=1024565 Ack=1003 Win=269056 Len=1240"
"6089","55.213332","142.251.32.10","192.168.2.103","TCP","1394","[TCP Out-Of-Order] 443  >  1589 [ACK] Seq=1025805 Ack=1003 Win=269056 Len=1240"
"6090","55.213335","142.251.32.10","192.168.2.103","TCP","1394","[TCP Out-Of-Order] 443  >  1589 [ACK] Seq=1028285 Ack=1003 Win=269056 Len=1240"
"6091","55.213340","142.251.32.10","192.168.2.103","TCP","1394","[TCP Out-Of-Order] 443  >  1589 [PSH, ACK] Seq=1029525 Ack=1003 Win=269056 Len=1240"
"6097","55.215215","142.251.32.10","192.168.2.103","TCP","1394","[TCP Out-Of-Order] 443  >  1589 [ACK] Seq=1030765 Ack=1003 Win=269056 Len=1240"
"6136","55.227894","192.168.2.103","142.251.32.10","TCP","146","1589  >  443 [ACK] Seq=1003 Ack=1051845 Win=131328 Len=0"
"6186","55.239229","142.251.32.10","192.168.2.103","TCP","1394","[TCP Out-Of-Order] 443  >  1589 [PSH, ACK] Seq=1071685 Ack=1003 Win=269056 Len=1240"
"6332","55.279343","142.251.32.10","192.168.2.103","TCP","1394","[TCP Out-Of-Order] 443  >  1589 [PSH, ACK] Seq=1146085 Ack=1003 Win=269056 Len=1240"
"6333","55.279345","142.251.32.10","192.168.2.103","TCP","1394","[TCP Out-Of-Order] 443  >  1589 [PSH, ACK] Seq=1148565 Ack=1003 Win=269056 Len=1240 [TCP PDU reassembled in 6410]"
"6334","55.279347","142.251.32.10","192.168.2.103","TCP","1394","[TCP Out-Of-Order] 443  >  1589 [ACK] Seq=1149805 Ack=1003 Win=269056 Len=1240 [TCP PDU reassembled in 6410]"
"6335","55.279349","142.251.32.10","192.168.2.103","TCP","1394","[TCP Out-Of-Order] 443  >  1589 [PSH, ACK] Seq=1151045 Ack=1003 Win=269056 Len=1240 [TCP PDU reassembled in 6410]"
"6363","55.287567","142.251.32.10","192.168.2.103","TCP","1394","[TCP Out-Of-Order] 443  >  1589 [ACK] Seq=1182045 Ack=1003 Win=269056 Len=1240 [TCP PDU reassembled in 6410]"
