"No.","Time","Source","Destination","Protocol","Length","Info"
"533","15.045554","157.240.26.49","192.168.2.103","TCP","146","[TCP Previous segment not captured] 443  >  1346 [ACK] Seq=213 Ack=1021 Win=67840 Len=0"
"722","16.663801","23.192.220.4","192.168.2.103","TCP","1394","[TCP Previous segment not captured] 443  >  1348 [ACK] Seq=5864 Ack=1127 Win=64128 Len=1240"
"740","16.666442","23.192.220.4","192.168.2.103","TCP","1394","[TCP Previous segment not captured] 443  >  1348 [ACK] Seq=13304 Ack=1127 Win=64128 Len=1240"
"770","16.673383","23.192.220.4","192.168.2.103","TCP","1394","[TCP Previous segment not captured] 443  >  1348 [ACK] Seq=24464 Ack=1158 Win=64128 Len=1240"
"840","16.688093","23.192.220.4","192.168.2.103","TCP","1394","[TCP Previous segment not captured] 443  >  1348 [ACK] Seq=56704 Ack=1158 Win=64128 Len=1240"
"1129","16.989643","157.240.26.49","192.168.2.103","TCP","146","[TCP Previous segment not captured] 443  >  1349 [ACK] Seq=18841 Ack=38254 Win=143616 Len=0"
"1584","19.299240","157.240.26.49","192.168.2.103","TCP","1394","[TCP Previous segment not captured] 443  >  1352 [ACK] Seq=80913 Ack=3976 Win=77056 Len=1240"
"1591","19.301202","157.240.26.49","192.168.2.103","TCP","1394","[TCP Previous segment not captured] 443  >  1352 [ACK] Seq=84633 Ack=3976 Win=77056 Len=1240"
"1641","19.425372","157.240.26.49","192.168.2.103","TCP","1394","[TCP Previous segment not captured] 443  >  1352 [ACK] Seq=107375 Ack=3976 Win=77056 Len=1240"
"1725","19.449297","157.240.26.49","192.168.2.103","TCP","1394","[TCP Previous segment not captured] 443  >  1352 [ACK] Seq=157141 Ack=3976 Win=77056 Len=1240"
"1755","19.457886","157.240.26.49","192.168.2.103","TCP","1394","[TCP Previous segment not captured] 443  >  1352 [ACK] Seq=174151 Ack=3976 Win=77056 Len=1240"
"2258","22.456919","34.36.199.114","192.168.2.103","TCP","146","[TCP Previous segment not captured] 443  >  1364 [ACK] Seq=1166 Ack=1634 Win=268288 Len=0"
"2269","22.459516","34.36.199.114","192.168.2.103","TCP","154","[TCP Previous segment not captured] 443  >  1365 [ACK] Seq=1166 Ack=1627 Win=268288 Len=0"
"2270","22.459519","34.36.199.114","192.168.2.103","TCP","154","[TCP Previous segment not captured] 443  >  1362 [ACK] Seq=1166 Ack=1636 Win=268288 Len=0"
"2466","22.516686","34.36.199.114","192.168.2.103","TCP","146","[TCP Previous segment not captured] 443  >  1358 [ACK] Seq=1753 Ack=2571 Win=267520 Len=0"
"2846","24.069806","157.240.26.35","192.168.2.103","TCP","1386","[TCP Previous segment not captured] 443  >  1366 [ACK] Seq=3227 Ack=596 Win=67840 Len=1240 [TCP PDU reassembled in 2848]"
"3541","44.239277","172.217.4.202","192.168.2.103","TCP","146","[TCP ACKed unseen segment] [TCP Previous segment not captured] 443  >  1373 [ACK] Seq=8475 Ack=13960 Win=257280 Len=0"
"3641","45.952217","192.168.2.103","172.217.4.202","TCP","146","[TCP Previous segment not captured] 1373  >  443 [ACK] Seq=13960 Ack=9108 Win=65536 Len=0"
"3733","45.997482","172.217.4.202","192.168.2.103","TCP","1394","[TCP Previous segment not captured] 443  >  1378 [ACK] Seq=58011 Ack=1003 Win=269056 Len=1240"
"3797","46.008618","172.217.4.202","192.168.2.103","TCP","1394","[TCP Previous segment not captured] 443  >  1378 [ACK] Seq=91491 Ack=1003 Win=269056 Len=1240"
"4031","46.061842","172.217.4.202","192.168.2.103","TCP","1394","[TCP Previous segment not captured] 443  >  1378 [ACK] Seq=246491 Ack=1003 Win=269056 Len=1240"
"4100","46.076664","172.217.4.202","192.168.2.103","TCP","1394","[TCP Previous segment not captured] 443  >  1378 [ACK] Seq=291131 Ack=1003 Win=269056 Len=1240"
"4113","46.080601","172.217.4.202","192.168.2.103","TCP","1394","[TCP Previous segment not captured] 443  >  1378 [ACK] Seq=301051 Ack=1003 Win=269056 Len=1240"
"4269","46.115500","172.217.4.202","192.168.2.103","TCP","1394","[TCP Previous segment not captured] 443  >  1378 [PSH, ACK] Seq=408931 Ack=1003 Win=269056 Len=1240"
"4271","46.115508","172.217.4.202","192.168.2.103","TCP","1394","[TCP Previous segment not captured] 443  >  1378 [ACK] Seq=412651 Ack=1003 Win=269056 Len=1240"
"4283","46.121206","172.217.4.202","192.168.2.103","TCP","1394","[TCP Previous segment not captured] 443  >  1378 [ACK] Seq=421331 Ack=1003 Win=269056 Len=1240"
"4425","46.151955","172.217.4.202","192.168.2.103","TCP","1394","[TCP Previous segment not captured] 443  >  1378 [PSH, ACK] Seq=509371 Ack=1003 Win=269056 Len=1240 [TCP PDU reassembled in 4518]"
"4469","46.159620","172.217.4.202","192.168.2.103","TCP","1394","[TCP Previous segment not captured] 443  >  1378 [ACK] Seq=534171 Ack=1003 Win=269056 Len=1240 [TCP PDU reassembled in 4518]"
"4480","46.165349","172.217.4.202","192.168.2.103","TCP","1394","[TCP Previous segment not captured] 443  >  1378 [ACK] Seq=540371 Ack=1003 Win=269056 Len=1240 [TCP PDU reassembled in 4518]"
"4607","46.193068","172.217.4.202","192.168.2.103","TCP","1394","[TCP Previous segment not captured] 443  >  1378 [ACK] Seq=614771 Ack=1003 Win=269056 Len=1240 [TCP PDU reassembled in 4645]"
"4700","46.213129","172.217.4.202","192.168.2.103","TCP","1394","[TCP Previous segment not captured] 443  >  1378 [PSH, ACK] Seq=669331 Ack=1003 Win=269056 Len=1240 [TCP PDU reassembled in 4762]"
"4707","46.215352","172.217.4.202","192.168.2.103","TCP","1394","[TCP Previous segment not captured] 443  >  1378 [ACK] Seq=671811 Ack=1003 Win=269056 Len=1240 [TCP PDU reassembled in 4762]"
"5025","46.283389","172.217.4.202","192.168.2.103","TCP","1394","[TCP Previous segment not captured] 443  >  1378 [ACK] Seq=880131 Ack=1003 Win=269056 Len=1240"
"5041","46.286869","172.217.4.202","192.168.2.103","TCP","1394","[TCP Previous segment not captured] 443  >  1378 [ACK] Seq=893771 Ack=1003 Win=269056 Len=1240"
"5047","46.286892","172.217.4.202","192.168.2.103","TCP","1394","[TCP Previous segment not captured] 443  >  1378 [ACK] Seq=901211 Ack=1003 Win=269056 Len=1240"
"5175","46.314946","172.217.4.202","192.168.2.103","TCP","1394","[TCP Previous segment not captured] 443  >  1378 [PSH, ACK] Seq=997931 Ack=1003 Win=269056 Len=1240"
"5195","46.324785","172.217.4.202","192.168.2.103","TCP","1394","[TCP Previous segment not captured] 443  >  1378 [PSH, ACK] Seq=1001651 Ack=1003 Win=269056 Len=1240"
"5328","46.354964","172.217.4.202","192.168.2.103","TCP","1394","[TCP Previous segment not captured] 443  >  1378 [ACK] Seq=1078531 Ack=1003 Win=269056 Len=1240"
"5357","46.360957","172.217.4.202","192.168.2.103","TCP","1394","[TCP Previous segment not captured] 443  >  1378 [PSH, ACK] Seq=1102091 Ack=1003 Win=269056 Len=1240 [TCP PDU reassembled in 5417]"
"5429","46.373062","172.217.4.202","192.168.2.103","TCP","1394","[TCP Previous segment not captured] 443  >  1378 [ACK] Seq=1151691 Ack=1003 Win=269056 Len=1240"
"5475","46.381537","172.217.4.202","192.168.2.103","TCP","1394","[TCP Previous segment not captured] 443  >  1378 [ACK] Seq=1176491 Ack=1003 Win=269056 Len=1240"
"5537","46.393833","172.217.4.202","192.168.2.103","TCP","1394","[TCP Previous segment not captured] 443  >  1378 [ACK] Seq=1218651 Ack=1003 Win=269056 Len=1240 [TCP PDU reassembled in 5615]"
"5557","46.397451","172.217.4.202","192.168.2.103","TCP","1394","[TCP Previous segment not captured] 443  >  1378 [ACK] Seq=1228571 Ack=1003 Win=269056 Len=1240 [TCP PDU reassembled in 5615]"
"5576","46.405537","172.217.4.202","192.168.2.103","TCP","1394","[TCP Previous segment not captured] 443  >  1378 [ACK] Seq=1240971 Ack=1003 Win=269056 Len=1240 [TCP PDU reassembled in 5615]"
"5579","46.405548","172.217.4.202","192.168.2.103","TCP","1394","[TCP Previous segment not captured] 443  >  1378 [ACK] Seq=1244691 Ack=1003 Win=269056 Len=1240 [TCP PDU reassembled in 5615]"
"5595","46.409002","172.217.4.202","192.168.2.103","TCP","1394","[TCP Previous segment not captured] 443  >  1378 [ACK] Seq=1250891 Ack=1003 Win=269056 Len=1240 [TCP PDU reassembled in 5615]"
"5767","46.447339","172.217.4.202","192.168.2.103","TCP","1394","[TCP Previous segment not captured] 443  >  1378 [PSH, ACK] Seq=1338931 Ack=1003 Win=269056 Len=1240 [TCP PDU reassembled in 5785]"
"5850","46.463361","172.217.4.202","192.168.2.103","TCP","1394","[TCP Previous segment not captured] 443  >  1378 [ACK] Seq=1397211 Ack=1003 Win=269056 Len=1240"
"5859","46.465355","172.217.4.202","192.168.2.103","TCP","1394","[TCP Previous segment not captured] 443  >  1378 [ACK] Seq=1400931 Ack=1003 Win=269056 Len=1240"
"5863","46.465364","172.217.4.202","192.168.2.103","TCP","1394","[TCP Previous segment not captured] 443  >  1378 [PSH, ACK] Seq=1405891 Ack=1003 Win=269056 Len=1240"
"5880","46.469009","172.217.4.202","192.168.2.103","TCP","1394","[TCP Previous segment not captured] 443  >  1378 [ACK] Seq=1415811 Ack=1003 Win=269056 Len=1240"
"5934","46.479155","172.217.4.202","192.168.2.103","TCP","1394","[TCP Previous segment not captured] 443  >  1378 [ACK] Seq=1445571 Ack=1003 Win=269056 Len=1240 [TCP PDU reassembled in 6000]"
"5968","46.485398","172.217.4.202","192.168.2.103","TCP","1394","[TCP Previous segment not captured] 443  >  1378 [ACK] Seq=1462931 Ack=1003 Win=269056 Len=1240 [TCP PDU reassembled in 6000]"
"5988","46.489160","172.217.4.202","192.168.2.103","TCP","1394","[TCP Previous segment not captured] 443  >  1378 [PSH, ACK] Seq=1472851 Ack=1003 Win=269056 Len=1240 [TCP PDU reassembled in 6000]"
"6736","56.323905","172.217.4.202","192.168.2.103","TCP","1394","[TCP Previous segment not captured] 443  >  1378 [ACK] Seq=1688733 Ack=1577 Win=268544 Len=1240"
"6741","56.327675","172.217.4.202","192.168.2.103","TCP","1394","[TCP Previous segment not captured] 443  >  1378 [PSH, ACK] Seq=1696173 Ack=1577 Win=268544 Len=1240"
"6745","56.327691","172.217.4.202","192.168.2.103","TCP","1394","[TCP Previous segment not captured] 443  >  1378 [PSH, ACK] Seq=1701133 Ack=1577 Win=268544 Len=1240"
"6800","56.343230","172.217.4.202","192.168.2.103","TCP","1394","[TCP Previous segment not captured] 443  >  1378 [ACK] Seq=1724693 Ack=1577 Win=268544 Len=1240"
"6932","56.374338","172.217.4.202","192.168.2.103","TCP","1394","[TCP Previous segment not captured] 443  >  1378 [ACK] Seq=1822653 Ack=1577 Win=268544 Len=1240 [TCP PDU reassembled in 6949]"
"6968","56.381167","172.217.4.202","192.168.2.103","TCP","1394","[TCP Previous segment not captured] 443  >  1378 [PSH, ACK] Seq=1854893 Ack=1577 Win=268544 Len=1240"
"6972","56.381177","172.217.4.202","192.168.2.103","TCP","1394","[TCP Previous segment not captured] 443  >  1378 [PSH, ACK] Seq=1859853 Ack=1577 Win=268544 Len=1240"
"7133","56.418101","172.217.4.202","192.168.2.103","TCP","1394","[TCP Previous segment not captured] 443  >  1378 [ACK] Seq=1952853 Ack=1577 Win=268544 Len=1240 [TCP PDU reassembled in 7201]"
"7175","56.427008","172.217.4.202","192.168.2.103","TCP","1394","[TCP Previous segment not captured] 443  >  1378 [ACK] Seq=1971453 Ack=1577 Win=268544 Len=1240 [TCP PDU reassembled in 7201]"
"7178","56.427020","172.217.4.202","192.168.2.103","TCP","1394","[TCP Previous segment not captured] 443  >  1378 [ACK] Seq=1975173 Ack=1577 Win=268544 Len=1240 [TCP PDU reassembled in 7201]"
"7221","56.439483","172.217.4.202","192.168.2.103","TCP","1394","[TCP Previous segment not captured] 443  >  1378 [ACK] Seq=1996253 Ack=1577 Win=268544 Len=1240 [TCP PDU reassembled in 7298]"
"7381","56.473195","172.217.4.202","192.168.2.103","TCP","1394","[TCP Previous segment not captured] 443  >  1378 [ACK] Seq=2092861 Ack=1577 Win=268544 Len=1240 [TCP PDU reassembled in 7444]"
"7458","56.489469","172.217.4.202","192.168.2.103","TCP","1394","[TCP Previous segment not captured] 443  >  1378 [PSH, ACK] Seq=2128821 Ack=1577 Win=268544 Len=1240 [TCP PDU reassembled in 7566]"
"7468","56.491072","172.217.4.202","192.168.2.103","TCP","1394","[TCP Previous segment not captured] 443  >  1378 [PSH, ACK] Seq=2132541 Ack=1577 Win=268544 Len=1240 [TCP PDU reassembled in 7566]"
"7808","56.565138","172.217.4.202","192.168.2.103","TCP","1394","[TCP Previous segment not captured] 443  >  1378 [ACK] Seq=2334661 Ack=1577 Win=268544 Len=1240 [TCP PDU reassembled in 7834]"
"7816","56.567437","172.217.4.202","192.168.2.103","TCP","1394","[TCP Previous segment not captured] 443  >  1378 [PSH, ACK] Seq=2337141 Ack=1577 Win=268544 Len=1240 [TCP PDU reassembled in 7834]"
"8166","56.637792","172.217.4.202","192.168.2.103","TCP","1394","[TCP Previous segment not captured] 443  >  1378 [PSH, ACK] Seq=2569021 Ack=1577 Win=268544 Len=1240 [TCP PDU reassembled in 8231]"
"8170","56.639411","172.217.4.202","192.168.2.103","TCP","1394","[TCP Previous segment not captured] 443  >  1378 [ACK] Seq=2575221 Ack=1577 Win=268544 Len=1240 [TCP PDU reassembled in 8231]"
"8173","56.639423","172.217.4.202","192.168.2.103","TCP","1394","[TCP Previous segment not captured] 443  >  1378 [ACK] Seq=2578941 Ack=1577 Win=268544 Len=1240 [TCP PDU reassembled in 8231]"
"8301","56.667781","172.217.4.202","192.168.2.103","TCP","1394","[TCP Previous segment not captured] 443  >  1378 [ACK] Seq=2645901 Ack=1577 Win=268544 Len=1240 [TCP PDU reassembled in 8310]"
"8534","56.723267","172.217.4.202","192.168.2.103","TCP","1394","[TCP Previous segment not captured] 443  >  1378 [PSH, ACK] Seq=2792221 Ack=1577 Win=268544 Len=1240 [TCP PDU reassembled in 8609]"
"8583","56.731507","172.217.4.202","192.168.2.103","TCP","1394","[TCP Previous segment not captured] 443  >  1378 [PSH, ACK] Seq=2818261 Ack=1577 Win=268544 Len=1240 [TCP PDU reassembled in 8609]"
"8590","56.733339","172.217.4.202","192.168.2.103","TCP","1394","[TCP Previous segment not captured] 443  >  1378 [ACK] Seq=2823221 Ack=1577 Win=268544 Len=1240 [TCP PDU reassembled in 8609]"
"8705","56.759245","172.217.4.202","192.168.2.103","TCP","1394","[TCP Previous segment not captured] 443  >  1378 [PSH, ACK] Seq=2892661 Ack=1577 Win=268544 Len=1240 [TCP PDU reassembled in 8734]"
"8917","56.805699","172.217.4.202","192.168.2.103","TCP","1394","[TCP Previous segment not captured] 443  >  1378 [ACK] Seq=3009221 Ack=1577 Win=268544 Len=1240 [TCP PDU reassembled in 8963]"
"8925","56.807557","172.217.4.202","192.168.2.103","TCP","1394","[TCP Previous segment not captured] 443  >  1378 [PSH, ACK] Seq=3015421 Ack=1577 Win=268544 Len=1240 [TCP PDU reassembled in 8963]"
"9129","58.457953","172.217.4.202","192.168.2.103","TCP","158","[TCP Previous segment not captured] 443  >  1373 [ACK] Seq=12257 Ack=23625 Win=249344 Len=0 SLE=24865 SRE=25558"
"10128","66.106002","172.217.4.202","192.168.2.103","TCP","1394","[TCP Previous segment not captured] 443  >  1378 [PSH, ACK] Seq=3721867 Ack=2151 Win=268032 Len=1240"
"10999","66.336253","172.217.4.202","192.168.2.103","TCP","1394","[TCP Previous segment not captured] 443  >  1378 [ACK] Seq=4472067 Ack=2151 Win=268032 Len=1240 [TCP PDU reassembled in 11013]"
"11496","75.679703","172.217.4.202","192.168.2.103","TCP","158","[TCP Previous segment not captured] 443  >  1378 [ACK] Seq=4591678 Ack=2151 Win=268032 Len=0 SLE=3391 SRE=4084"
"11941","76.164390","172.217.4.202","192.168.2.103","TCP","1394","[TCP Previous segment not captured] 443  >  1373 [ACK] Seq=323512 Ack=37730 Win=237824 Len=1240 [TCP PDU reassembled in 12001]"
"11949","76.166303","172.217.4.202","192.168.2.103","TCP","1394","[TCP Previous segment not captured] 443  >  1373 [ACK] Seq=337152 Ack=37730 Win=237824 Len=1240 [TCP PDU reassembled in 12001]"
"12218","76.211165","172.217.4.202","192.168.2.103","TCP","1394","[TCP Previous segment not captured] 443  >  1373 [ACK] Seq=487192 Ack=37730 Win=237824 Len=1240 [TCP PDU reassembled in 12249]"
"12880","76.341544","172.217.4.202","192.168.2.103","TCP","1394","[TCP Previous segment not captured] 443  >  1373 [ACK] Seq=1017912 Ack=37730 Win=237824 Len=1240 [TCP PDU reassembled in 12935]"
"12913","76.348134","172.217.4.202","192.168.2.103","TCP","1394","[TCP Previous segment not captured] 443  >  1373 [ACK] Seq=1041472 Ack=37730 Win=237824 Len=1240 [TCP PDU reassembled in 12935]"
"12976","76.361929","172.217.4.202","192.168.2.103","TCP","1394","[TCP Previous segment not captured] 443  >  1373 [ACK] Seq=1089832 Ack=37730 Win=237824 Len=1240"
"13008","76.367538","172.217.4.202","192.168.2.103","TCP","1394","[TCP Previous segment not captured] 443  >  1373 [PSH, ACK] Seq=1108432 Ack=37730 Win=237824 Len=1240"
"13134","76.395900","172.217.4.202","192.168.2.103","TCP","1394","[TCP Previous segment not captured] 443  >  1373 [PSH, ACK] Seq=1186520 Ack=37730 Win=237824 Len=1240 [TCP PDU reassembled in 13170]"
"13322","76.439265","172.217.4.202","192.168.2.103","TCP","1394","[TCP Previous segment not captured] 443  >  1373 [ACK] Seq=1317960 Ack=37730 Win=237824 Len=1240"
"13335","76.442865","172.217.4.202","192.168.2.103","TCP","1394","[TCP Previous segment not captured] 443  >  1373 [PSH, ACK] Seq=1320440 Ack=37730 Win=237824 Len=1240"
"13345","76.444609","172.217.4.202","192.168.2.103","TCP","1394","[TCP Previous segment not captured] 443  >  1373 [ACK] Seq=1329120 Ack=37730 Win=237824 Len=1240"
"13361","76.450246","172.217.4.202","192.168.2.103","TCP","1394","[TCP Previous segment not captured] 443  >  1373 [ACK] Seq=1341520 Ack=37730 Win=237824 Len=1240"
"13704","76.514101","172.217.4.202","192.168.2.103","TCP","1394","[TCP Previous segment not captured] 443  >  1373 [ACK] Seq=1577120 Ack=37730 Win=237824 Len=1240 [TCP PDU reassembled in 13724]"
"14122","86.305334","172.217.4.202","192.168.2.103","TCP","1394","[TCP Previous segment not captured] 443  >  1373 [ACK] Seq=1622056 Ack=42170 Win=233728 Len=1240"
"14487","86.385252","172.217.4.202","192.168.2.103","TCP","1394","[TCP Previous segment not captured] 443  >  1373 [PSH, ACK] Seq=1889824 Ack=42170 Win=233728 Len=1240"
"14498","86.385285","172.217.4.202","192.168.2.103","TCP","1394","[TCP Previous segment not captured] 443  >  1373 [ACK] Seq=1903464 Ack=42170 Win=233728 Len=1240"
"14507","86.390503","172.217.4.202","192.168.2.103","TCP","1394","[TCP Previous segment not captured] 443  >  1373 [ACK] Seq=1907184 Ack=42170 Win=233728 Len=1240"
"14717","86.423197","172.217.4.202","192.168.2.103","TCP","1394","[TCP Previous segment not captured] 443  >  1373 [ACK] Seq=2096904 Ack=42170 Win=233728 Len=1240 [TCP PDU reassembled in 14765]"
"15096","86.503818","172.217.4.202","192.168.2.103","TCP","1394","[TCP Previous segment not captured] 443  >  1373 [PSH, ACK] Seq=2392024 Ack=42170 Win=233728 Len=1240 [TCP PDU reassembled in 15144]"
"15107","86.505882","172.217.4.202","192.168.2.103","TCP","1394","[TCP Previous segment not captured] 443  >  1373 [ACK] Seq=2399464 Ack=42170 Win=233728 Len=1240"
"15392","86.566257","172.217.4.202","192.168.2.103","TCP","1394","[TCP Previous segment not captured] 443  >  1373 [PSH, ACK] Seq=2610264 Ack=42170 Win=233728 Len=1240 [TCP PDU reassembled in 15436]"
"15592","86.609395","172.217.4.202","192.168.2.103","TCP","1394","[TCP Previous segment not captured] 443  >  1373 [PSH, ACK] Seq=2751624 Ack=42170 Win=233728 Len=1240 [TCP PDU reassembled in 15672]"
"15745","86.640302","172.217.4.202","192.168.2.103","TCP","1394","[TCP Previous segment not captured] 443  >  1373 [ACK] Seq=2858264 Ack=42170 Win=233728 Len=1240"
"15925","86.683161","172.217.4.202","192.168.2.103","TCP","1394","[TCP Previous segment not captured] 443  >  1373 [PSH, ACK] Seq=2989704 Ack=42170 Win=233728 Len=1240 [TCP PDU reassembled in 15957]"
"16072","86.711071","172.217.4.202","192.168.2.103","TCP","1394","[TCP Previous segment not captured] 443  >  1373 [PSH, ACK] Seq=3097584 Ack=42170 Win=233728 Len=1240"
"16284","91.412944","172.217.4.202","192.168.2.103","TCP","158","[TCP Previous segment not captured] 443  >  1373 [ACK] Seq=3109732 Ack=44103 Win=232192 Len=0 SLE=45343 SRE=46036"
"16406","94.051904","157.240.26.35","192.168.2.103","TCP","146","[TCP Previous segment not captured] 443  >  1368 [FIN, ACK] Seq=27500 Ack=601 Win=67840 Len=0"
"16858","96.205810","172.217.4.202","192.168.2.103","TCP","1394","[TCP Previous segment not captured] 443  >  1373 [ACK] Seq=3348418 Ack=48543 Win=228352 Len=1240"
"17520","96.343620","172.217.4.202","192.168.2.103","TCP","1394","[TCP Previous segment not captured] 443  >  1373 [PSH, ACK] Seq=3826220 Ack=48543 Win=228352 Len=1240 [TCP PDU reassembled in 17564]"
"17948","96.440225","172.217.4.202","192.168.2.103","TCP","1394","[TCP Previous segment not captured] 443  >  1373 [ACK] Seq=4123820 Ack=48543 Win=228352 Len=1240"
"17983","96.447728","172.217.4.202","192.168.2.103","TCP","1394","[TCP Previous segment not captured] 443  >  1373 [ACK] Seq=4148620 Ack=48543 Win=228352 Len=1240"
"18212","96.489617","172.217.4.202","192.168.2.103","TCP","1394","[TCP Previous segment not captured] 443  >  1373 [PSH, ACK] Seq=4318500 Ack=48543 Win=228352 Len=1240 [TCP PDU reassembled in 18277]"
"18220","96.491652","172.217.4.202","192.168.2.103","TCP","1394","[TCP Previous segment not captured] 443  >  1373 [PSH, ACK] Seq=4323460 Ack=48543 Win=228352 Len=1240 [TCP PDU reassembled in 18277]"
"18244","96.497039","172.217.4.202","192.168.2.103","TCP","1394","[TCP Previous segment not captured] 443  >  1373 [PSH, ACK] Seq=4335860 Ack=48543 Win=228352 Len=1240 [TCP PDU reassembled in 18277]"
"18593","96.561495","172.217.4.202","192.168.2.103","TCP","1394","[TCP Previous segment not captured] 443  >  1373 [ACK] Seq=4585100 Ack=48543 Win=228352 Len=1240 [TCP PDU reassembled in 18672]"
"18601","96.563574","172.217.4.202","192.168.2.103","TCP","1394","[TCP Previous segment not captured] 443  >  1373 [PSH, ACK] Seq=4588820 Ack=48543 Win=228352 Len=1240 [TCP PDU reassembled in 18672]"
"18605","96.563589","172.217.4.202","192.168.2.103","TCP","1394","[TCP Previous segment not captured] 443  >  1373 [PSH, ACK] Seq=4593780 Ack=48543 Win=228352 Len=1240 [TCP PDU reassembled in 18672]"
"18664","96.581626","172.217.4.202","192.168.2.103","TCP","1394","[TCP Previous segment not captured] 443  >  1373 [ACK] Seq=4622300 Ack=48543 Win=228352 Len=1240 [TCP PDU reassembled in 18672]"
"18701","96.591026","172.217.4.202","192.168.2.103","TCP","1394","[TCP Previous segment not captured] 443  >  1373 [PSH, ACK] Seq=4658260 Ack=48543 Win=228352 Len=1240"
"19332","106.581693","172.217.4.202","192.168.2.103","TCP","1394","[TCP Previous segment not captured] 443  >  1378 [ACK] Seq=4780879 Ack=8524 Win=262656 Len=1240 [TCP PDU reassembled in 19410]"
"19335","106.581706","172.217.4.202","192.168.2.103","TCP","1394","[TCP Previous segment not captured] 443  >  1378 [ACK] Seq=4784599 Ack=8524 Win=262656 Len=1240 [TCP PDU reassembled in 19410]"
"19380","106.589383","172.217.4.202","192.168.2.103","TCP","1394","[TCP Previous segment not captured] 443  >  1378 [ACK] Seq=4811879 Ack=8524 Win=262656 Len=1240 [TCP PDU reassembled in 19410]"
"19444","106.601631","172.217.4.202","192.168.2.103","TCP","1394","[TCP Previous segment not captured] 443  >  1378 [ACK] Seq=4852799 Ack=8524 Win=262656 Len=1240 [TCP PDU reassembled in 19528]"
"19477","106.607906","172.217.4.202","192.168.2.103","TCP","1394","[TCP Previous segment not captured] 443  >  1378 [ACK] Seq=4878839 Ack=8524 Win=262656 Len=1240 [TCP PDU reassembled in 19528]"
"19487","106.610160","172.217.4.202","192.168.2.103","TCP","1394","[TCP Previous segment not captured] 443  >  1378 [ACK] Seq=4882559 Ack=8524 Win=262656 Len=1240 [TCP PDU reassembled in 19528]"
"19719","106.663696","172.217.4.202","192.168.2.103","TCP","1394","[TCP Previous segment not captured] 443  >  1378 [ACK] Seq=5026175 Ack=8524 Win=262656 Len=1240"
"19727","106.665695","172.217.4.202","192.168.2.103","TCP","1394","[TCP Previous segment not captured] 443  >  1378 [PSH, ACK] Seq=5031135 Ack=8524 Win=262656 Len=1240"
"19770","106.676209","172.217.4.202","192.168.2.103","TCP","1394","[TCP Previous segment not captured] 443  >  1378 [ACK] Seq=5063375 Ack=8524 Win=262656 Len=1240"
"19881","106.699134","172.217.4.202","192.168.2.103","TCP","1394","[TCP Previous segment not captured] 443  >  1378 [ACK] Seq=5145215 Ack=8524 Win=262656 Len=1240 [TCP PDU reassembled in 19912]"
"19962","106.722060","172.217.4.202","192.168.2.103","TCP","1394","[TCP Previous segment not captured] 443  >  1378 [PSH, ACK] Seq=5179935 Ack=8524 Win=262656 Len=1240"
"19979","106.726173","172.217.4.202","192.168.2.103","TCP","1394","[TCP Previous segment not captured] 443  >  1378 [ACK] Seq=5193575 Ack=8524 Win=262656 Len=1240"
"20001","106.729987","172.217.4.202","192.168.2.103","TCP","1394","[TCP Previous segment not captured] 443  >  1378 [ACK] Seq=5205975 Ack=8524 Win=262656 Len=1240"
"20099","106.755633","172.217.4.202","192.168.2.103","TCP","1394","[TCP Previous segment not captured] 443  >  1378 [ACK] Seq=5273951 Ack=8524 Win=262656 Len=1240 [TCP PDU reassembled in 20129]"
"20118","106.759687","172.217.4.202","192.168.2.103","TCP","1394","[TCP Previous segment not captured] 443  >  1378 [ACK] Seq=5280151 Ack=8524 Win=262656 Len=1240 [TCP PDU reassembled in 20129]"
"20150","106.765716","172.217.4.202","192.168.2.103","TCP","1394","[TCP Previous segment not captured] 443  >  1378 [ACK] Seq=5298751 Ack=8524 Win=262656 Len=1240 [TCP PDU reassembled in 20211]"
"20197","106.773231","172.217.4.202","192.168.2.103","TCP","1394","[TCP Previous segment not captured] 443  >  1378 [PSH, ACK] Seq=5328511 Ack=8524 Win=262656 Len=1240 [TCP PDU reassembled in 20211]"
"20271","106.789049","172.217.4.202","192.168.2.103","TCP","1394","[TCP Previous segment not captured] 443  >  1378 [ACK] Seq=5379351 Ack=8524 Win=262656 Len=1240 [TCP PDU reassembled in 20350]"
"20289","106.793384","172.217.4.202","192.168.2.103","TCP","1394","[TCP Previous segment not captured] 443  >  1378 [ACK] Seq=5386791 Ack=8524 Win=262656 Len=1240 [TCP PDU reassembled in 20350]"
"20320","106.803197","172.217.4.202","192.168.2.103","TCP","1394","[TCP Previous segment not captured] 443  >  1378 [PSH, ACK] Seq=5402911 Ack=8524 Win=262656 Len=1240 [TCP PDU reassembled in 20350]"
"20324","106.803212","172.217.4.202","192.168.2.103","TCP","1394","[TCP Previous segment not captured] 443  >  1378 [ACK] Seq=5407871 Ack=8524 Win=262656 Len=1240 [TCP PDU reassembled in 20350]"
"20389","106.821425","172.217.4.202","192.168.2.103","TCP","1394","[TCP Previous segment not captured] 443  >  1378 [ACK] Seq=5456231 Ack=8524 Win=262656 Len=1240"
"20436","106.829462","172.217.4.202","192.168.2.103","TCP","1394","[TCP Previous segment not captured] 443  >  1378 [ACK] Seq=5482271 Ack=8524 Win=262656 Len=1240"
"20443","106.831698","172.217.4.202","192.168.2.103","TCP","1394","[TCP Previous segment not captured] 443  >  1378 [ACK] Seq=5484751 Ack=8524 Win=262656 Len=1240"
"20446","106.831710","172.217.4.202","192.168.2.103","TCP","1394","[TCP Previous segment not captured] 443  >  1378 [ACK] Seq=5488471 Ack=8524 Win=262656 Len=1240"
"20450","106.833882","172.217.4.202","192.168.2.103","TCP","1394","[TCP Previous segment not captured] 443  >  1378 [ACK] Seq=5490951 Ack=8524 Win=262656 Len=1240"
"20461","106.835527","172.217.4.202","192.168.2.103","TCP","1394","[TCP Previous segment not captured] 443  >  1378 [ACK] Seq=5499631 Ack=8524 Win=262656 Len=1240"
"20538","106.853759","172.217.4.202","192.168.2.103","TCP","1394","[TCP Previous segment not captured] 443  >  1378 [ACK] Seq=5547991 Ack=8524 Win=262656 Len=1240"
"20562","106.857745","172.217.4.202","192.168.2.103","TCP","1394","[TCP Previous segment not captured] 443  >  1378 [ACK] Seq=5560391 Ack=8524 Win=262656 Len=1240"
"20732","106.893222","172.217.4.202","192.168.2.103","TCP","1394","[TCP Previous segment not captured] 443  >  1378 [ACK] Seq=5670751 Ack=8524 Win=262656 Len=1240 [TCP PDU reassembled in 20811]"
"20756","106.897668","172.217.4.202","192.168.2.103","TCP","1394","[TCP Previous segment not captured] 443  >  1378 [ACK] Seq=5676951 Ack=8524 Win=262656 Len=1240 [TCP PDU reassembled in 20811]"
"20792","106.903441","172.217.4.202","192.168.2.103","TCP","1394","[TCP Previous segment not captured] 443  >  1378 [ACK] Seq=5704231 Ack=8524 Win=262656 Len=1240 [TCP PDU reassembled in 20811]"
"20797","106.907530","172.217.4.202","192.168.2.103","TCP","1394","[TCP Previous segment not captured] 443  >  1378 [ACK] Seq=5706711 Ack=8524 Win=262656 Len=1240 [TCP PDU reassembled in 20811]"
"21007","106.961134","172.217.4.202","192.168.2.103","TCP","1394","[TCP Previous segment not captured] 443  >  1378 [ACK] Seq=5824511 Ack=8524 Win=262656 Len=1240 [TCP PDU reassembled in 21094]"
"21098","106.982542","172.217.4.202","192.168.2.103","TCP","1394","[TCP Previous segment not captured] 443  >  1378 [ACK] Seq=5872871 Ack=8524 Win=262656 Len=1240"
"21194","107.003054","172.217.4.202","192.168.2.103","TCP","1394","[TCP Previous segment not captured] 443  >  1378 [PSH, ACK] Seq=5926191 Ack=8524 Win=262656 Len=1240"
"21212","107.007181","172.217.4.202","192.168.2.103","TCP","1394","[TCP Previous segment not captured] 443  >  1378 [PSH, ACK] Seq=5936111 Ack=8524 Win=262656 Len=1240"
"21367","107.043247","172.217.4.202","192.168.2.103","TCP","1394","[TCP Previous segment not captured] 443  >  1378 [ACK] Seq=6017951 Ack=8524 Win=262656 Len=1240"
"21737","117.236320","172.217.4.202","192.168.2.103","TCP","1394","[TCP Previous segment not captured] 443  >  1378 [ACK] Seq=6105006 Ack=9098 Win=262144 Len=1240"
"22103","117.317823","172.217.4.202","192.168.2.103","TCP","1394","[TCP Previous segment not captured] 443  >  1378 [ACK] Seq=6389471 Ack=9098 Win=262144 Len=1240"
"22108","117.317839","172.217.4.202","192.168.2.103","TCP","1394","[TCP Previous segment not captured] 443  >  1378 [ACK] Seq=6395671 Ack=9098 Win=262144 Len=1240"
"22111","117.317847","172.217.4.202","192.168.2.103","TCP","1394","[TCP Previous segment not captured] 443  >  1378 [ACK] Seq=6400631 Ack=9098 Win=262144 Len=1240"
"22146","117.326457","172.217.4.202","192.168.2.103","TCP","1394","[TCP Previous segment not captured] 443  >  1378 [ACK] Seq=6408071 Ack=9098 Win=262144 Len=1240"
"22392","117.378054","172.217.4.202","192.168.2.103","TCP","1394","[TCP Previous segment not captured] 443  >  1378 [PSH, ACK] Seq=6592831 Ack=9098 Win=262144 Len=1240 [TCP PDU reassembled in 22469]"
"22426","117.386011","172.217.4.202","192.168.2.103","TCP","1394","[TCP Previous segment not captured] 443  >  1378 [ACK] Seq=6607711 Ack=9098 Win=262144 Len=1240 [TCP PDU reassembled in 22469]"
"22438","117.387999","172.217.4.202","192.168.2.103","TCP","1394","[TCP Previous segment not captured] 443  >  1378 [ACK] Seq=6610191 Ack=9098 Win=262144 Len=1240 [TCP PDU reassembled in 22469]"
"22447","117.389891","172.217.4.202","192.168.2.103","TCP","1394","[TCP Previous segment not captured] 443  >  1378 [ACK] Seq=6616391 Ack=9098 Win=262144 Len=1240 [TCP PDU reassembled in 22469]"
"23015","117.515719","172.217.4.202","192.168.2.103","TCP","1394","[TCP Previous segment not captured] 443  >  1378 [ACK] Seq=6974751 Ack=9098 Win=262144 Len=1240"
"23048","117.523142","172.217.4.202","192.168.2.103","TCP","1394","[TCP Previous segment not captured] 443  >  1378 [ACK] Seq=6997071 Ack=9098 Win=262144 Len=1240 [TCP PDU reassembled in 23063]"
"23173","117.553451","172.217.4.202","192.168.2.103","TCP","1394","[TCP Previous segment not captured] 443  >  1378 [ACK] Seq=7075191 Ack=9098 Win=262144 Len=1240"
"23291","117.581176","172.217.4.202","192.168.2.103","TCP","1394","[TCP Previous segment not captured] 443  >  1378 [PSH, ACK] Seq=7133471 Ack=9098 Win=262144 Len=1240 [TCP PDU reassembled in 23378]"
"23335","117.591092","172.217.4.202","192.168.2.103","TCP","1394","[TCP Previous segment not captured] 443  >  1378 [ACK] Seq=7149591 Ack=9098 Win=262144 Len=1240 [TCP PDU reassembled in 23378]"
"23542","117.635701","172.217.4.202","192.168.2.103","TCP","1394","[TCP Previous segment not captured] 443  >  1378 [ACK] Seq=7279791 Ack=9098 Win=262144 Len=1240"
"23581","117.643686","172.217.4.202","192.168.2.103","TCP","1394","[TCP Previous segment not captured] 443  >  1378 [ACK] Seq=7298391 Ack=9098 Win=262144 Len=1240 [TCP PDU reassembled in 23616]"
"23852","117.696798","172.217.4.202","192.168.2.103","TCP","1394","[TCP Previous segment not captured] 443  >  1378 [ACK] Seq=7484391 Ack=9098 Win=262144 Len=1240"
"23917","117.709745","172.217.4.202","192.168.2.103","TCP","1394","[TCP Previous segment not captured] 443  >  1378 [PSH, ACK] Seq=7516631 Ack=9098 Win=262144 Len=1240"
"23920","117.712981","172.217.4.202","192.168.2.103","TCP","1394","[TCP Previous segment not captured] 443  >  1378 [ACK] Seq=7521591 Ack=9098 Win=262144 Len=1240"
"23991","117.725232","172.217.4.202","192.168.2.103","TCP","1394","[TCP Previous segment not captured] 443  >  1378 [ACK] Seq=7569951 Ack=9098 Win=262144 Len=1240 [TCP PDU reassembled in 24046]"
"24809","125.888258","172.217.4.202","192.168.2.103","TCP","1394","[TCP Previous segment not captured] 443  >  1378 [ACK] Seq=7890578 Ack=9672 Win=261632 Len=1240 [TCP PDU reassembled in 24856]"
"24915","125.908167","172.217.4.202","192.168.2.103","TCP","1394","[TCP Previous segment not captured] 443  >  1378 [PSH, ACK] Seq=7961258 Ack=9672 Win=261632 Len=1240 [TCP PDU reassembled in 24924]"
"25037","125.932642","172.217.4.202","192.168.2.103","TCP","1394","[TCP Previous segment not captured] 443  >  1378 [ACK] Seq=8062938 Ack=9672 Win=261632 Len=1240 [TCP PDU reassembled in 25085]"
"25077","125.938278","172.217.4.202","192.168.2.103","TCP","1394","[TCP Previous segment not captured] 443  >  1378 [ACK] Seq=8096418 Ack=9672 Win=261632 Len=1240 [TCP PDU reassembled in 25085]"
"25449","126.022207","172.217.4.202","192.168.2.103","TCP","1394","[TCP Previous segment not captured] 443  >  1378 [ACK] Seq=8341938 Ack=9672 Win=261632 Len=1240"
"25471","126.026315","172.217.4.202","192.168.2.103","TCP","1394","[TCP Previous segment not captured] 443  >  1378 [ACK] Seq=8356818 Ack=9672 Win=261632 Len=1240"
"25491","126.031544","172.217.4.202","192.168.2.103","TCP","1394","[TCP Previous segment not captured] 443  >  1378 [ACK] Seq=8365498 Ack=9672 Win=261632 Len=1240"
"25526","126.037267","172.217.4.202","192.168.2.103","TCP","1394","[TCP Previous segment not captured] 443  >  1378 [ACK] Seq=8391538 Ack=9672 Win=261632 Len=1240 [TCP PDU reassembled in 25565]"
"25592","126.052694","172.217.4.202","192.168.2.103","TCP","1394","[TCP Previous segment not captured] 443  >  1378 [ACK] Seq=8429978 Ack=9672 Win=261632 Len=1240"
"25628","126.059962","172.217.4.202","192.168.2.103","TCP","1394","[TCP Previous segment not captured] 443  >  1378 [PSH, ACK] Seq=8458498 Ack=9672 Win=261632 Len=1240"
"25633","126.061565","172.217.4.202","192.168.2.103","TCP","1394","[TCP Previous segment not captured] 443  >  1378 [ACK] Seq=8463458 Ack=9672 Win=261632 Len=1240"
"25750","126.086143","172.217.4.202","192.168.2.103","TCP","1394","[TCP Previous segment not captured] 443  >  1378 [PSH, ACK] Seq=8544058 Ack=9672 Win=261632 Len=1240"
"25770","126.089755","172.217.4.202","192.168.2.103","TCP","1394","[TCP Previous segment not captured] 443  >  1378 [PSH, ACK] Seq=8558938 Ack=9672 Win=261632 Len=1240 [TCP PDU reassembled in 25787]"
"25875","126.115621","172.217.4.202","192.168.2.103","TCP","1394","[TCP Previous segment not captured] 443  >  1378 [ACK] Seq=8619698 Ack=9672 Win=261632 Len=1240"
"25914","126.123165","172.217.4.202","192.168.2.103","TCP","1394","[TCP Previous segment not captured] 443  >  1378 [PSH, ACK] Seq=8648218 Ack=9672 Win=261632 Len=1240 [TCP PDU reassembled in 25932]"
"26000","126.141495","172.217.4.202","192.168.2.103","TCP","1394","[TCP Previous segment not captured] 443  >  1378 [ACK] Seq=8713938 Ack=9672 Win=261632 Len=1240"
"26151","126.167589","172.217.4.202","192.168.2.103","TCP","1394","[TCP Previous segment not captured] 443  >  1378 [PSH, ACK] Seq=8823058 Ack=9672 Win=261632 Len=1240 [TCP PDU reassembled in 26213]"
"26163","126.169696","172.217.4.202","192.168.2.103","TCP","1394","[TCP Previous segment not captured] 443  >  1378 [ACK] Seq=8828018 Ack=9672 Win=261632 Len=1240 [TCP PDU reassembled in 26213]"
"26172","126.175678","172.217.4.202","192.168.2.103","TCP","1394","[TCP Previous segment not captured] 443  >  1378 [ACK] Seq=8832978 Ack=9672 Win=261632 Len=1240 [TCP PDU reassembled in 26213]"
"26234","126.186571","172.217.4.202","192.168.2.103","TCP","1394","[TCP Previous segment not captured] 443  >  1378 [ACK] Seq=8872658 Ack=9672 Win=261632 Len=1240"
"26285","126.197466","172.217.4.202","192.168.2.103","TCP","1394","[TCP Previous segment not captured] 443  >  1378 [ACK] Seq=8903658 Ack=9672 Win=261632 Len=1240"
"26487","126.236637","172.217.4.202","192.168.2.103","TCP","1394","[TCP Previous segment not captured] 443  >  1378 [ACK] Seq=9049978 Ack=9672 Win=261632 Len=1240"
"26514","126.241820","172.217.4.202","192.168.2.103","TCP","1394","[TCP Previous segment not captured] 443  >  1378 [ACK] Seq=9063618 Ack=9672 Win=261632 Len=1240"
"26526","126.245402","172.217.4.202","192.168.2.103","TCP","1394","[TCP Previous segment not captured] 443  >  1378 [ACK] Seq=9068578 Ack=9672 Win=261632 Len=1240"
"27225","136.232770","172.217.4.202","192.168.2.103","TCP","1394","[TCP Previous segment not captured] 443  >  1378 [ACK] Seq=9317027 Ack=10246 Win=261120 Len=1240 [TCP PDU reassembled in 27330]"
"27276","136.246546","172.217.4.202","192.168.2.103","TCP","1394","[TCP Previous segment not captured] 443  >  1378 [ACK] Seq=9333147 Ack=10246 Win=261120 Len=1240 [TCP PDU reassembled in 27330]"
"27386","136.268773","172.217.4.202","192.168.2.103","TCP","1394","[TCP Previous segment not captured] 443  >  1378 [PSH, ACK] Seq=9411267 Ack=10246 Win=261120 Len=1240 [TCP PDU reassembled in 27424]"
"27397","136.276289","172.217.4.202","192.168.2.103","TCP","1394","[TCP Previous segment not captured] 443  >  1378 [PSH, ACK] Seq=9421187 Ack=10246 Win=261120 Len=1240 [TCP PDU reassembled in 27424]"
"27757","136.355448","172.217.4.202","192.168.2.103","TCP","1394","[TCP Previous segment not captured] 443  >  1378 [ACK] Seq=9664227 Ack=10246 Win=261120 Len=1240"
"27769","136.357825","172.217.4.202","192.168.2.103","TCP","1394","[TCP Previous segment not captured] 443  >  1378 [ACK] Seq=9667947 Ack=10246 Win=261120 Len=1240"
"27777","136.361435","172.217.4.202","192.168.2.103","TCP","1394","[TCP Previous segment not captured] 443  >  1378 [ACK] Seq=9672907 Ack=10246 Win=261120 Len=1240"
"27801","136.366742","172.217.4.202","192.168.2.103","TCP","1394","[TCP Previous segment not captured] 443  >  1378 [ACK] Seq=9686547 Ack=10246 Win=261120 Len=1240"
"27880","136.379809","172.217.4.202","192.168.2.103","TCP","1394","[TCP Previous segment not captured] 443  >  1378 [ACK] Seq=9741107 Ack=10246 Win=261120 Len=1240 [TCP PDU reassembled in 27897]"
"27940","136.393475","172.217.4.202","192.168.2.103","TCP","1394","[TCP Previous segment not captured] 443  >  1378 [PSH, ACK] Seq=9784507 Ack=10246 Win=261120 Len=1240 [TCP PDU reassembled in 28019]"
"27964","136.397510","172.217.4.202","192.168.2.103","TCP","1394","[TCP Previous segment not captured] 443  >  1378 [ACK] Seq=9801867 Ack=10246 Win=261120 Len=1240 [TCP PDU reassembled in 28019]"
"27981","136.399522","172.217.4.202","192.168.2.103","TCP","1394","[TCP Previous segment not captured] 443  >  1378 [ACK] Seq=9813027 Ack=10246 Win=261120 Len=1240 [TCP PDU reassembled in 28019]"
"27989","136.403641","172.217.4.202","192.168.2.103","TCP","1394","[TCP Previous segment not captured] 443  >  1378 [ACK] Seq=9815507 Ack=10246 Win=261120 Len=1240 [TCP PDU reassembled in 28019]"
"28002","136.405516","172.217.4.202","192.168.2.103","TCP","1394","[TCP Previous segment not captured] 443  >  1378 [ACK] Seq=9826667 Ack=10246 Win=261120 Len=1240 [TCP PDU reassembled in 28019]"
"28005","136.407532","172.217.4.202","192.168.2.103","TCP","1394","[TCP Previous segment not captured] 443  >  1378 [PSH, ACK] Seq=9829147 Ack=10246 Win=261120 Len=1240 [TCP PDU reassembled in 28019]"
"28244","136.458600","172.217.4.202","192.168.2.103","TCP","1394","[TCP Previous segment not captured] 443  >  1378 [ACK] Seq=9958107 Ack=10246 Win=261120 Len=1240 [TCP PDU reassembled in 28276]"
"28871","136.595324","172.217.4.202","192.168.2.103","TCP","1394","[TCP Previous segment not captured] 443  >  1378 [ACK] Seq=10311507 Ack=10246 Win=261120 Len=1240 [TCP PDU reassembled in 28881]"
"28904","136.601613","172.217.4.202","192.168.2.103","TCP","1394","[TCP Previous segment not captured] 443  >  1378 [ACK] Seq=10332587 Ack=10246 Win=261120 Len=1240"
"28908","136.603471","172.217.4.202","192.168.2.103","TCP","1394","[TCP Previous segment not captured] 443  >  1378 [ACK] Seq=10336307 Ack=10246 Win=261120 Len=1240"
"28933","136.609186","172.217.4.202","192.168.2.103","TCP","1394","[TCP Previous segment not captured] 443  >  1378 [PSH, ACK] Seq=10359867 Ack=10246 Win=261120 Len=1240"
"29089","136.643975","172.217.4.202","192.168.2.103","TCP","1394","[TCP Previous segment not captured] 443  >  1378 [ACK] Seq=10468987 Ack=10246 Win=261120 Len=1240 [TCP PDU reassembled in 29182]"
"29121","136.651721","172.217.4.202","192.168.2.103","TCP","1394","[TCP Previous segment not captured] 443  >  1378 [ACK] Seq=10481387 Ack=10246 Win=261120 Len=1240 [TCP PDU reassembled in 29182]"
"29166","136.659207","172.217.4.202","192.168.2.103","TCP","1394","[TCP Previous segment not captured] 443  >  1378 [ACK] Seq=10513627 Ack=10246 Win=261120 Len=1240 [TCP PDU reassembled in 29182]"
"29235","136.671840","172.217.4.202","192.168.2.103","TCP","1394","[TCP Previous segment not captured] 443  >  1378 [PSH, ACK] Seq=10553307 Ack=10246 Win=261120 Len=1240"
"29236","136.671844","172.217.4.202","192.168.2.103","TCP","1394","[TCP Previous segment not captured] 443  >  1378 [ACK] Seq=10555787 Ack=10246 Win=261120 Len=1240"
"29271","136.677830","172.217.4.202","192.168.2.103","TCP","1394","[TCP Previous segment not captured] 443  >  1378 [ACK] Seq=10580587 Ack=10246 Win=261120 Len=1240"
"29952","146.050886","172.217.4.202","192.168.2.103","TCP","1394","[TCP Previous segment not captured] 443  >  1378 [ACK] Seq=10888959 Ack=10820 Win=260608 Len=1240 [TCP PDU reassembled in 29970]"
"30006","146.059221","172.217.4.202","192.168.2.103","TCP","1394","[TCP Previous segment not captured] 443  >  1378 [PSH, ACK] Seq=10941039 Ack=10820 Win=260608 Len=1240 [TCP PDU reassembled in 30095]"
"30194","146.097206","172.217.4.202","192.168.2.103","TCP","1394","[TCP Previous segment not captured] 443  >  1378 [ACK] Seq=11042719 Ack=10820 Win=260608 Len=1240"
"30196","146.097217","172.217.4.202","192.168.2.103","TCP","1394","[TCP Previous segment not captured] 443  >  1378 [PSH, ACK] Seq=11045199 Ack=10820 Win=260608 Len=1240"
"30363","146.127767","172.217.4.202","192.168.2.103","TCP","1394","[TCP Previous segment not captured] 443  >  1378 [ACK] Seq=11174159 Ack=10820 Win=260608 Len=1240"
"30414","146.143774","172.217.4.202","192.168.2.103","TCP","1394","[TCP Previous segment not captured] 443  >  1378 [PSH, ACK] Seq=11216319 Ack=10820 Win=260608 Len=1240"
"30426","146.145852","172.217.4.202","192.168.2.103","TCP","1394","[TCP Previous segment not captured] 443  >  1378 [ACK] Seq=11220039 Ack=10820 Win=260608 Len=1240"
"30457","146.151870","172.217.4.202","192.168.2.103","TCP","1394","[TCP Previous segment not captured] 443  >  1378 [PSH, ACK] Seq=11231199 Ack=10820 Win=260608 Len=1240"
"30486","146.156338","172.217.4.202","192.168.2.103","TCP","1394","[TCP Previous segment not captured] 443  >  1378 [ACK] Seq=11244839 Ack=10820 Win=260608 Len=1240"
"30496","146.158453","172.217.4.202","192.168.2.103","TCP","1394","[TCP Previous segment not captured] 443  >  1378 [PSH, ACK] Seq=11251039 Ack=10820 Win=260608 Len=1240"
"30503","146.160265","172.217.4.202","192.168.2.103","TCP","1394","[TCP Previous segment not captured] 443  >  1378 [PSH, ACK] Seq=11260959 Ack=10820 Win=260608 Len=1240"
"30608","146.183831","172.217.4.202","192.168.2.103","TCP","1394","[TCP Previous segment not captured] 443  >  1378 [ACK] Seq=11326679 Ack=10820 Win=260608 Len=1240"
"30611","146.185511","172.217.4.202","192.168.2.103","TCP","1394","[TCP Previous segment not captured] 443  >  1378 [ACK] Seq=11330399 Ack=10820 Win=260608 Len=1240"
"30665","146.193348","172.217.4.202","192.168.2.103","TCP","1394","[TCP Previous segment not captured] 443  >  1378 [PSH, ACK] Seq=11368839 Ack=10820 Win=260608 Len=1240"
"30852","146.232652","172.217.4.202","192.168.2.103","TCP","1394","[TCP Previous segment not captured] 443  >  1378 [ACK] Seq=11471759 Ack=10820 Win=260608 Len=1240"
"30895","146.239725","172.217.4.202","192.168.2.103","TCP","1394","[TCP Previous segment not captured] 443  >  1378 [ACK] Seq=11505239 Ack=10820 Win=260608 Len=1240"
"30912","146.247376","172.217.4.202","192.168.2.103","TCP","1394","[TCP Previous segment not captured] 443  >  1378 [ACK] Seq=11518879 Ack=10820 Win=260608 Len=1240"
"30914","146.247385","172.217.4.202","192.168.2.103","TCP","1394","[TCP Previous segment not captured] 443  >  1378 [PSH, ACK] Seq=11521359 Ack=10820 Win=260608 Len=1240"
"30948","146.255531","172.217.4.202","192.168.2.103","TCP","1394","[TCP Previous segment not captured] 443  >  1378 [ACK] Seq=11549879 Ack=10820 Win=260608 Len=1240"
"31005","146.268156","172.217.4.202","192.168.2.103","TCP","1394","[TCP Previous segment not captured] 443  >  1378 [ACK] Seq=11577159 Ack=10820 Win=260608 Len=1240 [TCP PDU reassembled in 31025]"
"31281","146.326201","172.217.4.202","192.168.2.103","TCP","1394","[TCP Previous segment not captured] 443  >  1378 [PSH, ACK] Seq=11750759 Ack=10820 Win=260608 Len=1240"
"31344","146.342279","172.217.4.202","192.168.2.103","TCP","1394","[TCP Previous segment not captured] 443  >  1378 [ACK] Seq=11792919 Ack=10820 Win=260608 Len=1240 [TCP PDU reassembled in 31440]"
"31348","146.348127","172.217.4.202","192.168.2.103","TCP","1394","[TCP Previous segment not captured] 443  >  1378 [ACK] Seq=11800359 Ack=10820 Win=260608 Len=1240 [TCP PDU reassembled in 31440]"
"31369","146.354666","172.217.4.202","192.168.2.103","TCP","1394","[TCP Previous segment not captured] 443  >  1378 [ACK] Seq=11811519 Ack=10820 Win=260608 Len=1240 [TCP PDU reassembled in 31440]"
"31383","146.357997","172.217.4.202","192.168.2.103","TCP","1394","[TCP Previous segment not captured] 443  >  1378 [ACK] Seq=11820199 Ack=10820 Win=260608 Len=1240 [TCP PDU reassembled in 31440]"
"31412","146.363373","172.217.4.202","192.168.2.103","TCP","1394","[TCP Previous segment not captured] 443  >  1378 [ACK] Seq=11838799 Ack=10820 Win=260608 Len=1240 [TCP PDU reassembled in 31440]"
"31423","146.368175","172.217.4.202","192.168.2.103","TCP","1394","[TCP Previous segment not captured] 443  >  1378 [ACK] Seq=11846239 Ack=10820 Win=260608 Len=1240 [TCP PDU reassembled in 31440]"
"31457","146.379324","172.217.4.202","192.168.2.103","TCP","1394","[TCP Previous segment not captured] 443  >  1378 [ACK] Seq=11872279 Ack=10820 Win=260608 Len=1240"
"31516","146.391230","172.217.4.202","192.168.2.103","TCP","1394","[TCP Previous segment not captured] 443  >  1378 [PSH, ACK] Seq=11899559 Ack=10820 Win=260608 Len=1240"
"31520","146.391244","172.217.4.202","192.168.2.103","TCP","1394","[TCP Previous segment not captured] 443  >  1378 [ACK] Seq=11904519 Ack=10820 Win=260608 Len=1240"
"31744","146.437477","172.217.4.202","192.168.2.103","TCP","1394","[TCP Previous segment not captured] 443  >  1378 [PSH, ACK] Seq=12055799 Ack=10820 Win=260608 Len=1240 [TCP PDU reassembled in 31762]"
"31751","146.439841","172.217.4.202","192.168.2.103","TCP","1394","[TCP Previous segment not captured] 443  >  1378 [ACK] Seq=12058279 Ack=10820 Win=260608 Len=1240 [TCP PDU reassembled in 31762]"
"31770","146.443643","172.217.4.202","192.168.2.103","TCP","1394","[TCP Previous segment not captured] 443  >  1378 [PSH, ACK] Seq=12074399 Ack=10820 Win=260608 Len=1240 [TCP PDU reassembled in 31879]"
"31806","146.453544","172.217.4.202","192.168.2.103","TCP","1394","[TCP Previous segment not captured] 443  >  1378 [ACK] Seq=12099199 Ack=10820 Win=260608 Len=1240 [TCP PDU reassembled in 31879]"
"31813","146.455132","172.217.4.202","192.168.2.103","TCP","1394","[TCP Previous segment not captured] 443  >  1378 [ACK] Seq=12106639 Ack=10820 Win=260608 Len=1240 [TCP PDU reassembled in 31879]"
"31859","146.464669","172.217.4.202","192.168.2.103","TCP","1394","[TCP Previous segment not captured] 443  >  1378 [ACK] Seq=12132679 Ack=10820 Win=260608 Len=1240 [TCP PDU reassembled in 31879]"
"31913","146.475895","172.217.4.202","192.168.2.103","TCP","1394","[TCP Previous segment not captured] 443  >  1378 [ACK] Seq=12158719 Ack=10820 Win=260608 Len=1240"
"31938","146.483115","172.217.4.202","192.168.2.103","TCP","1394","[TCP Previous segment not captured] 443  >  1378 [PSH, ACK] Seq=12167399 Ack=10820 Win=260608 Len=1240"
