"No.","Time","Source","Destination","Protocol","Length","Info"
"15","0.139146","192.168.2.103","224.0.0.251","MDNS","178","Standard query 0x0000 PTR _oculusal_sp_v2._tcp.local, ""QM"" question"
"18","0.139599","192.168.2.103","224.0.0.251","MDNS","178","Standard query 0x0000 PTR _oculusal_sp_v2._tcp.local, ""QM"" question"
"24","0.140075","192.168.2.103","224.0.0.251","MDNS","374","Standard query response 0x0000 PTR 12549::oldman._oculusal_sp_v2._tcp.local SRV 0 0 3469 oldman.local TXT A 192.168.2.103 AAAA fe80::18a0:cb74:d156:8d15"
"90","1.453445","192.168.2.103","157.240.26.11","TLSv1.2","177","Application Data"
"94","1.469421","192.168.2.103","157.240.26.11","TLSv1.2","177","Application Data"
"97","1.484161","157.240.26.11","192.168.2.103","TLSv1.2","177","Application Data"
"100","1.502109","157.240.26.11","192.168.2.103","TLSv1.2","177","Application Data"
"105","1.531505","192.168.2.103","157.240.26.11","TCP","146","1084  >  443 [ACK] Seq=32 Ack=32 Win=258 Len=0"
"112","1.547612","192.168.2.103","157.240.26.11","TCP","146","1085  >  443 [ACK] Seq=32 Ack=32 Win=256 Len=0"
"219","3.856259","192.168.2.103","224.0.0.251","MDNS","175","Standard query 0x0000 PTR _oculusal_sp._tcp.local, ""QM"" question"
"232","3.857977","192.168.2.103","224.0.0.251","MDNS","371","Standard query response 0x0000 PTR 12549::oldman._oculusal_sp_v2._tcp.local SRV 0 0 3469 oldman.local TXT A 192.168.2.103 AAAA fe80::18a0:cb74:d156:8d15"
"236","3.858529","192.168.2.103","224.0.0.251","MDNS","371","Standard query response 0x0000 PTR 12549::oldman._oculusal_sp_v2._tcp.local SRV 0 0 3469 oldman.local TXT A 192.168.2.103 AAAA fe80::18a0:cb74:d156:8d15"
"249","4.148746","192.168.2.103","224.0.0.251","MDNS","178","Standard query 0x0000 PTR _oculusal_sp_v2._tcp.local, ""QM"" question"
"261","4.149861","192.168.2.103","224.0.0.251","MDNS","374","Standard query response 0x0000 PTR 12549::oldman._oculusal_sp_v2._tcp.local SRV 0 0 3469 oldman.local TXT A 192.168.2.103 AAAA fe80::18a0:cb74:d156:8d15"
"387","11.830044","192.168.2.103","224.0.0.251","MDNS","183","Standard query 0x0000 PTR _oculusal_sp._tcp.local, ""QM"" question"
"393","11.847356","192.168.2.103","224.0.0.251","MDNS","371","Standard query response 0x0000 PTR 12549::oldman._oculusal_sp_v2._tcp.local SRV 0 0 3469 oldman.local TXT A 192.168.2.103 AAAA fe80::18a0:cb74:d156:8d15"
"397","11.847659","192.168.2.103","224.0.0.251","MDNS","371","Standard query response 0x0000 PTR 12549::oldman._oculusal_sp_v2._tcp.local SRV 0 0 3469 oldman.local TXT A 192.168.2.103 AAAA fe80::18a0:cb74:d156:8d15"
"404","12.122376","192.168.2.103","224.0.0.251","MDNS","186","Standard query 0x0000 PTR _oculusal_sp_v2._tcp.local, ""QM"" question"
"413","12.123080","192.168.2.103","224.0.0.251","MDNS","366","Standard query response 0x0000 PTR 12549::oldman._oculusal_sp_v2._tcp.local SRV 0 0 3469 oldman.local TXT A 192.168.2.103 AAAA fe80::18a0:cb74:d156:8d15"
"421","12.633995","192.168.2.103","34.107.172.168","TLSv1.2","1347","Application Data"
"423","12.662521","34.107.172.168","192.168.2.103","TCP","146","443  >  1282 [ACK] Seq=1 Ack=1202 Win=1011 Len=0"
"427","12.685618","34.107.172.168","192.168.2.103","TLSv1.2","330","Application Data"
"431","12.742710","192.168.2.103","34.107.172.168","TCP","146","1282  >  443 [ACK] Seq=1202 Ack=185 Win=251 Len=0"
"434","12.743094","192.168.2.103","34.107.172.168","TCP","146","[TCP Dup ACK 431#1] 1282  >  443 [ACK] Seq=1202 Ack=185 Win=251 Len=0"
"440","12.833782","192.168.2.103","224.0.0.251","MDNS","183","Standard query 0x0000 PTR _oculusal_sp._tcp.local, ""QM"" question"
"446","12.834070","192.168.2.103","224.0.0.251","MDNS","363","Standard query response 0x0000 PTR 12549::oldman._oculusal_sp_v2._tcp.local SRV 0 0 3469 oldman.local TXT A 192.168.2.103 AAAA fe80::18a0:cb74:d156:8d15"
"454","13.133966","192.168.2.103","224.0.0.251","MDNS","186","Standard query 0x0000 PTR _oculusal_sp_v2._tcp.local, ""QM"" question"
"457","13.134001","192.168.2.103","224.0.0.251","MDNS","374","Standard query response 0x0000 PTR 12549::oldman._oculusal_sp_v2._tcp.local SRV 0 0 3469 oldman.local TXT A 192.168.2.103 AAAA fe80::18a0:cb74:d156:8d15"
"477","14.837222","192.168.2.103","224.0.0.251","MDNS","175","Standard query 0x0000 PTR _oculusal_sp._tcp.local, ""QM"" question"
"480","14.837478","192.168.2.103","224.0.0.251","MDNS","175","Standard query 0x0000 PTR _oculusal_sp._tcp.local, ""QM"" question"
"489","14.846908","192.168.2.103","224.0.0.251","MDNS","371","Standard query response 0x0000 PTR 12549::oldman._oculusal_sp_v2._tcp.local SRV 0 0 3469 oldman.local TXT A 192.168.2.103 AAAA fe80::18a0:cb74:d156:8d15"
"493","14.899781","192.168.2.103","157.240.26.49","TLSv1.2","201","Application Data"
"494","14.899787","192.168.2.103","157.240.26.49","TLSv1.2","178","Application Data"
"498","14.900684","192.168.2.103","157.240.26.49","TCP","146","1189  >  443 [FIN, ACK] Seq=72 Ack=1 Win=256 Len=0"
"502","14.901520","192.168.2.103","192.168.2.1","DNS","168","Standard query 0x326e A graph.oculus.com"
"506","14.953976","192.168.2.103","192.168.2.1","DNS","176","Standard query 0xfa7a A graph.oculus.com"
"507","14.953982","192.168.2.103","192.168.2.1","DNS","176","Standard query 0xf0ab HTTPS graph.oculus.com"
"510","14.988678","192.168.2.1","192.168.2.103","DNS","219","Standard query response 0x326e A graph.oculus.com CNAME oculus.c10r.facebook.com A 157.240.26.49"
"514","14.990434","192.168.2.103","157.240.26.49","TCP","158","1346  >  443 [SYN] Seq=0 Win=64480 Len=0 MSS=1460 WS=256 SACK_PERM"
"516","15.022510","157.240.26.49","192.168.2.103","TCP","158","443  >  1346 [SYN, ACK] Seq=0 Ack=1 Win=65535 Len=0 MSS=1392 SACK_PERM WS=256"
"519","15.023593","192.168.2.103","157.240.26.49","TCP","154","1346  >  443 [ACK] Seq=1 Ack=1 Win=65536 Len=0"
"520","15.023601","192.168.2.103","157.240.26.49","TLSv1.2","672","Client Hello (SNI=graph.oculus.com)"
"522","15.024003","192.168.2.1","192.168.2.103","DNS","219","Standard query response 0xfa7a A graph.oculus.com CNAME oculus.c10r.facebook.com A 157.240.26.49"
"526","15.036763","192.168.2.103","157.240.26.49","TLSv1.2","210","[TCP ACKed unseen segment] , Change Cipher Spec, Application Data"
"530","15.037039","192.168.2.103","157.240.26.49","TLSv1.2","240","Application Data"
"531","15.037046","192.168.2.103","157.240.26.49","TLSv1.2","506","Application Data"
"533","15.045554","157.240.26.49","192.168.2.103","TCP","146","[TCP Previous segment not captured] 443  >  1346 [ACK] Seq=213 Ack=1021 Win=67840 Len=0"
"535","15.046007","157.240.26.49","192.168.2.103","TLSv1.2","315","Application Data"
"538","15.046454","157.240.26.49","192.168.2.103","TLSv1.2","198","[TCP Previous segment not captured] , Application Data"
"542","15.046883","192.168.2.103","157.240.26.49","TCP","154","[TCP ACKed unseen segment] 1346  >  443 [ACK] Seq=1021 Ack=500 Win=65024 Len=0"
"543","15.046889","192.168.2.103","157.240.26.49","TLSv1.2","185","Application Data"
"546","15.050977","192.168.2.1","192.168.2.103","DNS","287","Standard query response 0xf0ab HTTPS graph.oculus.com CNAME oculus.c10r.facebook.com HTTPS HTTPS"
"550","15.052257","192.168.2.103","157.240.26.49","TCP","158","1347  >  443 [SYN] Seq=0 Win=64480 Len=0 MSS=1460 WS=256 SACK_PERM"
"552","15.061578","157.240.26.49","192.168.2.103","TCP","158","443  >  1347 [SYN, ACK] Seq=0 Ack=1 Win=65535 Len=0 MSS=1392 SACK_PERM WS=256"
"556","15.062137","192.168.2.103","157.240.26.49","TCP","146","1347  >  443 [ACK] Seq=1 Ack=1 Win=65536 Len=0"
"560","15.062798","192.168.2.103","157.240.26.49","TLSv1.3","923","Client Hello (SNI=graph.oculus.com)"
"564","15.063891","192.168.2.103","157.240.26.49","TCP","923","[TCP Retransmission] 1347  >  443 [PSH, ACK] Seq=1 Ack=1 Win=65536 Len=777"
"567","15.074599","157.240.26.49","192.168.2.103","TCP","146","443  >  1347 [ACK] Seq=1 Ack=778 Win=67328 Len=0"
"569","15.075732","157.240.26.49","192.168.2.103","TLSv1.3","903","Server Hello, Change Cipher Spec, Application Data"
"573","15.076796","192.168.2.103","157.240.26.49","TLSv1.3","218","Change Cipher Spec, Application Data"
"574","15.076803","192.168.2.103","157.240.26.49","TLSv1.3","246","Application Data"
"578","15.077265","192.168.2.103","157.240.26.49","TLSv1.3","544","Application Data"
"579","15.077272","192.168.2.103","157.240.26.49","TLSv1.3","526","Application Data"
"581","15.085613","157.240.26.49","192.168.2.103","TCP","146","443  >  1347 [ACK] Seq=758 Ack=934 Win=67328 Len=0"
"583","15.086107","157.240.26.49","192.168.2.103","TCP","154","443  >  1347 [ACK] Seq=758 Ack=1696 Win=70400 Len=0"
"584","15.086120","157.240.26.49","192.168.2.103","TLSv1.3","323","Application Data"
"585","15.086296","157.240.26.49","192.168.2.103","TCP","154","443  >  1347 [ACK] Seq=758 Ack=1696 Win=70400 Len=0"
"586","15.086309","157.240.26.49","192.168.2.103","TCP","323","[TCP Retransmission] 443  >  1347 [PSH, ACK] Seq=758 Ack=1696 Win=70400 Len=169"
"588","15.086564","157.240.26.49","192.168.2.103","TLSv1.3","228","Application Data"
"589","15.086577","157.240.26.49","192.168.2.103","TLSv1.3","198","Application Data"
"593","15.087536","192.168.2.103","157.240.26.49","TCP","154","1347  >  443 [ACK] Seq=1696 Ack=1045 Win=64512 Len=0"
"594","15.087542","192.168.2.103","157.240.26.49","TLSv1.3","185","Application Data"
"598","15.130757","192.168.2.103","157.240.26.49","TCP","217","[TCP Retransmission] 1189  >  443 [FIN, PSH, ACK] Seq=1 Ack=1 Win=256 Len=71"
"602","15.131062","192.168.2.103","224.0.0.251","MDNS","186","Standard query 0x0000 PTR _oculusal_sp_v2._tcp.local, ""QM"" question"
"611","15.131852","192.168.2.103","224.0.0.251","MDNS","366","Standard query response 0x0000 PTR 12549::oldman._oculusal_sp_v2._tcp.local SRV 0 0 3469 oldman.local TXT A 192.168.2.103 AAAA fe80::18a0:cb74:d156:8d15"
"613","15.136324","157.240.26.49","192.168.2.103","TCP","146","443  >  1347 [ACK] Seq=1045 Ack=1727 Win=70400 Len=0"
"615","15.144766","157.240.26.49","192.168.2.103","TLSv1.2","698","Application Data"
"617","15.144986","157.240.26.49","192.168.2.103","TLSv1.2","250","Application Data"
"621","15.145945","192.168.2.103","157.240.26.49","TCP","146","1346  >  443 [ACK] Seq=1052 Ack=1156 Win=64512 Len=0"
"623","15.160110","157.240.26.49","192.168.2.103","TLSv1.3","658","Application Data"
"625","15.160142","157.240.26.49","192.168.2.103","TLSv1.3","231","Application Data"
"629","15.161253","192.168.2.103","157.240.26.49","TCP","146","1347  >  443 [ACK] Seq=1727 Ack=1642 Win=65536 Len=0"
"632","15.161661","192.168.2.103","157.240.26.49","TCP","146","[TCP Dup ACK 629#1] 1347  >  443 [ACK] Seq=1727 Ack=1642 Win=65536 Len=0"
"638","15.441377","192.168.2.103","157.240.26.49","TCP","217","[TCP Retransmission] 1189  >  443 [FIN, PSH, ACK] Seq=1 Ack=1 Win=256 Len=71"
"648","16.052268","192.168.2.103","157.240.26.49","TCP","217","[TCP Retransmission] 1189  >  443 [FIN, PSH, ACK] Seq=1 Ack=1 Win=256 Len=71"
"659","16.550814","192.168.2.103","192.168.2.1","DNS","173","Standard query 0x2416 A static.nvidiagrid.net"
"666","16.623724","192.168.2.103","23.192.220.4","TCP","158","1348  >  443 [SYN] Seq=0 Win=64240 Len=0 MSS=1460 WS=256 SACK_PERM"
"668","16.634231","23.192.220.4","192.168.2.103","TCP","158","443  >  1348 [SYN, ACK] Seq=0 Ack=1 Win=64240 Len=0 MSS=1384 SACK_PERM WS=128"
"672","16.634676","192.168.2.103","23.192.220.4","TCP","146","1348  >  443 [ACK] Seq=1 Ack=1 Win=66304 Len=0"
"675","16.635069","192.168.2.103","23.192.220.4","TCP","146","[TCP Dup ACK 672#1] 1348  >  443 [ACK] Seq=1 Ack=1 Win=66304 Len=0"
"679","16.635343","192.168.2.103","23.192.220.4","TLSv1.3","767","Client Hello (SNI=static.nvidiagrid.net)"
"681","16.647576","23.192.220.4","192.168.2.103","TCP","146","443  >  1348 [ACK] Seq=1 Ack=622 Win=64128 Len=0"
"682","16.647828","23.192.220.4","192.168.2.103","TCP","146","[TCP Dup ACK 681#1] 443  >  1348 [ACK] Seq=1 Ack=622 Win=64128 Len=0"
"684","16.648200","23.192.220.4","192.168.2.103","TLSv1.3","410","Server Hello, Change Cipher Spec, Application Data, Application Data"
"688","16.649338","192.168.2.103","23.192.220.4","TLSv1.3","234","Change Cipher Spec, Application Data"
"689","16.649345","192.168.2.103","23.192.220.4","TLSv1.3","240","Application Data"
"693","16.649791","192.168.2.103","23.192.220.4","TLSv1.3","429","Application Data"
"694","16.649808","192.168.2.103","23.192.220.4","TLSv1.3","218","Application Data"
"698","16.650015","192.168.2.103","23.192.220.4","TCP","234","[TCP Retransmission] 1348  >  443 [PSH, ACK] Seq=622 Ack=265 Win=66048 Len=80"
"699","16.650029","192.168.2.103","23.192.220.4","TCP","240","[TCP Retransmission] 1348  >  443 [PSH, ACK] Seq=702 Ack=265 Win=66048 Len=86"
"701","16.658297","23.192.220.4","192.168.2.103","TCP","146","443  >  1348 [ACK] Seq=265 Ack=702 Win=64128 Len=0"
"703","16.659183","23.192.220.4","192.168.2.103","TCP","154","443  >  1348 [ACK] Seq=265 Ack=788 Win=64128 Len=0"
"704","16.659197","23.192.220.4","192.168.2.103","TLSv1.3","441","Application Data"
"705","16.659203","23.192.220.4","192.168.2.103","TCP","154","443  >  1348 [ACK] Seq=552 Ack=1063 Win=64128 Len=0"
"706","16.659208","23.192.220.4","192.168.2.103","TCP","154","443  >  1348 [ACK] Seq=552 Ack=1127 Win=64128 Len=0"
"708","16.661344","23.192.220.4","192.168.2.103","TLSv1.3","215","Application Data"
"709","16.661357","23.192.220.4","192.168.2.103","TLSv1.3","185","Application Data"
"710","16.661363","23.192.220.4","192.168.2.103","TLSv1.3","414","Application Data"
"711","16.661369","23.192.220.4","192.168.2.103","TCP","1394","443  >  1348 [ACK] Seq=904 Ack=1127 Win=64128 Len=1240"
"716","16.661913","192.168.2.103","23.192.220.4","TCP","154","1348  >  443 [ACK] Seq=1127 Ack=2144 Win=66304 Len=0"
"717","16.661919","192.168.2.103","23.192.220.4","TLSv1.3","185","Application Data"
"719","16.663780","23.192.220.4","192.168.2.103","TCP","1394","443  >  1348 [ACK] Seq=2144 Ack=1127 Win=64128 Len=1240"
"722","16.663801","23.192.220.4","192.168.2.103","TCP","1394","[TCP Previous segment not captured] 443  >  1348 [ACK] Seq=5864 Ack=1127 Win=64128 Len=1240"
"729","16.664036","192.168.2.103","157.240.26.49","TCP","158","1349  >  443 [SYN] Seq=0 Win=64480 Len=0 MSS=1460 WS=256 SACK_PERM"
"731","16.664740","23.192.220.4","192.168.2.103","TCP","1386","[TCP Out-Of-Order] 443  >  1348 [PSH, ACK] Seq=3384 Ack=1127 Win=64128 Len=1240"
"733","16.666401","23.192.220.4","192.168.2.103","TCP","1394","[TCP Out-Of-Order] 443  >  1348 [ACK] Seq=4624 Ack=1127 Win=64128 Len=1240"
"734","16.666411","23.192.220.4","192.168.2.103","TCP","1394","[TCP Retransmission] 443  >  1348 [ACK] Seq=5864 Ack=1127 Win=64128 Len=1240"
"735","16.666417","23.192.220.4","192.168.2.103","TCP","1394","443  >  1348 [PSH, ACK] Seq=7104 Ack=1127 Win=64128 Len=1240"
"736","16.666421","23.192.220.4","192.168.2.103","TCP","1394","443  >  1348 [ACK] Seq=8344 Ack=1127 Win=64128 Len=1240"
"737","16.666430","23.192.220.4","192.168.2.103","TCP","1394","443  >  1348 [ACK] Seq=9584 Ack=1127 Win=64128 Len=1240"
"740","16.666442","23.192.220.4","192.168.2.103","TCP","1394","[TCP Previous segment not captured] 443  >  1348 [ACK] Seq=13304 Ack=1127 Win=64128 Len=1240"
"743","16.667007","23.192.220.4","192.168.2.103","TCP","1394","[TCP Out-Of-Order] 443  >  1348 [PSH, ACK] Seq=10824 Ack=1127 Win=64128 Len=1240"
"748","16.667810","23.192.220.4","192.168.2.103","TCP","1386","443  >  1348 [PSH, ACK] Seq=14544 Ack=1127 Win=64128 Len=1240"
"752","16.668045","192.168.2.103","23.192.220.4","TCP","154","1348  >  443 [ACK] Seq=1158 Ack=10824 Win=66304 Len=0"
"753","16.668058","192.168.2.103","23.192.220.4","TCP","154","1348  >  443 [ACK] Seq=1158 Ack=14544 Win=66304 Len=0"
"755","16.670362","23.192.220.4","192.168.2.103","TCP","1386","443  >  1348 [ACK] Seq=15784 Ack=1127 Win=64128 Len=1240"
"757","16.670884","23.192.220.4","192.168.2.103","TCP","1386","[TCP Retransmission] 443  >  1348 [ACK] Seq=15784 Ack=1127 Win=64128 Len=1240"
"761","16.671602","192.168.2.103","23.192.220.4","TCP","146","1348  >  443 [ACK] Seq=1158 Ack=17024 Win=66304 Len=0"
"763","16.672406","23.192.220.4","192.168.2.103","TCP","1394","443  >  1348 [ACK] Seq=17024 Ack=1127 Win=64128 Len=1240, Application Data"
"764","16.672413","23.192.220.4","192.168.2.103","TCP","1394","443  >  1348 [PSH, ACK] Seq=18264 Ack=1127 Win=64128 Len=1240"
"765","16.672417","23.192.220.4","192.168.2.103","TCP","1394","443  >  1348 [ACK] Seq=19504 Ack=1127 Win=64128 Len=1240"
"766","16.672421","23.192.220.4","192.168.2.103","TCP","1394","443  >  1348 [ACK] Seq=20744 Ack=1127 Win=64128 Len=1240"
"770","16.673383","23.192.220.4","192.168.2.103","TCP","1394","[TCP Previous segment not captured] 443  >  1348 [ACK] Seq=24464 Ack=1158 Win=64128 Len=1240"
"771","16.673387","23.192.220.4","192.168.2.103","TCP","1394","443  >  1348 [PSH, ACK] Seq=25704 Ack=1158 Win=64128 Len=1240"
"774","16.673598","192.168.2.103","23.192.220.4","TCP","146","1348  >  443 [ACK] Seq=1158 Ack=21984 Win=66304 Len=0"
"776","16.674537","23.192.220.4","192.168.2.103","TCP","1394","[TCP Out-Of-Order] 443  >  1348 [PSH, ACK] Seq=21984 Ack=1127 Win=64128 Len=1240"
"777","16.674541","23.192.220.4","192.168.2.103","TCP","1394","[TCP Out-Of-Order] 443  >  1348 [ACK] Seq=23224 Ack=1158 Win=64128 Len=1240"
"778","16.674546","23.192.220.4","192.168.2.103","TCP","1394","[TCP Retransmission] 443  >  1348 [ACK] Seq=24464 Ack=1158 Win=64128 Len=1240"
"779","16.674550","23.192.220.4","192.168.2.103","TCP","1394","[TCP Retransmission] 443  >  1348 [PSH, ACK] Seq=25704 Ack=1158 Win=64128 Len=1240"
"781","16.674804","157.240.26.49","192.168.2.103","TCP","158","443  >  1349 [SYN, ACK] Seq=0 Ack=1 Win=65535 Len=0 MSS=1392 SACK_PERM WS=256"
"785","16.675100","192.168.2.103","23.192.220.4","TCP","146","1348  >  443 [ACK] Seq=1158 Ack=26944 Win=66304 Len=0"
"789","16.675437","192.168.2.103","157.240.26.49","TCP","146","1349  >  443 [ACK] Seq=1 Ack=1 Win=65536 Len=0"
"791","16.676351","23.192.220.4","192.168.2.103","TCP","1386","443  >  1348 [ACK] Seq=26944 Ack=1158 Win=64128 Len=1240"
"795","16.676685","192.168.2.103","157.240.26.49","TLSv1.2","365","Client Hello (SNI=graph.oculus.com)"
"797","16.677036","23.192.220.4","192.168.2.103","TCP","1386","443  >  1348 [ACK] Seq=28184 Ack=1158 Win=64128 Len=1240"
"801","16.677549","192.168.2.103","23.192.220.4","TCP","146","1348  >  443 [ACK] Seq=1158 Ack=29424 Win=66304 Len=0"
"803","16.679641","23.192.220.4","192.168.2.103","TCP","1394","443  >  1348 [PSH, ACK] Seq=29424 Ack=1158 Win=64128 Len=1240"
"808","16.680323","192.168.2.103","23.192.220.4","TCP","146","[TCP ACKed unseen segment] 1348  >  443 [ACK] Seq=1158 Ack=38104 Win=66304 Len=0"
"809","16.681495","23.192.220.4","192.168.2.103","TLSv1.3","1394","[TCP Previous segment not captured] , Continuation Data"
"810","16.681500","23.192.220.4","192.168.2.103","TLSv1.3","1394","Continuation Data"
"815","16.681727","192.168.2.103","23.192.220.4","TCP","146","[TCP Dup ACK 808#1] 1348  >  443 [ACK] Seq=1158 Ack=38104 Win=66304 Len=0"
"817","16.683767","23.192.220.4","192.168.2.103","TLSv1.3","1394","Continuation Data"
"822","16.684134","192.168.2.103","23.192.220.4","TCP","146","1348  >  443 [ACK] Seq=1158 Ack=40584 Win=66304 Len=0"
"824","16.685958","23.192.220.4","192.168.2.103","TLSv1.3","1394","Continuation Data"
"825","16.685962","23.192.220.4","192.168.2.103","TLSv1.3","1394","Continuation Data"
"826","16.685967","23.192.220.4","192.168.2.103","TLSv1.3","1394","Continuation Data"
"827","16.685971","23.192.220.4","192.168.2.103","TLSv1.3","1394","Continuation Data"
"828","16.685975","23.192.220.4","192.168.2.103","TLSv1.3","1394","Continuation Data"
"829","16.685979","23.192.220.4","192.168.2.103","TLSv1.3","1394","Continuation Data"
"830","16.685983","23.192.220.4","192.168.2.103","TLSv1.3","1394","Continuation Data"
"831","16.685988","23.192.220.4","192.168.2.103","TLSv1.3","1394","Continuation Data"
"832","16.685994","23.192.220.4","192.168.2.103","TCP","1394","443  >  1348 [ACK] Seq=51744 Ack=1158 Win=64128 Len=1240"
"836","16.686214","192.168.2.103","23.192.220.4","TCP","146","1348  >  443 [ACK] Seq=1158 Ack=41824 Win=65024 Len=0"
"838","16.688085","23.192.220.4","192.168.2.103","TCP","1394","443  >  1348 [ACK] Seq=52984 Ack=1158 Win=64128 Len=1240"
"840","16.688093","23.192.220.4","192.168.2.103","TCP","1394","[TCP Previous segment not captured] 443  >  1348 [ACK] Seq=56704 Ack=1158 Win=64128 Len=1240"
"841","16.688097","23.192.220.4","192.168.2.103","TCP","1394","443  >  1348 [PSH, ACK] Seq=57944 Ack=1158 Win=64128 Len=1240"
"842","16.688101","23.192.220.4","192.168.2.103","TCP","1394","443  >  1348 [ACK] Seq=59184 Ack=1158 Win=64128 Len=1240"
"843","16.688105","23.192.220.4","192.168.2.103","TCP","1394","443  >  1348 [ACK] Seq=60424 Ack=1158 Win=64128 Len=1240"
"844","16.688109","23.192.220.4","192.168.2.103","TCP","1394","443  >  1348 [PSH, ACK] Seq=61664 Ack=1158 Win=64128 Len=1240"
"845","16.688114","23.192.220.4","192.168.2.103","TCP","1394","443  >  1348 [ACK] Seq=62904 Ack=1158 Win=64128 Len=1240"
"849","16.688331","192.168.2.103","23.192.220.4","TCP","146","1348  >  443 [ACK] Seq=1158 Ack=52984 Win=66304 Len=0"
"851","16.689707","23.192.220.4","192.168.2.103","TCP","1394","[TCP Out-Of-Order] 443  >  1348 [ACK] Seq=55464 Ack=1158 Win=64128 Len=1240"
"852","16.689711","23.192.220.4","192.168.2.103","TCP","1394","443  >  1348 [ACK] Seq=64144 Ack=1158 Win=64128 Len=1240"
"853","16.689714","23.192.220.4","192.168.2.103","TCP","1394","443  >  1348 [PSH, ACK] Seq=65384 Ack=1158 Win=64128 Len=1240"
"854","16.689719","23.192.220.4","192.168.2.103","TCP","1394","443  >  1348 [ACK] Seq=66624 Ack=1158 Win=64128 Len=1240"
"855","16.689723","23.192.220.4","192.168.2.103","TCP","1394","443  >  1348 [ACK] Seq=67864 Ack=1158 Win=64128 Len=1240"
"856","16.689728","23.192.220.4","192.168.2.103","TCP","1394","443  >  1348 [PSH, ACK] Seq=69104 Ack=1158 Win=64128 Len=1240"
"857","16.689732","23.192.220.4","192.168.2.103","TCP","600","443  >  1348 [PSH, ACK] Seq=70344 Ack=1158 Win=64128 Len=446"
"861","16.690029","192.168.2.103","23.192.220.4","TCP","146","[TCP ACKed unseen segment] 1348  >  443 [ACK] Seq=1158 Ack=55464 Win=66304 Len=0"
"865","16.690635","192.168.2.103","23.192.220.4","TCP","146","[TCP ACKed unseen segment] 1348  >  443 [ACK] Seq=1158 Ack=70790 Win=66304 Len=0"
"867","16.692017","157.240.26.49","192.168.2.103","TCP","146","443  >  1349 [ACK] Seq=1 Ack=220 Win=66816 Len=0"
"872","16.697716","192.168.2.103","157.240.26.49","TCP","154","[TCP ACKed unseen segment] 1349  >  443 [ACK] Seq=220 Ack=3568 Win=65536 Len=0"
"873","16.697721","192.168.2.103","157.240.26.49","TLSv1.2","280","Client Key Exchange, Change Cipher Spec, Encrypted Handshake Message"
"876","16.707823","157.240.26.49","192.168.2.103","TLSv1.2","197","[TCP Previous segment not captured] , Change Cipher Spec, Encrypted Handshake Message"
"878","16.708438","157.240.26.49","192.168.2.103","TLSv1.2","227","Application Data"
"882","16.708810","192.168.2.103","157.240.26.49","TLSv1.2","207","Application Data"
"883","16.708814","192.168.2.103","157.240.26.49","TLSv1.2","210","Application Data"
"884","16.708818","192.168.2.103","157.240.26.49","TLSv1.2","196","Application Data"
"885","16.708822","192.168.2.103","157.240.26.49","TLSv1.2","197","Application Data"
"889","16.710138","192.168.2.103","157.240.26.49","TCP","1394","1349  >  443 [ACK] Seq=540 Ack=3700 Win=65536 Len=1240 [TCP PDU reassembled in 894]"
"890","16.710143","192.168.2.103","157.240.26.49","TCP","1394","1349  >  443 [ACK] Seq=1780 Ack=3700 Win=65536 Len=1240 [TCP PDU reassembled in 894]"
"891","16.710147","192.168.2.103","157.240.26.49","TCP","1394","1349  >  443 [ACK] Seq=3020 Ack=3700 Win=65536 Len=1240 [TCP PDU reassembled in 894]"
"892","16.710152","192.168.2.103","157.240.26.49","TCP","1394","1349  >  443 [ACK] Seq=4260 Ack=3700 Win=65536 Len=1240 [TCP PDU reassembled in 894]"
"893","16.710156","192.168.2.103","157.240.26.49","TCP","1394","1349  >  443 [ACK] Seq=5500 Ack=3700 Win=65536 Len=1240 [TCP PDU reassembled in 894]"
"894","16.710161","192.168.2.103","157.240.26.49","TLSv1.2","1221","Application Data"
"895","16.710166","192.168.2.103","157.240.26.49","TLSv1.2","192","Application Data"
"897","16.717108","157.240.26.49","192.168.2.103","TLSv1.2","184","Application Data"
"899","16.718321","157.240.26.49","192.168.2.103","TCP","146","443  >  1349 [ACK] Seq=3738 Ack=3020 Win=71680 Len=0"
"901","16.718701","157.240.26.49","192.168.2.103","TCP","146","443  >  1349 [ACK] Seq=3738 Ack=5500 Win=76544 Len=0"
"903","16.719175","157.240.26.49","192.168.2.103","TCP","154","443  >  1349 [ACK] Seq=3738 Ack=7807 Win=81664 Len=0"
"904","16.719180","157.240.26.49","192.168.2.103","TLSv1.2","196","Application Data"
"908","16.719832","192.168.2.103","157.240.26.49","TCP","146","1349  >  443 [ACK] Seq=7845 Ack=3780 Win=65280 Len=0"
"910","16.758567","157.240.26.49","192.168.2.103","TCP","1386","443  >  1349 [ACK] Seq=3780 Ack=7845 Win=81664 Len=1240 [TCP PDU reassembled in 913]"
"912","16.759126","157.240.26.49","192.168.2.103","TCP","1394","443  >  1349 [PSH, ACK] Seq=5020 Ack=7845 Win=81664 Len=1240 [TCP PDU reassembled in 913]"
"913","16.759135","157.240.26.49","192.168.2.103","TLSv1.2","592","Application Data"
"914","16.759139","157.240.26.49","192.168.2.103","TLSv1.2","338","Application Data"
"918","16.759710","192.168.2.103","157.240.26.49","TCP","146","1349  >  443 [ACK] Seq=7845 Ack=6882 Win=65536 Len=0"
"922","16.760941","192.168.2.103","157.240.26.49","TLSv1.2","196","Application Data"
"923","16.760952","192.168.2.103","157.240.26.49","TCP","1394","1349  >  443 [ACK] Seq=7887 Ack=6882 Win=65536 Len=1240 [TCP PDU reassembled in 928]"
"924","16.760958","192.168.2.103","157.240.26.49","TCP","1394","1349  >  443 [ACK] Seq=9127 Ack=6882 Win=65536 Len=1240 [TCP PDU reassembled in 928]"
"925","16.760962","192.168.2.103","157.240.26.49","TCP","1394","1349  >  443 [ACK] Seq=10367 Ack=6882 Win=65536 Len=1240 [TCP PDU reassembled in 928]"
"926","16.760965","192.168.2.103","157.240.26.49","TCP","1394","1349  >  443 [ACK] Seq=11607 Ack=6882 Win=65536 Len=1240 [TCP PDU reassembled in 928]"
"927","16.760973","192.168.2.103","157.240.26.49","TCP","1394","1349  >  443 [ACK] Seq=12847 Ack=6882 Win=65536 Len=1240 [TCP PDU reassembled in 928]"
"928","16.760976","192.168.2.103","157.240.26.49","TLSv1.2","1196","Application Data"
"930","16.769286","157.240.26.49","192.168.2.103","TCP","146","443  >  1349 [ACK] Seq=6882 Ack=9127 Win=83968 Len=0"
"932","16.769662","157.240.26.49","192.168.2.103","TCP","146","443  >  1349 [ACK] Seq=6882 Ack=11607 Win=89088 Len=0"
"934","16.770140","157.240.26.49","192.168.2.103","TCP","154","443  >  1349 [ACK] Seq=6882 Ack=14087 Win=93952 Len=0"
"935","16.770151","157.240.26.49","192.168.2.103","TLSv1.2","196","Application Data"
"950","16.810897","157.240.26.49","192.168.2.103","TCP","1386","443  >  1349 [ACK] Seq=6924 Ack=15129 Win=96512 Len=1240 [TCP PDU reassembled in 953]"
"952","16.811753","157.240.26.49","192.168.2.103","TCP","1394","443  >  1349 [PSH, ACK] Seq=8164 Ack=15129 Win=96512 Len=1240 [TCP PDU reassembled in 953]"
"953","16.811760","157.240.26.49","192.168.2.103","TLSv1.2","315","Application Data"
"954","16.811763","157.240.26.49","192.168.2.103","TLSv1.2","338","Application Data"
"962","16.813184","157.240.26.49","192.168.2.103","TCP","1394","[TCP Retransmission] 443  >  1349 [PSH, ACK] Seq=8164 Ack=15129 Win=96512 Len=1240 [TCP PDU reassembled in 953]"
"963","16.813191","157.240.26.49","192.168.2.103","TCP","315","[TCP Retransmission] 443  >  1349 [ACK] Seq=9404 Ack=15129 Win=96512 Len=161 [TCP PDU reassembled in 953]"
"964","16.813193","157.240.26.49","192.168.2.103","TCP","338","[TCP Retransmission] 443  >  1349 [PSH, ACK] Seq=9565 Ack=15129 Win=96512 Len=184"
"979","16.817294","157.240.26.49","192.168.2.103","TCP","315","[TCP Retransmission] 443  >  1349 [ACK] Seq=9404 Ack=15129 Win=96512 Len=161 [TCP PDU reassembled in 953]"
"980","16.817297","157.240.26.49","192.168.2.103","TCP","338","[TCP Retransmission] 443  >  1349 [PSH, ACK] Seq=9565 Ack=15129 Win=96512 Len=184"
"981","16.817704","157.240.26.49","192.168.2.103","TCP","1394","[TCP Retransmission] 443  >  1349 [PSH, ACK] Seq=8164 Ack=15129 Win=96512 Len=1240 [TCP PDU reassembled in 953]"
"982","16.817707","157.240.26.49","192.168.2.103","TCP","315","[TCP Retransmission] 443  >  1349 [ACK] Seq=9404 Ack=15129 Win=96512 Len=161 [TCP PDU reassembled in 953]"
"983","16.817709","157.240.26.49","192.168.2.103","TCP","338","[TCP Retransmission] 443  >  1349 [PSH, ACK] Seq=9565 Ack=15129 Win=96512 Len=184"
"996","16.822598","157.240.26.49","192.168.2.103","TCP","1394","[TCP Retransmission] 443  >  1349 [PSH, ACK] Seq=8164 Ack=15129 Win=96512 Len=1240 [TCP PDU reassembled in 953]"
"997","16.822600","157.240.26.49","192.168.2.103","TCP","315","[TCP Retransmission] 443  >  1349 [ACK] Seq=9404 Ack=15129 Win=96512 Len=161 [TCP PDU reassembled in 953]"
"998","16.822603","157.240.26.49","192.168.2.103","TCP","338","[TCP Retransmission] 443  >  1349 [PSH, ACK] Seq=9565 Ack=15129 Win=96512 Len=184"
"1003","16.823199","192.168.2.103","157.240.26.49","TCP","146","1349  >  443 [ACK] Seq=15129 Ack=8164 Win=65536 Len=0"
"1005","16.823548","157.240.26.49","192.168.2.103","TCP","1394","[TCP Retransmission] 443  >  1349 [PSH, ACK] Seq=8164 Ack=15129 Win=96512 Len=1240 [TCP PDU reassembled in 953]"
"1006","16.823551","157.240.26.49","192.168.2.103","TCP","315","[TCP Retransmission] 443  >  1349 [ACK] Seq=9404 Ack=15129 Win=96512 Len=161 [TCP PDU reassembled in 953]"
"1007","16.823554","157.240.26.49","192.168.2.103","TCP","338","[TCP Retransmission] 443  >  1349 [PSH, ACK] Seq=9565 Ack=15129 Win=96512 Len=184"
"1011","16.824069","192.168.2.103","157.240.26.49","TCP","154","1349  >  443 [ACK] Seq=15129 Ack=9749 Win=65536 Len=0"
"1012","16.824072","192.168.2.103","157.240.26.49","TLSv1.2","196","Application Data"
"1016","16.825265","192.168.2.103","157.240.26.49","TCP","154","1349  >  443 [ACK] Seq=15129 Ack=9749 Win=65536 Len=0"
"1017","16.825269","192.168.2.103","157.240.26.49","TCP","1394","1349  >  443 [ACK] Seq=15171 Ack=9749 Win=65536 Len=1240 [TCP PDU reassembled in 1022]"
"1018","16.825272","192.168.2.103","157.240.26.49","TCP","1394","1349  >  443 [ACK] Seq=16411 Ack=9749 Win=65536 Len=1240 [TCP PDU reassembled in 1022]"
"1019","16.825275","192.168.2.103","157.240.26.49","TCP","1394","1349  >  443 [ACK] Seq=17651 Ack=9749 Win=65536 Len=1240 [TCP PDU reassembled in 1022]"
"1020","16.825277","192.168.2.103","157.240.26.49","TCP","1394","1349  >  443 [ACK] Seq=18891 Ack=9749 Win=65536 Len=1240 [TCP PDU reassembled in 1022]"
"1021","16.825279","192.168.2.103","157.240.26.49","TCP","1394","1349  >  443 [ACK] Seq=20131 Ack=9749 Win=65536 Len=1240 [TCP PDU reassembled in 1022]"
"1022","16.825282","192.168.2.103","157.240.26.49","TLSv1.2","1193","Application Data"
"1024","16.833518","157.240.26.49","192.168.2.103","TCP","146","443  >  1349 [ACK] Seq=9749 Ack=16411 Win=99072 Len=0"
"1026","16.833902","157.240.26.49","192.168.2.103","TCP","146","443  >  1349 [ACK] Seq=9749 Ack=18891 Win=103936 Len=0"
"1028","16.834372","157.240.26.49","192.168.2.103","TCP","154","443  >  1349 [ACK] Seq=9749 Ack=21371 Win=108800 Len=0"
"1029","16.834375","157.240.26.49","192.168.2.103","TLSv1.2","196","Application Data"
"1031","16.869675","157.240.26.49","192.168.2.103","TCP","1386","443  >  1349 [ACK] Seq=9791 Ack=22410 Win=111360 Len=1240 [TCP PDU reassembled in 1035]"
"1033","16.870054","157.240.26.49","192.168.2.103","TCP","1386","443  >  1349 [PSH, ACK] Seq=11031 Ack=22410 Win=111360 Len=1240 [TCP PDU reassembled in 1035]"
"1035","16.870492","157.240.26.49","192.168.2.103","TLSv1.2","560","Application Data"
"1037","16.870678","157.240.26.49","192.168.2.103","TLSv1.2","330","Application Data"
"1040","16.871290","157.240.26.49","192.168.2.103","TCP","330","[TCP Retransmission] 443  >  1349 [PSH, ACK] Seq=12685 Ack=22410 Win=111360 Len=184"
"1043","16.871464","192.168.2.103","157.240.26.49","TCP","154","1349  >  443 [ACK] Seq=22410 Ack=12685 Win=65536 Len=0"
"1044","16.871468","192.168.2.103","157.240.26.49","TLSv1.2","196","Application Data"
"1045","16.872506","192.168.2.103","157.240.26.49","TCP","1394","1349  >  443 [ACK] Seq=22452 Ack=12685 Win=65536 Len=1240 [TCP PDU reassembled in 1050]"
"1046","16.872517","192.168.2.103","157.240.26.49","TCP","1394","1349  >  443 [ACK] Seq=23692 Ack=12685 Win=65536 Len=1240 [TCP PDU reassembled in 1050]"
"1047","16.872520","192.168.2.103","157.240.26.49","TCP","1394","1349  >  443 [ACK] Seq=24932 Ack=12685 Win=65536 Len=1240 [TCP PDU reassembled in 1050]"
"1048","16.872523","192.168.2.103","157.240.26.49","TCP","1394","1349  >  443 [ACK] Seq=26172 Ack=12685 Win=65536 Len=1240 [TCP PDU reassembled in 1050]"
"1049","16.872528","192.168.2.103","157.240.26.49","TCP","1394","1349  >  443 [ACK] Seq=27412 Ack=12685 Win=65536 Len=1240 [TCP PDU reassembled in 1050]"
"1050","16.872530","192.168.2.103","157.240.26.49","TLSv1.2","1193","Application Data"
"1054","16.872854","157.240.26.49","192.168.2.103","TCP","330","[TCP Retransmission] 443  >  1349 [PSH, ACK] Seq=12685 Ack=22410 Win=111360 Len=184"
"1058","16.873703","192.168.2.103","157.240.26.49","TCP","146","1349  >  443 [ACK] Seq=22410 Ack=12685 Win=65536 Len=0"
"1060","16.882451","157.240.26.49","192.168.2.103","TCP","146","443  >  1349 [ACK] Seq=12869 Ack=23692 Win=113920 Len=0"
"1062","16.882786","157.240.26.49","192.168.2.103","TCP","146","443  >  1349 [ACK] Seq=12869 Ack=26172 Win=118784 Len=0"
"1064","16.883583","157.240.26.49","192.168.2.103","TCP","154","443  >  1349 [ACK] Seq=12869 Ack=28652 Win=123648 Len=0"
"1065","16.883592","157.240.26.49","192.168.2.103","TLSv1.2","196","Application Data"
"1069","16.884153","192.168.2.103","157.240.26.49","TCP","146","1349  >  443 [ACK] Seq=29691 Ack=12911 Win=65280 Len=0"
"1071","16.921010","157.240.26.49","192.168.2.103","TCP","1386","443  >  1349 [ACK] Seq=12911 Ack=29691 Win=126208 Len=1240 [TCP PDU reassembled in 1075]"
"1073","16.921363","157.240.26.49","192.168.2.103","TCP","1386","443  >  1349 [PSH, ACK] Seq=14151 Ack=29691 Win=126208 Len=1240 [TCP PDU reassembled in 1075]"
"1075","16.921806","157.240.26.49","192.168.2.103","TLSv1.2","300","Application Data"
"1077","16.922013","157.240.26.49","192.168.2.103","TLSv1.2","330","Application Data"
"1081","16.922473","192.168.2.103","157.240.26.49","TCP","146","1349  >  443 [ACK] Seq=29691 Ack=15545 Win=65536 Len=0"
"1085","16.923588","192.168.2.103","157.240.26.49","TCP","154","1349  >  443 [ACK] Seq=29691 Ack=15729 Win=65536 Len=0"
"1086","16.923599","192.168.2.103","157.240.26.49","TLSv1.2","196","Application Data"
"1087","16.923603","192.168.2.103","157.240.26.49","TCP","1394","1349  >  443 [ACK] Seq=29733 Ack=15729 Win=65536 Len=1240 [TCP PDU reassembled in 1097]"
"1088","16.923612","192.168.2.103","157.240.26.49","TCP","1394","1349  >  443 [ACK] Seq=30973 Ack=15729 Win=65536 Len=1240 [TCP PDU reassembled in 1097]"
"1089","16.923616","192.168.2.103","157.240.26.49","TCP","1394","1349  >  443 [ACK] Seq=32213 Ack=15729 Win=65536 Len=1240 [TCP PDU reassembled in 1097]"
"1094","16.930074","192.168.2.103","157.240.26.49","TCP","154","1349  >  443 [ACK] Seq=29691 Ack=15729 Win=65536 Len=0"
"1095","16.930591","192.168.2.103","157.240.26.49","TCP","1394","1349  >  443 [ACK] Seq=33453 Ack=15729 Win=65536 Len=1240 [TCP PDU reassembled in 1097]"
"1096","16.930599","192.168.2.103","157.240.26.49","TCP","1394","1349  >  443 [ACK] Seq=34693 Ack=15729 Win=65536 Len=1240 [TCP PDU reassembled in 1097]"
"1097","16.930602","192.168.2.103","157.240.26.49","TLSv1.2","1193","Application Data"
"1099","16.941067","157.240.26.49","192.168.2.103","TCP","146","443  >  1349 [ACK] Seq=15729 Ack=30973 Win=128768 Len=0"
"1101","16.941272","157.240.26.49","192.168.2.103","TCP","154","443  >  1349 [ACK] Seq=15729 Ack=33453 Win=133632 Len=0"
"1102","16.941282","157.240.26.49","192.168.2.103","TCP","154","443  >  1349 [ACK] Seq=15729 Ack=35933 Win=138752 Len=0"
"1103","16.941286","157.240.26.49","192.168.2.103","TLSv1.2","196","Application Data"
"1106","16.977895","157.240.26.49","192.168.2.103","TCP","1386","443  >  1349 [ACK] Seq=15771 Ack=36972 Win=141056 Len=1240 [TCP PDU reassembled in 1109]"
"1108","16.978281","157.240.26.49","192.168.2.103","TCP","1394","443  >  1349 [PSH, ACK] Seq=17011 Ack=36972 Win=141056 Len=1240 [TCP PDU reassembled in 1109]"
"1109","16.978287","157.240.26.49","192.168.2.103","TLSv1.2","560","Application Data"
"1116","16.979662","192.168.2.103","157.240.26.49","TCP","154","[TCP ACKed unseen segment] 1349  >  443 [ACK] Seq=36972 Ack=18841 Win=65536 Len=0"
"1117","16.979666","192.168.2.103","157.240.26.49","TLSv1.2","196","Application Data"
"1118","16.980661","192.168.2.103","157.240.26.49","TCP","1394","1349  >  443 [ACK] Seq=37014 Ack=18841 Win=65536 Len=1240 [TCP PDU reassembled in 1123]"
"1119","16.980667","192.168.2.103","157.240.26.49","TCP","1394","1349  >  443 [ACK] Seq=38254 Ack=18841 Win=65536 Len=1240 [TCP PDU reassembled in 1123]"
"1120","16.980669","192.168.2.103","157.240.26.49","TCP","1394","1349  >  443 [ACK] Seq=39494 Ack=18841 Win=65536 Len=1240 [TCP PDU reassembled in 1123]"
"1121","16.980672","192.168.2.103","157.240.26.49","TCP","1394","1349  >  443 [ACK] Seq=40734 Ack=18841 Win=65536 Len=1240 [TCP PDU reassembled in 1123]"
"1122","16.980675","192.168.2.103","157.240.26.49","TCP","1394","1349  >  443 [ACK] Seq=41974 Ack=18841 Win=65536 Len=1240 [TCP PDU reassembled in 1123]"
"1123","16.980683","192.168.2.103","157.240.26.49","TLSv1.2","1193","Application Data"
"1127","16.980861","192.168.2.103","157.240.26.49","TCP","146","1349  >  443 [ACK] Seq=36972 Ack=18841 Win=65536 Len=0"
"1129","16.989643","157.240.26.49","192.168.2.103","TCP","146","[TCP Previous segment not captured] 443  >  1349 [ACK] Seq=18841 Ack=38254 Win=143616 Len=0"
"1131","16.989955","157.240.26.49","192.168.2.103","TCP","154","443  >  1349 [ACK] Seq=18841 Ack=40734 Win=148480 Len=0"
"1132","16.989962","157.240.26.49","192.168.2.103","TCP","154","443  >  1349 [ACK] Seq=18841 Ack=43214 Win=153600 Len=0"
"1134","16.990292","157.240.26.49","192.168.2.103","TLSv1.2","188","Application Data"
"1136","17.028830","157.240.26.49","192.168.2.103","TCP","1386","443  >  1349 [ACK] Seq=18883 Ack=44253 Win=155904 Len=1240 [TCP PDU reassembled in 1140]"
"1138","17.029181","157.240.26.49","192.168.2.103","TCP","1386","443  >  1349 [PSH, ACK] Seq=20123 Ack=44253 Win=155904 Len=1240 [TCP PDU reassembled in 1140]"
"1140","17.029699","157.240.26.49","192.168.2.103","TLSv1.2","318","Application Data"
"1142","17.029922","157.240.26.49","192.168.2.103","TLSv1.2","330","Application Data"
"1146","17.030153","192.168.2.103","157.240.26.49","TCP","146","1349  >  443 [ACK] Seq=44253 Ack=21535 Win=65536 Len=0"
"1148","17.091199","192.168.2.103","157.240.26.49","TCP","146","1349  >  443 [ACK] Seq=44253 Ack=21719 Win=65536 Len=0"
"1153","17.091487","192.168.2.103","157.240.26.49","TCP","146","[TCP Dup ACK 1148#1] 1349  >  443 [ACK] Seq=44253 Ack=21719 Win=65536 Len=0"
"1161","17.262246","192.168.2.103","157.240.26.49","TLSv1.2","188","Application Data"
"1166","17.263256","192.168.2.103","157.240.26.49","TLSv1.2","1394","[TCP Previous segment not captured] , Ignored Unknown Record"
"1167","17.263270","192.168.2.103","157.240.26.49","TLSv1.2","1394","Ignored Unknown Record"
"1168","17.263275","192.168.2.103","157.240.26.49","TLSv1.2","1394","Ignored Unknown Record"
"1172","17.264659","192.168.2.103","157.240.26.49","TCP","1394","[TCP Out-Of-Order] 1349  >  443 [ACK] Seq=44295 Ack=21719 Win=65536 Len=1240"
"1177","17.265094","192.168.2.103","157.240.26.49","TLSv1.2","1394","Ignored Unknown Record"
"1178","17.265106","192.168.2.103","157.240.26.49","TLSv1.2","1214","Ignored Unknown Record"
"1180","17.272297","157.240.26.49","192.168.2.103","TCP","146","443  >  1349 [ACK] Seq=21719 Ack=45535 Win=158464 Len=0"
"1182","17.272572","157.240.26.49","192.168.2.103","TCP","146","443  >  1349 [ACK] Seq=21719 Ack=48015 Win=163328 Len=0"
"1184","17.273214","157.240.26.49","192.168.2.103","TCP","146","443  >  1349 [ACK] Seq=21719 Ack=50495 Win=168448 Len=0"
