"No.","Time","Source","Destination","Protocol","Length","Info"
"598","15.130757","192.168.2.103","157.240.26.49","TCP","217","[TCP Retransmission] 1189  >  443 [FIN, PSH, ACK] Seq=1 Ack=1 Win=256 Len=71"
"638","15.441377","192.168.2.103","157.240.26.49","TCP","217","[TCP Retransmission] 1189  >  443 [FIN, PSH, ACK] Seq=1 Ack=1 Win=256 Len=71"
"648","16.052268","192.168.2.103","157.240.26.49","TCP","217","[TCP Retransmission] 1189  >  443 [FIN, PSH, ACK] Seq=1 Ack=1 Win=256 Len=71"
"698","16.650015","192.168.2.103","23.192.220.4","TCP","234","[TCP Retransmission] 1348  >  443 [PSH, ACK] Seq=622 Ack=265 Win=66048 Len=80"
"699","16.650029","192.168.2.103","23.192.220.4","TCP","240","[TCP Retransmission] 1348  >  443 [PSH, ACK] Seq=702 Ack=265 Win=66048 Len=86"
"979","16.817294","157.240.26.49","192.168.2.103","TCP","315","[TCP Retransmission] 443  >  1349 [ACK] Seq=9404 Ack=15129 Win=96512 Len=161 [TCP PDU reassembled in 953]"
"980","16.817297","157.240.26.49","192.168.2.103","TCP","338","[TCP Retransmission] 443  >  1349 [PSH, ACK] Seq=9565 Ack=15129 Win=96512 Len=184"
"1283","17.715315","157.240.26.49","192.168.2.103","TCP","208","[TCP Retransmission] 443  >  1352 [PSH, ACK] Seq=4906 Ack=2902 Win=71168 Len=54"
"1332","18.455750","192.168.2.103","157.240.26.49","TCP","217","[TCP Retransmission] 1189  >  443 [FIN, PSH, ACK] Seq=1 Ack=1 Win=256 Len=71"
"1450","19.272964","157.240.26.49","192.168.2.103","TCP","1394","[TCP Retransmission] 443  >  1352 [PSH, ACK] Seq=28476 Ack=3976 Win=77056 Len=1240 [TCP PDU reassembled in 1458]"
"1451","19.272968","157.240.26.49","192.168.2.103","TCP","1394","[TCP Retransmission] 443  >  1352 [ACK] Seq=29716 Ack=3976 Win=77056 Len=1240 [TCP PDU reassembled in 1458]"
"1452","19.272971","157.240.26.49","192.168.2.103","TCP","1394","[TCP Retransmission] 443  >  1352 [PSH, ACK] Seq=30956 Ack=3976 Win=77056 Len=1240 [TCP PDU reassembled in 1458]"
"1536","19.287815","157.240.26.49","192.168.2.103","TCP","1394","[TCP Retransmission] 443  >  1352 [ACK] Seq=47973 Ack=3976 Win=77056 Len=1240 [TCP PDU reassembled in 1557]"
"1599","19.301641","157.240.26.49","192.168.2.103","TCP","1386","[TCP Retransmission] 443  >  1352 [ACK] Seq=90833 Ack=3976 Win=77056 Len=1240"
"1601","19.303235","157.240.26.49","192.168.2.103","TCP","1394","[TCP Retransmission] 443  >  1352 [PSH, ACK] Seq=92073 Ack=3976 Win=77056 Len=1240 [TCP PDU reassembled in 1597]"
"1741","19.452576","157.240.26.49","192.168.2.103","TCP","1394","[TCP Retransmission] 443  >  1352 [ACK] Seq=167951 Ack=3976 Win=77056 Len=1240 [TCP PDU reassembled in 1738]"
"1871","22.080138","192.168.2.103","157.240.26.49","TCP","217","[TCP Retransmission] 1189  >  443 [FIN, PSH, ACK] Seq=1 Ack=1 Win=256 Len=71"
"1993","22.358143","192.168.2.103","34.36.199.114","TCP","828","[TCP Retransmission] 1364  >  443 [PSH, ACK] Seq=1 Ack=1 Win=66304 Len=674"
"2069","22.380146","34.36.199.114","192.168.2.103","TCP","373","[TCP Retransmission] 443  >  1360 [PSH, ACK] Seq=1 Ack=675 Win=269056 Len=219"
"3054","26.883455","192.168.2.103","157.240.26.49","TCP","217","[TCP Retransmission] 1189  >  443 [FIN, PSH, ACK] Seq=1 Ack=1 Win=256 Len=71"
"3057","26.883714","192.168.2.103","157.240.26.49","TCP","217","[TCP Retransmission] 1189  >  443 [FIN, PSH, ACK] Seq=1 Ack=1 Win=256 Len=71"
"3158","28.886467","192.168.2.103","172.217.4.202","TCP","1386","[TCP Retransmission] 1373  >  443 [ACK] Seq=429 Ack=4692 Win=66048 Len=1240"
"3166","28.895010","192.168.2.103","172.217.4.202","TCP","839","[TCP Retransmission] 1373  >  443 [PSH, ACK] Seq=1669 Ack=4692 Win=66048 Len=693 [TCP PDU reassembled in 3152]"
"3301","32.646153","192.168.2.103","172.217.4.202","TCP","1394","[TCP Retransmission] 1373  >  443 [ACK] Seq=4295 Ack=5951 Win=66304 Len=1240"
"3777","46.004065","172.217.4.202","192.168.2.103","TCP","1386","[TCP Retransmission] 443  >  1378 [ACK] Seq=72891 Ack=1003 Win=269056 Len=1240"
"3780","46.006202","172.217.4.202","192.168.2.103","TCP","1394","[TCP Retransmission] 443  >  1378 [ACK] Seq=76611 Ack=1003 Win=269056 Len=1240"
"3781","46.006206","172.217.4.202","192.168.2.103","TCP","1394","[TCP Retransmission] 443  >  1378 [PSH, ACK] Seq=77851 Ack=1003 Win=269056 Len=1240"
"3782","46.006210","172.217.4.202","192.168.2.103","TCP","1394","[TCP Retransmission] 443  >  1378 [ACK] Seq=79091 Ack=1003 Win=269056 Len=1240"
"3948","46.043477","172.217.4.202","192.168.2.103","TCP","1394","[TCP Retransmission] 443  >  1378 [ACK] Seq=195651 Ack=1003 Win=269056 Len=1240"
"3949","46.043483","172.217.4.202","192.168.2.103","TCP","1394","[TCP Retransmission] 443  >  1378 [ACK] Seq=196891 Ack=1003 Win=269056 Len=1240"
"5138","46.309404","172.217.4.202","192.168.2.103","TCP","1394","[TCP Retransmission] 443  >  1378 [ACK] Seq=965691 Ack=1003 Win=269056 Len=1240"
"5644","46.421083","172.217.4.202","192.168.2.103","TCP","1394","[TCP Retransmission] 443  >  1378 [ACK] Seq=1267011 Ack=1003 Win=269056 Len=1240"
"5645","46.421085","172.217.4.202","192.168.2.103","TCP","1394","[TCP Retransmission] 443  >  1378 [ACK] Seq=1269491 Ack=1003 Win=269056 Len=1240"
"5646","46.421087","172.217.4.202","192.168.2.103","TCP","1394","[TCP Retransmission] 443  >  1378 [ACK] Seq=1270731 Ack=1003 Win=269056 Len=1240"
"5832","46.457870","192.168.2.103","172.217.4.202","TCP","1386","[TCP Retransmission] 1373  >  443 [PSH, ACK] Seq=14653 Ack=9108 Win=65536 Len=1240 [TCP PDU reassembled in 5696]"
"5917","46.477143","172.217.4.202","192.168.2.103","TCP","1394","[TCP Retransmission] 443  >  1378 [PSH, ACK] Seq=1431931 Ack=1003 Win=269056 Len=1240"
"6272","50.547867","192.168.2.103","157.240.26.49","TCP","217","[TCP Retransmission] 1295  >  443 [FIN, PSH, ACK] Seq=1 Ack=1 Win=253 Len=71"
"6289","50.857532","192.168.2.103","157.240.26.49","TCP","217","[TCP Retransmission] 1295  >  443 [FIN, PSH, ACK] Seq=1 Ack=1 Win=253 Len=71"
"6317","51.471499","192.168.2.103","157.240.26.49","TCP","217","[TCP Retransmission] 1295  >  443 [FIN, PSH, ACK] Seq=1 Ack=1 Win=253 Len=71"
"6341","52.675732","192.168.2.103","157.240.26.49","TCP","217","[TCP Retransmission] 1295  >  443 [FIN, PSH, ACK] Seq=1 Ack=1 Win=253 Len=71"
"6413","55.082105","192.168.2.103","157.240.26.49","TCP","217","[TCP Retransmission] 1295  >  443 [FIN, PSH, ACK] Seq=1 Ack=1 Win=253 Len=71"
"6658","56.308949","172.217.4.202","192.168.2.103","TCP","1394","[TCP Retransmission] 443  >  1378 [PSH, ACK] Seq=1641613 Ack=1577 Win=268544 Len=1240 [TCP PDU reassembled in 6647]"
"6976","56.383138","172.217.4.202","192.168.2.103","TCP","1394","[TCP Retransmission] 443  >  1378 [PSH, ACK] Seq=1859853 Ack=1577 Win=268544 Len=1240"
"7054","56.399225","172.217.4.202","192.168.2.103","TCP","1394","[TCP Retransmission] 443  >  1378 [ACK] Seq=1898293 Ack=1577 Win=268544 Len=1240"
"7055","56.399229","172.217.4.202","192.168.2.103","TCP","1394","[TCP Retransmission] 443  >  1378 [PSH, ACK] Seq=1899533 Ack=1577 Win=268544 Len=1240"
"7056","56.399234","172.217.4.202","192.168.2.103","TCP","1394","[TCP Retransmission] 443  >  1378 [ACK] Seq=1900773 Ack=1577 Win=268544 Len=1240"
"7074","56.403341","172.217.4.202","192.168.2.103","TCP","1394","[TCP Retransmission] 443  >  1378 [ACK] Seq=1906973 Ack=1577 Win=268544 Len=1240"
"7496","56.497595","172.217.4.202","192.168.2.103","TCP","1394","[TCP Retransmission] 443  >  1378 [PSH, ACK] Seq=2143701 Ack=1577 Win=268544 Len=1240 [TCP PDU reassembled in 7566]"
"7497","56.497599","172.217.4.202","192.168.2.103","TCP","1394","[TCP Retransmission] 443  >  1378 [ACK] Seq=2144941 Ack=1577 Win=268544 Len=1240 [TCP PDU reassembled in 7566]"
"7735","56.551417","172.217.4.202","192.168.2.103","TCP","1394","[TCP Retransmission] 443  >  1378 [ACK] Seq=2282581 Ack=1577 Win=268544 Len=1240"
"7992","56.603415","172.217.4.202","192.168.2.103","TCP","1394","[TCP Retransmission] 443  >  1378 [PSH, ACK] Seq=2448741 Ack=1577 Win=268544 Len=1240"
"8101","56.625278","172.217.4.202","192.168.2.103","TCP","1394","[TCP Retransmission] 443  >  1378 [ACK] Seq=2520661 Ack=1577 Win=268544 Len=1240"
"8103","56.625283","172.217.4.202","192.168.2.103","TCP","1394","[TCP Retransmission] 443  >  1378 [ACK] Seq=2524381 Ack=1577 Win=268544 Len=1240"
"8143","56.634165","172.217.4.202","192.168.2.103","TCP","1394","[TCP Retransmission] 443  >  1378 [PSH, ACK] Seq=2546701 Ack=1577 Win=268544 Len=1240 [TCP PDU reassembled in 8231]"
"8144","56.634169","172.217.4.202","192.168.2.103","TCP","1394","[TCP Retransmission] 443  >  1378 [ACK] Seq=2547941 Ack=1577 Win=268544 Len=1240 [TCP PDU reassembled in 8231]"
"8305","56.669760","172.217.4.202","192.168.2.103","TCP","1394","[TCP Retransmission] 443  >  1378 [PSH, ACK] Seq=2643421 Ack=1577 Win=268544 Len=1240 [TCP PDU reassembled in 8310]"
"8867","56.797768","172.217.4.202","192.168.2.103","TCP","1394","[TCP Retransmission] 443  >  1378 [ACK] Seq=2969541 Ack=1577 Win=268544 Len=1240"
"9169","59.894299","192.168.2.103","157.240.26.49","TCP","217","[TCP Retransmission] 1295  >  443 [FIN, PSH, ACK] Seq=1 Ack=1 Win=253 Len=71"
"10199","66.136096","172.217.4.202","192.168.2.103","TCP","1394","[TCP Retransmission] 443  >  1378 [ACK] Seq=3783867 Ack=2151 Win=268032 Len=1240"
"10200","66.136099","172.217.4.202","192.168.2.103","TCP","1394","[TCP Retransmission] 443  >  1378 [ACK] Seq=3785107 Ack=2151 Win=268032 Len=1240"
"10201","66.136205","172.217.4.202","192.168.2.103","TCP","1394","[TCP Retransmission] 443  >  1378 [PSH, ACK] Seq=3786347 Ack=2151 Win=268032 Len=1240 [TCP PDU reassembled in 10224]"
"10278","66.150424","172.217.4.202","192.168.2.103","TCP","1394","[TCP Retransmission] 443  >  1378 [ACK] Seq=3827267 Ack=2151 Win=268032 Len=1240"
"11839","76.140090","172.217.4.202","192.168.2.103","TCP","1394","[TCP Retransmission] 443  >  1373 [PSH, ACK] Seq=228032 Ack=37730 Win=237824 Len=1240"
"11971","76.169379","172.217.4.202","192.168.2.103","TCP","1394","[TCP Retransmission] 443  >  1373 [ACK] Seq=344592 Ack=37730 Win=237824 Len=1240 [TCP PDU reassembled in 12001]"
"11973","76.169387","172.217.4.202","192.168.2.103","TCP","1394","[TCP Retransmission] 443  >  1373 [ACK] Seq=349552 Ack=37730 Win=237824 Len=1240 [TCP PDU reassembled in 12001]"
"12861","76.339405","172.217.4.202","192.168.2.103","TCP","1394","[TCP Retransmission] 443  >  1373 [ACK] Seq=1000552 Ack=37730 Win=237824 Len=1240 [TCP PDU reassembled in 12935]"
"12862","76.339408","172.217.4.202","192.168.2.103","TCP","1394","[TCP Retransmission] 443  >  1373 [ACK] Seq=1003032 Ack=37730 Win=237824 Len=1240 [TCP PDU reassembled in 12935]"
"13007","76.367533","172.217.4.202","192.168.2.103","TCP","1394","[TCP Retransmission] 443  >  1373 [ACK] Seq=1104712 Ack=37730 Win=237824 Len=1240"
"13024","76.371454","172.217.4.202","192.168.2.103","TCP","1394","[TCP Retransmission] 443  >  1373 [ACK] Seq=1123280 Ack=37730 Win=237824 Len=1240"
"13535","76.482883","172.217.4.202","192.168.2.103","TCP","1394","[TCP Retransmission] 443  >  1373 [ACK] Seq=1455600 Ack=37730 Win=237824 Len=1240"
"13832","78.812433","192.168.2.103","172.217.4.202","TCP","1394","[TCP Retransmission] 1373  >  443 [ACK] Seq=37730 Ack=1612117 Win=133888 Len=1240"
"15222","86.528218","172.217.4.202","192.168.2.103","TCP","1394","[TCP Retransmission] 443  >  1373 [ACK] Seq=2477584 Ack=42170 Win=233728 Len=1240"
"16037","86.705688","172.217.4.202","192.168.2.103","TCP","1394","[TCP Retransmission] 443  >  1373 [PSH, ACK] Seq=3060384 Ack=42170 Win=233728 Len=1240"
"16076","86.713236","172.217.4.202","192.168.2.103","TCP","1394","[TCP Retransmission] 443  >  1373 [ACK] Seq=3095104 Ack=42170 Win=233728 Len=1240"
"17839","96.415553","172.217.4.202","192.168.2.103","TCP","1394","[TCP Retransmission] 443  >  1373 [PSH, ACK] Seq=4053140 Ack=48543 Win=228352 Len=1240"
"17840","96.415558","172.217.4.202","192.168.2.103","TCP","1394","[TCP Retransmission] 443  >  1373 [ACK] Seq=4054380 Ack=48543 Win=228352 Len=1240"
"18833","100.541049","192.168.2.103","34.107.172.168","TCP","146","[TCP Retransmission] 1370  >  443 [FIN, ACK] Seq=3226 Ack=1168 Win=64512 Len=0"
"19017","105.898806","192.168.2.103","172.217.4.202","TCP","720","[TCP Retransmission] 1378  >  443 [PSH, ACK] Seq=7950 Ack=4593577 Win=262144 Len=574"
"19193","106.551394","172.217.4.202","192.168.2.103","TCP","1394","[TCP Retransmission] 443  >  1378 [ACK] Seq=4700279 Ack=8524 Win=262656 Len=1240"
"19216","106.556154","172.217.4.202","192.168.2.103","TCP","1394","[TCP Retransmission] 443  >  1378 [PSH, ACK] Seq=4713919 Ack=8524 Win=262656 Len=1240"
"19242","106.561175","172.217.4.202","192.168.2.103","TCP","1394","[TCP Retransmission] 443  >  1378 [PSH, ACK] Seq=4720119 Ack=8524 Win=262656 Len=1240"
"19562","106.629459","172.217.4.202","192.168.2.103","TCP","1394","[TCP Retransmission] 443  >  1378 [ACK] Seq=4929679 Ack=8524 Win=262656 Len=1240"
"19583","106.633355","172.217.4.202","192.168.2.103","TCP","1394","[TCP Retransmission] 443  >  1378 [ACK] Seq=4942079 Ack=8524 Win=262656 Len=1240"
"20147","106.765704","172.217.4.202","192.168.2.103","TCP","1394","[TCP Retransmission] 443  >  1378 [ACK] Seq=5293791 Ack=8524 Win=262656 Len=1240 [TCP PDU reassembled in 20211]"
"20148","106.765708","172.217.4.202","192.168.2.103","TCP","1394","[TCP Retransmission] 443  >  1378 [ACK] Seq=5295031 Ack=8524 Win=262656 Len=1240 [TCP PDU reassembled in 20211]"
"20231","106.781382","172.217.4.202","192.168.2.103","TCP","1394","[TCP Retransmission] 443  >  1378 [PSH, ACK] Seq=5340911 Ack=8524 Win=262656 Len=1240"
"20566","106.859457","172.217.4.202","192.168.2.103","TCP","1394","[TCP Retransmission] 443  >  1378 [PSH, ACK] Seq=5557911 Ack=8524 Win=262656 Len=1240"
"20613","106.869352","172.217.4.202","192.168.2.103","TCP","1394","[TCP Retransmission] 443  >  1378 [ACK] Seq=5587671 Ack=8524 Win=262656 Len=1240"
"20614","106.869354","172.217.4.202","192.168.2.103","TCP","1394","[TCP Retransmission] 443  >  1378 [PSH, ACK] Seq=5588911 Ack=8524 Win=262656 Len=1240"
"20927","106.943381","172.217.4.202","192.168.2.103","TCP","1394","[TCP Retransmission] 443  >  1378 [PSH, ACK] Seq=5782351 Ack=8524 Win=262656 Len=1240"
"21092","106.981303","172.217.4.202","192.168.2.103","TCP","1394","[TCP Retransmission] 443  >  1378 [ACK] Seq=5869151 Ack=8524 Win=262656 Len=1240"
"21093","106.981305","172.217.4.202","192.168.2.103","TCP","1394","[TCP Retransmission] 443  >  1378 [ACK] Seq=5870391 Ack=8524 Win=262656 Len=1240"
"21935","117.277460","172.217.4.202","192.168.2.103","TCP","1394","[TCP Retransmission] 443  >  1378 [ACK] Seq=6261751 Ack=9098 Win=262144 Len=1240"
"22116","117.320659","172.217.4.202","192.168.2.103","TCP","1394","[TCP Retransmission] 443  >  1378 [ACK] Seq=6400631 Ack=9098 Win=262144 Len=1240"
"22273","117.350596","172.217.4.202","192.168.2.103","TCP","1394","[TCP Retransmission] 443  >  1378 [ACK] Seq=6506031 Ack=9098 Win=262144 Len=1240"
"22625","117.426518","172.217.4.202","192.168.2.103","TCP","1394","[TCP Retransmission] 443  >  1378 [ACK] Seq=6726751 Ack=9098 Win=262144 Len=1240"
"22689","117.443446","172.217.4.202","192.168.2.103","TCP","1394","[TCP Retransmission] 443  >  1378 [PSH, ACK] Seq=6760231 Ack=9098 Win=262144 Len=1240"
"22773","117.461741","172.217.4.202","192.168.2.103","TCP","1394","[TCP Retransmission] 443  >  1378 [ACK] Seq=6809831 Ack=9098 Win=262144 Len=1240"
"22865","117.481428","192.168.2.103","172.217.4.202","TCP","1386","[TCP Retransmission] 1373  >  443 [PSH, ACK] Seq=60832 Ack=4710266 Win=133888 Len=1240"
"23330","117.589341","172.217.4.202","192.168.2.103","TCP","1394","[TCP Retransmission] 443  >  1378 [PSH, ACK] Seq=7144631 Ack=9098 Win=262144 Len=1240 [TCP PDU reassembled in 23378]"
"24047","117.737712","172.217.4.202","192.168.2.103","TCP","1394","[TCP Retransmission] 443  >  1378 [ACK] Seq=7599711 Ack=9098 Win=262144 Len=1240"
"24066","117.741457","172.217.4.202","192.168.2.103","TCP","1394","[TCP Retransmission] 443  >  1378 [ACK] Seq=7610871 Ack=9098 Win=262144 Len=1240"
"24067","117.741462","172.217.4.202","192.168.2.103","TCP","1394","[TCP Retransmission] 443  >  1378 [ACK] Seq=7612111 Ack=9098 Win=262144 Len=1240"
"24247","119.714336","192.168.2.103","172.217.4.202","TCP","1394","[TCP Retransmission] 1373  >  443 [ACK] Seq=62072 Ack=4710899 Win=133120 Len=1240"
"26053","126.149825","172.217.4.202","192.168.2.103","TCP","1394","[TCP Retransmission] 443  >  1378 [PSH, ACK] Seq=8752378 Ack=9672 Win=261632 Len=1240"
"26054","126.149829","172.217.4.202","192.168.2.103","TCP","1394","[TCP Retransmission] 443  >  1378 [ACK] Seq=8753618 Ack=9672 Win=261632 Len=1240"
"26180","126.177543","172.217.4.202","192.168.2.103","TCP","1394","[TCP Retransmission] 443  >  1378 [ACK] Seq=8839178 Ack=9672 Win=261632 Len=1240 [TCP PDU reassembled in 26213]"
"26484","126.234776","172.217.4.202","192.168.2.103","TCP","1394","[TCP Retransmission] 443  >  1378 [ACK] Seq=9038818 Ack=9672 Win=261632 Len=1240"
"26548","126.249963","172.217.4.202","192.168.2.103","TCP","1394","[TCP Retransmission] 443  >  1378 [ACK] Seq=9071058 Ack=9672 Win=261632 Len=1240"
"26551","126.249975","172.217.4.202","192.168.2.103","TCP","1394","[TCP Retransmission] 443  >  1378 [ACK] Seq=9076018 Ack=9672 Win=261632 Len=1240"
"26954","134.285379","192.168.2.103","34.107.172.168","TCP","146","[TCP Retransmission] 1282  >  443 [FIN, ACK] Seq=1202 Ack=185 Win=251 Len=0"
"26980","134.889359","192.168.2.103","34.107.172.168","TCP","146","[TCP Retransmission] 1282  >  443 [FIN, ACK] Seq=1202 Ack=185 Win=251 Len=0"
"27024","136.090236","192.168.2.103","34.107.172.168","TCP","146","[TCP Retransmission] 1282  >  443 [FIN, ACK] Seq=1202 Ack=185 Win=251 Len=0"
"27245","136.236114","172.217.4.202","192.168.2.103","TCP","1394","[TCP Retransmission] 443  >  1378 [ACK] Seq=9317027 Ack=10246 Win=261120 Len=1240 [TCP PDU reassembled in 27330]"
"28177","136.443416","192.168.2.103","172.217.4.202","TCP","1394","[TCP Retransmission] 1373  >  443 [PSH, ACK] Seq=74362 Ack=4714681 Win=133120 Len=1240 [TCP PDU reassembled in 28048]"
"28699","136.561525","172.217.4.202","192.168.2.103","TCP","1394","[TCP Retransmission] 443  >  1378 [ACK] Seq=10198667 Ack=10246 Win=261120 Len=1240 [TCP PDU reassembled in 28724]"
"29128","136.653738","172.217.4.202","192.168.2.103","TCP","1394","[TCP Retransmission] 443  >  1378 [PSH, ACK] Seq=10478907 Ack=10246 Win=261120 Len=1240 [TCP PDU reassembled in 29182]"
"29577","138.493879","192.168.2.103","34.107.172.168","TCP","146","[TCP Retransmission] 1282  >  443 [FIN, ACK] Seq=1202 Ack=185 Win=251 Len=0"
"29703","143.299453","192.168.2.103","34.107.172.168","TCP","146","[TCP Retransmission] 1282  >  443 [FIN, ACK] Seq=1202 Ack=185 Win=251 Len=0"
"30466","146.154006","172.217.4.202","192.168.2.103","TCP","1394","[TCP Retransmission] 443  >  1378 [PSH, ACK] Seq=11231199 Ack=10820 Win=260608 Len=1240"
"30758","146.212910","172.217.4.202","192.168.2.103","TCP","1394","[TCP Retransmission] 443  >  1378 [PSH, ACK] Seq=11413479 Ack=10820 Win=260608 Len=1240"
"30796","146.219982","172.217.4.202","192.168.2.103","TCP","1394","[TCP Retransmission] 443  >  1378 [PSH, ACK] Seq=11439519 Ack=10820 Win=260608 Len=1240"
"30815","146.223579","172.217.4.202","192.168.2.103","TCP","1394","[TCP Retransmission] 443  >  1378 [ACK] Seq=11448199 Ack=10820 Win=260608 Len=1240"
"31068","146.286181","172.217.4.202","192.168.2.103","TCP","1394","[TCP Retransmission] 443  >  1378 [ACK] Seq=11618079 Ack=10820 Win=260608 Len=1240"
"31093","146.292013","172.217.4.202","192.168.2.103","TCP","1394","[TCP Retransmission] 443  >  1378 [ACK] Seq=11623039 Ack=10820 Win=260608 Len=1240"
"31393","146.359767","172.217.4.202","192.168.2.103","TCP","1394","[TCP Retransmission] 443  >  1378 [ACK] Seq=11822679 Ack=10820 Win=260608 Len=1240 [TCP PDU reassembled in 31440]"
"31586","146.407774","172.217.4.202","192.168.2.103","TCP","1394","[TCP Retransmission] 443  >  1378 [ACK] Seq=11942959 Ack=10820 Win=260608 Len=1240 [TCP PDU reassembled in 31591]"
"31699","146.429527","172.217.4.202","192.168.2.103","TCP","1394","[TCP Retransmission] 443  >  1378 [ACK] Seq=12023559 Ack=10820 Win=260608 Len=1240"
"31700","146.429531","172.217.4.202","192.168.2.103","TCP","1394","[TCP Retransmission] 443  >  1378 [ACK] Seq=12024799 Ack=10820 Win=260608 Len=1240"
"31921","146.478769","192.168.2.103","172.217.4.202","TCP","1386","[TCP Retransmission] 1373  >  443 [PSH, ACK] Seq=82094 Ack=4717206 Win=133120 Len=1240 [TCP PDU reassembled in 31848]"
"32056","146.505625","172.217.4.202","192.168.2.103","TCP","1394","[TCP Retransmission] 443  >  1378 [ACK] Seq=12243039 Ack=10820 Win=260608 Len=1240"
"32284","150.804583","192.168.2.103","172.217.4.202","TCP","1394","[TCP Retransmission] 1373  >  443 [ACK] Seq=85267 Ack=4718472 Win=133120 Len=1240"
"32285","150.804615","192.168.2.103","172.217.4.202","TCP","847","[TCP Retransmission] 1373  >  443 [PSH, ACK] Seq=86507 Ack=4718472 Win=133120 Len=693 [TCP PDU reassembled in 32278]"
