"No.","Time","Source","Destination","Protocol","Length","Info"
"112","1.547612","192.168.2.103","157.240.26.11","TCP","146","1085  >  443 [ACK] Seq=32 Ack=32 Win=256 Len=0"
"434","12.743094","192.168.2.103","34.107.172.168","TCP","146","[TCP Dup ACK 431#1] 1282  >  443 [ACK] Seq=1202 Ack=185 Win=251 Len=0"
"585","15.086296","157.240.26.49","192.168.2.103","TCP","154","443  >  1347 [ACK] Seq=758 Ack=1696 Win=70400 Len=0"
"632","15.161661","192.168.2.103","157.240.26.49","TCP","146","[TCP Dup ACK 629#1] 1347  >  443 [ACK] Seq=1727 Ack=1642 Win=65536 Len=0"
"675","16.635069","192.168.2.103","23.192.220.4","TCP","146","[TCP Dup ACK 672#1] 1348  >  443 [ACK] Seq=1 Ack=1 Win=66304 Len=0"
"682","16.647828","23.192.220.4","192.168.2.103","TCP","146","[TCP Dup ACK 681#1] 443  >  1348 [ACK] Seq=1 Ack=622 Win=64128 Len=0"
"731","16.664740","23.192.220.4","192.168.2.103","TCP","1386","[TCP Out-Of-Order] 443  >  1348 [PSH, ACK] Seq=3384 Ack=1127 Win=64128 Len=1240"
"733","16.666401","23.192.220.4","192.168.2.103","TCP","1394","[TCP Out-Of-Order] 443  >  1348 [ACK] Seq=4624 Ack=1127 Win=64128 Len=1240"
"735","16.666417","23.192.220.4","192.168.2.103","TCP","1394","443  >  1348 [PSH, ACK] Seq=7104 Ack=1127 Win=64128 Len=1240"
"736","16.666421","23.192.220.4","192.168.2.103","TCP","1394","443  >  1348 [ACK] Seq=8344 Ack=1127 Win=64128 Len=1240"
"737","16.666430","23.192.220.4","192.168.2.103","TCP","1394","443  >  1348 [ACK] Seq=9584 Ack=1127 Win=64128 Len=1240"
"740","16.666442","23.192.220.4","192.168.2.103","TCP","1394","[TCP Previous segment not captured] 443  >  1348 [ACK] Seq=13304 Ack=1127 Win=64128 Len=1240"
"743","16.667007","23.192.220.4","192.168.2.103","TCP","1394","[TCP Out-Of-Order] 443  >  1348 [PSH, ACK] Seq=10824 Ack=1127 Win=64128 Len=1240"
"748","16.667810","23.192.220.4","192.168.2.103","TCP","1386","443  >  1348 [PSH, ACK] Seq=14544 Ack=1127 Win=64128 Len=1240"
"776","16.674537","23.192.220.4","192.168.2.103","TCP","1394","[TCP Out-Of-Order] 443  >  1348 [PSH, ACK] Seq=21984 Ack=1127 Win=64128 Len=1240"
"777","16.674541","23.192.220.4","192.168.2.103","TCP","1394","[TCP Out-Of-Order] 443  >  1348 [ACK] Seq=23224 Ack=1158 Win=64128 Len=1240"
"815","16.681727","192.168.2.103","23.192.220.4","TCP","146","[TCP Dup ACK 808#1] 1348  >  443 [ACK] Seq=1158 Ack=38104 Win=66304 Len=0"
"838","16.688085","23.192.220.4","192.168.2.103","TCP","1394","443  >  1348 [ACK] Seq=52984 Ack=1158 Win=64128 Len=1240"
"851","16.689707","23.192.220.4","192.168.2.103","TCP","1394","[TCP Out-Of-Order] 443  >  1348 [ACK] Seq=55464 Ack=1158 Win=64128 Len=1240"
"950","16.810897","157.240.26.49","192.168.2.103","TCP","1386","443  >  1349 [ACK] Seq=6924 Ack=15129 Win=96512 Len=1240 [TCP PDU reassembled in 953]"
"1106","16.977895","157.240.26.49","192.168.2.103","TCP","1386","443  >  1349 [ACK] Seq=15771 Ack=36972 Win=141056 Len=1240 [TCP PDU reassembled in 1109]"
"1153","17.091487","192.168.2.103","157.240.26.49","TCP","146","[TCP Dup ACK 1148#1] 1349  >  443 [ACK] Seq=44253 Ack=21719 Win=65536 Len=0"
"1304","17.878407","157.240.26.49","192.168.2.103","TCP","146","[TCP Dup ACK 1303#1] 443  >  1352 [ACK] Seq=4960 Ack=3976 Win=77056 Len=0"
"1307","17.878644","157.240.26.49","192.168.2.103","TCP","146","[TCP Dup ACK 1303#2] 443  >  1352 [ACK] Seq=4960 Ack=3976 Win=77056 Len=0"
"1399","19.256794","157.240.26.49","192.168.2.103","TCP","1386","443  >  1352 [PSH, ACK] Seq=13596 Ack=3976 Win=77056 Len=1240 [TCP PDU reassembled in 1429]"
"1406","19.257547","192.168.2.103","157.240.26.49","TCP","146","[TCP Dup ACK 1403#1] 1352  >  443 [ACK] Seq=3976 Ack=14836 Win=65536 Len=0"
"1510","19.282942","157.240.26.49","192.168.2.103","TCP","1394","443  >  1352 [PSH, ACK] Seq=46733 Ack=3976 Win=77056 Len=1240 [TCP PDU reassembled in 1557]"
"1511","19.282946","157.240.26.49","192.168.2.103","TCP","1394","443  >  1352 [ACK] Seq=47973 Ack=3976 Win=77056 Len=1240 [TCP PDU reassembled in 1557]"
"1512","19.282950","157.240.26.49","192.168.2.103","TCP","1394","443  >  1352 [ACK] Seq=49213 Ack=3976 Win=77056 Len=1240 [TCP PDU reassembled in 1557]"
"1513","19.282955","157.240.26.49","192.168.2.103","TCP","1394","443  >  1352 [PSH, ACK] Seq=50453 Ack=3976 Win=77056 Len=1240 [TCP PDU reassembled in 1557]"
"1516","19.283165","192.168.2.103","157.240.26.49","TCP","146","[TCP Dup ACK 1501#1] 1352  >  443 [ACK] Seq=3976 Ack=38396 Win=65536 Len=0"
"1554","19.291218","157.240.26.49","192.168.2.103","TCP","1394","[TCP Out-Of-Order] 443  >  1352 [ACK] Seq=51693 Ack=3976 Win=77056 Len=1240 [TCP PDU reassembled in 1557]"
"1555","19.291223","157.240.26.49","192.168.2.103","TCP","1394","[TCP Out-Of-Order] 443  >  1352 [ACK] Seq=52933 Ack=3976 Win=77056 Len=1240 [TCP PDU reassembled in 1557]"
"1556","19.291227","157.240.26.49","192.168.2.103","TCP","1394","[TCP Out-Of-Order] 443  >  1352 [PSH, ACK] Seq=54173 Ack=3976 Win=77056 Len=1240 [TCP PDU reassembled in 1557]"
"1557","19.291231","157.240.26.49","192.168.2.103","TCP","1394","[TCP Out-Of-Order] 443  >  1352 [ACK] Seq=55413 Ack=3976 Win=77056 Len=1240"
"1558","19.291236","157.240.26.49","192.168.2.103","TCP","1394","[TCP Out-Of-Order] 443  >  1352 [ACK] Seq=56653 Ack=3976 Win=77056 Len=1240"
"1602","19.303239","157.240.26.49","192.168.2.103","TCP","1394","[TCP Out-Of-Order] 443  >  1352 [ACK] Seq=78433 Ack=3976 Win=77056 Len=1240"
"1603","19.303243","157.240.26.49","192.168.2.103","TCP","1394","[TCP Out-Of-Order] 443  >  1352 [ACK] Seq=82153 Ack=3976 Win=77056 Len=1240"
"1604","19.303247","157.240.26.49","192.168.2.103","TCP","1394","[TCP Out-Of-Order] 443  >  1352 [ACK] Seq=83393 Ack=3976 Win=77056 Len=1240"
"1650","19.427989","192.168.2.103","157.240.26.49","TCP","146","[TCP Dup ACK 1646#1] 1352  >  443 [ACK] Seq=3976 Ack=108615 Win=65536 Len=0"
"1701","19.441082","157.240.26.49","192.168.2.103","TCP","1394","443  >  1352 [ACK] Seq=150628 Ack=3976 Win=77056 Len=1240 [TCP PDU reassembled in 1702]"
"1718","19.447561","157.240.26.49","192.168.2.103","TCP","1394","[TCP Out-Of-Order] 443  >  1352 [ACK] Seq=138171 Ack=3976 Win=77056 Len=1240"
"1719","19.447565","157.240.26.49","192.168.2.103","TCP","1394","443  >  1352 [ACK] Seq=152181 Ack=3976 Win=77056 Len=1240 [TCP PDU reassembled in 1724]"
"1725","19.449297","157.240.26.49","192.168.2.103","TCP","1394","[TCP Previous segment not captured] 443  >  1352 [ACK] Seq=157141 Ack=3976 Win=77056 Len=1240"
"1730","19.449319","157.240.26.49","192.168.2.103","TCP","1394","[TCP Out-Of-Order] 443  >  1352 [ACK] Seq=136931 Ack=3976 Win=77056 Len=1240"
"1760","19.457906","157.240.26.49","192.168.2.103","TCP","1394","443  >  1352 [ACK] Seq=180351 Ack=3976 Win=77056 Len=1240"
"1761","19.457911","157.240.26.49","192.168.2.103","TCP","1394","[TCP Out-Of-Order] 443  >  1352 [ACK] Seq=170431 Ack=3976 Win=77056 Len=1240"
"1767","19.459853","157.240.26.49","192.168.2.103","TCP","1394","[TCP Out-Of-Order] 443  >  1352 [ACK] Seq=171671 Ack=3976 Win=77056 Len=1240"
"1805","19.465579","192.168.2.103","157.240.26.49","TCP","146","1352  >  443 [ACK] Seq=3976 Ack=196471 Win=65536 Len=0"
"1807","19.465957","157.240.26.49","192.168.2.103","TCP","1386","[TCP Out-Of-Order] 443  >  1352 [ACK] Seq=196471 Ack=3976 Win=77056 Len=1240"
"1947","22.341988","34.36.199.114","192.168.2.103","TCP","166","443  >  1359 [SYN, ACK] Seq=0 Ack=1 Win=65535 Len=0 MSS=1412 SACK_PERM WS=256"
"1948","22.342003","34.36.199.114","192.168.2.103","TCP","166","443  >  1356 [SYN, ACK] Seq=0 Ack=1 Win=65535 Len=0 MSS=1412 SACK_PERM WS=256"
"1949","22.342009","34.36.199.114","192.168.2.103","TCP","166","443  >  1361 [SYN, ACK] Seq=0 Ack=1 Win=65535 Len=0 MSS=1412 SACK_PERM WS=256"
"1950","22.342014","34.36.199.114","192.168.2.103","TCP","166","443  >  1360 [SYN, ACK] Seq=0 Ack=1 Win=65535 Len=0 MSS=1412 SACK_PERM WS=256"
"1951","22.342018","34.36.199.114","192.168.2.103","TCP","166","443  >  1363 [SYN, ACK] Seq=0 Ack=1 Win=65535 Len=0 MSS=1412 SACK_PERM WS=256"
"1952","22.342023","34.36.199.114","192.168.2.103","TCP","166","443  >  1362 [SYN, ACK] Seq=0 Ack=1 Win=65535 Len=0 MSS=1412 SACK_PERM WS=256"
"1953","22.342027","34.36.199.114","192.168.2.103","TCP","166","443  >  1364 [SYN, ACK] Seq=0 Ack=1 Win=65535 Len=0 MSS=1412 SACK_PERM WS=256"
"1954","22.342032","34.36.199.114","192.168.2.103","TCP","166","443  >  1365 [SYN, ACK] Seq=0 Ack=1 Win=65535 Len=0 MSS=1412 SACK_PERM WS=256"
"2015","22.370603","34.36.199.114","192.168.2.103","TCP","154","[TCP Dup ACK 2003#1] 443  >  1363 [ACK] Seq=1 Ack=675 Win=269056 Len=0"
"2016","22.370608","34.36.199.114","192.168.2.103","TCP","154","[TCP Dup ACK 2004#1] 443  >  1360 [ACK] Seq=1 Ack=675 Win=269056 Len=0"
"2017","22.370612","34.36.199.114","192.168.2.103","TCP","154","[TCP Dup ACK 2005#1] 443  >  1362 [ACK] Seq=1 Ack=675 Win=269056 Len=0"
"2021","22.370630","157.240.26.49","192.168.2.103","TCP","1394","443  >  1352 [ACK] Seq=201393 Ack=3976 Win=77056 Len=1240 [TCP PDU reassembled in 2022]"
"2024","22.370644","34.36.199.114","192.168.2.103","TCP","154","443  >  1361 [ACK] Seq=1 Ack=675 Win=269056 Len=0"
"2025","22.370649","34.36.199.114","192.168.2.103","TCP","154","443  >  1364 [ACK] Seq=1 Ack=675 Win=269056 Len=0"
"2026","22.370653","34.36.199.114","192.168.2.103","TCP","154","443  >  1365 [ACK] Seq=1 Ack=675 Win=269056 Len=0"
"2157","22.418722","34.36.199.114","192.168.2.103","TCP","146","443  >  1358 [ACK] Seq=965 Ack=1331 Win=268544 Len=0"
"2201","22.442159","34.36.199.114","192.168.2.103","TCP","146","443  >  1356 [ACK] Seq=1274 Ack=1621 Win=268288 Len=0"
"2259","22.457177","34.36.199.114","192.168.2.103","TCP","146","[TCP Dup ACK 2258#1] 443  >  1364 [ACK] Seq=1166 Ack=1634 Win=268288 Len=0"
"2260","22.457566","34.36.199.114","192.168.2.103","TCP","146","[TCP Dup ACK 2258#2] 443  >  1364 [ACK] Seq=1166 Ack=1634 Win=268288 Len=0"
"2267","22.458644","34.36.199.114","192.168.2.103","TCP","146","[TCP Dup ACK 2258#3] 443  >  1364 [ACK] Seq=1166 Ack=1634 Win=268288 Len=0"
"2272","22.459897","34.36.199.114","192.168.2.103","TCP","154","[TCP Dup ACK 2269#1] 443  >  1365 [ACK] Seq=1166 Ack=1627 Win=268288 Len=0"
"2273","22.459900","34.36.199.114","192.168.2.103","TCP","154","[TCP Dup ACK 2270#1] 443  >  1362 [ACK] Seq=1166 Ack=1636 Win=268288 Len=0"
"2274","22.459903","34.36.199.114","192.168.2.103","TCP","154","[TCP Dup ACK 2271#1] 443  >  1361 [ACK] Seq=1166 Ack=1613 Win=268288 Len=0"
"2372","22.486397","34.36.199.114","192.168.2.103","TCP","146","[TCP Dup ACK 2371#1] 443  >  1365 [ACK] Seq=1367 Ack=1961 Win=268032 Len=0"
"2374","22.487624","34.36.199.114","192.168.2.103","TCP","146","443  >  1358 [ACK] Seq=1568 Ack=2232 Win=267776 Len=0"
"2438","22.507877","34.36.199.114","192.168.2.103","TCP","146","443  >  1362 [ACK] Seq=1552 Ack=2302 Win=267776 Len=0"
"2446","22.513504","34.36.199.114","192.168.2.103","TCP","146","443  >  1357 [ACK] Seq=1861 Ack=2584 Win=267520 Len=0"
"2581","22.551733","192.168.2.103","34.36.199.114","TCP","146","1356  >  443 [FIN, ACK] Seq=2919 Ack=2231 Win=65536 Len=0"
"2751","23.948886","192.168.2.103","157.240.26.35","TCP","146","[TCP Dup ACK 2748#1] 1367  >  443 [ACK] Seq=1 Ack=1 Win=65536 Len=0"
"2802","23.980178","157.240.26.35","192.168.2.103","TCP","1386","[TCP Out-Of-Order] 443  >  1367 [ACK] Seq=1 Ack=342 Win=66816 Len=1240"
"2868","24.080851","157.240.26.35","192.168.2.103","TCP","1394","443  >  1369 [ACK] Seq=8187 Ack=601 Win=67840 Len=1240 [TCP PDU reassembled in 2874]"
"3131","28.868244","172.217.4.202","192.168.2.103","TCP","1394","443  >  1373 [PSH, ACK] Seq=1241 Ack=344 Win=269568 Len=1240 [TCP PDU reassembled in 3133]"
"3132","28.868258","172.217.4.202","192.168.2.103","TCP","1394","443  >  1373 [ACK] Seq=2481 Ack=344 Win=269568 Len=1240 [TCP PDU reassembled in 3133]"
"3291","32.181769","192.168.2.103","172.217.4.202","TCP","146","[TCP Dup ACK 3288#1] 1373  >  443 [ACK] Seq=4295 Ack=5951 Win=66304 Len=0"
"3304","32.653604","172.217.4.202","192.168.2.103","TCP","146","443  >  1373 [ACK] Seq=5951 Ack=6228 Win=264448 Len=0"
"3385","36.929722","192.168.2.103","172.217.4.202","TCP","146","[TCP Dup ACK 3382#1] 1373  >  443 [ACK] Seq=6228 Ack=6584 Win=65536 Len=0"
"3627","45.584890","172.217.4.202","192.168.2.103","TCP","146","[TCP Dup ACK 3626#1] 443  >  1378 [ACK] Seq=4691 Ack=1003 Win=269056 Len=0"
"3750","46.001424","172.217.4.202","192.168.2.103","TCP","1394","443  >  1378 [ACK] Seq=67931 Ack=1003 Win=269056 Len=1240"
"3751","46.001428","172.217.4.202","192.168.2.103","TCP","1394","443  >  1378 [ACK] Seq=69171 Ack=1003 Win=269056 Len=1240"
"3752","46.001430","172.217.4.202","192.168.2.103","TCP","1394","443  >  1378 [PSH, ACK] Seq=70411 Ack=1003 Win=269056 Len=1240"
"3753","46.001432","172.217.4.202","192.168.2.103","TCP","1394","443  >  1378 [ACK] Seq=71651 Ack=1003 Win=269056 Len=1240"
"3754","46.001435","172.217.4.202","192.168.2.103","TCP","1394","443  >  1378 [ACK] Seq=72891 Ack=1003 Win=269056 Len=1240"
"3755","46.001437","172.217.4.202","192.168.2.103","TCP","1394","443  >  1378 [PSH, ACK] Seq=74131 Ack=1003 Win=269056 Len=1240"
"3756","46.001439","172.217.4.202","192.168.2.103","TCP","1394","443  >  1378 [ACK] Seq=75371 Ack=1003 Win=269056 Len=1240"
"3757","46.001441","172.217.4.202","192.168.2.103","TCP","1394","443  >  1378 [ACK] Seq=76611 Ack=1003 Win=269056 Len=1240"
"3758","46.001444","172.217.4.202","192.168.2.103","TCP","1394","443  >  1378 [PSH, ACK] Seq=77851 Ack=1003 Win=269056 Len=1240"
"3759","46.001542","172.217.4.202","192.168.2.103","TCP","1394","443  >  1378 [ACK] Seq=79091 Ack=1003 Win=269056 Len=1240"
"3824","46.014383","172.217.4.202","192.168.2.103","TCP","1394","[TCP Out-Of-Order] 443  >  1378 [ACK] Seq=107611 Ack=1003 Win=269056 Len=1240"
"3875","46.024556","172.217.4.202","192.168.2.103","TCP","1394","[TCP Out-Of-Order] 443  >  1378 [ACK] Seq=143571 Ack=1003 Win=269056 Len=1240"
"3942","46.040992","172.217.4.202","192.168.2.103","TCP","1394","[TCP Out-Of-Order] 443  >  1378 [ACK] Seq=190691 Ack=1003 Win=269056 Len=1240"
"3945","46.043464","172.217.4.202","192.168.2.103","TCP","1394","[TCP Out-Of-Order] 443  >  1378 [ACK] Seq=191931 Ack=1003 Win=269056 Len=1240"
"3946","46.043468","172.217.4.202","192.168.2.103","TCP","1394","[TCP Out-Of-Order] 443  >  1378 [ACK] Seq=193171 Ack=1003 Win=269056 Len=1240"
"3951","46.043491","172.217.4.202","192.168.2.103","TCP","1394","[TCP Out-Of-Order] 443  >  1378 [PSH, ACK] Seq=199371 Ack=1003 Win=269056 Len=1240"
"3960","46.045304","172.217.4.202","192.168.2.103","TCP","1394","[TCP Out-Of-Order] 443  >  1378 [ACK] Seq=183251 Ack=1003 Win=269056 Len=1240"
"3961","46.045306","172.217.4.202","192.168.2.103","TCP","1394","[TCP Out-Of-Order] 443  >  1378 [ACK] Seq=184491 Ack=1003 Win=269056 Len=1240"
"3968","46.047284","172.217.4.202","192.168.2.103","TCP","1394","[TCP Out-Of-Order] 443  >  1378 [ACK] Seq=180771 Ack=1003 Win=269056 Len=1240"
"3971","46.047295","172.217.4.202","192.168.2.103","TCP","1394","[TCP Out-Of-Order] 443  >  1378 [ACK] Seq=185731 Ack=1003 Win=269056 Len=1240"
"3972","46.047299","172.217.4.202","192.168.2.103","TCP","1394","[TCP Out-Of-Order] 443  >  1378 [ACK] Seq=186971 Ack=1003 Win=269056 Len=1240"
"3977","46.049511","172.217.4.202","192.168.2.103","TCP","1394","[TCP Out-Of-Order] 443  >  1378 [PSH, ACK] Seq=188211 Ack=1003 Win=269056 Len=1240"
"3978","46.049514","172.217.4.202","192.168.2.103","TCP","1394","[TCP Out-Of-Order] 443  >  1378 [ACK] Seq=189451 Ack=1003 Win=269056 Len=1240"
"4002","46.054017","172.217.4.202","192.168.2.103","TCP","1394","[TCP Out-Of-Order] 443  >  1378 [ACK] Seq=209291 Ack=1003 Win=269056 Len=1240"
"4003","46.054021","172.217.4.202","192.168.2.103","TCP","1394","[TCP Out-Of-Order] 443  >  1378 [ACK] Seq=213011 Ack=1003 Win=269056 Len=1240"
"4004","46.054025","172.217.4.202","192.168.2.103","TCP","1394","[TCP Out-Of-Order] 443  >  1378 [ACK] Seq=214251 Ack=1003 Win=269056 Len=1240"
"4005","46.054029","172.217.4.202","192.168.2.103","TCP","1394","[TCP Out-Of-Order] 443  >  1378 [ACK] Seq=215491 Ack=1003 Win=269056 Len=1240"
"4016","46.058271","172.217.4.202","192.168.2.103","TCP","1394","443  >  1378 [PSH, ACK] Seq=232851 Ack=1003 Win=269056 Len=1240"
"4017","46.058274","172.217.4.202","192.168.2.103","TCP","1394","443  >  1378 [ACK] Seq=234091 Ack=1003 Win=269056 Len=1240"
"4018","46.058278","172.217.4.202","192.168.2.103","TCP","1394","443  >  1378 [ACK] Seq=235331 Ack=1003 Win=269056 Len=1240"
"4019","46.058282","172.217.4.202","192.168.2.103","TCP","1394","443  >  1378 [ACK] Seq=236571 Ack=1003 Win=269056 Len=1240"
"4020","46.058286","172.217.4.202","192.168.2.103","TCP","1394","443  >  1378 [ACK] Seq=237811 Ack=1003 Win=269056 Len=1240"
"4021","46.058289","172.217.4.202","192.168.2.103","TCP","1394","443  >  1378 [ACK] Seq=239051 Ack=1003 Win=269056 Len=1240"
"4022","46.058295","172.217.4.202","192.168.2.103","TCP","1394","443  >  1378 [ACK] Seq=240291 Ack=1003 Win=269056 Len=1240"
"4023","46.058297","172.217.4.202","192.168.2.103","TCP","1394","443  >  1378 [ACK] Seq=241531 Ack=1003 Win=269056 Len=1240"
"4031","46.061842","172.217.4.202","192.168.2.103","TCP","1394","[TCP Previous segment not captured] 443  >  1378 [ACK] Seq=246491 Ack=1003 Win=269056 Len=1240"
"4032","46.061844","172.217.4.202","192.168.2.103","TCP","1394","443  >  1378 [ACK] Seq=247731 Ack=1003 Win=269056 Len=1240"
"4033","46.061846","172.217.4.202","192.168.2.103","TCP","1394","443  >  1378 [ACK] Seq=248971 Ack=1003 Win=269056 Len=1240"
"4034","46.061849","172.217.4.202","192.168.2.103","TCP","1394","443  >  1378 [ACK] Seq=250211 Ack=1003 Win=269056 Len=1240"
"4035","46.061851","172.217.4.202","192.168.2.103","TCP","1394","443  >  1378 [ACK] Seq=251451 Ack=1003 Win=269056 Len=1240"
"4036","46.061859","172.217.4.202","192.168.2.103","TCP","1394","443  >  1378 [ACK] Seq=252691 Ack=1003 Win=269056 Len=1240"
"4073","46.070582","172.217.4.202","192.168.2.103","TCP","1394","443  >  1378 [ACK] Seq=268811 Ack=1003 Win=269056 Len=1240"
"4074","46.070586","172.217.4.202","192.168.2.103","TCP","1394","443  >  1378 [ACK] Seq=270051 Ack=1003 Win=269056 Len=1240"
"4075","46.070591","172.217.4.202","192.168.2.103","TCP","1394","443  >  1378 [ACK] Seq=271291 Ack=1003 Win=269056 Len=1240"
"4100","46.076664","172.217.4.202","192.168.2.103","TCP","1394","[TCP Previous segment not captured] 443  >  1378 [ACK] Seq=291131 Ack=1003 Win=269056 Len=1240"
"4101","46.076667","172.217.4.202","192.168.2.103","TCP","1394","443  >  1378 [ACK] Seq=292371 Ack=1003 Win=269056 Len=1240"
"4102","46.076669","172.217.4.202","192.168.2.103","TCP","1394","443  >  1378 [ACK] Seq=293611 Ack=1003 Win=269056 Len=1240"
"4113","46.080601","172.217.4.202","192.168.2.103","TCP","1394","[TCP Previous segment not captured] 443  >  1378 [ACK] Seq=301051 Ack=1003 Win=269056 Len=1240"
"4114","46.080605","172.217.4.202","192.168.2.103","TCP","1394","443  >  1378 [ACK] Seq=302291 Ack=1003 Win=269056 Len=1240"
"4115","46.080610","172.217.4.202","192.168.2.103","TCP","1394","443  >  1378 [ACK] Seq=303531 Ack=1003 Win=269056 Len=1240"
"4116","46.080614","172.217.4.202","192.168.2.103","TCP","1394","443  >  1378 [ACK] Seq=304771 Ack=1003 Win=269056 Len=1240"
"4123","46.083295","172.217.4.202","192.168.2.103","TCP","1394","[TCP Out-Of-Order] 443  >  1378 [PSH, ACK] Seq=298571 Ack=1003 Win=269056 Len=1240"
"4149","46.089288","172.217.4.202","192.168.2.103","TCP","1394","[TCP Out-Of-Order] 443  >  1378 [ACK] Seq=327091 Ack=1003 Win=269056 Len=1240"
"4150","46.089291","172.217.4.202","192.168.2.103","TCP","1394","[TCP Out-Of-Order] 443  >  1378 [ACK] Seq=328331 Ack=1003 Win=269056 Len=1240"
"4205","46.102304","172.217.4.202","192.168.2.103","TCP","1394","[TCP Out-Of-Order] 443  >  1378 [ACK] Seq=355611 Ack=1003 Win=269056 Len=1240"
"4206","46.102306","172.217.4.202","192.168.2.103","TCP","1394","[TCP Out-Of-Order] 443  >  1378 [ACK] Seq=359331 Ack=1003 Win=269056 Len=1240"
"4207","46.102309","172.217.4.202","192.168.2.103","TCP","1394","[TCP Out-Of-Order] 443  >  1378 [ACK] Seq=360571 Ack=1003 Win=269056 Len=1240"
"4275","46.117835","172.217.4.202","192.168.2.103","TCP","1394","[TCP Out-Of-Order] 443  >  1378 [ACK] Seq=410171 Ack=1003 Win=269056 Len=1240"
"4276","46.117839","172.217.4.202","192.168.2.103","TCP","1394","[TCP Out-Of-Order] 443  >  1378 [ACK] Seq=411411 Ack=1003 Win=269056 Len=1240"
"4278","46.117847","172.217.4.202","192.168.2.103","TCP","1394","443  >  1378 [ACK] Seq=413891 Ack=1003 Win=269056 Len=1240"
"4279","46.117850","172.217.4.202","192.168.2.103","TCP","1394","443  >  1378 [ACK] Seq=415131 Ack=1003 Win=269056 Len=1240"
"4280","46.117855","172.217.4.202","192.168.2.103","TCP","1394","443  >  1378 [ACK] Seq=416371 Ack=1003 Win=269056 Len=1240"
"4295","46.123138","172.217.4.202","192.168.2.103","TCP","1394","[TCP Out-Of-Order] 443  >  1378 [ACK] Seq=405211 Ack=1003 Win=269056 Len=1240"
"4296","46.123142","172.217.4.202","192.168.2.103","TCP","1394","[TCP Out-Of-Order] 443  >  1378 [ACK] Seq=417611 Ack=1003 Win=269056 Len=1240"
"4297","46.123147","172.217.4.202","192.168.2.103","TCP","1394","[TCP Out-Of-Order] 443  >  1378 [ACK] Seq=418851 Ack=1003 Win=269056 Len=1240"
"4303","46.127085","172.217.4.202","192.168.2.103","TCP","1394","[TCP Out-Of-Order] 443  >  1378 [PSH, ACK] Seq=420091 Ack=1003 Win=269056 Len=1240"
"4304","46.127090","172.217.4.202","192.168.2.103","TCP","1394","443  >  1378 [ACK] Seq=430011 Ack=1003 Win=269056 Len=1240"
"4305","46.127094","172.217.4.202","192.168.2.103","TCP","1394","443  >  1378 [PSH, ACK] Seq=431251 Ack=1003 Win=269056 Len=1240"
"4306","46.127098","172.217.4.202","192.168.2.103","TCP","1394","443  >  1378 [ACK] Seq=432491 Ack=1003 Win=269056 Len=1240"
"4388","46.143559","172.217.4.202","192.168.2.103","TCP","1394","[TCP Out-Of-Order] 443  >  1378 [ACK] Seq=477131 Ack=1003 Win=269056 Len=1240"
"4389","46.143563","172.217.4.202","192.168.2.103","TCP","1394","[TCP Out-Of-Order] 443  >  1378 [PSH, ACK] Seq=478371 Ack=1003 Win=269056 Len=1240"
"4390","46.143567","172.217.4.202","192.168.2.103","TCP","1394","[TCP Out-Of-Order] 443  >  1378 [ACK] Seq=479611 Ack=1003 Win=269056 Len=1240"
"4391","46.143571","172.217.4.202","192.168.2.103","TCP","1394","[TCP Out-Of-Order] 443  >  1378 [PSH, ACK] Seq=480851 Ack=1003 Win=269056 Len=1240"
"4392","46.143575","172.217.4.202","192.168.2.103","TCP","1394","[TCP Out-Of-Order] 443  >  1378 [ACK] Seq=482091 Ack=1003 Win=269056 Len=1240"
"4393","46.143579","172.217.4.202","192.168.2.103","TCP","1394","[TCP Out-Of-Order] 443  >  1378 [PSH, ACK] Seq=483331 Ack=1003 Win=269056 Len=1240"
"4441","46.154160","192.168.2.103","172.217.4.202","TCP","146","[TCP Dup ACK 4430#1] 1378  >  443 [ACK] Seq=1003 Ack=505651 Win=131328 Len=0"
"4445","46.155907","172.217.4.202","192.168.2.103","TCP","1394","[TCP Out-Of-Order] 443  >  1378 [ACK] Seq=508131 Ack=1003 Win=269056 Len=1240 [TCP PDU reassembled in 4518]"
"4480","46.165349","172.217.4.202","192.168.2.103","TCP","1394","[TCP Previous segment not captured] 443  >  1378 [ACK] Seq=540371 Ack=1003 Win=269056 Len=1240 [TCP PDU reassembled in 4518]"
"4481","46.165351","172.217.4.202","192.168.2.103","TCP","1394","443  >  1378 [ACK] Seq=541611 Ack=1003 Win=269056 Len=1240 [TCP PDU reassembled in 4518]"
"4482","46.165354","172.217.4.202","192.168.2.103","TCP","1394","443  >  1378 [PSH, ACK] Seq=542851 Ack=1003 Win=269056 Len=1240 [TCP PDU reassembled in 4518]"
"4483","46.165356","172.217.4.202","192.168.2.103","TCP","1394","443  >  1378 [ACK] Seq=544091 Ack=1003 Win=269056 Len=1240 [TCP PDU reassembled in 4518]"
"4484","46.165358","172.217.4.202","192.168.2.103","TCP","1394","443  >  1378 [ACK] Seq=545331 Ack=1003 Win=269056 Len=1240 [TCP PDU reassembled in 4518]"
"4485","46.165361","172.217.4.202","192.168.2.103","TCP","1394","443  >  1378 [PSH, ACK] Seq=546571 Ack=1003 Win=269056 Len=1240 [TCP PDU reassembled in 4518]"
"4486","46.165368","172.217.4.202","192.168.2.103","TCP","1394","443  >  1378 [ACK] Seq=547811 Ack=1003 Win=269056 Len=1240 [TCP PDU reassembled in 4518]"
"4488","46.167201","172.217.4.202","192.168.2.103","TCP","1394","[TCP Out-Of-Order] 443  >  1378 [ACK] Seq=532931 Ack=1003 Win=269056 Len=1240 [TCP PDU reassembled in 4518]"
"4490","46.167209","172.217.4.202","192.168.2.103","TCP","1394","[TCP Out-Of-Order] 443  >  1378 [ACK] Seq=536651 Ack=1003 Win=269056 Len=1240 [TCP PDU reassembled in 4518]"
"4491","46.167213","172.217.4.202","192.168.2.103","TCP","1394","[TCP Out-Of-Order] 443  >  1378 [ACK] Seq=537891 Ack=1003 Win=269056 Len=1240 [TCP PDU reassembled in 4518]"
"4492","46.167217","172.217.4.202","192.168.2.103","TCP","1394","[TCP Out-Of-Order] 443  >  1378 [PSH, ACK] Seq=539131 Ack=1003 Win=269056 Len=1240 [TCP PDU reassembled in 4518]"
"4509","46.171286","172.217.4.202","192.168.2.103","TCP","1394","[TCP Out-Of-Order] 443  >  1378 [ACK] Seq=555251 Ack=1003 Win=269056 Len=1240"
"4518","46.173178","172.217.4.202","192.168.2.103","TCP","1394","[TCP Out-Of-Order] 443  >  1378 [PSH, ACK] Seq=550291 Ack=1003 Win=269056 Len=1240"
"4538","46.177031","172.217.4.202","192.168.2.103","TCP","1394","[TCP Out-Of-Order] 443  >  1378 [ACK] Seq=562691 Ack=1003 Win=269056 Len=1240"
"4539","46.177033","172.217.4.202","192.168.2.103","TCP","1394","[TCP Out-Of-Order] 443  >  1378 [ACK] Seq=566411 Ack=1003 Win=269056 Len=1240"
"4553","46.179042","192.168.2.103","172.217.4.202","TCP","146","[TCP Dup ACK 4550#1] 1378  >  443 [ACK] Seq=1003 Ack=577571 Win=131328 Len=0"
"4556","46.179993","192.168.2.103","172.217.4.202","TCP","146","[TCP Dup ACK 4550#2] 1378  >  443 [ACK] Seq=1003 Ack=577571 Win=131328 Len=0"
"4572","46.185310","172.217.4.202","192.168.2.103","TCP","1394","[TCP Out-Of-Order] 443  >  1378 [ACK] Seq=578811 Ack=1003 Win=269056 Len=1240"
"4573","46.185313","172.217.4.202","192.168.2.103","TCP","1394","[TCP Out-Of-Order] 443  >  1378 [ACK] Seq=581291 Ack=1003 Win=269056 Len=1240"
"4619","46.195400","172.217.4.202","192.168.2.103","TCP","1394","[TCP Out-Of-Order] 443  >  1378 [ACK] Seq=612291 Ack=1003 Win=269056 Len=1240 [TCP PDU reassembled in 4645]"
"4620","46.195404","172.217.4.202","192.168.2.103","TCP","1394","[TCP Out-Of-Order] 443  >  1378 [PSH, ACK] Seq=613531 Ack=1003 Win=269056 Len=1240 [TCP PDU reassembled in 4645]"
"4631","46.201643","172.217.4.202","192.168.2.103","TCP","1394","443  >  1378 [ACK] Seq=622211 Ack=1003 Win=269056 Len=1240 [TCP PDU reassembled in 4645]"
"4632","46.201646","172.217.4.202","192.168.2.103","TCP","1394","443  >  1378 [ACK] Seq=623451 Ack=1003 Win=269056 Len=1240 [TCP PDU reassembled in 4645]"
"4633","46.201648","172.217.4.202","192.168.2.103","TCP","1394","443  >  1378 [PSH, ACK] Seq=624691 Ack=1003 Win=269056 Len=1240 [TCP PDU reassembled in 4645]"
"4634","46.201650","172.217.4.202","192.168.2.103","TCP","1394","443  >  1378 [ACK] Seq=625931 Ack=1003 Win=269056 Len=1240 [TCP PDU reassembled in 4645]"
"4635","46.201652","172.217.4.202","192.168.2.103","TCP","1394","443  >  1378 [ACK] Seq=627171 Ack=1003 Win=269056 Len=1240 [TCP PDU reassembled in 4645]"
"4636","46.201655","172.217.4.202","192.168.2.103","TCP","1394","443  >  1378 [PSH, ACK] Seq=628411 Ack=1003 Win=269056 Len=1240 [TCP PDU reassembled in 4645]"
"4637","46.201657","172.217.4.202","192.168.2.103","TCP","1394","443  >  1378 [ACK] Seq=629651 Ack=1003 Win=269056 Len=1240 [TCP PDU reassembled in 4645]"
"4715","46.217366","172.217.4.202","192.168.2.103","TCP","1394","[TCP Out-Of-Order] 443  >  1378 [ACK] Seq=666851 Ack=1003 Win=269056 Len=1240 [TCP PDU reassembled in 4762]"
"4716","46.217369","172.217.4.202","192.168.2.103","TCP","1394","[TCP Out-Of-Order] 443  >  1378 [ACK] Seq=668091 Ack=1003 Win=269056 Len=1240 [TCP PDU reassembled in 4762]"
"4717","46.217371","172.217.4.202","192.168.2.103","TCP","1394","[TCP Out-Of-Order] 443  >  1378 [ACK] Seq=670571 Ack=1003 Win=269056 Len=1240 [TCP PDU reassembled in 4762]"
"4780","46.229831","172.217.4.202","192.168.2.103","TCP","1386","[TCP Out-Of-Order] 443  >  1378 [ACK] Seq=718931 Ack=1003 Win=269056 Len=1240"
"4814","46.237206","172.217.4.202","192.168.2.103","TCP","1394","[TCP Out-Of-Order] 443  >  1378 [PSH, ACK] Seq=740011 Ack=1003 Win=269056 Len=1240"
"4816","46.237211","172.217.4.202","192.168.2.103","TCP","1394","[TCP Out-Of-Order] 443  >  1378 [PSH, ACK] Seq=743731 Ack=1003 Win=269056 Len=1240"
"4817","46.237213","172.217.4.202","192.168.2.103","TCP","1394","[TCP Out-Of-Order] 443  >  1378 [ACK] Seq=744971 Ack=1003 Win=269056 Len=1240"
"4910","46.257586","172.217.4.202","192.168.2.103","TCP","1394","[TCP Out-Of-Order] 443  >  1378 [PSH, ACK] Seq=795811 Ack=1003 Win=269056 Len=1240"
"4912","46.257593","172.217.4.202","192.168.2.103","TCP","1394","[TCP Out-Of-Order] 443  >  1378 [ACK] Seq=798291 Ack=1003 Win=269056 Len=1240"
"4913","46.257598","172.217.4.202","192.168.2.103","TCP","1394","[TCP Out-Of-Order] 443  >  1378 [PSH, ACK] Seq=799531 Ack=1003 Win=269056 Len=1240"
"4925","46.261240","172.217.4.202","192.168.2.103","TCP","1394","[TCP Out-Of-Order] 443  >  1378 [ACK] Seq=797051 Ack=1003 Win=269056 Len=1240"
"4943","46.265151","172.217.4.202","192.168.2.103","TCP","1394","[TCP Out-Of-Order] 443  >  1378 [ACK] Seq=828051 Ack=1003 Win=269056 Len=1240"
"4946","46.265158","172.217.4.202","192.168.2.103","TCP","1394","[TCP Out-Of-Order] 443  >  1378 [PSH, ACK] Seq=810691 Ack=1003 Win=269056 Len=1240"
"4947","46.265160","172.217.4.202","192.168.2.103","TCP","1394","[TCP Out-Of-Order] 443  >  1378 [ACK] Seq=811931 Ack=1003 Win=269056 Len=1240"
"4948","46.265162","172.217.4.202","192.168.2.103","TCP","1394","[TCP Out-Of-Order] 443  >  1378 [ACK] Seq=823091 Ack=1003 Win=269056 Len=1240"
"4949","46.265170","172.217.4.202","192.168.2.103","TCP","1394","[TCP Out-Of-Order] 443  >  1378 [ACK] Seq=824331 Ack=1003 Win=269056 Len=1240"
"4970","46.271154","172.217.4.202","192.168.2.103","TCP","1394","[TCP Out-Of-Order] 443  >  1378 [PSH, ACK] Seq=840451 Ack=1003 Win=269056 Len=1240"
"4985","46.275535","172.217.4.202","192.168.2.103","TCP","1394","443  >  1378 [PSH, ACK] Seq=851611 Ack=1003 Win=269056 Len=1240"
"4991","46.277248","172.217.4.202","192.168.2.103","TCP","1394","[TCP Out-Of-Order] 443  >  1378 [PSH, ACK] Seq=844171 Ack=1003 Win=269056 Len=1240"
"4993","46.277252","172.217.4.202","192.168.2.103","TCP","1394","[TCP Out-Of-Order] 443  >  1378 [PSH, ACK] Seq=847891 Ack=1003 Win=269056 Len=1240"
"5034","46.285241","172.217.4.202","192.168.2.103","TCP","1394","[TCP Out-Of-Order] 443  >  1378 [PSH, ACK] Seq=877651 Ack=1003 Win=269056 Len=1240"
"5035","46.285244","172.217.4.202","192.168.2.103","TCP","1394","[TCP Out-Of-Order] 443  >  1378 [ACK] Seq=878891 Ack=1003 Win=269056 Len=1240"
"5049","46.289058","172.217.4.202","192.168.2.103","TCP","1394","[TCP Out-Of-Order] 443  >  1378 [ACK] Seq=898731 Ack=1003 Win=269056 Len=1240"
"5184","46.317146","172.217.4.202","192.168.2.103","TCP","1394","[TCP Out-Of-Order] 443  >  1378 [ACK] Seq=996691 Ack=1003 Win=269056 Len=1240"
"5190","46.317781","192.168.2.103","172.217.4.202","TCP","146","[TCP Dup ACK 5179#1] 1378  >  443 [ACK] Seq=1003 Ack=988011 Win=131328 Len=0"
"5195","46.324785","172.217.4.202","192.168.2.103","TCP","1394","[TCP Previous segment not captured] 443  >  1378 [PSH, ACK] Seq=1001651 Ack=1003 Win=269056 Len=1240"
"5196","46.324787","172.217.4.202","192.168.2.103","TCP","1394","443  >  1378 [ACK] Seq=1002891 Ack=1003 Win=269056 Len=1240"
"5197","46.324789","172.217.4.202","192.168.2.103","TCP","1394","443  >  1378 [ACK] Seq=1004131 Ack=1003 Win=269056 Len=1240"
"5198","46.324792","172.217.4.202","192.168.2.103","TCP","1394","443  >  1378 [PSH, ACK] Seq=1005371 Ack=1003 Win=269056 Len=1240"
"5199","46.324794","172.217.4.202","192.168.2.103","TCP","1394","443  >  1378 [ACK] Seq=1006611 Ack=1003 Win=269056 Len=1240"
"5200","46.324796","172.217.4.202","192.168.2.103","TCP","1394","443  >  1378 [ACK] Seq=1007851 Ack=1003 Win=269056 Len=1240"
"5201","46.324804","172.217.4.202","192.168.2.103","TCP","1394","443  >  1378 [PSH, ACK] Seq=1009091 Ack=1003 Win=269056 Len=1240"
"5218","46.331750","172.217.4.202","192.168.2.103","TCP","1394","[TCP Out-Of-Order] 443  >  1378 [ACK] Seq=1011571 Ack=1003 Win=269056 Len=1240"
"5235","46.334985","172.217.4.202","192.168.2.103","TCP","1394","[TCP Out-Of-Order] 443  >  1378 [ACK] Seq=1014051 Ack=1003 Win=269056 Len=1240"
"5236","46.334992","172.217.4.202","192.168.2.103","TCP","1394","[TCP Out-Of-Order] 443  >  1378 [ACK] Seq=1015291 Ack=1003 Win=269056 Len=1240"
"5242","46.337656","172.217.4.202","192.168.2.103","TCP","1394","[TCP Out-Of-Order] 443  >  1378 [PSH, ACK] Seq=1016531 Ack=1003 Win=269056 Len=1240"
"5300","46.351080","172.217.4.202","192.168.2.103","TCP","1394","[TCP Out-Of-Order] 443  >  1378 [ACK] Seq=1045051 Ack=1003 Win=269056 Len=1240"
"5301","46.351084","172.217.4.202","192.168.2.103","TCP","1394","[TCP Out-Of-Order] 443  >  1378 [ACK] Seq=1047531 Ack=1003 Win=269056 Len=1240"
"5303","46.351093","172.217.4.202","192.168.2.103","TCP","1394","[TCP Out-Of-Order] 443  >  1378 [PSH, ACK] Seq=1050011 Ack=1003 Win=269056 Len=1240"
"5344","46.359351","172.217.4.202","192.168.2.103","TCP","1394","[TCP Out-Of-Order] 443  >  1378 [PSH, ACK] Seq=1076051 Ack=1003 Win=269056 Len=1240"
"5367","46.363420","172.217.4.202","192.168.2.103","TCP","1394","[TCP Out-Of-Order] 443  >  1378 [ACK] Seq=1100851 Ack=1003 Win=269056 Len=1240 [TCP PDU reassembled in 5417]"
"5441","46.375412","172.217.4.202","192.168.2.103","TCP","1394","[TCP Out-Of-Order] 443  >  1378 [ACK] Seq=1150451 Ack=1003 Win=269056 Len=1240"
"5443","46.375419","172.217.4.202","192.168.2.103","TCP","1394","443  >  1378 [PSH, ACK] Seq=1152931 Ack=1003 Win=269056 Len=1240"
"5545","46.395593","172.217.4.202","192.168.2.103","TCP","1394","[TCP Out-Of-Order] 443  >  1378 [ACK] Seq=1211211 Ack=1003 Win=269056 Len=1240 [TCP PDU reassembled in 5615]"
"5546","46.395597","172.217.4.202","192.168.2.103","TCP","1394","[TCP Out-Of-Order] 443  >  1378 [PSH, ACK] Seq=1212451 Ack=1003 Win=269056 Len=1240 [TCP PDU reassembled in 5615]"
"5547","46.395601","172.217.4.202","192.168.2.103","TCP","1394","[TCP Out-Of-Order] 443  >  1378 [ACK] Seq=1213691 Ack=1003 Win=269056 Len=1240 [TCP PDU reassembled in 5615]"
"5548","46.395605","172.217.4.202","192.168.2.103","TCP","1394","[TCP Out-Of-Order] 443  >  1378 [ACK] Seq=1214931 Ack=1003 Win=269056 Len=1240 [TCP PDU reassembled in 5615]"
"5566","46.399223","172.217.4.202","192.168.2.103","TCP","1394","[TCP Out-Of-Order] 443  >  1378 [PSH, ACK] Seq=1216171 Ack=1003 Win=269056 Len=1240 [TCP PDU reassembled in 5615]"
"5567","46.399228","172.217.4.202","192.168.2.103","TCP","1394","[TCP Out-Of-Order] 443  >  1378 [ACK] Seq=1217411 Ack=1003 Win=269056 Len=1240 [TCP PDU reassembled in 5615]"
"5583","46.407264","172.217.4.202","192.168.2.103","TCP","1394","[TCP Out-Of-Order] 443  >  1378 [PSH, ACK] Seq=1242211 Ack=1003 Win=269056 Len=1240 [TCP PDU reassembled in 5615]"
"5584","46.407268","172.217.4.202","192.168.2.103","TCP","1394","[TCP Out-Of-Order] 443  >  1378 [ACK] Seq=1243451 Ack=1003 Win=269056 Len=1240 [TCP PDU reassembled in 5615]"
"5586","46.407276","172.217.4.202","192.168.2.103","TCP","1394","443  >  1378 [PSH, ACK] Seq=1245931 Ack=1003 Win=269056 Len=1240 [TCP PDU reassembled in 5615]"
"5587","46.407280","172.217.4.202","192.168.2.103","TCP","1394","443  >  1378 [ACK] Seq=1247171 Ack=1003 Win=269056 Len=1240 [TCP PDU reassembled in 5615]"
"5588","46.407284","172.217.4.202","192.168.2.103","TCP","1394","443  >  1378 [ACK] Seq=1248411 Ack=1003 Win=269056 Len=1240 [TCP PDU reassembled in 5615]"
"5590","46.408992","172.217.4.202","192.168.2.103","TCP","1394","[TCP Out-Of-Order] 443  >  1378 [PSH, ACK] Seq=1227331 Ack=1003 Win=269056 Len=1240 [TCP PDU reassembled in 5615]"
"5592","46.408996","172.217.4.202","192.168.2.103","TCP","1394","[TCP Out-Of-Order] 443  >  1378 [PSH, ACK] Seq=1238491 Ack=1003 Win=269056 Len=1240 [TCP PDU reassembled in 5615]"
"5593","46.408998","172.217.4.202","192.168.2.103","TCP","1394","[TCP Out-Of-Order] 443  >  1378 [ACK] Seq=1239731 Ack=1003 Win=269056 Len=1240 [TCP PDU reassembled in 5615]"
"5612","46.413400","172.217.4.202","192.168.2.103","TCP","1394","[TCP Out-Of-Order] 443  >  1378 [ACK] Seq=1258331 Ack=1003 Win=269056 Len=1240 [TCP PDU reassembled in 5615]"
"5615","46.413412","172.217.4.202","192.168.2.103","TCP","1394","[TCP Out-Of-Order] 443  >  1378 [PSH, ACK] Seq=1249651 Ack=1003 Win=269056 Len=1240"
"5659","46.424267","172.217.4.202","192.168.2.103","TCP","1394","[TCP Out-Of-Order] 443  >  1378 [PSH, ACK] Seq=1271971 Ack=1003 Win=269056 Len=1240"
"5778","46.449415","172.217.4.202","192.168.2.103","TCP","1394","443  >  1378 [ACK] Seq=1341411 Ack=1003 Win=269056 Len=1240 [TCP PDU reassembled in 5785]"
"5838","46.461424","172.217.4.202","192.168.2.103","TCP","1394","443  >  1378 [PSH, ACK] Seq=1383571 Ack=1003 Win=269056 Len=1240"
"5839","46.461426","172.217.4.202","192.168.2.103","TCP","1394","443  >  1378 [ACK] Seq=1384811 Ack=1003 Win=269056 Len=1240"
"5840","46.461428","172.217.4.202","192.168.2.103","TCP","1394","443  >  1378 [ACK] Seq=1386051 Ack=1003 Win=269056 Len=1240"
"5841","46.461430","172.217.4.202","192.168.2.103","TCP","1394","443  >  1378 [PSH, ACK] Seq=1387291 Ack=1003 Win=269056 Len=1240"
"5842","46.461433","172.217.4.202","192.168.2.103","TCP","1394","443  >  1378 [ACK] Seq=1388531 Ack=1003 Win=269056 Len=1240"
"5843","46.461435","172.217.4.202","192.168.2.103","TCP","1394","443  >  1378 [ACK] Seq=1389771 Ack=1003 Win=269056 Len=1240"
"5844","46.461442","172.217.4.202","192.168.2.103","TCP","1394","443  >  1378 [PSH, ACK] Seq=1391011 Ack=1003 Win=269056 Len=1240"
"5871","46.467428","172.217.4.202","192.168.2.103","TCP","1394","[TCP Out-Of-Order] 443  >  1378 [PSH, ACK] Seq=1394731 Ack=1003 Win=269056 Len=1240"
"5872","46.467432","172.217.4.202","192.168.2.103","TCP","1394","[TCP Out-Of-Order] 443  >  1378 [PSH, ACK] Seq=1398451 Ack=1003 Win=269056 Len=1240"
"5873","46.467436","172.217.4.202","192.168.2.103","TCP","1394","[TCP Out-Of-Order] 443  >  1378 [ACK] Seq=1399691 Ack=1003 Win=269056 Len=1240"
"5891","46.471404","172.217.4.202","192.168.2.103","TCP","1394","[TCP Out-Of-Order] 443  >  1378 [ACK] Seq=1414571 Ack=1003 Win=269056 Len=1240"
"5965","46.485392","172.217.4.202","192.168.2.103","TCP","1394","443  >  1378 [ACK] Seq=1459211 Ack=1003 Win=269056 Len=1240 [TCP PDU reassembled in 6000]"
"5966","46.485393","172.217.4.202","192.168.2.103","TCP","1394","443  >  1378 [ACK] Seq=1460451 Ack=1003 Win=269056 Len=1240 [TCP PDU reassembled in 6000]"
"5978","46.487519","172.217.4.202","192.168.2.103","TCP","1394","[TCP Out-Of-Order] 443  >  1378 [PSH, ACK] Seq=1461691 Ack=1003 Win=269056 Len=1240 [TCP PDU reassembled in 6000]"
"5981","46.487531","172.217.4.202","192.168.2.103","TCP","1394","443  >  1378 [PSH, ACK] Seq=1465411 Ack=1003 Win=269056 Len=1240 [TCP PDU reassembled in 6000]"
"5982","46.487535","172.217.4.202","192.168.2.103","TCP","1394","443  >  1378 [ACK] Seq=1466651 Ack=1003 Win=269056 Len=1240 [TCP PDU reassembled in 6000]"
"6025","46.495561","172.217.4.202","192.168.2.103","TCP","1394","[TCP Out-Of-Order] 443  >  1378 [PSH, ACK] Seq=1487731 Ack=1003 Win=269056 Len=1240"
"6307","51.215765","13.107.42.12","192.168.2.103","TCP","146","443  >  1337 [RST, ACK] Seq=1 Ack=1 Win=0 Len=0"
"6310","51.215988","13.107.42.12","192.168.2.103","TCP","146","443  >  1337 [RST, ACK] Seq=1 Ack=1 Win=0 Len=0"
"6686","56.314546","172.217.4.202","192.168.2.103","TCP","1394","[TCP Out-Of-Order] 443  >  1378 [ACK] Seq=1644093 Ack=1577 Win=268544 Len=1240"
"6688","56.314555","172.217.4.202","192.168.2.103","TCP","1394","[TCP Out-Of-Order] 443  >  1378 [PSH, ACK] Seq=1646573 Ack=1577 Win=268544 Len=1240"
"6689","56.314560","172.217.4.202","192.168.2.103","TCP","1394","[TCP Out-Of-Order] 443  >  1378 [ACK] Seq=1647813 Ack=1577 Win=268544 Len=1240"
"6690","56.314564","172.217.4.202","192.168.2.103","TCP","1394","[TCP Out-Of-Order] 443  >  1378 [ACK] Seq=1649053 Ack=1577 Win=268544 Len=1240"
"6691","56.314573","172.217.4.202","192.168.2.103","TCP","1394","[TCP Out-Of-Order] 443  >  1378 [ACK] Seq=1650293 Ack=1577 Win=268544 Len=1240"
