"No.","Time","Source","Destination","Protocol","Length","Info"
"1477","8.155262","23.192.220.16","192.168.2.103","TCP","1394","[TCP Previous segment not captured] 443  >  2032 [PSH, ACK] Seq=19504 Ack=1127 Win=64128 Len=1240 [TCP PDU reassembled in 1508]"
"1584","8.176458","23.192.220.16","192.168.2.103","TCP","1394","[TCP Previous segment not captured] 443  >  2032 [ACK] Seq=60424 Ack=1158 Win=64128 Len=1240 [TCP PDU reassembled in 1607]"
"1826","8.454701","192.168.2.103","157.240.26.49","TCP","146","[TCP Previous segment not captured] 2033  >  443 [ACK] Seq=36972 Ack=18274 Win=65536 Len=0"
"1845","8.465283","157.240.26.49","192.168.2.103","TCP","146","[TCP Previous segment not captured] 443  >  2033 [ACK] Seq=18882 Ack=38254 Win=561 Len=0"
"2307","11.368729","157.240.26.49","192.168.2.103","TCP","1394","[TCP Previous segment not captured] 443  >  2038 [ACK] Seq=52053 Ack=3976 Win=77056 Len=1240 [TCP PDU reassembled in 2356]"
"3482","15.905288","34.36.199.114","192.168.2.103","TCP","154","[TCP Previous segment not captured] 443  >  2045 [ACK] Seq=1552 Ack=2310 Win=267776 Len=0"
"3483","15.905291","34.36.199.114","192.168.2.103","TCP","154","[TCP Previous segment not captured] 443  >  2043 [ACK] Seq=1552 Ack=2290 Win=267776 Len=0"
"3577","15.935584","34.36.199.114","192.168.2.103","TCP","146","[TCP Previous segment not captured] 443  >  2043 [ACK] Seq=1737 Ack=2622 Win=267520 Len=0"
"4624","17.532111","157.240.26.35","192.168.2.103","TCP","146","[TCP Previous segment not captured] 443  >  2050 [ACK] Seq=3227 Ack=596 Win=265 Len=0"
"7080","34.714442","142.250.190.42","192.168.2.103","TCP","146","[TCP Previous segment not captured] 443  >  2057 [ACK] Seq=7215 Ack=10094 Win=260864 Len=0"
"7576","38.914643","142.250.190.42","192.168.2.103","TCP","1394","[TCP Previous segment not captured] 443  >  2065 [PSH, ACK] Seq=56771 Ack=1003 Win=269056 Len=1240"
"7588","38.916925","142.250.190.42","192.168.2.103","TCP","1394","[TCP Previous segment not captured] 443  >  2065 [PSH, ACK] Seq=61731 Ack=1003 Win=269056 Len=1240"
"7886","38.977518","142.250.190.42","192.168.2.103","TCP","1394","[TCP Previous segment not captured] 443  >  2065 [ACK] Seq=239051 Ack=1003 Win=269056 Len=1240 [TCP PDU reassembled in 7923]"
"8025","39.005817","142.250.190.42","192.168.2.103","TCP","1394","[TCP Previous segment not captured] 443  >  2065 [ACK] Seq=318411 Ack=1003 Win=269056 Len=1240 [TCP PDU reassembled in 8043]"
"8032","39.007906","142.250.190.42","192.168.2.103","TCP","1394","[TCP Previous segment not captured] 443  >  2065 [ACK] Seq=322131 Ack=1003 Win=269056 Len=1240 [TCP PDU reassembled in 8043]"
"8137","39.033703","142.250.190.42","192.168.2.103","TCP","1394","[TCP Previous segment not captured] 443  >  2065 [ACK] Seq=395291 Ack=1003 Win=269056 Len=1240 [TCP PDU reassembled in 8165]"
"8522","39.112122","142.250.190.42","192.168.2.103","TCP","1394","[TCP Previous segment not captured] 443  >  2065 [PSH, ACK] Seq=606091 Ack=1003 Win=269056 Len=1240"
"8524","39.112131","142.250.190.42","192.168.2.103","TCP","1394","[TCP Previous segment not captured] 443  >  2065 [ACK] Seq=617251 Ack=1003 Win=269056 Len=1240"
"8602","39.134805","142.250.190.42","192.168.2.103","TCP","1394","[TCP Previous segment not captured] 443  >  2065 [ACK] Seq=674291 Ack=1003 Win=269056 Len=1240 [TCP PDU reassembled in 8616]"
"8644","39.146251","142.250.190.42","192.168.2.103","TCP","1394","[TCP Previous segment not captured] 443  >  2065 [PSH, ACK] Seq=710251 Ack=1003 Win=269056 Len=1240 [TCP PDU reassembled in 8659]"
"8835","39.199582","142.250.190.42","192.168.2.103","TCP","1394","[TCP Previous segment not captured] 443  >  2065 [ACK] Seq=805731 Ack=1003 Win=269056 Len=1240 [TCP PDU reassembled in 8915]"
"8875","39.208506","142.250.190.42","192.168.2.103","TCP","1394","[TCP Previous segment not captured] 443  >  2065 [ACK] Seq=825571 Ack=1003 Win=269056 Len=1240 [TCP PDU reassembled in 8915]"
"9027","39.245103","142.250.190.42","192.168.2.103","TCP","1394","[TCP Previous segment not captured] 443  >  2065 [ACK] Seq=909891 Ack=1003 Win=269056 Len=1240 [TCP PDU reassembled in 9085]"
"9080","39.256452","142.250.190.42","192.168.2.103","TCP","1394","[TCP Previous segment not captured] 443  >  2065 [ACK] Seq=932211 Ack=1003 Win=269056 Len=1240 [TCP PDU reassembled in 9085]"
"9108","39.263640","142.250.190.42","192.168.2.103","TCP","1394","[TCP Previous segment not captured] 443  >  2065 [ACK] Seq=954531 Ack=1003 Win=269056 Len=1240 [TCP PDU reassembled in 9132]"
"9152","39.273542","142.250.190.42","192.168.2.103","TCP","1394","[TCP Previous segment not captured] 443  >  2065 [ACK] Seq=981811 Ack=1003 Win=269056 Len=1240"
"9200","39.282392","142.250.190.42","192.168.2.103","TCP","1394","[TCP Previous segment not captured] 443  >  2065 [PSH, ACK] Seq=992971 Ack=1003 Win=269056 Len=1240"
"9252","39.291454","142.250.190.42","192.168.2.103","TCP","1394","[TCP Previous segment not captured] 443  >  2065 [PSH, ACK] Seq=1025211 Ack=1003 Win=269056 Len=1240"
"9398","39.319859","142.250.190.42","192.168.2.103","TCP","1394","[TCP Previous segment not captured] 443  >  2065 [ACK] Seq=1108291 Ack=1003 Win=269056 Len=1240 [TCP PDU reassembled in 9456]"
"9536","39.357456","142.250.190.42","192.168.2.103","TCP","1394","[TCP Previous segment not captured] 443  >  2065 [PSH, ACK] Seq=1171531 Ack=1003 Win=269056 Len=1240 [TCP PDU reassembled in 9577]"
"9668","39.387608","142.250.190.42","192.168.2.103","TCP","1394","[TCP Previous segment not captured] 443  >  2065 [ACK] Seq=1239731 Ack=1003 Win=269056 Len=1240 [TCP PDU reassembled in 9710]"
"9809","39.421833","142.250.190.42","192.168.2.103","TCP","1394","[TCP Previous segment not captured] 443  >  2065 [PSH, ACK] Seq=1302971 Ack=1003 Win=269056 Len=1240 [TCP PDU reassembled in 9860]"
"9812","39.426213","142.250.190.42","192.168.2.103","TCP","1394","[TCP Previous segment not captured] 443  >  2065 [PSH, ACK] Seq=1305451 Ack=1003 Win=269056 Len=1240 [TCP PDU reassembled in 9860]"
"10006","39.471307","142.250.190.42","192.168.2.103","TCP","1394","[TCP Previous segment not captured] 443  >  2065 [ACK] Seq=1403411 Ack=1003 Win=269056 Len=1240 [TCP PDU reassembled in 10129]"
"10044","39.481444","142.250.190.42","192.168.2.103","TCP","1394","[TCP Previous segment not captured] 443  >  2065 [ACK] Seq=1420771 Ack=1003 Win=269056 Len=1240 [TCP PDU reassembled in 10129]"
"10078","39.489446","142.250.190.42","192.168.2.103","TCP","1394","[TCP Previous segment not captured] 443  >  2065 [ACK] Seq=1433171 Ack=1003 Win=269056 Len=1240 [TCP PDU reassembled in 10129]"
"10117","39.497897","142.250.190.42","192.168.2.103","TCP","1394","[TCP Previous segment not captured] 443  >  2065 [ACK] Seq=1455491 Ack=1003 Win=269056 Len=1240 [TCP PDU reassembled in 10129]"
"10391","41.974122","142.250.190.42","192.168.2.103","TCP","146","[TCP Previous segment not captured] 443  >  2057 [ACK] Seq=8465 Ack=13960 Win=257280 Len=0"
"11270","47.295786","142.250.190.42","192.168.2.103","TCP","1394","[TCP Previous segment not captured] 443  >  2057 [PSH, ACK] Seq=285588 Ack=16467 Win=254976 Len=1240"
"12037","47.465340","142.250.190.42","192.168.2.103","TCP","1394","[TCP Previous segment not captured] 443  >  2057 [PSH, ACK] Seq=736948 Ack=16467 Win=254976 Len=1240 [TCP PDU reassembled in 12048]"
"13426","47.745605","142.250.190.42","192.168.2.103","TCP","191","[TCP Previous segment not captured] 443  >  2057 [PSH, ACK] Seq=1604948 Ack=16467 Win=254976 Len=37"
"14380","56.846600","142.250.190.42","192.168.2.103","TCP","146","[TCP Previous segment not captured] 443  >  2057 [ACK] Seq=1606877 Ack=22838 Win=249600 Len=0"
"14815","57.602022","142.250.190.42","192.168.2.103","TCP","1394","[TCP Previous segment not captured] 443  >  2057 [PSH, ACK] Seq=1812676 Ack=22838 Win=249600 Len=1240"
"14830","57.604002","142.250.190.42","192.168.2.103","TCP","1394","[TCP Previous segment not captured] 443  >  2057 [PSH, ACK] Seq=1827556 Ack=22838 Win=249600 Len=1240"
"14860","57.610244","142.250.190.42","192.168.2.103","TCP","1394","[TCP Previous segment not captured] 443  >  2057 [PSH, ACK] Seq=1842436 Ack=22838 Win=249600 Len=1240"
"14916","57.619845","142.250.190.42","192.168.2.103","TCP","1394","[TCP Previous segment not captured] 443  >  2057 [ACK] Seq=1880876 Ack=22838 Win=249600 Len=1240 [TCP PDU reassembled in 15005]"
"14923","57.622039","142.250.190.42","192.168.2.103","TCP","1394","[TCP Previous segment not captured] 443  >  2057 [PSH, ACK] Seq=1883356 Ack=22838 Win=249600 Len=1240 [TCP PDU reassembled in 15005]"
"14970","57.630706","142.250.190.42","192.168.2.103","TCP","1394","[TCP Previous segment not captured] 443  >  2057 [PSH, ACK] Seq=1916836 Ack=22838 Win=249600 Len=1240 [TCP PDU reassembled in 15005]"
"15055","57.646099","142.250.190.42","192.168.2.103","TCP","1394","[TCP Previous segment not captured] 443  >  2057 [PSH, ACK] Seq=1968916 Ack=22838 Win=249600 Len=1240 [TCP PDU reassembled in 15098]"
"15183","57.675853","142.250.190.42","192.168.2.103","TCP","1394","[TCP Previous segment not captured] 443  >  2057 [ACK] Seq=2034636 Ack=22838 Win=249600 Len=1240"
"16293","57.928284","142.250.190.42","192.168.2.103","TCP","1394","[TCP Previous segment not captured] 443  >  2057 [ACK] Seq=2693076 Ack=22838 Win=249600 Len=1240 [TCP PDU reassembled in 16308]"
"16405","57.949199","142.250.190.42","192.168.2.103","TCP","1394","[TCP Previous segment not captured] 443  >  2057 [PSH, ACK] Seq=2766236 Ack=22838 Win=249600 Len=1240"
"16788","58.025586","142.250.190.42","192.168.2.103","TCP","1394","[TCP Previous segment not captured] 443  >  2057 [ACK] Seq=3035316 Ack=22838 Win=249600 Len=1240"
"17732","67.654765","142.250.190.42","192.168.2.103","TCP","1394","[TCP Previous segment not captured] 443  >  2065 [ACK] Seq=1529086 Ack=5442 Win=265216 Len=1240 [TCP PDU reassembled in 17799]"
"18400","67.794434","142.250.190.42","192.168.2.103","TCP","1394","[TCP Previous segment not captured] 443  >  2065 [PSH, ACK] Seq=1977854 Ack=5442 Win=265216 Len=1240 [TCP PDU reassembled in 18410]"
"18487","67.810569","142.250.190.42","192.168.2.103","TCP","1394","[TCP Previous segment not captured] 443  >  2065 [ACK] Seq=2029934 Ack=5442 Win=265216 Len=1240 [TCP PDU reassembled in 18515]"
"18491","67.812191","142.250.190.42","192.168.2.103","TCP","1394","[TCP Previous segment not captured] 443  >  2065 [PSH, ACK] Seq=2037374 Ack=5442 Win=265216 Len=1240 [TCP PDU reassembled in 18515]"
"18494","67.812202","142.250.190.42","192.168.2.103","TCP","1394","[TCP Previous segment not captured] 443  >  2065 [ACK] Seq=2041094 Ack=5442 Win=265216 Len=1240 [TCP PDU reassembled in 18515]"
"18699","67.858704","142.250.190.42","192.168.2.103","TCP","1394","[TCP Previous segment not captured] 443  >  2065 [PSH, ACK] Seq=2165094 Ack=5442 Win=265216 Len=1240 [TCP PDU reassembled in 18754]"
"18738","67.867592","142.250.190.42","192.168.2.103","TCP","1394","[TCP Previous segment not captured] 443  >  2065 [ACK] Seq=2184934 Ack=5442 Win=265216 Len=1240 [TCP PDU reassembled in 18754]"
"18814","67.883772","142.250.190.42","192.168.2.103","TCP","1394","[TCP Previous segment not captured] 443  >  2065 [ACK] Seq=2241974 Ack=5442 Win=265216 Len=1240 [TCP PDU reassembled in 18835]"
"18927","67.910050","142.250.190.42","192.168.2.103","TCP","1394","[TCP Previous segment not captured] 443  >  2065 [PSH, ACK] Seq=2299014 Ack=5442 Win=265216 Len=1240 [TCP PDU reassembled in 18979]"
"18953","67.915649","142.250.190.42","192.168.2.103","TCP","1394","[TCP Previous segment not captured] 443  >  2065 [PSH, ACK] Seq=2310174 Ack=5442 Win=265216 Len=1240 [TCP PDU reassembled in 18979]"
"19009","67.926214","142.250.190.42","192.168.2.103","TCP","1394","[TCP Previous segment not captured] 443  >  2065 [ACK] Seq=2346134 Ack=5442 Win=265216 Len=1240 [TCP PDU reassembled in 19038]"
"19158","67.958337","142.250.190.42","192.168.2.103","TCP","1394","[TCP Previous segment not captured] 443  >  2065 [PSH, ACK] Seq=2429214 Ack=5442 Win=265216 Len=1240 [TCP PDU reassembled in 19246]"
"19168","67.960119","142.250.190.42","192.168.2.103","TCP","1394","[TCP Previous segment not captured] 443  >  2065 [PSH, ACK] Seq=2432934 Ack=5442 Win=265216 Len=1240 [TCP PDU reassembled in 19246]"
"19189","67.964112","142.250.190.42","192.168.2.103","TCP","1394","[TCP Previous segment not captured] 443  >  2065 [ACK] Seq=2439134 Ack=5442 Win=265216 Len=1240 [TCP PDU reassembled in 19246]"
"19222","67.969608","142.250.190.42","192.168.2.103","TCP","1394","[TCP Previous segment not captured] 443  >  2065 [ACK] Seq=2460214 Ack=5442 Win=265216 Len=1240 [TCP PDU reassembled in 19246]"
"19255","67.978692","142.250.190.42","192.168.2.103","TCP","1394","[TCP Previous segment not captured] 443  >  2065 [PSH, ACK] Seq=2470134 Ack=5442 Win=265216 Len=1240 [TCP PDU reassembled in 19271]"
"19547","68.038427","142.250.190.42","192.168.2.103","TCP","1394","[TCP Previous segment not captured] 443  >  2065 [ACK] Seq=2673494 Ack=5442 Win=265216 Len=1240"
"19581","68.044200","142.250.190.42","192.168.2.103","TCP","1394","[TCP Previous segment not captured] 443  >  2065 [ACK] Seq=2692094 Ack=5442 Win=265216 Len=1240"
"19613","68.052644","142.250.190.42","192.168.2.103","TCP","1394","[TCP Previous segment not captured] 443  >  2065 [PSH, ACK] Seq=2715654 Ack=5442 Win=265216 Len=1240"
"19835","68.088485","142.250.190.42","192.168.2.103","TCP","1394","[TCP Previous segment not captured] 443  >  2065 [PSH, ACK] Seq=2875614 Ack=5442 Win=265216 Len=1240 [TCP PDU reassembled in 19844]"
"19936","68.111703","142.250.190.42","192.168.2.103","TCP","1394","[TCP Previous segment not captured] 443  >  2065 [ACK] Seq=2941334 Ack=5442 Win=265216 Len=1240 [TCP PDU reassembled in 20005]"
"19994","68.124710","142.250.190.42","192.168.2.103","TCP","1394","[TCP Previous segment not captured] 443  >  2065 [ACK] Seq=2978534 Ack=5442 Win=265216 Len=1240 [TCP PDU reassembled in 20005]"
"21008","77.577114","142.250.190.42","192.168.2.103","TCP","1394","[TCP Previous segment not captured] 443  >  2065 [PSH, ACK] Seq=3268481 Ack=6016 Win=264704 Len=1240 [TCP PDU reassembled in 21024]"
"21181","77.607861","142.250.190.42","192.168.2.103","TCP","1394","[TCP Previous segment not captured] 443  >  2065 [ACK] Seq=3391241 Ack=6016 Win=264704 Len=1240 [TCP PDU reassembled in 21198]"
"21402","77.655179","142.250.190.42","192.168.2.103","TCP","1394","[TCP Previous segment not captured] 443  >  2065 [PSH, ACK] Seq=3551201 Ack=6016 Win=264704 Len=1240"
"21425","77.662236","142.250.190.42","192.168.2.103","TCP","1394","[TCP Previous segment not captured] 443  >  2065 [PSH, ACK] Seq=3557401 Ack=6016 Win=264704 Len=1240"
"21492","77.674462","142.250.190.42","192.168.2.103","TCP","1394","[TCP Previous segment not captured] 443  >  2065 [ACK] Seq=3590881 Ack=6016 Win=264704 Len=1240"
"21513","77.678644","142.250.190.42","192.168.2.103","TCP","1394","[TCP Previous segment not captured] 443  >  2065 [ACK] Seq=3598321 Ack=6016 Win=264704 Len=1240"
"21856","77.748154","142.250.190.42","192.168.2.103","TCP","1394","[TCP Previous segment not captured] 443  >  2065 [PSH, ACK] Seq=3836401 Ack=6016 Win=264704 Len=1240 [TCP PDU reassembled in 21875]"
"21942","77.768175","142.250.190.42","192.168.2.103","TCP","1394","[TCP Previous segment not captured] 443  >  2065 [ACK] Seq=3887241 Ack=6016 Win=264704 Len=1240 [TCP PDU reassembled in 21994]"
"22180","77.812729","142.250.190.42","192.168.2.103","TCP","1394","[TCP Previous segment not captured] 443  >  2065 [PSH, ACK] Seq=4037281 Ack=6016 Win=264704 Len=1240 [TCP PDU reassembled in 22193]"
"22250","77.828590","142.250.190.42","192.168.2.103","TCP","1394","[TCP Previous segment not captured] 443  >  2065 [PSH, ACK] Seq=4081921 Ack=6016 Win=264704 Len=1240 [TCP PDU reassembled in 22271]"
"22534","77.884457","142.250.190.42","192.168.2.103","TCP","1394","[TCP Previous segment not captured] 443  >  2065 [ACK] Seq=4269161 Ack=6016 Win=264704 Len=1240 [TCP PDU reassembled in 22561]"
"22539","77.886032","142.250.190.42","192.168.2.103","TCP","1394","[TCP Previous segment not captured] 443  >  2065 [PSH, ACK] Seq=4275361 Ack=6016 Win=264704 Len=1240 [TCP PDU reassembled in 22561]"
"22602","77.900433","142.250.190.42","192.168.2.103","TCP","1394","[TCP Previous segment not captured] 443  >  2065 [PSH, ACK] Seq=4320001 Ack=6016 Win=264704 Len=1240"
"22604","77.900441","142.250.190.42","192.168.2.103","TCP","1394","[TCP Previous segment not captured] 443  >  2065 [ACK] Seq=4322481 Ack=6016 Win=264704 Len=1240"
"22706","77.917354","142.250.190.42","192.168.2.103","TCP","1394","[TCP Previous segment not captured] 443  >  2065 [ACK] Seq=4385721 Ack=6016 Win=264704 Len=1240 [TCP PDU reassembled in 22729]"
"24488","87.345069","142.250.190.42","192.168.2.103","TCP","1394","[TCP Previous segment not captured] 443  >  2065 [ACK] Seq=4718450 Ack=6590 Win=264192 Len=1240 [TCP PDU reassembled in 24541]"
"24712","87.399968","142.250.190.42","192.168.2.103","TCP","1394","[TCP Previous segment not captured] 443  >  2065 [ACK] Seq=4898250 Ack=6590 Win=264192 Len=1240 [TCP PDU reassembled in 24782]"
"25546","87.572287","142.250.190.42","192.168.2.103","TCP","1394","[TCP Previous segment not captured] 443  >  2065 [PSH, ACK] Seq=5434946 Ack=6590 Win=264192 Len=1240 [TCP PDU reassembled in 25642]"
"25901","87.642750","142.250.190.42","192.168.2.103","TCP","1394","[TCP Previous segment not captured] 443  >  2065 [PSH, ACK] Seq=5661866 Ack=6590 Win=264192 Len=1240 [TCP PDU reassembled in 25911]"
"26038","87.674136","142.250.190.42","192.168.2.103","TCP","1394","[TCP Previous segment not captured] 443  >  2065 [PSH, ACK] Seq=5739986 Ack=6590 Win=264192 Len=1240 [TCP PDU reassembled in 26126]"
"26057","87.678101","142.250.190.42","192.168.2.103","TCP","1394","[TCP Previous segment not captured] 443  >  2065 [ACK] Seq=5748666 Ack=6590 Win=264192 Len=1240 [TCP PDU reassembled in 26126]"
"26696","87.811918","142.250.190.42","192.168.2.103","TCP","1394","[TCP Previous segment not captured] 443  >  2065 [PSH, ACK] Seq=6152906 Ack=6590 Win=264192 Len=1240 [TCP PDU reassembled in 26706]"
"28287","97.874001","142.250.190.42","192.168.2.103","TCP","1394","[TCP Previous segment not captured] 443  >  2065 [ACK] Seq=6729160 Ack=7164 Win=263680 Len=1240 [TCP PDU reassembled in 28335]"
"28295","97.876311","142.250.190.42","192.168.2.103","TCP","1394","[TCP Previous segment not captured] 443  >  2065 [PSH, ACK] Seq=6731640 Ack=7164 Win=263680 Len=1240 [TCP PDU reassembled in 28335]"
"28298","97.876322","142.250.190.42","192.168.2.103","TCP","1394","[TCP Previous segment not captured] 443  >  2065 [PSH, ACK] Seq=6735360 Ack=7164 Win=263680 Len=1240 [TCP PDU reassembled in 28335]"
"28315","97.879977","142.250.190.42","192.168.2.103","TCP","1394","[TCP Previous segment not captured] 443  >  2065 [ACK] Seq=6741560 Ack=7164 Win=263680 Len=1240 [TCP PDU reassembled in 28335]"
"28323","97.882241","142.250.190.42","192.168.2.103","TCP","1394","[TCP Previous segment not captured] 443  >  2065 [ACK] Seq=6744040 Ack=7164 Win=263680 Len=1240 [TCP PDU reassembled in 28335]"
"28563","97.937243","142.250.190.42","192.168.2.103","TCP","1394","[TCP Previous segment not captured] 443  >  2065 [PSH, ACK] Seq=6868040 Ack=7164 Win=263680 Len=1240"
"28634","97.953778","142.250.190.42","192.168.2.103","TCP","1394","[TCP Previous segment not captured] 443  >  2065 [PSH, ACK] Seq=6910200 Ack=7164 Win=263680 Len=1240"
"29026","98.030287","142.250.190.42","192.168.2.103","TCP","1394","[TCP Previous segment not captured] 443  >  2065 [ACK] Seq=7143320 Ack=7164 Win=263680 Len=1240 [TCP PDU reassembled in 29035]"
"29417","98.105276","142.250.190.42","192.168.2.103","TCP","1394","[TCP Previous segment not captured] 443  >  2065 [ACK] Seq=7433480 Ack=7164 Win=263680 Len=1240"
"29701","98.157392","142.250.190.42","192.168.2.103","TCP","1394","[TCP Previous segment not captured] 443  >  2065 [ACK] Seq=7644280 Ack=7164 Win=263680 Len=1240"
"29752","98.166564","142.250.190.42","192.168.2.103","TCP","1394","[TCP Previous segment not captured] 443  >  2065 [ACK] Seq=7676520 Ack=7164 Win=263680 Len=1240"
"30779","107.184733","142.250.190.42","192.168.2.103","TCP","1394","[TCP Previous segment not captured] 443  >  2065 [ACK] Seq=7776185 Ack=7738 Win=263168 Len=1240"
"30820","107.193127","142.250.190.42","192.168.2.103","TCP","1394","[TCP Previous segment not captured] 443  >  2065 [ACK] Seq=7786105 Ack=7738 Win=263168 Len=1240"
"30872","107.200791","142.250.190.42","192.168.2.103","TCP","1394","[TCP Previous segment not captured] 443  >  2065 [ACK] Seq=7820825 Ack=7738 Win=263168 Len=1240"
"31066","107.246236","142.250.190.42","192.168.2.103","TCP","1394","[TCP Previous segment not captured] 443  >  2065 [ACK] Seq=7943585 Ack=7738 Win=263168 Len=1240 [TCP PDU reassembled in 31098]"
"31144","107.261779","142.250.190.42","192.168.2.103","TCP","1394","[TCP Previous segment not captured] 443  >  2065 [ACK] Seq=7983265 Ack=7738 Win=263168 Len=1240 [TCP PDU reassembled in 31165]"
"31193","107.271775","142.250.190.42","192.168.2.103","TCP","1394","[TCP Previous segment not captured] 443  >  2065 [ACK] Seq=8016745 Ack=7738 Win=263168 Len=1240 [TCP PDU reassembled in 31243]"
"31204","107.274345","142.250.190.42","192.168.2.103","TCP","1394","[TCP Previous segment not captured] 443  >  2065 [ACK] Seq=8021705 Ack=7738 Win=263168 Len=1240 [TCP PDU reassembled in 31243]"
"31208","107.276372","142.250.190.42","192.168.2.103","TCP","1394","[TCP Previous segment not captured] 443  >  2065 [PSH, ACK] Seq=8026665 Ack=7738 Win=263168 Len=1240 [TCP PDU reassembled in 31243]"
"31225","107.280026","142.250.190.42","192.168.2.103","TCP","1394","[TCP Previous segment not captured] 443  >  2065 [ACK] Seq=8039065 Ack=7738 Win=263168 Len=1240 [TCP PDU reassembled in 31243]"
"31269","107.296369","142.250.190.42","192.168.2.103","TCP","1394","[TCP Previous segment not captured] 443  >  2065 [ACK] Seq=8092385 Ack=7738 Win=263168 Len=1240"
"31316","107.304100","142.250.190.42","192.168.2.103","TCP","1394","[TCP Previous segment not captured] 443  >  2065 [ACK] Seq=8124625 Ack=7738 Win=263168 Len=1240 [TCP PDU reassembled in 31361]"
"31319","107.306000","142.250.190.42","192.168.2.103","TCP","1394","[TCP Previous segment not captured] 443  >  2065 [ACK] Seq=8128345 Ack=7738 Win=263168 Len=1240 [TCP PDU reassembled in 31361]"
"31344","107.309761","142.250.190.42","192.168.2.103","TCP","1394","[TCP Previous segment not captured] 443  >  2065 [PSH, ACK] Seq=8141985 Ack=7738 Win=263168 Len=1240 [TCP PDU reassembled in 31361]"
"31780","107.404053","142.250.190.42","192.168.2.103","TCP","1394","[TCP Previous segment not captured] 443  >  2065 [PSH, ACK] Seq=8425945 Ack=7738 Win=263168 Len=1240"
"32181","107.483953","142.250.190.42","192.168.2.103","TCP","1394","[TCP Previous segment not captured] 443  >  2065 [PSH, ACK] Seq=8693785 Ack=7738 Win=263168 Len=1240"
"32266","107.500626","142.250.190.42","192.168.2.103","TCP","1394","[TCP Previous segment not captured] 443  >  2065 [ACK] Seq=8754545 Ack=7738 Win=263168 Len=1240"
"32878","107.640470","142.250.190.42","192.168.2.103","TCP","1394","[TCP Previous segment not captured] 443  >  2065 [ACK] Seq=9166225 Ack=7738 Win=263168 Len=1240"
"32884","107.640492","142.250.190.42","192.168.2.103","TCP","1394","[TCP Previous segment not captured] 443  >  2065 [ACK] Seq=9173665 Ack=7738 Win=263168 Len=1240"
"36745","117.276179","142.250.190.42","192.168.2.103","TCP","1394","[TCP Previous segment not captured] 443  >  2065 [PSH, ACK] Seq=9448620 Ack=8312 Win=262656 Len=1240"
"36804","117.286714","142.250.190.42","192.168.2.103","TCP","1394","[TCP Previous segment not captured] 443  >  2065 [ACK] Seq=9492020 Ack=8312 Win=262656 Len=1240 [TCP PDU reassembled in 36850]"
"36806","117.286722","142.250.190.42","192.168.2.103","TCP","1394","[TCP Previous segment not captured] 443  >  2065 [ACK] Seq=9494500 Ack=8312 Win=262656 Len=1240 [TCP PDU reassembled in 36850]"
"36867","117.301139","142.250.190.42","192.168.2.103","TCP","1394","[TCP Previous segment not captured] 443  >  2065 [ACK] Seq=9527980 Ack=8312 Win=262656 Len=1240 [TCP PDU reassembled in 36898]"
"36911","117.308239","142.250.190.42","192.168.2.103","TCP","1394","[TCP Previous segment not captured] 443  >  2065 [PSH, ACK] Seq=9560220 Ack=8312 Win=262656 Len=1240 [TCP PDU reassembled in 36961]"
"37173","117.362475","142.250.190.42","192.168.2.103","TCP","1394","[TCP Previous segment not captured] 443  >  2065 [PSH, ACK] Seq=9727620 Ack=8312 Win=262656 Len=1240 [TCP PDU reassembled in 37211]"
"37288","117.381951","142.250.190.42","192.168.2.103","TCP","1394","[TCP Previous segment not captured] 443  >  2065 [PSH, ACK] Seq=9805740 Ack=8312 Win=262656 Len=1240 [TCP PDU reassembled in 37394]"
"37367","117.400273","142.250.190.42","192.168.2.103","TCP","1394","[TCP Previous segment not captured] 443  >  2065 [ACK] Seq=9855340 Ack=8312 Win=262656 Len=1240 [TCP PDU reassembled in 37394]"
"37375","117.402393","142.250.190.42","192.168.2.103","TCP","1394","[TCP Previous segment not captured] 443  >  2065 [ACK] Seq=9859060 Ack=8312 Win=262656 Len=1240 [TCP PDU reassembled in 37394]"
"37417","117.410412","142.250.190.42","192.168.2.103","TCP","1394","[TCP Previous segment not captured] 443  >  2065 [ACK] Seq=9881380 Ack=8312 Win=262656 Len=1240 [TCP PDU reassembled in 37488]"
"37425","117.412422","142.250.190.42","192.168.2.103","TCP","1394","[TCP Previous segment not captured] 443  >  2065 [ACK] Seq=9886340 Ack=8312 Win=262656 Len=1240 [TCP PDU reassembled in 37488]"
"37428","117.412433","142.250.190.42","192.168.2.103","TCP","1394","[TCP Previous segment not captured] 443  >  2065 [ACK] Seq=9890060 Ack=8312 Win=262656 Len=1240 [TCP PDU reassembled in 37488]"
"38171","117.560732","142.250.190.42","192.168.2.103","TCP","1394","[TCP Previous segment not captured] 443  >  2065 [ACK] Seq=10403420 Ack=8312 Win=262656 Len=1240 [TCP PDU reassembled in 38193]"
"38271","117.580227","142.250.190.42","192.168.2.103","TCP","1394","[TCP Previous segment not captured] 443  >  2065 [ACK] Seq=10465420 Ack=8312 Win=262656 Len=1240"
"39740","127.438331","192.168.2.103","142.250.190.42","TCP","146","[TCP Previous segment not captured] 2065  >  443 [ACK] Seq=8886 Ack=10778371 Win=131328 Len=0"
"40395","127.566478","142.250.190.42","192.168.2.103","TCP","1394","[TCP Previous segment not captured] 443  >  2065 [ACK] Seq=11234579 Ack=8886 Win=262144 Len=1240 [TCP PDU reassembled in 40421]"
"40416","127.570012","142.250.190.42","192.168.2.103","TCP","1394","[TCP Previous segment not captured] 443  >  2065 [ACK] Seq=11245739 Ack=8886 Win=262144 Len=1240 [TCP PDU reassembled in 40421]"
"40745","127.646438","142.250.190.42","192.168.2.103","TCP","1394","[TCP Previous segment not captured] 443  >  2065 [PSH, ACK] Seq=11475139 Ack=8886 Win=262144 Len=1240 [TCP PDU reassembled in 40829]"
"40811","127.659000","142.250.190.42","192.168.2.103","TCP","1394","[TCP Previous segment not captured] 443  >  2065 [ACK] Seq=11525979 Ack=8886 Win=262144 Len=1240 [TCP PDU reassembled in 40829]"
"40978","127.687041","142.250.190.42","192.168.2.103","TCP","1394","[TCP Previous segment not captured] 443  >  2065 [ACK] Seq=11631379 Ack=8886 Win=262144 Len=1240 [TCP PDU reassembled in 41059]"
"41002","127.696664","142.250.190.42","192.168.2.103","TCP","1394","[TCP Previous segment not captured] 443  >  2065 [PSH, ACK] Seq=11641299 Ack=8886 Win=262144 Len=1240 [TCP PDU reassembled in 41059]"
"41009","127.698547","142.250.190.42","192.168.2.103","TCP","1394","[TCP Previous segment not captured] 443  >  2065 [ACK] Seq=11647499 Ack=8886 Win=262144 Len=1240 [TCP PDU reassembled in 41059]"
"41012","127.698557","142.250.190.42","192.168.2.103","TCP","1394","[TCP Previous segment not captured] 443  >  2065 [ACK] Seq=11651219 Ack=8886 Win=262144 Len=1240 [TCP PDU reassembled in 41059]"
"41393","127.778648","142.250.190.42","192.168.2.103","TCP","1394","[TCP Previous segment not captured] 443  >  2065 [ACK] Seq=11885579 Ack=8886 Win=262144 Len=1240 [TCP PDU reassembled in 41418]"
"41396","127.780285","142.250.190.42","192.168.2.103","TCP","1394","[TCP Previous segment not captured] 443  >  2065 [ACK] Seq=11891779 Ack=8886 Win=262144 Len=1240 [TCP PDU reassembled in 41418]"
"41522","127.806851","142.250.190.42","192.168.2.103","TCP","1394","[TCP Previous segment not captured] 443  >  2065 [ACK] Seq=11962459 Ack=8886 Win=262144 Len=1240 [TCP PDU reassembled in 41558]"
"41631","127.826170","142.250.190.42","192.168.2.103","TCP","1394","[TCP Previous segment not captured] 443  >  2065 [ACK] Seq=12040579 Ack=8886 Win=262144 Len=1240 [TCP PDU reassembled in 41689]"
"41741","127.852023","142.250.190.42","192.168.2.103","TCP","1394","[TCP Previous segment not captured] 443  >  2065 [PSH, ACK] Seq=12113739 Ack=8886 Win=262144 Len=1240 [TCP PDU reassembled in 41796]"
"41750","127.854456","142.250.190.42","192.168.2.103","TCP","1394","[TCP Previous segment not captured] 443  >  2065 [PSH, ACK] Seq=12117459 Ack=8886 Win=262144 Len=1240 [TCP PDU reassembled in 41796]"
"41759","127.856782","142.250.190.42","192.168.2.103","TCP","1394","[TCP Previous segment not captured] 443  >  2065 [ACK] Seq=12122419 Ack=8886 Win=262144 Len=1240 [TCP PDU reassembled in 41796]"
"41783","127.862288","142.250.190.42","192.168.2.103","TCP","1394","[TCP Previous segment not captured] 443  >  2065 [ACK] Seq=12138539 Ack=8886 Win=262144 Len=1240 [TCP PDU reassembled in 41796]"
"42021","127.908731","142.250.190.42","192.168.2.103","TCP","1394","[TCP Previous segment not captured] 443  >  2065 [ACK] Seq=12297259 Ack=8886 Win=262144 Len=1240 [TCP PDU reassembled in 42041]"
"42083","127.920457","142.250.190.42","192.168.2.103","TCP","1394","[TCP Previous segment not captured] 443  >  2065 [PSH, ACK] Seq=12325779 Ack=8886 Win=262144 Len=1240 [TCP PDU reassembled in 42131]"
"42112","127.925914","142.250.190.42","192.168.2.103","TCP","1394","[TCP Previous segment not captured] 443  >  2065 [PSH, ACK] Seq=12340659 Ack=8886 Win=262144 Len=1240 [TCP PDU reassembled in 42131]"
"42916","137.776874","142.250.190.42","192.168.2.103","TCP","1394","[TCP Previous segment not captured] 443  >  2057 [PSH, ACK] Seq=3172982 Ack=71732 Win=206592 Len=1240"
"42925","137.776914","142.250.190.42","192.168.2.103","TCP","1394","[TCP Previous segment not captured] 443  >  2057 [PSH, ACK] Seq=3184142 Ack=71732 Win=206592 Len=1240"
"43005","137.792450","142.250.190.42","192.168.2.103","TCP","1394","[TCP Previous segment not captured] 443  >  2057 [ACK] Seq=3244902 Ack=71732 Win=206592 Len=1240 [TCP PDU reassembled in 43026]"
"43124","137.815946","142.250.190.42","192.168.2.103","TCP","1394","[TCP Previous segment not captured] 443  >  2057 [ACK] Seq=3331702 Ack=71732 Win=206592 Len=1240"
"43208","137.834133","142.250.190.42","192.168.2.103","TCP","1394","[TCP Previous segment not captured] 443  >  2057 [ACK] Seq=3372622 Ack=71732 Win=206592 Len=1240"
"43224","137.839328","142.250.190.42","192.168.2.103","TCP","1394","[TCP Previous segment not captured] 443  >  2057 [ACK] Seq=3377582 Ack=71732 Win=206592 Len=1240"
"43240","137.844744","142.250.190.42","192.168.2.103","TCP","1394","[TCP Previous segment not captured] 443  >  2057 [PSH, ACK] Seq=3389982 Ack=71732 Win=206592 Len=1240"
"43517","137.900205","142.250.190.42","192.168.2.103","TCP","1394","[TCP Previous segment not captured] 443  >  2057 [ACK] Seq=3587142 Ack=71732 Win=206592 Len=1240 [TCP PDU reassembled in 43562]"
"43524","137.902440","142.250.190.42","192.168.2.103","TCP","1394","[TCP Previous segment not captured] 443  >  2057 [ACK] Seq=3589622 Ack=71732 Win=206592 Len=1240 [TCP PDU reassembled in 43562]"
"43599","137.916373","142.250.190.42","192.168.2.103","TCP","1394","[TCP Previous segment not captured] 443  >  2057 [ACK] Seq=3637982 Ack=71732 Win=206592 Len=1240 [TCP PDU reassembled in 43612]"
"44155","138.028922","142.250.190.42","192.168.2.103","TCP","1394","[TCP Previous segment not captured] 443  >  2057 [ACK] Seq=4016150 Ack=71732 Win=206592 Len=1240 [TCP PDU reassembled in 44168]"
"44230","138.046318","142.250.190.42","192.168.2.103","TCP","1394","[TCP Previous segment not captured] 443  >  2057 [ACK] Seq=4069470 Ack=71732 Win=206592 Len=1240 [TCP PDU reassembled in 44274]"
"44241","138.048461","142.250.190.42","192.168.2.103","TCP","1394","[TCP Previous segment not captured] 443  >  2057 [ACK] Seq=4073190 Ack=71732 Win=206592 Len=1240 [TCP PDU reassembled in 44274]"
"44329","138.067156","142.250.190.42","192.168.2.103","TCP","1394","[TCP Previous segment not captured] 443  >  2057 [ACK] Seq=4124030 Ack=71732 Win=206592 Len=1240 [TCP PDU reassembled in 44377]"
"44443","138.092821","142.250.190.42","192.168.2.103","TCP","1394","[TCP Previous segment not captured] 443  >  2057 [PSH, ACK] Seq=4197190 Ack=71732 Win=206592 Len=1240 [TCP PDU reassembled in 44457]"
"44631","138.130543","142.250.190.42","192.168.2.103","TCP","1394","[TCP Previous segment not captured] 443  >  2057 [PSH, ACK] Seq=4338550 Ack=71732 Win=206592 Len=1240 [TCP PDU reassembled in 44715]"
"45334","144.017071","192.168.2.103","142.250.190.42","TCP","146","[TCP Previous segment not captured] 2057  >  443 [ACK] Seq=75598 Ack=4615733 Win=133888 Len=0"
"45544","147.794652","142.250.190.42","192.168.2.103","TCP","146","[TCP Previous segment not captured] 443  >  2057 [ACK] Seq=4616358 Ack=78771 Win=200448 Len=0"
