"No.","Time","Source","Destination","Protocol","Length","Info"
"621","2.024082","192.168.2.103","157.240.26.49","TCP","363","[TCP Retransmission] 1101  >  443 [PSH, ACK] Seq=1 Ack=1 Win=261 Len=209"
"622","2.024297","192.168.2.103","157.240.26.49","TCP","953","[TCP Retransmission] 1101  >  443 [PSH, ACK] Seq=210 Ack=1 Win=261 Len=799"
"623","2.024304","192.168.2.103","157.240.26.49","TCP","185","[TCP Retransmission] 1101  >  443 [PSH, ACK] Seq=1009 Ack=1 Win=261 Len=31"
"1051","6.290241","192.168.2.103","157.240.26.49","TCP","201","[TCP Retransmission] 1873  >  443 [PSH, ACK] Seq=1 Ack=1 Win=256 Len=47"
"1052","6.290246","192.168.2.103","157.240.26.49","TCP","178","[TCP Retransmission] 1873  >  443 [PSH, ACK] Seq=48 Ack=1 Win=256 Len=24"
"1168","6.403897","192.168.2.103","157.240.26.49","TCP","218","[TCP Retransmission] 2030  >  443 [PSH, ACK] Seq=519 Ack=213 Win=65280 Len=64"
"1169","6.403903","192.168.2.103","157.240.26.49","TCP","240","[TCP Retransmission] 2030  >  443 [PSH, ACK] Seq=583 Ack=213 Win=65280 Len=86"
"1170","6.403907","192.168.2.103","157.240.26.49","TCP","506","[TCP Retransmission] 2030  >  443 [PSH, ACK] Seq=669 Ack=213 Win=65280 Len=352"
"1190","6.414801","192.168.2.103","157.240.26.49","TCP","185","[TCP Retransmission] 2030  >  443 [PSH, ACK] Seq=1021 Ack=500 Win=65024 Len=31"
"1257","6.516387","192.168.2.103","157.240.26.49","TCP","185","[TCP Retransmission] 2031  >  443 [PSH, ACK] Seq=1696 Ack=1045 Win=64512 Len=31"
"1264","6.517175","192.168.2.103","157.240.26.49","TCP","185","[TCP Retransmission] 2031  >  443 [PSH, ACK] Seq=1696 Ack=1045 Win=64512 Len=31"
"1276","6.538297","192.168.2.103","157.240.26.49","TCP","217","[TCP Retransmission] 1873  >  443 [FIN, PSH, ACK] Seq=1 Ack=1 Win=256 Len=71"
"1313","6.850379","192.168.2.103","157.240.26.49","TCP","217","[TCP Retransmission] 1873  >  443 [FIN, PSH, ACK] Seq=1 Ack=1 Win=256 Len=71"
"1346","7.459687","192.168.2.103","157.240.26.49","TCP","217","[TCP Retransmission] 1873  >  443 [FIN, PSH, ACK] Seq=1 Ack=1 Win=256 Len=71"
"1515","8.166285","23.192.220.16","192.168.2.103","TCP","1394","[TCP Retransmission] 443  >  2032 [ACK] Seq=26944 Ack=1158 Win=64128 Len=1240 [TCP PDU reassembled in 1508]"
"1517","8.166294","23.192.220.16","192.168.2.103","TCP","1394","[TCP Retransmission] 443  >  2032 [PSH, ACK] Seq=29424 Ack=1158 Win=64128 Len=1240 [TCP PDU reassembled in 1508]"
"1519","8.166302","23.192.220.16","192.168.2.103","TCP","1394","[TCP Retransmission] 443  >  2032 [ACK] Seq=31904 Ack=1158 Win=64128 Len=1240 [TCP PDU reassembled in 1508]"
"1520","8.166306","23.192.220.16","192.168.2.103","TCP","1394","[TCP Retransmission] 443  >  2032 [ACK] Seq=33144 Ack=1158 Win=64128 Len=1240"
"1569","8.175000","23.192.220.16","192.168.2.103","TCP","1394","[TCP Retransmission] 443  >  2032 [ACK] Seq=49264 Ack=1158 Win=64128 Len=1240 [TCP PDU reassembled in 1565]"
"1570","8.175003","23.192.220.16","192.168.2.103","TCP","1394","[TCP Retransmission] 443  >  2032 [ACK] Seq=50504 Ack=1158 Win=64128 Len=1240 [TCP PDU reassembled in 1565]"
"1571","8.175007","23.192.220.16","192.168.2.103","TCP","1394","[TCP Retransmission] 443  >  2032 [PSH, ACK] Seq=51744 Ack=1158 Win=64128 Len=1240"
"1572","8.175011","23.192.220.16","192.168.2.103","TCP","1394","[TCP Retransmission] 443  >  2032 [ACK] Seq=52984 Ack=1158 Win=64128 Len=1240 [TCP PDU reassembled in 1607]"
"1573","8.175014","23.192.220.16","192.168.2.103","TCP","1394","[TCP Retransmission] 443  >  2032 [PSH, ACK] Seq=54224 Ack=1158 Win=64128 Len=1240 [TCP PDU reassembled in 1607]"
"1606","8.180229","23.192.220.16","192.168.2.103","TCP","600","[TCP Retransmission] 443  >  2032 [PSH, ACK] Seq=70344 Ack=1158 Win=64128 Len=446 [TCP PDU reassembled in 1604]"
"1670","8.241683","192.168.2.103","157.240.26.49","TCP","1188","[TCP Retransmission] 2033  >  443 [PSH, ACK] Seq=14087 Ack=6882 Win=65536 Len=1042 [TCP PDU reassembled in 1666]"
"1717","8.301141","192.168.2.103","157.240.26.49","TCP","1386","[TCP Retransmission] 2033  >  443 [ACK] Seq=20131 Ack=9759 Win=65536 Len=1240 [TCP PDU reassembled in 1712]"
"1722","8.302399","192.168.2.103","157.240.26.49","TCP","1386","[TCP Retransmission] 2033  >  443 [ACK] Seq=20131 Ack=9759 Win=65536 Len=1240 [TCP PDU reassembled in 1712]"
"1873","8.665657","192.168.2.103","157.240.26.49","TCP","217","[TCP Retransmission] 1873  >  443 [FIN, PSH, ACK] Seq=1 Ack=1 Win=256 Len=71"
"2036","9.998326","157.240.26.49","192.168.2.103","TCP","189","[TCP Retransmission] 443  >  2038 [PSH, ACK] Seq=4656 Ack=2902 Win=71168 Len=35"
"2037","9.998336","157.240.26.49","192.168.2.103","TCP","189","[TCP Retransmission] 443  >  2038 [PSH, ACK] Seq=4691 Ack=2902 Win=71168 Len=35"
"2154","11.068175","192.168.2.103","157.240.26.49","TCP","217","[TCP Retransmission] 1873  >  443 [FIN, PSH, ACK] Seq=1 Ack=1 Win=256 Len=71"
"2263","11.357439","157.240.26.49","192.168.2.103","TCP","1394","[TCP Retransmission] 443  >  2038 [PSH, ACK] Seq=34693 Ack=3976 Win=77056 Len=1240 [TCP PDU reassembled in 2257]"
"2266","11.357451","157.240.26.49","192.168.2.103","TCP","1394","[TCP Retransmission] 443  >  2038 [PSH, ACK] Seq=38413 Ack=3976 Win=77056 Len=1240 [TCP PDU reassembled in 2257]"
"2424","11.397601","157.240.26.49","192.168.2.103","TCP","1394","[TCP Retransmission] 443  >  2038 [PSH, ACK] Seq=86773 Ack=3976 Win=77056 Len=1240 [TCP PDU reassembled in 2425]"
"2479","11.454883","157.240.26.49","192.168.2.103","TCP","1394","[TCP Retransmission] 443  >  2038 [ACK] Seq=105033 Ack=3976 Win=77056 Len=1240"
"2571","11.482992","157.240.26.49","192.168.2.103","TCP","1394","[TCP Retransmission] 443  >  2038 [ACK] Seq=153073 Ack=3976 Win=77056 Len=1240"
"2595","11.488523","157.240.26.49","192.168.2.103","TCP","1226","[TCP Retransmission] 443  >  2038 [PSH, ACK] Seq=165473 Ack=3976 Win=77056 Len=1072"
"2596","11.488529","157.240.26.49","192.168.2.103","TCP","1394","[TCP Retransmission] 443  >  2038 [ACK] Seq=166545 Ack=3976 Win=77056 Len=1240"
"2598","11.488537","157.240.26.49","192.168.2.103","TCP","1394","[TCP Retransmission] 443  >  2038 [ACK] Seq=168089 Ack=3976 Win=77056 Len=1240"
"2599","11.488540","157.240.26.49","192.168.2.103","TCP","1394","[TCP Retransmission] 443  >  2038 [ACK] Seq=169329 Ack=3976 Win=77056 Len=1240"
"2600","11.488542","157.240.26.49","192.168.2.103","TCP","1394","[TCP Retransmission] 443  >  2038 [PSH, ACK] Seq=170569 Ack=3976 Win=77056 Len=1240"
"2601","11.488545","157.240.26.49","192.168.2.103","TCP","1394","[TCP Retransmission] 443  >  2038 [ACK] Seq=171809 Ack=3976 Win=77056 Len=1240"
"2613","11.490719","157.240.26.49","192.168.2.103","TCP","1386","[TCP Retransmission] 443  >  2038 [ACK] Seq=174289 Ack=3976 Win=77056 Len=1240"
"2651","11.498452","157.240.26.49","192.168.2.103","TCP","1394","[TCP Retransmission] 443  >  2038 [ACK] Seq=185449 Ack=3976 Win=77056 Len=1240"
"3035","15.763940","192.168.2.103","34.36.199.114","TCP","828","[TCP Retransmission] 2041  >  443 [PSH, ACK] Seq=1 Ack=1 Win=66304 Len=674"
"3036","15.763943","192.168.2.103","34.36.199.114","TCP","828","[TCP Retransmission] 2042  >  443 [PSH, ACK] Seq=1 Ack=1 Win=66304 Len=674"
"3091","15.785352","34.36.199.114","192.168.2.103","TCP","373","[TCP Retransmission] 443  >  2049 [PSH, ACK] Seq=1 Ack=675 Win=269056 Len=219"
"3092","15.785355","34.36.199.114","192.168.2.103","TCP","373","[TCP Retransmission] 443  >  2042 [PSH, ACK] Seq=1 Ack=675 Win=269056 Len=219"
"3093","15.785358","34.36.199.114","192.168.2.103","TCP","373","[TCP Retransmission] 443  >  2045 [PSH, ACK] Seq=1 Ack=675 Win=269056 Len=219"
"3352","15.868173","192.168.2.103","157.240.26.49","TCP","217","[TCP Retransmission] 1873  >  443 [FIN, PSH, ACK] Seq=1 Ack=1 Win=256 Len=71"
"4620","17.489037","192.168.2.103","157.240.26.35","TCP","274","[TCP Retransmission] 2051  >  443 [PSH, ACK] Seq=468 Ack=3226 Win=66560 Len=128"
"4654","17.543948","157.240.26.35","192.168.2.103","TCP","1394","[TCP Retransmission] 443  >  2052 [ACK] Seq=6946 Ack=601 Win=67840 Len=1240 [TCP PDU reassembled in 4643]"
"4656","17.543954","157.240.26.35","192.168.2.103","TCP","1394","[TCP Retransmission] 443  >  2052 [ACK] Seq=9426 Ack=601 Win=67840 Len=1240 [TCP PDU reassembled in 4645]"
"4657","17.543957","157.240.26.35","192.168.2.103","TCP","1002","[TCP Retransmission] 443  >  2052 [PSH, ACK] Seq=10666 Ack=601 Win=67840 Len=848"
"4658","17.543959","157.240.26.35","192.168.2.103","TCP","1394","[TCP Retransmission] 443  >  2052 [ACK] Seq=11514 Ack=601 Win=67840 Len=1240"
"4729","17.560743","157.240.26.35","192.168.2.103","TCP","1394","[TCP Retransmission] 443  >  2053 [PSH, ACK] Seq=13147 Ack=601 Win=67840 Len=1240"
"4730","17.560746","157.240.26.35","192.168.2.103","TCP","1394","[TCP Retransmission] 443  >  2053 [ACK] Seq=14387 Ack=601 Win=67840 Len=1240"
"4731","17.560749","157.240.26.35","192.168.2.103","TCP","1394","[TCP Retransmission] 443  >  2052 [ACK] Seq=15234 Ack=601 Win=67840 Len=1240 [TCP PDU reassembled in 4696]"
"4742","17.562293","157.240.26.35","192.168.2.103","TCP","1394","[TCP Retransmission] 443  >  2052 [ACK] Seq=17714 Ack=601 Win=67840 Len=1240 [TCP PDU reassembled in 4734]"
"5510","22.284380","192.168.2.103","142.250.190.42","TCP","497","[TCP Retransmission] 2057  >  443 [PSH, ACK] Seq=1 Ack=1 Win=66304 Len=343"
"5533","22.311550","192.168.2.103","142.250.190.42","TCP","160","[TCP Retransmission] 2057  >  443 [PSH, ACK] Seq=386 Ack=4404 Win=66304 Len=6"
"5534","22.311556","192.168.2.103","142.250.190.42","TCP","191","[TCP Retransmission] 2057  >  443 [PSH, ACK] Seq=392 Ack=4404 Win=66304 Len=37"
"5547","22.312947","192.168.2.103","142.250.190.42","TCP","160","[TCP Retransmission] 2057  >  443 [PSH, ACK] Seq=386 Ack=4404 Win=66304 Len=6"
"5548","22.312953","192.168.2.103","142.250.190.42","TCP","191","[TCP Retransmission] 2057  >  443 [PSH, ACK] Seq=392 Ack=4404 Win=66304 Len=37"
"5563","22.325461","192.168.2.103","142.250.190.42","TCP","1386","[TCP Retransmission] 2057  >  443 [ACK] Seq=429 Ack=4691 Win=66048 Len=1240"
"5577","22.334438","192.168.2.103","142.250.190.42","TCP","839","[TCP Retransmission] 2057  >  443 [PSH, ACK] Seq=1669 Ack=4691 Win=66048 Len=693 [TCP PDU reassembled in 5555]"
"7077","34.705036","192.168.2.103","142.250.190.42","TCP","1386","[TCP Retransmission] 2057  >  443 [ACK] Seq=8161 Ack=7215 Win=66304 Len=1240"
"7621","38.923661","142.250.190.42","192.168.2.103","TCP","1394","[TCP Retransmission] 443  >  2065 [ACK] Seq=79091 Ack=1003 Win=269056 Len=1240"
"7622","38.923663","142.250.190.42","192.168.2.103","TCP","1394","[TCP Retransmission] 443  >  2065 [PSH, ACK] Seq=80331 Ack=1003 Win=269056 Len=1240"
"7657","38.929587","142.250.190.42","192.168.2.103","TCP","1394","[TCP Retransmission] 443  >  2065 [PSH, ACK] Seq=95211 Ack=1003 Win=269056 Len=1240 [TCP PDU reassembled in 7750]"
"7658","38.929591","142.250.190.42","192.168.2.103","TCP","1394","[TCP Retransmission] 443  >  2065 [ACK] Seq=96451 Ack=1003 Win=269056 Len=1240 [TCP PDU reassembled in 7750]"
"7659","38.929595","142.250.190.42","192.168.2.103","TCP","1394","[TCP Retransmission] 443  >  2065 [ACK] Seq=97691 Ack=1003 Win=269056 Len=1240 [TCP PDU reassembled in 7750]"
"7676","38.933682","142.250.190.42","192.168.2.103","TCP","1394","[TCP Retransmission] 443  >  2065 [PSH, ACK] Seq=102651 Ack=1003 Win=269056 Len=1240 [TCP PDU reassembled in 7750]"
"7902","38.981887","142.250.190.42","192.168.2.103","TCP","1394","[TCP Retransmission] 443  >  2065 [ACK] Seq=240291 Ack=1003 Win=269056 Len=1240 [TCP PDU reassembled in 7923]"
"7903","38.981891","142.250.190.42","192.168.2.103","TCP","1394","[TCP Retransmission] 443  >  2065 [ACK] Seq=241531 Ack=1003 Win=269056 Len=1240 [TCP PDU reassembled in 7923]"
"7988","38.997901","142.250.190.42","192.168.2.103","TCP","1394","[TCP Retransmission] 443  >  2065 [ACK] Seq=298571 Ack=1003 Win=269056 Len=1240"
"8194","39.046611","142.250.190.42","192.168.2.103","TCP","1394","[TCP Retransmission] 443  >  2065 [ACK] Seq=421331 Ack=1003 Win=269056 Len=1240"
"8195","39.046614","142.250.190.42","192.168.2.103","TCP","1394","[TCP Retransmission] 443  >  2065 [ACK] Seq=422571 Ack=1003 Win=269056 Len=1240"
"8265","39.062304","142.250.190.42","192.168.2.103","TCP","1386","[TCP Retransmission] 443  >  2065 [PSH, ACK] Seq=467211 Ack=1003 Win=269056 Len=1240"
"8578","39.129852","142.250.190.42","192.168.2.103","TCP","1394","[TCP Retransmission] 443  >  2065 [PSH, ACK] Seq=648251 Ack=1003 Win=269056 Len=1240"
"8579","39.129856","142.250.190.42","192.168.2.103","TCP","1394","[TCP Retransmission] 443  >  2065 [ACK] Seq=649491 Ack=1003 Win=269056 Len=1240"
"8580","39.129860","142.250.190.42","192.168.2.103","TCP","1394","[TCP Retransmission] 443  >  2065 [PSH, ACK] Seq=650731 Ack=1003 Win=269056 Len=1240"
"8582","39.129868","142.250.190.42","192.168.2.103","TCP","1394","[TCP Retransmission] 443  >  2065 [PSH, ACK] Seq=653211 Ack=1003 Win=269056 Len=1240"
"8638","39.144653","142.250.190.42","192.168.2.103","TCP","1394","[TCP Retransmission] 443  >  2065 [ACK] Seq=701571 Ack=1003 Win=269056 Len=1240"
"8709","39.171611","142.250.190.42","192.168.2.103","TCP","1394","[TCP Retransmission] 443  >  2065 [ACK] Seq=736291 Ack=1003 Win=269056 Len=1240"
"8710","39.171613","142.250.190.42","192.168.2.103","TCP","1394","[TCP Retransmission] 443  >  2065 [PSH, ACK] Seq=737531 Ack=1003 Win=269056 Len=1240"
"9146","39.273520","142.250.190.42","192.168.2.103","TCP","1394","[TCP Retransmission] 443  >  2065 [ACK] Seq=974371 Ack=1003 Win=269056 Len=1240"
"9147","39.273525","142.250.190.42","192.168.2.103","TCP","1394","[TCP Retransmission] 443  >  2065 [PSH, ACK] Seq=975611 Ack=1003 Win=269056 Len=1240"
"9148","39.273528","142.250.190.42","192.168.2.103","TCP","1394","[TCP Retransmission] 443  >  2065 [ACK] Seq=976851 Ack=1003 Win=269056 Len=1240"
"9255","39.293448","142.250.190.42","192.168.2.103","TCP","1394","[TCP Retransmission] 443  >  2065 [PSH, ACK] Seq=1022731 Ack=1003 Win=269056 Len=1240"
"9257","39.293456","142.250.190.42","192.168.2.103","TCP","1394","[TCP Retransmission] 443  >  2065 [PSH, ACK] Seq=1025211 Ack=1003 Win=269056 Len=1240"
"9387","39.318213","142.250.190.42","192.168.2.103","TCP","1394","[TCP Retransmission] 443  >  2065 [ACK] Seq=1098371 Ack=1003 Win=269056 Len=1240 [TCP PDU reassembled in 9456]"
"9429","39.331426","142.250.190.42","192.168.2.103","TCP","1394","[TCP Retransmission] 443  >  2065 [PSH, ACK] Seq=1119451 Ack=1003 Win=269056 Len=1240 [TCP PDU reassembled in 9456]"
"9619","39.377712","142.250.190.42","192.168.2.103","TCP","1394","[TCP Retransmission] 443  >  2065 [PSH, ACK] Seq=1206251 Ack=1003 Win=269056 Len=1240"
"9620","39.377716","142.250.190.42","192.168.2.103","TCP","1394","[TCP Retransmission] 443  >  2065 [ACK] Seq=1207491 Ack=1003 Win=269056 Len=1240"
"9621","39.377720","142.250.190.42","192.168.2.103","TCP","1394","[TCP Retransmission] 443  >  2065 [PSH, ACK] Seq=1208731 Ack=1003 Win=269056 Len=1240"
"9807","39.421828","142.250.190.42","192.168.2.103","TCP","1394","[TCP Retransmission] 443  >  2065 [PSH, ACK] Seq=1300491 Ack=1003 Win=269056 Len=1240"
"9883","39.441127","142.250.190.42","192.168.2.103","TCP","1394","[TCP Retransmission] 443  >  2065 [ACK] Seq=1341411 Ack=1003 Win=269056 Len=1240"
"9884","39.441130","142.250.190.42","192.168.2.103","TCP","1394","[TCP Retransmission] 443  >  2065 [PSH, ACK] Seq=1342651 Ack=1003 Win=269056 Len=1240"
"10033","39.478584","142.250.190.42","192.168.2.103","TCP","1394","[TCP Retransmission] 443  >  2065 [PSH, ACK] Seq=1414571 Ack=1003 Win=269056 Len=1240 [TCP PDU reassembled in 10129]"
"10876","47.210475","142.250.190.42","192.168.2.103","TCP","1394","[TCP Retransmission] 443  >  2057 [ACK] Seq=32044 Ack=16467 Win=254976 Len=1240 [TCP PDU reassembled in 10873]"
"10877","47.210483","142.250.190.42","192.168.2.103","TCP","1394","[TCP Retransmission] 443  >  2057 [PSH, ACK] Seq=33284 Ack=16467 Win=254976 Len=1240 [TCP PDU reassembled in 10874]"
"10909","47.218720","142.250.190.42","192.168.2.103","TCP","1394","[TCP Retransmission] 443  >  2057 [PSH, ACK] Seq=54364 Ack=16467 Win=254976 Len=1240"
"11166","47.273440","142.250.190.42","192.168.2.103","TCP","1394","[TCP Retransmission] 443  >  2057 [ACK] Seq=207468 Ack=16467 Win=254976 Len=1240"
"11167","47.273445","142.250.190.42","192.168.2.103","TCP","1394","[TCP Retransmission] 443  >  2057 [PSH, ACK] Seq=208708 Ack=16467 Win=254976 Len=1240"
"11168","47.273449","142.250.190.42","192.168.2.103","TCP","1394","[TCP Retransmission] 443  >  2057 [ACK] Seq=209948 Ack=16467 Win=254976 Len=1240"
"11169","47.273453","142.250.190.42","192.168.2.103","TCP","1394","[TCP Retransmission] 443  >  2057 [ACK] Seq=211188 Ack=16467 Win=254976 Len=1240"
"11170","47.273457","142.250.190.42","192.168.2.103","TCP","1394","[TCP Retransmission] 443  >  2057 [ACK] Seq=212428 Ack=16467 Win=254976 Len=1240"
"11171","47.273462","142.250.190.42","192.168.2.103","TCP","1394","[TCP Retransmission] 443  >  2057 [ACK] Seq=213668 Ack=16467 Win=254976 Len=1240"
"11253","47.291732","142.250.190.42","192.168.2.103","TCP","1386","[TCP Retransmission] 443  >  2057 [PSH, ACK] Seq=276908 Ack=16467 Win=254976 Len=1240"
"11255","47.293520","142.250.190.42","192.168.2.103","TCP","1394","[TCP Retransmission] 443  >  2057 [ACK] Seq=278148 Ack=16467 Win=254976 Len=1240"
"11256","47.293524","142.250.190.42","192.168.2.103","TCP","1394","[TCP Retransmission] 443  >  2057 [ACK] Seq=279388 Ack=16467 Win=254976 Len=1240"
"11257","47.293528","142.250.190.42","192.168.2.103","TCP","1394","[TCP Retransmission] 443  >  2057 [ACK] Seq=280628 Ack=16467 Win=254976 Len=1240"
"11258","47.293532","142.250.190.42","192.168.2.103","TCP","1394","[TCP Retransmission] 443  >  2057 [ACK] Seq=281868 Ack=16467 Win=254976 Len=1240"
"11364","47.321599","142.250.190.42","192.168.2.103","TCP","1394","[TCP Retransmission] 443  >  2057 [ACK] Seq=342628 Ack=16467 Win=254976 Len=1240"
"11365","47.321603","142.250.190.42","192.168.2.103","TCP","1394","[TCP Retransmission] 443  >  2057 [ACK] Seq=343868 Ack=16467 Win=254976 Len=1240"
"11366","47.321607","142.250.190.42","192.168.2.103","TCP","1394","[TCP Retransmission] 443  >  2057 [PSH, ACK] Seq=345108 Ack=16467 Win=254976 Len=1240"
"11368","47.321615","142.250.190.42","192.168.2.103","TCP","1394","[TCP Retransmission] 443  >  2057 [ACK] Seq=347588 Ack=16467 Win=254976 Len=1240"
"11369","47.321620","142.250.190.42","192.168.2.103","TCP","1394","[TCP Retransmission] 443  >  2057 [ACK] Seq=348828 Ack=16467 Win=254976 Len=1240"
"11587","47.363928","192.168.2.103","142.250.190.42","TCP","1394","[TCP Retransmission] 2065  >  443 [PSH, ACK] Seq=1696 Ack=1500540 Win=131328 Len=1240 [TCP PDU reassembled in 11440]"
"11635","47.377527","142.250.190.42","192.168.2.103","TCP","1394","[TCP Retransmission] 443  >  2057 [ACK] Seq=498868 Ack=16467 Win=254976 Len=1240"
"11687","47.390494","142.250.190.42","192.168.2.103","TCP","1394","[TCP Retransmission] 443  >  2057 [ACK] Seq=510028 Ack=16467 Win=254976 Len=1240"
"11688","47.390498","142.250.190.42","192.168.2.103","TCP","1394","[TCP Retransmission] 443  >  2057 [ACK] Seq=512508 Ack=16467 Win=254976 Len=1240"
"11690","47.390506","142.250.190.42","192.168.2.103","TCP","1394","[TCP Retransmission] 443  >  2057 [PSH, ACK] Seq=514988 Ack=16467 Win=254976 Len=1240"
"12359","47.528854","142.250.190.42","192.168.2.103","TCP","1394","[TCP Retransmission] 443  >  2057 [PSH, ACK] Seq=950228 Ack=16467 Win=254976 Len=1240"
"12360","47.528858","142.250.190.42","192.168.2.103","TCP","1394","[TCP Retransmission] 443  >  2057 [ACK] Seq=951468 Ack=16467 Win=254976 Len=1240"
"12562","47.572129","142.250.190.42","192.168.2.103","TCP","1394","[TCP Retransmission] 443  >  2057 [PSH, ACK] Seq=1056868 Ack=16467 Win=254976 Len=1240"
"12822","47.631115","142.250.190.42","192.168.2.103","TCP","1394","[TCP Retransmission] 443  >  2057 [PSH, ACK] Seq=1205668 Ack=16467 Win=254976 Len=1240 [TCP PDU reassembled in 12818]"
"12823","47.631117","142.250.190.42","192.168.2.103","TCP","1394","[TCP Retransmission] 443  >  2057 [ACK] Seq=1206908 Ack=16467 Win=254976 Len=1240 [TCP PDU reassembled in 12818]"
"12943","47.660676","142.250.190.42","192.168.2.103","TCP","1394","[TCP Retransmission] 443  >  2057 [PSH, ACK] Seq=1299908 Ack=16467 Win=254976 Len=1240"
"13306","47.730147","142.250.190.42","192.168.2.103","TCP","1394","[TCP Retransmission] 443  >  2057 [ACK] Seq=1536748 Ack=16467 Win=254976 Len=1240"
"13307","47.730152","142.250.190.42","192.168.2.103","TCP","1394","[TCP Retransmission] 443  >  2057 [PSH, ACK] Seq=1537988 Ack=16467 Win=254976 Len=1240"
"13308","47.730156","142.250.190.42","192.168.2.103","TCP","1394","[TCP Retransmission] 443  >  2057 [ACK] Seq=1539228 Ack=16467 Win=254976 Len=1240"
"13309","47.730160","142.250.190.42","192.168.2.103","TCP","1394","[TCP Retransmission] 443  >  2057 [PSH, ACK] Seq=1540468 Ack=16467 Win=254976 Len=1240"
"13310","47.730164","142.250.190.42","192.168.2.103","TCP","1394","[TCP Retransmission] 443  >  2057 [ACK] Seq=1541708 Ack=16467 Win=254976 Len=1240"
"13311","47.730168","142.250.190.42","192.168.2.103","TCP","1394","[TCP Retransmission] 443  >  2057 [PSH, ACK] Seq=1542948 Ack=16467 Win=254976 Len=1240"
"13891","52.642500","192.168.2.103","157.240.26.49","TCP","355","[TCP Retransmission] 1101  >  443 [PSH, ACK] Seq=1040 Ack=532 Win=258 Len=209"
"13894","52.642899","192.168.2.103","157.240.26.49","TCP","355","[TCP Retransmission] 1101  >  443 [PSH, ACK] Seq=1040 Ack=532 Win=258 Len=209"
"13977","52.915492","192.168.2.103","52.168.117.168","TCP","1386","[TCP Retransmission] 2068  >  443 [ACK] Seq=458 Ack=4356 Win=66048 Len=1240"
"13986","52.938069","192.168.2.103","52.168.117.168","TCP","354","[TCP Retransmission] 2068  >  443 [ACK] Seq=1698 Ack=4394 Win=66048 Len=200 [TCP PDU reassembled in 13964]"
"13988","52.938084","192.168.2.103","52.168.117.168","TCP","354","[TCP Retransmission] 2068  >  443 [ACK] Seq=3244 Ack=4394 Win=66048 Len=200 [TCP PDU reassembled in 13967]"
"13991","52.938497","192.168.2.103","52.168.117.168","TCP","1386","[TCP Retransmission] 2068  >  443 [ACK] Seq=458 Ack=4394 Win=66048 Len=1240"
"13995","52.941485","192.168.2.103","52.168.117.168","TCP","354","[TCP Retransmission] 2068  >  443 [ACK] Seq=1698 Ack=4394 Win=66048 Len=200 [TCP PDU reassembled in 13964]"
"13996","52.941722","192.168.2.103","52.168.117.168","TCP","1394","[TCP Retransmission] 2068  >  443 [ACK] Seq=2004 Ack=4394 Win=66048 Len=1240"
"13997","52.941732","192.168.2.103","52.168.117.168","TCP","354","[TCP Retransmission] 2068  >  443 [ACK] Seq=3244 Ack=4394 Win=66048 Len=200 [TCP PDU reassembled in 13967]"
"14001","52.942681","192.168.2.103","52.168.117.168","TCP","354","[TCP Retransmission] 2068  >  443 [ACK] Seq=1698 Ack=4394 Win=66048 Len=200 [TCP PDU reassembled in 13964]"
"14002","52.942691","192.168.2.103","52.168.117.168","TCP","1394","[TCP Retransmission] 2068  >  443 [ACK] Seq=2004 Ack=4394 Win=66048 Len=1240"
"14003","52.942700","192.168.2.103","52.168.117.168","TCP","354","[TCP Retransmission] 2068  >  443 [ACK] Seq=3244 Ack=4394 Win=66048 Len=200 [TCP PDU reassembled in 13967]"
"14009","52.943270","192.168.2.103","52.168.117.168","TCP","1386","[TCP Retransmission] 2068  >  443 [PSH, ACK] Seq=1698 Ack=4394 Win=66048 Len=1240"
"14017","52.961597","192.168.2.103","52.168.117.168","TCP","1386","[TCP Retransmission] 2068  >  443 [ACK] Seq=2938 Ack=4394 Win=66048 Len=1240 [TCP PDU reassembled in 13967]"
"14179","54.779973","192.168.2.103","157.240.26.49","TCP","1386","[TCP Retransmission] 1101  >  443 [ACK] Seq=2335 Ack=858 Win=257 Len=1240"
"14186","54.780922","192.168.2.103","157.240.26.49","TCP","1394","[TCP Retransmission] 1101  >  443 [ACK] Seq=2335 Ack=858 Win=257 Len=1240"
"14187","54.780934","192.168.2.103","157.240.26.49","TCP","306","[TCP Retransmission] 1101  >  443 [ACK] Seq=3575 Ack=858 Win=257 Len=152 [TCP PDU reassembled in 14170]"
"14474","57.350830","192.168.2.103","142.250.190.42","TCP","1394","[TCP Retransmission] 2065  >  443 [ACK] Seq=2936 Ack=1501173 Win=130560 Len=1240"
"14475","57.350843","192.168.2.103","142.250.190.42","TCP","846","[TCP Retransmission] 2065  >  443 [PSH, ACK] Seq=4176 Ack=1501173 Win=130560 Len=692 [TCP PDU reassembled in 14470]"
"14931","57.623965","142.250.190.42","192.168.2.103","TCP","1394","[TCP Retransmission] 443  >  2057 [ACK] Seq=1889556 Ack=22838 Win=249600 Len=1240 [TCP PDU reassembled in 15005]"
"14932","57.623969","142.250.190.42","192.168.2.103","TCP","1394","[TCP Retransmission] 443  >  2057 [PSH, ACK] Seq=1890796 Ack=22838 Win=249600 Len=1240 [TCP PDU reassembled in 15005]"
"14982","57.632643","142.250.190.42","192.168.2.103","TCP","1394","[TCP Retransmission] 443  >  2057 [PSH, ACK] Seq=1916836 Ack=22838 Win=249600 Len=1240 [TCP PDU reassembled in 15005]"
"15140","57.665027","142.250.190.42","192.168.2.103","TCP","1386","[TCP Retransmission] 443  >  2057 [ACK] Seq=2008596 Ack=22838 Win=249600 Len=1240"
"15749","57.797821","142.250.190.42","192.168.2.103","TCP","1394","[TCP Retransmission] 443  >  2057 [ACK] Seq=2343396 Ack=22838 Win=249600 Len=1240 [TCP PDU reassembled in 15754]"
"15817","57.809405","142.250.190.42","192.168.2.103","TCP","1394","[TCP Retransmission] 443  >  2057 [PSH, ACK] Seq=2394236 Ack=22838 Win=249600 Len=1240 [TCP PDU reassembled in 15860]"
"15905","57.832596","142.250.190.42","192.168.2.103","TCP","1394","[TCP Retransmission] 443  >  2057 [PSH, ACK] Seq=2441356 Ack=22838 Win=249600 Len=1240"
"15906","57.832601","142.250.190.42","192.168.2.103","TCP","1394","[TCP Retransmission] 443  >  2057 [ACK] Seq=2442596 Ack=22838 Win=249600 Len=1240"
"16663","58.003130","142.250.190.42","192.168.2.103","TCP","1394","[TCP Retransmission] 443  >  2057 [ACK] Seq=2931156 Ack=22838 Win=249600 Len=1240"
"17234","61.085231","192.168.2.103","13.105.74.49","TCP","765","[TCP Retransmission] 2076  >  443 [PSH, ACK] Seq=1792 Ack=9040 Win=66560 Len=619 [TCP PDU reassembled in 17230]"
"17237","61.085731","192.168.2.103","13.105.74.49","TCP","765","[TCP Retransmission] 2076  >  443 [PSH, ACK] Seq=1792 Ack=9040 Win=66560 Len=619 [TCP PDU reassembled in 17230]"
"17243","61.086406","192.168.2.103","13.105.74.49","TCP","1386","[TCP Retransmission] 2076  >  443 [ACK] Seq=372 Ack=9040 Win=66560 Len=1240"
"17251","61.107900","192.168.2.103","13.105.74.49","TCP","945","[TCP Retransmission] 2076  >  443 [PSH, ACK] Seq=1612 Ack=9040 Win=66560 Len=799 [TCP PDU reassembled in 17230]"
"17372","61.367250","192.168.2.103","57.150.97.97","TCP","1386","[TCP Retransmission] 2077  >  443 [ACK] Seq=1473 Ack=7810 Win=66048 Len=1240"
"17380","61.400026","192.168.2.103","57.150.97.97","TCP","1394","[TCP Retransmission] 2077  >  443 [ACK] Seq=2713 Ack=7810 Win=66048 Len=1240 [TCP PDU reassembled in 17410]"
"17381","61.400032","192.168.2.103","57.150.97.97","TCP","1394","[TCP Retransmission] 2077  >  443 [ACK] Seq=3953 Ack=7810 Win=66048 Len=1240 [TCP PDU reassembled in 17410]"
"17387","61.432421","192.168.2.103","57.150.97.97","TCP","1394","[TCP Retransmission] 2077  >  443 [ACK] Seq=5193 Ack=7810 Win=66048 Len=1240 [TCP PDU reassembled in 17410]"
"17388","61.432426","192.168.2.103","57.150.97.97","TCP","1394","[TCP Retransmission] 2077  >  443 [ACK] Seq=6433 Ack=7810 Win=66048 Len=1240 [TCP PDU reassembled in 17410]"
"17389","61.432429","192.168.2.103","57.150.97.97","TCP","1394","[TCP Retransmission] 2077  >  443 [ACK] Seq=7673 Ack=7810 Win=66048 Len=1240 [TCP PDU reassembled in 17410]"
"17390","61.432433","192.168.2.103","57.150.97.97","TCP","1394","[TCP Retransmission] 2077  >  443 [ACK] Seq=8913 Ack=7810 Win=66048 Len=1240 [TCP PDU reassembled in 17410]"
"17400","61.465442","192.168.2.103","57.150.97.97","TCP","1394","[TCP Retransmission] 2077  >  443 [ACK] Seq=10153 Ack=7810 Win=66048 Len=1240 [TCP PDU reassembled in 17410]"
"17401","61.465448","192.168.2.103","57.150.97.97","TCP","1394","[TCP Retransmission] 2077  >  443 [ACK] Seq=11393 Ack=7810 Win=66048 Len=1240 [TCP PDU reassembled in 17410]"
"17402","61.465452","192.168.2.103","57.150.97.97","TCP","1394","[TCP Retransmission] 2077  >  443 [ACK] Seq=12633 Ack=7810 Win=66048 Len=1240 [TCP PDU reassembled in 17410]"
"17403","61.465454","192.168.2.103","57.150.97.97","TCP","1394","[TCP Retransmission] 2077  >  443 [ACK] Seq=13873 Ack=7810 Win=66048 Len=1240 [TCP PDU reassembled in 17410]"
"17736","67.655695","142.250.190.42","192.168.2.103","TCP","1394","[TCP Retransmission] 443  >  2065 [ACK] Seq=1529086 Ack=5442 Win=265216 Len=1240 [TCP PDU reassembled in 17799]"
"18142","67.738912","142.250.190.42","192.168.2.103","TCP","1394","[TCP Retransmission] 443  >  2065 [ACK] Seq=1796926 Ack=5442 Win=265216 Len=1240"
"18143","67.738916","142.250.190.42","192.168.2.103","TCP","1394","[TCP Retransmission] 443  >  2065 [ACK] Seq=1798166 Ack=5442 Win=265216 Len=1240"
"18180","67.746590","142.250.190.42","192.168.2.103","TCP","1394","[TCP Retransmission] 443  >  2065 [PSH, ACK] Seq=1814286 Ack=5442 Win=265216 Len=1240"
"18196","67.750163","142.250.190.42","192.168.2.103","TCP","1394","[TCP Retransmission] 443  >  2065 [ACK] Seq=1842806 Ack=5442 Win=265216 Len=1240"
"18367","67.784565","142.250.190.42","192.168.2.103","TCP","1394","[TCP Retransmission] 443  >  2065 [ACK] Seq=1950574 Ack=5442 Win=265216 Len=1240 [TCP PDU reassembled in 18410]"
"18613","67.842700","142.250.190.42","192.168.2.103","TCP","1394","[TCP Retransmission] 443  >  2065 [ACK] Seq=2106814 Ack=5442 Win=265216 Len=1240"
"18614","67.842704","142.250.190.42","192.168.2.103","TCP","1394","[TCP Retransmission] 443  >  2065 [ACK] Seq=2108054 Ack=5442 Win=265216 Len=1240"
"18680","67.856740","142.250.190.42","192.168.2.103","TCP","1394","[TCP Retransmission] 443  >  2065 [ACK] Seq=2152694 Ack=5442 Win=265216 Len=1240"
"18681","67.856744","142.250.190.42","192.168.2.103","TCP","1394","[TCP Retransmission] 443  >  2065 [PSH, ACK] Seq=2153934 Ack=5442 Win=265216 Len=1240"
"18682","67.856748","142.250.190.42","192.168.2.103","TCP","1394","[TCP Retransmission] 443  >  2065 [ACK] Seq=2155174 Ack=5442 Win=265216 Len=1240"
"18683","67.856752","142.250.190.42","192.168.2.103","TCP","1394","[TCP Retransmission] 443  >  2065 [ACK] Seq=2156414 Ack=5442 Win=265216 Len=1240"
"18684","67.856757","142.250.190.42","192.168.2.103","TCP","1394","[TCP Retransmission] 443  >  2065 [PSH, ACK] Seq=2157654 Ack=5442 Win=265216 Len=1240"
"18685","67.856761","142.250.190.42","192.168.2.103","TCP","1394","[TCP Retransmission] 443  >  2065 [ACK] Seq=2158894 Ack=5442 Win=265216 Len=1240 [TCP PDU reassembled in 18754]"
"19491","68.025927","142.250.190.42","192.168.2.103","TCP","1394","[TCP Retransmission] 443  >  2065 [PSH, ACK] Seq=2637534 Ack=5442 Win=265216 Len=1240"
"19493","68.025935","142.250.190.42","192.168.2.103","TCP","1394","[TCP Retransmission] 443  >  2065 [ACK] Seq=2640014 Ack=5442 Win=265216 Len=1240"
"19816","68.086365","142.250.190.42","192.168.2.103","TCP","1394","[TCP Retransmission] 443  >  2065 [ACK] Seq=2858254 Ack=5442 Win=265216 Len=1240"
"19842","68.090602","142.250.190.42","192.168.2.103","TCP","1394","[TCP Retransmission] 443  >  2065 [PSH, ACK] Seq=2875614 Ack=5442 Win=265216 Len=1240 [TCP PDU reassembled in 19844]"
"20805","77.540272","142.250.190.42","192.168.2.103","TCP","1394","[TCP Retransmission] 443  >  2065 [PSH, ACK] Seq=3112241 Ack=6016 Win=264704 Len=1240"
"20806","77.540276","142.250.190.42","192.168.2.103","TCP","1394","[TCP Retransmission] 443  >  2065 [ACK] Seq=3113481 Ack=6016 Win=264704 Len=1240 [TCP PDU reassembled in 20796]"
"20831","77.543496","142.250.190.42","192.168.2.103","TCP","1394","[TCP Retransmission] 443  >  2065 [ACK] Seq=3129601 Ack=6016 Win=264704 Len=1240 [TCP PDU reassembled in 20824]"
"20832","77.543504","142.250.190.42","192.168.2.103","TCP","1394","[TCP Retransmission] 443  >  2065 [PSH, ACK] Seq=3130841 Ack=6016 Win=264704 Len=1240 [TCP PDU reassembled in 20825]"
"20876","77.549601","142.250.190.42","192.168.2.103","TCP","1394","[TCP Retransmission] 443  >  2065 [PSH, ACK] Seq=3156881 Ack=6016 Win=264704 Len=1240 [TCP PDU reassembled in 20870]"
"21057","77.585297","142.250.190.42","192.168.2.103","TCP","1394","[TCP Retransmission] 443  >  2065 [ACK] Seq=3305681 Ack=6016 Win=264704 Len=1240"
"21093","77.591037","142.250.190.42","192.168.2.103","TCP","1394","[TCP Retransmission] 443  >  2065 [PSH, ACK] Seq=3332961 Ack=6016 Win=264704 Len=1240"
"21213","77.614458","142.250.190.42","192.168.2.103","TCP","1394","[TCP Retransmission] 443  >  2065 [ACK] Seq=3409841 Ack=6016 Win=264704 Len=1240"
"21214","77.614462","142.250.190.42","192.168.2.103","TCP","1394","[TCP Retransmission] 443  >  2065 [ACK] Seq=3411081 Ack=6016 Win=264704 Len=1240"
"21215","77.614467","142.250.190.42","192.168.2.103","TCP","1394","[TCP Retransmission] 443  >  2065 [PSH, ACK] Seq=3412321 Ack=6016 Win=264704 Len=1240"
"21887","77.754153","142.250.190.42","192.168.2.103","TCP","1394","[TCP Retransmission] 443  >  2065 [ACK] Seq=3842601 Ack=6016 Win=264704 Len=1240"
"22038","77.786900","142.250.190.42","192.168.2.103","TCP","1394","[TCP Retransmission] 443  >  2065 [ACK] Seq=3938081 Ack=6016 Win=264704 Len=1240 [TCP PDU reassembled in 22075]"
"22039","77.786904","142.250.190.42","192.168.2.103","TCP","1394","[TCP Retransmission] 443  >  2065 [ACK] Seq=3939321 Ack=6016 Win=264704 Len=1240 [TCP PDU reassembled in 22075]"
"22040","77.786908","142.250.190.42","192.168.2.103","TCP","1394","[TCP Retransmission] 443  >  2065 [PSH, ACK] Seq=3940561 Ack=6016 Win=264704 Len=1240 [TCP PDU reassembled in 22075]"
"22042","77.786912","142.250.190.42","192.168.2.103","TCP","1394","[TCP Retransmission] 443  >  2065 [ACK] Seq=3943041 Ack=6016 Win=264704 Len=1240 [TCP PDU reassembled in 22075]"
"22437","77.868047","142.250.190.42","192.168.2.103","TCP","1394","[TCP Retransmission] 443  >  2065 [ACK] Seq=4202201 Ack=6016 Win=264704 Len=1240"
"22438","77.868052","142.250.190.42","192.168.2.103","TCP","1394","[TCP Retransmission] 443  >  2065 [ACK] Seq=4203441 Ack=6016 Win=264704 Len=1240"
"22488","77.877228","142.250.190.42","192.168.2.103","TCP","1394","[TCP Retransmission] 443  >  2065 [ACK] Seq=4228241 Ack=6016 Win=264704 Len=1240"
"22489","77.877232","142.250.190.42","192.168.2.103","TCP","1394","[TCP Retransmission] 443  >  2065 [ACK] Seq=4229481 Ack=6016 Win=264704 Len=1240 [TCP PDU reassembled in 22561]"
"22491","77.877241","142.250.190.42","192.168.2.103","TCP","1394","[TCP Retransmission] 443  >  2065 [ACK] Seq=4235681 Ack=6016 Win=264704 Len=1240 [TCP PDU reassembled in 22561]"
"22613","77.902255","142.250.190.42","192.168.2.103","TCP","1394","[TCP Retransmission] 443  >  2065 [ACK] Seq=4322481 Ack=6016 Win=264704 Len=1240"
"22773","77.933885","142.250.190.42","192.168.2.103","TCP","1394","[TCP Retransmission] 443  >  2065 [PSH, ACK] Seq=4427881 Ack=6016 Win=264704 Len=1240"
"22774","77.933890","142.250.190.42","192.168.2.103","TCP","1394","[TCP Retransmission] 443  >  2065 [ACK] Seq=4429121 Ack=6016 Win=264704 Len=1240"
"22832","77.944153","142.250.190.42","192.168.2.103","TCP","1394","[TCP Retransmission] 443  >  2065 [PSH, ACK] Seq=4457641 Ack=6016 Win=264704 Len=1240"
"22833","77.944157","142.250.190.42","192.168.2.103","TCP","1394","[TCP Retransmission] 443  >  2065 [ACK] Seq=4458881 Ack=6016 Win=264704 Len=1240"
"23066","78.117190","192.168.2.103","142.250.190.42","TCP","1394","[TCP Retransmission] 2057  >  443 [ACK] Seq=32503 Ack=3105798 Win=133120 Len=1240"
"23067","78.117198","192.168.2.103","142.250.190.42","TCP","847","[TCP Retransmission] 2057  >  443 [PSH, ACK] Seq=33743 Ack=3105798 Win=133120 Len=693 [TCP PDU reassembled in 23063]"
"23958","81.967759","192.168.2.103","34.107.172.168","TCP","146","[TCP Retransmission] 1627  >  443 [FIN, ACK] Seq=1 Ack=1 Win=252 Len=0"
"23993","82.570350","192.168.2.103","34.107.172.168","TCP","146","[TCP Retransmission] 1627  >  443 [FIN, ACK] Seq=1 Ack=1 Win=252 Len=0"
"24030","83.777689","192.168.2.103","34.107.172.168","TCP","146","[TCP Retransmission] 1627  >  443 [FIN, ACK] Seq=1 Ack=1 Win=252 Len=0"
"24276","86.190213","192.168.2.103","34.107.172.168","TCP","146","[TCP Retransmission] 1627  >  443 [FIN, ACK] Seq=1 Ack=1 Win=252 Len=0"
"24373","87.325331","142.250.190.42","192.168.2.103","TCP","1394","[TCP Retransmission] 443  >  2065 [ACK] Seq=4615467 Ack=6590 Win=264192 Len=1240 [TCP PDU reassembled in 24368]"
"24374","87.325340","142.250.190.42","192.168.2.103","TCP","1394","[TCP Retransmission] 443  >  2065 [ACK] Seq=4616707 Ack=6590 Win=264192 Len=1240 [TCP PDU reassembled in 24369]"
"24681","87.386183","142.250.190.42","192.168.2.103","TCP","1394","[TCP Retransmission] 443  >  2065 [ACK] Seq=4883370 Ack=6590 Win=264192 Len=1240"
"24682","87.386187","142.250.190.42","192.168.2.103","TCP","1394","[TCP Retransmission] 443  >  2065 [ACK] Seq=4884610 Ack=6590 Win=264192 Len=1240"
"24727","87.401860","142.250.190.42","192.168.2.103","TCP","1394","[TCP Retransmission] 443  >  2065 [ACK] Seq=4903210 Ack=6590 Win=264192 Len=1240 [TCP PDU reassembled in 24782]"
"24885","87.437422","142.250.190.42","192.168.2.103","TCP","1394","[TCP Retransmission] 443  >  2065 [PSH, ACK] Seq=5020898 Ack=6590 Win=264192 Len=1240"
"24886","87.437426","142.250.190.42","192.168.2.103","TCP","1394","[TCP Retransmission] 443  >  2065 [ACK] Seq=5022138 Ack=6590 Win=264192 Len=1240"
"24887","87.437430","142.250.190.42","192.168.2.103","TCP","1394","[TCP Retransmission] 443  >  2065 [ACK] Seq=5023378 Ack=6590 Win=264192 Len=1240"
"24888","87.437434","142.250.190.42","192.168.2.103","TCP","1394","[TCP Retransmission] 443  >  2065 [ACK] Seq=5024618 Ack=6590 Win=264192 Len=1240"
"24889","87.437438","142.250.190.42","192.168.2.103","TCP","1394","[TCP Retransmission] 443  >  2065 [ACK] Seq=5025858 Ack=6590 Win=264192 Len=1240"
"24890","87.437442","142.250.190.42","192.168.2.103","TCP","1394","[TCP Retransmission] 443  >  2065 [PSH, ACK] Seq=5027098 Ack=6590 Win=264192 Len=1240"
"25109","87.487757","142.250.190.42","192.168.2.103","TCP","1394","[TCP Retransmission] 443  >  2065 [PSH, ACK] Seq=5175898 Ack=6590 Win=264192 Len=1240"
"25110","87.487762","142.250.190.42","192.168.2.103","TCP","1394","[TCP Retransmission] 443  >  2065 [ACK] Seq=5177138 Ack=6590 Win=264192 Len=1240"
"25164","87.500161","142.250.190.42","192.168.2.103","TCP","1394","[TCP Retransmission] 443  >  2065 [ACK] Seq=5193258 Ack=6590 Win=264192 Len=1240"
"25165","87.500165","142.250.190.42","192.168.2.103","TCP","1394","[TCP Retransmission] 443  >  2065 [PSH, ACK] Seq=5194498 Ack=6590 Win=264192 Len=1240"
"25395","87.544670","142.250.190.42","192.168.2.103","TCP","1394","[TCP Retransmission] 443  >  2065 [PSH, ACK] Seq=5334618 Ack=6590 Win=264192 Len=1240 [TCP PDU reassembled in 25398]"
"25396","87.544674","142.250.190.42","192.168.2.103","TCP","1394","[TCP Retransmission] 443  >  2065 [ACK] Seq=5335858 Ack=6590 Win=264192 Len=1240 [TCP PDU reassembled in 25398]"
"25397","87.544678","142.250.190.42","192.168.2.103","TCP","1394","[TCP Retransmission] 443  >  2065 [ACK] Seq=5337098 Ack=6590 Win=264192 Len=1240 [TCP PDU reassembled in 25398]"
"25485","87.562704","157.240.26.35","192.168.2.103","TCP","154","[TCP Retransmission] 443  >  2051 [FIN, ACK] Seq=8053 Ack=596 Win=67840 Len=0"
"25507","87.566822","157.240.26.35","192.168.2.103","TCP","154","[TCP Retransmission] 443  >  2053 [FIN, ACK] Seq=27179 Ack=601 Win=67840 Len=0"
"25511","87.566839","157.240.26.35","192.168.2.103","TCP","154","[TCP Retransmission] 443  >  2050 [FIN, ACK] Seq=8054 Ack=596 Win=265 Len=0"
"25516","87.568432","157.240.26.35","192.168.2.103","TCP","154","[TCP Retransmission] 443  >  2052 [FIN, ACK] Seq=27250 Ack=601 Win=67840 Len=0"
"25598","87.584384","142.250.190.42","192.168.2.103","TCP","1394","[TCP Retransmission] 443  >  2065 [ACK] Seq=5451066 Ack=6590 Win=264192 Len=1240 [TCP PDU reassembled in 25642]"
"25599","87.584388","142.250.190.42","192.168.2.103","TCP","1394","[TCP Retransmission] 443  >  2065 [ACK] Seq=5452306 Ack=6590 Win=264192 Len=1240 [TCP PDU reassembled in 25642]"
"25600","87.584392","142.250.190.42","192.168.2.103","TCP","1394","[TCP Retransmission] 443  >  2065 [PSH, ACK] Seq=5453546 Ack=6590 Win=264192 Len=1240 [TCP PDU reassembled in 25642]"
"25601","87.584396","142.250.190.42","192.168.2.103","TCP","1394","[TCP Retransmission] 443  >  2065 [ACK] Seq=5454786 Ack=6590 Win=264192 Len=1240 [TCP PDU reassembled in 25642]"
"25602","87.584400","142.250.190.42","192.168.2.103","TCP","1394","[TCP Retransmission] 443  >  2065 [ACK] Seq=5456026 Ack=6590 Win=264192 Len=1240 [TCP PDU reassembled in 25642]"
"25920","87.646622","142.250.190.42","192.168.2.103","TCP","1394","[TCP Retransmission] 443  >  2065 [PSH, ACK] Seq=5661866 Ack=6590 Win=264192 Len=1240 [TCP PDU reassembled in 25911]"
"25921","87.646626","142.250.190.42","192.168.2.103","TCP","1394","[TCP Retransmission] 443  >  2065 [ACK] Seq=5663106 Ack=6590 Win=264192 Len=1240 [TCP PDU reassembled in 25911]"
"26191","87.703935","142.250.190.42","192.168.2.103","TCP","1394","[TCP Retransmission] 443  >  2065 [ACK] Seq=5823066 Ack=6590 Win=264192 Len=1240"
"26192","87.703939","142.250.190.42","192.168.2.103","TCP","1394","[TCP Retransmission] 443  >  2065 [ACK] Seq=5824306 Ack=6590 Win=264192 Len=1240"
"26725","87.818237","142.250.190.42","192.168.2.103","TCP","1394","[TCP Retransmission] 443  >  2065 [ACK] Seq=6165306 Ack=6590 Win=264192 Len=1240"
"27013","91.004596","192.168.2.103","34.107.172.168","TCP","146","[TCP Retransmission] 1627  >  443 [FIN, ACK] Seq=1 Ack=1 Win=252 Len=0"
"27543","97.722046","142.250.190.42","192.168.2.103","TCP","1394","[TCP Retransmission] 443  >  2065 [ACK] Seq=6228312 Ack=7164 Win=263680 Len=1240 [TCP PDU reassembled in 27537]"
"27832","97.781210","142.250.190.42","192.168.2.103","TCP","1394","[TCP Retransmission] 443  >  2065 [PSH, ACK] Seq=6411832 Ack=7164 Win=263680 Len=1240 [TCP PDU reassembled in 27836]"
"27834","97.781219","142.250.190.42","192.168.2.103","TCP","1394","[TCP Retransmission] 443  >  2065 [ACK] Seq=6414312 Ack=7164 Win=263680 Len=1240 [TCP PDU reassembled in 27836]"
"27835","97.781223","142.250.190.42","192.168.2.103","TCP","1394","[TCP Retransmission] 443  >  2065 [ACK] Seq=6418032 Ack=7164 Win=263680 Len=1240 [TCP PDU reassembled in 27836]"
"27914","97.802021","142.250.190.42","192.168.2.103","TCP","1394","[TCP Retransmission] 443  >  2065 [ACK] Seq=6478792 Ack=7164 Win=263680 Len=1240"
"28624","97.949249","142.250.190.42","192.168.2.103","TCP","1394","[TCP Retransmission] 443  >  2065 [ACK] Seq=6899040 Ack=7164 Win=263680 Len=1240"
"28625","97.949252","142.250.190.42","192.168.2.103","TCP","1394","[TCP Retransmission] 443  >  2065 [PSH, ACK] Seq=6900280 Ack=7164 Win=263680 Len=1240"
"28626","97.949254","142.250.190.42","192.168.2.103","TCP","1394","[TCP Retransmission] 443  >  2065 [ACK] Seq=6901520 Ack=7164 Win=263680 Len=1240"
"28660","97.958345","142.250.190.42","192.168.2.103","TCP","1394","[TCP Retransmission] 443  >  2065 [ACK] Seq=6918880 Ack=7164 Win=263680 Len=1240"
"28772","97.980915","142.250.190.42","192.168.2.103","TCP","1394","[TCP Retransmission] 443  >  2065 [ACK] Seq=6983360 Ack=7164 Win=263680 Len=1240 [TCP PDU reassembled in 28791]"
"29737","98.164630","142.250.190.42","192.168.2.103","TCP","1394","[TCP Retransmission] 443  >  2065 [ACK] Seq=7664120 Ack=7164 Win=263680 Len=1240"
"29738","98.164633","142.250.190.42","192.168.2.103","TCP","1394","[TCP Retransmission] 443  >  2065 [PSH, ACK] Seq=7665360 Ack=7164 Win=263680 Len=1240"
"29739","98.164637","142.250.190.42","192.168.2.103","TCP","1394","[TCP Retransmission] 443  >  2065 [ACK] Seq=7666600 Ack=7164 Win=263680 Len=1240"
"29740","98.164641","142.250.190.42","192.168.2.103","TCP","1394","[TCP Retransmission] 443  >  2065 [PSH, ACK] Seq=7667840 Ack=7164 Win=263680 Len=1240"
"29784","98.376803","192.168.2.103","142.250.190.42","TCP","839","[TCP Retransmission] 2057  >  443 [PSH, ACK] Seq=47272 Ack=3110214 Win=133888 Len=693 [TCP PDU reassembled in 29780]"
"30512","106.870574","192.168.2.103","142.250.190.42","TCP","720","[TCP Retransmission] 2065  >  443 [PSH, ACK] Seq=7164 Ack=7684425 Win=130816 Len=574"
"30849","107.198104","142.250.190.42","192.168.2.103","TCP","1394","[TCP Retransmission] 443  >  2065 [ACK] Seq=7802225 Ack=7738 Win=263168 Len=1240"
"30850","107.198114","142.250.190.42","192.168.2.103","TCP","1394","[TCP Retransmission] 443  >  2065 [PSH, ACK] Seq=7803465 Ack=7738 Win=263168 Len=1240"
"30969","107.228429","142.250.190.42","192.168.2.103","TCP","1394","[TCP Retransmission] 443  >  2065 [PSH, ACK] Seq=7877865 Ack=7738 Win=263168 Len=1240"
"30970","107.228432","142.250.190.42","192.168.2.103","TCP","1394","[TCP Retransmission] 443  >  2065 [PSH, ACK] Seq=7881585 Ack=7738 Win=263168 Len=1240"
"30971","107.228436","142.250.190.42","192.168.2.103","TCP","1394","[TCP Retransmission] 443  >  2065 [ACK] Seq=7882825 Ack=7738 Win=263168 Len=1240"
"31114","107.257872","142.250.190.42","192.168.2.103","TCP","1394","[TCP Retransmission] 443  >  2065 [ACK] Seq=7957225 Ack=7738 Win=263168 Len=1240"
"31115","107.257876","142.250.190.42","192.168.2.103","TCP","1394","[TCP Retransmission] 443  >  2065 [ACK] Seq=7958465 Ack=7738 Win=263168 Len=1240"
"31116","107.257880","142.250.190.42","192.168.2.103","TCP","1394","[TCP Retransmission] 443  >  2065 [PSH, ACK] Seq=7959705 Ack=7738 Win=263168 Len=1240"
"31117","107.257884","142.250.190.42","192.168.2.103","TCP","1394","[TCP Retransmission] 443  >  2065 [ACK] Seq=7960945 Ack=7738 Win=263168 Len=1240 [TCP PDU reassembled in 31165]"
"31118","107.257888","142.250.190.42","192.168.2.103","TCP","1394","[TCP Retransmission] 443  >  2065 [ACK] Seq=7962185 Ack=7738 Win=263168 Len=1240 [TCP PDU reassembled in 31165]"
"31292","107.300569","142.250.190.42","192.168.2.103","TCP","1394","[TCP Retransmission] 443  >  2065 [ACK] Seq=8103545 Ack=7738 Win=263168 Len=1240"
"31293","107.300573","142.250.190.42","192.168.2.103","TCP","1394","[TCP Retransmission] 443  >  2065 [PSH, ACK] Seq=8104785 Ack=7738 Win=263168 Len=1240"
"31529","107.350410","142.250.190.42","192.168.2.103","TCP","1394","[TCP Retransmission] 443  >  2065 [ACK] Seq=8258545 Ack=7738 Win=263168 Len=1240"
"31754","107.396715","142.250.190.42","192.168.2.103","TCP","1394","[TCP Retransmission] 443  >  2065 [PSH, ACK] Seq=8398665 Ack=7738 Win=263168 Len=1240"
"31830","107.412344","142.250.190.42","192.168.2.103","TCP","1394","[TCP Retransmission] 443  >  2065 [PSH, ACK] Seq=8458185 Ack=7738 Win=263168 Len=1240"
"31960","107.440954","142.250.190.42","192.168.2.103","TCP","1394","[TCP Retransmission] 443  >  2065 [ACK] Seq=8538785 Ack=7738 Win=263168 Len=1240 [TCP PDU reassembled in 31952]"
"31962","107.440962","142.250.190.42","192.168.2.103","TCP","1394","[TCP Retransmission] 443  >  2065 [ACK] Seq=8541265 Ack=7738 Win=263168 Len=1240"
"32444","107.553765","142.250.190.42","192.168.2.103","TCP","1394","[TCP Retransmission] 443  >  2065 [ACK] Seq=8868625 Ack=7738 Win=263168 Len=1240 [TCP PDU reassembled in 32464]"
"32445","107.553769","142.250.190.42","192.168.2.103","TCP","1394","[TCP Retransmission] 443  >  2065 [PSH, ACK] Seq=8872345 Ack=7738 Win=263168 Len=1240 [TCP PDU reassembled in 32464]"
"32446","107.553775","142.250.190.42","192.168.2.103","TCP","1394","[TCP Retransmission] 443  >  2065 [ACK] Seq=8873585 Ack=7738 Win=263168 Len=1240 [TCP PDU reassembled in 32464]"
"32447","107.553778","142.250.190.42","192.168.2.103","TCP","1394","[TCP Retransmission] 443  >  2065 [PSH, ACK] Seq=8874825 Ack=7738 Win=263168 Len=1240 [TCP PDU reassembled in 32464]"
"36440","116.755583","192.168.2.103","142.250.190.42","TCP","720","[TCP Retransmission] 2065  >  443 [PSH, ACK] Seq=7738 Ack=9279980 Win=131328 Len=574"
"36568","117.241280","142.250.190.42","192.168.2.103","TCP","1394","[TCP Retransmission] 443  >  2065 [PSH, ACK] Seq=9340740 Ack=8312 Win=262656 Len=1240"
"36583","117.243552","142.250.190.42","192.168.2.103","TCP","1394","[TCP Retransmission] 443  >  2065 [PSH, ACK] Seq=9348180 Ack=8312 Win=262656 Len=1240"
"36584","117.243556","142.250.190.42","192.168.2.103","TCP","1394","[TCP Retransmission] 443  >  2065 [ACK] Seq=9349420 Ack=8312 Win=262656 Len=1240"
"36585","117.243561","142.250.190.42","192.168.2.103","TCP","1394","[TCP Retransmission] 443  >  2065 [PSH, ACK] Seq=9350660 Ack=8312 Win=262656 Len=1240"
"36792","117.284276","142.250.190.42","192.168.2.103","TCP","1394","[TCP Retransmission] 443  >  2065 [ACK] Seq=9479620 Ack=8312 Win=262656 Len=1240 [TCP PDU reassembled in 36850]"
"36794","117.284283","142.250.190.42","192.168.2.103","TCP","1394","[TCP Retransmission] 443  >  2065 [PSH, ACK] Seq=9482100 Ack=8312 Win=262656 Len=1240 [TCP PDU reassembled in 36850]"
"36795","117.284286","142.250.190.42","192.168.2.103","TCP","1394","[TCP Retransmission] 443  >  2065 [ACK] Seq=9483340 Ack=8312 Win=262656 Len=1240 [TCP PDU reassembled in 36850]"
"36796","117.284289","142.250.190.42","192.168.2.103","TCP","1394","[TCP Retransmission] 443  >  2065 [ACK] Seq=9484580 Ack=8312 Win=262656 Len=1240 [TCP PDU reassembled in 36850]"
"36831","117.293646","142.250.190.42","192.168.2.103","TCP","1394","[TCP Retransmission] 443  >  2065 [ACK] Seq=9505660 Ack=8312 Win=262656 Len=1240 [TCP PDU reassembled in 36850]"
"36833","117.293653","142.250.190.42","192.168.2.103","TCP","1394","[TCP Retransmission] 443  >  2065 [PSH, ACK] Seq=9508140 Ack=8312 Win=262656 Len=1240 [TCP PDU reassembled in 36850]"
"36918","117.310406","142.250.190.42","192.168.2.103","TCP","1394","[TCP Retransmission] 443  >  2065 [ACK] Seq=9557740 Ack=8312 Win=262656 Len=1240 [TCP PDU reassembled in 36961]"
"37183","117.364379","142.250.190.42","192.168.2.103","TCP","1394","[TCP Retransmission] 443  >  2065 [PSH, ACK] Seq=9727620 Ack=8312 Win=262656 Len=1240"
"37766","117.476413","142.250.190.42","192.168.2.103","TCP","1394","[TCP Retransmission] 443  >  2065 [ACK] Seq=10120700 Ack=8312 Win=262656 Len=1240"
"38243","117.573889","142.250.190.42","192.168.2.103","TCP","1394","[TCP Retransmission] 443  >  2065 [ACK] Seq=10444340 Ack=8312 Win=262656 Len=1240"
"38653","117.652102","142.250.190.42","192.168.2.103","TCP","1394","[TCP Retransmission] 443  >  2065 [ACK] Seq=10738220 Ack=8312 Win=262656 Len=1240"
"40041","127.498654","142.250.190.42","192.168.2.103","TCP","1394","[TCP Retransmission] 443  >  2065 [ACK] Seq=10997851 Ack=8886 Win=262144 Len=1240"
"40090","127.506885","142.250.190.42","192.168.2.103","TCP","1394","[TCP Retransmission] 443  >  2065 [PSH, ACK] Seq=11028851 Ack=8886 Win=262144 Len=1240"
"40091","127.506890","142.250.190.42","192.168.2.103","TCP","1394","[TCP Retransmission] 443  >  2065 [PSH, ACK] Seq=11033811 Ack=8886 Win=262144 Len=1240 [TCP PDU reassembled in 40104]"
"40093","127.506899","142.250.190.42","192.168.2.103","TCP","1394","[TCP Retransmission] 443  >  2065 [ACK] Seq=11036291 Ack=8886 Win=262144 Len=1240 [TCP PDU reassembled in 40104]"
"40120","127.510806","142.250.190.42","192.168.2.103","TCP","1394","[TCP Retransmission] 443  >  2065 [ACK] Seq=11051171 Ack=8886 Win=262144 Len=1240"
"40718","127.639385","142.250.190.42","192.168.2.103","TCP","1394","[TCP Retransmission] 443  >  2065 [ACK] Seq=11440419 Ack=8886 Win=262144 Len=1240"
"40799","127.657299","142.250.190.42","192.168.2.103","TCP","1394","[TCP Retransmission] 443  >  2065 [ACK] Seq=11506139 Ack=8886 Win=262144 Len=1240 [TCP PDU reassembled in 40829]"
"41332","127.765768","142.250.190.42","192.168.2.103","TCP","1394","[TCP Retransmission] 443  >  2065 [ACK] Seq=11843419 Ack=8886 Win=262144 Len=1240"
"41333","127.765772","142.250.190.42","192.168.2.103","TCP","1394","[TCP Retransmission] 443  >  2065 [ACK] Seq=11844659 Ack=8886 Win=262144 Len=1240"
"41454","127.791267","142.250.190.42","192.168.2.103","TCP","1394","[TCP Retransmission] 443  >  2065 [PSH, ACK] Seq=11916579 Ack=8886 Win=262144 Len=1240"
"41457","127.791273","142.250.190.42","192.168.2.103","TCP","1394","[TCP Retransmission] 443  >  2065 [PSH, ACK] Seq=11920299 Ack=8886 Win=262144 Len=1240"
"41946","127.890635","142.250.190.42","192.168.2.103","TCP","1394","[TCP Retransmission] 443  >  2065 [PSH, ACK] Seq=12240219 Ack=8886 Win=262144 Len=1240"
"42180","127.940279","142.250.190.42","192.168.2.103","TCP","1386","[TCP Retransmission] 443  >  2065 [ACK] Seq=12367939 Ack=8886 Win=262144 Len=1240"
"42477","133.983824","192.168.2.103","142.250.190.42","TCP","1386","[TCP Retransmission] 2057  >  443 [ACK] Seq=69225 Ack=3117789 Win=133888 Len=1240"
"42991","137.789961","142.250.190.42","192.168.2.103","TCP","1394","[TCP Retransmission] 443  >  2057 [ACK] Seq=3227542 Ack=71732 Win=206592 Len=1240"
"43086","137.807959","142.250.190.42","192.168.2.103","TCP","1394","[TCP Retransmission] 443  >  2057 [ACK] Seq=3301942 Ack=71732 Win=206592 Len=1240 [TCP PDU reassembled in 43077]"
"43087","137.807962","142.250.190.42","192.168.2.103","TCP","1394","[TCP Retransmission] 443  >  2057 [PSH, ACK] Seq=3303182 Ack=71732 Win=206592 Len=1240 [TCP PDU reassembled in 43077]"
"43172","137.825291","142.250.190.42","192.168.2.103","TCP","1394","[TCP Retransmission] 443  >  2057 [ACK] Seq=3356502 Ack=71732 Win=206592 Len=1240"
"43173","137.825295","142.250.190.42","192.168.2.103","TCP","1394","[TCP Retransmission] 443  >  2057 [ACK] Seq=3357742 Ack=71732 Win=206592 Len=1240"
"43216","137.836464","142.250.190.42","192.168.2.103","TCP","1394","[TCP Retransmission] 443  >  2057 [ACK] Seq=3372622 Ack=71732 Win=206592 Len=1240"
"43921","137.986606","142.250.190.42","192.168.2.103","TCP","1394","[TCP Retransmission] 443  >  2057 [ACK] Seq=3852502 Ack=71732 Win=206592 Len=1240"
"44117","138.021550","142.250.190.42","192.168.2.103","TCP","1362","[TCP Retransmission] 443  >  2057 [PSH, ACK] Seq=3977742 Ack=71732 Win=206592 Len=1208"
"44408","138.087071","142.250.190.42","192.168.2.103","TCP","1394","[TCP Retransmission] 443  >  2057 [ACK] Seq=4176110 Ack=71732 Win=206592 Len=1240"
"44409","138.087074","142.250.190.42","192.168.2.103","TCP","1394","[TCP Retransmission] 443  >  2057 [ACK] Seq=4177350 Ack=71732 Win=206592 Len=1240"
"44410","138.087077","142.250.190.42","192.168.2.103","TCP","1394","[TCP Retransmission] 443  >  2057 [PSH, ACK] Seq=4178590 Ack=71732 Win=206592 Len=1240"
"44412","138.087082","142.250.190.42","192.168.2.103","TCP","1394","[TCP Retransmission] 443  >  2057 [ACK] Seq=4181070 Ack=71732 Win=206592 Len=1240"
"44413","138.087085","142.250.190.42","192.168.2.103","TCP","1394","[TCP Retransmission] 443  >  2057 [PSH, ACK] Seq=4182310 Ack=71732 Win=206592 Len=1240"
"44448","138.094524","142.250.190.42","192.168.2.103","TCP","1394","[TCP Retransmission] 443  >  2057 [ACK] Seq=4194710 Ack=71732 Win=206592 Len=1240 [TCP PDU reassembled in 44457]"
"44914","138.187209","142.250.190.42","192.168.2.103","TCP","1394","[TCP Retransmission] 443  >  2057 [ACK] Seq=4518350 Ack=71732 Win=206592 Len=1240"
"44915","138.187212","142.250.190.42","192.168.2.103","TCP","1394","[TCP Retransmission] 443  >  2057 [ACK] Seq=4519590 Ack=71732 Win=206592 Len=1240"
"45542","147.788042","192.168.2.103","142.250.190.42","TCP","839","[TCP Retransmission] 2057  >  443 [PSH, ACK] Seq=78771 Ack=4616358 Win=133120 Len=693 [TCP PDU reassembled in 45539]"
