"No.","Time","Source","Destination","Protocol","Length","Info"
"814","2.642105","192.168.2.103","157.240.26.49","TCP","146","[TCP Dup ACK 811#1] 1101  >  443 [ACK] Seq=1040 Ack=532 Win=258 Len=0"
"1156","6.401535","157.240.26.49","192.168.2.103","TCP","146","[TCP Dup ACK 1155#1] 443  >  2030 [ACK] Seq=1 Ack=519 Win=66816 Len=0"
"1473","8.154572","23.192.220.16","192.168.2.103","TCP","1386","443  >  2032 [ACK] Seq=15784 Ack=1127 Win=64128 Len=1240 [TCP PDU reassembled in 1475]"
"1501","8.162709","23.192.220.16","192.168.2.103","TCP","1394","443  >  2032 [PSH, ACK] Seq=24464 Ack=1158 Win=64128 Len=1240 [TCP PDU reassembled in 1508]"
"1502","8.162715","23.192.220.16","192.168.2.103","TCP","1394","443  >  2032 [ACK] Seq=25704 Ack=1158 Win=64128 Len=1240 [TCP PDU reassembled in 1508]"
"1503","8.162719","23.192.220.16","192.168.2.103","TCP","1394","443  >  2032 [ACK] Seq=26944 Ack=1158 Win=64128 Len=1240 [TCP PDU reassembled in 1508]"
"1504","8.162727","23.192.220.16","192.168.2.103","TCP","1394","443  >  2032 [ACK] Seq=28184 Ack=1158 Win=64128 Len=1240 [TCP PDU reassembled in 1508]"
"1505","8.162732","23.192.220.16","192.168.2.103","TCP","1394","443  >  2032 [PSH, ACK] Seq=29424 Ack=1158 Win=64128 Len=1240 [TCP PDU reassembled in 1508]"
"1506","8.162736","23.192.220.16","192.168.2.103","TCP","1394","443  >  2032 [ACK] Seq=30664 Ack=1158 Win=64128 Len=1240 [TCP PDU reassembled in 1508]"
"1507","8.162740","23.192.220.16","192.168.2.103","TCP","1394","443  >  2032 [ACK] Seq=31904 Ack=1158 Win=64128 Len=1240 [TCP PDU reassembled in 1508]"
"1509","8.162748","23.192.220.16","192.168.2.103","TCP","1394","443  >  2032 [PSH, ACK] Seq=34384 Ack=1158 Win=64128 Len=1240 [TCP PDU reassembled in 1524]"
"1542","8.169511","157.240.26.49","192.168.2.103","TCP","1394","[TCP Out-Of-Order] 443  >  2033 [PSH, ACK] Seq=1241 Ack=220 Win=261 Len=1240"
"1561","8.172372","23.192.220.16","192.168.2.103","TCP","1394","443  >  2032 [PSH, ACK] Seq=46784 Ack=1158 Win=64128 Len=1240 [TCP PDU reassembled in 1565]"
"1562","8.172376","23.192.220.16","192.168.2.103","TCP","1394","443  >  2032 [ACK] Seq=48024 Ack=1158 Win=64128 Len=1240 [TCP PDU reassembled in 1565]"
"1563","8.172381","23.192.220.16","192.168.2.103","TCP","1394","443  >  2032 [ACK] Seq=49264 Ack=1158 Win=64128 Len=1240 [TCP PDU reassembled in 1565]"
"1564","8.172385","23.192.220.16","192.168.2.103","TCP","1394","443  >  2032 [ACK] Seq=50504 Ack=1158 Win=64128 Len=1240 [TCP PDU reassembled in 1565]"
"1566","8.172394","23.192.220.16","192.168.2.103","TCP","1394","443  >  2032 [ACK] Seq=52984 Ack=1158 Win=64128 Len=1240 [TCP PDU reassembled in 1607]"
"1567","8.172398","23.192.220.16","192.168.2.103","TCP","1394","443  >  2032 [PSH, ACK] Seq=54224 Ack=1158 Win=64128 Len=1240 [TCP PDU reassembled in 1607]"
"1597","8.179427","23.192.220.16","192.168.2.103","TCP","1394","443  >  2032 [ACK] Seq=61664 Ack=1158 Win=64128 Len=1240 [TCP PDU reassembled in 1607]"
"1598","8.179430","23.192.220.16","192.168.2.103","TCP","1394","443  >  2032 [ACK] Seq=62904 Ack=1158 Win=64128 Len=1240 [TCP PDU reassembled in 1607]"
"1599","8.179433","23.192.220.16","192.168.2.103","TCP","1394","443  >  2032 [PSH, ACK] Seq=64144 Ack=1158 Win=64128 Len=1240 [TCP PDU reassembled in 1607]"
"1600","8.179436","23.192.220.16","192.168.2.103","TCP","1394","443  >  2032 [ACK] Seq=65384 Ack=1158 Win=64128 Len=1240 [TCP PDU reassembled in 1607]"
"1601","8.179439","23.192.220.16","192.168.2.103","TCP","1394","443  >  2032 [ACK] Seq=66624 Ack=1158 Win=64128 Len=1240 [TCP PDU reassembled in 1607]"
"1603","8.179445","23.192.220.16","192.168.2.103","TCP","1394","443  >  2032 [PSH, ACK] Seq=69104 Ack=1158 Win=64128 Len=1240 [TCP PDU reassembled in 1604]"
"1607","8.180233","23.192.220.16","192.168.2.103","TCP","1394","[TCP Out-Of-Order] 443  >  2032 [PSH, ACK] Seq=59184 Ack=1158 Win=64128 Len=1240"
"1672","8.250436","157.240.26.49","192.168.2.103","TCP","146","443  >  2033 [ACK] Seq=6882 Ack=9127 Win=328 Len=0"
"1855","8.505002","157.240.26.49","192.168.2.103","TCP","1386","443  >  2033 [ACK] Seq=18924 Ack=44253 Win=609 Len=1240 [TCP PDU reassembled in 1858]"
"1957","9.913214","157.240.26.49","192.168.2.103","TCP","146","[TCP Dup ACK 1956#1] 443  >  2038 [ACK] Seq=1 Ack=518 Win=66816 Len=0"
"1982","9.926233","157.240.26.49","192.168.2.103","TCP","146","443  >  2038 [ACK] Seq=3628 Ack=668 Win=66816 Len=0"
"2015","9.988227","192.168.2.103","157.240.26.49","TCP","146","[TCP Dup ACK 2009#1] 2038  >  443 [ACK] Seq=1198 Ack=4656 Win=64512 Len=0"
"2023","9.997023","157.240.26.49","192.168.2.103","TCP","146","[TCP Dup ACK 2022#1] 443  >  2038 [ACK] Seq=4656 Ack=1916 Win=69120 Len=0"
"2027","9.997450","157.240.26.49","192.168.2.103","TCP","146","[TCP Dup ACK 2022#2] 443  >  2038 [ACK] Seq=4656 Ack=1916 Win=69120 Len=0"
"2032","9.998077","157.240.26.49","192.168.2.103","TCP","154","443  >  2038 [ACK] Seq=4656 Ack=2902 Win=71168 Len=0"
"2239","11.353177","192.168.2.103","157.240.26.49","TCP","146","[TCP Dup ACK 2236#1] 2038  >  443 [ACK] Seq=3976 Ack=28493 Win=65536 Len=0"
"2307","11.368729","157.240.26.49","192.168.2.103","TCP","1394","[TCP Previous segment not captured] 443  >  2038 [ACK] Seq=52053 Ack=3976 Win=77056 Len=1240 [TCP PDU reassembled in 2356]"
"2308","11.368733","157.240.26.49","192.168.2.103","TCP","1394","443  >  2038 [PSH, ACK] Seq=53293 Ack=3976 Win=77056 Len=1240 [TCP PDU reassembled in 2356]"
"2500","11.461523","157.240.26.49","192.168.2.103","TCP","1394","443  >  2038 [ACK] Seq=121734 Ack=3976 Win=77056 Len=1240 [TCP PDU reassembled in 2511]"
"2501","11.461527","157.240.26.49","192.168.2.103","TCP","1394","443  >  2038 [ACK] Seq=122974 Ack=3976 Win=77056 Len=1240 [TCP PDU reassembled in 2511]"
"2502","11.461530","157.240.26.49","192.168.2.103","TCP","1394","443  >  2038 [ACK] Seq=124214 Ack=3976 Win=77056 Len=1240 [TCP PDU reassembled in 2511]"
"2503","11.461533","157.240.26.49","192.168.2.103","TCP","1394","443  >  2038 [ACK] Seq=125454 Ack=3976 Win=77056 Len=1240 [TCP PDU reassembled in 2511]"
"2504","11.461539","157.240.26.49","192.168.2.103","TCP","1394","443  >  2038 [PSH, ACK] Seq=126694 Ack=3976 Win=77056 Len=1240 [TCP PDU reassembled in 2511]"
"2505","11.461542","157.240.26.49","192.168.2.103","TCP","1394","443  >  2038 [ACK] Seq=127934 Ack=3976 Win=77056 Len=1240 [TCP PDU reassembled in 2511]"
"2525","11.466987","157.240.26.49","192.168.2.103","TCP","1394","[TCP Out-Of-Order] 443  >  2038 [ACK] Seq=136953 Ack=3976 Win=77056 Len=1240"
"2554","11.480153","157.240.26.49","192.168.2.103","TCP","1394","[TCP Out-Of-Order] 443  >  2038 [PSH, ACK] Seq=151833 Ack=3976 Win=77056 Len=1240"
"2557","11.480168","157.240.26.49","192.168.2.103","TCP","1394","443  >  2038 [ACK] Seq=155553 Ack=3976 Win=77056 Len=1240"
"2566","11.480774","192.168.2.103","157.240.26.49","TCP","146","[TCP Dup ACK 2563#1] 2038  >  443 [ACK] Seq=3976 Ack=151833 Win=65536 Len=0"
"2569","11.481267","192.168.2.103","157.240.26.49","TCP","146","[TCP Dup ACK 2563#2] 2038  >  443 [ACK] Seq=3976 Ack=151833 Win=65536 Len=0"
"2931","15.574318","34.36.199.114","192.168.2.103","TCP","146","443  >  2039 [ACK] Seq=1 Ack=675 Win=269056 Len=0"
"2997","15.751390","34.36.199.114","192.168.2.103","TCP","166","443  >  2041 [SYN, ACK] Seq=0 Ack=1 Win=65535 Len=0 MSS=1412 SACK_PERM WS=256"
"2998","15.751402","34.36.199.114","192.168.2.103","TCP","166","443  >  2042 [SYN, ACK] Seq=0 Ack=1 Win=65535 Len=0 MSS=1412 SACK_PERM WS=256"
"2999","15.751409","34.36.199.114","192.168.2.103","TCP","166","443  >  2043 [SYN, ACK] Seq=0 Ack=1 Win=65535 Len=0 MSS=1412 SACK_PERM WS=256"
"3000","15.751413","34.36.199.114","192.168.2.103","TCP","166","443  >  2045 [SYN, ACK] Seq=0 Ack=1 Win=65535 Len=0 MSS=1412 SACK_PERM WS=256"
"3001","15.751418","34.36.199.114","192.168.2.103","TCP","166","443  >  2044 [SYN, ACK] Seq=0 Ack=1 Win=65535 Len=0 MSS=1412 SACK_PERM WS=256"
"3002","15.751422","34.36.199.114","192.168.2.103","TCP","166","443  >  2046 [SYN, ACK] Seq=0 Ack=1 Win=65535 Len=0 MSS=1412 SACK_PERM WS=256"
"3003","15.751426","34.36.199.114","192.168.2.103","TCP","166","443  >  2047 [SYN, ACK] Seq=0 Ack=1 Win=65535 Len=0 MSS=1412 SACK_PERM WS=256"
"3115","15.797255","34.36.199.114","192.168.2.103","TCP","154","443  >  2044 [ACK] Seq=220 Ack=1044 Win=268800 Len=0"
"3116","15.797259","34.36.199.114","192.168.2.103","TCP","154","443  >  2040 [ACK] Seq=220 Ack=1046 Win=268800 Len=0"
"3188","15.824247","34.36.199.114","192.168.2.103","TCP","146","443  >  2044 [ACK] Seq=965 Ack=1337 Win=268544 Len=0"
"3198","15.827229","34.36.199.114","192.168.2.103","TCP","146","[TCP Dup ACK 3196#1] 443  >  2049 [ACK] Seq=965 Ack=1343 Win=268544 Len=0"
"3280","15.850205","34.36.199.114","192.168.2.103","TCP","146","[TCP Dup ACK 3279#1] 443  >  2049 [ACK] Seq=1166 Ack=1643 Win=268288 Len=0"
"3374","15.875362","34.36.199.114","192.168.2.103","TCP","146","[TCP Dup ACK 3373#1] 443  >  2043 [ACK] Seq=1367 Ack=1954 Win=268032 Len=0"
"3436","15.892145","34.36.199.114","192.168.2.103","TCP","146","443  >  2044 [ACK] Seq=1568 Ack=2251 Win=267776 Len=0"
"3446","15.893126","34.36.199.114","192.168.2.103","TCP","146","[TCP Dup ACK 3436#1] 443  >  2044 [ACK] Seq=1568 Ack=2251 Win=267776 Len=0"
"3458","15.897752","34.36.199.114","192.168.2.103","TCP","146","[TCP Dup ACK 3457#1] 443  >  2042 [ACK] Seq=1552 Ack=2274 Win=267776 Len=0"
"3519","15.918324","34.36.199.114","192.168.2.103","TCP","154","443  >  2040 [ACK] Seq=1861 Ack=2576 Win=267520 Len=0"
"3520","15.918327","34.36.199.114","192.168.2.103","TCP","154","443  >  2044 [ACK] Seq=1753 Ack=2584 Win=267520 Len=0"
"3537","15.923982","34.36.199.114","192.168.2.103","TCP","146","[TCP Dup ACK 3536#1] 443  >  2049 [ACK] Seq=1737 Ack=2653 Win=267520 Len=0"
"3596","15.940252","34.36.199.114","192.168.2.103","TCP","146","443  >  2044 [ACK] Seq=1938 Ack=2920 Win=267264 Len=0"
"3618","15.946321","34.36.199.114","192.168.2.103","TCP","146","[TCP Dup ACK 3615#1] 443  >  2040 [ACK] Seq=2046 Ack=2922 Win=267264 Len=0"
"3644","15.950921","192.168.2.103","34.36.199.114","TCP","146","[TCP Dup ACK 3640#1] 2046  >  443 [ACK] Seq=2634 Ack=1923 Win=65792 Len=0"
"4557","17.442812","157.240.26.35","192.168.2.103","TCP","1394","[TCP Out-Of-Order] 443  >  2051 [ACK] Seq=1 Ack=342 Win=66816 Len=1240"
"4558","17.442816","157.240.26.35","192.168.2.103","TCP","1394","[TCP Out-Of-Order] 443  >  2051 [PSH, ACK] Seq=1241 Ack=342 Win=66816 Len=1240"
"4687","17.553997","157.240.26.35","192.168.2.103","TCP","1394","[TCP Out-Of-Order] 443  >  2053 [ACK] Seq=4467 Ack=601 Win=67840 Len=1240"
"4688","17.554002","157.240.26.35","192.168.2.103","TCP","1394","[TCP Out-Of-Order] 443  >  2053 [ACK] Seq=5707 Ack=601 Win=67840 Len=1240"
"4691","17.554016","157.240.26.35","192.168.2.103","TCP","1394","443  >  2053 [ACK] Seq=9427 Ack=601 Win=67840 Len=1240"
"4692","17.554021","157.240.26.35","192.168.2.103","TCP","1394","443  >  2053 [PSH, ACK] Seq=10667 Ack=601 Win=67840 Len=1240"
"4693","17.554025","157.240.26.35","192.168.2.103","TCP","1394","443  >  2053 [ACK] Seq=11907 Ack=601 Win=67840 Len=1240"
"4694","17.554030","157.240.26.35","192.168.2.103","TCP","1394","443  >  2053 [PSH, ACK] Seq=13147 Ack=601 Win=67840 Len=1240"
"4695","17.554037","157.240.26.35","192.168.2.103","TCP","1394","443  >  2053 [ACK] Seq=14387 Ack=601 Win=67840 Len=1240"
"6060","27.212601","142.250.190.42","192.168.2.103","TCP","146","443  >  2057 [ACK] Seq=5949 Ack=6228 Win=264448 Len=0"
"6970","34.037592","157.240.26.49","192.168.2.103","TCP","154","443  >  2064 [ACK] Seq=3628 Ack=2162 Win=70400 Len=0"
"6971","34.037604","157.240.26.49","192.168.2.103","TCP","154","443  >  2064 [ACK] Seq=3628 Ack=2332 Win=72704 Len=0"
"6972","34.037609","157.240.26.49","192.168.2.103","TCP","323","[TCP Out-Of-Order] 443  >  2064 [PSH, ACK] Seq=3628 Ack=2332 Win=72704 Len=169"
"6973","34.037616","157.240.26.49","192.168.2.103","TCP","228","[TCP Out-Of-Order] 443  >  2064 [PSH, ACK] Seq=3797 Ack=2332 Win=72704 Len=74"
"6977","34.038140","157.240.26.49","192.168.2.103","TCP","154","443  >  2064 [ACK] Seq=3628 Ack=2162 Win=70400 Len=0"
"6981","34.038377","157.240.26.49","192.168.2.103","TCP","154","443  >  2064 [ACK] Seq=3628 Ack=2162 Win=70400 Len=0"
"7500","38.894422","142.250.190.42","192.168.2.103","TCP","1386","[TCP Out-Of-Order] 443  >  2065 [ACK] Seq=19571 Ack=1003 Win=269056 Len=1240"
"7547","38.907897","142.250.190.42","192.168.2.103","TCP","1394","[TCP Out-Of-Order] 443  >  2065 [ACK] Seq=28251 Ack=1003 Win=269056 Len=1240"
"7549","38.907905","142.250.190.42","192.168.2.103","TCP","1394","443  >  2065 [ACK] Seq=30731 Ack=1003 Win=269056 Len=1240"
"7593","38.920038","142.250.190.42","192.168.2.103","TCP","1394","[TCP Out-Of-Order] 443  >  2065 [ACK] Seq=58011 Ack=1003 Win=269056 Len=1240"
"7594","38.920043","142.250.190.42","192.168.2.103","TCP","1394","[TCP Out-Of-Order] 443  >  2065 [ACK] Seq=60491 Ack=1003 Win=269056 Len=1240"
"7620","38.923658","142.250.190.42","192.168.2.103","TCP","1394","[TCP Out-Of-Order] 443  >  2065 [ACK] Seq=77851 Ack=1003 Win=269056 Len=1240"
"7810","38.962400","142.250.190.42","192.168.2.103","TCP","1394","443  >  2065 [ACK] Seq=185731 Ack=1003 Win=269056 Len=1240 [TCP PDU reassembled in 7822]"
"7811","38.962404","142.250.190.42","192.168.2.103","TCP","1394","443  >  2065 [PSH, ACK] Seq=186971 Ack=1003 Win=269056 Len=1240 [TCP PDU reassembled in 7822]"
"7812","38.962408","142.250.190.42","192.168.2.103","TCP","1394","443  >  2065 [ACK] Seq=188211 Ack=1003 Win=269056 Len=1240 [TCP PDU reassembled in 7822]"
"7813","38.962412","142.250.190.42","192.168.2.103","TCP","1394","443  >  2065 [ACK] Seq=189451 Ack=1003 Win=269056 Len=1240 [TCP PDU reassembled in 7822]"
"7814","38.962416","142.250.190.42","192.168.2.103","TCP","1394","443  >  2065 [ACK] Seq=190691 Ack=1003 Win=269056 Len=1240 [TCP PDU reassembled in 7822]"
"7859","38.972033","142.250.190.42","192.168.2.103","TCP","1394","[TCP Out-Of-Order] 443  >  2065 [ACK] Seq=209291 Ack=1003 Win=269056 Len=1240"
"7860","38.972042","142.250.190.42","192.168.2.103","TCP","1394","[TCP Out-Of-Order] 443  >  2065 [ACK] Seq=210531 Ack=1003 Win=269056 Len=1240"
"7862","38.973614","142.250.190.42","192.168.2.103","TCP","1394","[TCP Out-Of-Order] 443  >  2065 [ACK] Seq=213011 Ack=1003 Win=269056 Len=1240"
"7863","38.973618","142.250.190.42","192.168.2.103","TCP","1394","[TCP Out-Of-Order] 443  >  2065 [ACK] Seq=214251 Ack=1003 Win=269056 Len=1240"
"7864","38.973622","142.250.190.42","192.168.2.103","TCP","1394","[TCP Out-Of-Order] 443  >  2065 [ACK] Seq=215491 Ack=1003 Win=269056 Len=1240"
"7865","38.973627","142.250.190.42","192.168.2.103","TCP","1394","[TCP Out-Of-Order] 443  >  2065 [ACK] Seq=216731 Ack=1003 Win=269056 Len=1240"
"7899","38.980173","142.250.190.42","192.168.2.103","TCP","1394","443  >  2065 [PSH, ACK] Seq=242771 Ack=1003 Win=269056 Len=1240 [TCP PDU reassembled in 7923]"
"7910","38.983455","142.250.190.42","192.168.2.103","TCP","1394","[TCP Out-Of-Order] 443  >  2065 [ACK] Seq=237811 Ack=1003 Win=269056 Len=1240 [TCP PDU reassembled in 7923]"
"7945","38.990485","142.250.190.42","192.168.2.103","TCP","1394","[TCP Out-Of-Order] 443  >  2065 [PSH, ACK] Seq=260131 Ack=1003 Win=269056 Len=1240"
"8040","39.009669","142.250.190.42","192.168.2.103","TCP","1394","[TCP Out-Of-Order] 443  >  2065 [ACK] Seq=317171 Ack=1003 Win=269056 Len=1240 [TCP PDU reassembled in 8043]"
"8043","39.009681","142.250.190.42","192.168.2.103","TCP","1394","[TCP Out-Of-Order] 443  >  2065 [ACK] Seq=320891 Ack=1003 Win=269056 Len=1240"
"8069","39.017971","142.250.190.42","192.168.2.103","TCP","1394","[TCP Out-Of-Order] 443  >  2065 [ACK] Seq=343211 Ack=1003 Win=269056 Len=1240"
"8070","39.017973","142.250.190.42","192.168.2.103","TCP","1394","[TCP Out-Of-Order] 443  >  2065 [ACK] Seq=344451 Ack=1003 Win=269056 Len=1240"
"8108","39.028445","142.250.190.42","192.168.2.103","TCP","1394","443  >  2065 [ACK] Seq=375451 Ack=1003 Win=269056 Len=1240 [TCP PDU reassembled in 8165]"
"8109","39.028450","142.250.190.42","192.168.2.103","TCP","1394","443  >  2065 [ACK] Seq=376691 Ack=1003 Win=269056 Len=1240 [TCP PDU reassembled in 8165]"
"8110","39.028454","142.250.190.42","192.168.2.103","TCP","1394","[TCP Out-Of-Order] 443  >  2065 [ACK] Seq=361811 Ack=1003 Win=269056 Len=1240"
"8112","39.030019","142.250.190.42","192.168.2.103","TCP","1394","[TCP Out-Of-Order] 443  >  2065 [PSH, ACK] Seq=363051 Ack=1003 Win=269056 Len=1240"
"8113","39.030023","142.250.190.42","192.168.2.103","TCP","1394","[TCP Out-Of-Order] 443  >  2065 [ACK] Seq=364291 Ack=1003 Win=269056 Len=1240"
"8114","39.030027","142.250.190.42","192.168.2.103","TCP","1394","[TCP Out-Of-Order] 443  >  2065 [ACK] Seq=365531 Ack=1003 Win=269056 Len=1240"
"8115","39.030031","142.250.190.42","192.168.2.103","TCP","1394","[TCP Out-Of-Order] 443  >  2065 [ACK] Seq=366771 Ack=1003 Win=269056 Len=1240"
"8116","39.030035","142.250.190.42","192.168.2.103","TCP","1394","[TCP Out-Of-Order] 443  >  2065 [ACK] Seq=368011 Ack=1003 Win=269056 Len=1240"
"8140","39.035480","142.250.190.42","192.168.2.103","TCP","1394","[TCP Out-Of-Order] 443  >  2065 [ACK] Seq=394051 Ack=1003 Win=269056 Len=1240 [TCP PDU reassembled in 8165]"
"8193","39.046607","142.250.190.42","192.168.2.103","TCP","1394","[TCP Out-Of-Order] 443  >  2065 [ACK] Seq=420091 Ack=1003 Win=269056 Len=1240"
"8198","39.046626","142.250.190.42","192.168.2.103","TCP","1394","[TCP Out-Of-Order] 443  >  2065 [ACK] Seq=413891 Ack=1003 Win=269056 Len=1240"
"8205","39.048510","142.250.190.42","192.168.2.103","TCP","1394","[TCP Out-Of-Order] 443  >  2065 [ACK] Seq=416371 Ack=1003 Win=269056 Len=1240"
"8229","39.056337","142.250.190.42","192.168.2.103","TCP","1394","443  >  2065 [ACK] Seq=436211 Ack=1003 Win=269056 Len=1240 [TCP PDU reassembled in 8242]"
"8230","39.056341","142.250.190.42","192.168.2.103","TCP","1394","443  >  2065 [ACK] Seq=437451 Ack=1003 Win=269056 Len=1240 [TCP PDU reassembled in 8242]"
"8231","39.056345","142.250.190.42","192.168.2.103","TCP","1394","443  >  2065 [ACK] Seq=438691 Ack=1003 Win=269056 Len=1240 [TCP PDU reassembled in 8242]"
"8232","39.056350","142.250.190.42","192.168.2.103","TCP","1394","443  >  2065 [ACK] Seq=439931 Ack=1003 Win=269056 Len=1240 [TCP PDU reassembled in 8242]"
"8233","39.056354","142.250.190.42","192.168.2.103","TCP","1394","443  >  2065 [PSH, ACK] Seq=441171 Ack=1003 Win=269056 Len=1240 [TCP PDU reassembled in 8242]"
"8267","39.063843","142.250.190.42","192.168.2.103","TCP","1394","[TCP Out-Of-Order] 443  >  2065 [ACK] Seq=452331 Ack=1003 Win=269056 Len=1240"
"8270","39.063850","142.250.190.42","192.168.2.103","TCP","1394","[TCP Out-Of-Order] 443  >  2065 [ACK] Seq=456051 Ack=1003 Win=269056 Len=1240"
"8276","39.065813","142.250.190.42","192.168.2.103","TCP","1394","[TCP Out-Of-Order] 443  >  2065 [ACK] Seq=457291 Ack=1003 Win=269056 Len=1240"
"8277","39.065817","142.250.190.42","192.168.2.103","TCP","1394","[TCP Out-Of-Order] 443  >  2065 [PSH, ACK] Seq=458531 Ack=1003 Win=269056 Len=1240"
"8324","39.075115","142.250.190.42","192.168.2.103","TCP","1394","[TCP Out-Of-Order] 443  >  2065 [ACK] Seq=489531 Ack=1003 Win=269056 Len=1240"
"8325","39.075117","142.250.190.42","192.168.2.103","TCP","1394","[TCP Out-Of-Order] 443  >  2065 [ACK] Seq=490771 Ack=1003 Win=269056 Len=1240"
"8428","39.090367","192.168.2.103","142.250.190.42","TCP","146","2065  >  443 [ACK] Seq=1003 Ack=557731 Win=131328 Len=0"
"8430","39.090884","142.250.190.42","192.168.2.103","TCP","1386","443  >  2065 [PSH, ACK] Seq=558971 Ack=1003 Win=269056 Len=1240 [TCP PDU reassembled in 8450]"
"8466","39.097123","142.250.190.42","192.168.2.103","TCP","1394","[TCP Out-Of-Order] 443  >  2065 [ACK] Seq=575091 Ack=1003 Win=269056 Len=1240"
"8522","39.112122","142.250.190.42","192.168.2.103","TCP","1394","[TCP Previous segment not captured] 443  >  2065 [PSH, ACK] Seq=606091 Ack=1003 Win=269056 Len=1240"
"8555","39.122407","142.250.190.42","192.168.2.103","TCP","1394","[TCP Out-Of-Order] 443  >  2065 [PSH, ACK] Seq=628411 Ack=1003 Win=269056 Len=1240"
"8556","39.122412","142.250.190.42","192.168.2.103","TCP","1394","[TCP Out-Of-Order] 443  >  2065 [ACK] Seq=629651 Ack=1003 Win=269056 Len=1240"
"8557","39.122416","142.250.190.42","192.168.2.103","TCP","1394","[TCP Out-Of-Order] 443  >  2065 [PSH, ACK] Seq=630891 Ack=1003 Win=269056 Len=1240"
"8558","39.122421","142.250.190.42","192.168.2.103","TCP","1394","[TCP Out-Of-Order] 443  >  2065 [ACK] Seq=632131 Ack=1003 Win=269056 Len=1240"
"8559","39.122424","142.250.190.42","192.168.2.103","TCP","1394","[TCP Out-Of-Order] 443  >  2065 [PSH, ACK] Seq=633371 Ack=1003 Win=269056 Len=1240"
"8560","39.122428","142.250.190.42","192.168.2.103","TCP","1394","[TCP Out-Of-Order] 443  >  2065 [ACK] Seq=634611 Ack=1003 Win=269056 Len=1240"
"8570","39.127951","142.250.190.42","192.168.2.103","TCP","1394","[TCP Out-Of-Order] 443  >  2065 [PSH, ACK] Seq=645771 Ack=1003 Win=269056 Len=1240"
"8574","39.127966","142.250.190.42","192.168.2.103","TCP","1394","[TCP Out-Of-Order] 443  >  2065 [PSH, ACK] Seq=650731 Ack=1003 Win=269056 Len=1240"
"8606","39.136539","142.250.190.42","192.168.2.103","TCP","1394","443  >  2065 [PSH, ACK] Seq=675531 Ack=1003 Win=269056 Len=1240 [TCP PDU reassembled in 8616]"
"8612","39.136564","142.250.190.42","192.168.2.103","TCP","1394","[TCP Out-Of-Order] 443  >  2065 [PSH, ACK] Seq=673051 Ack=1003 Win=269056 Len=1240 [TCP PDU reassembled in 8616]"
"8659","39.149314","142.250.190.42","192.168.2.103","TCP","1394","[TCP Out-Of-Order] 443  >  2065 [ACK] Seq=709011 Ack=1003 Win=269056 Len=1240"
"8775","39.185112","142.250.190.42","192.168.2.103","TCP","1394","[TCP Out-Of-Order] 443  >  2065 [PSH, ACK] Seq=774731 Ack=1003 Win=269056 Len=1240"
"8778","39.185124","142.250.190.42","192.168.2.103","TCP","1394","[TCP Out-Of-Order] 443  >  2065 [ACK] Seq=778451 Ack=1003 Win=269056 Len=1240"
"8783","39.187070","142.250.190.42","192.168.2.103","TCP","1394","[TCP Out-Of-Order] 443  >  2065 [PSH, ACK] Seq=767291 Ack=1003 Win=269056 Len=1240"
"8785","39.187074","142.250.190.42","192.168.2.103","TCP","1394","[TCP Out-Of-Order] 443  >  2065 [PSH, ACK] Seq=769771 Ack=1003 Win=269056 Len=1240"
"8786","39.187076","142.250.190.42","192.168.2.103","TCP","1394","[TCP Out-Of-Order] 443  >  2065 [ACK] Seq=771011 Ack=1003 Win=269056 Len=1240"
"8814","39.194519","142.250.190.42","192.168.2.103","TCP","1386","[TCP Out-Of-Order] 443  >  2065 [ACK] Seq=785891 Ack=1003 Win=269056 Len=1240"
"8816","39.195732","142.250.190.42","192.168.2.103","TCP","1394","[TCP Out-Of-Order] 443  >  2065 [PSH, ACK] Seq=787131 Ack=1003 Win=269056 Len=1240"
"8817","39.195737","142.250.190.42","192.168.2.103","TCP","1394","[TCP Out-Of-Order] 443  >  2065 [ACK] Seq=788371 Ack=1003 Win=269056 Len=1240"
"8858","39.204766","142.250.190.42","192.168.2.103","TCP","1394","443  >  2065 [ACK] Seq=810691 Ack=1003 Win=269056 Len=1240 [TCP PDU reassembled in 8915]"
"8859","39.204770","142.250.190.42","192.168.2.103","TCP","1394","443  >  2065 [PSH, ACK] Seq=811931 Ack=1003 Win=269056 Len=1240 [TCP PDU reassembled in 8915]"
"8860","39.204774","142.250.190.42","192.168.2.103","TCP","1394","443  >  2065 [ACK] Seq=813171 Ack=1003 Win=269056 Len=1240 [TCP PDU reassembled in 8915]"
"8865","39.206920","142.250.190.42","192.168.2.103","TCP","1394","[TCP Out-Of-Order] 443  >  2065 [PSH, ACK] Seq=804491 Ack=1003 Win=269056 Len=1240 [TCP PDU reassembled in 8915]"
"8882","39.210342","142.250.190.42","192.168.2.103","TCP","1394","[TCP Out-Of-Order] 443  >  2065 [ACK] Seq=820611 Ack=1003 Win=269056 Len=1240 [TCP PDU reassembled in 8915]"
"8883","39.210346","142.250.190.42","192.168.2.103","TCP","1394","[TCP Out-Of-Order] 443  >  2065 [PSH, ACK] Seq=821851 Ack=1003 Win=269056 Len=1240 [TCP PDU reassembled in 8915]"
"8884","39.210350","142.250.190.42","192.168.2.103","TCP","1394","[TCP Out-Of-Order] 443  >  2065 [ACK] Seq=823091 Ack=1003 Win=269056 Len=1240 [TCP PDU reassembled in 8915]"
"8885","39.210354","142.250.190.42","192.168.2.103","TCP","1394","[TCP Out-Of-Order] 443  >  2065 [PSH, ACK] Seq=824331 Ack=1003 Win=269056 Len=1240 [TCP PDU reassembled in 8915]"
"8965","39.232227","142.250.190.42","192.168.2.103","TCP","1394","443  >  2065 [PSH, ACK] Seq=876411 Ack=1003 Win=269056 Len=1240 [TCP PDU reassembled in 9085]"
"8991","39.236381","192.168.2.103","142.250.190.42","TCP","146","[TCP Dup ACK 8988#1] 2065  >  443 [ACK] Seq=1003 Ack=886331 Win=131328 Len=0"
"9040","39.248640","142.250.190.42","192.168.2.103","TCP","1394","[TCP Out-Of-Order] 443  >  2065 [PSH, ACK] Seq=908651 Ack=1003 Win=269056 Len=1240 [TCP PDU reassembled in 9085]"
"9083","39.260156","142.250.190.42","192.168.2.103","TCP","1394","[TCP Out-Of-Order] 443  >  2065 [PSH, ACK] Seq=930971 Ack=1003 Win=269056 Len=1240 [TCP PDU reassembled in 9085]"
"9086","39.260163","142.250.190.42","192.168.2.103","TCP","1394","443  >  2065 [ACK] Seq=934691 Ack=1003 Win=269056 Len=1240 [TCP PDU reassembled in 9132]"
"9087","39.260165","142.250.190.42","192.168.2.103","TCP","1394","443  >  2065 [PSH, ACK] Seq=935931 Ack=1003 Win=269056 Len=1240 [TCP PDU reassembled in 9132]"
"9088","39.260167","142.250.190.42","192.168.2.103","TCP","1394","443  >  2065 [ACK] Seq=937171 Ack=1003 Win=269056 Len=1240 [TCP PDU reassembled in 9132]"
"9089","39.260175","142.250.190.42","192.168.2.103","TCP","1394","443  >  2065 [PSH, ACK] Seq=938411 Ack=1003 Win=269056 Len=1240 [TCP PDU reassembled in 9132]"
"9125","39.268036","142.250.190.42","192.168.2.103","TCP","1394","[TCP Out-Of-Order] 443  >  2065 [PSH, ACK] Seq=960731 Ack=1003 Win=269056 Len=1240"
"9126","39.268041","142.250.190.42","192.168.2.103","TCP","1394","[TCP Out-Of-Order] 443  >  2065 [ACK] Seq=961971 Ack=1003 Win=269056 Len=1240"
"9130","39.270121","142.250.190.42","192.168.2.103","TCP","1394","[TCP Out-Of-Order] 443  >  2065 [PSH, ACK] Seq=953291 Ack=1003 Win=269056 Len=1240 [TCP PDU reassembled in 9132]"
"9132","39.270128","142.250.190.42","192.168.2.103","TCP","1394","[TCP Out-Of-Order] 443  >  2065 [PSH, ACK] Seq=955771 Ack=1003 Win=269056 Len=1240"
"9166","39.276029","142.250.190.42","192.168.2.103","TCP","1394","[TCP Out-Of-Order] 443  >  2065 [ACK] Seq=979331 Ack=1003 Win=269056 Len=1240"
"9204","39.284067","142.250.190.42","192.168.2.103","TCP","1394","[TCP Out-Of-Order] 443  >  2065 [ACK] Seq=991731 Ack=1003 Win=269056 Len=1240"
"9207","39.284079","142.250.190.42","192.168.2.103","TCP","1394","443  >  2065 [PSH, ACK] Seq=995451 Ack=1003 Win=269056 Len=1240"
"9208","39.284083","142.250.190.42","192.168.2.103","TCP","1394","443  >  2065 [ACK] Seq=996691 Ack=1003 Win=269056 Len=1240"
"9209","39.284087","142.250.190.42","192.168.2.103","TCP","1394","443  >  2065 [PSH, ACK] Seq=997931 Ack=1003 Win=269056 Len=1240"
"9210","39.284091","142.250.190.42","192.168.2.103","TCP","1394","443  >  2065 [ACK] Seq=999171 Ack=1003 Win=269056 Len=1240"
"9366","39.314694","142.250.190.42","192.168.2.103","TCP","1394","443  >  2065 [ACK] Seq=1088451 Ack=1003 Win=269056 Len=1240 [TCP PDU reassembled in 9367]"
"9372","39.314718","142.250.190.42","192.168.2.103","TCP","1394","443  >  2065 [ACK] Seq=1095891 Ack=1003 Win=269056 Len=1240 [TCP PDU reassembled in 9456]"
"9404","39.324199","142.250.190.42","192.168.2.103","TCP","1394","[TCP Out-Of-Order] 443  >  2065 [PSH, ACK] Seq=1107051 Ack=1003 Win=269056 Len=1240 [TCP PDU reassembled in 9456]"
"9406","39.324207","142.250.190.42","192.168.2.103","TCP","1394","443  >  2065 [PSH, ACK] Seq=1109531 Ack=1003 Win=269056 Len=1240 [TCP PDU reassembled in 9456]"
"9407","39.324211","142.250.190.42","192.168.2.103","TCP","1394","443  >  2065 [ACK] Seq=1110771 Ack=1003 Win=269056 Len=1240 [TCP PDU reassembled in 9456]"
"9453","39.337055","142.250.190.42","192.168.2.103","TCP","1394","443  >  2065 [ACK] Seq=1128131 Ack=1003 Win=269056 Len=1240 [TCP PDU reassembled in 9456]"
"9454","39.337059","142.250.190.42","192.168.2.103","TCP","1394","443  >  2065 [PSH, ACK] Seq=1129371 Ack=1003 Win=269056 Len=1240 [TCP PDU reassembled in 9456]"
"9455","39.337064","142.250.190.42","192.168.2.103","TCP","1394","443  >  2065 [ACK] Seq=1130611 Ack=1003 Win=269056 Len=1240 [TCP PDU reassembled in 9456]"
"9467","39.338495","192.168.2.103","142.250.190.42","TCP","146","[TCP Dup ACK 9463#1] 2065  >  443 [ACK] Seq=1003 Ack=1135571 Win=131328 Len=0"
"9486","39.342548","192.168.2.103","142.250.190.42","TCP","146","[TCP Dup ACK 9463#2] 2065  >  443 [ACK] Seq=1003 Ack=1135571 Win=131328 Len=0"
"9492","39.346265","142.250.190.42","192.168.2.103","TCP","1394","[TCP Out-Of-Order] 443  >  2065 [ACK] Seq=1138051 Ack=1003 Win=269056 Len=1240"
"9493","39.346269","142.250.190.42","192.168.2.103","TCP","1394","[TCP Out-Of-Order] 443  >  2065 [PSH, ACK] Seq=1139291 Ack=1003 Win=269056 Len=1240"
"9494","39.346273","142.250.190.42","192.168.2.103","TCP","1394","[TCP Out-Of-Order] 443  >  2065 [ACK] Seq=1140531 Ack=1003 Win=269056 Len=1240"
"9495","39.346277","142.250.190.42","192.168.2.103","TCP","1394","[TCP Out-Of-Order] 443  >  2065 [PSH, ACK] Seq=1141771 Ack=1003 Win=269056 Len=1240"
"9508","39.350190","142.250.190.42","192.168.2.103","TCP","1394","443  >  2065 [ACK] Seq=1157891 Ack=1003 Win=269056 Len=1240 [TCP PDU reassembled in 9577]"
"9509","39.350194","142.250.190.42","192.168.2.103","TCP","1394","443  >  2065 [PSH, ACK] Seq=1159131 Ack=1003 Win=269056 Len=1240 [TCP PDU reassembled in 9577]"
"9517","39.352419","142.250.190.42","192.168.2.103","TCP","1394","443  >  2065 [ACK] Seq=1160371 Ack=1003 Win=269056 Len=1240 [TCP PDU reassembled in 9577]"
"9518","39.352423","142.250.190.42","192.168.2.103","TCP","1394","443  >  2065 [PSH, ACK] Seq=1161611 Ack=1003 Win=269056 Len=1240 [TCP PDU reassembled in 9577]"
"9519","39.352427","142.250.190.42","192.168.2.103","TCP","1394","443  >  2065 [ACK] Seq=1162851 Ack=1003 Win=269056 Len=1240 [TCP PDU reassembled in 9577]"
"9525","39.354206","142.250.190.42","192.168.2.103","TCP","1394","[TCP Out-Of-Order] 443  >  2065 [ACK] Seq=1143011 Ack=1003 Win=269056 Len=1240"
"9526","39.354214","142.250.190.42","192.168.2.103","TCP","1394","[TCP Out-Of-Order] 443  >  2065 [ACK] Seq=1152931 Ack=1003 Win=269056 Len=1240"
"9528","39.355862","142.250.190.42","192.168.2.103","TCP","1394","[TCP Out-Of-Order] 443  >  2065 [PSH, ACK] Seq=1154171 Ack=1003 Win=269056 Len=1240"
"9562","39.364505","142.250.190.42","192.168.2.103","TCP","1394","[TCP Out-Of-Order] 443  >  2065 [PSH, ACK] Seq=1169051 Ack=1003 Win=269056 Len=1240 [TCP PDU reassembled in 9577]"
"9568","39.366061","142.250.190.42","192.168.2.103","TCP","1394","[TCP Out-Of-Order] 443  >  2065 [ACK] Seq=1170291 Ack=1003 Win=269056 Len=1240 [TCP PDU reassembled in 9577]"
"9673","39.388988","142.250.190.42","192.168.2.103","TCP","1394","[TCP Out-Of-Order] 443  >  2065 [PSH, ACK] Seq=1236011 Ack=1003 Win=269056 Len=1240 [TCP PDU reassembled in 9710]"
"9674","39.388992","142.250.190.42","192.168.2.103","TCP","1394","[TCP Out-Of-Order] 443  >  2065 [ACK] Seq=1237251 Ack=1003 Win=269056 Len=1240 [TCP PDU reassembled in 9710]"
"9675","39.388997","142.250.190.42","192.168.2.103","TCP","1394","[TCP Out-Of-Order] 443  >  2065 [PSH, ACK] Seq=1238491 Ack=1003 Win=269056 Len=1240 [TCP PDU reassembled in 9710]"
"9740","39.406659","142.250.190.42","192.168.2.103","TCP","1394","443  >  2065 [PSH, ACK] Seq=1268251 Ack=1003 Win=269056 Len=1240 [TCP PDU reassembled in 9752]"
"9741","39.406664","142.250.190.42","192.168.2.103","TCP","1394","443  >  2065 [ACK] Seq=1269491 Ack=1003 Win=269056 Len=1240 [TCP PDU reassembled in 9752]"
"9742","39.406668","142.250.190.42","192.168.2.103","TCP","1394","443  >  2065 [PSH, ACK] Seq=1270731 Ack=1003 Win=269056 Len=1240 [TCP PDU reassembled in 9752]"
"9743","39.406671","142.250.190.42","192.168.2.103","TCP","1394","443  >  2065 [ACK] Seq=1271971 Ack=1003 Win=269056 Len=1240 [TCP PDU reassembled in 9752]"
"9821","39.427727","142.250.190.42","192.168.2.103","TCP","1394","[TCP Out-Of-Order] 443  >  2065 [ACK] Seq=1301731 Ack=1003 Win=269056 Len=1240 [TCP PDU reassembled in 9860]"
"9823","39.427736","142.250.190.42","192.168.2.103","TCP","1394","[TCP Out-Of-Order] 443  >  2065 [ACK] Seq=1304211 Ack=1003 Win=269056 Len=1240 [TCP PDU reassembled in 9860]"
"9837","39.431886","142.250.190.42","192.168.2.103","TCP","1394","443  >  2065 [PSH, ACK] Seq=1317851 Ack=1003 Win=269056 Len=1240 [TCP PDU reassembled in 9860]"
"9838","39.431890","142.250.190.42","192.168.2.103","TCP","1394","443  >  2065 [ACK] Seq=1319091 Ack=1003 Win=269056 Len=1240 [TCP PDU reassembled in 9860]"
"9839","39.431894","142.250.190.42","192.168.2.103","TCP","1394","443  >  2065 [PSH, ACK] Seq=1320331 Ack=1003 Win=269056 Len=1240 [TCP PDU reassembled in 9860]"
"9951","39.453880","192.168.2.103","142.250.190.42","TCP","146","[TCP Dup ACK 9948#1] 2065  >  443 [ACK] Seq=1003 Ack=1366211 Win=131328 Len=0"
"9957","39.456848","142.250.190.42","192.168.2.103","TCP","1394","443  >  2065 [ACK] Seq=1371171 Ack=1003 Win=269056 Len=1240"
"9984","39.466387","142.250.190.42","192.168.2.103","TCP","1394","[TCP Out-Of-Order] 443  >  2065 [PSH, ACK] Seq=1382331 Ack=1003 Win=269056 Len=1240"
"9985","39.466391","142.250.190.42","192.168.2.103","TCP","1394","[TCP Out-Of-Order] 443  >  2065 [PSH, ACK] Seq=1384811 Ack=1003 Win=269056 Len=1240"
"10020","39.474414","142.250.190.42","192.168.2.103","TCP","1394","[TCP Out-Of-Order] 443  >  2065 [PSH, ACK] Seq=1402171 Ack=1003 Win=269056 Len=1240"
"10039","39.480095","142.250.190.42","192.168.2.103","TCP","1394","443  >  2065 [ACK] Seq=1415811 Ack=1003 Win=269056 Len=1240 [TCP PDU reassembled in 10129]"
"10051","39.482903","142.250.190.42","192.168.2.103","TCP","1394","[TCP Out-Of-Order] 443  >  2065 [PSH, ACK] Seq=1419531 Ack=1003 Win=269056 Len=1240 [TCP PDU reassembled in 10129]"
"10076","39.487710","142.250.190.42","192.168.2.103","TCP","1394","443  >  2065 [ACK] Seq=1430691 Ack=1003 Win=269056 Len=1240 [TCP PDU reassembled in 10129]"
"10085","39.490792","142.250.190.42","192.168.2.103","TCP","1394","[TCP Out-Of-Order] 443  >  2065 [PSH, ACK] Seq=1431931 Ack=1003 Win=269056 Len=1240 [TCP PDU reassembled in 10129]"
"10122","39.499722","142.250.190.42","192.168.2.103","TCP","1394","443  >  2065 [PSH, ACK] Seq=1456731 Ack=1003 Win=269056 Len=1240 [TCP PDU reassembled in 10129]"
"10123","39.499724","142.250.190.42","192.168.2.103","TCP","1394","443  >  2065 [ACK] Seq=1457971 Ack=1003 Win=269056 Len=1240 [TCP PDU reassembled in 10129]"
"10124","39.499731","142.250.190.42","192.168.2.103","TCP","1394","443  >  2065 [PSH, ACK] Seq=1459211 Ack=1003 Win=269056 Len=1240 [TCP PDU reassembled in 10129]"
"10126","39.501108","142.250.190.42","192.168.2.103","TCP","1394","[TCP Out-Of-Order] 443  >  2065 [PSH, ACK] Seq=1451771 Ack=1003 Win=269056 Len=1240 [TCP PDU reassembled in 10129]"
"10127","39.501113","142.250.190.42","192.168.2.103","TCP","1394","[TCP Out-Of-Order] 443  >  2065 [ACK] Seq=1453011 Ack=1003 Win=269056 Len=1240 [TCP PDU reassembled in 10129]"
"10128","39.501117","142.250.190.42","192.168.2.103","TCP","1394","[TCP Out-Of-Order] 443  >  2065 [PSH, ACK] Seq=1454251 Ack=1003 Win=269056 Len=1240 [TCP PDU reassembled in 10129]"
"10147","39.505680","142.250.190.42","192.168.2.103","TCP","1394","443  >  2065 [PSH, ACK] Seq=1469131 Ack=1003 Win=269056 Len=1240 [TCP PDU reassembled in 17685]"
"10148","39.505684","142.250.190.42","192.168.2.103","TCP","1394","443  >  2065 [ACK] Seq=1470371 Ack=1003 Win=269056 Len=1240 [TCP PDU reassembled in 17685]"
"10392","41.974557","142.250.190.42","192.168.2.103","TCP","146","[TCP Dup ACK 10391#1] 443  >  2057 [ACK] Seq=8465 Ack=13960 Win=257280 Len=0"
"10908","47.218715","142.250.190.42","192.168.2.103","TCP","1394","[TCP Out-Of-Order] 443  >  2057 [PSH, ACK] Seq=43204 Ack=16467 Win=254976 Len=1240"
"11025","47.243942","142.250.190.42","192.168.2.103","TCP","1394","[TCP Out-Of-Order] 443  >  2057 [ACK] Seq=116364 Ack=16467 Win=254976 Len=1240"
"11026","47.243945","142.250.190.42","192.168.2.103","TCP","1394","[TCP Out-Of-Order] 443  >  2057 [ACK] Seq=117604 Ack=16467 Win=254976 Len=1240"
"11027","47.243950","142.250.190.42","192.168.2.103","TCP","1394","[TCP Out-Of-Order] 443  >  2057 [ACK] Seq=118844 Ack=16467 Win=254976 Len=1240"
"11028","47.243954","142.250.190.42","192.168.2.103","TCP","1394","[TCP Out-Of-Order] 443  >  2057 [PSH, ACK] Seq=120084 Ack=16467 Win=254976 Len=1240"
"11066","47.253737","142.250.190.42","192.168.2.103","TCP","1394","[TCP Out-Of-Order] 443  >  2057 [PSH, ACK] Seq=126284 Ack=16467 Win=254976 Len=1240"
"11067","47.253743","142.250.190.42","192.168.2.103","TCP","1394","[TCP Out-Of-Order] 443  >  2057 [ACK] Seq=127524 Ack=16467 Win=254976 Len=1240"
"11068","47.253747","142.250.190.42","192.168.2.103","TCP","1394","[TCP Out-Of-Order] 443  >  2057 [ACK] Seq=128764 Ack=16467 Win=254976 Len=1240"
"11069","47.253751","142.250.190.42","192.168.2.103","TCP","1394","[TCP Out-Of-Order] 443  >  2057 [ACK] Seq=130004 Ack=16467 Win=254976 Len=1240"
"11070","47.253755","142.250.190.42","192.168.2.103","TCP","1394","[TCP Out-Of-Order] 443  >  2057 [ACK] Seq=131244 Ack=16467 Win=254976 Len=1240"
"11071","47.253759","142.250.190.42","192.168.2.103","TCP","1394","[TCP Out-Of-Order] 443  >  2057 [ACK] Seq=136204 Ack=16467 Win=254976 Len=1240"
"11105","47.259272","142.250.190.42","192.168.2.103","TCP","1394","[TCP Out-Of-Order] 443  >  2057 [ACK] Seq=171508 Ack=16467 Win=254976 Len=1240"
"11152","47.268358","142.250.190.42","192.168.2.103","TCP","1394","[TCP Out-Of-Order] 443  >  2057 [ACK] Seq=203748 Ack=16467 Win=254976 Len=1240 [TCP PDU reassembled in 11153]"
"11153","47.268362","142.250.190.42","192.168.2.103","TCP","1394","[TCP Out-Of-Order] 443  >  2057 [ACK] Seq=204988 Ack=16467 Win=254976 Len=1240"
"11201","47.284677","142.250.190.42","192.168.2.103","TCP","1394","[TCP Out-Of-Order] 443  >  2057 [ACK] Seq=221108 Ack=16467 Win=254976 Len=1240"
"11202","47.284682","142.250.190.42","192.168.2.103","TCP","1394","[TCP Out-Of-Order] 443  >  2057 [ACK] Seq=222348 Ack=16467 Win=254976 Len=1240"
"11203","47.284686","142.250.190.42","192.168.2.103","TCP","1394","[TCP Out-Of-Order] 443  >  2057 [ACK] Seq=223588 Ack=16467 Win=254976 Len=1240"
"11229","47.289335","142.250.190.42","192.168.2.103","TCP","1394","[TCP Out-Of-Order] 443  >  2057 [ACK] Seq=243428 Ack=16467 Win=254976 Len=1240"
"11230","47.289338","142.250.190.42","192.168.2.103","TCP","1394","[TCP Out-Of-Order] 443  >  2057 [ACK] Seq=244668 Ack=16467 Win=254976 Len=1240"
"11231","47.289343","142.250.190.42","192.168.2.103","TCP","1394","[TCP Out-Of-Order] 443  >  2057 [ACK] Seq=245908 Ack=16467 Win=254976 Len=1240"
"11232","47.289346","142.250.190.42","192.168.2.103","TCP","1394","[TCP Out-Of-Order] 443  >  2057 [ACK] Seq=247148 Ack=16467 Win=254976 Len=1240"
"11236","47.289360","142.250.190.42","192.168.2.103","TCP","1394","[TCP Out-Of-Order] 443  >  2057 [ACK] Seq=252108 Ack=16467 Win=254976 Len=1240"
"11237","47.289364","142.250.190.42","192.168.2.103","TCP","1394","[TCP Out-Of-Order] 443  >  2057 [ACK] Seq=253348 Ack=16467 Win=254976 Len=1240"
"11239","47.291166","142.250.190.42","192.168.2.103","TCP","1394","[TCP Out-Of-Order] 443  >  2057 [ACK] Seq=254588 Ack=16467 Win=254976 Len=1240"
"11259","47.293536","142.250.190.42","192.168.2.103","TCP","1394","[TCP Out-Of-Order] 443  >  2057 [ACK] Seq=248388 Ack=16467 Win=254976 Len=1240"
"11260","47.293541","142.250.190.42","192.168.2.103","TCP","1394","[TCP Out-Of-Order] 443  >  2057 [ACK] Seq=249628 Ack=16467 Win=254976 Len=1240"
"11261","47.293545","142.250.190.42","192.168.2.103","TCP","1394","[TCP Out-Of-Order] 443  >  2057 [PSH, ACK] Seq=250868 Ack=16467 Win=254976 Len=1240"
"11371","47.323797","142.250.190.42","192.168.2.103","TCP","1394","[TCP Out-Of-Order] 443  >  2057 [PSH, ACK] Seq=328988 Ack=16467 Win=254976 Len=1240"
"11372","47.323800","142.250.190.42","192.168.2.103","TCP","1394","[TCP Out-Of-Order] 443  >  2057 [ACK] Seq=330228 Ack=16467 Win=254976 Len=1240"
"11373","47.323802","142.250.190.42","192.168.2.103","TCP","1394","[TCP Out-Of-Order] 443  >  2057 [ACK] Seq=331468 Ack=16467 Win=254976 Len=1240"
