"No.","Time","Source","Destination","Protocol","Length","Info"
"616","2.023594","192.168.2.103","157.240.26.49","TLSv1.2","363","Application Data"
"617","2.023809","192.168.2.103","157.240.26.49","TLSv1.2","953","Application Data"
"618","2.023816","192.168.2.103","157.240.26.49","TLSv1.2","185","Application Data"
"621","2.024082","192.168.2.103","157.240.26.49","TCP","363","[TCP Retransmission] 1101  >  443 [PSH, ACK] Seq=1 Ack=1 Win=261 Len=209"
"622","2.024297","192.168.2.103","157.240.26.49","TCP","953","[TCP Retransmission] 1101  >  443 [PSH, ACK] Seq=210 Ack=1 Win=261 Len=799"
"623","2.024304","192.168.2.103","157.240.26.49","TCP","185","[TCP Retransmission] 1101  >  443 [PSH, ACK] Seq=1009 Ack=1 Win=261 Len=31"
"625","2.032902","157.240.26.49","192.168.2.103","TLSv1.2","181","Application Data"
"643","2.083641","192.168.2.103","157.240.26.49","TCP","146","1101  >  443 [ACK] Seq=1040 Ack=36 Win=260 Len=0"
"646","2.083895","192.168.2.103","157.240.26.49","TCP","146","[TCP Dup ACK 643#1] 1101  >  443 [ACK] Seq=1040 Ack=36 Win=260 Len=0"
"651","2.085255","192.168.2.103","157.240.26.49","TCP","146","[TCP Dup ACK 643#2] 1101  >  443 [ACK] Seq=1040 Ack=36 Win=260 Len=0"
"673","2.193544","192.168.2.103","224.0.0.251","MDNS","183","Standard query 0x0000 PTR _oculusal_sp._tcp.local, ""QM"" question"
"682","2.194433","192.168.2.103","224.0.0.251","MDNS","363","Standard query response 0x0000 PTR 12549::oldman._oculusal_sp_v2._tcp.local SRV 0 0 3469 oldman.local TXT A 192.168.2.103 AAAA fe80::18a0:cb74:d156:8d15"
"685","2.194713","192.168.2.103","224.0.0.251","MDNS","363","Standard query response 0x0000 PTR 12549::oldman._oculusal_sp_v2._tcp.local SRV 0 0 3469 oldman.local TXT A 192.168.2.103 AAAA fe80::18a0:cb74:d156:8d15"
"772","2.454133","192.168.2.103","224.0.0.251","MDNS","186","Standard query 0x0000 PTR _oculusal_sp_v2._tcp.local, ""QM"" question"
"783","2.458275","192.168.2.103","224.0.0.251","MDNS","366","Standard query response 0x0000 PTR 12549::oldman._oculusal_sp_v2._tcp.local SRV 0 0 3469 oldman.local TXT A 192.168.2.103 AAAA fe80::18a0:cb74:d156:8d15"
"807","2.640156","157.240.26.49","192.168.2.103","TLSv1.2","542","Application Data"
"809","2.640526","157.240.26.49","192.168.2.103","TLSv1.2","246","Application Data"
"811","2.641529","192.168.2.103","157.240.26.49","TCP","146","1101  >  443 [ACK] Seq=1040 Ack=532 Win=258 Len=0"
"814","2.642105","192.168.2.103","157.240.26.49","TCP","146","[TCP Dup ACK 811#1] 1101  >  443 [ACK] Seq=1040 Ack=532 Win=258 Len=0"
"1047","6.289523","192.168.2.103","157.240.26.49","TLSv1.2","201","Application Data"
"1048","6.289529","192.168.2.103","157.240.26.49","TLSv1.2","178","Application Data"
"1051","6.290241","192.168.2.103","157.240.26.49","TCP","201","[TCP Retransmission] 1873  >  443 [PSH, ACK] Seq=1 Ack=1 Win=256 Len=47"
"1052","6.290246","192.168.2.103","157.240.26.49","TCP","178","[TCP Retransmission] 1873  >  443 [PSH, ACK] Seq=48 Ack=1 Win=256 Len=24"
"1056","6.290564","192.168.2.103","157.240.26.49","TCP","146","1873  >  443 [FIN, ACK] Seq=72 Ack=1 Win=256 Len=0"
"1060","6.291237","192.168.2.103","192.168.2.1","DNS","168","Standard query 0xcfac A graph.oculus.com"
"1116","6.374412","192.168.2.1","192.168.2.103","DNS","219","Standard query response 0xcfac A graph.oculus.com CNAME oculus.c10r.facebook.com A 157.240.26.49"
"1122","6.376137","192.168.2.103","157.240.26.49","TCP","158","2030  >  443 [SYN] Seq=0 Win=64480 Len=0 MSS=1460 WS=256 SACK_PERM"
"1130","6.388063","157.240.26.49","192.168.2.103","TCP","158","443  >  2030 [SYN, ACK] Seq=0 Ack=1 Win=65535 Len=0 MSS=1392 SACK_PERM WS=256"
"1134","6.388625","192.168.2.103","157.240.26.49","TCP","146","2030  >  443 [ACK] Seq=1 Ack=1 Win=65536 Len=0"
"1140","6.389367","192.168.2.103","157.240.26.49","TLSv1.3","664","Client Hello (SNI=graph.oculus.com)"
"1143","6.390372","192.168.2.103","157.240.26.49","TCP","664","[TCP Retransmission] 2030  >  443 [PSH, ACK] Seq=1 Ack=1 Win=65536 Len=518"
"1155","6.401182","157.240.26.49","192.168.2.103","TCP","146","443  >  2030 [ACK] Seq=1 Ack=519 Win=66816 Len=0"
"1156","6.401535","157.240.26.49","192.168.2.103","TCP","146","[TCP Dup ACK 1155#1] 443  >  2030 [ACK] Seq=1 Ack=519 Win=66816 Len=0"
"1158","6.402223","157.240.26.49","192.168.2.103","TLSv1.3","358","Server Hello, Change Cipher Spec, Application Data"
"1162","6.403319","192.168.2.103","157.240.26.49","TLSv1.3","218","Change Cipher Spec, Application Data"
"1163","6.403324","192.168.2.103","157.240.26.49","TLSv1.3","240","Application Data"
"1164","6.403328","192.168.2.103","157.240.26.49","TLSv1.3","506","Application Data"
"1168","6.403897","192.168.2.103","157.240.26.49","TCP","218","[TCP Retransmission] 2030  >  443 [PSH, ACK] Seq=519 Ack=213 Win=65280 Len=64"
"1169","6.403903","192.168.2.103","157.240.26.49","TCP","240","[TCP Retransmission] 2030  >  443 [PSH, ACK] Seq=583 Ack=213 Win=65280 Len=86"
"1170","6.403907","192.168.2.103","157.240.26.49","TCP","506","[TCP Retransmission] 2030  >  443 [PSH, ACK] Seq=669 Ack=213 Win=65280 Len=352"
"1172","6.412404","157.240.26.49","192.168.2.103","TCP","146","443  >  2030 [ACK] Seq=213 Ack=1021 Win=67840 Len=0"
"1176","6.412632","192.168.2.103","192.168.2.1","DNS","176","Standard query 0x4ba8 A graph.oculus.com"
"1177","6.412637","192.168.2.103","192.168.2.1","DNS","176","Standard query 0x1067 HTTPS graph.oculus.com"
"1180","6.413710","157.240.26.49","192.168.2.103","TLSv1.3","228","[TCP Previous segment not captured] , Application Data"
"1181","6.413714","157.240.26.49","192.168.2.103","TLSv1.3","198","Application Data"
"1185","6.414349","192.168.2.103","157.240.26.49","TCP","154","[TCP ACKed unseen segment] 2030  >  443 [ACK] Seq=1021 Ack=500 Win=65024 Len=0"
"1186","6.414353","192.168.2.103","157.240.26.49","TLSv1.3","185","Application Data"
"1189","6.414797","192.168.2.103","157.240.26.49","TCP","154","2030  >  443 [ACK] Seq=1021 Ack=500 Win=65024 Len=0"
"1190","6.414801","192.168.2.103","157.240.26.49","TCP","185","[TCP Retransmission] 2030  >  443 [PSH, ACK] Seq=1021 Ack=500 Win=65024 Len=31"
"1196","6.448152","192.168.2.1","192.168.2.103","DNS","222","Standard query response 0x4ba8 A graph.oculus.com CNAME oculus.c10r.facebook.com A 157.240.26.49"
"1201","6.460694","192.168.2.103","157.240.26.49","TCP","158","2031  >  443 [SYN] Seq=0 Win=64480 Len=0 MSS=1460 WS=256 SACK_PERM"
"1205","6.481638","157.240.26.49","192.168.2.103","TCP","146","443  >  2030 [ACK] Seq=500 Ack=1052 Win=67840 Len=0"
"1211","6.490443","157.240.26.49","192.168.2.103","TCP","158","443  >  2031 [SYN, ACK] Seq=0 Ack=1 Win=65535 Len=0 MSS=1392 SACK_PERM WS=256"
"1215","6.490937","192.168.2.103","157.240.26.49","TCP","146","2031  >  443 [ACK] Seq=1 Ack=1 Win=65536 Len=0"
"1219","6.491415","192.168.2.103","157.240.26.49","TLSv1.3","923","Client Hello (SNI=graph.oculus.com)"
"1221","6.502564","157.240.26.49","192.168.2.103","TCP","146","443  >  2031 [ACK] Seq=1 Ack=778 Win=67328 Len=0"
"1223","6.503524","157.240.26.49","192.168.2.103","TLSv1.3","903","Server Hello, Change Cipher Spec, Application Data"
"1227","6.504628","192.168.2.103","157.240.26.49","TLSv1.3","218","Change Cipher Spec, Application Data"
"1228","6.504633","192.168.2.103","157.240.26.49","TLSv1.3","246","Application Data"
"1232","6.505090","192.168.2.103","157.240.26.49","TLSv1.3","544","Application Data"
"1233","6.505097","192.168.2.103","157.240.26.49","TLSv1.3","526","Application Data"
"1235","6.511508","192.168.2.1","192.168.2.103","DNS","287","Standard query response 0x1067 HTTPS graph.oculus.com CNAME oculus.c10r.facebook.com HTTPS HTTPS"
"1237","6.512920","157.240.26.49","192.168.2.103","TCP","146","443  >  2031 [ACK] Seq=758 Ack=934 Win=67328 Len=0"
"1239","6.513278","157.240.26.49","192.168.2.103","TCP","146","443  >  2031 [ACK] Seq=758 Ack=1696 Win=70400 Len=0"
"1243","6.513896","157.240.26.49","192.168.2.103","TLSv1.3","323","Application Data"
"1244","6.513996","157.240.26.49","192.168.2.103","TLSv1.3","228","Application Data"
"1245","6.514000","157.240.26.49","192.168.2.103","TLSv1.3","198","Application Data"
"1251","6.515186","192.168.2.103","157.240.26.49","TCP","154","2031  >  443 [ACK] Seq=1696 Ack=1045 Win=64512 Len=0"
"1252","6.515191","192.168.2.103","157.240.26.49","TLSv1.3","185","Application Data"
"1256","6.516383","192.168.2.103","157.240.26.49","TCP","154","2031  >  443 [ACK] Seq=1696 Ack=1045 Win=64512 Len=0"
"1257","6.516387","192.168.2.103","157.240.26.49","TCP","185","[TCP Retransmission] 2031  >  443 [PSH, ACK] Seq=1696 Ack=1045 Win=64512 Len=31"
"1263","6.517170","192.168.2.103","157.240.26.49","TCP","154","2031  >  443 [ACK] Seq=1696 Ack=1045 Win=64512 Len=0"
"1264","6.517175","192.168.2.103","157.240.26.49","TCP","185","[TCP Retransmission] 2031  >  443 [PSH, ACK] Seq=1696 Ack=1045 Win=64512 Len=31"
"1266","6.533960","157.240.26.49","192.168.2.103","TLSv1.3","697","Application Data"
"1268","6.533981","157.240.26.49","192.168.2.103","TLSv1.3","250","Application Data"
"1272","6.535023","192.168.2.103","157.240.26.49","TCP","146","2030  >  443 [ACK] Seq=1052 Ack=1155 Win=64512 Len=0"
"1276","6.538297","192.168.2.103","157.240.26.49","TCP","217","[TCP Retransmission] 1873  >  443 [FIN, PSH, ACK] Seq=1 Ack=1 Win=256 Len=71"
"1284","6.564720","157.240.26.49","192.168.2.103","TCP","146","443  >  2031 [ACK] Seq=1045 Ack=1727 Win=70400 Len=0"
"1288","6.586288","157.240.26.49","192.168.2.103","TLSv1.3","656","Application Data"
"1290","6.586318","157.240.26.49","192.168.2.103","TLSv1.3","231","Application Data"
"1298","6.588838","192.168.2.103","157.240.26.49","TCP","146","2031  >  443 [ACK] Seq=1727 Ack=1640 Win=65536 Len=0"
"1313","6.850379","192.168.2.103","157.240.26.49","TCP","217","[TCP Retransmission] 1873  >  443 [FIN, PSH, ACK] Seq=1 Ack=1 Win=256 Len=71"
"1346","7.459687","192.168.2.103","157.240.26.49","TCP","217","[TCP Retransmission] 1873  >  443 [FIN, PSH, ACK] Seq=1 Ack=1 Win=256 Len=71"
"1368","8.026905","192.168.2.103","192.168.2.1","DNS","173","Standard query 0x39c6 A static.nvidiagrid.net"
"1400","8.103577","192.168.2.1","192.168.2.103","DNS","286","Standard query response 0x39c6 A static.nvidiagrid.net CNAME static.nvidiagrid.net.edgekey.net CNAME e28142.dscg.akamaiedge.net A 23.192.220.16 A 23.192.220.4"
"1404","8.105444","192.168.2.103","23.192.220.16","TCP","158","2032  >  443 [SYN] Seq=0 Win=64240 Len=0 MSS=1460 WS=256 SACK_PERM"
"1406","8.115815","23.192.220.16","192.168.2.103","TCP","158","443  >  2032 [SYN, ACK] Seq=0 Ack=1 Win=64240 Len=0 MSS=1384 SACK_PERM WS=128"
"1410","8.116365","192.168.2.103","23.192.220.16","TCP","146","2032  >  443 [ACK] Seq=1 Ack=1 Win=66304 Len=0"
"1414","8.116863","192.168.2.103","23.192.220.16","TLSv1.3","767","Client Hello (SNI=static.nvidiagrid.net)"
"1418","8.129679","192.168.2.103","157.240.26.49","TCP","158","2033  >  443 [SYN] Seq=0 Win=64480 Len=0 MSS=1460 WS=256 SACK_PERM"
"1420","8.129937","23.192.220.16","192.168.2.103","TCP","146","443  >  2032 [ACK] Seq=1 Ack=622 Win=64128 Len=0"
"1422","8.130223","23.192.220.16","192.168.2.103","TLSv1.3","410","Server Hello, Change Cipher Spec, Application Data, Application Data"
"1426","8.131630","192.168.2.103","23.192.220.16","TLSv1.3","226","Change Cipher Spec, Application Data"
"1430","8.131892","192.168.2.103","23.192.220.16","TLSv1.3","240","Application Data"
"1431","8.132123","192.168.2.103","23.192.220.16","TLSv1.3","429","Application Data"
"1432","8.132132","192.168.2.103","23.192.220.16","TLSv1.3","218","Application Data"
"1436","8.140745","192.168.2.103","157.240.26.49","TLSv1.2","365","Client Hello (SNI=graph.oculus.com)"
"1439","8.141259","23.192.220.16","192.168.2.103","TCP","146","443  >  2032 [ACK] Seq=265 Ack=702 Win=64128 Len=0"
"1441","8.142355","23.192.220.16","192.168.2.103","TCP","154","443  >  2032 [ACK] Seq=265 Ack=788 Win=64128 Len=0"
"1442","8.142367","23.192.220.16","192.168.2.103","TLSv1.3","441","Application Data"
"1443","8.142373","23.192.220.16","192.168.2.103","TCP","154","443  >  2032 [ACK] Seq=552 Ack=1063 Win=64128 Len=0"
"1444","8.142378","23.192.220.16","192.168.2.103","TCP","154","443  >  2032 [ACK] Seq=552 Ack=1127 Win=64128 Len=0"
"1446","8.142992","23.192.220.16","192.168.2.103","TLSv1.3","207","Application Data"
"1447","8.143432","23.192.220.16","192.168.2.103","TCP","207","[TCP Retransmission] 443  >  2032 [PSH, ACK] Seq=552 Ack=1127 Win=64128 Len=61"
"1451","8.144279","192.168.2.103","23.192.220.16","TCP","154","2032  >  443 [ACK] Seq=1127 Ack=613 Win=65792 Len=0"
"1452","8.144284","192.168.2.103","23.192.220.16","TLSv1.3","185","Application Data"
"1454","8.147156","23.192.220.16","192.168.2.103","TLSv1.3","185","Application Data"
"1455","8.147168","23.192.220.16","192.168.2.103","TLSv1.3","414","Application Data"
"1456","8.147175","23.192.220.16","192.168.2.103","TCP","1394","443  >  2032 [ACK] Seq=904 Ack=1127 Win=64128 Len=1240 [TCP PDU reassembled in 1475]"
"1457","8.147183","23.192.220.16","192.168.2.103","TCP","1394","443  >  2032 [ACK] Seq=2144 Ack=1127 Win=64128 Len=1240 [TCP PDU reassembled in 1475]"
"1458","8.147186","23.192.220.16","192.168.2.103","TCP","1394","443  >  2032 [ACK] Seq=3384 Ack=1127 Win=64128 Len=1240 [TCP PDU reassembled in 1475]"
"1459","8.147190","23.192.220.16","192.168.2.103","TCP","1394","443  >  2032 [PSH, ACK] Seq=4624 Ack=1127 Win=64128 Len=1240 [TCP PDU reassembled in 1475]"
"1460","8.147194","23.192.220.16","192.168.2.103","TCP","1394","443  >  2032 [ACK] Seq=5864 Ack=1127 Win=64128 Len=1240 [TCP PDU reassembled in 1475]"
"1461","8.147198","23.192.220.16","192.168.2.103","TCP","1394","443  >  2032 [ACK] Seq=7104 Ack=1127 Win=64128 Len=1240 [TCP PDU reassembled in 1475]"
"1462","8.147201","23.192.220.16","192.168.2.103","TCP","1394","443  >  2032 [ACK] Seq=8344 Ack=1127 Win=64128 Len=1240 [TCP PDU reassembled in 1475]"
"1463","8.147205","23.192.220.16","192.168.2.103","TCP","1394","443  >  2032 [PSH, ACK] Seq=9584 Ack=1127 Win=64128 Len=1240 [TCP PDU reassembled in 1475]"
"1464","8.147208","23.192.220.16","192.168.2.103","TCP","1394","443  >  2032 [ACK] Seq=10824 Ack=1127 Win=64128 Len=1240 [TCP PDU reassembled in 1475]"
"1465","8.147211","23.192.220.16","192.168.2.103","TCP","1394","443  >  2032 [ACK] Seq=12064 Ack=1127 Win=64128 Len=1240 [TCP PDU reassembled in 1475]"
"1466","8.147215","23.192.220.16","192.168.2.103","TCP","1394","443  >  2032 [ACK] Seq=13304 Ack=1127 Win=64128 Len=1240 [TCP PDU reassembled in 1475]"
"1467","8.147218","23.192.220.16","192.168.2.103","TCP","1394","443  >  2032 [PSH, ACK] Seq=14544 Ack=1127 Win=64128 Len=1240 [TCP PDU reassembled in 1475]"
"1471","8.147792","192.168.2.103","23.192.220.16","TCP","146","2032  >  443 [ACK] Seq=1158 Ack=15784 Win=66304 Len=0"
"1473","8.154572","23.192.220.16","192.168.2.103","TCP","1386","443  >  2032 [ACK] Seq=15784 Ack=1127 Win=64128 Len=1240 [TCP PDU reassembled in 1475]"
"1475","8.155248","23.192.220.16","192.168.2.103","TLSv1.3","1394","Application Data, Application Data"
"1477","8.155262","23.192.220.16","192.168.2.103","TCP","1394","[TCP Previous segment not captured] 443  >  2032 [PSH, ACK] Seq=19504 Ack=1127 Win=64128 Len=1240 [TCP PDU reassembled in 1508]"
"1479","8.155864","23.192.220.16","192.168.2.103","TCP","1394","[TCP Out-Of-Order] 443  >  2032 [ACK] Seq=18264 Ack=1127 Win=64128 Len=1240 [TCP PDU reassembled in 1508]"
"1480","8.155876","157.240.26.49","192.168.2.103","TCP","154","443  >  2033 [ACK] Seq=1 Ack=220 Win=261 Len=0"
"1484","8.155941","192.168.2.103","23.192.220.16","TCP","146","2032  >  443 [ACK] Seq=1158 Ack=18264 Win=66304 Len=0"
"1488","8.156358","192.168.2.103","23.192.220.16","TCP","146","2032  >  443 [ACK] Seq=1158 Ack=20744 Win=66304 Len=0"
"1490","8.156964","23.192.220.16","192.168.2.103","TCP","1386","443  >  2032 [ACK] Seq=20744 Ack=1158 Win=64128 Len=1240 [TCP PDU reassembled in 1508]"
"1492","8.158049","23.192.220.16","192.168.2.103","TCP","1394","443  >  2032 [ACK] Seq=21984 Ack=1158 Win=64128 Len=1240 [TCP PDU reassembled in 1508]"
"1493","8.158054","23.192.220.16","192.168.2.103","TCP","1394","443  >  2032 [ACK] Seq=23224 Ack=1158 Win=64128 Len=1240 [TCP PDU reassembled in 1508]"
"1497","8.158686","192.168.2.103","23.192.220.16","TCP","146","2032  >  443 [ACK] Seq=1158 Ack=24464 Win=66304 Len=0"
"1501","8.162709","23.192.220.16","192.168.2.103","TCP","1394","443  >  2032 [PSH, ACK] Seq=24464 Ack=1158 Win=64128 Len=1240 [TCP PDU reassembled in 1508]"
"1502","8.162715","23.192.220.16","192.168.2.103","TCP","1394","443  >  2032 [ACK] Seq=25704 Ack=1158 Win=64128 Len=1240 [TCP PDU reassembled in 1508]"
"1503","8.162719","23.192.220.16","192.168.2.103","TCP","1394","443  >  2032 [ACK] Seq=26944 Ack=1158 Win=64128 Len=1240 [TCP PDU reassembled in 1508]"
"1504","8.162727","23.192.220.16","192.168.2.103","TCP","1394","443  >  2032 [ACK] Seq=28184 Ack=1158 Win=64128 Len=1240 [TCP PDU reassembled in 1508]"
"1505","8.162732","23.192.220.16","192.168.2.103","TCP","1394","443  >  2032 [PSH, ACK] Seq=29424 Ack=1158 Win=64128 Len=1240 [TCP PDU reassembled in 1508]"
"1506","8.162736","23.192.220.16","192.168.2.103","TCP","1394","443  >  2032 [ACK] Seq=30664 Ack=1158 Win=64128 Len=1240 [TCP PDU reassembled in 1508]"
"1507","8.162740","23.192.220.16","192.168.2.103","TCP","1394","443  >  2032 [ACK] Seq=31904 Ack=1158 Win=64128 Len=1240 [TCP PDU reassembled in 1508]"
"1508","8.162745","23.192.220.16","192.168.2.103","TLSv1.3","1394","Application Data, Application Data"
"1509","8.162748","23.192.220.16","192.168.2.103","TCP","1394","443  >  2032 [PSH, ACK] Seq=34384 Ack=1158 Win=64128 Len=1240 [TCP PDU reassembled in 1524]"
"1513","8.163350","192.168.2.103","23.192.220.16","TCP","146","2032  >  443 [ACK] Seq=1158 Ack=26944 Win=66304 Len=0"
"1515","8.166285","23.192.220.16","192.168.2.103","TCP","1394","[TCP Retransmission] 443  >  2032 [ACK] Seq=26944 Ack=1158 Win=64128 Len=1240 [TCP PDU reassembled in 1508]"
"1516","8.166289","23.192.220.16","192.168.2.103","TCP","1394","[TCP Retransmission] 443  >  2032 [ACK] Seq=28184 Ack=1158 Win=64128 Len=1240 [TCP PDU reassembled in 1508]"
"1517","8.166294","23.192.220.16","192.168.2.103","TCP","1394","[TCP Retransmission] 443  >  2032 [PSH, ACK] Seq=29424 Ack=1158 Win=64128 Len=1240 [TCP PDU reassembled in 1508]"
"1518","8.166298","23.192.220.16","192.168.2.103","TCP","1394","[TCP Retransmission] 443  >  2032 [ACK] Seq=30664 Ack=1158 Win=64128 Len=1240 [TCP PDU reassembled in 1508]"
"1519","8.166302","23.192.220.16","192.168.2.103","TCP","1394","[TCP Retransmission] 443  >  2032 [ACK] Seq=31904 Ack=1158 Win=64128 Len=1240 [TCP PDU reassembled in 1508]"
"1520","8.166306","23.192.220.16","192.168.2.103","TCP","1394","[TCP Retransmission] 443  >  2032 [ACK] Seq=33144 Ack=1158 Win=64128 Len=1240"
"1521","8.166311","23.192.220.16","192.168.2.103","TCP","1394","[TCP Retransmission] 443  >  2032 [PSH, ACK] Seq=34384 Ack=1158 Win=64128 Len=1240 [TCP PDU reassembled in 1524]"
"1522","8.166314","157.240.26.49","192.168.2.103","TLSv1.2","1394","Server Hello"
"1524","8.166324","23.192.220.16","192.168.2.103","TLSv1.3","1394","Application Data, Application Data"
"1525","8.166327","23.192.220.16","192.168.2.103","TCP","1394","443  >  2032 [ACK] Seq=36864 Ack=1158 Win=64128 Len=1240 [TCP PDU reassembled in 1565]"
"1526","8.166330","23.192.220.16","192.168.2.103","TCP","1394","443  >  2032 [ACK] Seq=38104 Ack=1158 Win=64128 Len=1240 [TCP PDU reassembled in 1565]"
"1527","8.166334","23.192.220.16","192.168.2.103","TCP","1394","443  >  2032 [PSH, ACK] Seq=39344 Ack=1158 Win=64128 Len=1240 [TCP PDU reassembled in 1565]"
"1528","8.166337","157.240.26.49","192.168.2.103","TCP","1241","[TCP Previous segment not captured] 443  >  2033 [PSH, ACK] Seq=2481 Ack=220 Win=261 Len=1087 [TCP PDU reassembled in 1542], Server Key Exchange, Server Hello Done"
"1529","8.166340","23.192.220.16","192.168.2.103","TCP","1394","443  >  2032 [ACK] Seq=40584 Ack=1158 Win=64128 Len=1240 [TCP PDU reassembled in 1565]"
"1530","8.166344","23.192.220.16","192.168.2.103","TCP","1394","443  >  2032 [ACK] Seq=41824 Ack=1158 Win=64128 Len=1240 [TCP PDU reassembled in 1565]"
"1531","8.166347","23.192.220.16","192.168.2.103","TCP","1394","443  >  2032 [ACK] Seq=43064 Ack=1158 Win=64128 Len=1240 [TCP PDU reassembled in 1565]"
"1532","8.166350","23.192.220.16","192.168.2.103","TCP","1394","443  >  2032 [PSH, ACK] Seq=44304 Ack=1158 Win=64128 Len=1240 [TCP PDU reassembled in 1565]"
"1533","8.166353","23.192.220.16","192.168.2.103","TCP","1394","443  >  2032 [ACK] Seq=45544 Ack=1158 Win=64128 Len=1240 [TCP PDU reassembled in 1565]"
"1534","8.169475","23.192.220.16","192.168.2.103","TCP","1394","[TCP Retransmission] 443  >  2032 [ACK] Seq=26944 Ack=1158 Win=64128 Len=1240 [TCP PDU reassembled in 1508]"
"1535","8.169480","23.192.220.16","192.168.2.103","TCP","1394","[TCP Retransmission] 443  >  2032 [ACK] Seq=28184 Ack=1158 Win=64128 Len=1240 [TCP PDU reassembled in 1508]"
"1536","8.169485","23.192.220.16","192.168.2.103","TCP","1394","[TCP Retransmission] 443  >  2032 [PSH, ACK] Seq=29424 Ack=1158 Win=64128 Len=1240 [TCP PDU reassembled in 1508]"
"1537","8.169489","23.192.220.16","192.168.2.103","TCP","1394","[TCP Retransmission] 443  >  2032 [ACK] Seq=30664 Ack=1158 Win=64128 Len=1240 [TCP PDU reassembled in 1508]"
"1538","8.169494","23.192.220.16","192.168.2.103","TCP","1394","[TCP Retransmission] 443  >  2032 [ACK] Seq=31904 Ack=1158 Win=64128 Len=1240 [TCP PDU reassembled in 1508]"
"1539","8.169498","23.192.220.16","192.168.2.103","TCP","1394","[TCP Retransmission] 443  >  2032 [ACK] Seq=33144 Ack=1158 Win=64128 Len=1240"
"1540","8.169502","23.192.220.16","192.168.2.103","TCP","1394","[TCP Retransmission] 443  >  2032 [PSH, ACK] Seq=34384 Ack=1158 Win=64128 Len=1240 [TCP PDU reassembled in 1524]"
"1541","8.169507","157.240.26.49","192.168.2.103","TCP","1394","[TCP Retransmission] 443  >  2033 [ACK] Seq=1 Ack=220 Win=261 Len=1240"
"1542","8.169511","157.240.26.49","192.168.2.103","TCP","1394","[TCP Out-Of-Order] 443  >  2033 [PSH, ACK] Seq=1241 Ack=220 Win=261 Len=1240"
"1543","8.169515","23.192.220.16","192.168.2.103","TCP","1394","[TCP Retransmission] 443  >  2032 [ACK] Seq=35624 Ack=1158 Win=64128 Len=1240"
"1544","8.169518","23.192.220.16","192.168.2.103","TCP","1394","[TCP Retransmission] 443  >  2032 [ACK] Seq=36864 Ack=1158 Win=64128 Len=1240 [TCP PDU reassembled in 1565]"
"1545","8.169521","23.192.220.16","192.168.2.103","TCP","1394","[TCP Retransmission] 443  >  2032 [ACK] Seq=38104 Ack=1158 Win=64128 Len=1240 [TCP PDU reassembled in 1565]"
"1546","8.169524","23.192.220.16","192.168.2.103","TCP","1394","[TCP Retransmission] 443  >  2032 [PSH, ACK] Seq=39344 Ack=1158 Win=64128 Len=1240 [TCP PDU reassembled in 1565]"
"1547","8.169528","157.240.26.49","192.168.2.103","TCP","1241","[TCP Retransmission] 443  >  2033 [PSH, ACK] Seq=2481 Ack=220 Win=261 Len=1087"
"1551","8.169540","23.192.220.16","192.168.2.103","TCP","1394","[TCP Retransmission] 443  >  2032 [PSH, ACK] Seq=44304 Ack=1158 Win=64128 Len=1240 [TCP PDU reassembled in 1565]"
"1557","8.170929","192.168.2.103","23.192.220.16","TCP","154","2032  >  443 [ACK] Seq=1158 Ack=40584 Win=66304 Len=0"
"1558","8.171032","192.168.2.103","157.240.26.49","TCP","154","2033  >  443 [ACK] Seq=220 Ack=3568 Win=65536 Len=0"
"1559","8.171036","192.168.2.103","157.240.26.49","TLSv1.2","280","Client Key Exchange, Change Cipher Spec, Encrypted Handshake Message"
"1561","8.172372","23.192.220.16","192.168.2.103","TCP","1394","443  >  2032 [PSH, ACK] Seq=46784 Ack=1158 Win=64128 Len=1240 [TCP PDU reassembled in 1565]"
"1562","8.172376","23.192.220.16","192.168.2.103","TCP","1394","443  >  2032 [ACK] Seq=48024 Ack=1158 Win=64128 Len=1240 [TCP PDU reassembled in 1565]"
"1563","8.172381","23.192.220.16","192.168.2.103","TCP","1394","443  >  2032 [ACK] Seq=49264 Ack=1158 Win=64128 Len=1240 [TCP PDU reassembled in 1565]"
"1564","8.172385","23.192.220.16","192.168.2.103","TCP","1394","443  >  2032 [ACK] Seq=50504 Ack=1158 Win=64128 Len=1240 [TCP PDU reassembled in 1565]"
"1565","8.172389","23.192.220.16","192.168.2.103","TLSv1.3","1394","Application Data, Application Data"
"1566","8.172394","23.192.220.16","192.168.2.103","TCP","1394","443  >  2032 [ACK] Seq=52984 Ack=1158 Win=64128 Len=1240 [TCP PDU reassembled in 1607]"
"1567","8.172398","23.192.220.16","192.168.2.103","TCP","1394","443  >  2032 [PSH, ACK] Seq=54224 Ack=1158 Win=64128 Len=1240 [TCP PDU reassembled in 1607]"
"1569","8.175000","23.192.220.16","192.168.2.103","TCP","1394","[TCP Retransmission] 443  >  2032 [ACK] Seq=49264 Ack=1158 Win=64128 Len=1240 [TCP PDU reassembled in 1565]"
"1570","8.175003","23.192.220.16","192.168.2.103","TCP","1394","[TCP Retransmission] 443  >  2032 [ACK] Seq=50504 Ack=1158 Win=64128 Len=1240 [TCP PDU reassembled in 1565]"
"1571","8.175007","23.192.220.16","192.168.2.103","TCP","1394","[TCP Retransmission] 443  >  2032 [PSH, ACK] Seq=51744 Ack=1158 Win=64128 Len=1240"
"1572","8.175011","23.192.220.16","192.168.2.103","TCP","1394","[TCP Retransmission] 443  >  2032 [ACK] Seq=52984 Ack=1158 Win=64128 Len=1240 [TCP PDU reassembled in 1607]"
"1573","8.175014","23.192.220.16","192.168.2.103","TCP","1394","[TCP Retransmission] 443  >  2032 [PSH, ACK] Seq=54224 Ack=1158 Win=64128 Len=1240 [TCP PDU reassembled in 1607]"
"1574","8.175017","23.192.220.16","192.168.2.103","TCP","1394","[TCP Retransmission] 443  >  2032 [ACK] Seq=40584 Ack=1158 Win=64128 Len=1240 [TCP PDU reassembled in 1565]"
"1575","8.175020","23.192.220.16","192.168.2.103","TCP","1394","[TCP Retransmission] 443  >  2032 [ACK] Seq=41824 Ack=1158 Win=64128 Len=1240 [TCP PDU reassembled in 1565]"
"1576","8.175023","23.192.220.16","192.168.2.103","TCP","1394","[TCP Retransmission] 443  >  2032 [ACK] Seq=43064 Ack=1158 Win=64128 Len=1240 [TCP PDU reassembled in 1565]"
"1577","8.175027","23.192.220.16","192.168.2.103","TCP","1394","[TCP Retransmission] 443  >  2032 [PSH, ACK] Seq=44304 Ack=1158 Win=64128 Len=1240 [TCP PDU reassembled in 1565]"
"1578","8.175030","23.192.220.16","192.168.2.103","TCP","1394","[TCP Retransmission] 443  >  2032 [ACK] Seq=45544 Ack=1158 Win=64128 Len=1240 [TCP PDU reassembled in 1565]"
"1579","8.175033","23.192.220.16","192.168.2.103","TCP","1394","443  >  2032 [ACK] Seq=55464 Ack=1158 Win=64128 Len=1240 [TCP PDU reassembled in 1607]"
"1580","8.175036","23.192.220.16","192.168.2.103","TCP","1394","443  >  2032 [ACK] Seq=56704 Ack=1158 Win=64128 Len=1240 [TCP PDU reassembled in 1607]"
"1581","8.175039","23.192.220.16","192.168.2.103","TCP","1394","443  >  2032 [ACK] Seq=57944 Ack=1158 Win=64128 Len=1240 [TCP PDU reassembled in 1607]"
"1584","8.176458","23.192.220.16","192.168.2.103","TCP","1394","[TCP Previous segment not captured] 443  >  2032 [ACK] Seq=60424 Ack=1158 Win=64128 Len=1240 [TCP PDU reassembled in 1607]"
"1591","8.176890","192.168.2.103","23.192.220.16","TCP","146","2032  >  443 [ACK] Seq=1158 Ack=59184 Win=66304 Len=0"
"1594","8.177282","192.168.2.103","23.192.220.16","TCP","146","[TCP Dup ACK 1591#1] 2032  >  443 [ACK] Seq=1158 Ack=59184 Win=66304 Len=0"
"1596","8.179424","23.192.220.16","192.168.2.103","TCP","1394","[TCP Retransmission] 443  >  2032 [ACK] Seq=60424 Ack=1158 Win=64128 Len=1240 [TCP PDU reassembled in 1607]"
"1597","8.179427","23.192.220.16","192.168.2.103","TCP","1394","443  >  2032 [ACK] Seq=61664 Ack=1158 Win=64128 Len=1240 [TCP PDU reassembled in 1607]"
"1598","8.179430","23.192.220.16","192.168.2.103","TCP","1394","443  >  2032 [ACK] Seq=62904 Ack=1158 Win=64128 Len=1240 [TCP PDU reassembled in 1607]"
"1599","8.179433","23.192.220.16","192.168.2.103","TCP","1394","443  >  2032 [PSH, ACK] Seq=64144 Ack=1158 Win=64128 Len=1240 [TCP PDU reassembled in 1607]"
"1600","8.179436","23.192.220.16","192.168.2.103","TCP","1394","443  >  2032 [ACK] Seq=65384 Ack=1158 Win=64128 Len=1240 [TCP PDU reassembled in 1607]"
"1601","8.179439","23.192.220.16","192.168.2.103","TCP","1394","443  >  2032 [ACK] Seq=66624 Ack=1158 Win=64128 Len=1240 [TCP PDU reassembled in 1607]"
"1602","8.179442","23.192.220.16","192.168.2.103","TCP","1394","443  >  2032 [ACK] Seq=67864 Ack=1158 Win=64128 Len=1240 [TCP PDU reassembled in 1607], Application Data"
"1603","8.179445","23.192.220.16","192.168.2.103","TCP","1394","443  >  2032 [PSH, ACK] Seq=69104 Ack=1158 Win=64128 Len=1240 [TCP PDU reassembled in 1604]"
"1604","8.179449","23.192.220.16","192.168.2.103","TLSv1.3","600","Application Data"
"1606","8.180229","23.192.220.16","192.168.2.103","TCP","600","[TCP Retransmission] 443  >  2032 [PSH, ACK] Seq=70344 Ack=1158 Win=64128 Len=446 [TCP PDU reassembled in 1604]"
"1607","8.180233","23.192.220.16","192.168.2.103","TCP","1394","[TCP Out-Of-Order] 443  >  2032 [PSH, ACK] Seq=59184 Ack=1158 Win=64128 Len=1240"
"1608","8.180236","157.240.26.49","192.168.2.103","TLSv1.2","205","Change Cipher Spec, Encrypted Handshake Message"
"1609","8.180832","23.192.220.16","192.168.2.103","TCP","600","[TCP Retransmission] 443  >  2032 [PSH, ACK] Seq=70344 Ack=1158 Win=64128 Len=446 [TCP PDU reassembled in 1604]"
"1610","8.180835","23.192.220.16","192.168.2.103","TCP","1394","[TCP Retransmission] 443  >  2032 [PSH, ACK] Seq=59184 Ack=1158 Win=64128 Len=1240 [TCP PDU reassembled in 1607]"
"1611","8.180838","157.240.26.49","192.168.2.103","TCP","205","[TCP Retransmission] 443  >  2033 [PSH, ACK] Seq=3568 Ack=346 Win=261 Len=51"
"1613","8.181168","157.240.26.49","192.168.2.103","TLSv1.2","227","Application Data"
"1617","8.181540","192.168.2.103","23.192.220.16","TCP","146","2032  >  443 [ACK] Seq=1158 Ack=70790 Win=132864 Len=0"
"1621","8.182908","192.168.2.103","157.240.26.49","TLSv1.2","207","Application Data"
"1622","8.182914","192.168.2.103","157.240.26.49","TLSv1.2","210","Application Data"
"1623","8.182917","192.168.2.103","157.240.26.49","TLSv1.2","196","Application Data"
"1624","8.182921","192.168.2.103","157.240.26.49","TLSv1.2","197","Application Data"
"1625","8.182925","192.168.2.103","157.240.26.49","TCP","1394","2033  >  443 [ACK] Seq=540 Ack=3700 Win=65536 Len=1240 [TCP PDU reassembled in 1630]"
"1626","8.182929","192.168.2.103","157.240.26.49","TCP","1394","2033  >  443 [ACK] Seq=1780 Ack=3700 Win=65536 Len=1240 [TCP PDU reassembled in 1630]"
"1627","8.182932","192.168.2.103","157.240.26.49","TCP","1394","2033  >  443 [ACK] Seq=3020 Ack=3700 Win=65536 Len=1240 [TCP PDU reassembled in 1630]"
"1628","8.182936","192.168.2.103","157.240.26.49","TCP","1394","2033  >  443 [ACK] Seq=4260 Ack=3700 Win=65536 Len=1240 [TCP PDU reassembled in 1630]"
"1629","8.182939","192.168.2.103","157.240.26.49","TCP","1394","2033  >  443 [ACK] Seq=5500 Ack=3700 Win=65536 Len=1240 [TCP PDU reassembled in 1630]"
"1630","8.182942","192.168.2.103","157.240.26.49","TLSv1.2","1221","Application Data"
"1634","8.183249","192.168.2.103","157.240.26.49","TLSv1.2","184","Application Data"
"1637","8.192791","157.240.26.49","192.168.2.103","TCP","146","443  >  2033 [ACK] Seq=3700 Ack=1780 Win=270 Len=0"
"1639","8.193537","157.240.26.49","192.168.2.103","TCP","154","443  >  2033 [ACK] Seq=3700 Ack=4260 Win=290 Len=0"
"1640","8.193541","157.240.26.49","192.168.2.103","TCP","154","443  >  2033 [ACK] Seq=3700 Ack=6740 Win=309 Len=0"
"1641","8.193545","157.240.26.49","192.168.2.103","TLSv1.2","192","Application Data"
"1642","8.193548","157.240.26.49","192.168.2.103","TLSv1.2","196","Application Data"
"1646","8.204132","192.168.2.103","157.240.26.49","TCP","146","2033  >  443 [ACK] Seq=7845 Ack=3780 Win=65280 Len=0"
"1648","8.238712","157.240.26.49","192.168.2.103","TCP","1386","443  >  2033 [ACK] Seq=3780 Ack=7845 Win=319 Len=1240 [TCP PDU reassembled in 1651]"
"1650","8.239305","157.240.26.49","192.168.2.103","TCP","1394","443  >  2033 [PSH, ACK] Seq=5020 Ack=7845 Win=319 Len=1240 [TCP PDU reassembled in 1651]"
"1651","8.239313","157.240.26.49","192.168.2.103","TLSv1.2","592","Application Data"
"1652","8.239316","157.240.26.49","192.168.2.103","TLSv1.2","338","Application Data"
"1656","8.239823","192.168.2.103","157.240.26.49","TCP","146","2033  >  443 [ACK] Seq=7845 Ack=6882 Win=65536 Len=0"
"1660","8.240084","192.168.2.103","157.240.26.49","TLSv1.2","196","Application Data"
"1661","8.241218","192.168.2.103","157.240.26.49","TCP","1394","2033  >  443 [ACK] Seq=7887 Ack=6882 Win=65536 Len=1240 [TCP PDU reassembled in 1666]"
"1662","8.241224","192.168.2.103","157.240.26.49","TCP","1394","2033  >  443 [ACK] Seq=9127 Ack=6882 Win=65536 Len=1240 [TCP PDU reassembled in 1666]"
"1663","8.241227","192.168.2.103","157.240.26.49","TCP","1394","2033  >  443 [ACK] Seq=10367 Ack=6882 Win=65536 Len=1240 [TCP PDU reassembled in 1666]"
"1664","8.241230","192.168.2.103","157.240.26.49","TCP","1394","2033  >  443 [ACK] Seq=11607 Ack=6882 Win=65536 Len=1240 [TCP PDU reassembled in 1666]"
"1665","8.241233","192.168.2.103","157.240.26.49","TCP","1394","2033  >  443 [ACK] Seq=12847 Ack=6882 Win=65536 Len=1240 [TCP PDU reassembled in 1666]"
"1666","8.241236","192.168.2.103","157.240.26.49","TLSv1.2","1196","Application Data"
"1670","8.241683","192.168.2.103","157.240.26.49","TCP","1188","[TCP Retransmission] 2033  >  443 [PSH, ACK] Seq=14087 Ack=6882 Win=65536 Len=1042 [TCP PDU reassembled in 1666]"
"1672","8.250436","157.240.26.49","192.168.2.103","TCP","146","443  >  2033 [ACK] Seq=6882 Ack=9127 Win=328 Len=0"
"1674","8.250558","157.240.26.49","192.168.2.103","TCP","154","443  >  2033 [ACK] Seq=6882 Ack=11607 Win=348 Len=0"
"1675","8.250562","157.240.26.49","192.168.2.103","TCP","154","443  >  2033 [ACK] Seq=6882 Ack=14087 Win=367 Len=0"
"1676","8.250566","157.240.26.49","192.168.2.103","TLSv1.2","196","Application Data"
"1679","8.291362","157.240.26.49","192.168.2.103","TCP","1386","443  >  2033 [ACK] Seq=6924 Ack=15129 Win=377 Len=1240 [TCP PDU reassembled in 1694]"
"1682","8.294794","157.240.26.49","192.168.2.103","TCP","1386","443  >  2033 [PSH, ACK] Seq=8164 Ack=15129 Win=377 Len=1240 [TCP PDU reassembled in 1694]"
"1687","8.295084","192.168.2.103","157.240.26.49","TCP","146","2033  >  443 [ACK] Seq=15129 Ack=8164 Win=65536 Len=0"
"1689","8.295733","157.240.26.49","192.168.2.103","TCP","1386","[TCP Retransmission] 443  >  2033 [PSH, ACK] Seq=8164 Ack=15129 Win=377 Len=1240 [TCP PDU reassembled in 1694]"
"1692","8.296185","157.240.26.49","192.168.2.103","TCP","1386","[TCP Retransmission] 443  >  2033 [PSH, ACK] Seq=8164 Ack=15129 Win=377 Len=1240 [TCP PDU reassembled in 1694]"
"1694","8.296434","157.240.26.49","192.168.2.103","TLSv1.2","325","Application Data"
"1695","8.296443","157.240.26.49","192.168.2.103","TLSv1.2","338","Application Data"
"1699","8.297134","192.168.2.103","157.240.26.49","TCP","154","2033  >  443 [ACK] Seq=15129 Ack=9759 Win=65536 Len=0"
"1700","8.297346","192.168.2.103","157.240.26.49","TLSv1.2","196","Application Data"
"1707","8.299158","192.168.2.103","157.240.26.49","TCP","1394","2033  >  443 [ACK] Seq=15171 Ack=9759 Win=65536 Len=1240 [TCP PDU reassembled in 1712]"
"1708","8.299162","192.168.2.103","157.240.26.49","TCP","1394","2033  >  443 [ACK] Seq=16411 Ack=9759 Win=65536 Len=1240 [TCP PDU reassembled in 1712]"
"1709","8.299166","192.168.2.103","157.240.26.49","TCP","1394","2033  >  443 [ACK] Seq=17651 Ack=9759 Win=65536 Len=1240 [TCP PDU reassembled in 1712]"
"1710","8.299169","192.168.2.103","157.240.26.49","TCP","1394","2033  >  443 [ACK] Seq=18891 Ack=9759 Win=65536 Len=1240 [TCP PDU reassembled in 1712]"
"1711","8.299172","192.168.2.103","157.240.26.49","TCP","1394","2033  >  443 [ACK] Seq=20131 Ack=9759 Win=65536 Len=1240 [TCP PDU reassembled in 1712]"
"1712","8.299176","192.168.2.103","157.240.26.49","TLSv1.2","1193","Application Data"
"1717","8.301141","192.168.2.103","157.240.26.49","TCP","1386","[TCP Retransmission] 2033  >  443 [ACK] Seq=20131 Ack=9759 Win=65536 Len=1240 [TCP PDU reassembled in 1712]"
"1722","8.302399","192.168.2.103","157.240.26.49","TCP","1386","[TCP Retransmission] 2033  >  443 [ACK] Seq=20131 Ack=9759 Win=65536 Len=1240 [TCP PDU reassembled in 1712]"
"1724","8.307340","157.240.26.49","192.168.2.103","TCP","146","443  >  2033 [ACK] Seq=9759 Ack=16411 Win=387 Len=0"
"1726","8.308121","157.240.26.49","192.168.2.103","TCP","146","443  >  2033 [ACK] Seq=9759 Ack=18891 Win=406 Len=0"
"1728","8.311504","157.240.26.49","192.168.2.103","TCP","146","443  >  2033 [ACK] Seq=9759 Ack=21371 Win=425 Len=0"
"1730","8.311804","157.240.26.49","192.168.2.103","TLSv1.2","188","Application Data"
"1747","8.350811","157.240.26.49","192.168.2.103","TCP","1386","443  >  2033 [ACK] Seq=9801 Ack=22410 Win=435 Len=1240 [TCP PDU reassembled in 1755]"
"1749","8.351359","157.240.26.49","192.168.2.103","TCP","1386","443  >  2033 [PSH, ACK] Seq=11041 Ack=22410 Win=435 Len=1240 [TCP PDU reassembled in 1755]"
"1753","8.351396","192.168.2.103","157.240.26.49","TCP","146","2033  >  443 [ACK] Seq=22410 Ack=11041 Win=65536 Len=0"
"1755","8.351847","157.240.26.49","192.168.2.103","TLSv1.2","573","Application Data"
"1756","8.351855","157.240.26.49","192.168.2.103","TLSv1.2","338","Application Data"
"1757","8.352293","157.240.26.49","192.168.2.103","TCP","573","[TCP Retransmission] 443  >  2033 [ACK] Seq=12281 Ack=22410 Win=435 Len=419 [TCP PDU reassembled in 1755]"
"1758","8.352300","157.240.26.49","192.168.2.103","TCP","338","[TCP Retransmission] 443  >  2033 [PSH, ACK] Seq=12700 Ack=22410 Win=435 Len=184"
"1762","8.353050","192.168.2.103","157.240.26.49","TCP","154","2033  >  443 [ACK] Seq=22410 Ack=12884 Win=65536 Len=0"
"1763","8.353054","192.168.2.103","157.240.26.49","TLSv1.2","196","Application Data"
"1767","8.354422","192.168.2.103","157.240.26.49","TCP","1394","2033  >  443 [ACK] Seq=22452 Ack=12884 Win=65536 Len=1240 [TCP PDU reassembled in 1772]"
"1768","8.354430","192.168.2.103","157.240.26.49","TCP","1394","2033  >  443 [ACK] Seq=23692 Ack=12884 Win=65536 Len=1240 [TCP PDU reassembled in 1772]"
"1769","8.354435","192.168.2.103","157.240.26.49","TCP","1394","2033  >  443 [ACK] Seq=24932 Ack=12884 Win=65536 Len=1240 [TCP PDU reassembled in 1772]"
"1770","8.354439","192.168.2.103","157.240.26.49","TCP","1394","2033  >  443 [ACK] Seq=26172 Ack=12884 Win=65536 Len=1240 [TCP PDU reassembled in 1772]"
"1771","8.354444","192.168.2.103","157.240.26.49","TCP","1394","2033  >  443 [ACK] Seq=27412 Ack=12884 Win=65536 Len=1240 [TCP PDU reassembled in 1772]"
"1772","8.354448","192.168.2.103","157.240.26.49","TLSv1.2","1193","Application Data"
"1782","8.362472","157.240.26.49","192.168.2.103","TCP","146","443  >  2033 [ACK] Seq=12884 Ack=23692 Win=445 Len=0"
"1784","8.362847","157.240.26.49","192.168.2.103","TCP","146","443  >  2033 [ACK] Seq=12884 Ack=26172 Win=464 Len=0"
"1786","8.363327","157.240.26.49","192.168.2.103","TCP","154","443  >  2033 [ACK] Seq=12884 Ack=28652 Win=483 Len=0"
"1787","8.363331","157.240.26.49","192.168.2.103","TLSv1.2","196","Application Data"
"1796","8.404036","157.240.26.49","192.168.2.103","TCP","1386","443  >  2033 [ACK] Seq=12926 Ack=29691 Win=493 Len=1240 [TCP PDU reassembled in 1799]"
"1798","8.404553","157.240.26.49","192.168.2.103","TCP","1394","443  >  2033 [PSH, ACK] Seq=14166 Ack=29691 Win=493 Len=1240 [TCP PDU reassembled in 1799]"
"1799","8.404559","157.240.26.49","192.168.2.103","TLSv1.2","316","Application Data"
"1800","8.404561","157.240.26.49","192.168.2.103","TLSv1.2","338","Application Data"
"1804","8.404819","192.168.2.103","157.240.26.49","TCP","146","2033  >  443 [ACK] Seq=29691 Ack=15406 Win=65536 Len=0"
"1808","8.415013","157.240.26.49","192.168.2.103","TCP","146","[TCP ACKed unseen segment] 443  >  2033 [ACK] Seq=15752 Ack=30973 Win=503 Len=0"
"1810","8.415515","157.240.26.49","192.168.2.103","TCP","154","[TCP ACKed unseen segment] 443  >  2033 [ACK] Seq=15752 Ack=33453 Win=522 Len=0"
"1811","8.415522","157.240.26.49","192.168.2.103","TCP","154","[TCP ACKed unseen segment] 443  >  2033 [ACK] Seq=15752 Ack=35933 Win=542 Len=0"
"1813","8.415855","157.240.26.49","192.168.2.103","TLSv1.2","188","[TCP ACKed unseen segment] , Application Data"
"1817","8.453515","157.240.26.49","192.168.2.103","TCP","1386","443  >  2033 [ACK] Seq=15794 Ack=36972 Win=551 Len=1240 [TCP PDU reassembled in 1821]"
